ID,category,sub_category,content,collaborative_rec,content_rec,mean,two_one
N19347,news,newspolitics,"Former US Senator Kay Hagan dead at 66 Former U.S. Sen. Kay Hagan, a one-time Capitol Hill intern who went on to become North Carolina's first Democratic female senator, died Monday at her Greensboro home. She was 66.",0.2039754358945827,0.2830647822724771,0.2435201090835299,0.25670166681317896
N55189,tv,tvnews,"'Wheel Of Fortune' Guest Delivers Hilarious, Off The Rails Introduction We'd like to solve the puzzle, Pat: Blair Davis' loveless marriage? On Monday, ""Wheel of Fortune"" welcomed as a new contestant trucking business owner Blair Davis, who offered a biting introduction for himself. When host Pat Sajak asked the man from Cardiff, California, about his family, Davis plunged into one of the darkest personal summaries the show has likely ever heard. ""I've been trapped in a loveless marriage for the last 12 years to an...",0.2277760440918421,0.2365204262361488,0.23214823516399546,0.23360563218804659
N42782,sports,baseball_mlb,Three takeaways from Yankees' ALCS Game 5 victory over the Astros The Yankees kept hope alive thanks to some impressive starting pitching and a pair of early home runs.,0.2305389156879171,0.3137480469909017,0.2721434813394094,0.28601166988990684
N18445,sports,football_ncaa,"Michigan sends breakup tweet to Notre Dame as series goes on hold Parting is such sweet sorrow, say the Wolverines.",0.2378028664868135,0.2675362389117955,0.2526695526993045,0.25762511477013483
N10414,movies,movienews,"Robert Evans, 'Chinatown' Producer and Paramount Chief, Dies at 89 Robert Evans, the Paramount executive who produced ""Chinatown"" and ""Urban Cowboy"" and whose life became as melodramatic and jaw-dropping as any of his films, died on Saturday night. He was 89. Even though Hollywood history is filled with colorful characters, few can match the tale of Evans, whose life would seem far-fetched if it were",0.2403477780163874,0.2934411398302355,0.26689445892331143,0.27574335255895277
N31801,news,newspolitics,Joe Biden reportedly denied Communion at a South Carolina church because of his stance on abortion Joe Biden has a complicated history with the Catholic Church.,0.2449715753720113,0.2664062525817505,0.25568891397688087,0.2592613601785041
N63302,lifestyle,lifestylebuzz,"This Wedding Photo of a Canine Best Man Captures Just How Deep a Dog's Love Truly Is When Mark Doublet made his dog, Marley, the best man at his wedding, he took his duties very seriously, and a photo of them together has gone viral.",0.2492616991288517,0.2903518549805521,0.2698067770547019,0.2766551363633186
N45794,news,newscrime,"Four flight attendants were arrested in Miami's airport after bringing in thousands in cash, police say Four American Airlines flight attendants were arrested at the Miami International Airport and charged with money laundering after bringing large amounts of cash into the country, police said.",0.2676412415385452,0.310345475188287,0.2889933583634161,0.29611073063837307
N53526,health,voices,"I Was An NBA Wife. Here's How It Affected My Mental Health. I felt like I was a fraud, and being an NBA wife didn't help that. In fact, it nearly destroyed me.",0.2699960020143165,0.2796808923704319,0.2748384471923742,0.27645259558506013
N49749,sports,football_nfl,"'Unbelievable.' Chiefs fans stunned, mad after loss to the Titans What the heck happened? The Chiefs were lining up for a field goal that would have given them and eight-point lead late in Sunday's game against the Tennessee Titans in Nashville. The snap came before holder Dustin Colquitt was ready and he threw the ball away. Colquitt was called for intentional grounding and the Titans took over. They drove down the field for a touchdown, two-point ...",0.2941700250474633,0.3161472518062979,0.3051586384268806,0.308821509553353
N55199,news,newsus,Winter homeless shelter remains unopened after protests ,1.0,0.2496517262663685,0.6248258631331842,0.4997678175109123
N6940,finance,finance-career-education,"Kaiser Permanente CEO And Affordable Health Care Advocate Bernard J. Tyson Dies Health care provider Kaiser Permanente said Sunday its chairman and CEO, Bernard J. Tyson, has died unexpectedly at the age of 60.",1.0,0.2884748450839317,0.6442374225419658,0.5256498967226211
N18340,sports,basketball_nba,"Raptors end Lakers' 7-game winning streak in 113-104 victory LOS ANGELES (AP)   The centerpiece of the Toronto Raptors' championship team works at Staples Center now. Two more key components of last season's sublime roster got injured right before the Raptors arrived in Los Angeles for the reunion. In the opening weeks of life after Kawhi, the defending champs are learning they might be deeper than even they realized. They definitely had enough to hold off Staples' marquee tenants in a remarkable...",1.0,0.3162404492329222,0.6581202246164611,0.5441602994886148
N40147,sports,football_nfl,"Well, they'll take it: Shining light on the highs and lows from the Bears' win over the Lions on the Bear Download podcast Welcome to the Bear Download podcast. Listen below or subscribe and listen on iTunes | Spotify | Stitcher | Google Play Bears win! Well, yes, they did end their four-game losing streak with a 20-13 victory over the shorthanded Lions. But Rich and Dan break it all down and let some air out of the balloon -- not that much was in there to start. On the bright side, quarterback Mitch Trubisky ...",1.0,0.2994741679704789,0.6497370839852394,0.5329827786469858
N41222,news,newsworld,"Evo Morales of Bolivia Accepts Asylum in Mexico Evo Morales, the former president of Bolivia who resigned under pressure from street protests and the military, was granted asylum in Mexico on Monday, departing from the country at a time when it is deeply polarized and leaderless.",1.0,0.2797596612587508,0.6398798306293754,0.5198397741725005
N25142,entertainment,awards,"Robert Downey Jr. reassures fans he didn't die at 2019 E! PCAs Tony Stark has risen from the dead! The ""Iron Man"" star takes the stage to kick off the E! People's Choice Awards with a bang! Watch.",1.0,0.2474133875598368,0.6237066937799184,0.4982755917065579
N55528,lifestyle,lifestyleroyals,"The Brands Queen Elizabeth, Prince Charles, and Prince Philip Swear By Shop the notebooks, jackets, and more that the royals can't live without.",1.0,0.264177134796794,0.632088567398397,0.5094514231978626
N61572,sports,football_nfl,"Believe in 'Minkah Magic' as Fitzpatrick sparks Steelers' turnaround Discarded by the Dolphins after a little more than a season, Minkah Fitzpatrick is making a considerable difference for a surging Steelers team.",1.0,0.3082271742989292,0.6541135871494645,0.5388181161992861
N218,video,news,Bolivia protesters celebrate Morales' resignation Bolivian opposition protesters celebrated joyously in the streets of La Paz on Sunday evening after Bolivian President Evo Morales said he would resign following weeks of protests over a disputed election that has roiled the South American nation.,1.0,0.2859639837360045,0.6429819918680022,0.5239759891573363
N9739,sports,football_nfl_videos,Vikings edge Cowboys on 'SNF' Watch the Minnesota Vikings vs. Dallas Cowboys highlights from Week 10 of the 2019 season.,1.0,0.3023053425321594,0.6511526712660797,0.5348702283547729
N39983,news,newscrime,"NYPD Defends Officers In Arrest Of Illegal Food Vendor Despite criticism from some city officials, the NYPD says its officers acted properly in arresting a woman who was illegally selling churros inside a Brooklyn subway station. CBS2's Lisa Rozner reports",1.0,0.2667131575651976,0.6333565787825988,0.511142105043465
N43567,news,newspolitics,"High-stakes televised impeachment hearings set for next week William Taylor, the top diplomat in Ukraine, will testify, and Republicans hope to hear from Hunter Biden and the anonymous whistleblower.",1.0,0.2655488773106514,0.6327744386553257,0.510365918207101
N413,news,newsscienceandtechnology,"Google Maps lets you manage your public profile from the Android app Google Maps increasingly thrives on user contributions to fill in details, but you haven't had the option to manage your public profile from the phone app you're probably using to make those contributions. That's a bit backwards, but Google is thankfully setting things right. An updated version of the Android app lets you manage your profile from a new ""your profile"" item in the side menu.",1.0,0.3187014547030501,0.6593507273515251,0.5458009698020334
N208,sports,football_nfl,Five winners and five losers as the Dallas Cowboys drop a heartbreaker to the Minnesota Vikings A tough loss to swallow for the Cowboys.,1.0,0.3024205231431811,0.6512102615715906,0.5349470154287874
N27974,weather,weathertopstories,"Colder Temperatures And A Wintery Mix Expected Monday First on Fox, we begin tonight on the winter watch today`s fall feel giving way to winter in a hurry, and that means getting prepared for the quick change in seasons, and that means some snow. Fox 2/News 11`s Blair Ledet begins our coverage.",1.0,0.2832163982570205,0.6416081991285103,0.5221442655046803
N6379,news,newscrime,"California cops respond to 2 homeless men shot with arrows: report Two homeless men living at an encampment near San Francisco were shot with arrows early Sunday in an attack that was not random, a report said.",1.0,0.2940104952636145,0.6470052476318072,0.529340330175743
N5,sports,icehockey_nhl,"Even David Pastrnak's slumps are superstar caliber for Bruins Guess David Pastrnak isn't going to score 82 goals and accumulate 164 points this season. Or at least he's not on pace to do anymore. After scoring 15 goals and adding 15 assists through the Bruins' first 15 games, Pastrnak had gone two games without a point after he was blanked in Boston's 3-2 shootout loss to Philadelphia at TD Garden on Sunday. Oh the humanity! But here's where things stand in the 23-year-old sniper's career. Gone are the...",1.0,0.2766850053326649,0.6383425026663324,0.51779000355511
N20831,sports,soccer_mls,"New buzz on possibility of Major League Soccer in Charlotte Charlotte appears to be in the driver's seat for Major League Soccer's 30th franchise. MLS Commissioner Don Garber mentioned Charlotte as one of three cities in the running at Friday's State of the League press conference. ""It is very likely that we'll announce [the] team 30 in the next number of months,"" Garber said. Garber acknowledged Charlotte, Phoenix and Las Vegas as cities in the mix for expansion. ""It's fair to say that Charlotte has...",1.0,0.3038622410316626,0.6519311205158314,0.535908160687775
N5497,news,newsus,"Still teaching at 95, Jimmy Carter draws devotees to church PLAINS, Ga. (AP)   The pilgrims arrive early and from all over, gathering hours before daybreak in an old pecan grove that surrounds a country church. They come, they say, for a dose of simple decency and devotion wrapped up in a Bible lesson. The teacher is the 39th president of the United States, Jimmy Carter. Nearly four decades after he left office and despite a body that's failing after 95 years, the nation's oldest-ever ex-president still...",1.0,0.2966347841684092,0.6483173920842046,0.5310898561122728
N13019,video,lifestyle,"Still teaching at 95, Jimmy Carter draws devotees to church Former President Jimmy Carter can still draw a crowd, and he does each time he teaches Sunday school in his hometown of Plains, Georgia. (Nov. 11)",1.0,0.27752553878307,0.638762769391535,0.5183503591887133
N31581,news,newsus,"Man killed in single-car crash after having medical emergency behind the wheel A 52-year-old man was killed after he had a medical emergency behind the wheel. The Missouri State Highway Patrol said Jeffery T. Gregory was driving on Missouri Highway 79 near the intersection of East Terra Lane Sunday afternoon at around 12:45 when he had a medical emergency. The crash report said the car drove off the left side of the road, ended up on East Terra Lane and flipped before slamming into a concrete median. He was pronounced dead...",1.0,0.3201194022697377,0.6600597011348688,0.5467462681798251
N10311,news,newsworld,"Turkish army takes CNN inside Syria's safe zone A month after Turkey launched its operation into northern Syria, major combat operations around the town of Tal Abyad may have ended, but the battle for this part of Syria is far from over. CNN's Jomana Karadsheh reports.",1.0,0.2809815368759875,0.6404907684379937,0.520654357917325
N5027,news,newsscienceandtechnology,NEW DETAILS: Wright Brothers airport eyes growth as upgrades continue Dayton-Wright Brothers Airport is in the midst of what is expected be more than $4 million in investments as it broadens its regional reach.,1.0,0.3152420404752555,0.6576210202376278,0.5434946936501703
N64760,news,newsoffbeat,"Supermarket magnate John Catsimatidis offers $1,000 reward in case of possible Queens cat poisonings It might take Cats to catch a heartless feline killer. Supermarket mogul and one-time mayoral hopeful John Catsimatidis is offering a $1,000 reward for information on a suspected cat killer who animal rights activists believe is poisoning feral felines in Queens. Catsimatidis announced the reward on his Cats Roundtable radio show Sunday morning during a segment with Guardian Angels ...",1.0,0.2874528702892777,0.6437264351446388,0.5249685801928518
N43432,news,newsus,"US Forest Service shuts down vandalized Georgia park feature GAINESVILLE, Ga. (AP)   The U.S. Forest Service says vandalism is forcing it to shut down a popular fall leaf viewing destination in Georgia. The agency posted photos to Facebook on Friday showing a wooden platform covered in white spray paint overlooking the mountainous north Georgia landscape at Chattahoochee-Oconee National Forests.",1.0,0.3099835505814974,0.6549917752907487,0.5399890337209983
N17258,news,newsscienceandtechnology,Realme takes chunk of India mobile market as Samsung slides Over 400 percent more phones shipped year-on-year,1.0,0.3207498436858709,0.6603749218429354,0.5471665624572473
N23858,sports,golf,"Young Northeast Florida fans flock to U.S. women's soccer When the U.S. women's national soccer team arrived in Jacksonville for a final exhibition match to conclude their 2019 Victory Tour at TIAA Bank Field against Costa Rica Sunday night, area fans were waiting for them. Although the suspense was low, since the U.S. women's national team has put up an impressive 14-0-0 all-time record against Costa Rica, soccer fans from far and wide showed out to ...",1.0,0.2990697347387363,0.6495348673693682,0.5327131564924908
N16909,weather,weathertopstories,"Adapting, Learning And Soul Searching: Reflecting On Woolsey Fire Woolsey Fire Anniversary: A community is forever changed by the largest blaze in county history, a harbinger of the catastrophic fire era.",1.0,0.2810285680811901,0.6405142840405951,0.5206857120541267
N47585,lifestyle,lifestylefamily,Family says 13-year-old Broadway star died from massive asthma attack ,1.0,0.2641794317804091,0.6320897158902046,0.5094529545202727
N7482,sports,more_sports,"St. Dominic soccer player tries to kick cancer to the curb Sometimes, what happens on the sidelines can be even more important than what happens on the field. That was the case recently for the improving St. Dominic boys soccer team. ""We're led by some great seniors and they're learning a lot,"" said head soccer coach Greg Koeller. Since 2000, the Crusaders have won five state titles. And if that wasn't enough motivation, they have players who provide inspiration. Like No. 2, Clay North. ""Clay is just an...",1.0,0.3210654520730712,0.6605327260365356,0.5473769680487142
N3411,sports,basketball_ncaa,"Aldermen, Parents And Players Hope SLPS Will Reconsider Roosevelt Coach Termination New tonight, the Roosevelt High School football coach was fired for contacting players through social media. But theres a push to have him re-instated. Fox 2/News 11s Jeff Bernthal was live with why several St. Louis aldermen want the district to re-consider the coachs termination.",1.0,0.2639485246879103,0.6319742623439552,0.5092990164586069
N5171,news,elections-2020-us,Still a chance? 2020 longshots insist race is up for grabs Bernie Sanders rallied hundreds of supporters outside the New Hampshire capital when the senator formally filed to compete in the state's first-in-the-nation presidential primary.,1.0,0.2768471089904144,0.6384235544952073,0.5178980726602762
N241,finance,finance-companies,"Are Stores Open on Veterans Day? Target, Aldi, Walmart and More Will shoppers be able to make the most of Veterans Day deals this public holiday?",1.0,0.2949064538888164,0.6474532269444082,0.5299376359258776
N20332,news,newsworld,"Langfords, 100 members of Mormon families leave Mexico after ambush David Langford and his hero son, Devin, who helped save his siblings, are leaving Northwest Mexico, where Mormons lived for decades before drug cartels encroached.",1.0,0.3097237139375741,0.6548618569687871,0.539815809291716
N19639,health,weightloss,50 Worst Habits For Belly Fat These seemingly harmless habits are holding you back and keeping you from shedding that unwanted belly fat for good.,1.0,0.3036383786065344,0.6518191893032672,0.5357589190710229
N61837,news,newsworld,"The Cost of Trump's Aid Freeze in the Trenches of Ukraine's War Lt. Ivan Molchanets peeked over a parapet of sand bags at the front line of the war in Ukraine. Next to him was an empty helmet propped up to trick snipers, already perforated with multiple holes.",1.0,0.2848764555983849,0.6424382277991925,0.5232509703989232
N38324,health,medical,"How to Get Rid of Skin Tags, According to a Dermatologist They seem harmless, but there's a very good reason you shouldn't ignore them. The post How to Get Rid of Skin Tags, According to a Dermatologist appeared first on Reader's Digest.",1.0,0.3315518727951715,0.6657759363975857,0.554367915196781
N2073,sports,football_nfl,Should NFL be able to fine players for criticizing officiating? Several fines came down against NFL players for criticizing officiating this week. It's a very bad look for the league.,1.0,0.2883225457522813,0.6441612728761407,0.5255483638348541
N49186,weather,weathertopstories,"It's been Orlando's hottest October ever so far, but cooler temperatures on the way There won't be a chill down to your bones this Halloween in Orlando, unless you count the sweat dripping from your armpits.",1.0,0.2784809053536031,0.6392404526768015,0.5189872702357354
N59295,news,newsworld,"Chile: Three die in supermarket fire amid protests Three people have died in a supermarket fire as angry protests in Chile entered their seventh day, the mayor of capital city Santiago said on Sunday.",1.0,0.2959707458877578,0.6479853729438789,0.5306471639251719
N15962,sports,football_nfl,"Ravens Coach Harbaugh: Michael Pierce's X-Rays Negative After Ankle Injury, No Timetable On Return Coach John Harbaugh said the x-rays on his ankle came back negative, but there is no clear timetable on his return.",1.0,0.2729065849182344,0.6364532924591172,0.5152710566121562
N28814,sports,basketball_ncaa,"Christyn Williams delivers all-around performance to fuel stilted UConn offense On a day when UConn's offense often felt stilted and stagnant, the Huskies turned to one player more than any other for scoring, playmaking and a general positive presence. Sophomore Christyn Williams was efficient Sunday, converting 10 of 17 field-goal attempts. She was consistent, with at least one field goal in all four quarters and at least two rebounds in three of the four. And she was ...",1.0,0.2947909939065293,0.6473954969532647,0.5298606626043528
N47850,news,newsus,"Texas teacher free on bond after assaulting a student A Texas teacher is free on bond tonight, after her arrest for assaulting a student. Her violent outburst was captured on cell phone video. Meg Oliver reports.",1.0,0.2776124078117091,0.6388062039058545,0.5184082718744727
N52046,sports,racing,NASCAR championship standings 2019: Final 4 drivers set for Cup Series title race at Homestead Three Joe Gibbs Racing drivers will be competing with a Stewart-Haas Racing driver for a championship on Nov. 17.,1.0,0.3259643579663661,0.662982178983183,0.5506429053109108
N4219,sports,icehockey_nhl,"In USA vs. Canada hockey, the winners are women At the end, what didn't matter was the score. What mattered most was the game. Playing ice hockey hard and fast. Some of the highest level hockey in the world, played by women. Even the players in Sunday's second sold-out exhibition game between the national women's teams of the United States and Canada   the best female players in the world and the biggest rivals   had stressed a higher purpose to this past week's joint training camp that put...",1.0,0.2798270263746545,0.6399135131873273,0.5198846842497696
N31089,news,newsus,Thief steals thousands from couple during wedding reception Emma and Chris Cox's picture-perfect wedding day was tarnished when a thief swiped a gift bag filled with thousands in cash. The brazen heist was caught on surveillance cameras.,1.0,0.2845720233732567,0.6422860116866284,0.5230480155821711
N41479,sports,basketball_nba,"Scouting report: Rockets vs. Pelicans When/where: 7 p.m. Monday/Smoothie King Center TV/radio: AT&T SportsNet/790-AM; Spanish: 850 AM/101.7 FM So far: Rockets 6-3, Pelicans 2-7 Lately: The Rockets have a three-game winning streak, their longest of the season, after beating the Bulls in Chicago on Saturday. The Pelicans picked up their second win of the season Saturday in Charlotte. Scouting the Rockets In the past six games against the Pelicans, the Rockets have outscored New...",1.0,0.293862318258265,0.6469311591291325,0.52924154550551
N54299,sports,baseball_mlb,"Column: Baseball's hot stove league could use an NBA-style spark after the slow pace of the last few offseasons When discussing teams' interest in free agent Bryce Harper last year at the general managers meetings, agent Scott Boras cautioned that many suitors would be playing it cool over the winter. ""It's not a regatta,"" Boras said. ""It's a submarine race."" The submarine race finally ended more than three months later, during spring training, with Harper signing a record 13-year, $330 million deal ...",1.0,0.2609023036216773,0.6304511518108387,0.5072682024144515
N24301,sports,football_nfl,"10 biggest disappointments of NFL Week 10 From quarterback play to special teams disasters, there was plenty of disappointment to go around in Week 10 of the NFL.",1.0,0.2981678984383955,0.6490839492191978,0.5321119322922636
N15236,finance,finance-real-estate,"Only 1 World City Charges More Than NYC Per Foot Of Apt Space The amount New Yorkers pay per square foot of real estate is much higher than almost anywhere else in the world, a recent report shows.",1.0,0.3222282284298792,0.6611141142149396,0.5481521522865861
N3354,sports,more_sports,NCDPS: Juveniles who escaped from N.C. development center may be in Hickory area ,1.0,0.3047181028178134,0.6523590514089067,0.5364787352118756
N35584,travel,travelnews,"Veterans gather, share stories at Brick Store Museum exhibit ahead of American Legion Centennial The Brick Store Museum in Kennebunk held an open house for veterans Sunday in celebration of the American Legion's centennial anniversary. At the museum, a new exhibit looks back at 100 years of history between the town of Kennebunk and the Webber-Lefebvre American Legion Post 74. The exhibit displays various artifacts, historical documents, military uniforms and photos on loan from the post. Sign up for our Newsletters The American Legion is...",1.0,0.3234191501849116,0.6617095750924558,0.5489461001232744
N21106,sports,football_nfl,"Patriots: CB Stephon Gilmore's dominance has had much to do with New England being 8-1 The Patriots headed into their bye week after their first loss of 2019. At 8-1, however, there's been much more good than bad this season, so far. When the team returns for Week 11, they'll still be in the driver's seat for the AFC's No. 1 seed. The schedule won't be easy -- Philadelphia, Dallas, Houston and Kansas City -- but we'll see if the Patriots can regain their form from the first ...",1.0,0.3181717653827292,0.6590858826913646,0.5454478435884861
N8371,sports,football_nfl,"Rams' fake punt goes horribly wrong, Steelers get pick Nothing seems to be working for the Rams against the Steelers, and this fake punt attempt was no exception.",1.0,0.28855415610782,0.64427707805391,0.5257027707385467
N56061,sports,football_nfl,9 things we learned from Sunday's games of Week 10 of NFL season ,1.0,0.3041884195305132,0.6520942097652566,0.5361256130203421
N14622,news,newscrime,"Family asks for help in solving May cold case Friends and family of a murder victim is asking the community for answers. Corey Johnson, 27, was gunned down on 18th and West Main Streets on May 21. His sister, Monique Johnson, says she has not heard anything from police as far as leads or suspects. Johnson is asking that if someone knows information regarding her brother's murder to come forward. ""I'm just pleading for the public, anyone who knows anything please speak,"" she said. Johnson's...",1.0,0.3036615255489522,0.6518307627744762,0.5357743503659681
N13341,news,newsus,"Rising temperatures put U.S. troops at risk during training, report finds By midcentury, troops could face an extra month of heat-index temperatures above 100 F every year, the Union of Concerned Scientists found.",1.0,0.3037359266892392,0.6518679633446196,0.5358239511261594
