ID,category,sub_category,content,collaborative_rec,content_rec,mean,two_one
N50451,news,newsus,"Police: Man killed in crash, fire in Pleasant Ridge A man is dead after a car crash turned into a fire in Pleasant Ridge late Sunday night. The crash happened around 10:30 p.m. on Ridge and Montgomery Road. Sign up for our Newsletters Police said emergency crews at the scene found the driver trapped in the car. Officials said the driver crashed into a utility pole causing the car to burst into flames. The driver later died from his injuries. Investigators said they believe the driver was speeding...",1.0,0.3173795506026574,0.6586897753013287,0.5449197004017716
N40065,sports,more_sports,"The Day in Sports: Sunday, November 10, 2019 The Day in Sports: Sunday, November 10, 2019",1.0,0.2781725106856105,0.6390862553428053,0.518781673790407
N17301,sports,football_nfl,Kirk Cousins responds to narrative about not being able to beat winning teams Cousins helped deliver a huge win for the Vikings over the Cowboys Sunday night.,1.0,0.2871357228741559,0.6435678614370779,0.5247571485827706
N34418,sports,soccer_epl,"How the Sounders won MLS Cup Mark, Jeremiah and Casey were so excited they did a postgame podcast.",1.0,0.3079592923899499,0.653979646194975,0.5386395282599665
N56193,sports,football_nfl,Cowboys have questionable red zone calls in loss to Vikings ,1.0,0.2736896627765416,0.6368448313882709,0.5157931085176943
N33435,lifestyle,lifestylefamily,"Four siblings, all veterans, celebrate Veterans Day in DC Those who pay a visit to the solemn World War II Memorial will come across inscriptions, excerpts of speeches from leaders honoring those who laid down their lives for this country.",1.0,0.3039231463401705,0.6519615731700852,0.5359487642267803
N10529,sports,football_nfl,Week 10 Game Balls: Few Bright Spots in Colts Dismal Showing against Dolphins ,1.0,0.2906778973499646,0.6453389486749823,0.5271185982333098
N39850,lifestyle,lifestylebuzz,"Veterans Day event in Jeffersontown brings out the town and the Ladies for Liberty At a Veterans Day observation service in Jeffersontown Veterans Memorial Park Sunday, several hundred people gathered.",1.0,0.284825531742075,0.6424127658710375,0.5232170211613834
N44276,autos,autossports,Best Sports Car Deals for October ,1.0,0.2976342643359052,0.6488171321679526,0.5317561762239368
