ID,category,sub_category,content,collaborative_rec,content_rec,mean,two_one
N14592,entertainment,entertainment-celebrity,"Chrissy Teigen's weekend was basically a clapback double-header, plus more news Chrissy Teigen gives us two more lessons in the art of the clapback. Plus, more celebrity news for Nov. 12, 2019.",1.0,0.2327759129973015,0.6163879564986507,0.48851727533153433
N39399,music,cma-awards,Gwen Stefani and Blake Shelton Are Couples Goals at the 2019 CMA Awards The cute couple had their second awards show date night of the week in Nashville on Wednesday.,1.0,0.2581722946594806,0.6290861473297403,0.5054481964396538
N26944,news,newsus,"Jeffrey Epstein's Estate May Set Up a Program to Pay Accusers Lawyers for Jeffrey Epstein's estate are considering setting up a program to resolve claims filed by women who say they were abused by the financier, who killed himself in August while facing federal sex trafficking charges. The plan was disclosed in a court filing on Tuesday by a lawyer for one of Mr. Epstein's accusers, who is suing the estate in federal court in Manhattan. The filing said lawyers for Mr. Epstein's estate had informed...",1.0,0.2362789748833065,0.6181394874416533,0.49085264992220434
N36807,weather,weathertopstories,"Timelapse Shows Snow Dusting Central New Hampshire A ""wintery mix"" of snow, ice, and rain moved across much of New Hampshire on Tuesday, November 12, local meteorologists said. Rain and freezing rain early Tuesday gave way to a period of light snow as colder air rushed in, WMUR said. This timelapse   filmed from 1 pm on Monday to 12 pm on Tuesday   shows snow falling and repeatedly dusting a parking lot in Plymouth, New Hampshire. Gunnar Consol, who filmed the video, said about an inch or two accumulated in Plymouth by Tuesday. Credit: @GunnarConsolWx via Storyful",1.0,0.2937552357780538,0.6468776178890269,0.5291701571853692
N58499,news,newspolitics,"Pompeo's Impeachment Role Draws Outcry From Diplomats, Staffers Secretary of State Mike Pompeo has been credited with improving State Department staffing and morale, but his treatment of U.S. Foreign Service officers caught in the impeachment inquiry has undercut those efforts, according to current and former career professionals upset over his recent actions.",1.0,0.2088545769066195,0.6044272884533097,0.47256971793774627
N35850,news,newsus,U.S. Judge Blocks 'Suspicionless' Searches of Phones at Borders A federal judge rejected a Trump administration policy allowing agents at U.S. border crossings and airports to arbitrarily search the phones and laptops of international travelers.,1.0,0.2111705712844899,0.605585285642245,0.4741137141896599
N47851,travel,traveltripideas,The Top Winter Wonderlands You Should Visit This Holiday Find the best alpine views at these wintry destinations.,1.0,0.2853490326826914,0.6426745163413456,0.5235660217884609
N51808,news,newspolitics,"Democrats' impeachment lawyer cut his teeth prosecuting mobsters, Wall Street cheats Daniel Goldman will lead witness questioning during the hearings that begin Wednesday.",1.0,0.1833423046719032,0.5916711523359516,0.45556153644793546
N32798,news,newspolitics,"Kent, Taylor say they're not 'Never Trumpers' after Trump twitter offensive Bill Taylor, the top U.S. diplomat in Ukraine, and George Kent, a top State Department official, denied during Wednesday's first public impeachment hearing that they are ""never Trumpers.""Rep. Eric Swalwell (D-Calif.) asked Kent and Taylor if they identify as ""never Trumpers,"" a label the president assigned them on Twitter ahead of the hearing.""Just about an hour before the two of you sat down to testify today the president tweeted multiple...",1.0,0.1832511594499561,0.5916255797249781,0.4555007729666374
N24898,autos,autosbuying,"The lightest sports cars you can buy for under $30,000 Power-to-weight ratios matter, and what these sports cars lack in horsepower they more than make up for in their abilities to attack the roads with venom.",1.0,0.2978169570814187,0.6489084785407093,0.5318779713876125
N37320,news,newspolitics,"Pro-Trump conservatives are getting trolled in real life by a far-right group Groypers, as they call themselves, fuse online political extremism with stunts at conservative events.",1.0,0.1975473216739934,0.5987736608369967,0.4650315477826622
N15855,lifestyle,lifestyleroyals,"A body-language expert says Meghan Markle is ""politely disconnecting"" from the public, and honestly, we would too Can we blame her? Meghan Markle is supposedly ""politely disconnecting"" from the public as seen in her body language, and girl, you do you.",1.0,0.2423022834721965,0.6211511417360982,0.49486818898146434
N22417,travel,travelarticle,Divers salvage 100-year-old liquor from WWI shipwreck A team of ocean explorers says it has retrieved cognac and liqueur from a ship that was bound for Russia when it was sunk by a German submarine in 1917.,1.0,0.2906258670885138,0.6453129335442569,0.5270839113923425
N53585,tv,tvnews,"Rip Taylor's Cause of Death Revealed, Memorial Service Scheduled for Later This Month The comedian died at the age of 84 last month.",1.0,0.2844111111202594,0.6422055555601297,0.5229407407468396
N58241,finance,markets,"The Dow was perfectly unchanged on Tuesday, a rare occasion on Wall Street The 30-stock average closed flat going out at least six decimal places. It was the first unchanged close for the Dow since April 24, 2014.",1.0,0.249836743179562,0.624918371589781,0.49989116211970797
N496,music,cma-awards,"Fashion hits and misses from the 2019 Country Music Association Awards From Nicole Kidman to Pink, see the best and worst dressed stars at the 2019 Country Music Association Awards.",1.0,0.2807376409880694,0.6403688204940348,0.5204917606587129
N21519,tv,tv-celebrity,RHOP's Monique Samuels Charged With Assault After Incident With Candiace Dillard RHOP's Monique Samuels Charged With Assault After Incident With Candiace Dillard,1.0,0.2621018357782478,0.6310509178891239,0.5080678905188318
N26025,news,newspolitics,"Bannon calls Pelosi's impeachment strategy ""actually quite brilliant"" Bannon, the former White House chief strategist, called Pelosi a ""master at political warfare""",1.0,0.2047167926742936,0.6023583963371468,0.46981119511619573
N23184,entertainment,celebrity,Long-term celebrity couples who won't get married These committed celeb couples have opted not to tie the knot.,1.0,0.2652992821324488,0.6326496410662243,0.5101995214216325
N17896,autos,autossuvs,"Should Chevy Bring This Three-Row Blazer to the U.S.? It's set to go on sale in China soon, but we could see this bigger Blazer doing well in America, too.",1.0,0.2605855244186984,0.6302927622093493,0.5070570162791322
N11967,weather,weathertopstories,"Flying through the wintry landscape A blanket of snow was laid over Belfast, Virginia, on Nov. 12.",1.0,0.2641196944177819,0.632059847208891,0.5094131296118546
N47401,foodanddrink,tipsandtricks,"Your turkey timeline: what to do and when for the perfect holiday roast Most people only cook a turkey once or twice a year which inevitably turns the whole thing into a stressful experience, full of paranoia that the bird will turn out dry. But fear not! Our fail-safe turkey timeline will take you all the way from ordering through to what to do with the leftovers.",1.0,0.2961943187240734,0.6480971593620367,0.5307962124827156
N54482,lifestyle,lifestylebuzz,"Mixed-race mother reveals strangers question whether she's related to her fair-skinned daughter - including a suspicious church-goer who asked the girl: 'Is this your Mummy?' Davina Moon, 32, from Surrey, who has a mixed heritage including Sri Lanka and Ireland, told how society often treats her differently because she doesn't look like her children.",1.0,0.2779705124017213,0.6389852562008607,0.5186470082678142
N41578,lifestyle,lifestyleroyals,Meghan Markle Chose a Chic Black Ensemble for Remembrance Sunday Services She paired her outfit with a bold hat and a crimson poppy pin.,1.0,0.2682711660503758,0.6341355830251879,0.5121807773669171
N15506,news,newsworld,"Trump 'so extreme' on climate he's waking people up, Greta Thunberg tells AFP Swedish teen activist Greta Thunberg said Tuesday that US President Donald Trump's climate change denialism was ""so extreme"" that it had helped galvanize the movement to halt long term planetary warming. The venue was originally in Chile but was shifted because of political unrest, forcing Greta to change her travel plans.",1.0,0.1813686895297874,0.5906843447648937,0.45424579301985823
N48064,news,newsworld,"Why Ukraine and Russia are still at war A long and draining war in eastern Ukraine has become embroiled in President Trump's attempts to undermine his opponents at home. But the war is real and still taking lives, and a way to end it will be very difficult to find.",1.0,0.1921862361432719,0.596093118071636,0.46145749076218123
N36252,finance,markets,Oil rises after OPEC's Barkindo says U.S. shale growth may slow in 2020 Oil rises after OPEC's Barkindo says U.S. shale growth may slow in 2020,1.0,0.2414506819762379,0.6207253409881189,0.4943004546508253
N29839,lifestyle,lifestylehomeandgarden,"Simple Solutions to Help You Get Rid of Ants for Good Kick pesky ants out of your house and back to their colony with these easy, expert-approved tricks.",1.0,0.2870659293066138,0.6435329646533069,0.5247106195377425
N25138,sports,football_ncaa,"College Football Playoff picture: 4 in, 2 out, 5 to watch Sporting News takes a look at the College Football Playoff picture heading into Week 12 of the season.",1.0,0.2667156286694603,0.6333578143347302,0.5111437524463068
N60408,weather,weathertopstories,"Over 20 inches of snow for some Michigan communities in 24 hours! Significant amounts of snow fell within a meandering lake-effect snow band overnight into Tuesday morning across parts of the southwestern Lower Peninsula of Michigan, resulting in up to and over 2 feet in some locations... and that's where AccuWeather's Blake Naftel took in some of the snowy spectacles as people begun to dig out.",1.0,0.2820851103117365,0.6410425551558683,0.5213900735411576
N25722,news,newspolitics,"Rex Tillerson denies he tried to undermine Trump, says Nikki Haley was 'rarely present' at meetings The former secretary of state refuted Haley's claims contained in a new book and says he remains proud of his tumultuous time in the Trump administration.",1.0,0.2009870571700001,0.600493528585,0.46732470478000004
N47099,foodanddrink,tipsandtricks,"This Korean Ingredient Makes Your Chili Taste Amazing As in, more amazing than it already is.",1.0,0.312080640647725,0.6560403203238625,0.5413870937651499
N54161,news,newsus,"Berliners tried to send Trump a piece of the Berlin Wall with a message saying 'no wall lasts forever' The 2.7-ton chunk of concrete arrived in Washington, DC, on Saturday, and local media outlets reported that the Secret Service turned it away.",1.0,0.2039694637112009,0.6019847318556004,0.4693129758074672
N30071,news,newspolitics,"Trump juggles statecraft and impeachment on a historic day Projecting unusual calm in the middle of a political firestorm, President Donald Trump pleaded ignorance Wednesday about the first public impeachment hearing, unexpectedly insisting that he really wasn't paying attention to sworn testimony in the House Intelligence Committee that could determine whether he serves out his term in office. The disclaimer might be more credible if ...",1.0,0.1845876456536852,0.5922938228268426,0.45639176376912344
N46477,movies,movienews,Mark Ruffalo Wants to Set Up Jennifer Aniston on a Date Mark Ruffalo Wants to Set Up Jennifer Aniston on a Date,1.0,0.2526582066610698,0.6263291033305349,0.5017721377740465
N56051,lifestyle,lifestyleroyals,"Meghan Markle and Prince Harry Reunite with Kate Middleton and Prince William for Remembrance Service Meghan Markle, Harry Reunite Kate and William at Remembrance Day",1.0,0.254833309691812,0.627416654845906,0.503222206461208
N61145,foodanddrink,tipsandtricks,Stop! Read This Guide Before You Buy an Air Fryer. Shopping for air fryers? Or maybe air fryer toaster ovens? Our air fryer buying guide will help you find the perfect appliance for your needs.,1.0,0.3143980447377867,0.6571990223688934,0.5429320298251912
N60932,tv,tv-celebrity,Lamar Odom's Son Was ''Hurt'' After Finding Out About His Dad's Engagement on Instagram Lamar Odom's son admits that he was ''hurt and caught off guard'' after finding out about his dad's engagement to Sabrina Parr on Instagram.,1.0,0.2639554122341639,0.6319777061170819,0.5093036081561093
N57591,lifestyle,lifestyleroyals,Prince Charles Is Getting Into the Fashion Business The Prince's Foundation is partnering with the Yoox Net-a-Porter Group on a sustainable 17-piece collection.,1.0,0.2624642332986715,0.6312321166493358,0.508309488865781
N15307,sports,basketball_nba,"10 most stunning early trends around the NBA Youngsters Luka Doncic and Pascal Siakam are taking their games to new heights, while a former No. 1 overall pick is doing his best to shed the ""bust"" label.",1.0,0.2476728372113846,0.6238364186056923,0.49844855814092304
N36703,lifestyle,lifestylecelebstyle,Photos of Celebrities at the Airport Are Here to Inspire Your Holiday Travel Style Even the rich and famous aren't spared the most annoying place in the world: the airport.,1.0,0.2765147429820359,0.6382573714910179,0.5176764953213573
N46751,news,newscrime,"Mom named person of interest in 5-year-old girl's disappearance The search for Taylor Rose Williams, 5, began in Jacksonville on Wednesday.",1.0,0.2591310456702433,0.6295655228351217,0.5060873637801622
N29196,health,health-news,"Florida boy's mock CPR drill goes viral: 'How cute is this!' The saying ""the apple doesn't fall far from the tree"" rings very true for a 3-year-old Florida boy who apparently wants to be just like his father, a first responder.",1.0,0.2592768912481441,0.629638445624072,0.5061845941654294
N39844,sports,basketball_ncaa,"James Wiseman eligibility: Explaining the NCAA questions on Penny Hardaway, Memphis star Everything you need to know about James Wiseman's eligibility case at Memphis and what it means for him, the Tigers' basketball team and the NCAA going forward.",1.0,0.2760516784731408,0.6380258392365704,0.5173677856487605
N57097,news,newsus,Last known Pearl Harbor survivor in Mass. dies at 98 Massachusetts' last known survivor of the Japanese attack on Pearl Harbor that drew the United States into World War II died Tuesday at 98.,1.0,0.2763848016078043,0.6381924008039022,0.5175898677385362
N39389,lifestyle,lifestylebuzz,"Dog Rips The Tail Off Every Single One Of His Toy Pigs Tim Eberts When Diesel's parents first brought him home a cute little stuffed pig toy, they had no idea just how much the husky was going to love it.",1.0,0.2650450575689864,0.6325225287844932,0.5100300383793243
N44818,sports,football_nfl,Redskins name rookie Dwayne Haskins starter for rest of season ,1.0,0.2522161607037952,0.6261080803518976,0.5014774404691968
N36532,weather,weathertopstories,Winds fan ferocious fires in Australia's most populous state Ferocious wildfires were burning at emergency-level intensity across Australia's most populous state and into Sydney's suburbs on Tuesday as authorities warned most people in their paths that there was no longer time to flee.,1.0,0.2647385373324827,0.6323692686662413,0.5098256915549885
N47205,news,newspolitics,"Whistleblower never met or talked with Schiff - source The whistleblower who prompted an impeachment inquiry into U.S. President Donald Trump never met or spoke with congressman Adam Schiff, the Democrat leading impeachment hearings in Congress, a source familiar with the whistleblower's contacts said.",1.0,0.2027279156461539,0.6013639578230769,0.4684852770974359
N51896,health,fitness,"Watch the 'Footloose' Dance Warmup That Gets These High Schoolers Ready to Race They tear up the course before, well, tearing up the course.",1.0,0.2674363692325594,0.6337181846162797,0.5116242461550395
N43299,sports,baseball_mlb,"Tigers put All-Star P Matthew Boyd on trade block Coming off one of the worst seasons in franchise history, it sure looks like the Detroit Tigers are going to further blow things up.",1.0,0.255146993664232,0.627573496832116,0.503431329109488
N37204,health,health-news,"Model, 23, Didn't Know She Was Pregnant Until She Gave Birth to a Full-Term Baby in Her Bathroom An Australian model recently had a life-changing surprise when she gave birth to a baby in her bathroom, despite not knowing that she had been carrying her daughter for nine months.",1.0,0.2840730372279344,0.6420365186139672,0.5227153581519562
N12995,news,newsus,"Cows swept out to sea by Hurricane Dorian are found months later   on the Outer Banks CHARLOTTE, N.C. - Cape Lookout National Seashore on the Outer Banks has discovered three cows are roaming the national park, and it is believed they got there by swimming four to five miles across the Core Sound during Hurricane Dorian. All three were living on Cedar Island when the hurricane generated a ""mini tsunami"" on Sept. 6, sweeping much of the wildlife off the island, including 28 wild ...",1.0,0.3043300300962387,0.6521650150481193,0.5362200200641591
N49030,movies,movies-celebrity,"Kevin Hart Steps Out for Date Night With Wife Amid Recovery From Car Accident Kevin Hart is in better spirits following the violent car crash that left him hospitalized in September. Last night, he was spotted out with his wife for date night in Los Angeles.",1.0,0.2708986596199326,0.6354493298099663,0.5139324397466217
N53526,health,voices,"I Was An NBA Wife. Here's How It Affected My Mental Health. I felt like I was a fraud, and being an NBA wife didn't help that. In fact, it nearly destroyed me.",1.0,0.2747988645297008,0.6373994322648504,0.5165325763531339
N58553,lifestyle,lifestyleroyals,"Prince Harry and Meghan Markle Will Reportedly Visit Oprah While in California During their six-week break from their royal duties, Prince Harry and Meghan Markle are planning to visit Oprah Winfrey, according to a royal insider.",1.0,0.2484180956486792,0.6242090478243396,0.49894539709911945
N48225,finance,finance-companies,"Harassment, Culture of Fear Flourished at Federal Workers Union, Staff Say Current and former employees question whether an investigation into sexual harassment allegations at AFGE will dig deep enough.",1.0,0.2308838480126812,0.6154419240063406,0.48725589867512076
N23446,lifestyle,lifestyleroyals,"Prince Harry and Meghan Markle just shared a never-before-seen photo of baby Archie with his 'Grandpa' Prince Charles to celebrate his birthday The Duke and Duchess of Sussex shared a new photo of Archie, Harry, and Charles to mark the Prince of Wales' 71st birthday on Thursday.",1.0,0.2782689164538172,0.6391344582269086,0.5188459443025448
N11363,health,nutrition,"3 'health' products that are a waste of money, according to dietitians Probiotics are expensive and typically useless, while alkaline water likely doesn't have more health benefits than tap water, experts say.",1.0,0.2979241875997619,0.648962093799881,0.5319494583998412
N8373,travel,travelnews,"Video shows a Boeing 737 plane carrying 196 people burst into flames just after landing at an Egyptian airport The plane, operated by EgyptAir and owned by Ukrainian budget airline SkyUp, burst into flames while it was still taxiing to its gate.",1.0,0.26976857071675,0.6348842853583749,0.5131790471444999
N42860,news,elections-2020-us,Sessions vows to 'work for' Trump endorsement Former Attorney General Jeff Sessions vowed to work for President Trump's endorsement in the 2020 Alabama Republican Senate primary.,1.0,0.1962981030004543,0.5981490515002271,0.4641987353336362
N9720,lifestyle,lifestylecelebstyle,Emilia Clarke Stunned in a Cut-Out Dress at the 'Last Christmas' Premiere Clarke finished the look with a sleek ponytail and minimal heels.,1.0,0.2598502625304526,0.6299251312652263,0.5065668416869684
N36545,tv,tv-celebrity,Joe Giudice Calls His Family 'Italian Strong' During Reunion with Wife Teresa and Their Daughters Joe Giudice Shares Sweet Photo During Family Reunion in Italy,1.0,0.2530752800103115,0.6265376400051558,0.502050186673541
N36626,news,newsworld,Austrian army says soldier mauled to death by service dogs The Austrian army says a 31-year-old soldier appears to have been killed by two service dogs he was tasked with feeding.,1.0,0.2646871257349354,0.6323435628674677,0.5097914171566236
N36226,finance,finance-retirement,"The 1 reason you shouldn't hesitate to claim Social Security early Seniors are often told to wait on Social Security, but here's a good argument for filing sooner.",1.0,0.2582082173252559,0.6291041086626279,0.5054721448835039
N706,news,newscrime,"Police arrest suspect in fatal stabbing over Popeyes chicken sandwich A Maryland man wanted in a fatal stabbing over a Popeyes chicken sandwich has been arrested, police said.",1.0,0.2672212127242123,0.6336106063621061,0.5114808084828082
N56711,finance,finance-companies,"American Outdoor to split into two firms, separating its gun business American Outdoor Brands Corp. said it will split into two publicly traded companies, one focused on firearms and the other on outdoor products, in an effort to reverse a stock-market decline amid rising pressure for tougher U.S. gun restrictions.",1.0,0.2592640344099765,0.6296320172049883,0.5061760229399843
N56227,foodanddrink,foodnews,"15 secrets of the $4.99 Costco rotisserie chicken Though the price is widely known, there are some facts about Costco's most popular poultry that you might not know.",1.0,0.295373225850212,0.647686612925106,0.5302488172334746
N53343,foodanddrink,tipsandtricks,This Sturdy Cutting Board Will Last for a Lifetime and It's On Super Sale Right Now It also makes the perfect holiday gift.,1.0,0.288097641287683,0.6440488206438415,0.525398427525122
N30035,news,newspolitics,"George Conway: 'Republicans Were Fundamentally Illogical and Incoherent' George Conway continued his surprising appearance on MSNBC panels covering the impeachment hearings and not disappoint loyal viewers eager for harsh criticism of Congressional Republicans in defense of President Donald Trump. Conway has been a remarkably vocal critic of President Trump, who's volumes of tweets have only received more interest and attention due to the […]",1.0,0.1881811192716526,0.5940905596358264,0.45878741284776836
N48613,news,newsworld,Turkey's Erdoğan showed propaganda film about Kurds during White House meeting: report Turkish President Recep Tayyip Erdoğan reportedly took out an iPad to show President Trump and a group of Republican senators a propaganda film about Kurdish-led forces during a White House meeting on Wednesday.,1.0,0.1968687837496829,0.5984343918748415,0.46457918916645524
N61404,foodanddrink,restaurantsandnews,Arby's tells parents that 'only well behaved children' are allowed A location of the fast-food chain said only those who remained seated and kept food on their trays would be welcome.,1.0,0.2827255301424429,0.6413627650712215,0.5218170200949619
N64916,news,newscrime,"Rape victim rejects judge's offer: $150,000 for her, reduced sentence for attacker A Louisiana judge asked a rape survivor if she would consider a $150,000 restitution payment from her attacker. She refused, saying the attack has left her ""broken.""",1.0,0.2569830950495928,0.6284915475247964,0.5046553966997285
N28947,travel,traveltips,14 mistakes to avoid at all-inclusive resorts I stayed for 28 nights at an all-inclusive resort in the Dominican Republic this hurricane season.,1.0,0.2863877961793706,0.6431938980896853,0.5242585307862471
N41220,autos,autosenthusiasts,This little Montana town is full of Power Wagons and Mustangs You never know what sorts of treasures hide down that unpaved backroad.,1.0,0.2790504661403989,0.6395252330701995,0.5193669774269326
N51133,news,newsscienceandtechnology,Astronauts Will Take 4 of the Most Challenging Spacewalks Ever to Fix a Dark Matter Experiment Two astronauts are gearing up for what may be the most challenging spacewalks in history.,1.0,0.2673968196936638,0.6336984098468319,0.5115978797957759
N20811,foodanddrink,foodnews,Justin Bieber Says Popeyes Chicken Sandwich Is 'Not Worth the Hype' Justin Bieber Says Popeyes Chicken Sandwich Is 'Not Worth the Hype',1.0,0.2625042759352651,0.6312521379676326,0.5083361839568434
N25966,sports,basketball_ncaa,"Memphis declares James Wiseman ineligible while it works toward resolution with NCAA James Wiseman withdrew his lawsuit against the NCAA, indicating a settlement could be in the works.",1.0,0.2553869935047703,0.6276934967523852,0.5035913290031802
N20527,finance,markets,"15 states where poverty is worse than you might think Developed in 1963, the official poverty rate is based on pre-tax income thresholds related to the cost of a minimum food diet and the number of individuals who depend on that income.",1.0,0.2767696852787372,0.6383848426393686,0.5178464568524914
N25949,music,music-celebrity,Demi Lovato Goes Instagram Official With Boyfriend Austin Wilson: See Their Sweet Synchronized Posts This is the singer's first social media-official romance since her July 2018 overdose.,1.0,0.2604275310616871,0.6302137655308435,0.5069516873744581
N47981,lifestyle,lifestylebuzz,"Meghan Markle Chose a Black Brocade Dress For the Royal Family's Important Outing On Saturday, the royal family reunited publicly for the first time in months to attend the Royal British Legion's Festival of Remembrance at the Royal Albert Hall.",1.0,0.2496332767635792,0.6248166383817896,0.49975551784238614
N63796,news,newspolitics,"Instructions Came From Trump, Schiff Says: Impeachment Update The first public hearing in the formal impeachment inquiry into President Donald Trump was held Wednesday, as the House Intelligence Committee heard testimony from two State Department officials.",1.0,0.1919978892209516,0.5959989446104758,0.461331926147301
