ID,category,sub_category,content,collaborative_rec,content_rec,mean,two_one
N33831,entertainment,celebrity,"From Idris Elba to Richard Gere: All the Sexiest Man Alive Covers Some are familiar faces (Ben! Brad!) and some are shockers (here's looking at you, Richard!). Check out who's been named Sexiest through the years",1.0,0.2785185801189105,0.6392592900594553,0.5190123867459403
N31041,foodanddrink,recipes,19 Cornbread Recipes to Replace The Store-Bought Rolls This Thanksgiving ,1.0,0.2680782834682312,0.6340391417341156,0.5120521889788208
N22371,lifestyle,lifestylehomeandgarden,Easy DIY Thanksgiving Centerpieces for a Picture-Perfect Table We'll show you how to set the stage.,1.0,0.2721137564790588,0.6360568782395294,0.5147425043193725
N30475,entertainment,celebrity,The Sexiest Photos Ever of Our 29 Sexiest Men Alive Warning: lots of heat ahead,1.0,0.2771341666217499,0.638567083310875,0.5180894444144999
N29468,health,ads-lung-health,"​'My Annoying Cough Turned Out To Be Lung Cancer' As soon as I was coming out of anesthesia, he told me it was cancerous.",1.0,0.2981982404623479,0.649099120231174,0.5321321603082318
N7535,lifestyle,lifestylehomeandgarden,"America's Largest Home Also Has the Most Amazing Christmas Decorations Over 13,000 ornaments are deployed around the Biltmore Estate in NC.",1.0,0.2815454148549484,0.6407727074274742,0.5210302765699656
N26940,health,nutrition,"This is Exactly How Long You Should Keep Thanksgiving Leftovers While keeping leftovers seems like a no-brainer, if not done properly, they can make you sick. Learn the right way to store Thanksgiving leftovers.",1.0,0.2999034638488864,0.6499517319244432,0.5332689758992576
N27441,lifestyle,lifestylehomeandgarden,These Christmas Window Decorations Are Full of Holiday Cheer Don't overlook this decorating opportunity this year.,1.0,0.2746241004363062,0.6373120502181531,0.5164160669575375
N8400,autos,autosresearchguides,These are the new cars that depreciate least Don't want to lose a ton of money on your next new car? These are the new car models that hold the most value after five years.,1.0,0.2850420465006104,0.6425210232503051,0.5233613643337403
N6342,health,weightloss,"Jess Lost 75 Pounds Without Counting Calories and Did This 1 Inspiring Thing Before Every Meal Jess Dukes makes a list of her ""whys"" and reads them before every meal and every workout.",1.0,0.2806510704862519,0.640325535243126,0.5204340469908346
N53431,lifestyle,lifestylehomeandgarden,Designer-Approved Ideas to Transform a Small Bedroom Because a lack of square footage shouldn't cramp your style.,1.0,0.2846728955774985,0.6423364477887492,0.5231152637183323
N55204,entertainment,entertainment-celebrity,"Stars Who Served in the Military Adam Driver, Jeff Bridges, Ice-T and more stars who served in the military.",1.0,0.2516067246024948,0.6258033623012473,0.5010711497349964
N61623,entertainment,entertainment-celebrity,"Big celebrity money moments of the last decade From bankruptcy filings and huge paydays to reaching billionaire status, read up on the most fascinating money news involving the stars from 2010 to 2019.",1.0,0.2366378214909621,0.6183189107454811,0.4910918809939747
N38783,movies,movies-gallery,The 25 most iconic film quotes The most iconic quotes are the ones that are so famous that you can't even use those words in casual conversation without reminding the average person of the movie.,1.0,0.2814775486716487,0.6407387743358244,0.5209850324477658
N36741,autos,autosnews,Is Lamborghini Testing The Urus ST-X At The Nürburgring? This could be the rumored road-legal version of the racer.,1.0,0.2848702634429378,0.6424351317214689,0.5232468422952918
N2952,lifestyle,voices,I'm Child-Free and Couldn't Be Happier About It. What's So Bad About That? Women need to stop pressuring other women to want children,1.0,0.2998348598730909,0.6499174299365454,0.5332232399153939
N58885,health,fitness,3 Months of Full Body Workouts Helped This Guy Get Shredded at 40 Mat Smith ramped up his workouts and found an online support group to share fitness goals.,1.0,0.2628592173276983,0.6314296086638491,0.5085728115517989
N6932,foodanddrink,tipsandtricks,How to Split an Apple in Half With Your Bare Hands Paul Rudd wowed Twitter the other day with a video in which he split an apple in half with his bare hands. Amazing! What human being can do that? Surely nobody but Paul Rudd!,1.0,0.2440893048696709,0.6220446524348354,0.4960595365797806
N61822,lifestyle,lifestylehomeandgarden,"200 Shocking Home Photos You Have to See We know a good DIY project when we see it, but these aren't them. Some of these are goofy, some are head scratchers and some are downright dangerous. Check these photos out, you'll definitely learn a thing or two!",1.0,0.2790716836029624,0.6395358418014812,0.5193811224019749
N54397,finance,personalfinance,7 Signs You Have Too Much Debt We all have our debt limits. Here's how to know when you've reached yours.,1.0,0.277737566042591,0.6388687830212955,0.5184917106950606
N60858,autos,autostrucks,Next Ford F-150 Spied By Motor1.com Reader Work continues on America's favorite truck.,1.0,0.2567129752561952,0.6283564876280976,0.5044753168374634
N23254,movies,movies-celebrity,Best nostalgic pics of Leonardo DiCaprio Celebrate Leo's birthday with these throwback photos.,1.0,0.2946265407984824,0.6473132703992412,0.5297510271989883
N5791,lifestyle,lifestylehomeandgarden,"12 Fall Landscaping Mistakes to Know and Avoid Whether you have a green thumb when it comes to your home garden, or you can hardly tell the difference between a rose and a weed, you should know that there are certain landscaping tasks that need to be done right to keep your home exterior looking its best. But to do that, you must avoid the most common fall landscaping blunders.",1.0,0.2829778687225005,0.6414889343612502,0.5219852458150003
N24686,entertainment,entertainment-celebrity,Stars who've had more than one wedding with the same spouse See which celebs exchanged vows with their significant others more than once.,1.0,0.2705638237337636,0.6352819118668818,0.5137092158225091
N30188,lifestyle,lifestylebuzz,Look of the day: Ashley Graham's latest sizzling maternity look & more celeb style Bella Hadid attended the CFDA/Vogue Fashion Fund Awards in an Alexander Wang jumpsuit embellished with nipple and belly-button jewels.,1.0,0.2645356521131771,0.6322678260565886,0.5096904347421181
N28324,music,music-gallery,Celebrity Christmas albums: From beloved classics to big surprises All we want for Christmas is to listen to this holiday music from the stars.,1.0,0.2711773786764997,0.6355886893382499,0.5141182524509997
N17104,news,newscrime,"Veterans suffered, investors lost millions in nationwide schemes People lost hundreds of millions of dollars. But something is happening that might finally stop it.",1.0,0.216096208240214,0.608048104120107,0.4773974721601426
N54988,finance,personalfinance,28 Dumb Ways You Could Lose It All by Trying To Get Rich Don't gamble your money away in foolish ways.,1.0,0.2663947879329914,0.6331973939664957,0.5109298586219942
N22549,entertainment,awards,2019 People's Choice Awards nominees' best recent style moments We're checking out the E! People's Choice Awards nominees' stellar recent style moments.,1.0,0.2672325232716596,0.6336162616358298,0.5114883488477731
N54300,entertainment,celebrity,"Week in celebrity photos for Nov. 4-8, 2019 Week in celebrity photos for Nov. 4-8, 2019",1.0,0.2838961975673824,0.6419480987836912,0.5225974650449215
N21840,travel,traveltips,"10 Things You Should Never Do in an Airplane Bathroom Germs are potentially harmful in a normal bathroom. But put that bathroom in the sky, shrink it, and pump pressurized air into it and you've got the perfect environment for germs to thrive. The post 10 Things You Should Never Do in an Airplane Bathroom appeared first on Reader's Digest.",1.0,0.3158374737091042,0.657918736854552,0.5438916491394028
N51241,lifestyle,lifestylefamilyandrelationships,"I Was Adopted Here's What Everyone Gets Wrong About Adoption While adoption is wonderful in many ways, it comes with its own set of unique challenges. Sometimes, those challenges come from other people making incorrect assumptions. The post I Was Adopted Here's What Everyone Gets Wrong About Adoption appeared first on Reader's Digest.",1.0,0.2978109066590415,0.6489054533295208,0.5318739377726943
N37870,news,newsworld,Today in History: November 11 ,1.0,0.263707930026241,0.6318539650131205,0.509138620017494
N22880,lifestyle,voices,"I ordered clothes from those cheap online stores, and I'm not sold As an avid brick-and-mortar shopper, my eyes were opened when I tried an $8 formal dress, a $4 blouse, and other clothes for less than $10.",1.0,0.2675149608050949,0.6337574804025474,0.5116766405367299
N27143,foodanddrink,beverages,Best Dive Bar in Every State The real challenge in compiling a list of America's best dive bars comes in defining just what a dive bar is and isn't.,1.0,0.2761315929152841,0.638065796457642,0.5174210619435227
N4912,movies,movies-gallery,"New Movies and TV Shows You'll Be Able to Cozy Up With on Netflix in November Movie watchers divide themselves into two camps when November rolls around: those who aren't ready to stop watching all the horror flicks that creeped them out around Halloween, and those who can't wait to dive into cheesy holiday movie season.",1.0,0.2673126064268589,0.6336563032134295,0.5115417376179059
N61006,entertainment,awards,Jenna Dewan flaunts her baby bump in red gown at People's Choice Awards She looks absolutely stunning.,1.0,0.2828141891993349,0.6414070945996675,0.5218761261328899
N11817,travel,traveltripideas,"Here's the Best Small Town in Every State From Los Alamos, California, to Shelter Island, New York, these are the best small towns INSIDER found in every state.",1.0,0.2727200842065529,0.6363600421032765,0.5151467228043686
N64482,health,health-cancer,How I Got Lung Cancer at 31 Without Ever Smoking a Single Cigarette Rachael Malmberg was 31 when she received a deadly diagnosis. She is fighting her condition and has embarked upon a mission to educate others about the second leading cause of lung cancer and it has nothing to do with smoking.,1.0,0.30444853766579,0.652224268832895,0.5362990251105266
N36273,sports,football_nfl,"Best, worst QB performances from NFL Week 10 Lamar Jackson continues to excel. Philip Rivers Continues to... not excel.",1.0,0.2817596341191396,0.6408798170595698,0.5211730894127597
N51853,finance,markets,"The problem with diamonds is they keep getting cheaper Americans are buying more diamond jewelry than ever before, but prices for most polished gems are falling.",1.0,0.2842483947190627,0.6421241973595313,0.5228322631460418
N64174,news,newscrime,Georgia executes man convicted of killing convenience store clerk Georgia executes man convicted of killing convenience store clerk,1.0,0.2771818496166447,0.6385909248083224,0.5181212330777631
N17059,finance,finance-companies,"No. 1 milk company declares bankruptcy amid drop in demand Dean Foods blamed a decadeslong drop in milk consumption that has seen people turn to alternatives like soda, juice and almond milk.",1.0,0.267157512757196,0.633578756378598,0.5114383418381306
N36624,finance,markets,"Red and Blue Economies Are Heading in Sharply Different Directions At a quick glance, red and blue metropolitan areas are performing equally well on average in the most watched indicators of labor market health. Employment growth in the year ending in the first quarter of 2019 was 1.4 percent in both Democratic-leaning and Republican-leaning metro areas, and the unemployment rate in both types of places is roughly equivalent. Silicon Valley (blue) is booming. So is Provo, Utah (red). But below the surface, red...",1.0,0.2425804908888656,0.6212902454444328,0.49505366059257705
N35937,sports,football_nfl,"JuJu Smith-Schuster: Jalen Ramsey's right, I'm not Antonio Brown In the days leading up to Sunday's game against the Steelers, Rams cornerback Jalen Ramsey shared his opinion that Steelers wide receiver JuJu Smith-Schuster isn't the same kind of threat that Antonio Brown was when he roamed football fields rather than the social media universe. Smith-Schuster may not be Brown, but the Rams paid him [more]",1.0,0.2449609479135963,0.6224804739567982,0.4966406319423975
N53111,finance,finance-real-estate,Luxury rentals only the superrich can afford The world's costliest luxury lettings come with eye-watering rents only a billionaire could contemplate   mere millionaires need not apply.,1.0,0.2837379932095857,0.6418689966047928,0.5224919954730571
N27473,news,newspolitics,President Trump Speaks At Opening Ceremony Of 100th Annual Veterans Day Parade In NYC New York City is marking 100 years of commemorating the veterans who served our country.,1.0,0.2277938526837291,0.6138969263418645,0.48519590178915273
N40559,news,newsworld,"2 dead, 3 injured in a school shooting in Russia Russian police say a student has killed a fellow student and wounded three more in a shooting at a college before taking his own life. Russia's state Investigative Committee says the 19-year-old student in Blagoveshchensk near the border with China brought a hunting rifle to class Thursday and opened fire on students, shooting one dead and severely injuring three more.",1.0,0.2664589108820392,0.6332294554410196,0.5109726072546927
N7419,lifestyle,lifestylevideo,"Why This Couple Is Getting a 'Sleep Divorce' A New Jersey couple is getting an unusual ""divorce."" Liz and Rich Alterman have been happily married for almost 20 years. They have three children and are now on the brink of getting ""sleep divorced.""",1.0,0.2514107734459115,0.6257053867229557,0.5009405156306077
N20824,finance,markets,"The economic picture is darkening in states critical to Trump's reelection bid A closer look at key battleground states could spell trouble for the candidate, whose populist economic proposals have been central to his campaign.",1.0,0.1829854004243164,0.5914927002121582,0.4553236002828776
N47624,news,newsworld,"US, South Korea could scale back joint drills: Esper US military exercises with South Korea could be scaled back to aid diplomacy with the nuclear-armed North, Defense Secretary Mark Esper said on his way to Seoul, as Pyongyang said it was running out of patience. Seoul and Tokyo are both major US allies, democracies and market economies faced with an overbearing China and nuclear-armed North Korea.",1.0,0.2201239699180128,0.6100619849590064,0.4800826466120085
N27476,sports,basketball_nba,"Harden scores 47 points, Rockets beat Clippers 102-93 HOUSTON (AP)   James Harden scored 47 points and the Houston Rockets outlasted the Clippers 102-93 in a wild game that saw Los Angeles coach Doc Rivers ejected in the fourth quarter Wednesday night. Houston was up by two with about two minutes left when former Rocket Patrick Beverley fouled out. Harden made both free throws before grabbing a rebound on the other end and hitting a 3 to make it 95-88. Beverley was given a technical foul during a...",1.0,0.2794984574314627,0.6397492287157314,0.5196656382876418
N57853,news,newscrime,Triple Shooting In Dallas Leaves 2 Dead & Police Investigating Two people are dead after a triple shooting in Dallas late Sunday night.,1.0,0.2743817235956017,0.6371908617978008,0.5162544823970678
N50005,news,newsgoodnews,"A teenager thought his leukemia was a death sentence. A college football player saved his life. William & Mary offensive lineman Mark Williamson on Friday finally met Rusty Plemons, whose life he helped save three years ago.",1.0,0.2577396740497204,0.6288698370248602,0.5051597826998135
N10840,finance,markets,Trade War's Forgotten Farmers Get Crushed in U.S. Cotton Country American cotton farmers are having such a difficult year that even a potential trade deal between the U.S. and China is likely to offer them little comfort.,1.0,0.2255439260243235,0.6127719630121617,0.4836959506828823
N54283,lifestyle,lifestyleroyals,"Prince Harry just hinted that he and Meghan Markle may want another baby Reports also suggest that Meghan Markle may want to have their next child in Los Angeles, where she was born.",1.0,0.2649099451029002,0.6324549725514501,0.5099399634019335
N33261,video,lifestyle,The Queen Had This Hilarious Reaction to (Unnecessary) Mouth-to-Mouth Resuscitation The Queen had a hilarious reaction when someone tried to save her life. Buzz60's Keri Lumm reports.,1.0,0.2791129373512092,0.6395564686756046,0.5194086249008061
N26084,foodanddrink,recipes,These Christmas Dinner Menus Will Create an Unforgettable Meal We've got you covered for any type of crowd.,1.0,0.2864504772250126,0.6432252386125064,0.5243003181500083
N999,news,newsscienceandtechnology,"Motorola's Razr flip phone is back as a folding-screen smartphone, for $1,500 The good news: A phone can fit in your pocket again. The bad news: It's twice the price of an iPhone.",1.0,0.263219515406089,0.6316097577030445,0.508813010270726
N18698,entertainment,awards,Khloe Kardashian Apologizes to Fans After Not Realizing She'd Won an Award at the People's Choice Awards Her family also won for Best Reality Show.,1.0,0.2566661108271115,0.6283330554135558,0.504444073884741
N287,news,newscrime,Three school workers charged in death of special needs student The student was reportedly restrained face-down for nearly an hour before becoming unresponsive,1.0,0.2733669135554561,0.6366834567777281,0.5155779423703041
N39461,foodanddrink,foodnews,"We Tried 5 Brands of Toaster Pastries So You Don't Have To We tasted organic, generic, gourmet, and nostagic options. Here's what we thought.",1.0,0.2796178866328915,0.6398089433164458,0.519745257755261
N46972,news,newsworld,U.S. calls on Iraq to hold early elections U.S. calls on Iraq to hold early elections,1.0,0.232915177314301,0.6164575886571505,0.488610118209534
N42803,lifestyle,awardstyle,Dolly Parton Is Rocking a Thigh-High Slit at the CMA Awards and She Looks Incredible This is why we love her.,1.0,0.2681831877927674,0.6340915938963837,0.5121221251951782
N3992,news,newsworld,"Dozens detained in India over holy site social media comments Indian police have arrested dozens of people for social media comments that allegedly threatened ""communal harmony"" after the Supreme Court awarded a holy site once used for a mosque to Hindus, officials said Monday. The site in the northern city of Ayodhya has in the past caused communal riots that have left thousands dead, and security forces have been on alert since the verdict was announced on Saturday.",1.0,0.2622284678798789,0.6311142339399395,0.5081523119199193
N41172,entertainment,celebrity,Welcome to the World! All of the Celebrity Babies Who've Made Their Debuts in 2019 See who's made their debut so far this year,1.0,0.2797362772258258,0.6398681386129129,0.5198241848172171
N14531,news,newsworld,Turkey starts repatriation of captured Islamic State militants: media Turkey starts repatriation of captured Islamic State militants: media,1.0,0.2275487291621953,0.6137743645810977,0.4850324861081302
N40530,news,newspolitics,"What's coming in impeachment: The inquiry goes public For only the fourth time in U.S. history, the House of Representatives has started a presidential impeachment inquiry.",1.0,0.2172755753183887,0.6086377876591944,0.4781837168789258
N64606,entertainment,celebrity,"Best celebrity hair moments of 2019 (so far) New year, new 'do! Nothing has the power to transform a look quite like a new hairstyle, which might explain why celebrities are constantly switching things up with fresh cuts, colors and lengths. In 2019, we've already seen stars like Rowan Blanchard and John Travolta go shorter (or, in the Saturday Night Fever star's case, bald!), Lady Gaga and Chris Messina walk the red carpet with striking new shades and Hilary Duff and Sarah Hyland show how subtle color shifts can make a big impact. And, if 2018's tress transformations were any indication, there is going to be so much more where that came from. Keep scrolling to see the best celebrity haircuts, color, extensions and more of 2019 so far!",1.0,0.2474491683682773,0.6237245841841387,0.49829944557885153
N25414,finance,finance-companies,"Alibaba breaks Singles Day record of more than $30 billion in sales and climbing Chinese e-commerce giant Alibaba set a new sales record on Singles Day, the world's largest 24-hour shopping event.",1.0,0.2540355171709262,0.627017758585463,0.5026903447806175
N59385,entertainment,celebrity,"Celebrity Engagements of 2019 Love is abloom in 2019! Stars such as Tim Tebow, who is set to wed former Miss Universe Demi-Leigh Nel-Peters, and Hamilton's Anthony Ramos will soon be walking down the aisle after popping the question to their respective loved ones. Scroll through to see who else is put a ring on it this year and get the story behind their sweet proposals.",1.0,0.252566256886825,0.6262831284434125,0.50171083792455
N6056,entertainment,celebrity,"See what your favorite stars look like without makeup They get glammed up for red carpet events, but in their downtime, celebrities from Katie Holmes to Emma Stone prefer to let their natural beauty take center stage. Yes, just like you, stars do occasionally allow the world to see their foundation-free skin and mascara-less lashes to celebrate their freckles, little imperfections and inside-out glow, usually by way of the makeup-free selfie. They even sometimes celebrate their bare-facedness with hashtags like #wokeuplikethis and #nofilter. To see these stars without makeup   including Kate Hudson, Kim Kardashian, Gigi Hadid and all the stars you see above   check out the gallery now. For the latest beauty and style trends subscribe to our new podcast 'Get Tressed With Us' below! 34 Of Your Favorite Celebrities With Or Without Makeup!",1.0,0.2662664721584221,0.633133236079211,0.5108443147722814
N33120,entertainment,celebrity,Stars who welcomed babies in 2019 See which celebrities expanded their families this year!,1.0,0.2808652159386848,0.6404326079693424,0.5205768106257899
N31978,music,music-awards,"Country music's biggest scandals From Wynonna Judd's husband's arrest to the Dixie Chicks' vent about George W. Bush, relive country's biggest scandals.",1.0,0.2342785593766332,0.6171392796883166,0.4895190395844221
N15761,entertainment,humor,Comics - '9 to 5' by Harley Schwadron Daily comics: '9 to 5' by Harley Schwadron,1.0,0.2552794042215531,0.6276397021107766,0.5035196028143687
N3344,music,cma-awards,"Top 100 country songs of all time Stacker counts down the top 100 country songs of all time. From old-school honky-tonk to modern country pop, this list covers the biggest hits in Billboard history.",1.0,0.2943559387495404,0.6471779693747702,0.5295706258330269
N26262,entertainment,entertainment-celebrity,"Celebrity plastic surgery transformations See how stars like Sharon Osbourne, Cardi B, Pauly D, Kim Zolciak-Biermann, Gisele Bundchen, Kanye West and others have altered their looks.",1.0,0.2479219384129661,0.623960969206483,0.498614625608644
N38311,entertainment,celebrity,Celebrity PDA of 2019 See the stars kissing and hugging on the red carpet and out and about!,1.0,0.263695283181184,0.631847641590592,0.509130188787456
N45561,news,newsphotos,"Inside the world's largest plane, which has a wingspan longer than a football field and a mysterious new owner The Stratolaunch is 238 feet long, 50 feet tall, and has a 385-foot wingspan. It made its first flight in April.",1.0,0.2913022499970058,0.6456511249985029,0.5275348333313372
N8957,music,cma-awards,Best country music albums of all time Stacker has compiled a list of the best country albums of all time as per Billboard's Greatest of All Time Country Albums list. These ratings are based on albums' weekly performance on the Top Country Albums chart from January 1996 to June 2016.,1.0,0.3013383352622027,0.6506691676311014,0.5342255568414684
N49252,entertainment,entertainment-books,"100 Books Everyone Should Read Before They Die If you want to fill your shelves with classic titles and tomes that will open your mind to many worlds of fancy, facts, and fiction, these 100 books are the place to start.",1.0,0.309057786107735,0.6545288930538675,0.5393718574051567
N30253,health,nutrition,"29 Foods Diabetics Should Avoid While some foods may seem healthy, they can be low-nutrition sources of hidden sugars. Here are foods to avoid.",1.0,0.3182121662653274,0.6591060831326637,0.5454747775102182
N42266,lifestyle,lifestylehomeandgarden,"Stylish Living Room Ideas, From Floral to Family-Friendly Bookmark this for the next time you need a refresh.",1.0,0.2917910528198018,0.6458955264099009,0.5278607018798678
N53696,news,newsworld,"Ugly From the Outset: Hong Kong's Day of Widespread Violence HONG KONG   Hong Kong was a city on edge on Monday following escalating violence, in which one demonstrator was shot point blank by a police officer and one man was doused with a flammable liquid and set on fire after he scolded protesters. At nightfall, both men were fighting for their lives in a city seething with resentments. Protesters have voiced outrage at police officers they see as increasingly resorting to force, and at a government...",1.0,0.2709034137926686,0.6354517068963343,0.5139356091951124
N46029,news,newsworld,"How Russia Meddles Abroad for Profit: Cash, Trolls and a Cult Leader The Russians were hard to miss. They appeared suddenly last year in Madagascar's traffic-snarled capital, carrying backpacks stuffed with cash and campaign swag decorated with the name of Madagascar's president.",1.0,0.2255461071207941,0.612773053560397,0.483697404747196
N28204,finance,markets,"A $100 Billion Fund Manager Is Debunking Stock-Bubble Theories Negative interest rates are unnaturally propping up the stock market and at some point the whole edifice will collapse. It's an oft-repeated theory, but history suggests it might be wrong.",1.0,0.2347709040387258,0.6173854520193629,0.4898472693591505
