ID,category,sub_category,content,collaborative_rec,content_rec,mean,two_one
N42128,movies,movies-celebrity,"Hugh Hefner's son Cooper weds 'Harry Potter' actress Cooper Hefner married Scarlett Byrne in Ventura, Calif., on Monday.",0.1882755827179073,0.2652986326943617,0.22678710770613453,0.23962428270221026
N28257,news,newspolitics,"Meghan McCain confronts Trump Jr.: 'You and your family have hurt a lot of people' Donald Trump Jr., the president's son, defended his family after ""View"" co-host Meghan McCain suggested they were responsible for the lack of ""character"" in American politics.",0.1882755827179073,0.1798467282127568,0.18406115546533205,0.1826563463811403
N20680,sports,football_nfl,Saints DBs mocked Bears RB Tarik Cohen for being short during heated argument Things go personal in Chicago.,0.1882755827179073,0.2527571772414335,0.22051637997967038,0.2312633124002581
N22816,foodanddrink,foodnews,"Snow crab sells for record price in Japan A ""five shining star"" snow crab was auctioned off in Tottori, Japan for a record-breaking 5 million yen ($46,000). wide.",0.1904014846510107,0.2708003891306734,0.23060093689084205,0.24400075430411916
N54435,news,newsus,"'Angel' car saves Arizona family after smashing into suspected drunk driver running red light, video shows An Arizona driver who police praised as an ""angel"" may have saved the lives of a couple pushing a stroller in a crosswalk last week after video showed the car smashing into a suspected drunk driver speeding through a red light -- who came inches away from plowing into the family.",0.1904014846510107,0.2627597647879677,0.2265806247194892,0.23864033807564872
N59496,sports,football_nfl,"Week 7 winners, losers: Aaron Rodgers now in MVP race; Mitchell Trubisky looks lost Aaron Rodgers' big game vaults him into the MVP race. Meanwhile in Chicago, it might be time for the Bears to reconsider Mitchell Trubisky's future.",0.1904014846510107,0.238159129321144,0.21428030698607736,0.22223991443109958
N63180,music,music-celebrity,"Taylor Swift can't shake 'Shake It Off' copyright suit reinstated by federal court panel A federal appeals court panel Monday reinstated a dismissed copyright lawsuit claiming Taylor Swift's ""Shake It Off"" infringed on an earlier song.",0.1904014846510107,0.2385175843750349,0.2144595345130228,0.22247888446702685
N11727,foodanddrink,restaurantsandnews,"Popeyes quietly launched a new pumpkin pie and it's the best fast-food dessert I've ever tasted Popeyes still doesn't have the chicken sandwich, but it does have a delicious new deep-fried pumpkin and cream cheese pie. Run, don't walk.",0.1904014846510107,0.2562284087040712,0.22331494667754095,0.2342861006863844
N6750,news,newspolitics,"Kamala Harris to slash staff, restructure campaign as she hemorrhages cash Kamala Harris is dramatically restructuring her campaign by redeploying staffers to Iowa and laying off dozens of aides at her Baltimore headquarters, according to campaign sources and a memo obtained by POLITICO Wednesday, as she struggles to resuscitate her beleaguered presidential bid.",0.1904014846510107,0.206467695858622,0.19843459025481636,0.20111229212275156
N7499,entertainment,celebrity,New Couple Alert? Drake and Kylie Jenner Appear Into Each Other at Party New Couple Alert? Drake and Kylie Jenner Appear Into Each Other at Party,0.1904014846510107,0.2603968056848805,0.2253991451679456,0.23706503200692391
N5978,finance,markets,"Eric Tse, 24, just became a billionaire overnight A 24-year-old business school graduate has just become an overnight billionaire.",0.1904014846510107,0.2410066538456723,0.2157040692483415,0.2241382641141184
N17681,foodanddrink,foodnews,McDonald's Is Going to Add Chicken to Its Breakfast Menu in 2020 Here's the rumor from McDonald's HQ. The post McDonald's Plans to Add Chicken to Its Breakfast Menu in 2020 appeared first on Taste of Home.,0.1904014846510107,0.282258296180614,0.23632989041581234,0.2516393590040796
N40716,tv,tv-celebrity,Lori Loughlin Is 'Absolutely Terrified' After Being Hit With New Charge Lori Loughlin Is 'Absolutely Terrified' After Being Hit With New Charge,0.1904014846510107,0.2338680560811289,0.2121347703660698,0.21937919893775615
N995,foodanddrink,restaurantsandnews,10 of the best fast-food burger chains across the US Fast-food spots like Shake Shack and In-N-Out sell fresh burgers that keep customers coming back for more.,0.1904014846510107,0.2665543239491076,0.22847790430005915,0.2411700441830753
N20109,music,musicnews,Lady Gaga Says 'Fame Is Prison' -- And Has Fans Speculating If New Music Is on the Way The singer's fans are also wondering if she's talking about the pressures of the industry.,0.1904014846510107,0.2630962769239052,0.22674888078745795,0.23886467949960705
N21720,health,health-news,Juul accused of selling 1 million tainted vaping pods Former Juul senior vice president Siddharth Breja claims he was fired in March for raising concerns about contaminated pods,0.1904014846510107,0.2508803304200137,0.2206409075355122,0.23072071516367937
N32268,foodanddrink,foodnews,"I ate one of Meghan Markle's favorite foods from Toronto here's what I thought The food at Terroni was good and the prices were surprisingly affordable, but the service was disappointing.",0.1904014846510107,0.2717361953938704,0.23106884002244055,0.2446246251462505
N40944,news,newsus,"Family of toddler who fell from cruise ship 'utterly crushed' after grandfather charged The charge of negligent homicide was ""like pouring salt on an open wound"" for the girl's parents, the family's lawyer told NBC News.",0.1904014846510107,0.2600714390883886,0.22523646186969964,0.23684812094259594
N619,news,newsus,"Cornell student, 18, found dead in gorge after frat party, reports say A top Ivy League student was found dead Saturday afternoon in a New York gorge after he left a fraternity party and disappeared Thursday night, according to reports.",0.1904014846510107,0.2631910261845658,0.22679625541778825,0.23892784567338077
N34934,sports,golf,"20 years after Payne Stewart's tragic death, son Aaron carries his legacy Aaron Stewart spent his summers on the road as a PGA Tour kid. The behind-the-scenes visits at the Columbus Zoo during the Memorial Tournament stand out among his favorite memories as well as the ""music man"" under the big tree on Hilton Head Island.",0.1904014846510107,0.2545508696503101,0.2224761771506604,0.2331677413172103
N42570,news,newsus,"Woman dies after being hit by vehicle crossing northwest Fort Worth street, police say A 24-year-old woman died Wednesday after she was struck by a vehicle as she walked across a far northwest Fort Worth street, police said. Kristen Morton was hit at about 6:15 p.m. on Boat Club Road near Reef Point Lane, authorities said. The crash was an accident, a Fort Worth police spokesman said. Police did not describe the vehicle. Morton, who lived in White Settlement, was taken ...",0.1904014846510107,0.2887873644459228,0.23959442454846674,0.2559920711809521
N3577,health,health-news,Tennessee reports 49 cases of lung injury linked to vaping Tennessee health officials say they have received 49 cases of serious lung injury in people who use electronic cigarettes or other vaping devices.,0.1904014846510107,0.3037585422225313,0.247080013436771,0.2659728563653578
N41089,lifestyle,lifestylebuzz,"This Man's Rattlesnake Bite Is a Warning to Everyone to Take Animal Bites More Seriously You wouldn't think a baby rattlesnake could do so much damage, but Austin McGee knows better after almost losing his finger to one.",0.1904014846510107,0.2689788866850578,0.22969018566803426,0.24278641934037543
N60850,foodanddrink,newstrends,"Popeyes is bringing back the chicken sandwich--and also takes a swipe at Chick-fil-A FORT WORTH -- The much-loved Popeyes Louisiana Kitchen fried chicken sandwich returns Sunday, and the company's announcement was a hard kick to the gizzard for competitor Chick-fil-A. After a limited-time summer special turned into a $65 million marketing bonanza, Popeyes will return both the spicy and mild sandwiches -- and on Sunday, when Chick-fil-A is not even open. Popeyes' ...",0.1904014846510107,0.2664894798298218,0.22844548224041625,0.24112681477021808
N27919,sports,golf,Martin worries about amputation after breaking right leg Casey Martin's worst fear was realized earlier this month when he stepped awkwardly off a curb and fractured his right tibia.,0.1904014846510107,0.2521657232298498,0.22128360394043026,0.2315776437035701
N13893,foodanddrink,restaurantsandnews,"14 Weird Rules Fast-Food Employees Have to Follow Fast food may seem easy, but there are quite a few intricate rules employees have to follow.",0.1904014846510107,0.2927544878337489,0.2415779862423798,0.2586368201061695
N40640,foodanddrink,foodnews,"Foie Gras Is Banned by New York City Lutèce served it seared, with dark chocolate sauce and bitter orange marmalade. Le Cirque offered it in classic terrine form, but also served it with rabbit and bacon and made it the scene-stealer in a ravioli dish. But Lutèce closed in New York in 2004. Le Cirque shut its last Manhattan location in 2017. And foie gras, the calling card of fine French dining, is about to follow suit. The New York City Council overwhelmingly passed legislation on...",0.1904014846510107,0.2673749606897522,0.22888822267038145,0.24171713534350503
N56537,foodanddrink,restaurantsandnews,"Why Smoked Bologna Is the Secret Star of Oklahoma Barbecue No barbecue plate in the Sooner State is complete without a side of ""Oklahoma tenderloin"".",0.1904014846510107,0.2961007205049254,0.24325110257796806,0.2608676418869538
N18086,foodanddrink,restaurantsandnews,"I Would Go Back to This Missouri Theme Park Just for the Snacks The excellent food at Silver Dollar City is one of many reasons that Branson, Missouri is an essential stop on any Midwest road trip.",0.1904014846510107,0.2819841131835202,0.23619279891726544,0.25145657033935037
N9803,finance,markets,"Jeff Bezos is set to lose his crown as world's richest person Jeff Bezos is about to relinquish the title of world's richest person to Bill Gates, as Amazon.com Inc. stock tumbled in late trading Thursday.",0.1904014846510107,0.2172236874683079,0.2038125860596593,0.20828295319587548
N59254,news,newsus,Judge rules deputies can't put 'no trick-or-treat' signs in sex offenders' yards A federal judge has ruled deputies in a Georgia county cannot put warning signs where registered sex offenders live.,0.1904014846510107,0.2531388826207444,0.22177018363587755,0.23222641663083315
N56630,finance,markets,China asks WTO for $2.4 billion sanctions against U.S. in latest clash China asks WTO for $2.4 billion sanctions against U.S. in latest clash,0.1904014846510107,0.2283197951065732,0.20936063987879194,0.21568035828805238
N61186,music,music-celebrity,Infected toe stops R. Kelly from attending court hearing CHICAGO (AP)   R. Kelly's lawyer has told a federal judge that an infected toe prevented the R&B star from attending a hearing in his child pornography case in Chicago. Kelly is detained at a jail two blocks from the courthouse and had been expected to appear at Wednesday's status hearing. But defense lawyer Steve Greenberg said one of Kelly's toenails had to be removed as treatment and Kelly worried someone might trample on his toe as he was...,0.1904014846510107,0.2750677250268737,0.2327346048389422,0.24684564490158606
N38495,health,health-news,"Poultry Recall After 22 Tons of Vietnamese Products Distributed Without Import Inspection In addition to failing to go through the usual food inspection processes, the products came from Vietnam a country that is not eligible to export poultry products to the U.S. or any meat products aside from catfish.",0.1904014846510107,0.2846077499391337,0.2375046172950722,0.25320566150975937
N45794,news,newscrime,"Four flight attendants were arrested in Miami's airport after bringing in thousands in cash, police say Four American Airlines flight attendants were arrested at the Miami International Airport and charged with money laundering after bringing large amounts of cash into the country, police said.",0.1905256579709001,0.2901472167764722,0.24033643737368615,0.25694003050794817
N14340,news,newsworld,"Security camera spots SOS from woman lost for three days in Australia There was a bit of euphoria that, wow there's our break, police said of the the SOS message.",0.1920272722499406,0.2720930920280378,0.23206018213898919,0.24540448543533872
N41244,entertainment,entertainment-celebrity,"Keanu Reeves holds hands with Alexandra Grant as the Internet swoons, plus more news The Internet is even more in love with Keanu Reeves after Alexandra Grant PDA. Plus, more celebrity news for Nov. 5, 2019.",0.1921676495912155,0.2605056204075627,0.2263366349993891,0.2377262968021136
N12576,news,newsworld,Chinese pilot suspended after woman poses in cockpit with drinks The unidentified woman is seen sitting in the captain's seat with drinks in front of her on an Air Guilin flight in January this year.,0.1921676495912155,0.2804146544598198,0.23629115202551765,0.250998986170285
N13137,video,popculture,"Singer stands up to heckler who told her to take shirt off After being heckled on stage and told to ""free the nips"" at a concert in Texas, singer Maggie Rogers voiced her anger about the harassment.",0.1932533064286572,0.2503321338647274,0.22179272014669232,0.23130585805270398
N27235,news,newspolitics,"Hillary Clinton backs out of DC event also set to include Tulsi Gabbard, Kirstjen Nielsen: report Hillary Clinton has backed out of a Friday appearance at an event also scheduled to include Democratic presidential candidate Tulsi Gabbard, among other guests, according to a report.",0.1932533064286572,0.1801972537774709,0.18672528010306405,0.18454927132786633
N37378,news,newsus,"Wisconsin jury awards $450,000 in Sandy Hook defamation case A jury in Wisconsin has awarded $450,000 to the father of a boy killed in the 2012 Sandy Hook school shooting after he filed a defamation lawsuit against conspiracy theorist writers who claimed the massacre never happened.",0.1932533064286572,0.2447739672255167,0.21901363682708697,0.22760041362656352
N39762,news,newscrime,"Woman stabbed to death by son in Plainville, police say A 21-year-old man is accused of stabbing his mother to death in Plainville. Police were called at 10:14 p.m. Thursday to the home at 37 Landau Road. The victim, 51-year old Carlyn D. Murphy, was found dead with apparent stab wounds. Her son, Sean Murphy, 21, who lived in the home, was taken into custody at Patriots Place in Foxborough. Plainville police said they do not believe that there is any ongoing threat or danger to the public. Sean...",0.1932533064286572,0.2646048847545087,0.22892909559158298,0.24082102531255822
N58580,tv,tv-gallery,"17 Hallmark Movies That Are Totally Worth Watching From festive flicks to cheesy romantic comedies, here are all the best Hallmark movies that are worth watching at least once.",0.1932533064286572,0.3083981341921314,0.2508257203103943,0.27001652493764
N29499,news,newsus,"California governor signs measure banning 'lunch shaming' SACRAMENTO, Calif. (AP)   California's governor has signed into law a bill that guarantees all students a state-funded meal of their choice, even if their parent or guardian has unpaid meal fees.",0.1932533064286572,0.2610240076898922,0.22713865705927472,0.23843377393614718
N35022,lifestyle,lifestylebuzz,"Bed, Bath and Beyond Pulls 'Blackface Pumpkins From the Shelves The pumpkins were removed from stores after an upstate New York community filed complaints.",0.1932533064286572,0.2464989812939042,0.2198761438612807,0.22875042300548853
N38118,tv,tv-celebrity,Uh-Oh! Carrie Ann Inaba Falls on 'Dancing With the Stars' Uh-Oh! Carrie Ann Inaba Falls on 'Dancing With the Stars',0.1932533064286572,0.2433273200008173,0.21829031321473724,0.22663598214343061
N459,news,newscrime,Serial stowaway arrested at Chicago airport for 2nd time Hartman was taken into custody was charged with one felony count of criminal trespass,0.1932533064286572,0.281675510374535,0.2374644084015961,0.2522014423925757
N24691,news,newsus,"Bill Macy, Bea Arthur's Husband on 'Maude,' Dies at 97 Norman Lear saw him choking on a chicken bone and brought him to Hollywood. The actor also appeared in 'My Favorite Year' and 'The Late Show.'",0.1932533064286572,0.2772235143411448,0.235238410384901,0.24923344503698225
N35452,weather,weathertopstories,"'Potentially historic wind event' over weekend could inflame California wildfires Northern California could experience a potentially historic wind event this weekend, which could have a dangerous effect on wildfires.",0.1932533064286572,0.2792009548484089,0.23622713063853307,0.2505517387084917
N1258,travel,travelnews,"Tourist in Venice kidnaps local woman in row over exchange rate The 46-year-old Israeli was unhappy about the sum of money he was given, and reacted by locking himself in the currency exhange with the worker",0.1932533064286572,0.2557149904048383,0.22448414841674774,0.23489442907944458
N37083,news,newsus,Police warn against THC-laced Halloween candy Police in Pennsylvania are urging parents to be extra cautious with their Halloween candy this year.,0.1932533064286572,0.2745956372197609,0.23392447182420906,0.24748152695605963
N24492,news,newsus,"Police: Off-Duty Dallas Officer Mistakenly Shoots, Injures Adult Son Thinking He Was An Intruder An off-duty Dallas officer accidentally shot and injured his adult son in DeSoto Saturday evening, police say.",0.1932533064286572,0.2723995188333984,0.23282641263102782,0.24601744803181802
N16190,foodanddrink,newstrends,We Tried Cinnamon Coke And Cranberry Sprite And One Of Them Is About To Become Your New Favorite Here's how we felt about them.,0.1935464961774601,0.2773800693455335,0.2354632827614968,0.2494355449561757
N44559,health,health-news,Photo of emotional nurse after 'particularly hard day' goes viral Her sister revealed that she had just wrapped up four days worth of work that included assisting in the delivery of a stillborn baby.,0.1935464961774601,0.2811465203601704,0.23734650826881526,0.25194651229926696
N27526,news,newsus,"1 dead, 8 others hospitalized in Salmonella outbreak likely tied to ground beef The CDC said the latest Salmonella outbreak is not tied to one type or brand of ground beef.",0.1935464961774601,0.278451111828727,0.23599880400309353,0.2501495732783047
N62209,foodanddrink,foodnews,"Popeyes mocks Chick-fil-A for National Sandwich Day blunder, reignites sandwich wars Popeyes is mocking Chick-fil-A as the chicken sandwich wars heat up once again before National Sandwich Day.",0.1935464961774601,0.2616618061031648,0.22760415114031246,0.23895670279459658
N21817,news,newspolitics,Two House Democrats break ranks with Pelosi on impeachment rules vote Two House Democrats broke ranks with their party leadership on Thursday's highly-contentious vote.,0.1935464961774601,0.2134356447733533,0.2034910704754067,0.20680592857472224
N21899,foodanddrink,tipsandtricks,Here's How to Correctly Store Potatoes to Keep Them Fresh Potatoes are a staple food in most people's diets for good reason.,0.1935464961774601,0.3052366993885271,0.24939159778299358,0.2680066316515048
N26176,finance,finance-companies,"Walmart Sparks Panic and Confusion in the Dish-Soap Aisle Procter & Gamble didn't make enough dish soap, and Walmart is letting all its customers know about it.",0.1935464961774601,0.2440397709056325,0.21879313354154628,0.22720867932957506
N42470,finance,finance-companies,G.M. Workers Approve Contract and End U.A.W. Strike The longest nationwide strike against General Motors in half a century ended on Friday after a solid majority of the company's union members delivered their support for the four-year contract hammered out by their leaders. The United Auto Workers union emerged with substantial wage increases and succeeded in ending a two-tier wage structure that had been a particular irritant in its ranks. It also won commitments to new G.M. investments in...,0.1935464961774601,0.266824215884301,0.23018535603088053,0.24239830931535405
N32893,weather,weathertopstories,"A Northeast storm is intensifying into a bomb cyclone, forecasters say A bomb cyclone is taking shape along the Eastern Seaboard and starting to make itself felt in the Northeast.",0.1935464961774601,0.2698404853443923,0.2316934907609262,0.2444091556220816
N28624,foodanddrink,foodnews,"When I moved from China to the US, eating out became so much more expensive I had to break the habit. Here's how I did it. Instead of feeling like I was depriving myself, I set out to manage my restaurant addiction by figuring out how to recreate what I loved about them.",0.1935464961774601,0.2626301767146665,0.2280883364460633,0.23960228320226434
N43627,news,newsus,"The Justice Department is fishing for details about the anonymous 'resistance' op-ed writer The author, identified only as ""a senior official in the Trump administration,"" is set to release a tell-all book this month.",0.1935464961774601,0.1913169227164017,0.1924317094469309,0.1920601138700878
N5283,foodanddrink,foodnews,"For the first time ever, a US cheese is named best in the world Forget the American love affair with Cheez Whiz, blocks of Velveeta and pasteurized processed cheese food slices. An organic blue cheese from Oregon has been named the world's top cheese.",0.1935464961774601,0.2815004951484665,0.23752349566296327,0.2521824954914644
N55742,sports,mma,President Donald Trump gets mixed reaction at UFC 244 in historic milestone for MMA ,0.1935464961774601,0.1823789501291658,0.18796272315331294,0.18610146547859724
N4614,foodanddrink,foodnews,"Orange vs. White Cheddar Cheese: What's The Difference, Anyway? Americans love cheese, and we're eating more of it than ever: about 37 pounds per year per capita, in fact, more than double what we ate four decades ago, according to the U.S. Department of Agriculture.",0.1935464961774601,0.2736500089865963,0.2335982525820282,0.24694883805021756
N61813,sports,football_nfl,"Redskins' Williams reveals cancer scare, explains holdout ASHBURN, Va. (AP)   Washington Redskins tackle Trent Williams revealed a cancer diagnosis that played a part in his lengthy holdout and distrust of the team's medical staff and the organization. Williams on Thursday said he told the team of the medical issue six years ago, and the growth on his head grew substantially over time. The 31-year-old said he had a tumor removed from his skull and needs to get checked out every six months to make sure...",0.1935464961774601,0.2475010492277413,0.2205237727026007,0.2295161982109809
N22545,foodanddrink,foodnews,"The Search for a Gender Neutral Drive Thru Toy When families are asked whether a kid's meal is for a boy or girl, it means kids get toys based on stereotypes not their actual interests. Is it time to rethink drive-thru toys?",0.1935464961774601,0.2685917096157749,0.23106910289661747,0.24357663846966998
N33571,foodanddrink,recipes,"The Braised Onion Pasta I Only Make for People I Love There are, for me, two kinds of recipes, one for each mood: The first kind is quick and easy, like the 30-minute lemon chicken I make when I come home from work hungry and don't want to think too hard about what I'm feeding myself. The second is for when I'm feeding someone else, usually something special I'm excited to share; these take more time, and just a little bit more care. Like this braised onion pasta, which takes at least two hours to...",0.1935464961774601,0.3049528926607937,0.24924969441912687,0.26781742716634915
N55064,news,newspolitics,"Trump Taxes: Appeals Court Rules President Must Turn Over 8 Years of Tax Returns A federal appeals panel said on Monday that President Trump's accounting firm must turn over eight years of his personal and corporate tax returns to Manhattan prosecutors, a setback for the president's attempt to keep his financial records private.",0.1935464961774601,0.198772740843938,0.19615961851069905,0.19703065928844538
N51810,foodanddrink,newstrends,"The Gooey Sticky Buns of Hit Boston Bakery, Flour, Pop Up in NYC Saturday Plus, Peter Luger's zero-star review is now a Broadway punchline   and more intel",0.1935464961774601,0.258957060848561,0.22625177851301054,0.23715353929152738
N60956,lifestyle,shop-holidays,"What to Buy the Guy Who Is Impossible to Shop For Indulgences, gadgets, and the things he might never splurge for on his own top our list of gifts for the guy who is impossible to shop for. The post What to Buy the Guy Who Is Impossible to Shop For appeared first on Reader's Digest.",0.1935464961774601,0.3088573244516946,0.25120191031457734,0.27042038169361643
N32208,foodanddrink,foodnews,"A Seattle man broke into an office building, ate $200 worth of chocolate, and collapsed in a sugar coma When security arrived, they found the man sprawled out on an office coach stripped of his jacket and shoes.",0.1935464961774601,0.2618354577067793,0.2276909769421197,0.2390724705303396
N54522,entertainment,celebrity,"Ben Affleck has a new girlfriend after using the Raya dating app, plus more celeb love life news for late October 2019 Meg Ryan and John Mellencamp call it quits, Halsey and Evan Peters get serious, James McAvoy weds, Meghan King Edmonds accuses hubby of cheating and more.",0.1935464961774601,0.2408037432142535,0.2171751196958568,0.22505132753532237
N41797,autos,autosenthusiasts,"Tent Spent: We Try Luxury Camping in a $100,000 Airstream Call us crazy, but we actually enjoy traditional camping activities such as gathering firewood, pitching a tent, and peeing in the woods.",0.194037914820508,0.2776239658171813,0.23583094031884466,0.24976194881829022
N23887,news,newsus,"Video allegedly shows police officer roughing up 11-year-old girl There's no excuse for the way this girl was treated, the Farmington police chief said.",0.194037914820508,0.2631867457068438,0.2286123302636759,0.24013713541139853
