ID,category,sub_category,content,collaborative_rec,content_rec,mean,two_one
N31099,travel,traveltripideas,Harry Potter's Childhood Home in England Is Now on Airbnb I think I can die happy now.,0.146725569297762,0.2740922449239928,0.2104089071108774,0.23163668638191587
N53118,health,health-news,Colorado Mom's Touching Facebook Post Beautifully Explains Why We Shouldn't Suffer in Silence One Colorado mom's Facebook post recently went viral for showing how much asking a friend for help can make the difference when you're feeling alone.,0.146725569297762,0.2594074148245545,0.20306649206115823,0.22184679964895698
N56438,news,newsus,The 'race whisperer' A black activist convinced a neo-Nazi he'd save him from legal ruin. Then the real plan got underway.,0.146725569297762,0.2345917233234663,0.19065864631061416,0.2053030053148982
N2183,tv,humor,"The top female comedians working in film and television today Film and television, specifically in the comedic vein, is currently blessed with a bevy of talented women. The transition from writing standup material to award-winning, mainstream masterpieces has never been so visible, and the impressive canon of female voices peppering the entertainment world is staggering.",0.146725569297762,0.2609480976736776,0.2038368334857198,0.2228739215483724
N19874,health,wellness,"How Your Hormones, Weight, or Medication Could Be Killing Your Sex Drive Your libido can suffer for some unexpected reasons. And remember, there is no ""normal"" when it comes to sexual desire.",0.146725569297762,0.3118035036912121,0.22926453649448708,0.25677752556006206
N6576,health,weightloss,16 Women Reveal Exactly How They Got Six-Pack Abs What does it really take to get six-pack abs? These women can tell you exactly what worked for them.,0.146725569297762,0.2975555738130443,0.22214057155540318,0.24727890564128355
N59774,foodanddrink,restaurantsandnews,"The Unreasonable Lengths Restaurant Workers Have to Go to Take Time Off From working doubles in advance to finding their own replacements, here's how unsalaried shift workers manage when it comes to vacation.",0.146725569297762,0.2661490088474039,0.20643728907258296,0.22634119566418992
N21389,news,newsworldpolitics,Rep. Katie Hill's lawyers send cease-and-desist letter to DailyMail.com over nude photos The website is the second to publish alleged lewd photos of the Democratic congresswoman.,0.146725569297762,0.2189225977238023,0.18282408351078216,0.19485692158178886
N30103,travel,traveltripideas,"A network of 28 tiny, one-bed hotels in Amsterdam is being called the most beautifully designed hotel of 2019   and it consists of a series of converted bridge houses. Take a look inside. Amsterdam's bridge hotels, located in historic houses on and near bridges, are a tiny house lover's dream ⁠  and they just won a major design award.",0.146725569297762,0.3081671079504658,0.2274463386241139,0.25435326173289785
N56444,health,wellness,"Jameela Jamil Called Out a New TV Show Where Judges Decide If Contestants ""Deserve"" Plastic Surgery The Good Place star had a lot to say after learning about ""The Surjury,"" a new British reality series about people competing against one another to win free plastic surgery.",0.146725569297762,0.2356929765088685,0.19120927290331524,0.20603717410516634
N63248,lifestyle,lifestylecelebstyle,"Hailey Baldwin wore three show-stopping dresses during her wedding, and put a unique twist on each one Hailey Baldwin's three custom gowns were designed by Virgil Abloh of Off-White, Vera Wang, and Ralph & Russo.",0.146725569297762,0.2783654070024932,0.21254548815012758,0.23448546110091611
N8237,foodanddrink,restaurantsandnews,16 Secrets Olive Garden Doesn't Want You to Know Here's everything you've wanted to know about your favorite breadstick-serving restaurant.,0.146725569297762,0.276123092852864,0.211424331075313,0.23299058500116335
N62471,sports,football_nfl,"Trent Williams fails physical, experiencing discomfort with helmet Washington Redskins tackle Trent Williams' health situation has managed to get stranger after he reported to the team.",0.146725569297762,0.2633765649596751,0.20505106712871857,0.2244928997390374
N21019,autos,autosnews,"Ford Baby Bronco Bare Body Allegedly Leaked In Exclusive Photo Ford had no comment, but it sure looks like the real deal.",0.146725569297762,0.2708958236851154,0.20881069649143869,0.22950573888933093
N12785,sports,baseball_mlb,"With Carlos Beltran hire it's clear the Mets learned nothing from the Mickey Callaway mess In hiring Carlos Beltran to guide their fortunes next year, the Mets hierarchy once again out-thought themselves by going ""outside-the-box"" for someone who had never managed anywhere before.",0.146725569297762,0.2427484312049396,0.19473700025135082,0.21074081056921373
N30974,sports,basketball_ncaa,"Police identify 2 suspects in murder of Andre Emmett last month Two men accused of killing former Texas Tech and NBA player Andre Emmett were identified by Dallas police on Monday, the Dallas Morning News reported.",0.146725569297762,0.2643250239689576,0.20552529663335978,0.2251252057452257
N51457,foodanddrink,restaurantsandnews,Restaurants Are Dealing With an Avalanche of Special Requests. One Chef Has Had Enough. It's not all about you.,0.146725569297762,0.259632183226443,0.20317887626210251,0.221996645250216
N64983,news,newsus,"Buffalo Wild Wings fires workers allegedly involved in racist incident Multi-racial group of 18 in Naperville, Illinois eatery was allegedly asked to move tables to get farther from frequent diner who was ""racist""",0.146725569297762,0.2674754497268861,0.20710050951232406,0.22722548958384473
N41298,music,music-celebrity,"Katy Perry sued for $150k by photo agency for 3-year-old pic Katy Perry allegedly posted a paparazzi photo without paying the fee, a photo agency claims.",0.146725569297762,0.2614245089493808,0.2040750391235714,0.22319152906550788
N2018,entertainment,celebrity,"Debunking the week's tabloid stories: Nov. 1, 2019 A round-up of the week's tabloid stories that totally missed the mark.",0.146725569297762,0.2194925581951249,0.18310906374644345,0.19523689522933727
N16344,entertainment,celebrity,Stars   They're Just Like Us! Stars   They're Just Like Us!,0.146725569297762,0.265090178003711,0.20590787365073648,0.22563530843506133
N29561,lifestyle,lifestylebuzz,"High school cheerleaders go off-script to help man propose to their coach A school's cheer squad coach was surprised when her students went off-script and held up four signs during a routine that read, ""Will you marry me?""",0.146725569297762,0.2691394251181994,0.20793249720798068,0.22833480651138693
N47922,music,music-celebrity,"Allegations against entertainer Todrick Hall are piling up, from stories of nonpayment to accusations of backlash for reporting sexual assault Todrick Hall became prominent in Broadway musicals, for his friendship with Taylor Swift, and more. Now, accusations against him are piling up.",0.146725569297762,0.2305158404991778,0.1886207048984699,0.20258575009870589
N10340,foodanddrink,tipsandtricks,"The French Grandmother's Clever Trick to Keeping Fruit Flies Away When I worked in Paris as an au pair, I marveled at how the French seemed to have it all figured out. The family's grandmother always set the table with the good silver even on a Tuesday. I was instructed to pick up fresh, fluffy chouquettes from the boulangerie for the kids' after-school snack instead of, I don't know, granola bars (which is what I would've gotten). It was almost irritating how everyone around me seemed to have effortlessly...",0.146725569297762,0.2816961540702671,0.21421086168401454,0.23670595914609874
N40526,music,music-celebrity,Miranda Lambert Shares the Surprising Story of Her and Brendan McLoughlin's Meet-Cute The Pistol Annie's are to thank for introducing the country singer to her husband,0.146725569297762,0.2801878951682429,0.21345673223300243,0.23570045321141592
N15122,tv,tv-celebrity,Tamron Hall says she 'never dealt' cocaine after reports say she confessed to doing so Tamron Hall issued a statement in response to the Daily Mail reporting that she confessed to facilitating the sale of cocaine as a teenager.,0.146725569297762,0.2637651517144375,0.20524536050609976,0.22475195757554567
N61070,news,newscrime,Man arrested in 1993 cold case rape after he's identified by DNA: Police The suspect was 28 at the time and not known to the victim.,0.146725569297762,0.296473646930226,0.22159960811399398,0.24655762105273799
N32109,travel,travelnews,"Cell Phone Forces Flight Diversion to Ireland When no one could identify the owner of the phone, the captain diverted the flight.",0.146725569297762,0.2667467493557487,0.20673615932675538,0.2267396893364198
N42791,tv,tvnews,"Eva Longoria: 'Latinas Are the Last to Find Their Voices Amplified' Eva Longoria delivered a powerful and moving keynote at TheWrap's Power Women Summit in Los Angeles on Friday, saying that people in Hollywood are ""largely responsible for much of the unconscious bias that is against people of color"" and that ""Latinas are the last to find their voices amplified in this industry."" ""What studies show is that we are being erased,"" Longoria told a room of 2,000 attendees. ""This goes beyond underrepresentation. When...",0.146725569297762,0.2530388338740647,0.19988220158591335,0.21760107901529713
N54449,news,newsus,"Third Indiana Catholic school employee fired in growing scandal over LGBTQ staff Unlike the others fired from Indianapolis-area Catholic schools, Kelley Fisher is straight and only expressed support for her fired colleagues.",0.146725569297762,0.2560243545787486,0.20137496193825533,0.2195914261517531
N63554,travel,traveltripideas,"It took me 96 hours to ride an Amtrak train from coast to coast. I'd do it again in a heartbeat. Four days aboard a cross-country Amtrak train was so much more relaxing than flying. If I had the time, I'd do it on every trip.",0.146725569297762,0.319243730897188,0.232984650097475,0.26173767703071266
N40442,finance,markets,"25 bathrooms? Former Clinton labor secretary says Bezos' mansion helps make case for soaking the rich Robert Reich served as labor secretary in the Clinton administration, where he was named by Time Magazine as one of the 10 most effective cabinet secretaries of the 20th century. He's a Rhodes scholar, a best-selling author, a documentarian and a professor of public policy at UC Berkeley. What he's not, apparently, is a fan of billionaires clinging to their riches.",0.146725569297762,0.1975273107693463,0.17212644003355415,0.18059339694548487
N30827,foodanddrink,restaurantsandnews,"These are the 11 classic food-court chains with the most locations From Panda Express to Auntie Anne's to Baskin-Robbins, these are the 13 classic food-court chains with the most US locations.",0.146725569297762,0.2784257770659533,0.21257567318185766,0.23452570780988952
N61972,entertainment,entertainment-celebrity,"New details on why Meg Ryan, John Mellencamp split, plus more news Meg Ryan and John Mellencamp's marriage plans may have prompted their split. Plus, more celebrity news for Nov. 4, 2019.",0.146725569297762,0.2502930312505985,0.19850930027418023,0.21577054393298634
N31802,entertainment,celebrity,Stars turning 50 in 2019 Find out which celebrities are celebrating the big 5-0 in 2019!,0.146725569297762,0.2642956368623966,0.2055106030800793,0.22510561434085175
N54536,news,newsus,4 High School Students Killed in Texas Car Crash That Also Injured 3: 'We Grieve Together' 4 High School Students Killed in Texas Car Crash,0.146725569297762,0.2733309687547456,0.21002826902625382,0.23112916893575108
N11163,news,newspolitics,"Kobach's campaign paid Kansan known to post racist comments on white nationalist site Kansas Republican Kris Kobach's Senate campaign paid an Olathe man who regularly posted hateful comments about Jews and racial minorities on a white nationalist website. Kobach's campaign paid Joe Suber $500 for field coordinating services in September, according to the Republican's latest campaign finance report. Suber also filed the paperwork with the state of Kansas creating ...",0.146725569297762,0.2265092635504033,0.18661741642408264,0.19991469879952287
N56853,news,newsworld,"Trump orders withdrawal of U.S. forces from northern Syria, days after Pentagon downplays possibility U.S.-allied Syrian Kurdish fighters announced late Sunday that the Syrian Army would deploy along the Turkish border to ""liberate the areas that the Turkish army has entered with its mercenaries.""",0.146725569297762,0.1578068978219543,0.15226623355985816,0.15411312164722354
N50258,news,newspolitics,Trump feuds with Susan Rice over Syria President Trump exchanged barbs with the former Obama administration national security adviser Susan Rice over Syria after she criticized his policy.,0.146725569297762,0.1491350515338512,0.14793031041580662,0.14833189078848813
N22479,health,medical,"Frequent Urination At Night: A Sign Of Serious Health Problem Nocturia forces you to wake up during the night to urinate, a condition that could be a sign of serious health problems, such as a tumor, congestive heart failure and kidney failure.",0.146725569297762,0.3213030682835117,0.23401431879063683,0.2631105686215951
N58744,lifestyle,voices,"I Gave Up On Love, And It Was One Of The Best Decisions I Ever Made At the end of our date in August 2018, Justin escorted me to my car, where henervously kissed me. When I kissed him back, he cheered, pumping his fists inthe air like he'd won something. I walked from the curb to my car, and when Iturned around, he was watching me, beaming.""I just want to make sure you get to your car safely,"" he said, even though Iwas less than a yard away.I slipped into the driver's seat, thrilled that our second date had gone...",0.146725569297762,0.266549597686241,0.2066375834920015,0.22660825489008132
N50479,health,wellness,"Items you need to stop sharing with others right now Items you should never share for your health and safety include everyday items like toothbrushes, earbuds and lipstick.",0.146725569297762,0.2882157782992685,0.21747067379851526,0.24105237529876633
N22627,news,newsus,Family Members Plead for Help in Search for Missing Atlanta College Student: 'Just Come Home' Family Pleads for Help in Search for Missing College Student,0.146725569297762,0.2806000559169681,0.21366281260736508,0.23597522704389942
N58091,finance,finance-companies,Ex-Credit Suisse Banker Says Secret Affair Helped Fuel $45 Million Fraud A former Credit Suisse Group AG banker told a federal jury in New York that his decision to take millions of dollars in bribes was fueled in part by his secret love affair with a subordinate.,0.146725569297762,0.2451555892321827,0.19594057926497235,0.2123455825873758
N13225,travel,traveltripideas,5 Reasons Destin Is a Great Family Vacation Destination The calm emerald waters and family-friendly attractions of the area make Destin a top spot for a fall or winter getaway.,0.146725569297762,0.2940644024815115,0.22039498588963674,0.24495145808692834
N12709,lifestyle,lifestylebuzz,"Twitter Had Feelings About Mark Zuckerberg's Micro-Bangs Facebook founder Mark Zuckerberg debuted a new haircut on the House floor on Wednesday, and Twitter quickly took note with an avalanche of memes and quips.",0.146725569297762,0.2124363540006209,0.17958096164919146,0.19053275909966794
N63889,news,newspolitics,Trump Attorneys Assert Immunity From Broad Sweep of Law Legal filings and lawyers' statements show an attempt to put President Trump beyond legal reach while in office.,0.146725569297762,0.211801189185162,0.17926337924146202,0.190109315889362
N36593,foodanddrink,foodnews,"How the Boston cream pie became a beloved dessert A product of the longest continually operating hotel in the United States, the Boston cream pie combines sponge cake, vanilla custard and chocolate icing to form a beloved American dessert.",0.146725569297762,0.2926730019254344,0.21969928561159818,0.24402385771621027
N22614,sports,football_ncaa,Predicting which of college football's 10 undefeated teams will lose in Week 9 How many teams will still have a perfect record after Week 9?,0.146725569297762,0.2701130415538435,0.20841930542580278,0.2289838841351497
N39235,news,newscrime,"Florida woman allegedly flees 2 car crashes, kills driver in 3rd crash A Florida woman who killed a 53-year-old man after running a red light and smashing into his Lexus on Saturday morning was in the process of fleeing two earlier car accidents when she caused the fatal collision, police said.",0.146725569297762,0.273282580243354,0.210004074770558,0.23109690992815668
N25158,lifestyle,lifestyleroyals,Kate Middleton Takes Prince George and Princess Charlotte Halloween Shopping at Local Supermarket Kate Middleton Takes George and Charlotte Halloween Shopping,0.146725569297762,0.2570202540948902,0.2018729116963261,0.22025535916251415
N37123,lifestyle,lifestylesmartliving,"17 Things You Should Never Do During a Conversation Want to make sure every conversation you have goes well? Begin with avoiding these 17 things you should never do, according to etiquette experts.",0.146725569297762,0.2783456238981684,0.21253559659796523,0.2344722723646996
N64554,entertainment,entertainment-celebrity,"Meghan King Edmonds, Jim Edmonds' Nanny Denies Cheating Allegations Meghan King Edmonds, Jim Edmonds' Nanny Denies Cheating Allegations",0.146725569297762,0.2466291339481731,0.19667735162296757,0.2133279457313694
N2078,tv,tv-celebrity,"Rainbow Baby! Shawn Johnson, Andrew East Welcome 1st Child After Miscarriage Rainbow Baby! Shawn Johnson, Andrew East Welcome 1st Child After Miscarriage",0.146725569297762,0.2889747613700791,0.21785016533392054,0.24155836401264008
N56290,foodanddrink,tipsandtricks,The Secret Ingredient for Sausage Gravy That's Out of This World Transform your gravy with this $1 ingredient,0.146725569297762,0.2924295714368636,0.2195775703673128,0.24386157072382975
N43374,news,newspolitics,Trump goes on Twitter tear after White House official condemns his Ukraine call President Donald Trump launched a sustained online offensive after details emerged of damaging congressional testimony by a senior White House official.,0.146725569297762,0.1841982694954717,0.16546191939661686,0.17170736942956846
N59469,lifestyle,lifestyleroyals,"Every outfit Duchess Kate has worn in 2019 See Kate Middleton's style choices this year from glam gowns and coat dresses to re-wears, tiaras and hats.",0.146725569297762,0.2936927594345693,0.22020916436616567,0.24470369605563352
N6285,finance,personalfinance,4 habits that could wreck your finances beyond repair Avoid these at all costs.,0.146725569297762,0.2675855989300645,0.20715558411391327,0.22729892238596366
N28074,lifestyle,lifestylefamilyandrelationships,"Woman Texts Dead Father's Phone for 4 Years & Finally Receives an Emotional Reply The pain of losing a parent, especially at a young age, is one that never really goes away.",0.146725569297762,0.257855736035425,0.20229065266659352,0.22081234712287068
N51503,sports,football_ncaa,"Bill Plaschke: Mike Bohn brings USC integrity, which means he can't hire Urban Meyer LOS ANGELES_You ever heard of Mike Bohn? Me neither, and that's a good thing. The University of Southern California is apparently set on naming Bohn as its new athletic director, the smart hiring of a man who embodies the most important attribute for the new leader of the Trojans family. He's a complete stranger. He never played football at USC. He never coached football at USC. He never ...",0.146725569297762,0.2340885979589082,0.1904070836283351,0.2049675884051928
N54842,news,newsus,"Mississippi woman found after being missing for days by writing S.O.S. with rocks S.O.S spelled out with rocks saved a woman missing in a national park for days, according to a release from the National Park Service.",0.1521406312277823,0.2839464523220226,0.21804354177490243,0.2400111786239425
N61005,sports,football_nfl,Randy Moss takes a perfect dig at Joe Buck's infamous 'disgusting act' call ,0.1544347449972825,0.2487911599091419,0.2016129524532122,0.21733902160518878
N33502,finance,markets,"China's trade with US shrinks in October despite optimism BEIJING (AP)   U.S.-Chinese trade contracted again in October, despite optimism about possible progress in talks aimed at ending a tariff war that threatens global economic growth.",0.1575556931578026,0.2234160040640499,0.19048584861092627,0.2014625670953008
N60340,lifestyle,lifestyleroyals,"Here's Why Harry and Meghan's Latest Interview Could Be the Final Straw for the Royal Family In Prince Harry and Meghan Markle's ITV interview on Oct. 20, they said they're unhappy living in a fishbowl. An insider reveals the palace's response.",0.1575556931578026,0.2304725921375433,0.19401414264767294,0.2061669591442964
N29867,travel,travelnews,Airline Passenger Faked Pregnancy by Stuffing Items Under Dress to Avoid Baggage Fee Woman Caught Faking Pregnancy to Avoid Baggage Fee,0.1575556931578026,0.2917371968255805,0.22464644499169156,0.2470100289363212
N18064,news,newspolitics,Top moments from Tuesday's Democratic debate Tuesday's debate in the key battleground state of Ohio was the first opportunity for Democratic candidates to gather on stage since the announcement of the impeachment inquiry against President Donald Trump.,0.1575556931578026,0.1780909664632177,0.16782332981051015,0.17124587536141267
N38868,finance,markets,"China's economic slowdown deepens, weighing on global growth BEIJING (AP)   China's economic growth sank to a new multi-decade low in the latest quarter as a trade war with Washington deepened a slump that is weighing on the global economy. Growth in the world's second-largest economy slipped to 6% in the three months ending in September, down from the previous quarter's 6.2%, data showed Friday. It was the weakest level since China started reporting data by quarters in 1993. The slowdown and weakening...",0.1575556931578026,0.2506925631275721,0.20412412814268735,0.2196469398043156
N39778,lifestyle,lifestyleroyals,"14 Parenting Rules the Royals Have to Follow Even in our modern times, there are some traditions British royal parents can't escape.",0.1575556931578026,0.2758000674373206,0.2166778802975616,0.2363852760108146
N55051,lifestyle,voices,I Am Unapologetically Raising My Daughter Without Religion ,0.1610057876085435,0.2692860550011575,0.2151459213048505,0.23319263253695283
N57318,news,newsus,"A 2,000-pound great white shark is swimming off the coast of Florida A great white shark that weighs over 2,000 pounds and measures 15 feet, 5 inches long has been swimming along the US East Coast.",0.1614038856033676,0.2896160368131414,0.2255099612082545,0.24687865307655013
N17463,news,newspolitics,"Democrats unveil procedures for Trump's impeachment inquiry, rebutting GOP attacks The resolution hands the lead role to the House Intelligence Committee and its chairman, Rep. Adam B. Schiff, who would have broad latitude to organize extended questioning of potential public witnesses.",0.162143920696803,0.1768403857078645,0.16949215320233374,0.17194156403751068
N14137,sports,football_nfl,MetLife Stadium searching for the famous black cat from 'Monday Night Football' ,0.162143920696803,0.2746105076953105,0.21837721419605674,0.23712164536247465
N64395,sports,football_nfl,J.J. Watt has sobering quote after season-ending injury The Houston Texans lost the rock of their team for the season during Sunday's win over the Oakland Raiders. Stud pass rusher and future Hall of Famer J.J.,0.162143920696803,0.2665256421681077,0.21433478143245535,0.23173173501100613
N16158,lifestyle,lifestylebuzz,"Nationals pitcher criticized for missing playoff game for daughter's birth Daniel Hudson said his family is his ""top priority"" after receiving criticism for missing a playoff game for the birth of his daughter.",0.162143920696803,0.2570927326307168,0.2096183266637599,0.22544312865274554
N34380,news,newspolitics,"House rejects GOP measure censuring Schiff Democrats in the House turned aside a GOP-led privileged resolution to censure House Intelligence Committee Chairman Adam Schiff (D-Calif.) on Monday in a 218-185 vote.Republicans and President Trump have increasingly targeted Schiff, a public face of the impeachment effort.They have taken issue with Schiff's exaggerated account of the details of President Trump's July 25 phone call with Ukrainian President Volodymyr Zelensky during a...",0.162143920696803,0.1911423588805426,0.1766431397886728,0.18147621281929607
N5211,sports,football_nfl,"Jets trade DL Leonard Williams to Giants The USC product is in the final year of his deal, and the Jets wanted to get something for him while they still could. The third-rounder they'll be getting from the Giants will presumably be an early third-rounder.",0.162143920696803,0.2537749455534477,0.20795943312512535,0.22323127060123282
N9441,sports,baseball_mlb,How President Trump reacted to getting loudly booed at the World Series Video surfaced of his reaction.,0.162143920696803,0.2118772638269541,0.18701059226187855,0.1952994827835704
N22570,foodanddrink,foodnews,'Ghost kitchens' are taking over fast-food chains from Chick-fil-A to Wendy's Wendy's became the latest fast-food chain to name-check ghost kitchens on Friday at the company's investor day.,0.162143920696803,0.2473885923612274,0.2047662565290152,0.21897370180641929
N4408,sports,football_nfl,"Patrick Mahomes already back at practice for Chiefs Although Reid didn't rule Mahomes out for the team's Week 8 game, it seems like a long-shot for the quarterback to get back onto the field that quickly.",0.162143920696803,0.2788309475789172,0.2204874341378601,0.2399352719515458
