ID,category,sub_category,content,collaborative_rec,content_rec,mean,two_one
N64631,news,newsworld,"She fought for human rights on a tiny island that banned guns. Then she was shot dead. Rachelle Bergeron had been the only prosecutor in Yap, a Micronesian island about 550 miles southwest of Guam.",0.191405516876874,0.2666297252925068,0.22901762108469037,0.2415549891539625
N58580,tv,tv-gallery,"17 Hallmark Movies That Are Totally Worth Watching From festive flicks to cheesy romantic comedies, here are all the best Hallmark movies that are worth watching at least once.",0.2124313511270311,0.2928587375888499,0.2526450443579405,0.26604960876824363
N65169,news,newsus,"Ohio voters express angst over impeachment Support for impeachment may be on the rise, but the view from central Ohio is strikingly complicated and nuanced.",0.2150936004114105,0.2511678711864861,0.2331307357989483,0.2391431142614609
N58801,sports,golf,"Greg Norman upset Tiger Woods didn't respond to his handwritten letter: ""Maybe Tiger just dislikes me"" Greg Norman tells Men's Health he hand delivered a letter to Tiger Woods following his Masters win in April, but never got a reply.",0.2150936004114105,0.2907607401569391,0.2529271702841748,0.2655383602417629
N40716,tv,tv-celebrity,Lori Loughlin Is 'Absolutely Terrified' After Being Hit With New Charge Lori Loughlin Is 'Absolutely Terrified' After Being Hit With New Charge,0.215979830744955,0.126709637353422,0.17134473404918849,0.156466368483933
N63889,news,newspolitics,Trump Attorneys Assert Immunity From Broad Sweep of Law Legal filings and lawyers' statements show an attempt to put President Trump beyond legal reach while in office.,0.2184626569127272,0.2517726243998611,0.23511764065629415,0.2406693019041498
N40442,finance,markets,"25 bathrooms? Former Clinton labor secretary says Bezos' mansion helps make case for soaking the rich Robert Reich served as labor secretary in the Clinton administration, where he was named by Time Magazine as one of the 10 most effective cabinet secretaries of the 20th century. He's a Rhodes scholar, a best-selling author, a documentarian and a professor of public policy at UC Berkeley. What he's not, apparently, is a fan of billionaires clinging to their riches.",0.2184626569127272,0.2716552754550644,0.2450589661838958,0.25392440260761867
N27235,news,newspolitics,"Hillary Clinton backs out of DC event also set to include Tulsi Gabbard, Kirstjen Nielsen: report Hillary Clinton has backed out of a Friday appearance at an event also scheduled to include Democratic presidential candidate Tulsi Gabbard, among other guests, according to a report.",0.2196964159080817,0.2651118887316361,0.2424041523198589,0.2499733977904513
N37083,news,newsus,Police warn against THC-laced Halloween candy Police in Pennsylvania are urging parents to be extra cautious with their Halloween candy this year.,0.2196964159080817,0.253715339973056,0.23670587794056885,0.24237569861806457
N1258,travel,travelnews,"Tourist in Venice kidnaps local woman in row over exchange rate The 46-year-old Israeli was unhappy about the sum of money he was given, and reacted by locking himself in the currency exhange with the worker",0.2196964159080817,0.2673786000733242,0.24353750799070295,0.25148453868491005
N39762,news,newscrime,"Woman stabbed to death by son in Plainville, police say A 21-year-old man is accused of stabbing his mother to death in Plainville. Police were called at 10:14 p.m. Thursday to the home at 37 Landau Road. The victim, 51-year old Carlyn D. Murphy, was found dead with apparent stab wounds. Her son, Sean Murphy, 21, who lived in the home, was taken into custody at Patriots Place in Foxborough. Plainville police said they do not believe that there is any ongoing threat or danger to the public. Sean...",0.2196964159080817,0.2594231506382586,0.23955978327317015,0.24618090572819964
N24492,news,newsus,"Police: Off-Duty Dallas Officer Mistakenly Shoots, Injures Adult Son Thinking He Was An Intruder An off-duty Dallas officer accidentally shot and injured his adult son in DeSoto Saturday evening, police say.",0.2196964159080817,0.2765120093148728,0.24810421261147725,0.2575734781792758
N21136,tv,tv-celebrity,Andy Cohen Says He Doesn't Feel Guilty About Joe and Teresa Giudice's Legal Fate After RHONJ Andy Cohen Doesn't Feel Guilt About Joe and Teresa Giudice,0.2220751481362948,0.2309829308923058,0.2265290395143003,0.22801366997363548
N56541,sports,baseball_mlb,"Soto, Nationals edge Astros in World Series opener Juan Soto homered onto the train tracks high above the left field wall and hit a two-run double as the Nationals tagged Gerrit Cole and the Houston Astros 5-4 Tuesday night in the World Series opener.",0.2225329861203074,0.2935555876419333,0.25804428688112035,0.26988138713472465
N27106,sports,football_ncaa,Brett McMurphy's College Football Bowl Projections After Week 8 This week's National Championship projection: LSU vs. Ohio State. The post Brett McMurphy's College Football Bowl Projections After Week 8 appeared first on Stadium.,0.2225823172053425,0.2686567896351794,0.24561955342026096,0.2532986321585671
N33622,finance,finance-companies,"Aluminum is replacing plastic as the greenest bottle The drive to turn products more eco-friendly is sweeping through the U.S. beverage market, with plastic being replaced in everything from red Solo cups to Coca-Cola Co. and PepsiCo Inc. water bottles.",0.2225823172053425,0.3109283896146951,0.26675535341001877,0.2814796988115776
N36229,news,newsworld,"US jets destroy anti-ISIS coalition base in Syria after withdrawal, official says Two Operation Inherent Resolve (OIR) F-15 jets destroyed a base that was the headquarters of the anti-ISIS coalition in northern Syria on Wednesday after it had been vacated, according to a military official.",0.2225823172053425,0.3014908880846031,0.2620366026449728,0.2751880311248496
N31820,news,newsworld,"What we know about the military dog injured in the al-Baghdadi raid The Belgian Malinois wounded during the raid targeting ISIS leader Abu Bakr al-Baghdadi hasn't been identified, but President Trump tweeted a declassified photo.",0.2225823172053425,0.2819767256749853,0.25227952144016386,0.2621785895184377
N28660,news,newsworld,"Erdogan vows to 'crush the heads' of Kurds if they don't withdraw; both sides trade blame for violating cease-fire Turkish President Recep Tayyip Erdogan on Saturday promised to ""crush the heads"" of the Kurds in Syria if they don't fall back from the border's safe zone, according to reports.",0.2225823172053425,0.3005638760167671,0.26157309661105477,0.2745700230796256
N58625,news,newspolitics,"Kamala Harris responds to memo on staff cuts: 'I fully intend to win' The senator's campaign is cutting jobs in its headquarters and shifting workers from New Hampshire, Nevada and California.",0.2225823172053425,0.2809452180937266,0.25176376764953456,0.26149091779759853
N8160,sports,football_ncaa,College Football Playoff Chase: Who's Still In The Hunt After Week 9? Which top teams have the best chance of getting into the College Football Playoff after Week 9?,0.2225823172053425,0.2502340031291237,0.2364081601672331,0.2410167744878633
N20933,sports,football_ncaa,"College football Week 7 takeaways: LSU offense shows it's for real LSU appears to finally have the offense to compete with Alabama, and other things Dan Wolken learned from Week 7 of the college football season.",0.2225823172053425,0.2581235507869746,0.24035293399615854,0.24627647292643057
N28467,news,newsworld,"Four-metre king cobra wrestled from sewer in Thailand A feisty four-metre (13-foot) king cobra was pulled from a sewer in southern Thailand in an hour-long operation, a rescue foundation said Tuesday, describing the reptile as one of the largest they had ever captured. Kritkamon said the snake was more than four metres long, weighed 15 kilos (33 pounds), and was the third-largest they had found.",0.2225823172053425,0.3409347427835548,0.2817585299944486,0.30148393425748404
N4524,sports,football_ncaa,Brett McMurphy's College Football Bowl Projections After Week 9 Is Oklahoma still projected to earn a College Football Playoff bid? The post Brett McMurphy's College Football Bowl Projections After Week 9 appeared first on Stadium.,0.2225823172053425,0.2670142449338798,0.24479828106961116,0.25220360235770073
N50015,news,newsworld,North Korea rejects meeting with South over resort North Korea on Tuesday rejected South Korea's request for working-level talks to discuss the possible demolition of South Korean-made hotels and other facilities at the North's Diamond Mountain resort that North Korean leader Kim Jong Un wants removed.,0.2225823172053425,0.3153050821963861,0.2689436997008643,0.28439749386603824
N10671,news,newsus,"Pentagon releases first images from raid that killed ISIS leader The Pentagon released newly declassified video and images Wednesday of the daring, two hour raid targeting ISIS leader Abu Bakr al-Baghdadi that shows US forces taking small arms fire from multiple locations as their helicopters approached the compound.",0.2225823172053425,0.283526485217943,0.25305440121164274,0.2632117625470762
N21628,news,newsus,"Parkland shooter's death penalty trial set to begin in January Parkland school shooter Nikolas Cruz's death penalty trial is set to begin in January 2020, according to a court order issued Thursday by Florida Circuit Judge Elizabeth Scherer.",0.2225823172053425,0.2549158985316855,0.238749107868514,0.24413803808957119
N9460,news,newsworld,"Egypt unveils discovery of 30 ancient coffins with mummies inside Egyptian authorities on Saturday revealed the contents of 30 ancient wooden coffins discovered in Luxor and yes, they include mummies.",0.2225823172053425,0.2975570091059759,0.26006966315565916,0.2725654451390981
N45388,sports,football_ncaa,"College football Week 8 bowl projections: Baylor surges into New Year's Day 6 Sporting News' Week 8 bowl projections saw a little movement, and Baylor and North Carolina each have joined the New Year's Day 6 discussion.",0.2225823172053425,0.2702135176426821,0.2463979174240123,0.25433645083023554
N29819,movies,movies-celebrity,"Paparazzi Drove Keira Knightley to a Mental Breakdown: 'I Told Them I Was Going to Kill Somebody' The twice-Oscar-nominated actress spoke frankly with The Telegraph about how the enormous pressure of 2003's ""Pirates of the Caribbean"" and the hits that followed forced her to retreat from the limelight.",0.2225823172053425,0.2582594234533923,0.2404208703293674,0.24636705470404235
N14972,foodanddrink,foodnews,"Here's Why We Pass Out Candy on Halloween Sure, candy's a big part of lots of our holidays in the United States but why is Halloween the one where we go door-to-door asking for it?",0.2225823172053425,0.2965657873971895,0.25957405230126596,0.27190463066657383
N17371,news,newsworld,Turkey Takes Fight Against Kurdish Fighters to Iraq As It Struggles in Syria The Turkish Defense Ministry announced that up to seven Kurdish PKK fighters were killed in back-to-back strikes in northern Iraq as deadly clashes continued across the border in Syria.,0.2225823172053425,0.3087466470887217,0.2656644821470321,0.28002520379426193
N14662,foodanddrink,foodnews,"This Controversial Julia Child Recipe Caused Quite a Stir Julia Child has long been one of the most popular cooks in the country, celebrated for strict interpretations of culinary classics. However, her take on a classic Italian dish caused an uproar.",0.2225823172053425,0.2591035109537573,0.24084291407954989,0.2469297797042857
N14238,sports,football_ncaa,College Football Rivalries: The Top Nicknames ,0.2225823172053425,0.2725836332133737,0.2475829752093581,0.2559165278773633
N6231,sports,football_ncaa,Brett McMurphy's College Football Bowl Projections After Week 7 Find out where your team fits in McMurphy's latest projections. The post Brett McMurphy's College Football Bowl Projections After Week 7 appeared first on Stadium.,0.2225823172053425,0.2826465091713794,0.252614413188361,0.2626251118493671
N46354,sports,football_ncaa,Week 8 observations: Wisconsin exposed as fraud in title chase and that could hurt Big Ten Wisconsin showed it was not a real national title contender with a loss to Illinois that changes the landscape of the Big Ten.,0.2225823172053425,0.2650703449842463,0.2438263310947944,0.25090766905794504
N22032,sports,football_ncaa,Five arguments College Football Playoff committee can ignite with first rankings The first College Football Playoff rankings will be unveiled on Tuesday. Here are the five arguments that could take off as a result.,0.2225823172053425,0.2586216123619926,0.24060196478366755,0.24660851397644257
N40545,finance,finance-savemoney,"12 things that could save us money if we weren't lazy From checking your credit report to comparison shopping, go the extra mile to keep your cash.",0.2225823172053425,0.2936470689631431,0.2581146930842428,0.26995881837720953
N35554,sports,football_ncaa,"Lane Kiffin interested in Florida State head coach job Look out, folks. Lane Kiffin wants back into the Power Five, expressing his interest in the Florida State job on the heels of Willie Taggart's Sunday firing.",0.2225823172053425,0.2633134031631003,0.2429478601842214,0.2497363745105144
N58601,health,health-news,"Zantac Recall Update: Another Company Recalls Ranitidine Heartburn Drug Over Cancer Fears Aurobindo Pharma USA, Inc. is the latest company to issue a voluntary recall of ranitidine products over concerns regarding ""probable"" carcinogen NDMA.",0.2225823172053425,0.3229400129344675,0.272761165069905,0.2894874476914258
N52692,news,newsus,"Dow says no injuries from chemical plant blast in Louisiana An explosion at a Dow chemical plant in Louisiana rattled windows in nearby homes but caused no injuries, the company said Sunday.",0.2225823172053425,0.2890835527061568,0.25583293495574966,0.2669164742058854
N42583,news,newsworld,"India's capital restricts cars as people choke in dirty air Authorities restricted many private vehicles from taking to the roads of India's capital on Monday amid a public health crisis that has left New Delhi residents gasping and their eyes burning from toxic air pollution. The ""odd-even"" scheme will restrict private vehicles with odd-number license plates to driving on odd dates while even-numbered plates are allowed on even-numbered dates.",0.2225823172053425,0.3038827265923026,0.2632325218988225,0.2767825901299826
N44007,video,news,Where have Cape Town's great whites gone? Shark spotters say Cape Town's world-famous great whites have disappeared. So where have they gone?,0.2225823172053425,0.2745626794465619,0.24857249832595218,0.2572358920328221
N2052,sports,football_ncaa,"Hernandez: USC athletic director Mike Bohn needs to tune out Urban (Meyer) noise He wasn't in the building. Except he was. He was rarely mentioned by name. Except every other question was about him. Urban Meyer was nowhere and everywhere Thursday in the John McKay Center, where Mike Bohn was introduced as USC's athletic director. The reason was obvious: Meyer is whom Trojan Nation wants as its football coach. USC can preach the importance of integrity, but the university ...",0.2225823172053425,0.2807864957671576,0.25168440648625,0.2613851029132192
N770,tv,tvnews,"Megyn Kelly Slams NBC News on 'Tucker Carlson Tonight' for Matt Lauer Investigation, Harvey Weinstein Coverage In Megyn Kelly's first televised interview since exiting NBC, the former Fox News and NBC News anchor took to ""Tucker Carlson Tonight"" Wednesday evening to criticize NBC News management for its handling of the outlet's Harvey Weinstein coverage and internal Matt Lauer investigation.",0.2225823172053425,0.2691917098389232,0.24588701352213285,0.2536552456277296
N50343,sports,football_ncaa,'We think it's cute.' Clemson reacts as undefeated Tigers keep falling in Top 25 Clemson co-offensive coordinator Jeff Scott was the head coach at Blythewood High School in Richland County in the mid-2000s before beginning his college coaching career at Presbyterian in 2007.,0.2225823172053425,0.2746482091537333,0.2486152631795379,0.257292911837603
N63642,news,newsus,U.S. Coast Guard responds to oil discharge in Louisiana protected wetlands U.S. Coast Guard responds to oil discharge in Louisiana protected wetlands,0.2225823172053425,0.2819286148918782,0.2522554660486104,0.262146515663033
N38821,news,newsphotos,The US Navy is 244 years old today. Here are 42 powerful images from its iconic history. The US Navy has long been the most visible part of America's military might with visits to far flung ports and operations all over the world.,0.2225823172053425,0.312430463615673,0.2675063904105077,0.28248108147889617
N53052,movies,movienews,Charlize Theron Says Playing Megyn Kelly Was 'Harder' Than Portraying a Serial Killer Charlize Theron: Playing Megyn Kelly Was 'Harder' Than Playing a Serial Killer,0.2225823172053425,0.2429807695956283,0.2327815434004854,0.23618128546553302
N62545,finance,finance-companies,"The CEO taking on the gun lobby Ed Stack didn't set out to be an activist. The chief executive of Dick's Sporting Goods, Mr. Stack spent his career selling fishing rods, camping gear and athletic equipment at big-box stores around the country. Dick's was founded by Mr. Stack's father in upstate New York. As a young man, Mr. Stack worked for the family business. But he didn't enjoy the experience. His father was a divisive boss who couldn't manage a supply chain, and was...",0.2225823172053425,0.3126772609565957,0.2676297890809691,0.2826456130395113
N1455,sports,football_ncaa,"LSU up to No. 2 behind Alabama in Amway Coaches poll as Oklahoma, Notre Dame tumble LSU is now No. 2 in the Amway Coaches Poll behind Alabama, while Oklahoma and Notre Dame both tumbled after losses on the road.",0.2225823172053425,0.2794360851603417,0.2510092011828421,0.26048482917534194
N8285,sports,football_ncaa,"Report: Potential new USC AD told he cannot pursue Urban Meyer, could back out USC supposedly has a deal in place with Cincinnati athletic director Mike Bohn to make him their next AD, but many expected an official announcement on Monday.",0.2225823172053425,0.2619281126705697,0.2422552149379561,0.24881284751549398
N60936,news,newsus,Chicago teachers' strike ends after 11 days. CPS will have 5 make-up days of school The Chicago Teachers Union voted to accept a tentative agreement with Mayor Lori Lightfoot. The two sides argued over how many days to make up.,0.2225823172053425,0.2771580204465397,0.2498701688259411,0.2589661193661406
N51616,sports,football_ncaa,"Plaschke: USC's debacle against Oregon is final nail in coach Clay Helton's coffin It's over now, finally, mercifully, a USC football era ending Saturday night on a field filled with mistakes surrounded by fans teeming with anger. There's no way Clay Helton comes back from this. There's no way the Trojans football program can continue on like this. There's no way this should ever happen at USC, ever, this embarrassing 56-24 whipping at the hands and arms and feet of the ...",0.2225823172053425,0.2622259838456903,0.2424041505255164,0.2490114282989077
N11673,movies,movies-celebrity,"Blake Lively Hilariously Trolls Ryan Reynolds for Having ""No Chill"" Blake Lively trolled husband Ryan Reynolds and his gin company, Aviation Gin, on Instagram with some hilarious Stories. See what she wrote here.",0.2225823172053425,0.2743284031948122,0.24845536020007736,0.25707970786498896
N6785,news,newsworld,Today in History: November 5 ,0.2225823172053425,0.2866298431087044,0.25460608015702346,0.26528066780758375
N61319,sports,football_ncaa,"After throwing a punch, Dabo Swinney made CB Andrew Booth ride the manager bus back to Clemson ",0.2225823172053425,0.2924811634463814,0.25753174032586196,0.2691815480327018
N50049,sports,football_ncaa,"11 bold predictions for rest of college football season Alabama misses the playoff, USC wins Pac-12 and more",0.2225823172053425,0.2662335366956032,0.24440792695047284,0.25168313019884964
N51147,sports,football_ncaa,10 storylines to follow heading down college football's home stretch Seven weeks down; seven to go. We've hit the halfway mark of the college football regular season. It's been entertaining thus far   not too many surprises   with enough intrigue to keep us going back each week.,0.2225823172053425,0.2700651148577999,0.2463237160315712,0.2542375156403141
N14588,sports,football_ncaa,"Jake Fromm proves Georgia is more than just its running game vs. Florida Georgia beat Florida 24-17 in a huge SEC showdown, and the Bulldogs did that with a clutch performance from Jake Fromm.",0.2225823172053425,0.2930663777902824,0.25782434749781247,0.26957169092863575
N51464,news,newsus,"Woman wanted for climbing into Bronx Zoo lion exhibit: 'I am the lion now' Myah Autry said her decision to climb a fence and head into the lion's den was a ""spiritual"" experience.",0.2225823172053425,0.2758125456954836,0.24919743145041304,0.25806913619876987
N37378,news,newsus,"Wisconsin jury awards $450,000 in Sandy Hook defamation case A jury in Wisconsin has awarded $450,000 to the father of a boy killed in the 2012 Sandy Hook school shooting after he filed a defamation lawsuit against conspiracy theorist writers who claimed the massacre never happened.",0.2228682847762014,0.2692936018015113,0.24608094328885635,0.253818496126408
N40509,news,newscrime,One of FBI's Most Wanted fugitives offers surrender One of the FBI's Most Wanted fugitives says he wants to surrender but claims his offers are being ignored by the United States government.,0.2236493647159317,0.2518627257210244,0.23775604521847804,0.24245827205266018
N24591,lifestyle,lifestylebuzz,"A heartbreaking photo of a dog riding a bus alone went viral, and now people want to adopt her A kennel is seeking the dog's owner. If no one comes forward, she will be put up for adoption.",0.2243112354248318,0.2896801426482462,0.256995689036539,0.2678905069071081
N45535,news,newsus,DOJ sues Walmart for allegedly discriminating against a Navy reserve officer The Department of Justice says that Walmart did not hire a naval reserve officer due to her mandatory two-week training in the summer of 2016.,0.2244806151251493,0.2557823310944568,0.24013147310980304,0.2453484257713543
N64467,news,newsus,"Former Fox News hosts want out of non-disclosure agreements In the wake of the Me Too movement, women are calling them unfair silencers that sweep sexual misconduct claims under the rug",0.2249511248395519,0.2505667368940536,0.23775893086680278,0.24202819954255306
N35452,weather,weathertopstories,"'Potentially historic wind event' over weekend could inflame California wildfires Northern California could experience a potentially historic wind event this weekend, which could have a dangerous effect on wildfires.",0.2259325563921959,0.2691807418443072,0.24755664911825154,0.25476468002693675
N29499,news,newsus,"California governor signs measure banning 'lunch shaming' SACRAMENTO, Calif. (AP)   California's governor has signed into law a bill that guarantees all students a state-funded meal of their choice, even if their parent or guardian has unpaid meal fees.",0.2259325563921959,0.2589201238264823,0.24242634010933908,0.2479242680150535
N2606,news,newscrime,"Couple Accused of Injecting Childhood Friend With Meth and Filming Her As She Died After more than two years of investigation, authorities in Oklahoma have filed formal murder charges in the death of a 41-year-old woman whose last moments were captured on videotape.",0.2262166096253752,0.2372438675805601,0.23173023860296765,0.23356811492883178
N20886,news,newsworld,"ISIS Leader Paid Rival for Protection but Was Betrayed by His Own The Islamic State leader Abu Bakr al-Baghdadi was able to hide out in an unlikely part of Syria, the base of a rival group, because he was paying protection money to its members, according to receipts for the payments recovered by researchers.",0.2262166096253752,0.2964482475000647,0.26133242856272,0.2730377015418349
N24123,sports,baseball_mlb,Why is Giancarlo Stanton on the Yankees' playoff roster? ,0.2262166096253752,0.2760152800260601,0.25111594482571764,0.2594157232258318
N64562,tv,tv-celebrity,Rob Kardashian Appears Thinner at Kim Kardashian's Birthday Party in Rare Video Rob Kardashian Appears Thinner at Kim Kardashian's Birthday Party,0.2262166096253752,0.2849034589465364,0.2555600342859558,0.2653411758394827
N55310,news,newscrime,"Joey 'the Clown' Lombardo, infamous Chicago mobster, dead at 90, reports say Chicago mobster Joseph Lombardo   better as ""Joey the Clown""   died in prison Saturday while serving a life sentence for murder, according to federal prosecutors.",0.2262166096253752,0.269901206841059,0.2480589082332171,0.25533967443583105
N157,sports,baseball_mlb,"How did the Nats respond to a controversial call? By leaving absolutely no doubt. A controversial interference call. Dominance from Stephen Strasburg. Booming home runs to turn it around. And now, one game to decide it all.",0.2262166096253752,0.284432819512696,0.2553247145690356,0.2650274162169224
N18663,news,newsus,"Coast Guard offloads $92 million worth of smuggled cocaine in San Diego The Coast Guard offloaded more than 6,800 pounds of cocaine   worth an estimated $92 million   in San Diego on Wednesday, contraband that the military branch seized in international waters of the eastern Pacific Ocean.",0.2262166096253752,0.2815230471088046,0.25386982836708993,0.26308756794766147
N47482,travel,travelnews,TSA Agents Stop Passenger With Loaded Gun Before Boarding Plane The man was carrying a loaded .22 caliber handgun.,0.2262166096253752,0.2890333194662313,0.25762496454580325,0.2680944161859459
