ID,category,sub_category,content,collaborative_rec,content_rec,mean,two_one
N25885,entertainment,celebrity,Here's Every Costume the Kardashian-Jenner Family Wore This Halloween Every Kardashian-Jenner Halloween Costume (Even the Kids!) From 2019,0.2438412575707908,0.2744201285045432,0.259130693037667,0.2642271715266258
N45794,news,newscrime,"Four flight attendants were arrested in Miami's airport after bringing in thousands in cash, police say Four American Airlines flight attendants were arrested at the Miami International Airport and charged with money laundering after bringing large amounts of cash into the country, police said.",0.244192490065456,0.2440680911004498,0.2441302905829529,0.24410955742211854
N14385,news,newsworld,ISIS names successor to slain leader al-Baghdadi The militant group named Abu Ibrahim Hashimi al-Quraishi as the new leader in a message posted by its official media wing.,0.2442064282005751,0.3050169725758208,0.27461170038819793,0.28474679111740553
N42620,lifestyle,lifestylebuzz,"Heidi Klum's 2019 Halloween Costume Transformation Is Mind-Blowing   But, Like, What Is It? You might say she's scary good at playing dress-up, because Heidi Klum's 2019 Halloween costume is even more impressive than we could have imagined   and that's saying a lot, considering transformative Halloween costumes are kind of her thing. But this year Klum took it up one more notch as she shared her metamorphosis into,",0.2446235167896757,0.2900094695795291,0.2673164931846024,0.274880818649578
N35022,lifestyle,lifestylebuzz,"Bed, Bath and Beyond Pulls 'Blackface Pumpkins From the Shelves The pumpkins were removed from stores after an upstate New York community filed complaints.",0.2449334563027391,0.2851664113335838,0.26504993381816144,0.27175542632330224
N619,news,newsus,"Cornell student, 18, found dead in gorge after frat party, reports say A top Ivy League student was found dead Saturday afternoon in a New York gorge after he left a fraternity party and disappeared Thursday night, according to reports.",0.2449439656952891,0.2471952863536274,0.24606962602445825,0.2464448461341813
N37131,sports,baseball_mlb,What recent history tells us to expect from World Series Game 7 Will the Nationals and Astros give us a classic or a clunker?,0.2449597804514643,0.2712090320220786,0.2580844062367714,0.2624592814985405
N30867,news,causes-environment,"The size of a bus, rare and endangered whale shark spotted off Florida coast Bigger than Jaws, but not nearly as dangerous, the largest fish in the sea, a whale shark, was spotted off the Florida coast.",0.2449846036557026,0.2971928840191468,0.2710887438374247,0.27979012389799873
N47791,autos,autosnews,"Hyundai fuel cell semi concept makes the Tesla Semi look boring Called the HDC-6 Neptune, it's a pretty great-looking thing.",0.2451324705584974,0.3071239387583687,0.276128204658433,0.28646011602507826
N44383,news,newscrime,"Florida police tell man to quit calling about stolen marijuana A man in Florida repeatedly called 911 over the weekend to report that his roommate had stolen his weed, police said.",0.2452995606078812,0.2757743706885217,0.26053696564820145,0.26561610066164154
N6750,news,newspolitics,"Kamala Harris to slash staff, restructure campaign as she hemorrhages cash Kamala Harris is dramatically restructuring her campaign by redeploying staffers to Iowa and laying off dozens of aides at her Baltimore headquarters, according to campaign sources and a memo obtained by POLITICO Wednesday, as she struggles to resuscitate her beleaguered presidential bid.",0.2455594228515879,0.2723645719218571,0.2589619973867225,0.26342952223176735
N4607,autos,autosnews,Cause determined in Jessi Combs' fatal speed record crash Occurred at speeds near 550 mph,0.2456298050096964,0.272002722826276,0.2588162639179862,0.2632117502207495
N58715,news,newsus,Officer placed on leave after threatening teen skaters at gunpoint Witnesses said the confrontation began on Saturday night when the plain-clothes officer approached the teenagers and ordered them stop playing loud music.,0.245705923176619,0.2644758380765695,0.25509088062659424,0.258219199776586
N63302,lifestyle,lifestylebuzz,"This Wedding Photo of a Canine Best Man Captures Just How Deep a Dog's Love Truly Is When Mark Doublet made his dog, Marley, the best man at his wedding, he took his duties very seriously, and a photo of them together has gone viral.",0.245801618120428,0.2972230621907591,0.27151234015559356,0.2800825808339821
N13008,finance,finance-companies,Harley-Davidson halts production of new electric motorcycles Harley-Davidson has halted production and deliveries of its new LiveWire electric motorcycle after reportedly discovering a problem with its charging mechanism.,0.2460226193746479,0.2932127149813031,0.2696176671779755,0.277482683112418
N16158,lifestyle,lifestylebuzz,"Nationals pitcher criticized for missing playoff game for daughter's birth Daniel Hudson said his family is his ""top priority"" after receiving criticism for missing a playoff game for the birth of his daughter.",0.246029179502711,0.2519890321933227,0.24900910584801683,0.25000241462978545
N38562,sports,baseball_mlb,Nationals still uncertain on Scherzer status after injection HOUSTON (AP)   The Washington Nationals remain unsure about the health of pitcher Max Scherzer and catcher Kurt Suzuki heading into Game 6 of the World Series against Houston. Scherzer was scratched from his Game 5 start Sunday night because of nerve irritation near his neck and had a cortisone shot. Scherzer won the opener and hopes to be able to pitch in a Game 7 if the Nationals get that far. Houston won three in a row at Washington to take a...,0.2460486750308748,0.3027660814103423,0.27440737822060857,0.28386027928385316
N30531,tv,tv-gallery,"16 transgender celebrities who are changing television Shows like ""Euphoria,"" ""Pose,"" ""The Fosters,"" and ""Shameless"" have all introduced trans actors and characters in recent years.",0.2461672108530281,0.2750288945695643,0.2605980527112962,0.2654083333307189
N12349,lifestyle,lifestylebuzz,"Divers Find Giant Mysterious 'Egg' Floating In Ocean A team of divers set off to explore a sunken World War II ship off the Norwegian coast, but what they found was something far more mysterious. While making their way back to shore, Ronald Raasch, Nils Baadness and Brynjar Aarnseth came face-to-face with a giant floating orb. The bubble hovered 17 meters (56 feet) below the surface and appeared to be see-through. The divers turned their flashlights on it and realized that the sphere was filled...",0.2463546531075243,0.2886322020167865,0.26749342756215544,0.27453968571369913
N56630,finance,markets,China asks WTO for $2.4 billion sanctions against U.S. in latest clash China asks WTO for $2.4 billion sanctions against U.S. in latest clash,0.2466961155878318,0.2769059054046867,0.26180101049625926,0.26683597546573506
N10414,movies,movienews,"Robert Evans, 'Chinatown' Producer and Paramount Chief, Dies at 89 Robert Evans, the Paramount executive who produced ""Chinatown"" and ""Urban Cowboy"" and whose life became as melodramatic and jaw-dropping as any of his films, died on Saturday night. He was 89. Even though Hollywood history is filled with colorful characters, few can match the tale of Evans, whose life would seem far-fetched if it were",0.2467178278281032,0.3034553546531009,0.2750865912406021,0.284542845711435
N54522,entertainment,celebrity,"Ben Affleck has a new girlfriend after using the Raya dating app, plus more celeb love life news for late October 2019 Meg Ryan and John Mellencamp call it quits, Halsey and Evan Peters get serious, James McAvoy weds, Meghan King Edmonds accuses hubby of cheating and more.",0.2469390350362168,0.2674637319346801,0.25720138348544846,0.26062216630185897
N23979,finance,markets,"China already snapping up U.S. farm goods, Trump claims President Donald Trump boasted Sunday without providing evidence that China had ""already begun"" making large purchases of U.S. agricultural products as part of last week's tariff deal with Beijing.",0.2469924499024935,0.2929898007961713,0.2699911253493324,0.2776573504982787
N58226,sports,racing,NASCAR driver's car got flipped over and then stuck the landing in wild wreck at Talladega Brendan Gaughan had the best reaction to getting flipped.,0.2470164547541347,0.2939563259552976,0.2704863903547161,0.2783097022215766
N10340,foodanddrink,tipsandtricks,"The French Grandmother's Clever Trick to Keeping Fruit Flies Away When I worked in Paris as an au pair, I marveled at how the French seemed to have it all figured out. The family's grandmother always set the table with the good silver even on a Tuesday. I was instructed to pick up fresh, fluffy chouquettes from the boulangerie for the kids' after-school snack instead of, I don't know, granola bars (which is what I would've gotten). It was almost irritating how everyone around me seemed to have effortlessly...",0.2473752620442906,0.3009999451301067,0.2741876035871986,0.283125050768168
N42470,finance,finance-companies,G.M. Workers Approve Contract and End U.A.W. Strike The longest nationwide strike against General Motors in half a century ended on Friday after a solid majority of the company's union members delivered their support for the four-year contract hammered out by their leaders. The United Auto Workers union emerged with substantial wage increases and succeeded in ending a two-tier wage structure that had been a particular irritant in its ranks. It also won commitments to new G.M. investments in...,0.2474462595407523,0.3245356079977097,0.285990933769231,0.2988391585120572
N7132,lifestyle,lifestylebuzz,"8 Hero Dogs That We Don't Deserve From trained search and rescue dogs, to a cosmonaut, to a boxer with a penchant for recycling, here are 8 dogs who deserve all the belly rubs.",0.247551618668765,0.3085391364390171,0.278045377553891,0.28820996384893305
N56446,movies,movies-celebrity,Ryan Reynolds Shares the First Photo of His and Blake Lively's Newborn Daughter This is the first time the actor has talked about his newborn daughter.,0.2475682257660812,0.2615253112221493,0.2545467684941152,0.2568729494034599
N55051,lifestyle,voices,I Am Unapologetically Raising My Daughter Without Religion ,0.2477918808429179,0.2589646527047522,0.25337826677383507,0.2552403954174741
N61005,sports,football_nfl,Randy Moss takes a perfect dig at Joe Buck's infamous 'disgusting act' call ,0.2478241042995057,0.2791098952872014,0.26346699979335353,0.26868129829130283
N28088,movies,movies-celebrity,Bruce Willis brought Demi Moore to tears after reading her book Demi wasn't sure how her ex would feel about her book until he called her.,0.2479375033895824,0.2849291697463578,0.2664333365679701,0.2725986142940993
N10417,music,musicnews,Watch Miranda Lambert Invite a Little Girl On Stage Who 'Stole' Her Heart The girl's mother thanked Lambert for raining attention on her daughter Remi during the show on Saturday night.,0.248080094565436,0.2654092209057183,0.25674465773557714,0.2596328454589575
N29867,travel,travelnews,Airline Passenger Faked Pregnancy by Stuffing Items Under Dress to Avoid Baggage Fee Woman Caught Faking Pregnancy to Avoid Baggage Fee,0.2483075283632382,0.2526358217889771,0.2504716750761076,0.25119305731373076
N28058,lifestyle,lifestylebuzz,Strange Dog Shows Up On Woman's Lawn   And Seems To Recognize Her Kate Howard was sitting outside her home one afternoon after a memorial service when something amazing happened.,0.2483135643362306,0.2783477260231288,0.2633306451796797,0.26833633879416274
N62703,autos,autosnews,"Does Tire Rotation Include Tightening Lug Nuts? Michigan Court Thinks About It For Awhile, Concludes 'No' In what will surely go down in history as one of the most Galaxy Brain court rulings of all time, a Michigan appeals court determined that a tire rotation does not, in fact, include tightening the lug nuts.",0.2484429626436187,0.2751597473862961,0.2618013550149574,0.2662541524720703
N871,tv,tv-celebrity,"Woman, suspect dead at 'Tarzan' actor Ron Ely's California residence Ron Ely, who portrayed Tarzan in the TV series in the 60s, was not harmed and is alive and well, a sheriff's office spokesman said.",0.2488192628328281,0.2791908601134203,0.2640050614731242,0.2690669943532229
N57967,sports,basketball_nba,Harden-Westbrook argument goes viral A clip of the Rockets stars appearing to exchange words during Thursday's game against the Bucks quickly started making the rounds online.,0.2488683645850034,0.2794111957515809,0.26413978016829215,0.2692302520293884
N39235,news,newscrime,"Florida woman allegedly flees 2 car crashes, kills driver in 3rd crash A Florida woman who killed a 53-year-old man after running a red light and smashing into his Lexus on Saturday morning was in the process of fleeing two earlier car accidents when she caused the fatal collision, police said.",0.2491212226412932,0.2538332615998727,0.2514772421205829,0.25226258194701284
N34124,travel,travelnews,"Southwest Airlines evacuates Chicago flight after blown tires: reports Southwest Airlines evacuated a flight Monday morning at Chicago's Midway International Airport, blaming a hydraulic issue with the landing gear.",0.2492031025914286,0.3101899279298715,0.27969651526065004,0.2898609861503905
N46082,video,science,"Archaeologists open ancient coffins in Egypt After 30 ancient coffins were unearthed ""completely by accident"" in Egypt this week, archaeologists are now taking a closer look. Two of the coffins have been opened but what will experts find inside? NBC's Molly Hunter reports for Weekend TODAY.",0.2494389680160486,0.292190358672541,0.2708146633442948,0.27793989512037687
N5445,weather,weathertopstories,"Wild fall freeze: Utah falls close to minus-35 as West shivers, while bitter cold oozes east Denver could start Halloween morning near 0 degrees.",0.2494538409105281,0.3136415959039237,0.2815477184072259,0.29224567757279185
N8129,news,newsworld,"Elderly Japan woman rescued from Typhoon Hagibis dies after falling from helicopter; storm kills at least 33 An elderly woman was one of the more than 30 who have died in Japan from the devastating Typhoon Hagibis, officials said.",0.249510746028924,0.2880286361524032,0.2687696910906636,0.2751893394445768
N11005,news,newspolitics,"Nunes Aide Is Leaking the Ukraine Whistleblower's Name, Sources Say A top aide to Rep. Devin Nunes has been providing conservative politicians and journalists with information and misinformation about the anonymous whistleblower who triggered the biggest crisis of Donald Trump's presidency, two knowledgeable sources tell The Daily Beast.",0.2495140346991753,0.2711276252309008,0.260320829965038,0.26392309505365896
N16290,news,newsus,"Missouri man missing for a week found alive in car that crashed into ravine Ryan Linneman, of Lee's Summit, was found by a dirt bike rider in wreckage along Interstate 470 in Kansas City, Lee's Summit police said.",0.2495668745167659,0.2997763302256914,0.2746716023712287,0.2830398449893829
N5978,finance,markets,"Eric Tse, 24, just became a billionaire overnight A 24-year-old business school graduate has just become an overnight billionaire.",0.2500981443287515,0.2857101175707258,0.26790413094973864,0.273839459823401
N54225,news,newsus,"Multiple Houses on Fire After Plane Crashes in NJ At least two houses are on fire in Colonia, New Jersey, after a plane crash, according to the Colonia Fire Department. A Cessna 414 crashed into a home on Berkley Avenue at 11 a.m. Tuesday, according to the FAA. The FAA will conduct an investigation into the cause of the crash. The number of people aboard and their conditions are unknown. The area is a heavy residential area with tree-lined streets. News 4's Dennis Protsko, who is part of the...",0.250790357932267,0.2806704768818724,0.2657304174070697,0.27071043723200394
N55897,tv,tv-celebrity,40 Fun Facts About Jennifer Aniston ,0.2507979699177335,0.2562110213207506,0.25350449561924204,0.2544066708530782
N21164,news,newsus,"Pirates kidnap nine crew members from cargo ship off coast of Benin Pirates boarded a shipping vessel and kidnapped nine crew members off the coast of Benin in West Africa early Saturday morning, according to J.J. Ugland, the Norwegian shipping company which owns the vessel.",0.2508771917437322,0.2728243648662605,0.26185077830499637,0.2655086404920844
N58090,sports,football_nfl,"Frustrated Antonio Brown has active morning on Twitter Receiver Antonio Brown continues to wait for his next opportunity, and he continues to be justifiably frustrated by the fact that the NFL's slow-moving investigation is essentially keeping Brown suspended without pay.",0.2509855555742936,0.2773345644279473,0.26416006000112047,0.2685515614767294
N54305,sports,football_nfl,Urban legend? How the Cowboys' rout of the Eagles helped take Coach Meyer out of the conversation Did the Cowboy's victory Sunday night take care of the Urban Meyer rumors?,0.2510562865169236,0.2814359460738188,0.2662461162953712,0.27130939288818706
N44442,news,newspolitics,"CNN Poll: 50% support impeaching Trump and removing him from office Half of Americans say President Donald Trump should be impeached and removed from office, according to a new CNN poll conducted by SSRS.",0.2511560664397673,0.2771725196067007,0.26416429302323396,0.26850036855105625
N54435,news,newsus,"'Angel' car saves Arizona family after smashing into suspected drunk driver running red light, video shows An Arizona driver who police praised as an ""angel"" may have saved the lives of a couple pushing a stroller in a crosswalk last week after video showed the car smashing into a suspected drunk driver speeding through a red light -- who came inches away from plowing into the family.",0.2515961300479901,0.2742064658463851,0.2629012979471876,0.2666696872469201
N13137,video,popculture,"Singer stands up to heckler who told her to take shirt off After being heckled on stage and told to ""free the nips"" at a concert in Texas, singer Maggie Rogers voiced her anger about the harassment.",0.2516402175338754,0.2797454244191485,0.2656928209765119,0.27037702212405745
N59496,sports,football_nfl,"Week 7 winners, losers: Aaron Rodgers now in MVP race; Mitchell Trubisky looks lost Aaron Rodgers' big game vaults him into the MVP race. Meanwhile in Chicago, it might be time for the Bears to reconsider Mitchell Trubisky's future.",0.2517686345952145,0.2957657837497515,0.273767209172483,0.2811000673649058
N21817,news,newspolitics,Two House Democrats break ranks with Pelosi on impeachment rules vote Two House Democrats broke ranks with their party leadership on Thursday's highly-contentious vote.,0.2518159993550319,0.2543154542044998,0.25306572677976585,0.2534823025880105
N59026,news,newsus,"Cincinnati school board candidate accused of 'pretending to be black' in his ads A current CPS board member took to Twitter Sunday to say a candidate for the board ""is a white guy pretending to be black to get votes"" in ads.",0.2519189507953419,0.2722611851625587,0.2620900679789503,0.2654804403734864
N17099,news,newscrime,Missing New Hampshire couple's bodies found buried on a Texas beach James and Michelle Butler had been camping in their RV along the South Texas coast when they went missing in mid-October.,0.2520941888782939,0.2600259908363205,0.2560600898573072,0.2573820568503116
N21317,sports,football_ncaa,New Mexico DE Nahje Flowers dies at 21 ,0.2521210330799248,0.2849569503029572,0.268538991691441,0.2740116445619464
N23554,sports,football_nfl,Joe Flacco criticizes Broncos coaches as 'afraid to lose' after Colts' comeback Joe Flacco made it clear he thought the Broncos weren't aggressive enough when playing with a lead late in Sunday's loss to the Colts.,0.252167977081371,0.2998601270873046,0.2760140520843378,0.2839627437519934
N13231,news,newsus,"Homeowner says a mystery object damaged his house. It didn't fall from a plane, FAA says Authorities including the Federal Aviation Administration have not been able to identify a canister-type object that damaged a Kentucky man's home.",0.252441258131228,0.27012710344397,0.26128418078759896,0.26423182167305603
N58264,entertainment,celebrity,Celebrity beach cruising for 2019 See all the stars who hit the beach this year!,0.2526988246153226,0.2765829767366112,0.2646409006759669,0.2686215926961817
N56514,travel,travelnews,"Road built by biblical villain uncovered in Jerusalem A long-buried street that led pilgrims to the Jewish Temple 2,000 years ago was commissioned by Roman governor Pontius Pilate.",0.2528351873304071,0.3028371375594871,0.27783616244494713,0.2861698208164604
N8275,news,newsworld,"30 killed in DR Congo bus accident At least 30 died early Sunday when a packed bus came off the road and burst into flames near Kinshasa, the DR Congo capital, a local official said.",0.253367570628556,0.2964527165388981,0.27491014358372706,0.2820910012354507
N61388,movies,movies-celebrity,"Judge: Brad Pitt, others can be sued over New Orleans homes The Times-Picayune/ The New Orleans Advocate reports Pitt and other foundation directors asked the court to remove them from the lawsuit, saying they weren't personally responsible for the construction.",0.2535891535869395,0.2511177148742227,0.2523534342305811,0.2519415277784616
N306,movies,movies-celebrity,"Kevin Spacey Won't Be Charged in Sexual Assault Case After Accuser Dies The Los Angeles County District Attorney's Office has formally dropped a case against actor Kevin Spacey, after the accuser died.",0.2537108273506778,0.2410134734196478,0.2473621503851628,0.24524592472999113
N61342,sports,basketball_nba,"The Warriors' fall from glory, explained Things are getting bad quick for the Warriors.",0.2538979864264348,0.2845680549106467,0.2692330206685407,0.2743446987492427
N22561,sports,football_nfl,NFL Week 8 Power Rankings: Old-school football rules the day NFL Week 8 Power Rankings: Old-school football rules the day,0.2539892796786319,0.2936747317890055,0.2738320057338187,0.2804462477522143
N46616,foodanddrink,newstrends,"The best sandwich shop in every US state and DC You don't need to look far to find a great sandwich in the USA. We've rounded up the best sandwich joints in every state, spanning the range from old-school delis still whipping up traditional favorites to quirky, modern joints putting innovative ingredients to work. Pull up a stool and sink your teeth into these mouthwatering offerings.",0.2540081483285488,0.3349290945579445,0.29446862144324665,0.3079554458148126
N34399,foodanddrink,restaurantsandnews,Burger King's new 'Ghost Whopper' is here to haunt your Halloween order The Ghost Whopper will be available at 10 select restaurants beginning Oct. 24. The only thing scarier than Burger King's new Ghost Whopper is the thought of having no Whoppers at all.,0.2540464029280636,0.3305310344774291,0.2922887187027463,0.3050361572943073
N2309,tv,tv-celebrity,James Van Der Beek and Wife Kimberly on Expecting Baby No. 6: It Often Requires an 'Explanation' James Van Der Beek and Wife Kimberly on Expecting Baby No. 6,0.2541550142109715,0.2640288858087422,0.25909195000985685,0.2607375952761519
N48222,sports,basketball_nba,"Bucks have done everything right to keep Giannis for good Though Giannis Antetokounmpo doesn't want to talk about his supermax extension right now, the Bucks have done everything right so far.",0.2541917983645784,0.3061057171415465,0.28014875775306247,0.2888010775492238
N7534,sports,basketball_nba,Magic Johnson uses MJ's Steph Curry statement to make tampering joke Los Angeles Lakers legend Magic Johnson is free to tweet from Game 1 until the end of the season and we are here for it.,0.2541917983645784,0.2990743466314348,0.2766330724980066,0.2841134972091493
N39121,sports,basketball_nba,"Celtics, Zion remain sizzling to start preseason Preseason numbers often mean almost nothing. Rotations are unusual, starters rarely play much, and few if any teams are putting a premium on winning games. As such, it's tough to glean much from exhibition stats. But what the Boston Celtics and New Orleans rookie Zion Williamson   the No. 1 pick in this year's draft   have been doing so far in the preseason certainly stands out. The Celtics are 3-0 after beating Cleveland on Sunday   and have...",0.2541917983645784,0.3200288296607166,0.2871103140126475,0.29808315256200385
N48423,sports,basketball_nba,"Warriors' Steve Kerr clarifies comments about Klay Thompson After he previously implied that Thompson wasn't going to play this coming season, Steve Kerr clarified his comments later on Tuesday.",0.2541917983645784,0.2861316791333025,0.27016173874894045,0.2754850522103945
N14167,music,music-celebrity,Britney Spears Does The Splits Like a Boss in Workout Video She's still got it!,0.2541917983645784,0.2878281121084783,0.2710099552365284,0.27661600752717835
N57528,news,newsus,Bahareh Zare Bahari: Beauty queen says she will be killed if she is deported to Iran An Iranian beauty queen who has spent almost two weeks inside Manila's international airport says she will be killed if she is sent back home and is seeking asylum in the Philippines.,0.2541917983645784,0.2517177814809124,0.2529547899227454,0.25254245377546775
N5092,sports,basketball_nba,Giannis Antetokounmpo spoils Harden-Westbrook debut with triple-double in Bucks comeback ,0.2541917983645784,0.3123813916084741,0.28328659498652625,0.29298486052717554
N22260,sports,football_nfl,Black cat visits field during Cowboys-Giants game on 'Monday Night Football' ,0.2541917983645784,0.3005567833838594,0.2773742908742189,0.2851017883774324
N11405,finance,finance-companies,"Boeing says up to 50 planes grounded globally over cracks Crisis-hit Boeing faced fresh safety concerns Thursday, as the firm admitted cracks were found in up to 50 of its popular 737NG planes following worldwide inspections.",0.2541917983645784,0.2730732680031738,0.2636325331838761,0.26677944479030863
