ID,category,sub_category,content,collaborative_rec,content_rec,mean,two_one
N35488,sports,basketball_nba,Kevin Durant had a simple reason for why Steph Curry is better than Russell Westbrook There you have it.,0.2541917983645784,0.3160138195606687,0.2851028089626235,0.29540647916197194
N3812,sports,basketball_nba,Parity in the NBA means no favorites to win the title Not since the mid-2000s has the NBA season begun with no prohibitive favorite to win the championship.,0.2541917983645784,0.2995343681463848,0.2768630832554816,0.28442017821911597
N53428,news,newspolitics,"Pete Buttigieg Says He Does Not Respect Donald Trump: 'At a Deeper Level I Don't Think He Respects Himself' Democratic candidate Pete Buttigieg went on the offensive against President Donald Trump, saying that Trump has done nothing to command his respect.",0.2541917983645784,0.2897150694107395,0.2719534338876589,0.2778739790620191
N63658,lifestyle,lifestylecelebstyle,Presenting: The 41 All-Time Most Stunning Dresses From the People's Choice Awards Red Carpet Top hats? Got 'em. A cane? Mm-hmm. Shoulder pads? You betcha.,0.2541917983645784,0.2785847219526879,0.26638826015863315,0.27045374742331807
N59289,lifestyle,lifestylecelebstyle,"Katy Perry's 34 Most Memorable Looks of All Time In honor of her birthday, we're looking back at Katy Perry's most memorable performance looks of all time.",0.2541917983645784,0.302646638136295,0.2784192182504367,0.28649502487905615
N50748,weather,weathertopstories,"A rare October snowstorm blankets the Texas Panhandle Heavy snow fell in parts of the Texas Panhandle on Thursday, causing near whiteout conditions in Amarillo, according to the National Weather Service.",0.2541917983645784,0.3090943631130467,0.28164308073881256,0.2907935081968906
N4654,sports,basketball_nba,"Shaq gets emotional welcome back from TNT crew after sister's death Shaq had been away after his sister, Ayesha Harrison-Jex, died from cancer at age 40.",0.2541917983645784,0.2926767222137432,0.2734342602891608,0.27984841426402157
N56638,sports,basketball_nba,"LeBron James evacuates LA home, relocates family to hotel because of wildfires Lakers star LeBron James and his family were forced to evacuate their home in Los Angeles due to wildfires that have engulfed Southern California.",0.2541917983645784,0.2843749431972897,0.269283370780934,0.27431389491971925
N13286,entertainment,celebrity,"Will Smith gets friendly with fans, plus more celebs out and about this fall See new photos of your favorite celebrities living life during fall 2019!",0.2541917983645784,0.2799940715346113,0.26709293494959485,0.271393313811267
N58997,sports,basketball_nba,"LeBron, D-Wade get hyped watching sons connect for basket LeBron James and Dwyane Wade were having a great time as basketball dads watching their son's play over the weekend for Sierra Canyon.",0.2541917983645784,0.2563193590482427,0.2552555787064106,0.2556101721536879
N25287,sports,basketball_nba,"Steve Kerr: Steph Curry is 'at his peak physically, mentally' ",0.2541917983645784,0.2791918007992945,0.26669179958193645,0.2708584666543891
N25604,sports,basketball_nba,Warriors' Russell ejected for going after official D'Angelo Russell is not having the best start to the new phase of his career with the Golden State Warriors.,0.2541917983645784,0.284508401227545,0.2693500997960617,0.27440286693988947
N41777,sports,baseball_mlb,"Kate Upton was so fired up after the Astros' big defensive play The Houston Astros made a great defensive play to keep Game 2 of the ALCS tied in the sixth inning, and perhaps nobody was more excited about it than Kate Upton.",0.2541917983645784,0.27814211231714,0.2661669553408592,0.27015867433295276
N8519,lifestyle,lifestylebuzz,"Kristen Stewart Just Made Leather Bras a Thing, and We're All For It Leave it to Kristen Stewart to look like a total badass while promoting her new film Charlie's Angels.",0.2541917983645784,0.2715597221691751,0.26287576026687676,0.2657704142343095
N52145,sports,basketball_nba,"Anthony Davis' performance against Grizzlies places him among Lakers greats George Mikan. Elgin Baylor. Wilt Chamberlain. Kareem Abdul-Jabbar. Shaquille O'Neal. Now, Anthony Davis. Lakers history is filled with big men who dazzled their fans and terrified opponents, and on Tuesday night Davis joined their exclusive club. They are the only Lakers to have scored at least 40 points in a game in which they also grabbed 20 rebounds. Davis scored 40 points with 20 rebounds ...",0.2541917983645784,0.3192145476571072,0.2867031730108428,0.29754029789293096
N4885,sports,basketball_nba,Tacko Fall working hard to show he's more than a novelty act The 7-foot-5-inch fan favorite is working diligently with the Celtics coaching staff to sharpen his skills.,0.2541917983645784,0.2935677895969274,0.2738797939807529,0.2804424591861444
N13057,lifestyle,lifestyleroyals,"Queen Elizabeth and Michelle Obama Shared 'Instant, Mutual Warmth' When They Broke Royal Protocol Queen Elizabeth Welcomed When Michelle Obama Put Arm Around Her",0.2541917983645784,0.2687539815863834,0.2614728899754809,0.2638999205124484
N13480,video,popculture,"Jennifer Aniston on why she joined Instagram: 'I'm just trying to build content' Jennifer Aniston visited Jimmy Kimmel Live!, Wednesday to promote her new Apple series The Morning Show. And while she was there she also talked about her record breaking new Instagram account. As of last night's broadcast, Aniston's account had garnered over 11 million followers in less than two days. She set a new world record, racking up a her first million followers 29 minutes faster than the previous record holders Prince Harry and Megan Markle. While this is her first official instagram account it wasn't her first time on IG. Aniston admitted that she had a fake account prior to making things official. ""It was a stalker account,"" said Aniston, ""When I was thinking about doing this, I sort of figured it was time to kind of understand the world and dip my toe into the social media pool."" When asked why she joined Insta, Aniston replied, ""I don't know."" She also revealed that she does look at other people's Instagram posts. She said, ""I'm just trying to build content, as they say.""",0.2541917983645784,0.2974372774352993,0.2758145378999388,0.283022117745059
N27023,sports,basketball_nba,"Paschall, young Warriors beat Blazers for 1st home win SAN FRANCISCO (AP)   Rookie forward Eric Paschall hit a key 3-pointer with 4:05 remaining and finished with 36 points and 13 rebounds for his best game yet, leading the injury-plagued Golden State Warriors to a 127-118 victory against Damian Lillard and the Portland Trail Blazers on Monday night for their first home win at last. Without all their injured stars, the young Warriors more than hung tough   they shined   against a Western Conference...",0.2541917983645784,0.322331590811993,0.28826169458828566,0.29961832666285476
N10888,sports,basketball_nba,Report: Many NBA executives believe Andre Iguodala will be traded to Lakers The notion that Iguodala is likely to land with the Lakers is so strong that there is a belief in league circles that it could dissuade other teams from engaging in trade dialogue with Memphis.,0.2541917983645784,0.2876693688347684,0.27093058359967337,0.2765101786780384
N63411,lifestyle,lifestyleroyals,Meghan Markle's Leather Pencil Skirt is a Powerful Statement Piece Meghan Markle stepped out for an important guest panel appearance in a maroon long-sleeved top with an eye-catching red leather pencil skirt.,0.2541917983645784,0.2648557760082999,0.25952378718643915,0.2613011167937261
N16710,finance,markets,The value of America's natural resources revealed Ever been curious about how much money is hiding in America's untapped natural resources? We reveal what they're really worth…,0.2541917983645784,0.2944717987824274,0.27433179857350287,0.28104513197647774
N43608,news,newsus,"Trump, Newsom wildfire clash came days after Newsom lauded president as 'partner' Last week Gov. Newsom thanked the Trump administration for ""moving expeditiously to support our efforts"" fighting fires. That was then, this is now.",0.2541917983645784,0.2841263631978648,0.2691590807812216,0.2741481749201026
N24578,entertainment,celebrity,"Week in celebrity photos for Oct. 28-Nov. 1, 2019 See what the stars were up to during the last week of October.",0.2541917983645784,0.2749580605680687,0.26457492946632355,0.26803597316690525
N49526,sports,basketball_nba,"James Harden drops 59 points as Rockets edge Wizards in high-scoring duel James Harden would not let the Rockets lose, not a game like this. And all it took was for the Rockets to score 159 points. With no one stopping anyone, with 3s falling and drives ending at the rim, Harden kept scoring and scoring until the Rockets finally got a stop and just enough scoring to finally score just enough. After Russell Westbrook drove to a three-point play after a Harden slam missed, giving the Rockets a lead with 32.4 seconds...",0.2541917983645784,0.3319397038680033,0.29306575111629085,0.30602373536686167
N2533,entertainment,entertainment-celebrity,"Khloe Kardashian misses ex, Lamar Odom 'all the time,' plus more news Khloe Kardashian wrestles with whether to meet with her ex, Lamar Odom. Plus, more celebrity news for Oct. 24, 2019.",0.2541917983645784,0.2706165739056719,0.2624041861351252,0.2651416487253074
N33727,news,newspolitics,"Why Pete Buttigieg's moment could last well past the debate The Indiana mayor has the money, the staff, the data, and the endorsements to rapidly expand his reach.",0.2541917983645784,0.2781079575471145,0.26614987795584644,0.2701359044862691
N24422,sports,football_nfl,Lamar Jackson makes NFL history with huge day in win over Bengals ,0.2541917983645784,0.3066103319304148,0.28040106514749663,0.28913748740846934
N45189,news,newsscienceandtechnology,"Roman chariot and horse fossils are unearthed in Croatia after being buried in a ritual reserved for very wealthy families, archaeologists reveal Archaeologists uncovered the fossils near the city of Vinkovci in eastern Croatia and said this is the first time a burial ritual like this has been discovered in the country.",0.2541917983645784,0.296176230997322,0.2751840146809502,0.2821814201197408
N8959,news,newspolitics,"Graham now says Trump's Ukraine policy was too 'incoherent' for quid pro quo A day after saying he wouldn't bother reading transcripts released by House Democrats in the impeachment inquiry into President Trump, Sen. Lindsey Graham, R-S.C., now says he did read the testimony, and his conclusion is that the administration's Ukraine policy was too ""incoherent"" for it to have orchestrated the quid pro quo that is at the heart of the probe.",0.2541917983645784,0.2653807169041047,0.25978625763434154,0.26165107739092924
N53494,sports,football_nfl,Top takeaways from Sunday's Week 7 NFL action The Atlanta Falcons' season-long struggles continued while the Houston Texans put up a bummer of a performance against the Indianapolis Colts.,0.2541917983645784,0.3155542053592213,0.28487300186189984,0.29510006969434033
N41832,sports,basketball_nba,Curry swishes shots in warm-up sequence at Chase Center The Golden State Warriors will begin a new season in their new arena Chase Center on Thursday night.,0.2541917983645784,0.3073553283204936,0.280773563342536,0.28963415166852186
N52631,sports,basketball_nba,"Steve Kerr says Warriors' blowout opening loss is no one-off: 'This is reality' The last five years we've been living in a world that isn't supposed to exist, Kerr said after Golden State fell 141-122 to the Clippers.",0.2541917983645784,0.2876856655430589,0.2709387319538187,0.27652104315023207
N18939,sports,basketball_nba,"Charles Barkley: 'At this point, Kawhi's a better player than LeBron' TNT Analyst Charles Barkley said Kawhi Leonard is a better player than LeBron James.",0.2541917983645784,0.2946751682853699,0.27443348332497414,0.28118071164510605
N119,sports,basketball_nba,"Anthony Davis, LeBron James dominate offensively to lead Lakers past Warriors in preseason bout ",0.2541917983645784,0.2815881034956807,0.2678899509301296,0.27245600178531326
N16541,sports,basketball_nba,"Steve Kerr says it's unlikely Klay Thompson returns this season from ACL tear Last month, Golden State general manager Bob Myers announced that Klay Thompson would be out at least until the All-Star break to recover from the ACL tear he suffered in the NBA Finals, which left the door open for a return this season.",0.2541917983645784,0.3024224689826097,0.27830713367359405,0.2863455787765993
N51458,sports,basketball_nba,Lonzo Ball says Pelicans have to 'hold the fort down' until Zion Williamson returns Lonzo Ball is confident that the New Orleans Pelicans have the talent to win games without their leading scorer Zion Williamson.,0.2541917983645784,0.2925001084952461,0.27334595342991225,0.27973067178502353
N26040,sports,football_nfl,"32 things we learned from Week 7 of the 2019 NFL season As the NFL approaches its midseason point, several contenders are rounding into top form while others are getting desperate.",0.2541917983645784,0.2836626043024616,0.26892720133352,0.2738390023231672
N55141,news,newspolitics,"White House to cancel Times, Post subscriptions after Trump's 'Hannity' comments The White House said Tuesday that it will not be renewing subscriptions to the New York Times and The Washington Post.",0.2541917983645784,0.2927432568751779,0.27346752761987814,0.27989277070497803
N28149,sports,basketball_nba,"After summer moves, Jazz not worried about offensive stumbles to start season We've got to not think the game too much, just go out there and play.  Jeff Green",0.2541917983645784,0.3061372924692922,0.2801645454169353,0.2888221277677209
N49689,news,newspolitics,"Democrats confront the prospect of a long primary Joe Biden and Elizabeth Warren are holding steady, Bernie Sanders is bouncing back from his heart attack and Pete Buttigieg is springing to life in Iowa.",0.2541917983645784,0.2814783115475223,0.2678350549560503,0.2723828071532077
N4693,lifestyle,lifestylecelebstyle,"8 Times Ciara Was the Sexiest Person on the Red Carpet - or Within 50 Miles - This Year Ciara's red carpet style is automatic, supersonic, hypnotic, funky fresh, and - above all - unbelievably sexy.",0.2541917983645784,0.2982643764131297,0.27622808738885407,0.2835735170636126
N32089,foodanddrink,tipsandtricks,Costco workers reveal 6 things they'd never buy from the store Costco products are known for their reasonable prices and bulk sizes   but there are some employees say they choose to avoid.,0.2541984864744694,0.3071681269498619,0.2806833067121657,0.2895115801247311
N44559,health,health-news,Photo of emotional nurse after 'particularly hard day' goes viral Her sister revealed that she had just wrapped up four days worth of work that included assisting in the delivery of a stillborn baby.,0.254691584249241,0.270215961902699,0.26245377307596995,0.2650411693515463
N40640,foodanddrink,foodnews,"Foie Gras Is Banned by New York City Lutèce served it seared, with dark chocolate sauce and bitter orange marmalade. Le Cirque offered it in classic terrine form, but also served it with rabbit and bacon and made it the scene-stealer in a ravioli dish. But Lutèce closed in New York in 2004. Le Cirque shut its last Manhattan location in 2017. And foie gras, the calling card of fine French dining, is about to follow suit. The New York City Council overwhelmingly passed legislation on...",0.2546956319551753,0.3103969187822377,0.28254627536870647,0.2918298231732169
N26176,finance,finance-companies,"Walmart Sparks Panic and Confusion in the Dish-Soap Aisle Procter & Gamble didn't make enough dish soap, and Walmart is letting all its customers know about it.",0.2550089771115814,0.2757363437675952,0.2653726604395883,0.2688272215489239
N8331,entertainment,celebrity,"Melanie Griffith, 62, shows off her insane figure in lingerie selfie, plus more news Melanie Griffith looks more stunning than ever in lingerie selfie, plus more celebrity news for Oct. 30, 2019.",0.2556208284573078,0.2578826309438992,0.2567517297006035,0.2571286967817021
N42137,entertainment,celebrity,Celeb couples with big age gaps Age is just a number for some stars!,0.2559661715887405,0.2842088268550077,0.27008749922187414,0.27479460843291864
N59426,travel,travelnews,"Four American Airlines flight attendants arrested at Miami airport, accused of money laundering Four American Airlines flight attendants were arrested at Miami International Airport Monday on money laundering charges.",0.255986153346306,0.2348920017447369,0.24543907754552144,0.24192338561192658
N32893,weather,weathertopstories,"A Northeast storm is intensifying into a bomb cyclone, forecasters say A bomb cyclone is taking shape along the Eastern Seaboard and starting to make itself felt in the Northeast.",0.2564245898319821,0.2845409053187311,0.2704827475753566,0.27516880015648143
N41244,entertainment,entertainment-celebrity,"Keanu Reeves holds hands with Alexandra Grant as the Internet swoons, plus more news The Internet is even more in love with Keanu Reeves after Alexandra Grant PDA. Plus, more celebrity news for Nov. 5, 2019.",0.2564319468033781,0.2802621969597697,0.2683470718815739,0.27231878024097256
N22570,foodanddrink,foodnews,'Ghost kitchens' are taking over fast-food chains from Chick-fil-A to Wendy's Wendy's became the latest fast-food chain to name-check ghost kitchens on Friday at the company's investor day.,0.2565253829437812,0.3116276039198076,0.2840764934317944,0.2932601969277988
N18445,sports,football_ncaa,"Michigan sends breakup tweet to Notre Dame as series goes on hold Parting is such sweet sorrow, say the Wolverines.",0.2566029086501674,0.2903228769656156,0.2734628928078915,0.27908288752713284
N32852,news,newsus,"Nearly $400M worth of cocaine and marijuana intercepted by US Coast Guard The U.S. Coast Guard announced that it seized nearly $367 million of cocaine and about 11,000 pounds of marijuana worth an estimated $10.1 million at a Florida port.",0.2569169020524207,0.2704746631703514,0.26369578261138604,0.26595540946437446
N2511,foodanddrink,foodnews,"Krispy Kreme orders Minnesota student who bought, resold doughnuts to 'shut down operations' The people of Minnesota appear to once again be without Krispy Kreme doughnuts.",0.2571169872172398,0.281943820849754,0.26953040403349693,0.2736682096389159
N29757,sports,basketball_nba,Clippers set bad precedent resting Kawhi Leonard against Bucks The Los Angeles Clippers are continuing with the theme we saw with the Toronto Raptors last season. They've rested reigning NBA Finals MVP Kawhi Leonard in one game of a back-to-back already this season.,0.2577747959317198,0.3119384179718172,0.2848566069517685,0.2938838772917848
N43627,news,newsus,"The Justice Department is fishing for details about the anonymous 'resistance' op-ed writer The author, identified only as ""a senior official in the Trump administration,"" is set to release a tell-all book this month.",0.2578940965241215,0.2352134914726531,0.24655379399838728,0.2427736931564759
N14137,sports,football_nfl,MetLife Stadium searching for the famous black cat from 'Monday Night Football' ,0.2585676422284187,0.296975324735401,0.27777148348190983,0.2841727638997402
N45824,sports,football_nfl_videos,"Ian Rapoport: MRI results are good news for Patrick Mahomes, Kansas City Chiefs NFL Network Insider Ian Rapoport and James Palmer provide a Patrick Mahomes injury update.",0.2585676422284187,0.2877394669390372,0.2731535545837279,0.278015525368831
N52196,news,newspolitics,"Graham claims victory with impeachment vote Sen. Lindsey Graham, who introduced a resolution condemning secretive impeachment proceedings in the House, claimed victory Monday after House Speaker Nancy Pelosi announced she'll hold a formal vote and open up the hearings to the public.",0.2585676422284187,0.2635024374804259,0.26103503985442233,0.26185750572975686
N54807,news,newsworld,"Russia questions language of ""unusual"" Trump letter to Erdogan Russia questions language of ""unusual"" Trump letter to Erdogan",0.2585676422284187,0.2830435952431633,0.270805618735791,0.27488494423824844
N32027,sports,football_nfl,Payton declines to name Saints starting QB for Week 8 ,0.2585676422284187,0.3133887748629803,0.2859782085456995,0.2951150639847931
N10270,autos,autossports,"What Do Old-School Mustang Guys Think of the Kia Stinger? We wondered, so we put the Original Venice Crew in our long-term Stinger GT.",0.2585676422284187,0.2860891701630297,0.2723284061957242,0.2769153275181594
N53209,sports,baseball_mlb,"​Are the Astros stealing signs to gain an edge in ALCS? Hopefully. If your code is easy to crack, the problem is on you, not the codebreaker.",0.2585676422284187,0.285657249603603,0.27211244591601086,0.2766273804785416
N63306,sports,football_nfl,Jenkins' scorching response to Scandrick ripping Eagles Former Philadelphia Eagles cornerback Orlando Scandrick ripped into Malcolm Jenkins and his former teammates in general.,0.2585676422284187,0.3098947636124527,0.2842312029204357,0.29278572315110807
N34380,news,newspolitics,"House rejects GOP measure censuring Schiff Democrats in the House turned aside a GOP-led privileged resolution to censure House Intelligence Committee Chairman Adam Schiff (D-Calif.) on Monday in a 218-185 vote.Republicans and President Trump have increasingly targeted Schiff, a public face of the impeachment effort.They have taken issue with Schiff's exaggerated account of the details of President Trump's July 25 phone call with Ukrainian President Volodymyr Zelensky during a...",0.2585676422284187,0.2723936536291221,0.2654806479287704,0.267784983162221
N5019,sports,football_nfl,"Winners, losers from Cowboys' win over Giants on 'Monday Night Football' In a NFC East tilt, the Cowboys overwhelmed the Giants defense late while Big Blue continues to trip over its own feet.",0.2585676422284187,0.3139160017551349,0.28624182199177683,0.29546654857956284
N17463,news,newspolitics,"Democrats unveil procedures for Trump's impeachment inquiry, rebutting GOP attacks The resolution hands the lead role to the House Intelligence Committee and its chairman, Rep. Adam B. Schiff, who would have broad latitude to organize extended questioning of potential public witnesses.",0.2585676422284187,0.2583370400155961,0.25845234112200743,0.2584139074198703
N4745,news,newspolitics,"Testimony: White House lawyer told Vindman not to discuss Ukraine call The senior White House lawyer who placed a record of President Donald Trump's July 25 call with Ukraine's president in a top-secret system also instructed at least one official who heard the call not to tell anyone about it, according to testimony heard by House impeachment investigators this week.",0.2585676422284187,0.2720017506992286,0.2652846964638237,0.26752371454229196
N52865,news,newspolitics,Ohio's Reputation As a Must-Win State May No Longer Be True ,0.2585676422284187,0.2449666471961149,0.2517671447122668,0.24950031220688285
N52227,sports,basketball_nba,"Joel Embiid, Karl-Anthony Towns likely facing multi-game bans for roles in brawl Both teams don't play again until Saturday, so the league will have plenty of time to assess whether any players left the bench area, which could lead to additional suspensions.",0.2585676422284187,0.2643907652902674,0.2614792037593431,0.2624497242696512
N62283,news,newsworld,British PM denied new Brexit deal vote Prime Minister Boris Johnson prepared to Monday make a second attempt to ram his EU divorce deal through parliament and avoid the political damage of delaying Brexit next week. But EU officials were still making preparations for Britain to leave in 10 days' time.,0.2585676422284187,0.307301528966708,0.28293458559756335,0.2910569000539449
N27164,sports,football_nfl,"Burning questions for Dolphins vs. Steelers on 'Monday Night Football' The Dolphins (0-6) are visiting the Steelers (2-4) to close out NFL Week 8 on Monday Night Football. Fans should brace for an ugly game, because that's been a weekly occurrence whenever the Dolphins take the field.",0.2585676422284187,0.3018990521859878,0.2802333472072033,0.2874552488667981
N26606,autos,autosenthusiasts,2020 Shelby GT500 Aero Performance & Cooling Supercomputers and 3-D Printing are secrets to the all-new Mustang Shelby GT500's high performance.,0.2585676422284187,0.3182395803489017,0.2884036112886602,0.2983489343087407
N4408,sports,football_nfl,"Patrick Mahomes already back at practice for Chiefs Although Reid didn't rule Mahomes out for the team's Week 8 game, it seems like a long-shot for the quarterback to get back onto the field that quickly.",0.2585676422284187,0.3006954832142181,0.2796315627213184,0.286652869552285
N36068,sports,football_nfl,"AP source: Trent Williams ends holdout, reports to Redskins A person with knowledge of the situation says left tackle Trent Williams has reported to the Washington Redskins, ending his lengthy holdout. The person spoke to The Associated Press on condition of anonymity because the team had not announced Williams' return. He can be kept off the 53-man roster for up to three weeks after reporting. Washington did not deal the 31-year-old before the NFL trade deadline Tuesday, which prompted...",0.2585676422284187,0.3059823795862666,0.28227501090734264,0.29017746713365067
N37481,sports,football_nfl,Baker Mayfield blasts officials after Browns loss: Refs were 'pretty bad today' ,0.2585676422284187,0.275226709740358,0.26689717598438834,0.26967368723637825
