ID,category,sub_category,content,collaborative_rec,content_rec,mean,two_one
N60785,music,music-celebrity,"DMX heading back to rehab, cancels concerts DMX has long struggled with substance abuse.",0.2300561469467291,0.3064384999168335,0.26824732343178126,0.28097771559346535
N23784,music,music-gallery,"35 musicians you should see live at least once in your life If you have a chance to see these musicians live, you absolutely need to take the chance and grab a ticket.",0.2300561469467291,0.2987403049616705,0.2643982259541998,0.2758455856233567
N37681,sports,basketball_nba,Chris Paul receives standing ovation in return to Houston against Rockets ,0.2300561469467291,0.3243866755526838,0.27722141124970645,0.2929431660173656
N36353,weather,weathertopstories,"Halloween storm to dump 1st snow of season in parts of Midwest After a brief clip of wintry weather races through the central Plains and western Great Lakes to start the week, a much larger and more impactful winterlike storm will close out October.",0.2300561469467291,0.3079146745024329,0.268985410724581,0.28196183198386493
N44416,sports,more_sports,Rockets vs Nets game thread The Houston Rockets will look for their fourth straight win tonight against the Brooklyn Nets.,0.2300561469467291,0.321655949215716,0.27585604808122255,0.2911226817927204
N65204,movies,movies-celebrity,See Vin Diesel's 21st birthday post to Paul Walker's daughter Meadow The Fast & Furious franchise star has remained close to close to Paul's daughter following his death six years ago this month.,0.2300561469467291,0.2782258418909066,0.2541409944188179,0.2621692769095141
N44984,sports,football_nfl,"Who the Houston Roughnecks took in the XFL Draft Twenty-two of the 42 players added to the Houston Roughnecks roster through the inaugural XFL Draft this week have been on active NFL rosters in their careers. Twelve of those players played multiple seasons in the NFL. Among the most well-known players selected by the Roughnecks include quarterback Connor Cook, who started a playoff game for the Raiders, who lost that game to the Texans in January 2017. Receiver Sammie Coates also was taken by...",0.2300561469467291,0.3110685440153083,0.2705623454810187,0.2840644116591152
N20680,sports,football_nfl,Saints DBs mocked Bears RB Tarik Cohen for being short during heated argument Things go personal in Chicago.,0.2300561469467291,0.3033315304084208,0.26669383867757496,0.2789064025878569
N37586,autos,autosclassics,The 50 most expensive cars ever sold at auction Breaking records and bank accounts,0.2300561469467291,0.2918717302041405,0.26096393857543476,0.27126653578500337
N48621,finance,personalfinance,"The 25 richest families in America Stacker compiled a list of the 25 richest American families using 2019 data from Forbes. From winemakers to oil tycoons, find out which American families have a combined net worth of more than $721.5 billion.",0.2300561469467291,0.3040996874500852,0.2670779171984071,0.27941850728229983
N25114,lifestyle,lifestylebuzz,"There's a mouse hiding among mushrooms in this viral brainteaser. Can you spot it? Artist Gergely Dudás expertly hides hard-to-find objects in his vibrant illustrations, creating viral brainteasers that stump the internet.",0.2300561469467291,0.2905545963465331,0.2603053716466311,0.27038844654659844
N50372,entertainment,celebrity,Celebrity mug shots Check out the best celebrity mug shots of all time!,0.2300561469467291,0.2726489289397271,0.2513525379432281,0.2584513349420611
N47687,sports,basketball_nba,Video emerges of Rockets fan punching Pelicans assistant coach A television station obtained video showing a fan at Toyota Center punching New Orleans Pelicans assistant coach Joe Boylan.,0.2300561469467291,0.3019966283207331,0.2660263876337311,0.27801646786273176
N53017,lifestyle,lifestylebuzz,Kendall Jenner Wore the Tiniest Dress to Go Jewelry Shopping No fall layers to see here.,0.2305913271324522,0.3001545271509671,0.2653729271417096,0.2769667938114621
N53880,finance,markets,"The megaprojects that changed countries forever Megaprojects are complex and expensive ventures that take years to complete. Although the massive scale of these projects makes them fraught with risk, they also have the capacity to bring great economic and social benefits during and after construction. Whether good or bad, these are the megaprojects that have shaped the future of their countries in a big way.",0.2307386284610342,0.3243171060830303,0.27752786727203227,0.29312428020903164
N33013,lifestyle,lifestylebuzz,"Couple Cancels Wedding, Keeps $30K as ""Donation"" for Honeymoon Instead In a viral Facebook post, a couple announces they're canceling their wedding, but keeping the $30,000 in gifts for a honeymoon instead.",0.2307386284610342,0.2980728125169272,0.2644057204889807,0.2756280844982962
N25258,sports,boxing,Evander Holyfield's son wins pro boxing debut in 16 seconds ,0.2311124219115196,0.2849298259689186,0.2580211239402191,0.2669906912831189
N59359,news,newscrime,Police Arrest Motorcyclist Who Led High-Speed Chase And Went Home Thinking He Escaped A motorcyclist was arrested after leading California Highway Patrol units on a high-speed chase in Placerville on Saturday.,0.2311577095453617,0.2774048603635496,0.2542812849544557,0.26198914342415364
N62471,sports,football_nfl,"Trent Williams fails physical, experiencing discomfort with helmet Washington Redskins tackle Trent Williams' health situation has managed to get stranger after he reported to the team.",0.2314055734924895,0.2999316318352787,0.2656686026638841,0.2770896123876823
N2805,movies,movienews,"Star Wars: The Rise of Skywalker trailer is out, tickets already on sale The trailer debuted during Monday Night Football halftime, on Carrie Fisher's birthday.",0.2314386812712433,0.2797097874924784,0.25557423438186083,0.2636194187520667
N57239,movies,movies-celebrity,Emma Watson Says She Rejects the Word Single: 'I Call It Being Self-Partnered' Emma Watson Rejects the Word Single: 'I Call It Being Self-Partnered',0.2314386812712433,0.2806610509328743,0.2560498661020588,0.2642535943789973
N62285,news,newsus,"Former Florida cop won't serve jail time after accidentally killing woman, 73, in training exercise A former Florida police officer who accidentally shot and killed a 73-year-old woman during a demonstration will not serve any jail time as part of a plea agreement.",0.2317209580283816,0.264994507477415,0.2483577327528983,0.2539033243277372
N13912,travel,traveltips,A lawyer reveals a legal nightmare you can face on a cruise ship Cruise ship passengers can be exposed to legal systems that don't provide the same protections they would find in the US.,0.2317209580283816,0.2244599631095574,0.2280904605689695,0.2268802947491655
N15122,tv,tv-celebrity,Tamron Hall says she 'never dealt' cocaine after reports say she confessed to doing so Tamron Hall issued a statement in response to the Daily Mail reporting that she confessed to facilitating the sale of cocaine as a teenager.,0.2320859498519542,0.243193845926475,0.23763989788921458,0.23949121390163475
N42128,movies,movies-celebrity,"Hugh Hefner's son Cooper weds 'Harry Potter' actress Cooper Hefner married Scarlett Byrne in Ventura, Calif., on Monday.",0.2321304486427315,0.249096262197406,0.24061335542006873,0.24344099101251448
N30698,news,newsus,Cranes remove bus partially swallowed by Pittsburgh sinkhole A bus that was partially swallowed when a sinkhole opened during morning rush hour in downtown Pittsburgh has been removed from the hole. Authorities said earlier Monday that two cranes arrived to remove the city bus.,0.2322371918354669,0.3015557547625854,0.26689647329902616,0.27844956712021257
N57737,news,newsus,"Missing Minnesota boy, 6, and his dog, found in cornfield by drone with thermal camera A missing 6-year-old boy from Minnesota and his dog were found Wednesday after hundreds of volunteers   including one who used his own drone with a thermal camera   searched for him for hours.",0.2323649736876716,0.3036747608401438,0.2680198672639077,0.2799048317893197
N24889,news,newspolitics,"McConnell tees off on Democrats over impeachment Senate Majority Leader Mitch McConnell (R-Ky.) teed off against the House impeachment inquiry on Tuesday, marking his first comments since Congress returned from its two-week break. ""House Democrats are finally indulging in their impeachment obsession. Full steam ahead,"" McConnell said during a speech from the Senate floor, adding that House Speaker Nancy Pelosi (D-Calif.) had ""crumbled"" to the ""left-wing impeachment caucus."" ""I don't...",0.2327215378278992,0.2666708409978096,0.24969618941285437,0.2553544066078395
N56461,finance,finance-taxes,"President Trump's trillion-dollar hit to homeowners People should consider one of the largely unexamined effects of the last tax bill, which Trump promised would help the middle class: Would you believe it has inflicted a trillion dollars of damage on homeowners?",0.2330240991779312,0.2666356833193326,0.2498298912486319,0.2554318219388655
N14349,entertainment,celebrity,Celebrity Headshots from Before They Were Famous Prepare for some straight-up baby faces.,0.2331634039282291,0.2747607968776251,0.2539621004029271,0.26089499922782644
N41218,news,newspolitics,"Election Day 2019: Most Important Races and What to Watch For In elections that will determine policy, the political makeup of state legislatures and who lives in governors' mansions, voters will head to the polls Tuesday in states across the country.",0.2332725082111538,0.265922360348052,0.2495974342796029,0.2550390763024193
N719,finance,finance-companies,"Nevada gambling bosses move to bar Wynn from casino industry The complaint filed Monday by the state's Gaming Control Board lists sexual misconduct allegations that have been lodged against the mogul since January 2018. The complaint asks Nevada's Gaming Commission, which acts on the board's recommendations and has final say on licensing, to fine Wynn and revoke his status as being found suitable to be licensed in the industry.",0.2336982501385706,0.2690240949654804,0.2513611725520255,0.25724881335651045
N47485,news,newsus,"Health warning lifted over fire at California oil facility Authorities have lifted shelter-in-place orders for some 12,000 people in Northern California after containment of a fire at a fuel storage facility that sent up a huge cloud of smoke. Emergency sirens blared and thick plumes of black smoke and flames filled the skyline around the NuStar Energy LP facility in Crockett, California, about 30 miles (50 kilometers) northeast of downtown San Francisco.",0.2336982501385706,0.2991036040885949,0.26640092711358276,0.2773018194385868
N48031,sports,basketball_nba,Ex-Maverick to pay for funeral of woman fatally shot in home by police ,0.2341214858487874,0.260157588738019,0.24713953729340318,0.25147888777494176
N6244,news,newscrime,Suspect Alfredo Vazquez pleads guilty in Clark County judges' shooting case ,0.2341214858487874,0.2477244707711852,0.2409229783099863,0.24319014246371928
N31402,foodanddrink,restaurantsandnews,"The Best Seafood Restaurant in All 50 States Think there are too many seafood places in Maine to choose among, but none in landlocked Nebraska? This list will point your cravings and more in the right direction. Whether it's shrimp, crab, fish, or sushi that you love, even the most landlocked states have top-notch options for seafood. Find out what's near you.",0.2341214858487874,0.3154206814675928,0.2747710836581901,0.28832094959465765
N50528,news,newscrime,Man shot in the chest on Floyd Street ,0.2341214858487874,0.2960219365159232,0.2650717111823553,0.27538845296021125
N8429,weather,weathertopstories,"Group clears plastic drums, tires from Falls of the Ohio State Park LOUISVILLE, Ky. (WHAS11)   The Falls of the Ohio is a little cleaner after volunteers helped return it to its glory. The volunteers picked up trash and debris along with old tires and leftover plastic barrels. It was part of Moran Environmental Recovery's effort to clean up parts of the state park. The group says over the years, the site has experienced waste dumping leaving the grounds full of empty drums, tires and glass. The state park is the...",0.2341214858487874,0.2985418542682224,0.2663316700585049,0.2770683981284107
N48390,travel,travelnews,First round of auctions begin for Joe Ley Antiques ,0.2341214858487874,0.2794260644027866,0.25677377512578703,0.2643245382181202
N31739,news,newscrime,"'Habitual stowaway' arrested again at O'Hare, Chicago police say A woman arrested at O'Hare International Airport on Friday night was identified by Chicago police as ""known habitual stowaway"" Marilyn Hartman.",0.2341214858487874,0.2558512305985909,0.24498635822368914,0.2486079823486564
N42704,news,newscrime,UPDATE: Coroner reveals identity of victim in Beechmont neighborhood shooting ,0.2341214858487874,0.2857677369254334,0.2599446113871104,0.2685523198998847
N6087,news,newsworld,"U.S. bans all flights to Cuba outside Havana in latest crackdown American Airlines and JetBlue, which fly routes to Cuba other than Havana, will have to submit to new regulations from the Transportation Department.",0.2341214858487874,0.2776425129653251,0.25588199940705625,0.2631355039264792
N23061,news,newscrime,"Police arrest suspect in Bashford Manor double shooting Police have identified the suspect in a double shooting that happened in Bashford Manor. On Thursday, officers arrested Matthew Martin on attempted murder and other drug-related charges. Police said Martin and one of the victims pulled out guns during an argument that happened at Martin's apartment on Goldsmith Lane Wednesday afternoon. Following the argument, both victims were shot in the back as they ran down the hallway and were transported...",0.2341214858487874,0.286914202204384,0.26051784402658573,0.2693166300858518
N45099,news,newscrime,Suspect in crossbow murder of his father arraigned ,0.2341214858487874,0.2191985134512037,0.22665999964999556,0.22417283758373158
N63317,news,newscrime,"Police: 4 charged with attempted murder month after shooting in SW Louisville Four people are facing attempted murder charges for a shooting last month in southwest Louisville. According to arrest citations, a group arrived at an apartment in the 9600 block of Lamborne Boulevard on Sept. 27 and attempted to lure a male, unknown age, out of his apartment. When the victim agreed to come outside, police said Byron Kirby, 25, shot at the victim four times. The victim then ran into the woods. It's unclear if he was hit....",0.2341214858487874,0.2786003871100381,0.2563609364794127,0.2637740866896212
N3433,finance,finance-companies,A secretive family landing a $4 billion haul has everyone guessing One of the world's richest and most discreet families must decide what to do with a massive pile of cash.,0.2341214858487874,0.2355681706856571,0.23484482826722225,0.23508594240670055
N43353,news,newscrime,"Wedding shooter may have been avenging late stepfather's murder, authorities say Brandon Castiglione, the groom's son, was previously charged with second-degree murder in the death of the suspect's stepfather.",0.2341214858487874,0.2433599468866979,0.23874071636774263,0.24028045987406105
N59049,news,newsworld,"Three gunmen killed in Brazil airport raid, kidnapping: police Heavily armed gunmen raided an airport in Brazil on Thursday, officials said, stealing money from an armored truck before fleeing and taking a mother and baby hostage. At least one assailant escaped to a nearby residential neighborhood, taking a mother and her baby hostage in their home, the police spokeswoman said.",0.2341214858487874,0.2691949674841567,0.2516582266664721,0.25750380693903363
N6072,news,newsus,"Search resumes for worker missing in New Orleans Hard Rock Hotel building site collapse that killed 2 Rescuers resumed searching Sunday for a worker trapped in rubble after a deadly construction collapse in New Orleans, officials said, but the building's instability is making for a precarious situation.",0.2341214858487874,0.3066866634858812,0.2704040746673343,0.28249827094018326
N34567,news,newscrime,Grandfather charged in death of toddler who fell on cruise ship in Puerto Rico A grandfather who police say dropped his young niece from the 11th floor of a cruise ship docked in Puerto Rico in July has been accused of negligent homicide.,0.2341214858487874,0.2394375510423738,0.2367795184455806,0.23766552931117835
N35656,travel,travelnews,Motorcyclist killed in crash on New Cut Road identified ,0.2341214858487874,0.2911623611345608,0.2626419234916741,0.272148736039303
N15710,news,newscrime,Arrest made in connection to stabbing in South Louisville ,0.2341214858487874,0.2604773997922556,0.2472994428205215,0.25169209514443286
N51163,lifestyle,lifestylebuzz,"He grew a 910-pound pumpkin and then used it as a boat Instead of making a giant jack o'lantern or a massive pie that could feed the whole town, a farmer in Tennessee took his 910-pound pumpkin out for a spin in his pond.",0.2341214858487874,0.3127345403937737,0.2734280131212805,0.28653018887877824
N1569,news,newsus,"Officer who shot naked man found not guilty of murder DECATUR, Ga. (AP)   A former Georgia police officer who fatally shot an unarmed, naked man was found not guilty of murder Monday but was convicted of aggravated assault and other charges that could send him to prison for more than 30 years. Robert ""Chip"" Olsen's face turned red and he squeezed his eyes shut tightly as the verdict was read. His wife, Kathy Olsen, began sobbing and had to be led from the courtroom. DeKalb County Superior Court...",0.2341214858487874,0.2784569579017888,0.25628922187528813,0.263678467217455
N22976,news,newsus,"The Sante Fe High School massacre suspect isn't fit to stand trial and will get psychiatric treatment, attorney says Dimitrios Pagourtzis is accused of killing eight students and two teachers at his Texas high school last year.",0.2341214858487874,0.2355223804934104,0.2348219331710989,0.23505541561186938
N63045,news,newscrime,"Coroner IDs man found dead in Klondike neighborhood A man who was found dead in the Klondike neighborhood has been identified. Louisville Metro police responded to the 3200 block of Pomeroy Drive for a call of a person down Friday. Officials said Kevin Hellems, 54, was found dead inside the home from some type of foul play. No other information has been released. The death comes as a surprise to the neighbors in the area, who say they aren't used to seeing police cars and detectives on this...",0.2341214858487874,0.3014708172759903,0.26779615156238884,0.2790210401335893
N44462,news,newscrime,"Louisville man who shot at LMPD officer sentenced to 10 more years in prison A Louisville man convicted of shooting at an officer was sentenced Friday. Judge David Hale sentenced Elijah Eubanks, 22, to 119 months in prison for a federal weapons charge. Sign up for our Newsletters In March 2018, Eubanks opened fire on an officer who was attempting to question him while he was in his vehicle with another person. No officers were hit, but Eubanks was shot multiple times when officers returned fire. Eubanks was previously...",0.2341214858487874,0.2926175418930191,0.26336951387090324,0.27311885654494183
N5398,news,newscrime,Suspects identified following hours-long SWAT standoff on South 34th Street ,0.2341214858487874,0.2566786249689066,0.245400055408847,0.2491595785955335
N65112,news,newscrime,"Family says 16-year-old was victim hit, killed on I-64 The person struck by 5 vehicles on Interstate 64 Friday night was a 16-year-old girl, according to family members. The girl's father, Ronnie Click, spoke with WHAS11 News Saturday and said his daughter Brea was killed in that incident. Police responded to I-64 near the 22nd Street exit after they received reports that a person had been hit while walking in the slow lane. RELATED: LMPD: Pedestrian struck and killed on I-64 E at 22nd Street Once...",0.2341214858487874,0.273427799525105,0.25377464268694616,0.26032569496633245
N2663,news,newsworld,16 sentenced to death for burning alive Bangladesh teen Sixteen people were sentenced to death Thursday for burning alive a Bangladeshi teenager who refused to withdraw sexual assault charges against her head teacher.,0.2341214858487874,0.2516723064116979,0.24289689613024265,0.24582203289072774
N19041,news,newscrime,Kroger shooting: Suspect coming out of store fires at officers before they shoot him dead ,0.2341214858487874,0.2809333968134118,0.2575274413310996,0.2653294264918703
N61101,news,newscrime,"Resident recalls moments leading up to fatal shooting in Russell neighborhood In the Russell neighborhood, crime tape has become a well known sight that's why Lisa Tutt encourages her son and his friends to hang out at her house. READ THE FULL STORY:Resident recalls moments leading up to fatal shooting in Russell neighborhood Sign up for our Newsletters CHECK OUT WLKY:Live. Local. Late-Breaking. Get the top Louisville news, weather and sports from the team at WLKY   online, anytime.",0.2341214858487874,0.2638127096555102,0.24896709775214879,0.25391563505326925
N19709,news,newscrime,Teen given 8 years in prison for gang-related hate crime of student caught on tape A California teenager has been sentenced to eight years in prison for a gang-affiliated hate crime assault on another student.,0.2341214858487874,0.2498571583863463,0.24198932211756685,0.24461193420716
N10438,lifestyle,lifestylebuzz,"Pope Lick Legend: Loved ones of those who died on trestle push for change Legends of a monster living under a dangerous train trestle have lured people to a quiet Louisville creek for decades. Some swear they have seen proof of a human-goat hybrid terrorizing the area. Others leave with no sightings and no story to tell. Those are the lucky ones. The story of a ""Pope Lick Monster"" or ""Goatman"" haunting the trestle at Pope Lick Creek has been commonplace in Louisville even becoming the focus of a movie in the late...",0.2341214858487874,0.2960590471036055,0.26509026647619643,0.27541319335199943
N61355,news,newscrime,"2 Murder suspects escape from Monterey County, California, Jail The suspects are considered dangerous and should not be approached. Anyone who sees them should call 911 immediately.",0.2341214858487874,0.2587746263819963,0.24644805611539183,0.25055691287092663
N29802,finance,finance-companies,"Barneys Is Sold for Scrap, Ending an Era Authentic Brands Group will take control of the Barneys name   one that has been part of the Manhattan landscape since 1923   and license it to other companies like Saks Fifth Avenue. The firm B. Riley Financial is preparing to liquidate Barneys' high-end wares, at its five stores and two Warehouse locations, starting with private sale events for Barneys' ""most loyal"" shoppers next week.",0.2341214858487874,0.293255055456931,0.26368827065285916,0.2735438655875498
N55833,news,newscrime,"Oldham County man charged, injuring victim during shooting practice ",0.2341214858487874,0.2709599626977254,0.25254072427325636,0.25868047041474607
N29948,lifestyle,lifestyle-news-feature,"A White Woman Searches for Her Black Family DNA testing tells people a lot about their geographic ancestry, prompting difficult questions about racial identity and belonging. ""In my heart, I feel a connection.""",0.2341214858487874,0.2632893493477618,0.2487054175982746,0.253566728181437
N31741,music,musicnews,"Snoop Dogg bringing 'I Wanna Thank Me' tour to Louisville Palace Multi-platinum rap legend Snoop Dogg is bringing his ""I Wanna Thank Me"" tour to the Louisville Palace in 2020. The venue announced on Twitter that the show is scheduled for Jan. 25. Live Nation presale starts starts Thursday at 10 a.m., and tickets go on sale to the general public Friday at 10 a.m. The Long Beach native released his 17th album, ""I Wanna Thank Me,"" in August. The Doggfather's West Coast G-funk style has sold more than 38 million...",0.2341214858487874,0.32252075819799,0.27832112202338866,0.2930543340815891
N3142,health,health-news,"Teen wins science competition with liquid bandage invention Kara Fan beat nine other finalists and hundreds of students who submitted ideas in the 3M​ Young Scientist Challenge, winning $25,000.",0.2341214858487874,0.2831151155835988,0.2586183007161931,0.266783905671995
N62612,news,newscrime,16-year-old injured in shooting near Churchill Downs ,0.2341214858487874,0.2668529294686762,0.2504872076587318,0.2559424482620466
N21773,travel,travelnews,Lumber spilled on I-71 following rollover crash; Lanes shut down ,0.2341214858487874,0.2738580671282686,0.253989776488528,0.2606125400351082
N58224,news,newscrime,"13-year-old charged with two murders escapes custody in North Carolina Officials said they have concerns for public safety due to the teen's ""prior history of assaultive and unpredictable behavior.""",0.2341214858487874,0.2222858709800382,0.2282036784144128,0.22623107593628794
N24611,news,newscrime,"Former Jewish Hospital nurse to be arraigned on sexual abuse of patient charge According to court documents, Dorsey told the woman ""repeatedly"" that, ""I would like to video you.""",0.2341214858487874,0.2533915831759934,0.2437565345123904,0.2469682174002581
N41011,news,newsworld,"For the first time, a man has been sentenced for sexual slavery by the International Criminal Court. He got 30 years. Bosco Ntaganda is a former Congolese rebel nicknamed the ""Terminator."" The ICC convicted him on 18 counts including murder, sexual slavery and using child soldiers.",0.2341214858487874,0.272436770627097,0.2532791282379422,0.2596650090343271
N54889,lifestyle,lifestyle-news-feature,"Chris, the famously woolly sheep, has died Chris made headlines in 2015 after he became the unofficial world record holder for having grown the heaviest fleece.",0.2341214858487874,0.2918121823640407,0.2629668341064141,0.2725819501922896
