ID,category,sub_category,content,collaborative_rec,content_rec,mean,two_one
N29924,autos,autosenthusiasts,"25 Cars No One Wanted to Buy Along with cars so bad they become icons and the models that should have worked but never caught on come a slew of vehicles that'll have you scratching your head. Remind yourself of the disasters that were the Cadillac Catera, Buick Reatta, Volkswagen Phaeton, Lincoln Blackwood, Chrysler Executive Limousine, and more.",0.1840691365229938,0.2985948043688288,0.24133197044591131,0.26041958175355046
N2153,news,newsworld,"Iran alleges foreign government behind 'treacherous' ship attack Iran said Monday a foreign government was behind what it alleges was a ""treacherous"" attack on a tanker off Saudi Arabia last week, as it released pictures of its damaged hull. But the state-owned NITC denied reports the alleged attack had originated from Saudi soil.",0.1840691365229938,0.2508899180926448,0.21747952730781933,0.2286163242360945
N26122,weather,weatherfullscreenmaps,"Explosive new wildfire drives thousands from homes near Los Angeles The Maria fire ignited in Ventura County early Thursday night and raced westward, consuming 4,000 acres in just three hours.",0.1840691365229938,0.2464875652055985,0.21527835086429614,0.22568142231139693
N5887,weather,weathertopstories,"Lucky Texas Storm Chaser Sees Hailstones Whizz Past Him During Tornado Storm chaser Marcus Diaz may think twice about how close he gets to the elements after large hailstones whizzed past his head from behind as he was filming an EF2 tornado in Tahoka, Texas, earlier this year. According to Accuweather, the winds in the tornado reached ""between 113 and 157 mph."" Diaz posted footage of the moment he was filming a ""dusty EF-2 tornado at close range"" as the hailstones almost hit ""the camera from behind,"" to Twitter on October 17. The lucky storm chaser told Storyful the footage was recorded on May 5. No injuries were reported as a result of the storm. However, the cyclone ripped through agricultural areas, ""causing structural damage to farms and wrecking equipment, power lines, and irrigation systems,"" according to media reports. Diaz may be better served in the future by heeding the advice of the National Oceanic and Atmospheric Administration (NOAA). According to NOAA, ""if you are unable to make it to a safe shelter, either get down in your car and cover your head, or abandon your car and seek shelter in a low lying area such as a ditch or ravine."" Credit: Marcus Diaz via Storyful",0.1840691365229938,0.25966932239986,0.2218692294614269,0.2344692604409046
N15919,news,newsus,"Saddleridge fire calms down, heavy rains on East Coast A new storm system is developing in the southern Plains and will move east over the next few days bringing a threat of flooding to the South with rain and gusty winds.",0.1840691365229938,0.2554185061464109,0.21974382133470233,0.23163538293860517
N391,news,newsus,"Illegal drones ground water-dropping helicopters at critical moment in Maria fire battle LOS ANGELES - As flames rapidly spread along a hillside in Santa Paula, firefighters were faced with a perilous dilemma: ground night-flying helicopters working to contain the growing fire or risk an aerial collision with a thrill-seeking drone.",0.1840691365229938,0.2429607647380436,0.2135149506305187,0.22333022199969366
N64049,news,newsworld,"After Soldiers Surrender El Chapo's Son, a Shocked Mexican City Sighs With Relief In the days following the siege of the city of Culiacán by the Sinaloa cartel, residents were overcome with relief: Relief that the terror is over.",0.1840691365229938,0.2149064614479032,0.1994877989854485,0.20462735313960007
N41420,news,newsus,Cracks found on 38 of 810 Boeing 737 NG jets inspected globally Cracks found on 38 of 810 Boeing 737 NG jets inspected globally,0.1840691365229938,0.2803996295175296,0.23223438302026173,0.24828946518601766
N37720,health,nutrition,"23 Foods That Help Lower High Blood Pressure Consuming less sodium may be important to help slash blood pressure levels, but eating more of these foods is good for your heart and arteries too. The post 23 Foods That Help Lower High Blood Pressure appeared first on The Healthy.",0.1840691365229938,0.3445973801182374,0.2643332583206156,0.2910879655864895
N15122,tv,tv-celebrity,Tamron Hall says she 'never dealt' cocaine after reports say she confessed to doing so Tamron Hall issued a statement in response to the Daily Mail reporting that she confessed to facilitating the sale of cocaine as a teenager.,0.1842682692590725,0.2248478177514501,0.2045580435052613,0.21132130158732423
N56630,finance,markets,China asks WTO for $2.4 billion sanctions against U.S. in latest clash China asks WTO for $2.4 billion sanctions against U.S. in latest clash,0.1844084762216415,0.2597923530975911,0.22210041465961627,0.23466439413894122
N60340,lifestyle,lifestyleroyals,"Here's Why Harry and Meghan's Latest Interview Could Be the Final Straw for the Royal Family In Prince Harry and Meghan Markle's ITV interview on Oct. 20, they said they're unhappy living in a fishbowl. An insider reveals the palace's response.",0.1847611867854201,0.2233713485813718,0.20406626768339597,0.2105012946493879
N61388,movies,movies-celebrity,"Judge: Brad Pitt, others can be sued over New Orleans homes The Times-Picayune/ The New Orleans Advocate reports Pitt and other foundation directors asked the court to remove them from the lawsuit, saying they weren't personally responsible for the construction.",0.1849055469320374,0.2102408536304398,0.1975732002812386,0.201795751397639
N5978,finance,markets,"Eric Tse, 24, just became a billionaire overnight A 24-year-old business school graduate has just become an overnight billionaire.",0.1852750673968756,0.2414236028361119,0.21334933511649373,0.22270742435636645
N4607,autos,autosnews,Cause determined in Jessi Combs' fatal speed record crash Occurred at speeds near 550 mph,0.1854515641768534,0.2433492070122609,0.21440038559455715,0.22404999273379175
N28088,movies,movies-celebrity,Bruce Willis brought Demi Moore to tears after reading her book Demi wasn't sure how her ex would feel about her book until he called her.,0.1855859303564057,0.251402890950901,0.21849441065365335,0.22946390408606923
N14385,news,newsworld,ISIS names successor to slain leader al-Baghdadi The militant group named Abu Ibrahim Hashimi al-Quraishi as the new leader in a message posted by its official media wing.,0.1857725685437017,0.2692540503630205,0.22751330945336112,0.24142688975658091
N10340,foodanddrink,tipsandtricks,"The French Grandmother's Clever Trick to Keeping Fruit Flies Away When I worked in Paris as an au pair, I marveled at how the French seemed to have it all figured out. The family's grandmother always set the table with the good silver even on a Tuesday. I was instructed to pick up fresh, fluffy chouquettes from the boulangerie for the kids' after-school snack instead of, I don't know, granola bars (which is what I would've gotten). It was almost irritating how everyone around me seemed to have effortlessly...",0.1862176027303659,0.2705192447711911,0.22836842375077848,0.24241869742424937
N31801,news,newspolitics,Joe Biden reportedly denied Communion at a South Carolina church because of his stance on abortion Joe Biden has a complicated history with the Catholic Church.,0.186263740794946,0.243617944907248,0.214940842851097,0.224499876869814
N33502,finance,markets,"China's trade with US shrinks in October despite optimism BEIJING (AP)   U.S.-Chinese trade contracted again in October, despite optimism about possible progress in talks aimed at ending a tariff war that threatens global economic growth.",0.1866340581917991,0.2697803647049184,0.22820721144835876,0.2420649292005453
N54522,entertainment,celebrity,"Ben Affleck has a new girlfriend after using the Raya dating app, plus more celeb love life news for late October 2019 Meg Ryan and John Mellencamp call it quits, Halsey and Evan Peters get serious, James McAvoy weds, Meghan King Edmonds accuses hubby of cheating and more.",0.1871837859827172,0.2275371657937681,0.20736047588824263,0.21408603919008448
N13137,video,popculture,"Singer stands up to heckler who told her to take shirt off After being heckled on stage and told to ""free the nips"" at a concert in Texas, singer Maggie Rogers voiced her anger about the harassment.",0.1871878636701088,0.2191425192434124,0.2031651914567606,0.20849096738564454
N34399,foodanddrink,restaurantsandnews,Burger King's new 'Ghost Whopper' is here to haunt your Halloween order The Ghost Whopper will be available at 10 select restaurants beginning Oct. 24. The only thing scarier than Burger King's new Ghost Whopper is the thought of having no Whoppers at all.,0.1872190464219814,0.2926225693504528,0.23992080788621709,0.257488061707629
N62703,autos,autosnews,"Does Tire Rotation Include Tightening Lug Nuts? Michigan Court Thinks About It For Awhile, Concludes 'No' In what will surely go down in history as one of the most Galaxy Brain court rulings of all time, a Michigan appeals court determined that a tire rotation does not, in fact, include tightening the lug nuts.",0.1872883988493628,0.2694902010601852,0.22838929995477397,0.2420896003232444
N17099,news,newscrime,Missing New Hampshire couple's bodies found buried on a Texas beach James and Michelle Butler had been camping in their RV along the South Texas coast when they went missing in mid-October.,0.1873427285282165,0.2113824729242219,0.1993626007262192,0.2033692247922201
N61070,news,newscrime,Man arrested in 1993 cold case rape after he's identified by DNA: Police The suspect was 28 at the time and not known to the victim.,0.1874747225415625,0.240290738163282,0.21388273035242225,0.22268539962270884
N28058,lifestyle,lifestylebuzz,Strange Dog Shows Up On Woman's Lawn   And Seems To Recognize Her Kate Howard was sitting outside her home one afternoon after a memorial service when something amazing happened.,0.1879198697481207,0.2365271800422439,0.21222352489518231,0.22032474327753615
N42470,finance,finance-companies,G.M. Workers Approve Contract and End U.A.W. Strike The longest nationwide strike against General Motors in half a century ended on Friday after a solid majority of the company's union members delivered their support for the four-year contract hammered out by their leaders. The United Auto Workers union emerged with substantial wage increases and succeeded in ending a two-tier wage structure that had been a particular irritant in its ranks. It also won commitments to new G.M. investments in...,0.1879844768181187,0.2950263201822809,0.2415053985001998,0.2593457057275602
N7132,lifestyle,lifestylebuzz,"8 Hero Dogs That We Don't Deserve From trained search and rescue dogs, to a cosmonaut, to a boxer with a penchant for recycling, here are 8 dogs who deserve all the belly rubs.",0.1883290111396912,0.2834615852142295,0.23589529817696034,0.2517507271893834
N5445,weather,weathertopstories,"Wild fall freeze: Utah falls close to minus-35 as West shivers, while bitter cold oozes east Denver could start Halloween morning near 0 degrees.",0.188973266678834,0.2678340062684374,0.2284036364736357,0.24154709307190292
N15034,tv,tv-celebrity,Alec Baldwin's 'heart goes out to' imprisoned Felicity Huffman and husband William H. Macy Alec Baldwin thinks incarceration shouldn't be a consequence for those guilty in the admissions scandal and gave a shout-out to Felicity Huffman.,0.1890013297209856,0.1986620139045878,0.1938316718127867,0.19544178584338706
N20121,music,musicnews,"Bob Kingsley, Country Radio Legend, Dead at 80 Country radio legend Bob Kingley, the longtime host of the nationally syndicated program Bob Kingsley's Country Top 40, died early Thursday in Weatherford, Texas, following a lengthy battle with bladder cancer. He was 80 years old. A member of the Country Radio Broadcasters Hall of Fame, inducted in 1998, he later became only the format's fifth representative in the National Radio Hall of Fame in 2016. Kingsley was 18 and serving in the Air...",0.1892756985110743,0.2750201084858021,0.2321479034984382,0.24643863849422618
N42620,lifestyle,lifestylebuzz,"Heidi Klum's 2019 Halloween Costume Transformation Is Mind-Blowing   But, Like, What Is It? You might say she's scary good at playing dress-up, because Heidi Klum's 2019 Halloween costume is even more impressive than we could have imagined   and that's saying a lot, considering transformative Halloween costumes are kind of her thing. But this year Klum took it up one more notch as she shared her metamorphosis into,",0.1893680517666815,0.2643292595045319,0.2268486556356067,0.23934219025858178
N46616,foodanddrink,newstrends,"The best sandwich shop in every US state and DC You don't need to look far to find a great sandwich in the USA. We've rounded up the best sandwich joints in every state, spanning the range from old-school delis still whipping up traditional favorites to quirky, modern joints putting innovative ingredients to work. Pull up a stool and sink your teeth into these mouthwatering offerings.",0.1893786137891407,0.3135683293120539,0.2514734715505973,0.27217175747108285
N21136,tv,tv-celebrity,Andy Cohen Says He Doesn't Feel Guilty About Joe and Teresa Giudice's Legal Fate After RHONJ Andy Cohen Doesn't Feel Guilt About Joe and Teresa Giudice,0.1898706081006911,0.2032752024484426,0.19657290527456683,0.19880700433252543
N35022,lifestyle,lifestylebuzz,"Bed, Bath and Beyond Pulls 'Blackface Pumpkins From the Shelves The pumpkins were removed from stores after an upstate New York community filed complaints.",0.1899421956525989,0.2490690074505092,0.21950560155155405,0.2293600701845391
N16290,news,newsus,"Missouri man missing for a week found alive in car that crashed into ravine Ryan Linneman, of Lee's Summit, was found by a dirt bike rider in wreckage along Interstate 470 in Kansas City, Lee's Summit police said.",0.1901805671900092,0.2452988797946428,0.217739723492326,0.22692610892643159
N57318,news,newsus,"A 2,000-pound great white shark is swimming off the coast of Florida A great white shark that weighs over 2,000 pounds and measures 15 feet, 5 inches long has been swimming along the US East Coast.",0.1902511237187527,0.2643618964310864,0.22730651007491953,0.23965830552697515
N34694,tv,tvnews,Rosie O'Donnell: Barbara Walters Isn't 'Up to Speaking to People' Right Now Rosie O'Donnell: Barbara Walters Isn't 'Up to Speaking to People' Right Now,0.1904386301654583,0.2169431591388213,0.2036908946521398,0.2081083161477003
N40640,foodanddrink,foodnews,"Foie Gras Is Banned by New York City Lutèce served it seared, with dark chocolate sauce and bitter orange marmalade. Le Cirque offered it in classic terrine form, but also served it with rabbit and bacon and made it the scene-stealer in a ravioli dish. But Lutèce closed in New York in 2004. Le Cirque shut its last Manhattan location in 2017. And foie gras, the calling card of fine French dining, is about to follow suit. The New York City Council overwhelmingly passed legislation on...",0.1906425130057814,0.2451110632974783,0.21787678815162986,0.22695487986691268
N306,movies,movies-celebrity,"Kevin Spacey Won't Be Charged in Sexual Assault Case After Accuser Dies The Los Angeles County District Attorney's Office has formally dropped a case against actor Kevin Spacey, after the accuser died.",0.1910210378971874,0.2247582356526317,0.20788963677490957,0.2135125030674836
N62283,news,newsworld,British PM denied new Brexit deal vote Prime Minister Boris Johnson prepared to Monday make a second attempt to ram his EU divorce deal through parliament and avoid the political damage of delaying Brexit next week. But EU officials were still making preparations for Britain to leave in 10 days' time.,0.1913006147147338,0.2698720429274734,0.2305863288211036,0.24368156685656023
N34380,news,newspolitics,"House rejects GOP measure censuring Schiff Democrats in the House turned aside a GOP-led privileged resolution to censure House Intelligence Committee Chairman Adam Schiff (D-Calif.) on Monday in a 218-185 vote.Republicans and President Trump have increasingly targeted Schiff, a public face of the impeachment effort.They have taken issue with Schiff's exaggerated account of the details of President Trump's July 25 phone call with Ukrainian President Volodymyr Zelensky during a...",0.1913006147147338,0.2398381422736124,0.2155693784941731,0.22365896642065286
N57364,news,newspolitics,"Facebook's Zuckerberg grilled by AOC on fact-checking policy for political ads Facebook CEO Mark Zuckerberg struggled to explain the social media company's new policy on fact-checking political ads under questioning from Rep. Alexandria Ocasio-Cortez during a Tuesday hearing. The company recently announced that to protect political speech it would no longer fact check ads from politicians, essentially allowing campaigns to pay Facebook to spread disinformation. At the hearing of the House Financial Services committee,...",0.1913006147147338,0.2498564428925005,0.22057852880361717,0.2303378334999116
N52865,news,newspolitics,Ohio's Reputation As a Must-Win State May No Longer Be True ,0.1913006147147338,0.2272953234665767,0.20929796909065523,0.2152970872159624
N37481,sports,football_nfl,Baker Mayfield blasts officials after Browns loss: Refs were 'pretty bad today' ,0.1913006147147338,0.2329032618632038,0.21210193828896878,0.2190357128137138
N54807,news,newsworld,"Russia questions language of ""unusual"" Trump letter to Erdogan Russia questions language of ""unusual"" Trump letter to Erdogan",0.1913006147147338,0.2542758329404749,0.22278822382760435,0.23328409353189455
N45824,sports,football_nfl_videos,"Ian Rapoport: MRI results are good news for Patrick Mahomes, Kansas City Chiefs NFL Network Insider Ian Rapoport and James Palmer provide a Patrick Mahomes injury update.",0.1913006147147338,0.2366058765135085,0.21395324561412116,0.2215041225805836
N64395,sports,football_nfl,J.J. Watt has sobering quote after season-ending injury The Houston Texans lost the rock of their team for the season during Sunday's win over the Oakland Raiders. Stud pass rusher and future Hall of Famer J.J.,0.1913006147147338,0.2555407938026175,0.22342070425867566,0.23412740077332295
N32027,sports,football_nfl,Payton declines to name Saints starting QB for Week 8 ,0.1913006147147338,0.2572034370620453,0.22425202588838955,0.23523582961294148
N4408,sports,football_nfl,"Patrick Mahomes already back at practice for Chiefs Although Reid didn't rule Mahomes out for the team's Week 8 game, it seems like a long-shot for the quarterback to get back onto the field that quickly.",0.1913006147147338,0.2477064448858583,0.21950352980029605,0.22890450149548347
N52196,news,newspolitics,"Graham claims victory with impeachment vote Sen. Lindsey Graham, who introduced a resolution condemning secretive impeachment proceedings in the House, claimed victory Monday after House Speaker Nancy Pelosi announced she'll hold a formal vote and open up the hearings to the public.",0.1913006147147338,0.2408396597078136,0.21607013721127372,0.22432664471012032
N26606,autos,autosenthusiasts,2020 Shelby GT500 Aero Performance & Cooling Supercomputers and 3-D Printing are secrets to the all-new Mustang Shelby GT500's high performance.,0.1913006147147338,0.2942060450354573,0.24275332987509554,0.25990423492854947
N32670,news,newspolitics,"McConnell tees up government funding votes amid stalemate Senate Majority Leader Mitch McConnell (R-Ky.) is turning the Senate toward trying to pass a set of long-stalled appropriations bills. ""Congress has fallen badly behind schedule on appropriations. It's been a month since my Democratic colleagues filibustered government funding here on the floor, blocking defense funding and a pay raise for service members. We need to get moving,"" McConnell said from the Senate floor. McConnell said the Senate...",0.1913006147147338,0.2603296119922297,0.22581511335348176,0.2373199462330644
N62055,news,newspolitics,"Trump campaign threatens to sue CNN, citing Project Veritas videos An attorney representing President Trump's reelection campaign sent a letter to CNN on Friday threatening to sue.",0.1913006147147338,0.2389484335741473,0.21512452414444055,0.22306582728767615
N5211,sports,football_nfl,"Jets trade DL Leonard Williams to Giants The USC product is in the final year of his deal, and the Jets wanted to get something for him while they still could. The third-rounder they'll be getting from the Giants will presumably be an early third-rounder.",0.1913006147147338,0.2695124238159468,0.2304065192653403,0.24344182078220916
N21428,autos,autosnews,Ford's Mach E Electric SUV Spied Looking...Interesting We're not sure how we feel about this new EV's Mustang-inspired styling cues.,0.1913006147147338,0.2850276186983277,0.23816411670653076,0.25378528403712974
N49990,sports,football_nfl,Watch: Kevin Harlan's call of streaking cat on 'MNF' is epic This might legitimately be the best thing we've ever heard from Mr. Harlan.,0.1913006147147338,0.2761853157475356,0.2337429652311347,0.24789041540326834
N21851,sports,football_nfl,"Next man up: Chiefs prepare for life without Mahomes, with Moore Two weeks ago, Tyreek Hill served as Matt Moore's top target.",0.1913006147147338,0.2507916977892812,0.2210461562520075,0.23096133676443203
N36068,sports,football_nfl,"AP source: Trent Williams ends holdout, reports to Redskins A person with knowledge of the situation says left tackle Trent Williams has reported to the Washington Redskins, ending his lengthy holdout. The person spoke to The Associated Press on condition of anonymity because the team had not announced Williams' return. He can be kept off the 53-man roster for up to three weeks after reporting. Washington did not deal the 31-year-old before the NFL trade deadline Tuesday, which prompted...",0.1913006147147338,0.253897606844832,0.2225991107797829,0.23303194280146594
N4745,news,newspolitics,"Testimony: White House lawyer told Vindman not to discuss Ukraine call The senior White House lawyer who placed a record of President Donald Trump's July 25 call with Ukraine's president in a top-secret system also instructed at least one official who heard the call not to tell anyone about it, according to testimony heard by House impeachment investigators this week.",0.1913006147147338,0.2576717436025242,0.224486179158629,0.23554803397326074
N5019,sports,football_nfl,"Winners, losers from Cowboys' win over Giants on 'Monday Night Football' In a NFC East tilt, the Cowboys overwhelmed the Giants defense late while Big Blue continues to trip over its own feet.",0.1913006147147338,0.282989444821883,0.2371450297683084,0.25242650145283324
N37835,sports,football_nfl,Giants will not go back to Eli Manning after Daniel Jones' struggles Jones has thrown eight interceptions and has lost two fumbles in his past four starts.,0.1913006147147338,0.2730301932721423,0.23216540399343805,0.24578700041967277
N62396,sports,football_nfl,Colin Kaepernick is the perfect replacement for Patrick Mahomes This is a good idea if Mahomes misses a lot of time.,0.1913006147147338,0.2598402238907001,0.22557041930271696,0.23699368749871136
N53209,sports,baseball_mlb,"​Are the Astros stealing signs to gain an edge in ALCS? Hopefully. If your code is easy to crack, the problem is on you, not the codebreaker.",0.1913006147147338,0.2860796228097579,0.23869011876224586,0.25448662011141654
N15087,sports,football_nfl,"Trent Williams to Cleveland rumor emerges Dysfunctional teams do dysfunctional things. But sometimes they do something that makes sense, against their nature. Washington may soon be throwing in the towel on the Trent Williams holdout, trading the disgruntled left tackle in advance of the deadline that arrives in only two weeks. Steve Doerschuk of the Canton Repository shares the news with [more]",0.1913006147147338,0.2558973896398786,0.22359900217730622,0.234365131331497
N14137,sports,football_nfl,MetLife Stadium searching for the famous black cat from 'Monday Night Football' ,0.1913006147147338,0.2411493735029078,0.2162249941088208,0.2245331205735165
N10270,autos,autossports,"What Do Old-School Mustang Guys Think of the Kia Stinger? We wondered, so we put the Original Venice Crew in our long-term Stinger GT.",0.1913006147147338,0.2836435938863763,0.23747210430055504,0.2528626008291621
N63306,sports,football_nfl,Jenkins' scorching response to Scandrick ripping Eagles Former Philadelphia Eagles cornerback Orlando Scandrick ripped into Malcolm Jenkins and his former teammates in general.,0.1913006147147338,0.2506914457858473,0.22099603025029055,0.23089450209547613
N14437,sports,basketball_nba,"Suns' Deandre Ayton suspended 25 games for violating NBA anti-drug policy The league informed the Suns that Ayton, the top pick in the 2018 draft, tested positive for a diuretic. His suspension begins Friday.",0.1913006147147338,0.2582921236240888,0.22479636916941131,0.23596162065430382
N64456,news,newsus,"LA's Getty fire was sparked by downed power lines, Mayor Garcetti says LOS ANGELES - The Getty fire was sparked by a tree branch that fell on power lines, Los Angeles Mayor Eric Garcetti announced at a news conference Tuesday evening. Video footage shows the branch breaking off a eucalyptus tree and sparking the fire in the 1900 block of North Sepulveda Boulevard, Garcetti said. The power lines being examined are operated by the Los Angeles Department of Water ...",0.1913006147147338,0.2603266035033323,0.22581360910903306,0.23731794057379946
N22929,sports,football_nfl,"Burning questions for Cowboys vs Giants on 'Monday Night Football' Capping off the action in Week 9, the New York Giants are hosting the Dallas Cowboys for the NFC Monday Night Football. There are five burning questions for this NFC matchup.",0.1913006147147338,0.3016776703716378,0.2464891425431858,0.2648853184860031
