ID,category,sub_category,content,collaborative_rec,content_rec,mean,two_one
N49526,sports,basketball_nba,"James Harden drops 59 points as Rockets edge Wizards in high-scoring duel James Harden would not let the Rockets lose, not a game like this. And all it took was for the Rockets to score 159 points. With no one stopping anyone, with 3s falling and drives ending at the rim, Harden kept scoring and scoring until the Rockets finally got a stop and just enough scoring to finally score just enough. After Russell Westbrook drove to a three-point play after a Harden slam missed, giving the Rockets a lead with 32.4 seconds...",0.1788564506696758,0.2870989929743377,0.23297772182200677,0.2510181455394504
N22260,sports,football_nfl,Black cat visits field during Cowboys-Giants game on 'Monday Night Football' ,0.1788564506696758,0.2461154971734238,0.21248597392154978,0.22369581500550778
N41832,sports,basketball_nba,Curry swishes shots in warm-up sequence at Chase Center The Golden State Warriors will begin a new season in their new arena Chase Center on Thursday night.,0.1788564506696758,0.2584125326776787,0.21863449167367727,0.23189383867501107
N24578,entertainment,celebrity,"Week in celebrity photos for Oct. 28-Nov. 1, 2019 See what the stars were up to during the last week of October.",0.1788564506696758,0.2549901562298428,0.2169233034497593,0.22961225437645377
N48423,sports,basketball_nba,"Warriors' Steve Kerr clarifies comments about Klay Thompson After he previously implied that Thompson wasn't going to play this coming season, Steve Kerr clarified his comments later on Tuesday.",0.1788564506696758,0.256945182144378,0.2179008164070269,0.23091560498614394
N18939,sports,basketball_nba,"Charles Barkley: 'At this point, Kawhi's a better player than LeBron' TNT Analyst Charles Barkley said Kawhi Leonard is a better player than LeBron James.",0.1788564506696758,0.276410640115818,0.22763354539274688,0.24389257696710392
N5092,sports,basketball_nba,Giannis Antetokounmpo spoils Harden-Westbrook debut with triple-double in Bucks comeback ,0.1788564506696758,0.2649870936166683,0.22192177214317205,0.2362768793010041
N14167,music,music-celebrity,Britney Spears Does The Splits Like a Boss in Workout Video She's still got it!,0.1788564506696758,0.2544948110333502,0.21667563085151298,0.22928202424545874
N13286,entertainment,celebrity,"Will Smith gets friendly with fans, plus more celebs out and about this fall See new photos of your favorite celebrities living life during fall 2019!",0.1788564506696758,0.264301686877775,0.2215790687737254,0.23581994147507526
N49689,news,newspolitics,"Democrats confront the prospect of a long primary Joe Biden and Elizabeth Warren are holding steady, Bernie Sanders is bouncing back from his heart attack and Pete Buttigieg is springing to life in Iowa.",0.1788564506696758,0.2541250299207996,0.21649074029523768,0.22903550350375834
N33727,news,newspolitics,"Why Pete Buttigieg's moment could last well past the debate The Indiana mayor has the money, the staff, the data, and the endorsements to rapidly expand his reach.",0.1788564506696758,0.2574404943079688,0.2181484724888223,0.23124581309520445
N13057,lifestyle,lifestyleroyals,"Queen Elizabeth and Michelle Obama Shared 'Instant, Mutual Warmth' When They Broke Royal Protocol Queen Elizabeth Welcomed When Michelle Obama Put Arm Around Her",0.1788564506696758,0.2352291168500837,0.20704278375987975,0.21643822812328106
N58997,sports,basketball_nba,"LeBron, D-Wade get hyped watching sons connect for basket LeBron James and Dwyane Wade were having a great time as basketball dads watching their son's play over the weekend for Sierra Canyon.",0.1788564506696758,0.2434204797322969,0.21113846520098634,0.2218991367114232
N119,sports,basketball_nba,"Anthony Davis, LeBron James dominate offensively to lead Lakers past Warriors in preseason bout ",0.1788564506696758,0.2580489650256992,0.2184527078476875,0.23165146024035804
N28149,sports,basketball_nba,"After summer moves, Jazz not worried about offensive stumbles to start season We've got to not think the game too much, just go out there and play.  Jeff Green",0.1788564506696758,0.2677244553260169,0.22329045299784633,0.23810178710723653
N13480,video,popculture,"Jennifer Aniston on why she joined Instagram: 'I'm just trying to build content' Jennifer Aniston visited Jimmy Kimmel Live!, Wednesday to promote her new Apple series The Morning Show. And while she was there she also talked about her record breaking new Instagram account. As of last night's broadcast, Aniston's account had garnered over 11 million followers in less than two days. She set a new world record, racking up a her first million followers 29 minutes faster than the previous record holders Prince Harry and Megan Markle. While this is her first official instagram account it wasn't her first time on IG. Aniston admitted that she had a fake account prior to making things official. ""It was a stalker account,"" said Aniston, ""When I was thinking about doing this, I sort of figured it was time to kind of understand the world and dip my toe into the social media pool."" When asked why she joined Insta, Aniston replied, ""I don't know."" She also revealed that she does look at other people's Instagram posts. She said, ""I'm just trying to build content, as they say.""",0.1788564506696758,0.2540595148510344,0.2164579827603551,0.22899182679058153
N25604,sports,basketball_nba,Warriors' Russell ejected for going after official D'Angelo Russell is not having the best start to the new phase of his career with the Golden State Warriors.,0.1788564506696758,0.2412388214248769,0.21004763604727633,0.22044469783980986
N43608,news,newsus,"Trump, Newsom wildfire clash came days after Newsom lauded president as 'partner' Last week Gov. Newsom thanked the Trump administration for ""moving expeditiously to support our efforts"" fighting fires. That was then, this is now.",0.1788564506696758,0.2290112294192932,0.2039338400444845,0.2122929698360874
N50748,weather,weathertopstories,"A rare October snowstorm blankets the Texas Panhandle Heavy snow fell in parts of the Texas Panhandle on Thursday, causing near whiteout conditions in Amarillo, according to the National Weather Service.",0.1788564506696758,0.2722195716055721,0.22553801113762395,0.24109853129360664
N16710,finance,markets,The value of America's natural resources revealed Ever been curious about how much money is hiding in America's untapped natural resources? We reveal what they're really worth…,0.1788564506696758,0.287520964025618,0.2331887073476469,0.25129945957363725
N35488,sports,basketball_nba,Kevin Durant had a simple reason for why Steph Curry is better than Russell Westbrook There you have it.,0.1788564506696758,0.2702122362051652,0.2245343434374205,0.2397603076933354
N8519,lifestyle,lifestylebuzz,"Kristen Stewart Just Made Leather Bras a Thing, and We're All For It Leave it to Kristen Stewart to look like a total badass while promoting her new film Charlie's Angels.",0.1788564506696758,0.241808563279553,0.2103325069746144,0.22082452574292727
N59289,lifestyle,lifestylecelebstyle,"Katy Perry's 34 Most Memorable Looks of All Time In honor of her birthday, we're looking back at Katy Perry's most memorable performance looks of all time.",0.1788564506696758,0.2835726475540048,0.2312145491118403,0.24866724859256178
N8959,news,newspolitics,"Graham now says Trump's Ukraine policy was too 'incoherent' for quid pro quo A day after saying he wouldn't bother reading transcripts released by House Democrats in the impeachment inquiry into President Trump, Sen. Lindsey Graham, R-S.C., now says he did read the testimony, and his conclusion is that the administration's Ukraine policy was too ""incoherent"" for it to have orchestrated the quid pro quo that is at the heart of the probe.",0.1788564506696758,0.2502564713280359,0.21455646099885584,0.22645646444191586
N7534,sports,basketball_nba,Magic Johnson uses MJ's Steph Curry statement to make tampering joke Los Angeles Lakers legend Magic Johnson is free to tweet from Game 1 until the end of the season and we are here for it.,0.1788564506696758,0.2529497669413383,0.21590310880550706,0.22825199485078412
N25287,sports,basketball_nba,"Steve Kerr: Steph Curry is 'at his peak physically, mentally' ",0.1788564506696758,0.2582273231298293,0.21854188689975257,0.2317703656431115
N56638,sports,basketball_nba,"LeBron James evacuates LA home, relocates family to hotel because of wildfires Lakers star LeBron James and his family were forced to evacuate their home in Los Angeles due to wildfires that have engulfed Southern California.",0.1788564506696758,0.2169389604083762,0.197897705539026,0.20424479049547606
N63658,lifestyle,lifestylecelebstyle,Presenting: The 41 All-Time Most Stunning Dresses From the People's Choice Awards Red Carpet Top hats? Got 'em. A cane? Mm-hmm. Shoulder pads? You betcha.,0.1788564506696758,0.2578694966422019,0.21836297365593882,0.23153181465135986
N52145,sports,basketball_nba,"Anthony Davis' performance against Grizzlies places him among Lakers greats George Mikan. Elgin Baylor. Wilt Chamberlain. Kareem Abdul-Jabbar. Shaquille O'Neal. Now, Anthony Davis. Lakers history is filled with big men who dazzled their fans and terrified opponents, and on Tuesday night Davis joined their exclusive club. They are the only Lakers to have scored at least 40 points in a game in which they also grabbed 20 rebounds. Davis scored 40 points with 20 rebounds ...",0.1788564506696758,0.2853014070898904,0.2320789288797831,0.24981975494981884
N53428,news,newspolitics,"Pete Buttigieg Says He Does Not Respect Donald Trump: 'At a Deeper Level I Don't Think He Respects Himself' Democratic candidate Pete Buttigieg went on the offensive against President Donald Trump, saying that Trump has done nothing to command his respect.",0.1788564506696758,0.2493526526889885,0.21410455167933215,0.22585391868255095
N41777,sports,baseball_mlb,"Kate Upton was so fired up after the Astros' big defensive play The Houston Astros made a great defensive play to keep Game 2 of the ALCS tied in the sixth inning, and perhaps nobody was more excited about it than Kate Upton.",0.1788564506696758,0.2307459430179694,0.20480119684382259,0.2134494455685382
N57528,news,newsus,Bahareh Zare Bahari: Beauty queen says she will be killed if she is deported to Iran An Iranian beauty queen who has spent almost two weeks inside Manila's international airport says she will be killed if she is sent back home and is seeking asylum in the Philippines.,0.1788564506696758,0.2014630430381379,0.19015974685390685,0.1939275122486505
N2533,entertainment,entertainment-celebrity,"Khloe Kardashian misses ex, Lamar Odom 'all the time,' plus more news Khloe Kardashian wrestles with whether to meet with her ex, Lamar Odom. Plus, more celebrity news for Oct. 24, 2019.",0.1788564506696758,0.2242586027402527,0.20155752670496424,0.2091245520500604
N4885,sports,basketball_nba,Tacko Fall working hard to show he's more than a novelty act The 7-foot-5-inch fan favorite is working diligently with the Celtics coaching staff to sharpen his skills.,0.1788564506696758,0.2536605064834212,0.2162584785765485,0.22872582121217272
N48222,sports,basketball_nba,"Bucks have done everything right to keep Giannis for good Though Giannis Antetokounmpo doesn't want to talk about his supermax extension right now, the Bucks have done everything right so far.",0.1788564506696758,0.2669993709395081,0.22292791080459196,0.23761839751623065
N4654,sports,basketball_nba,"Shaq gets emotional welcome back from TNT crew after sister's death Shaq had been away after his sister, Ayesha Harrison-Jex, died from cancer at age 40.",0.1788564506696758,0.2341466856976886,0.2065015681836822,0.21571660735501766
N11405,finance,finance-companies,"Boeing says up to 50 planes grounded globally over cracks Crisis-hit Boeing faced fresh safety concerns Thursday, as the firm admitted cracks were found in up to 50 of its popular 737NG planes following worldwide inspections.",0.1788564506696758,0.2705183327058655,0.22468739168777063,0.2399643720271356
N45189,news,newsscienceandtechnology,"Roman chariot and horse fossils are unearthed in Croatia after being buried in a ritual reserved for very wealthy families, archaeologists reveal Archaeologists uncovered the fossils near the city of Vinkovci in eastern Croatia and said this is the first time a burial ritual like this has been discovered in the country.",0.1788564506696758,0.2680736605264865,0.22346505559808116,0.23833459057421627
N54842,news,newsus,"Mississippi woman found after being missing for days by writing S.O.S. with rocks S.O.S spelled out with rocks saved a woman missing in a national park for days, according to a release from the National Park Service.",0.1788763352601724,0.2332845273271369,0.20608043129365466,0.21514846330481538
N16617,news,newsus,"Coast Guard searches for man who fell from cruise off Texas The U.S. Coast Guard late Thursday said it was searching for a man who plunged into the Gulf of Mexico while the ship was about 47 miles off the coast of Galveston, Texas.",0.1789397532828115,0.2582327686743612,0.21858626097858636,0.23180176354384463
N1398,news,newsus,"Iowa woman killed by explosion at gender reveal party An Iowa woman was killed by debris from an explosion at a gender reveal party on Saturday, police said.",0.1790151727891559,0.2502267456311673,0.2146209592101616,0.2264895546838302
N58226,sports,racing,NASCAR driver's car got flipped over and then stuck the landing in wild wreck at Talladega Brendan Gaughan had the best reaction to getting flipped.,0.1790813692982772,0.2394604008152665,0.20927088505677185,0.2193340569762701
N619,news,newsus,"Cornell student, 18, found dead in gorge after frat party, reports say A top Ivy League student was found dead Saturday afternoon in a New York gorge after he left a fraternity party and disappeared Thursday night, according to reports.",0.1793880377764267,0.22931238477609,0.20435021127625835,0.21267093577620225
N30160,foodanddrink,tipsandtricks,How To Open a Can Without a Can Opener All it takes is a metal spoon and some elbow grease.,0.1797271034893593,0.3089787661544274,0.24435293482189335,0.2658948785994047
N59026,news,newsus,"Cincinnati school board candidate accused of 'pretending to be black' in his ads A current CPS board member took to Twitter Sunday to say a candidate for the board ""is a white guy pretending to be black to get votes"" in ads.",0.1798906846391175,0.2514134762757583,0.2156520804574379,0.22757254573021135
N10679,news,newspolitics,Justice Dept. appeals order on Mueller grand jury testimony The Justice Department is appealing a judge's order directing the department to produce to the House secret grand jury testimony from special counsel Robert Mueller's Russia investigation.,0.1800903860135889,0.2449470296425175,0.2125187078280532,0.22332814843287463
N23163,news,newspolitics,"'You people with this phony Emoluments Clause': Cabinet meeting devolves into 71 minutes of Trump grievances President Trump, trying to dig out from two new political holes of his own making on top of the expanding House impeachment inquiry, held forth for 71 minutes Monday during what was ostensibly a Cabinet meeting but ended up being a familiar torrent of grievance, defensiveness and bold statements about his expansive view of his own powers.",0.1801737497276758,0.2327127396687655,0.20644324469822065,0.21519974302173558
N23554,sports,football_nfl,Joe Flacco criticizes Broncos coaches as 'afraid to lose' after Colts' comeback Joe Flacco made it clear he thought the Broncos weren't aggressive enough when playing with a lead late in Sunday's loss to the Colts.,0.1801773032379345,0.2375474278725666,0.20886236555525056,0.2184240529943559
N22561,sports,football_nfl,NFL Week 8 Power Rankings: Old-school football rules the day NFL Week 8 Power Rankings: Old-school football rules the day,0.1801912661848892,0.2653537053301765,0.22277248575753283,0.2369662256150807
N45794,news,newscrime,"Four flight attendants were arrested in Miami's airport after bringing in thousands in cash, police say Four American Airlines flight attendants were arrested at the Miami International Airport and charged with money laundering after bringing large amounts of cash into the country, police said.",0.1804230062927134,0.2263759808376485,0.20339949356518094,0.2110583226560035
N24294,news,newspolitics,"Giuliani Mixes His Business With Role as Trump's Lawyer It is an extraordinary time in Washington, but it is more or less business as usual for Rudolph W. Giuliani. He is a central figure in the impeachment inquiry. He is under scrutiny by federal prosecutors. But throughout the building controversy, Mr. Giuliani has continued to represent clients, broker deals and take on consulting contracts in Washington and around the world in ways that leave him subject to criticism that he is using...",0.1805643686537285,0.2266657606845542,0.20361506466914137,0.21129863000761231
N44442,news,newspolitics,"CNN Poll: 50% support impeaching Trump and removing him from office Half of Americans say President Donald Trump should be impeached and removed from office, according to a new CNN poll conducted by SSRS.",0.1808377295220639,0.2747981357456813,0.2278179326338726,0.24347800033780884
N4020,tv,tv-celebrity,"'Tarzan' Actor Ron Ely: Actor's son allegedly killed his mother before deputies shot and killed him, sheriff's office says The son of ""Tarzan"" actor Ron Ely killed his mother before he was shot and killed by deputies on Tuesday, according to the Santa Barbara County Sheriff's Office.",0.1808888476136267,0.2100986328012897,0.1954937402074582,0.20036203773873537
N9798,news,newsus,"Missing West Point cadet found dead, officials say A U.S. Military Academy cadet who vanished last week has been found dead, officials said Wednesday.",0.1809986120270661,0.2498817458513924,0.21544017893922923,0.22692070124328365
N39235,news,newscrime,"Florida woman allegedly flees 2 car crashes, kills driver in 3rd crash A Florida woman who killed a 53-year-old man after running a red light and smashing into his Lexus on Saturday morning was in the process of fleeing two earlier car accidents when she caused the fatal collision, police said.",0.1813803232440853,0.1970039390481435,0.18919213114611438,0.19179606711345742
N55742,sports,mma,President Donald Trump gets mixed reaction at UFC 244 in historic milestone for MMA ,0.1815721368246459,0.2132315481888992,0.19740184250677256,0.20267841106748144
N43955,entertainment,entertainment-celebrity,"Celebrity kids then and now: See how they've grown See what the children of Bobby Cannavale, Ray Liotta, Jude Law, Jamie Foxx, Sylvester Stallone, James Gandolfini and more stars look like now.",0.1816839808641258,0.2343199480137546,0.2080019644389402,0.216774625630545
N58936,news,newsus,Beloved grandfather's body pulled from collapsed Hard Rock hotel A family holding vigil outside the site of the Hard Rock hotel construction collapse received the news they hoped they'd never hear.,0.1816995860855701,0.2300188213750011,0.2058592037302856,0.21391240961185742
N25158,lifestyle,lifestyleroyals,Kate Middleton Takes Prince George and Princess Charlotte Halloween Shopping at Local Supermarket Kate Middleton Takes George and Charlotte Halloween Shopping,0.1820716993807473,0.254508510563153,0.21829010497195014,0.23036290683568442
N19347,news,newspolitics,"Former US Senator Kay Hagan dead at 66 Former U.S. Sen. Kay Hagan, a one-time Capitol Hill intern who went on to become North Carolina's first Democratic female senator, died Monday at her Greensboro home. She was 66.",0.1821765848690637,0.2361181914401181,0.2091473881545909,0.21813765591643333
N38562,sports,baseball_mlb,Nationals still uncertain on Scherzer status after injection HOUSTON (AP)   The Washington Nationals remain unsure about the health of pitcher Max Scherzer and catcher Kurt Suzuki heading into Game 6 of the World Series against Houston. Scherzer was scratched from his Game 5 start Sunday night because of nerve irritation near his neck and had a cortisone shot. Scherzer won the opener and hopes to be able to pitch in a Game 7 if the Nationals get that far. Houston won three in a row at Washington to take a...,0.1823746827179045,0.2651208741713051,0.2237477784446048,0.23753881035350488
N18094,movies,movies-celebrity,"Michelle Pfeiffer initially blamed herself after #MeToo moment: 'I should've known' Michelle Pfeiffer is opening up about an uncomfortable and inappropriate moment with a ""high-powered"" industry person.",0.1824583332745478,0.2153005019119414,0.1988794175932446,0.20435311236614354
N47791,autos,autosnews,"Hyundai fuel cell semi concept makes the Tesla Semi look boring Called the HDC-6 Neptune, it's a pretty great-looking thing.",0.1826513131701764,0.286428189963151,0.2345397515666637,0.25183589769882614
N13138,news,newsworld,"Amelia Bambridge: Body of missing backpacker found in sea The body of a 21-year-old British backpacker who went missing after a beach party on a Cambodian island has been found, according to the charity assisting her family.",0.1827470138495085,0.2283297494659699,0.2055383816577392,0.21313550426048275
N54225,news,newsus,"Multiple Houses on Fire After Plane Crashes in NJ At least two houses are on fire in Colonia, New Jersey, after a plane crash, according to the Colonia Fire Department. A Cessna 414 crashed into a home on Berkley Avenue at 11 a.m. Tuesday, according to the FAA. The FAA will conduct an investigation into the cause of the crash. The number of people aboard and their conditions are unknown. The area is a heavy residential area with tree-lined streets. News 4's Dennis Protsko, who is part of the...",0.182751398557233,0.2488556332237967,0.21580351589051483,0.22682088833494213
N56175,foodanddrink,restaurantsandnews,Pizza Hut is testing a new round pizza box that looks like a spaceship and is meant to keep pizza fresher Pizza Hut has partnered with Zume to test a new round pizza box that is supposed to keep pizza fresher and crispier. It's also compostable.,0.1831658688032912,0.307606714600666,0.24538629170197862,0.26612643266820774
N54305,sports,football_nfl,Urban legend? How the Cowboys' rout of the Eagles helped take Coach Meyer out of the conversation Did the Cowboy's victory Sunday night take care of the Urban Meyer rumors?,0.1832496994161844,0.2494754324185295,0.21636256591735697,0.22740018808441448
N16158,lifestyle,lifestylebuzz,"Nationals pitcher criticized for missing playoff game for daughter's birth Daniel Hudson said his family is his ""top priority"" after receiving criticism for missing a playoff game for the birth of his daughter.",0.1832944283615088,0.2305771569740418,0.2069357926677753,0.2148162474365308
N54435,news,newsus,"'Angel' car saves Arizona family after smashing into suspected drunk driver running red light, video shows An Arizona driver who police praised as an ""angel"" may have saved the lives of a couple pushing a stroller in a crosswalk last week after video showed the car smashing into a suspected drunk driver speeding through a red light -- who came inches away from plowing into the family.",0.1835202739090403,0.23540293064097,0.20946160227500515,0.21810871173032675
N38118,tv,tv-celebrity,Uh-Oh! Carrie Ann Inaba Falls on 'Dancing With the Stars' Uh-Oh! Carrie Ann Inaba Falls on 'Dancing With the Stars',0.1836675581171865,0.2404475477973715,0.21205755295727902,0.22152088457064317
N54536,news,newsus,4 High School Students Killed in Texas Car Crash That Also Injured 3: 'We Grieve Together' 4 High School Students Killed in Texas Car Crash,0.1837858228841153,0.2446195208205508,0.21420267185233305,0.22434162150840564
N49179,movies,movienews,Joe Alwyn on Buzz Around Taylor Swift Romance: 'I'll Just Turn it Off' Joe Alwyn on Buzz Around Taylor Swift Romance: 'I'll Just Turn it Off',0.1840691365229938,0.2589641150690649,0.22151662579602938,0.23399912222037453
N55312,travel,travelnews,"Why are most aircraft painted predominantly white? Aircraft liveries, or the designs painted on the exterior of aircraft from the nose to the tail, are a way to identify to which airline the plane belongs.",0.1840691365229938,0.3215329116449226,0.2528010240839582,0.2757116532709463
N35259,finance,finance-retirement,"'I'm 73 and fed up with California and want a gun-friendly, affordable city with good weather   so where should I retire?' Some hidden gems to consider in Georgia, New Mexico and Arkansas.",0.1840691365229938,0.2364683210182467,0.21026872877062025,0.21900192618649572
N53436,finance,finance-real-estate,"Inside the Sheikh of Dubai's 800-acre Kentucky horse farm I got a tour of Sheikh Mohammed of Dubai's 800-acre horse farm in Kentucky, where horses live in immaculate barns with skylights and personal fans.",0.1840691365229938,0.2605773127985157,0.22232322466075477,0.23507458737334172
N11917,travel,travelnews,JetBlue Plane Makes Emergency Landing at JFK Airport The plane landed safely in NYC Sunday night.,0.1840691365229938,0.2509410259365154,0.2175050812297546,0.2286503961320082
N20091,weather,weathertopstories,"Firefighting Plane Battles Maria Fire Near Santa Paula A tanker dropped fire retardant to combat the Maria Fire near Santa Paula in Ventura County, California on Friday, November 1. By Friday, the fire had reached more than 9,000 acres and was at zero percent containment, according to CAL FIRE. The Maria Fire broke out at around 9 pm on Thursday, and ""exploded"" overnight, prompting mandatory evacuations affecting more than 10,000 residents between Santa Paula and Somis, according to reports. Firefighters are battling several blazes across the state, including the 77,000 acre Kincade Fire in Sonoma County and the 1,800 Easy Fire in Ventura County. Incident reports for the California wildfires can be found here. Credit: @shant_nazaryan via Storyful",0.1840691365229938,0.2641486152242857,0.22410887587363976,0.23745545565718837
