ID,category,sub_category,content,collaborative_rec,content_rec,mean,two_one
N47922,music,music-celebrity,"Allegations against entertainer Todrick Hall are piling up, from stories of nonpayment to accusations of backlash for reporting sexual assault Todrick Hall became prominent in Broadway musicals, for his friendship with Taylor Swift, and more. Now, accusations against him are piling up.",0.1750084574278283,0.222041957516699,0.19852520747226365,0.20636412415374208
N59469,lifestyle,lifestyleroyals,"Every outfit Duchess Kate has worn in 2019 See Kate Middleton's style choices this year from glam gowns and coat dresses to re-wears, tiaras and hats.",0.1750084574278283,0.2912802938192056,0.23314437562351698,0.25252301502207986
N31802,entertainment,celebrity,Stars turning 50 in 2019 Find out which celebrities are celebrating the big 5-0 in 2019!,0.1750084574278283,0.2800696128240979,0.22753903512596313,0.24504922769200804
N51503,sports,football_ncaa,"Bill Plaschke: Mike Bohn brings USC integrity, which means he can't hire Urban Meyer LOS ANGELES_You ever heard of Mike Bohn? Me neither, and that's a good thing. The University of Southern California is apparently set on naming Bohn as its new athletic director, the smart hiring of a man who embodies the most important attribute for the new leader of the Trojans family. He's a complete stranger. He never played football at USC. He never coached football at USC. He never ...",0.1750084574278283,0.2426215366379366,0.20881499703288245,0.22008384356790048
N30103,travel,traveltripideas,"A network of 28 tiny, one-bed hotels in Amsterdam is being called the most beautifully designed hotel of 2019   and it consists of a series of converted bridge houses. Take a look inside. Amsterdam's bridge hotels, located in historic houses on and near bridges, are a tiny house lover's dream ⁠  and they just won a major design award.",0.1750084574278283,0.2973537569240915,0.23618110717595991,0.2565719904253371
N22614,sports,football_ncaa,Predicting which of college football's 10 undefeated teams will lose in Week 9 How many teams will still have a perfect record after Week 9?,0.1750084574278283,0.2971925758741865,0.2361005166510074,0.2564645363920671
N61972,entertainment,entertainment-celebrity,"New details on why Meg Ryan, John Mellencamp split, plus more news Meg Ryan and John Mellencamp's marriage plans may have prompted their split. Plus, more celebrity news for Nov. 4, 2019.",0.1750084574278283,0.2556715082466209,0.2153399828372246,0.22878382464035668
N19874,health,wellness,"How Your Hormones, Weight, or Medication Could Be Killing Your Sex Drive Your libido can suffer for some unexpected reasons. And remember, there is no ""normal"" when it comes to sexual desire.",0.1750084574278283,0.3195978091027517,0.24730313326529002,0.2714013585444439
N22627,news,newsus,Family Members Plead for Help in Search for Missing Atlanta College Student: 'Just Come Home' Family Pleads for Help in Search for Missing College Student,0.1750084574278283,0.2337514397847069,0.2043799486062676,0.21417044566574736
N16344,entertainment,celebrity,Stars   They're Just Like Us! Stars   They're Just Like Us!,0.1750084574278283,0.2586562596304855,0.2168323585291569,0.23077365889626641
N56853,news,newsworld,"Trump orders withdrawal of U.S. forces from northern Syria, days after Pentagon downplays possibility U.S.-allied Syrian Kurdish fighters announced late Sunday that the Syrian Army would deploy along the Turkish border to ""liberate the areas that the Turkish army has entered with its mercenaries.""",0.1750084574278283,0.24365537329386,0.20933191536084417,0.22077306800518276
N50479,health,wellness,"Items you need to stop sharing with others right now Items you should never share for your health and safety include everyday items like toothbrushes, earbuds and lipstick.",0.1750084574278283,0.2887615936633387,0.2318850255455835,0.2508438815848352
N13225,travel,traveltripideas,5 Reasons Destin Is a Great Family Vacation Destination The calm emerald waters and family-friendly attractions of the area make Destin a top spot for a fall or winter getaway.,0.1750084574278283,0.2835649863171651,0.2292867218724967,0.24737947668738616
N29561,lifestyle,lifestylebuzz,"High school cheerleaders go off-script to help man propose to their coach A school's cheer squad coach was surprised when her students went off-script and held up four signs during a routine that read, ""Will you marry me?""",0.1750084574278283,0.2555648555831207,0.21528665650547452,0.22871272286468988
N64554,entertainment,entertainment-celebrity,"Meghan King Edmonds, Jim Edmonds' Nanny Denies Cheating Allegations Meghan King Edmonds, Jim Edmonds' Nanny Denies Cheating Allegations",0.1750084574278283,0.2268249843069596,0.20091672086739396,0.2095528086805825
N2078,tv,tv-celebrity,"Rainbow Baby! Shawn Johnson, Andrew East Welcome 1st Child After Miscarriage Rainbow Baby! Shawn Johnson, Andrew East Welcome 1st Child After Miscarriage",0.1750084574278283,0.2640266398496182,0.21951754863872325,0.23435391237568823
N54449,news,newsus,"Third Indiana Catholic school employee fired in growing scandal over LGBTQ staff Unlike the others fired from Indianapolis-area Catholic schools, Kelley Fisher is straight and only expressed support for her fired colleagues.",0.1750084574278283,0.2210534749660482,0.19803096619693827,0.20570513578664157
N53118,health,health-news,Colorado Mom's Touching Facebook Post Beautifully Explains Why We Shouldn't Suffer in Silence One Colorado mom's Facebook post recently went viral for showing how much asking a friend for help can make the difference when you're feeling alone.,0.1750084574278283,0.2387070436462247,0.20685775053702649,0.21747418157342588
N43374,news,newspolitics,Trump goes on Twitter tear after White House official condemns his Ukraine call President Donald Trump launched a sustained online offensive after details emerged of damaging congressional testimony by a senior White House official.,0.1750084574278283,0.2365441200199651,0.2057762887238967,0.21603223248925282
N58091,finance,finance-companies,Ex-Credit Suisse Banker Says Secret Affair Helped Fuel $45 Million Fraud A former Credit Suisse Group AG banker told a federal jury in New York that his decision to take millions of dollars in bribes was fueled in part by his secret love affair with a subordinate.,0.1750084574278283,0.2457280675476268,0.21036826248772755,0.22215486417436062
N63248,lifestyle,lifestylecelebstyle,"Hailey Baldwin wore three show-stopping dresses during her wedding, and put a unique twist on each one Hailey Baldwin's three custom gowns were designed by Virgil Abloh of Off-White, Vera Wang, and Ralph & Russo.",0.1750084574278283,0.2499966872329916,0.21250257233040995,0.2250006106312705
N6285,finance,personalfinance,4 habits that could wreck your finances beyond repair Avoid these at all costs.,0.1750084574278283,0.2866684155682626,0.23083843649804547,0.24944842952145116
N30974,sports,basketball_ncaa,"Police identify 2 suspects in murder of Andre Emmett last month Two men accused of killing former Texas Tech and NBA player Andre Emmett were identified by Dallas police on Monday, the Dallas Morning News reported.",0.1750084574278283,0.2394708956809597,0.20723967655439401,0.2179834162632492
N12785,sports,baseball_mlb,"With Carlos Beltran hire it's clear the Mets learned nothing from the Mickey Callaway mess In hiring Carlos Beltran to guide their fortunes next year, the Mets hierarchy once again out-thought themselves by going ""outside-the-box"" for someone who had never managed anywhere before.",0.1750084574278283,0.2698068779600791,0.2224076676939537,0.2382074044493288
N30827,foodanddrink,restaurantsandnews,"These are the 11 classic food-court chains with the most locations From Panda Express to Auntie Anne's to Baskin-Robbins, these are the 13 classic food-court chains with the most US locations.",0.1750084574278283,0.2869361021310818,0.23097227977945506,0.2496268872299973
N56290,foodanddrink,tipsandtricks,The Secret Ingredient for Sausage Gravy That's Out of This World Transform your gravy with this $1 ingredient,0.1750084574278283,0.3037192545671107,0.2393638559974695,0.26081565552068325
N58744,lifestyle,voices,"I Gave Up On Love, And It Was One Of The Best Decisions I Ever Made At the end of our date in August 2018, Justin escorted me to my car, where henervously kissed me. When I kissed him back, he cheered, pumping his fists inthe air like he'd won something. I walked from the curb to my car, and when Iturned around, he was watching me, beaming.""I just want to make sure you get to your car safely,"" he said, even though Iwas less than a yard away.I slipped into the driver's seat, thrilled that our second date had gone...",0.1750084574278283,0.2720840682959007,0.22354626286186452,0.23972553133987656
N2018,entertainment,celebrity,"Debunking the week's tabloid stories: Nov. 1, 2019 A round-up of the week's tabloid stories that totally missed the mark.",0.1750084574278283,0.2409570368689666,0.20798274714839746,0.21897417705525382
N51457,foodanddrink,restaurantsandnews,Restaurants Are Dealing With an Avalanche of Special Requests. One Chef Has Had Enough. It's not all about you.,0.1750084574278283,0.2582422358471842,0.21662534663750627,0.23049764304073223
N42791,tv,tvnews,"Eva Longoria: 'Latinas Are the Last to Find Their Voices Amplified' Eva Longoria delivered a powerful and moving keynote at TheWrap's Power Women Summit in Los Angeles on Friday, saying that people in Hollywood are ""largely responsible for much of the unconscious bias that is against people of color"" and that ""Latinas are the last to find their voices amplified in this industry."" ""What studies show is that we are being erased,"" Longoria told a room of 2,000 attendees. ""This goes beyond underrepresentation. When...",0.1750084574278283,0.2274332957316199,0.2012208765797241,0.20995834963035603
N21389,news,newsworldpolitics,Rep. Katie Hill's lawyers send cease-and-desist letter to DailyMail.com over nude photos The website is the second to publish alleged lewd photos of the Democratic congresswoman.,0.1750084574278283,0.2241191538825959,0.1995638056552121,0.2077489217310067
N59774,foodanddrink,restaurantsandnews,"The Unreasonable Lengths Restaurant Workers Have to Go to Take Time Off From working doubles in advance to finding their own replacements, here's how unsalaried shift workers manage when it comes to vacation.",0.1750084574278283,0.2727091889784903,0.2238588232031593,0.24014227846160294
N6576,health,weightloss,16 Women Reveal Exactly How They Got Six-Pack Abs What does it really take to get six-pack abs? These women can tell you exactly what worked for them.,0.1750084574278283,0.2877080646392471,0.23135826103353768,0.2501415289021075
N50258,news,newspolitics,Trump feuds with Susan Rice over Syria President Trump exchanged barbs with the former Obama administration national security adviser Susan Rice over Syria after she criticized his policy.,0.1750084574278283,0.215479298796051,0.19524387811193966,0.20198901833997676
N56438,news,newsus,The 'race whisperer' A black activist convinced a neo-Nazi he'd save him from legal ruin. Then the real plan got underway.,0.1750084574278283,0.2349418971931092,0.20497517731046877,0.21496408393801555
N56444,health,wellness,"Jameela Jamil Called Out a New TV Show Where Judges Decide If Contestants ""Deserve"" Plastic Surgery The Good Place star had a lot to say after learning about ""The Surjury,"" a new British reality series about people competing against one another to win free plastic surgery.",0.1750084574278283,0.2352281973298412,0.20511832737883476,0.2151549506958369
N2183,tv,humor,"The top female comedians working in film and television today Film and television, specifically in the comedic vein, is currently blessed with a bevy of talented women. The transition from writing standup material to award-winning, mainstream masterpieces has never been so visible, and the impressive canon of female voices peppering the entertainment world is staggering.",0.1750084574278283,0.2581606207124283,0.2165845390701283,0.23044323295089494
N11163,news,newspolitics,"Kobach's campaign paid Kansan known to post racist comments on white nationalist site Kansas Republican Kris Kobach's Senate campaign paid an Olathe man who regularly posted hateful comments about Jews and racial minorities on a white nationalist website. Kobach's campaign paid Joe Suber $500 for field coordinating services in September, according to the Republican's latest campaign finance report. Suber also filed the paperwork with the state of Kansas creating ...",0.1750084574278283,0.2354435866291909,0.2052260220285096,0.21529854356207004
N36593,foodanddrink,foodnews,"How the Boston cream pie became a beloved dessert A product of the longest continually operating hotel in the United States, the Boston cream pie combines sponge cake, vanilla custard and chocolate icing to form a beloved American dessert.",0.1750084574278283,0.2940056260041225,0.23450704171597542,0.25433990314535776
N60850,foodanddrink,newstrends,"Popeyes is bringing back the chicken sandwich--and also takes a swipe at Chick-fil-A FORT WORTH -- The much-loved Popeyes Louisiana Kitchen fried chicken sandwich returns Sunday, and the company's announcement was a hard kick to the gizzard for competitor Chick-fil-A. After a limited-time summer special turned into a $65 million marketing bonanza, Popeyes will return both the spicy and mild sandwiches -- and on Sunday, when Chick-fil-A is not even open. Popeyes' ...",0.1750311228918487,0.2872875197550631,0.2311593213234559,0.2498687208006583
N61186,music,music-celebrity,Infected toe stops R. Kelly from attending court hearing CHICAGO (AP)   R. Kelly's lawyer has told a federal judge that an infected toe prevented the R&B star from attending a hearing in his child pornography case in Chicago. Kelly is detained at a jail two blocks from the courthouse and had been expected to appear at Wednesday's status hearing. But defense lawyer Steve Greenberg said one of Kelly's toenails had to be removed as treatment and Kelly worried someone might trample on his toe as he was...,0.1750311228918487,0.2470291115982827,0.2110301172450657,0.22302978202947135
N32268,foodanddrink,foodnews,"I ate one of Meghan Markle's favorite foods from Toronto here's what I thought The food at Terroni was good and the prices were surprisingly affordable, but the service was disappointing.",0.1750311228918487,0.2598873288379599,0.2174592258649043,0.23160192685592282
N34934,sports,golf,"20 years after Payne Stewart's tragic death, son Aaron carries his legacy Aaron Stewart spent his summers on the road as a PGA Tour kid. The behind-the-scenes visits at the Columbus Zoo during the Memorial Tournament stand out among his favorite memories as well as the ""music man"" under the big tree on Hilton Head Island.",0.1750311228918487,0.2423988377596031,0.20871498032572589,0.21994293280368496
N11727,foodanddrink,restaurantsandnews,"Popeyes quietly launched a new pumpkin pie and it's the best fast-food dessert I've ever tasted Popeyes still doesn't have the chicken sandwich, but it does have a delicious new deep-fried pumpkin and cream cheese pie. Run, don't walk.",0.1750311228918487,0.2957324547983678,0.23538178884510824,0.25549867749619476
N38495,health,health-news,"Poultry Recall After 22 Tons of Vietnamese Products Distributed Without Import Inspection In addition to failing to go through the usual food inspection processes, the products came from Vietnam a country that is not eligible to export poultry products to the U.S. or any meat products aside from catfish.",0.1750311228918487,0.2622362237666329,0.2186336733292408,0.2331678568083715
N63180,music,music-celebrity,"Taylor Swift can't shake 'Shake It Off' copyright suit reinstated by federal court panel A federal appeals court panel Monday reinstated a dismissed copyright lawsuit claiming Taylor Swift's ""Shake It Off"" infringed on an earlier song.",0.1750311228918487,0.2523193867448012,0.21367525481832494,0.22655663212715035
N59254,news,newsus,Judge rules deputies can't put 'no trick-or-treat' signs in sex offenders' yards A federal judge has ruled deputies in a Georgia county cannot put warning signs where registered sex offenders live.,0.1750311228918487,0.247439956939531,0.21123553991568983,0.2233036789236369
N20109,music,musicnews,Lady Gaga Says 'Fame Is Prison' -- And Has Fans Speculating If New Music Is on the Way The singer's fans are also wondering if she's talking about the pressures of the industry.,0.1750311228918487,0.2232998705557238,0.19916549672378625,0.20721028800109875
N7499,entertainment,celebrity,New Couple Alert? Drake and Kylie Jenner Appear Into Each Other at Party New Couple Alert? Drake and Kylie Jenner Appear Into Each Other at Party,0.1750311228918487,0.2491188868916455,0.21207500489174708,0.22442296555837987
N41089,lifestyle,lifestylebuzz,"This Man's Rattlesnake Bite Is a Warning to Everyone to Take Animal Bites More Seriously You wouldn't think a baby rattlesnake could do so much damage, but Austin McGee knows better after almost losing his finger to one.",0.1750311228918487,0.2519924499395799,0.2135117864157143,0.22633867425700283
N42570,news,newsus,"Woman dies after being hit by vehicle crossing northwest Fort Worth street, police say A 24-year-old woman died Wednesday after she was struck by a vehicle as she walked across a far northwest Fort Worth street, police said. Kristen Morton was hit at about 6:15 p.m. on Boat Club Road near Reef Point Lane, authorities said. The crash was an accident, a Fort Worth police spokesman said. Police did not describe the vehicle. Morton, who lived in White Settlement, was taken ...",0.1750311228918487,0.2313287627074798,0.20317994279966423,0.2125628827689361
N21720,health,health-news,Juul accused of selling 1 million tainted vaping pods Former Juul senior vice president Siddharth Breja claims he was fired in March for raising concerns about contaminated pods,0.1750311228918487,0.2324703490850699,0.20375073598845928,0.21332394035399616
N17681,foodanddrink,foodnews,McDonald's Is Going to Add Chicken to Its Breakfast Menu in 2020 Here's the rumor from McDonald's HQ. The post McDonald's Plans to Add Chicken to Its Breakfast Menu in 2020 appeared first on Taste of Home.,0.1750311228918487,0.3067737951875384,0.24090245903969354,0.2628595710889752
N18086,foodanddrink,restaurantsandnews,"I Would Go Back to This Missouri Theme Park Just for the Snacks The excellent food at Silver Dollar City is one of many reasons that Branson, Missouri is an essential stop on any Midwest road trip.",0.1750311228918487,0.2881147623058795,0.2315729425988641,0.2504202158345359
N3577,health,health-news,Tennessee reports 49 cases of lung injury linked to vaping Tennessee health officials say they have received 49 cases of serious lung injury in people who use electronic cigarettes or other vaping devices.,0.1750311228918487,0.2799728677377994,0.22750199531482404,0.24499228612248247
N27919,sports,golf,Martin worries about amputation after breaking right leg Casey Martin's worst fear was realized earlier this month when he stepped awkwardly off a curb and fractured his right tibia.,0.1750311228918487,0.2256355866453198,0.20033335476858424,0.20876743206082943
N59496,sports,football_nfl,"Week 7 winners, losers: Aaron Rodgers now in MVP race; Mitchell Trubisky looks lost Aaron Rodgers' big game vaults him into the MVP race. Meanwhile in Chicago, it might be time for the Bears to reconsider Mitchell Trubisky's future.",0.1751149535047419,0.2404882849359152,0.20780161922032855,0.21869717445885745
N62471,sports,football_nfl,"Trent Williams fails physical, experiencing discomfort with helmet Washington Redskins tackle Trent Williams' health situation has managed to get stranger after he reported to the team.",0.1751483497180561,0.2524913376802125,0.2138198436991343,0.22671034169282703
N55911,lifestyle,lifestylebuzz,Katie Holmes Talks About That Bra and Cardigan Moment Katie Holmes Talks About That Bra and Cardigan Moment,0.1754703765331635,0.2241645025188042,0.19981743952598385,0.2079331271902573
N37509,news,newsus,"A man dies in Hawaii after falling into a lava tube in his yard An elderly man died after falling into a lava tube on his property in Hilo, Hawaii, police announced on Wednesday.",0.1757402397790222,0.2349999999001416,0.2053701198395819,0.21524674652643513
N46795,music,musicnews,Eminem Says He Sides With Chris Brown Over Rihanna Assault on Alleged Leaked Song Leaked audio of Eminem allegedly rapping that he'd side with Chris Brown over Rihanna assault is making rounds on social media and fans are not happy.,0.1757469705469164,0.2410259662386743,0.20838646839279534,0.21926630100808833
N2203,sports,baseball_mlb,"Off to the World Series, these Nationals have proved everyone wrong This unexpected joyride of a season could hold more promise yet.",0.1759522366558678,0.2568734315048228,0.21641283408034528,0.22989969988850445
N12576,news,newsworld,Chinese pilot suspended after woman poses in cockpit with drinks The unidentified woman is seen sitting in the captain's seat with drinks in front of her on an Air Guilin flight in January this year.,0.176129272359729,0.2312518107448977,0.20369054155231336,0.2128776312831748
N47485,news,newsus,"Health warning lifted over fire at California oil facility Authorities have lifted shelter-in-place orders for some 12,000 people in Northern California after containment of a fire at a fuel storage facility that sent up a huge cloud of smoke. Emergency sirens blared and thick plumes of black smoke and flames filled the skyline around the NuStar Energy LP facility in Crockett, California, about 30 miles (50 kilometers) northeast of downtown San Francisco.",0.1764746469177189,0.2649582947641142,0.22071647084091656,0.23546374548198243
N719,finance,finance-companies,"Nevada gambling bosses move to bar Wynn from casino industry The complaint filed Monday by the state's Gaming Control Board lists sexual misconduct allegations that have been lodged against the mogul since January 2018. The complaint asks Nevada's Gaming Commission, which acts on the board's recommendations and has final say on licensing, to fine Wynn and revoke his status as being found suitable to be licensed in the industry.",0.1764746469177189,0.2450495592465678,0.21076210308214335,0.22219125513695148
N28257,news,newspolitics,"Meghan McCain confronts Trump Jr.: 'You and your family have hurt a lot of people' Donald Trump Jr., the president's son, defended his family after ""View"" co-host Meghan McCain suggested they were responsible for the lack of ""character"" in American politics.",0.1765126471863224,0.2006179889375614,0.18856531806194188,0.19258287502048174
N57737,news,newsus,"Missing Minnesota boy, 6, and his dog, found in cornfield by drone with thermal camera A missing 6-year-old boy from Minnesota and his dog were found Wednesday after hundreds of volunteers   including one who used his own drone with a thermal camera   searched for him for hours.",0.1765971120672991,0.2597114949849709,0.21815430352613502,0.23200670067908033
N25258,sports,boxing,Evander Holyfield's son wins pro boxing debut in 16 seconds ,0.1767362206047897,0.2385863521754614,0.20766128639012554,0.21796964165190416
N28074,lifestyle,lifestylefamilyandrelationships,"Woman Texts Dead Father's Phone for 4 Years & Finally Receives an Emotional Reply The pain of losing a parent, especially at a young age, is one that never really goes away.",0.1768139403948057,0.2446080552737897,0.2107109978342977,0.22201001698079503
N2052,sports,football_ncaa,"Hernandez: USC athletic director Mike Bohn needs to tune out Urban (Meyer) noise He wasn't in the building. Except he was. He was rarely mentioned by name. Except every other question was about him. Urban Meyer was nowhere and everywhere Thursday in the John McKay Center, where Mike Bohn was introduced as USC's athletic director. The reason was obvious: Meyer is whom Trojan Nation wants as its football coach. USC can preach the importance of integrity, but the university ...",0.1769215467406166,0.239270603778211,0.20809607525941382,0.21848758476567953
N58601,health,health-news,"Zantac Recall Update: Another Company Recalls Ranitidine Heartburn Drug Over Cancer Fears Aurobindo Pharma USA, Inc. is the latest company to issue a voluntary recall of ranitidine products over concerns regarding ""probable"" carcinogen NDMA.",0.1769215467406166,0.3054880460511466,0.2412047963958816,0.26263254628096994
N770,tv,tvnews,"Megyn Kelly Slams NBC News on 'Tucker Carlson Tonight' for Matt Lauer Investigation, Harvey Weinstein Coverage In Megyn Kelly's first televised interview since exiting NBC, the former Fox News and NBC News anchor took to ""Tucker Carlson Tonight"" Wednesday evening to criticize NBC News management for its handling of the outlet's Harvey Weinstein coverage and internal Matt Lauer investigation.",0.1769215467406166,0.2185564048510699,0.19773897579584326,0.20467811881425213
N51147,sports,football_ncaa,10 storylines to follow heading down college football's home stretch Seven weeks down; seven to go. We've hit the halfway mark of the college football regular season. It's been entertaining thus far   not too many surprises   with enough intrigue to keep us going back each week.,0.1769215467406166,0.282250617632332,0.2295860821864743,0.24714092733509355
N52692,news,newsus,"Dow says no injuries from chemical plant blast in Louisiana An explosion at a Dow chemical plant in Louisiana rattled windows in nearby homes but caused no injuries, the company said Sunday.",0.1769215467406166,0.2521770945201957,0.21454932063040616,0.22709191192700268
