ID,category,sub_category,content,collaborative_rec,content_rec,mean,two_one
N38868,finance,markets,"China's economic slowdown deepens, weighing on global growth BEIJING (AP)   China's economic growth sank to a new multi-decade low in the latest quarter as a trade war with Washington deepened a slump that is weighing on the global economy. Growth in the world's second-largest economy slipped to 6% in the three months ending in September, down from the previous quarter's 6.2%, data showed Friday. It was the weakest level since China started reporting data by quarters in 1993. The slowdown and weakening...",0.1731710048509332,0.248795375343069,0.21098319009700112,0.2235872518456904
N39778,lifestyle,lifestyleroyals,"14 Parenting Rules the Royals Have to Follow Even in our modern times, there are some traditions British royal parents can't escape.",0.1731710048509332,0.3074674028713424,0.2403192038611378,0.26270193686453935
N18064,news,newspolitics,Top moments from Tuesday's Democratic debate Tuesday's debate in the key battleground state of Ohio was the first opportunity for Democratic candidates to gather on stage since the announcement of the impeachment inquiry against President Donald Trump.,0.1731710048509332,0.1889783761981158,0.18107469052452452,0.18370925241572159
N33502,finance,markets,"China's trade with US shrinks in October despite optimism BEIJING (AP)   U.S.-Chinese trade contracted again in October, despite optimism about possible progress in talks aimed at ending a tariff war that threatens global economic growth.",0.1923723193254727,0.230246756371974,0.21130953784872336,0.21762194402314022
N24724,news,newsworld,"Humanitarian crisis unfolds as violence escalates in Syria In little more than a week, longstanding alliances have crumbled and old enemies have teamed up after the U.S. began pulling its forces out and Turkey invaded Syria",0.2097497560624825,0.2722863749269322,0.24101806549470733,0.251440835305449
N20933,sports,football_ncaa,"College football Week 7 takeaways: LSU offense shows it's for real LSU appears to finally have the offense to compete with Alabama, and other things Dan Wolken learned from Week 7 of the college football season.",0.209914806538481,0.2565385259596601,0.23322666624907054,0.24099728615260038
N35554,sports,football_ncaa,"Lane Kiffin interested in Florida State head coach job Look out, folks. Lane Kiffin wants back into the Power Five, expressing his interest in the Florida State job on the heels of Willie Taggart's Sunday firing.",0.209914806538481,0.2827795074738557,0.24634715700616835,0.2584912738287308
N50343,sports,football_ncaa,'We think it's cute.' Clemson reacts as undefeated Tigers keep falling in Top 25 Clemson co-offensive coordinator Jeff Scott was the head coach at Blythewood High School in Richland County in the mid-2000s before beginning his college coaching career at Presbyterian in 2007.,0.209914806538481,0.2859015712989975,0.24790818891873925,0.26057264971215865
N38821,news,newsphotos,The US Navy is 244 years old today. Here are 42 powerful images from its iconic history. The US Navy has long been the most visible part of America's military might with visits to far flung ports and operations all over the world.,0.209914806538481,0.2794850005511203,0.24469990354480065,0.25629493588024055
N1455,sports,football_ncaa,"LSU up to No. 2 behind Alabama in Amway Coaches poll as Oklahoma, Notre Dame tumble LSU is now No. 2 in the Amway Coaches Poll behind Alabama, while Oklahoma and Notre Dame both tumbled after losses on the road.",0.209914806538481,0.2509755571069455,0.23044518182271326,0.2372886402507907
N8285,sports,football_ncaa,"Report: Potential new USC AD told he cannot pursue Urban Meyer, could back out USC supposedly has a deal in place with Cincinnati athletic director Mike Bohn to make him their next AD, but many expected an official announcement on Monday.",0.209914806538481,0.272463723264531,0.241189264901506,0.25161408435584764
N50049,sports,football_ncaa,"11 bold predictions for rest of college football season Alabama misses the playoff, USC wins Pac-12 and more",0.209914806538481,0.2457176202997659,0.22781621341912345,0.23378334904600426
N8160,sports,football_ncaa,College Football Playoff Chase: Who's Still In The Hunt After Week 9? Which top teams have the best chance of getting into the College Football Playoff after Week 9?,0.209914806538481,0.2420906851721809,0.22600274585533095,0.23136539229428094
N31820,news,newsworld,"What we know about the military dog injured in the al-Baghdadi raid The Belgian Malinois wounded during the raid targeting ISIS leader Abu Bakr al-Baghdadi hasn't been identified, but President Trump tweeted a declassified photo.",0.209914806538481,0.2537400643430257,0.23182743544075335,0.23913164507484413
N6231,sports,football_ncaa,Brett McMurphy's College Football Bowl Projections After Week 7 Find out where your team fits in McMurphy's latest projections. The post Brett McMurphy's College Football Bowl Projections After Week 7 appeared first on Stadium.,0.209914806538481,0.2674772675336446,0.2386960370360628,0.24828978053525672
N14588,sports,football_ncaa,"Jake Fromm proves Georgia is more than just its running game vs. Florida Georgia beat Florida 24-17 in a huge SEC showdown, and the Bulldogs did that with a clutch performance from Jake Fromm.",0.209914806538481,0.2801500010241472,0.2450324037813141,0.25673826952892514
N61319,sports,football_ncaa,"After throwing a punch, Dabo Swinney made CB Andrew Booth ride the manager bus back to Clemson ",0.209914806538481,0.2964949934787332,0.25320490000860707,0.2676349311653158
N17371,news,newsworld,Turkey Takes Fight Against Kurdish Fighters to Iraq As It Struggles in Syria The Turkish Defense Ministry announced that up to seven Kurdish PKK fighters were killed in back-to-back strikes in northern Iraq as deadly clashes continued across the border in Syria.,0.209914806538481,0.2962483416651728,0.25308157410182686,0.2674704966229422
N33622,finance,finance-companies,"Aluminum is replacing plastic as the greenest bottle The drive to turn products more eco-friendly is sweeping through the U.S. beverage market, with plastic being replaced in everything from red Solo cups to Coca-Cola Co. and PepsiCo Inc. water bottles.",0.209914806538481,0.2649748615196421,0.23744483402906155,0.24662150985925507
N14662,foodanddrink,foodnews,"This Controversial Julia Child Recipe Caused Quite a Stir Julia Child has long been one of the most popular cooks in the country, celebrated for strict interpretations of culinary classics. However, her take on a classic Italian dish caused an uproar.",0.209914806538481,0.2942413714623981,0.25207808900043954,0.26613251648775904
N4524,sports,football_ncaa,Brett McMurphy's College Football Bowl Projections After Week 9 Is Oklahoma still projected to earn a College Football Playoff bid? The post Brett McMurphy's College Football Bowl Projections After Week 9 appeared first on Stadium.,0.209914806538481,0.2683962297254222,0.2391555181319516,0.2489024219964418
N21628,news,newsus,"Parkland shooter's death penalty trial set to begin in January Parkland school shooter Nikolas Cruz's death penalty trial is set to begin in January 2020, according to a court order issued Thursday by Florida Circuit Judge Elizabeth Scherer.",0.209914806538481,0.283655751099592,0.2467852788190365,0.25907543624588836
N63642,news,newsus,U.S. Coast Guard responds to oil discharge in Louisiana protected wetlands U.S. Coast Guard responds to oil discharge in Louisiana protected wetlands,0.209914806538481,0.3037702809855769,0.256842543762029,0.2724851228365449
N42583,news,newsworld,"India's capital restricts cars as people choke in dirty air Authorities restricted many private vehicles from taking to the roads of India's capital on Monday amid a public health crisis that has left New Delhi residents gasping and their eyes burning from toxic air pollution. The ""odd-even"" scheme will restrict private vehicles with odd-number license plates to driving on odd dates while even-numbered plates are allowed on even-numbered dates.",0.209914806538481,0.304054273087988,0.2569845398132345,0.272674450904819
N60936,news,newsus,Chicago teachers' strike ends after 11 days. CPS will have 5 make-up days of school The Chicago Teachers Union voted to accept a tentative agreement with Mayor Lori Lightfoot. The two sides argued over how many days to make up.,0.209914806538481,0.2657833049417574,0.2378490557401192,0.24716047214066525
N53052,movies,movienews,Charlize Theron Says Playing Megyn Kelly Was 'Harder' Than Portraying a Serial Killer Charlize Theron: Playing Megyn Kelly Was 'Harder' Than Playing a Serial Killer,0.209914806538481,0.3214926477426282,0.26570372714055457,0.2843000340079125
N51464,news,newsus,"Woman wanted for climbing into Bronx Zoo lion exhibit: 'I am the lion now' Myah Autry said her decision to climb a fence and head into the lion's den was a ""spiritual"" experience.",0.209914806538481,0.311994038883175,0.260954422710828,0.27796762810161035
N45388,sports,football_ncaa,"College football Week 8 bowl projections: Baylor surges into New Year's Day 6 Sporting News' Week 8 bowl projections saw a little movement, and Baylor and North Carolina each have joined the New Year's Day 6 discussion.",0.209914806538481,0.2541245888617909,0.23201969770013595,0.23938799475402092
N58601,health,health-news,"Zantac Recall Update: Another Company Recalls Ranitidine Heartburn Drug Over Cancer Fears Aurobindo Pharma USA, Inc. is the latest company to issue a voluntary recall of ranitidine products over concerns regarding ""probable"" carcinogen NDMA.",0.209914806538481,0.3097387495754378,0.2598267780569594,0.2764641018964522
N2052,sports,football_ncaa,"Hernandez: USC athletic director Mike Bohn needs to tune out Urban (Meyer) noise He wasn't in the building. Except he was. He was rarely mentioned by name. Except every other question was about him. Urban Meyer was nowhere and everywhere Thursday in the John McKay Center, where Mike Bohn was introduced as USC's athletic director. The reason was obvious: Meyer is whom Trojan Nation wants as its football coach. USC can preach the importance of integrity, but the university ...",0.209914806538481,0.2920301401333544,0.25097247333591766,0.26465836226839656
N28467,news,newsworld,"Four-metre king cobra wrestled from sewer in Thailand A feisty four-metre (13-foot) king cobra was pulled from a sewer in southern Thailand in an hour-long operation, a rescue foundation said Tuesday, describing the reptile as one of the largest they had ever captured. Kritkamon said the snake was more than four metres long, weighed 15 kilos (33 pounds), and was the third-largest they had found.",0.209914806538481,0.3121116717061181,0.26101323912229957,0.2780460499835724
N44007,video,news,Where have Cape Town's great whites gone? Shark spotters say Cape Town's world-famous great whites have disappeared. So where have they gone?,0.209914806538481,0.2902036368514733,0.2500592216949772,0.2634406934138092
N62545,finance,finance-companies,"The CEO taking on the gun lobby Ed Stack didn't set out to be an activist. The chief executive of Dick's Sporting Goods, Mr. Stack spent his career selling fishing rods, camping gear and athletic equipment at big-box stores around the country. Dick's was founded by Mr. Stack's father in upstate New York. As a young man, Mr. Stack worked for the family business. But he didn't enjoy the experience. His father was a divisive boss who couldn't manage a supply chain, and was...",0.209914806538481,0.26126878817251,0.23559179735549549,0.24415079429450032
N50015,news,newsworld,North Korea rejects meeting with South over resort North Korea on Tuesday rejected South Korea's request for working-level talks to discuss the possible demolition of South Korean-made hotels and other facilities at the North's Diamond Mountain resort that North Korean leader Kim Jong Un wants removed.,0.209914806538481,0.2884624358701245,0.24918862120430274,0.26227989275957664
N52692,news,newsus,"Dow says no injuries from chemical plant blast in Louisiana An explosion at a Dow chemical plant in Louisiana rattled windows in nearby homes but caused no injuries, the company said Sunday.",0.209914806538481,0.2867892153900548,0.2483520109642679,0.2611644124395302
N14972,foodanddrink,foodnews,"Here's Why We Pass Out Candy on Halloween Sure, candy's a big part of lots of our holidays in the United States but why is Halloween the one where we go door-to-door asking for it?",0.209914806538481,0.2613198151956195,0.23561731086705023,0.24418481230990666
N11673,movies,movies-celebrity,"Blake Lively Hilariously Trolls Ryan Reynolds for Having ""No Chill"" Blake Lively trolled husband Ryan Reynolds and his gin company, Aviation Gin, on Instagram with some hilarious Stories. See what she wrote here.",0.209914806538481,0.3131050950015592,0.2615099507700201,0.27870833218053315
N29819,movies,movies-celebrity,"Paparazzi Drove Keira Knightley to a Mental Breakdown: 'I Told Them I Was Going to Kill Somebody' The twice-Oscar-nominated actress spoke frankly with The Telegraph about how the enormous pressure of 2003's ""Pirates of the Caribbean"" and the hits that followed forced her to retreat from the limelight.",0.209914806538481,0.2988773991830432,0.2543961028607621,0.2692232016348558
N10671,news,newsus,"Pentagon releases first images from raid that killed ISIS leader The Pentagon released newly declassified video and images Wednesday of the daring, two hour raid targeting ISIS leader Abu Bakr al-Baghdadi that shows US forces taking small arms fire from multiple locations as their helicopters approached the compound.",0.209914806538481,0.2462603347317647,0.22808757063512286,0.2341451586673368
N36229,news,newsworld,"US jets destroy anti-ISIS coalition base in Syria after withdrawal, official says Two Operation Inherent Resolve (OIR) F-15 jets destroyed a base that was the headquarters of the anti-ISIS coalition in northern Syria on Wednesday after it had been vacated, according to a military official.",0.209914806538481,0.2895738495487063,0.24974432804359364,0.2630208352119645
N6785,news,newsworld,Today in History: November 5 ,0.209914806538481,0.266620478340752,0.23826764243961648,0.24771858773999497
N14238,sports,football_ncaa,College Football Rivalries: The Top Nicknames ,0.209914806538481,0.2698423601883436,0.2398785833634123,0.24986650897172274
N9460,news,newsworld,"Egypt unveils discovery of 30 ancient coffins with mummies inside Egyptian authorities on Saturday revealed the contents of 30 ancient wooden coffins discovered in Luxor and yes, they include mummies.",0.209914806538481,0.2902928807905681,0.25010384366452454,0.26350018937320574
N28660,news,newsworld,"Erdogan vows to 'crush the heads' of Kurds if they don't withdraw; both sides trade blame for violating cease-fire Turkish President Recep Tayyip Erdogan on Saturday promised to ""crush the heads"" of the Kurds in Syria if they don't fall back from the border's safe zone, according to reports.",0.209914806538481,0.2748264505012516,0.2423706285198663,0.2531892358469947
N51616,sports,football_ncaa,"Plaschke: USC's debacle against Oregon is final nail in coach Clay Helton's coffin It's over now, finally, mercifully, a USC football era ending Saturday night on a field filled with mistakes surrounded by fans teeming with anger. There's no way Clay Helton comes back from this. There's no way the Trojans football program can continue on like this. There's no way this should ever happen at USC, ever, this embarrassing 56-24 whipping at the hands and arms and feet of the ...",0.209914806538481,0.2958159329911662,0.2528653697648236,0.2671822241736045
N58625,news,newspolitics,"Kamala Harris responds to memo on staff cuts: 'I fully intend to win' The senator's campaign is cutting jobs in its headquarters and shifting workers from New Hampshire, Nevada and California.",0.209914806538481,0.2336180444093745,0.22176642547392775,0.22571696511907666
N22032,sports,football_ncaa,Five arguments College Football Playoff committee can ignite with first rankings The first College Football Playoff rankings will be unveiled on Tuesday. Here are the five arguments that could take off as a result.,0.209914806538481,0.2678667753875072,0.2388907909629941,0.2485494524378318
N770,tv,tvnews,"Megyn Kelly Slams NBC News on 'Tucker Carlson Tonight' for Matt Lauer Investigation, Harvey Weinstein Coverage In Megyn Kelly's first televised interview since exiting NBC, the former Fox News and NBC News anchor took to ""Tucker Carlson Tonight"" Wednesday evening to criticize NBC News management for its handling of the outlet's Harvey Weinstein coverage and internal Matt Lauer investigation.",0.209914806538481,0.2684482135805702,0.2391815100595256,0.2489370778998738
N27106,sports,football_ncaa,Brett McMurphy's College Football Bowl Projections After Week 8 This week's National Championship projection: LSU vs. Ohio State. The post Brett McMurphy's College Football Bowl Projections After Week 8 appeared first on Stadium.,0.209914806538481,0.2589167985327693,0.23441580253562513,0.24258280120133985
N46354,sports,football_ncaa,Week 8 observations: Wisconsin exposed as fraud in title chase and that could hurt Big Ten Wisconsin showed it was not a real national title contender with a loss to Illinois that changes the landscape of the Big Ten.,0.209914806538481,0.24804784155055,0.2289813240445155,0.23533682987986035
N40545,finance,finance-savemoney,"12 things that could save us money if we weren't lazy From checking your credit report to comparison shopping, go the extra mile to keep your cash.",0.209914806538481,0.2538613910296542,0.2318880987840676,0.23921252953259647
N51147,sports,football_ncaa,10 storylines to follow heading down college football's home stretch Seven weeks down; seven to go. We've hit the halfway mark of the college football regular season. It's been entertaining thus far   not too many surprises   with enough intrigue to keep us going back each week.,0.209914806538481,0.2528249412693623,0.23136987390392164,0.23852156302573518
N41218,news,newspolitics,"Election Day 2019: Most Important Races and What to Watch For In elections that will determine policy, the political makeup of state legislatures and who lives in governors' mansions, voters will head to the polls Tuesday in states across the country.",0.2106674278304911,0.2052908093915841,0.2079791186110376,0.20708301553788644
N14349,entertainment,celebrity,Celebrity Headshots from Before They Were Famous Prepare for some straight-up baby faces.,0.2107442201692466,0.2705727333130374,0.240658476741142,0.25062989559844046
N40171,autos,autosbuying,Why You Shouldn't Ever Go for the Cheapest Brake Pads Brakes are the most important part of your car. Here's why you shouldn't cut costs on them.,0.2115736338000122,0.298526646254176,0.25505014002709414,0.26954230876945473
N33981,lifestyle,lifestylebuzz,"Dog Throws A Total Tantrum When She Realizes Mom Wants To Take The Stairs Aurora Angel Beste Nala has always been the friendliest dog, and loves going out on adventures and meeting new people.",0.2115736338000122,0.287497174223293,0.2495354040116526,0.26218932741553275
N40509,news,newscrime,One of FBI's Most Wanted fugitives offers surrender One of the FBI's Most Wanted fugitives says he wants to surrender but claims his offers are being ignored by the United States government.,0.211909407521209,0.2565897469892856,0.2342495772552473,0.24169630049992674
N62471,sports,football_nfl,"Trent Williams fails physical, experiencing discomfort with helmet Washington Redskins tackle Trent Williams' health situation has managed to get stranger after he reported to the team.",0.2125379181044022,0.2979500407454017,0.25524397942490196,0.2694793331984019
N63554,travel,traveltripideas,"It took me 96 hours to ride an Amtrak train from coast to coast. I'd do it again in a heartbeat. Four days aboard a cross-country Amtrak train was so much more relaxing than flying. If I had the time, I'd do it on every trip.",0.2130678134279182,0.3214868944401576,0.2672773539340379,0.2853472007694111
N56446,movies,movies-celebrity,Ryan Reynolds Shares the First Photo of His and Blake Lively's Newborn Daughter This is the first time the actor has talked about his newborn daughter.,0.2131052663695042,0.2926034757121252,0.2528543710408147,0.2661040725979182
N16158,lifestyle,lifestylebuzz,"Nationals pitcher criticized for missing playoff game for daughter's birth Daniel Hudson said his family is his ""top priority"" after receiving criticism for missing a playoff game for the birth of his daughter.",0.2134595836460197,0.2717867378092689,0.24262316072764428,0.2523443530881858
N44442,news,newspolitics,"CNN Poll: 50% support impeaching Trump and removing him from office Half of Americans say President Donald Trump should be impeached and removed from office, according to a new CNN poll conducted by SSRS.",0.2139894789695357,0.2206905858479777,0.2173400324087567,0.21845688355516368
N22614,sports,football_ncaa,Predicting which of college football's 10 undefeated teams will lose in Week 9 How many teams will still have a perfect record after Week 9?,0.2145619930558242,0.2593668936759176,0.2369644433658709,0.24443192680255313
N42791,tv,tvnews,"Eva Longoria: 'Latinas Are the Last to Find Their Voices Amplified' Eva Longoria delivered a powerful and moving keynote at TheWrap's Power Women Summit in Los Angeles on Friday, saying that people in Hollywood are ""largely responsible for much of the unconscious bias that is against people of color"" and that ""Latinas are the last to find their voices amplified in this industry."" ""What studies show is that we are being erased,"" Longoria told a room of 2,000 attendees. ""This goes beyond underrepresentation. When...",0.2145619930558242,0.2780158668722449,0.24628892996403456,0.25686457560010467
N50479,health,wellness,"Items you need to stop sharing with others right now Items you should never share for your health and safety include everyday items like toothbrushes, earbuds and lipstick.",0.2145619930558242,0.2955360823342857,0.25504903769505494,0.26854471924146517
N56444,health,wellness,"Jameela Jamil Called Out a New TV Show Where Judges Decide If Contestants ""Deserve"" Plastic Surgery The Good Place star had a lot to say after learning about ""The Surjury,"" a new British reality series about people competing against one another to win free plastic surgery.",0.2145619930558242,0.2909050976125672,0.25273354533419573,0.2654573960936529
N30103,travel,traveltripideas,"A network of 28 tiny, one-bed hotels in Amsterdam is being called the most beautifully designed hotel of 2019   and it consists of a series of converted bridge houses. Take a look inside. Amsterdam's bridge hotels, located in historic houses on and near bridges, are a tiny house lover's dream ⁠  and they just won a major design award.",0.2145619930558242,0.3095903138903736,0.2620761534730989,0.2779142069455238
N6576,health,weightloss,16 Women Reveal Exactly How They Got Six-Pack Abs What does it really take to get six-pack abs? These women can tell you exactly what worked for them.,0.2145619930558242,0.3070510222120888,0.2608065076339565,0.27622134582666724
N53118,health,health-news,Colorado Mom's Touching Facebook Post Beautifully Explains Why We Shouldn't Suffer in Silence One Colorado mom's Facebook post recently went viral for showing how much asking a friend for help can make the difference when you're feeling alone.,0.2145619930558242,0.2847140238655352,0.24963800846067968,0.2613300135956315
N54449,news,newsus,"Third Indiana Catholic school employee fired in growing scandal over LGBTQ staff Unlike the others fired from Indianapolis-area Catholic schools, Kelley Fisher is straight and only expressed support for her fired colleagues.",0.2145619930558242,0.2944297302266812,0.2544958616412527,0.26780715116972886
N12709,lifestyle,lifestylebuzz,"Twitter Had Feelings About Mark Zuckerberg's Micro-Bangs Facebook founder Mark Zuckerberg debuted a new haircut on the House floor on Wednesday, and Twitter quickly took note with an avalanche of memes and quips.",0.2145619930558242,0.2714986281136167,0.24303031058472047,0.2525197497610192
N64554,entertainment,entertainment-celebrity,"Meghan King Edmonds, Jim Edmonds' Nanny Denies Cheating Allegations Meghan King Edmonds, Jim Edmonds' Nanny Denies Cheating Allegations",0.2145619930558242,0.289020093790766,0.2517910434232951,0.2642007268791187
N40526,music,music-celebrity,Miranda Lambert Shares the Surprising Story of Her and Brendan McLoughlin's Meet-Cute The Pistol Annie's are to thank for introducing the country singer to her husband,0.2145619930558242,0.3015279336235048,0.2580449633396645,0.27253928676761124
N56290,foodanddrink,tipsandtricks,The Secret Ingredient for Sausage Gravy That's Out of This World Transform your gravy with this $1 ingredient,0.2145619930558242,0.3097718031682911,0.2621668981120577,0.2780351997974688
N47922,music,music-celebrity,"Allegations against entertainer Todrick Hall are piling up, from stories of nonpayment to accusations of backlash for reporting sexual assault Todrick Hall became prominent in Broadway musicals, for his friendship with Taylor Swift, and more. Now, accusations against him are piling up.",0.2145619930558242,0.2883048167223072,0.2514334048890657,0.2637238755001462
N29561,lifestyle,lifestylebuzz,"High school cheerleaders go off-script to help man propose to their coach A school's cheer squad coach was surprised when her students went off-script and held up four signs during a routine that read, ""Will you marry me?""",0.2145619930558242,0.2998469674461007,0.25720448025096243,0.27141864264934185
N22627,news,newsus,Family Members Plead for Help in Search for Missing Atlanta College Student: 'Just Come Home' Family Pleads for Help in Search for Missing College Student,0.2145619930558242,0.2880999252103017,0.25133095913306297,0.2635872811588092
