ID,category,sub_category,content,collaborative_rec,content_rec,mean,two_one
N42128,movies,movies-celebrity,"Hugh Hefner's son Cooper weds 'Harry Potter' actress Cooper Hefner married Scarlett Byrne in Ventura, Calif., on Monday.",0.2341638203438501,0.2989671514672861,0.2665654859055681,0.27736604109280744
N43955,entertainment,entertainment-celebrity,"Celebrity kids then and now: See how they've grown See what the children of Bobby Cannavale, Ray Liotta, Jude Law, Jamie Foxx, Sylvester Stallone, James Gandolfini and more stars look like now.",0.2343647399566334,0.2727539949775757,0.25355936746710456,0.2599575766372616
N11005,news,newspolitics,"Nunes Aide Is Leaking the Ukraine Whistleblower's Name, Sources Say A top aide to Rep. Devin Nunes has been providing conservative politicians and journalists with information and misinformation about the anonymous whistleblower who triggered the biggest crisis of Donald Trump's presidency, two knowledgeable sources tell The Daily Beast.",0.2344634250740162,0.2506863763440546,0.24257490070903542,0.24527872592070848
N13137,video,popculture,"Singer stands up to heckler who told her to take shirt off After being heckled on stage and told to ""free the nips"" at a concert in Texas, singer Maggie Rogers voiced her anger about the harassment.",0.2347894379633683,0.3063632432362397,0.270576340599804,0.2825053081452826
N9803,finance,markets,"Jeff Bezos is set to lose his crown as world's richest person Jeff Bezos is about to relinquish the title of world's richest person to Bill Gates, as Amazon.com Inc. stock tumbled in late trading Thursday.",0.2348320021818963,0.2558302314441153,0.2453311168130058,0.24883082169004234
N20091,weather,weathertopstories,"Firefighting Plane Battles Maria Fire Near Santa Paula A tanker dropped fire retardant to combat the Maria Fire near Santa Paula in Ventura County, California on Friday, November 1. By Friday, the fire had reached more than 9,000 acres and was at zero percent containment, according to CAL FIRE. The Maria Fire broke out at around 9 pm on Thursday, and ""exploded"" overnight, prompting mandatory evacuations affecting more than 10,000 residents between Santa Paula and Somis, according to reports. Firefighters are battling several blazes across the state, including the 77,000 acre Kincade Fire in Sonoma County and the 1,800 Easy Fire in Ventura County. Incident reports for the California wildfires can be found here. Credit: @shant_nazaryan via Storyful",0.2348693617686601,0.306921628328343,0.2708954950485016,0.282904206141782
N5887,weather,weathertopstories,"Lucky Texas Storm Chaser Sees Hailstones Whizz Past Him During Tornado Storm chaser Marcus Diaz may think twice about how close he gets to the elements after large hailstones whizzed past his head from behind as he was filming an EF2 tornado in Tahoka, Texas, earlier this year. According to Accuweather, the winds in the tornado reached ""between 113 and 157 mph."" Diaz posted footage of the moment he was filming a ""dusty EF-2 tornado at close range"" as the hailstones almost hit ""the camera from behind,"" to Twitter on October 17. The lucky storm chaser told Storyful the footage was recorded on May 5. No injuries were reported as a result of the storm. However, the cyclone ripped through agricultural areas, ""causing structural damage to farms and wrecking equipment, power lines, and irrigation systems,"" according to media reports. Diaz may be better served in the future by heeding the advice of the National Oceanic and Atmospheric Administration (NOAA). According to NOAA, ""if you are unable to make it to a safe shelter, either get down in your car and cover your head, or abandon your car and seek shelter in a low lying area such as a ditch or ravine."" Credit: Marcus Diaz via Storyful",0.2348693617686601,0.3095911593704369,0.2722302605695485,0.28468389350317796
N53436,finance,finance-real-estate,"Inside the Sheikh of Dubai's 800-acre Kentucky horse farm I got a tour of Sheikh Mohammed of Dubai's 800-acre horse farm in Kentucky, where horses live in immaculate barns with skylights and personal fans.",0.2348693617686601,0.3025511381274929,0.2687102499480765,0.279990546007882
N41420,news,newsus,Cracks found on 38 of 810 Boeing 737 NG jets inspected globally Cracks found on 38 of 810 Boeing 737 NG jets inspected globally,0.2348693617686601,0.2880679999927189,0.26146868088068953,0.27033512058469933
N64049,news,newsworld,"After Soldiers Surrender El Chapo's Son, a Shocked Mexican City Sighs With Relief In the days following the siege of the city of Culiacán by the Sinaloa cartel, residents were overcome with relief: Relief that the terror is over.",0.2348693617686601,0.2673267741876034,0.2510980679781318,0.2565076367146223
N26122,weather,weatherfullscreenmaps,"Explosive new wildfire drives thousands from homes near Los Angeles The Maria fire ignited in Ventura County early Thursday night and raced westward, consuming 4,000 acres in just three hours.",0.2348693617686601,0.3007666903451294,0.26781802605689475,0.2788009141529729
N37720,health,nutrition,"23 Foods That Help Lower High Blood Pressure Consuming less sodium may be important to help slash blood pressure levels, but eating more of these foods is good for your heart and arteries too. The post 23 Foods That Help Lower High Blood Pressure appeared first on The Healthy.",0.2348693617686601,0.3074878921669827,0.2711786269678214,0.2832817153675418
N15919,news,newsus,"Saddleridge fire calms down, heavy rains on East Coast A new storm system is developing in the southern Plains and will move east over the next few days bringing a threat of flooding to the South with rain and gusty winds.",0.2348693617686601,0.2825841069617714,0.25872673436521576,0.26667919189740097
N391,news,newsus,"Illegal drones ground water-dropping helicopters at critical moment in Maria fire battle LOS ANGELES - As flames rapidly spread along a hillside in Santa Paula, firefighters were faced with a perilous dilemma: ground night-flying helicopters working to contain the growing fire or risk an aerial collision with a thrill-seeking drone.",0.2348693617686601,0.2802720847035966,0.25757072323612834,0.26513784372528443
N11917,travel,travelnews,JetBlue Plane Makes Emergency Landing at JFK Airport The plane landed safely in NYC Sunday night.,0.2348693617686601,0.2882873538671113,0.2615783578178857,0.2704813565009609
N49179,movies,movienews,Joe Alwyn on Buzz Around Taylor Swift Romance: 'I'll Just Turn it Off' Joe Alwyn on Buzz Around Taylor Swift Romance: 'I'll Just Turn it Off',0.2348693617686601,0.2994013322656078,0.26713534701713393,0.2778906754332919
N29924,autos,autosenthusiasts,"25 Cars No One Wanted to Buy Along with cars so bad they become icons and the models that should have worked but never caught on come a slew of vehicles that'll have you scratching your head. Remind yourself of the disasters that were the Cadillac Catera, Buick Reatta, Volkswagen Phaeton, Lincoln Blackwood, Chrysler Executive Limousine, and more.",0.2348693617686601,0.2913679505789806,0.26311865617382035,0.2725350876422071
N35259,finance,finance-retirement,"'I'm 73 and fed up with California and want a gun-friendly, affordable city with good weather   so where should I retire?' Some hidden gems to consider in Georgia, New Mexico and Arkansas.",0.2348693617686601,0.2824287039991425,0.2586490328839013,0.266575589922315
N55312,travel,travelnews,"Why are most aircraft painted predominantly white? Aircraft liveries, or the designs painted on the exterior of aircraft from the nose to the tail, are a way to identify to which airline the plane belongs.",0.2348693617686601,0.3402844971747552,0.28757692947170765,0.3051461187060568
N2153,news,newsworld,"Iran alleges foreign government behind 'treacherous' ship attack Iran said Monday a foreign government was behind what it alleges was a ""treacherous"" attack on a tanker off Saudi Arabia last week, as it released pictures of its damaged hull. But the state-owned NITC denied reports the alleged attack had originated from Saudi soil.",0.2348693617686601,0.3001030914121374,0.2674862265903988,0.2783585148643116
N56541,sports,baseball_mlb,"Soto, Nationals edge Astros in World Series opener Juan Soto homered onto the train tracks high above the left field wall and hit a two-run double as the Nationals tagged Gerrit Cole and the Houston Astros 5-4 Tuesday night in the World Series opener.",0.2350253301530139,0.2860197313616395,0.2605225307573267,0.269021597625431
N19347,news,newspolitics,"Former US Senator Kay Hagan dead at 66 Former U.S. Sen. Kay Hagan, a one-time Capitol Hill intern who went on to become North Carolina's first Democratic female senator, died Monday at her Greensboro home. She was 66.",0.2350715118008769,0.2860789781072818,0.26057524495407935,0.26907648933848016
N54522,entertainment,celebrity,"Ben Affleck has a new girlfriend after using the Raya dating app, plus more celeb love life news for late October 2019 Meg Ryan and John Mellencamp call it quits, Halsey and Evan Peters get serious, James McAvoy weds, Meghan King Edmonds accuses hubby of cheating and more.",0.2355256801943306,0.2799974547468117,0.25776156747057116,0.2651735298959847
N28074,lifestyle,lifestylefamilyandrelationships,"Woman Texts Dead Father's Phone for 4 Years & Finally Receives an Emotional Reply The pain of losing a parent, especially at a young age, is one that never really goes away.",0.2355427670689487,0.3022233395539907,0.2688830533114697,0.2799964820589767
N28058,lifestyle,lifestylebuzz,Strange Dog Shows Up On Woman's Lawn   And Seems To Recognize Her Kate Howard was sitting outside her home one afternoon after a memorial service when something amazing happened.,0.2359364484084713,0.2917541296934343,0.2638452890509528,0.27314823593177995
N42620,lifestyle,lifestylebuzz,"Heidi Klum's 2019 Halloween Costume Transformation Is Mind-Blowing   But, Like, What Is It? You might say she's scary good at playing dress-up, because Heidi Klum's 2019 Halloween costume is even more impressive than we could have imagined   and that's saying a lot, considering transformative Halloween costumes are kind of her thing. But this year Klum took it up one more notch as she shared her metamorphosis into,",0.2361367471291399,0.2933324989382609,0.26473462303370043,0.27426724833522054
N63276,autos,autosenthusiasts,Gordon Ramsay's Ferrari Monza SP2 Looks Delicious Good thing the roofless ride is inside because it's raining outside.,0.2362391578468187,0.3062112267909458,0.27122519231888226,0.2828872038095701
N11855,news,newsus,"New Jersey woman sues waiter for spilling wine on her Hermès handbag The woman is seeking $30,000 for the light-pink luxury handbag, which has been discontinued.",0.2362488122731251,0.2965829210103575,0.26641586664174133,0.27647155143128
N38155,sports,baseball_mlb,Best Photos of the World Series Best Photos of the World Series,0.236285201436427,0.2730491828157082,0.2546671921260676,0.2607945223559478
N59026,news,newsus,"Cincinnati school board candidate accused of 'pretending to be black' in his ads A current CPS board member took to Twitter Sunday to say a candidate for the board ""is a white guy pretending to be black to get votes"" in ads.",0.2363655620746755,0.2455084919254587,0.24093702700006708,0.2424608486418643
N15122,tv,tv-celebrity,Tamron Hall says she 'never dealt' cocaine after reports say she confessed to doing so Tamron Hall issued a statement in response to the Daily Mail reporting that she confessed to facilitating the sale of cocaine as a teenager.,0.2364868016539381,0.2785598465111363,0.2575233240825372,0.26453549822540356
N55556,finance,personalfinance,Why President Trump's kids are probably celebrating his move to Florida The No. 1 reason billionaires decide to move.,0.2368795945210112,0.2648817028685387,0.25088064869477494,0.2555476667526962
N20121,music,musicnews,"Bob Kingsley, Country Radio Legend, Dead at 80 Country radio legend Bob Kingley, the longtime host of the nationally syndicated program Bob Kingsley's Country Top 40, died early Thursday in Weatherford, Texas, following a lengthy battle with bladder cancer. He was 80 years old. A member of the Country Radio Broadcasters Hall of Fame, inducted in 1998, he later became only the format's fifth representative in the National Radio Hall of Fame in 2016. Kingsley was 18 and serving in the Air...",0.2370015919223582,0.3061258093791086,0.27156370065073343,0.2830844035601918
N58936,news,newsus,Beloved grandfather's body pulled from collapsed Hard Rock hotel A family holding vigil outside the site of the Hard Rock hotel construction collapse received the news they hoped they'd never hear.,0.2370440988637164,0.2747207825487925,0.25588244070625443,0.2621618879871005
N5283,foodanddrink,foodnews,"For the first time ever, a US cheese is named best in the world Forget the American love affair with Cheez Whiz, blocks of Velveeta and pasteurized processed cheese food slices. An organic blue cheese from Oregon has been named the world's top cheese.",0.2371958512379595,0.2798101388512676,0.25850299504461355,0.26560537631349823
N38118,tv,tv-celebrity,Uh-Oh! Carrie Ann Inaba Falls on 'Dancing With the Stars' Uh-Oh! Carrie Ann Inaba Falls on 'Dancing With the Stars',0.2374085793126287,0.2777840257176645,0.2575963025151466,0.26432554358265253
N54305,sports,football_nfl,Urban legend? How the Cowboys' rout of the Eagles helped take Coach Meyer out of the conversation Did the Cowboy's victory Sunday night take care of the Urban Meyer rumors?,0.237760094842283,0.2863147308475928,0.26203741284493787,0.2701298521791562
N30698,news,newsus,Cranes remove bus partially swallowed by Pittsburgh sinkhole A bus that was partially swallowed when a sinkhole opened during morning rush hour in downtown Pittsburgh has been removed from the hole. Authorities said earlier Monday that two cranes arrived to remove the city bus.,0.2379960763307078,0.288629771837232,0.2633129240839699,0.27175187333505724
N32109,travel,travelnews,"Cell Phone Forces Flight Diversion to Ireland When no one could identify the owner of the phone, the captain diverted the flight.",0.2380198051821683,0.2959907840178579,0.2670052946000131,0.27666712440596136
N37123,lifestyle,lifestylesmartliving,"17 Things You Should Never Do During a Conversation Want to make sure every conversation you have goes well? Begin with avoiding these 17 things you should never do, according to etiquette experts.",0.2380198051821683,0.2902263721072786,0.26412308864472345,0.2728241831322418
N56630,finance,markets,China asks WTO for $2.4 billion sanctions against U.S. in latest clash China asks WTO for $2.4 billion sanctions against U.S. in latest clash,0.2380451809726716,0.2726368911646079,0.2553410360686397,0.26110632110062915
N56514,travel,travelnews,"Road built by biblical villain uncovered in Jerusalem A long-buried street that led pilgrims to the Jewish Temple 2,000 years ago was commissioned by Roman governor Pontius Pilate.",0.2381517804426843,0.3016998193992899,0.2699257999209871,0.28051713974708803
N45535,news,newsus,DOJ sues Walmart for allegedly discriminating against a Navy reserve officer The Department of Justice says that Walmart did not hire a naval reserve officer due to her mandatory two-week training in the summer of 2016.,0.2382290177402083,0.2607662575618724,0.24949763765104033,0.25325384428798436
N23887,news,newsus,"Video allegedly shows police officer roughing up 11-year-old girl There's no excuse for the way this girl was treated, the Farmington police chief said.",0.2387015811745418,0.296841427272698,0.2677715042236199,0.2774614785733126
N62703,autos,autosnews,"Does Tire Rotation Include Tightening Lug Nuts? Michigan Court Thinks About It For Awhile, Concludes 'No' In what will surely go down in history as one of the most Galaxy Brain court rulings of all time, a Michigan appeals court determined that a tire rotation does not, in fact, include tightening the lug nuts.",0.2387660201376044,0.3206379201229448,0.2797019701302746,0.293347286794498
N14385,news,newsworld,ISIS names successor to slain leader al-Baghdadi The militant group named Abu Ibrahim Hashimi al-Quraishi as the new leader in a message posted by its official media wing.,0.2388099163805535,0.2722681735946788,0.25553904498761615,0.2611154211899704
N31825,video,viral,A sneak peek at Hudson Yards' Edge to open March 2020 A new observation deck in NYC is opening up on March 11th 2020. We give you a sneak peek at Hudson Yards' Edge.,0.2389173195754408,0.2749347849699349,0.25692605227268783,0.26292896317177017
N45729,tv,tv-celebrity,"Former Deadliest Catch Star Jerod Sechrist Arrested, Charged with Heroin Possession Deadliest Catch: Jerod Sechrist Charged with Heroin Possession",0.2389173195754408,0.3013182083462351,0.2701177639608379,0.28051791208930366
N51891,sports,football_ncaa,"7 biggest takeaways from the opening College Football Playoff rankings Hey, the Pac-12 is actually being respected.",0.2389173195754408,0.262230314992489,0.2505738172839649,0.2544593165201396
N62058,sports,football_nfl,"What Tom Brady, Lamar Jackson Told Each Other After Patriots-Ravens Tom Brady offered credit where it was due Sunday night in Baltimore. The Ravens handed Brady and the Patriots their first loss of the season in Week at M amp T Bank Stadium. The primetime",0.2391083289990963,0.2921542468464662,0.26563128792278123,0.2744722742306762
N1398,news,newsus,"Iowa woman killed by explosion at gender reveal party An Iowa woman was killed by debris from an explosion at a gender reveal party on Saturday, police said.",0.2391498386404998,0.2936731883860399,0.26641151351326986,0.27549873847085987
N28257,news,newspolitics,"Meghan McCain confronts Trump Jr.: 'You and your family have hurt a lot of people' Donald Trump Jr., the president's son, defended his family after ""View"" co-host Meghan McCain suggested they were responsible for the lack of ""character"" in American politics.",0.2393874250895781,0.2615242499482628,0.2504558375189204,0.25414530832870125
N12576,news,newsworld,Chinese pilot suspended after woman poses in cockpit with drinks The unidentified woman is seen sitting in the captain's seat with drinks in front of her on an Air Guilin flight in January this year.,0.239417508518004,0.307733583874837,0.2735755461964205,0.2849615587558927
N59359,news,newscrime,Police Arrest Motorcyclist Who Led High-Speed Chase And Went Home Thinking He Escaped A motorcyclist was arrested after leading California Highway Patrol units on a high-speed chase in Placerville on Saturday.,0.2397069166988685,0.3031879155686494,0.27144741613375895,0.28202758261205574
N10414,movies,movienews,"Robert Evans, 'Chinatown' Producer and Paramount Chief, Dies at 89 Robert Evans, the Paramount executive who produced ""Chinatown"" and ""Urban Cowboy"" and whose life became as melodramatic and jaw-dropping as any of his films, died on Saturday night. He was 89. Even though Hollywood history is filled with colorful characters, few can match the tale of Evans, whose life would seem far-fetched if it were",0.2397485785833053,0.2990633009423833,0.2694059397628443,0.27929172682269066
N44559,health,health-news,Photo of emotional nurse after 'particularly hard day' goes viral Her sister revealed that she had just wrapped up four days worth of work that included assisting in the delivery of a stillborn baby.,0.2398458114492828,0.2880100902762529,0.2639279508627679,0.27195533066726285
N15034,tv,tv-celebrity,Alec Baldwin's 'heart goes out to' imprisoned Felicity Huffman and husband William H. Macy Alec Baldwin thinks incarceration shouldn't be a consequence for those guilty in the admissions scandal and gave a shout-out to Felicity Huffman.,0.2400117385043955,0.288245465053923,0.26412860177915926,0.2721675562040805
N60340,lifestyle,lifestyleroyals,"Here's Why Harry and Meghan's Latest Interview Could Be the Final Straw for the Royal Family In Prince Harry and Meghan Markle's ITV interview on Oct. 20, they said they're unhappy living in a fishbowl. An insider reveals the palace's response.",0.2400582421169722,0.2867584207718195,0.26340833144439585,0.2711916945535371
N37131,sports,baseball_mlb,What recent history tells us to expect from World Series Game 7 Will the Nationals and Astros give us a classic or a clunker?,0.2401254283518875,0.2671510849913409,0.2536382566716142,0.25814253277818977
N27526,news,newsus,"1 dead, 8 others hospitalized in Salmonella outbreak likely tied to ground beef The CDC said the latest Salmonella outbreak is not tied to one type or brand of ground beef.",0.2405502469963469,0.2735359435805545,0.2570430952884507,0.26254071138581864
N23979,finance,markets,"China already snapping up U.S. farm goods, Trump claims President Donald Trump boasted Sunday without providing evidence that China had ""already begun"" making large purchases of U.S. agricultural products as part of last week's tariff deal with Beijing.",0.2406542443545394,0.2193730890014684,0.23001366667800388,0.22646680745249206
N45794,news,newscrime,"Four flight attendants were arrested in Miami's airport after bringing in thousands in cash, police say Four American Airlines flight attendants were arrested at the Miami International Airport and charged with money laundering after bringing large amounts of cash into the country, police said.",0.2410571606420687,0.3074444932257688,0.2742508269339187,0.2853153823645354
N20286,movies,movies-celebrity,Scarlett Johansson Says She Was 'Surprised' by Colin Jost's Proposal: 'He Killed It' Scarlett Johansson Was 'Surprised' by Colin Jost's Proposal,0.2411179609126565,0.294544944578155,0.26783145274540576,0.27673595002298884
N5888,sports,baseball_mlb,Report: Angels could be fined up to $2M for not reporting Skaggs' opioid use The Los Angeles Angels could be fined up to $2 million by the commissioner for not reporting Tyler Skaggs' opioid use. A report published by ESPN on Saturday stated that Angels communications director Eric Kay admitted to federal investigators that he used and supplied Skaggs with drugs since at least 2017.,0.2411179609126565,0.3268723503425489,0.2839951556276027,0.2982875538659181
N2606,news,newscrime,"Couple Accused of Injecting Childhood Friend With Meth and Filming Her As She Died After more than two years of investigation, authorities in Oklahoma have filed formal murder charges in the death of a 41-year-old woman whose last moments were captured on videotape.",0.2411179609126565,0.3106318471412341,0.2758749040269453,0.28746055173170826
N47054,autos,autossema,"Hennessey Maximus Is a 1000-HP Jeep Gladiator from Hell If a 2020 Jeep Gladiator is not aggressive-looking enough, Hennessey has this even more intense version, which it's bringing to the SEMA show.",0.2411179609126565,0.3103642575088301,0.2757411092107433,0.2872821586434389
N8419,news,newscrime,Man charged with 5 counts of first-degree murder in shooting rampage at Chicago condo Chicago police Monday morning announced charges against a man in connection with a shooting rampage that left five people dead Saturday night.,0.2411179609126565,0.2668091096555929,0.2539635352841247,0.25824539340794744
N55310,news,newscrime,"Joey 'the Clown' Lombardo, infamous Chicago mobster, dead at 90, reports say Chicago mobster Joseph Lombardo   better as ""Joey the Clown""   died in prison Saturday while serving a life sentence for murder, according to federal prosecutors.",0.2411179609126565,0.278638045902394,0.25987800340752526,0.26613135090581486
N1431,news,newscrime,"Four charged with repeatedly escaping prison, returning with booze and phones Acting on ""repeated reports"" that prisoners were regularly escaping and returning, authorities said they caught the men in the act with the contraband.",0.2411179609126565,0.2949588251464283,0.2680383930295424,0.2770118704018377
N18663,news,newsus,"Coast Guard offloads $92 million worth of smuggled cocaine in San Diego The Coast Guard offloaded more than 6,800 pounds of cocaine   worth an estimated $92 million   in San Diego on Wednesday, contraband that the military branch seized in international waters of the eastern Pacific Ocean.",0.2411179609126565,0.2930134391407087,0.2670657000266826,0.27571494639802463
N22130,music,music-celebrity,Rihanna Slays in Sexy Black Bikini in Slow-Motion Video -- Watch! The singer shut down Instagram with her slow-motion clip.,0.2411179609126565,0.2848943143024224,0.26300613760753944,0.27030219650583376
N64562,tv,tv-celebrity,Rob Kardashian Appears Thinner at Kim Kardashian's Birthday Party in Rare Video Rob Kardashian Appears Thinner at Kim Kardashian's Birthday Party,0.2411179609126565,0.2812869844116578,0.2612024726621571,0.2678973099119907
N15771,autos,autosenthusiasts,"The Holy Grail Of Jeep Grand Cherokees Sits On An Old Wisconsin Dairy Farm, But It May Be Doomed ",0.2411179609126565,0.2738383389236215,0.257478149918139,0.26293154625329984
N47482,travel,travelnews,TSA Agents Stop Passenger With Loaded Gun Before Boarding Plane The man was carrying a loaded .22 caliber handgun.,0.2411179609126565,0.3206992728968678,0.28090861690476215,0.2941721689021307
N24123,sports,baseball_mlb,Why is Giancarlo Stanton on the Yankees' playoff roster? ,0.2411179609126565,0.2999287646546685,0.2705233627836625,0.28032516340733116
N20886,news,newsworld,"ISIS Leader Paid Rival for Protection but Was Betrayed by His Own The Islamic State leader Abu Bakr al-Baghdadi was able to hide out in an unlikely part of Syria, the base of a rival group, because he was paying protection money to its members, according to receipts for the payments recovered by researchers.",0.2411179609126565,0.2748278720014229,0.2579729164570397,0.2635912349718341
N60388,news,newscrime,"Man threatened school to distract from robbery, police say As a precaution, schools in one of the districts that were threatened placed all of its schools on a modified lockdown",0.2411179609126565,0.2759934216118289,0.2585556912622427,0.2643682680454381
