ID,category,sub_category,content,collaborative_rec,content_rec,mean,two_one
N64745,sports,baseball_mlb,"With latest sign-stealing revelations, Houston Astros once again toe baseball's ethical lines Accused of electronically stealing signs in 2017, the Astros organization faces even more questions about its culture.",1.0,0.2947947883628828,0.6473973941814414,0.5298631922419219
N51808,news,newspolitics,"Democrats' impeachment lawyer cut his teeth prosecuting mobsters, Wall Street cheats Daniel Goldman will lead witness questioning during the hearings that begin Wednesday.",1.0,0.2257228540246988,0.6128614270123494,0.4838152360164658
N22417,travel,travelarticle,Divers salvage 100-year-old liquor from WWI shipwreck A team of ocean explorers says it has retrieved cognac and liqueur from a ship that was bound for Russia when it was sunk by a German submarine in 1917.,1.0,0.305865570555157,0.6529327852775785,0.537243713703438
N37320,news,newspolitics,"Pro-Trump conservatives are getting trolled in real life by a far-right group Groypers, as they call themselves, fuse online political extremism with stunts at conservative events.",1.0,0.2759412661585243,0.6379706330792622,0.5172941774390162
N42977,news,newsus,"'It's not over': Sarah Palin says she is fighting to repair her marriage Former Alaska Gov. Sarah Palin said she learned her husband, Todd, wanted a divorce in an email from his lawyer and that the two are seeking counseling.",1.0,0.2609501282832036,0.6304750641416018,0.5073000855221357
N29196,health,health-news,"Florida boy's mock CPR drill goes viral: 'How cute is this!' The saying ""the apple doesn't fall far from the tree"" rings very true for a 3-year-old Florida boy who apparently wants to be just like his father, a first responder.",1.0,0.2766329878073592,0.6383164939036796,0.5177553252049061
N56193,sports,football_nfl,Cowboys have questionable red zone calls in loss to Vikings ,1.0,0.2789148551291286,0.6394574275645644,0.5192765700860857
N58241,finance,markets,"The Dow was perfectly unchanged on Tuesday, a rare occasion on Wall Street The 30-stock average closed flat going out at least six decimal places. It was the first unchanged close for the Dow since April 24, 2014.",1.0,0.2555565679994928,0.6277782839997463,0.5037043786663284
N26706,news,newsus,Missing California hiker found dead at top of glacier just weeks before baby was due A missing hiker from Huntington Beach California was found dead on Thursday at the top of the Darwin glacier in the Inyo National Forest.,1.0,0.2927785069630945,0.6463892534815472,0.5285190046420629
N49030,movies,movies-celebrity,"Kevin Hart Steps Out for Date Night With Wife Amid Recovery From Car Accident Kevin Hart is in better spirits following the violent car crash that left him hospitalized in September. Last night, he was spotted out with his wife for date night in Los Angeles.",1.0,0.288063967746972,0.644031983873486,0.5253759784979813
N35131,finance,markets,"The world's largest trade deal could be signed in 2020 RCEP involves all 10 ASEAN countries and five of the bloc's major trading partners: Australia, China, Japan, New Zealand and South Korea.",1.0,0.2588970209269965,0.6294485104634983,0.5059313472846643
N12995,news,newsus,"Cows swept out to sea by Hurricane Dorian are found months later   on the Outer Banks CHARLOTTE, N.C. - Cape Lookout National Seashore on the Outer Banks has discovered three cows are roaming the national park, and it is believed they got there by swimming four to five miles across the Core Sound during Hurricane Dorian. All three were living on Cedar Island when the hurricane generated a ""mini tsunami"" on Sept. 6, sweeping much of the wildlife off the island, including 28 wild ...",1.0,0.3007346272371772,0.6503673136185886,0.5338230848247848
N47099,foodanddrink,tipsandtricks,"This Korean Ingredient Makes Your Chili Taste Amazing As in, more amazing than it already is.",1.0,0.3215449419346093,0.6607724709673046,0.5476966279564062
N25406,autos,autossuvs,We Test the 2020 Jeep Wrangler EcoDiesel Jeep's diesel engine turns a great off-roader into something special.,1.0,0.2834065130123228,0.6417032565061613,0.5222710086748819
N5171,news,elections-2020-us,Still a chance? 2020 longshots insist race is up for grabs Bernie Sanders rallied hundreds of supporters outside the New Hampshire capital when the senator formally filed to compete in the state's first-in-the-nation presidential primary.,1.0,0.1934368504231929,0.5967184252115965,0.46229123361546187
N56051,lifestyle,lifestyleroyals,"Meghan Markle and Prince Harry Reunite with Kate Middleton and Prince William for Remembrance Service Meghan Markle, Harry Reunite Kate and William at Remembrance Day",1.0,0.2958426152920148,0.6479213076460074,0.5305617435280099
N31679,entertainment,celebrity,Biggest celeb weddings of the last decade Take a look back at the most memorable and extravagant celeb weddings that went down in the 2010s.,1.0,0.2643054916006425,0.6321527458003212,0.5095369944004283
N61320,lifestyle,lifestyleroyals,Kate Middleton Wore a Simple Black Dress and Embellished Headband to the Festival of Remembrance The Duchess of Cambridge and the rest of the royal family are honoring those who have died in battle this weekend.,1.0,0.2878654834815507,0.6439327417407754,0.5252436556543671
N36436,news,newsphotos,"The 12 Texas cities everyone in the country is moving to Texas' largest cities were at the top of the list, as well as Midland, a major hub of the fracking boom.",1.0,0.2688946456260721,0.6344473228130361,0.5125964304173813
N51587,travel,traveltripideas,"The 24 Most Beautiful Castles in Europe Eat your heart out, Disney.",1.0,0.301281449863725,0.6506407249318625,0.5341876332424833
N64560,sports,basketball_nba,"Report: Knicks' brass will stay on if team shows 'progress' this season The New York Knicks' front office appears to be safe for now. Owner James Dolan met with president of basketball operations Steve Mills and others in management on Monday. The Knicks' brass left with the impression that their jobs would be secure as long as the team ""showed progress"" this season, league sources told SNY's Ian Begley. However, it's unclear what Dolan deems as ""progress,"" reports Begley. Mills and general manager Scott Perry are...",1.0,0.2907110811376764,0.6453555405688383,0.5271407207584509
N33677,tv,tv-celebrity,Marie Osmond 'chipped off a piece' of her kneecap when she fell on stage during performance Marie Osmond reveals that she chipped her knee when she fell during her Las Vegas residency performance last week.,1.0,0.3194075346167271,0.6597037673083636,0.5462716897444847
N57327,lifestyle,lifestylebuzz,Please Don't Yell at Your Dog! A new study shows it can cause long-term psychological impacts.,1.0,0.2909344929595568,0.6454672464797784,0.5272896619730378
N49712,news,newsgoodnews,"Wisconsin bus driver saves children wandering in snow, as deadly Arctic air mass grips US As bitter cold took hold across the Midwest earlier this week, a sharp-eyed bus driver in Wisconsin was credited with helping rescue two children who were very underdressed for the weather conditions.",1.0,0.2860868772208172,0.6430434386104086,0.5240579181472115
N19376,sports,basketball_nba,The HoopsHype Daily: Trae Young putting up monstrous numbers ,1.0,0.2838605878169922,0.6419302939084961,0.522573725211328
N58020,foodanddrink,beverages,Brooklyn Brewery Shows Craft Beer Can Be Nonalcoholic Too Special Effects hits all the notes of a craft brew with none of the alcohol,1.0,0.2941959140044538,0.6470979570022268,0.5294639426696358
N36532,weather,weathertopstories,Winds fan ferocious fires in Australia's most populous state Ferocious wildfires were burning at emergency-level intensity across Australia's most populous state and into Sydney's suburbs on Tuesday as authorities warned most people in their paths that there was no longer time to flee.,1.0,0.2863423921024726,0.6431711960512363,0.5242282614016484
N4913,finance,finance-companies,Don't be fooled: Costco says $75 coupon is a scam Wholesale retailer Costco is warning customers about a new scam that is promising shoppers a $75 coupon.,1.0,0.2426314973861103,0.6213157486930552,0.4950876649240735
N58553,lifestyle,lifestyleroyals,"Prince Harry and Meghan Markle Will Reportedly Visit Oprah While in California During their six-week break from their royal duties, Prince Harry and Meghan Markle are planning to visit Oprah Winfrey, according to a royal insider.",1.0,0.2737593821147701,0.6368796910573851,0.5158395880765134
N9652,finance,finance-real-estate,"NYC is selling 'air rights' to city housing buildings, first big deal goes to de Blasio donors It may not be a bridge, but the city has something to sell you in Brooklyn   and donors to Mayor de Blasio are first in line to benefit. In what appears to be a textbook ""pay-to-play"" move, the city is selling NYCHA development rights to builders who gave de Blasio's campaigns more than $20,000.",1.0,0.2586664760174898,0.6293332380087449,0.5057776506783265
N38309,tv,tv-celebrity,Joe Giudice Says It Was 'Painful' Watching Real Housewives of New Jersey from Prison Joe Giudice Says It Was 'Painful' Watching RHONJ from Prison,1.0,0.2887812834069233,0.6443906417034616,0.5258541889379489
N15855,lifestyle,lifestyleroyals,"A body-language expert says Meghan Markle is ""politely disconnecting"" from the public, and honestly, we would too Can we blame her? Meghan Markle is supposedly ""politely disconnecting"" from the public as seen in her body language, and girl, you do you.",1.0,0.2930344812560086,0.6465172406280043,0.5286896541706724
N7821,sports,football_nfl,"'Monday Night Football' commentator under fire after belittling criticism of 49ers kicker for missed field goal Joe Tessitore called out 49ers kicker Chase McLaughlin after he shanked a potential game-winning kick in San Francisco, and some fans weren't happy.",1.0,0.2760803549115043,0.6380401774557521,0.5173869032743361
N46477,movies,movienews,Mark Ruffalo Wants to Set Up Jennifer Aniston on a Date Mark Ruffalo Wants to Set Up Jennifer Aniston on a Date,1.0,0.2849473092821293,0.6424736546410647,0.5232982061880862
N48064,news,newsworld,"Why Ukraine and Russia are still at war A long and draining war in eastern Ukraine has become embroiled in President Trump's attempts to undermine his opponents at home. But the war is real and still taking lives, and a way to end it will be very difficult to find.",1.0,0.2514310809278876,0.6257155404639438,0.500954053951925
N41578,lifestyle,lifestyleroyals,Meghan Markle Chose a Chic Black Ensemble for Remembrance Sunday Services She paired her outfit with a bold hat and a crimson poppy pin.,1.0,0.2880981782165429,0.6440490891082714,0.5253987854776953
N47401,foodanddrink,tipsandtricks,"Your turkey timeline: what to do and when for the perfect holiday roast Most people only cook a turkey once or twice a year which inevitably turns the whole thing into a stressful experience, full of paranoia that the bird will turn out dry. But fear not! Our fail-safe turkey timeline will take you all the way from ordering through to what to do with the leftovers.",1.0,0.3051259869250017,0.6525629934625008,0.5367506579500011
N23184,entertainment,celebrity,Long-term celebrity couples who won't get married These committed celeb couples have opted not to tie the knot.,1.0,0.2911481691378746,0.6455740845689373,0.527432112758583
N43670,sports,basketball_nba,"Draymond criticizes official for ejection: 'Don't tell me not to talk' Golden State Warriors forward Draymond Green made Chase Center history during Monday's loss to the Utah Jazz, becoming the first player ejected from a game in the new venue after arguing with an official. The three-time All-Star was given a second technical foul for continuing to plead his case after disagreeing with a blocking call, but it seems Green's spat with the official went beyond just that foul. ""I disagreed with that call,"" Green told...",1.0,0.2996401626534789,0.6498200813267394,0.5330934417689859
N26944,news,newsus,"Jeffrey Epstein's Estate May Set Up a Program to Pay Accusers Lawyers for Jeffrey Epstein's estate are considering setting up a program to resolve claims filed by women who say they were abused by the financier, who killed himself in August while facing federal sex trafficking charges. The plan was disclosed in a court filing on Tuesday by a lawyer for one of Mr. Epstein's accusers, who is suing the estate in federal court in Manhattan. The filing said lawyers for Mr. Epstein's estate had informed...",1.0,0.3117975232159292,0.6558987616079646,0.5411983488106195
N47205,news,newspolitics,"Whistleblower never met or talked with Schiff - source The whistleblower who prompted an impeachment inquiry into U.S. President Donald Trump never met or spoke with congressman Adam Schiff, the Democrat leading impeachment hearings in Congress, a source familiar with the whistleblower's contacts said.",1.0,0.2728648510951964,0.6364324255475982,0.5152432340634643
N35850,news,newsus,U.S. Judge Blocks 'Suspicionless' Searches of Phones at Borders A federal judge rejected a Trump administration policy allowing agents at U.S. border crossings and airports to arbitrarily search the phones and laptops of international travelers.,1.0,0.2716421027522112,0.6358210513761056,0.5144280685014742
N39389,lifestyle,lifestylebuzz,"Dog Rips The Tail Off Every Single One Of His Toy Pigs Tim Eberts When Diesel's parents first brought him home a cute little stuffed pig toy, they had no idea just how much the husky was going to love it.",1.0,0.2773730877262842,0.6386865438631422,0.5182487251508561
N44818,sports,football_nfl,Redskins name rookie Dwayne Haskins starter for rest of season ,1.0,0.2746713265266879,0.637335663263344,0.5164475510177919
N51896,health,fitness,"Watch the 'Footloose' Dance Warmup That Gets These High Schoolers Ready to Race They tear up the course before, well, tearing up the course.",1.0,0.2777029090907006,0.6388514545453503,0.5184686060604671
N36252,finance,markets,Oil rises after OPEC's Barkindo says U.S. shale growth may slow in 2020 Oil rises after OPEC's Barkindo says U.S. shale growth may slow in 2020,1.0,0.2589756999527065,0.6294878499763532,0.505983799968471
N52600,finance,finance-companies,"Saudi Aramco takes another step toward 1st public offering DUBAI, United Arab Emirates (AP)   Saudi Arabia's state-owned oil giant Aramco revealed it will sell up to 0.5% of its shares to individual investors, but in a lengthy document published late Saturday it did not disclose how much of the company will be floated when it goes public on the country's domestic exchange.",1.0,0.2868340964706276,0.6434170482353138,0.5245560643137517
N54161,news,newsus,"Berliners tried to send Trump a piece of the Berlin Wall with a message saying 'no wall lasts forever' The 2.7-ton chunk of concrete arrived in Washington, DC, on Saturday, and local media outlets reported that the Secret Service turned it away.",1.0,0.2600397952397274,0.6300198976198637,0.506693196826485
N60408,weather,weathertopstories,"Over 20 inches of snow for some Michigan communities in 24 hours! Significant amounts of snow fell within a meandering lake-effect snow band overnight into Tuesday morning across parts of the southwestern Lower Peninsula of Michigan, resulting in up to and over 2 feet in some locations... and that's where AccuWeather's Blake Naftel took in some of the snowy spectacles as people begun to dig out.",1.0,0.2764776686682999,0.63823883433415,0.5176517791122
N25138,sports,football_ncaa,"College Football Playoff picture: 4 in, 2 out, 5 to watch Sporting News takes a look at the College Football Playoff picture heading into Week 12 of the season.",1.0,0.2550518414745324,0.6275259207372662,0.5033678943163549
N56061,sports,football_nfl,9 things we learned from Sunday's games of Week 10 of NFL season ,1.0,0.2500128807908771,0.6250064403954385,0.500008587193918
N15506,news,newsworld,"Trump 'so extreme' on climate he's waking people up, Greta Thunberg tells AFP Swedish teen activist Greta Thunberg said Tuesday that US President Donald Trump's climate change denialism was ""so extreme"" that it had helped galvanize the movement to halt long term planetary warming. The venue was originally in Chile but was shifted because of political unrest, forcing Greta to change her travel plans.",1.0,0.2582587149143236,0.6291293574571618,0.5055058099428824
N54482,lifestyle,lifestylebuzz,"Mixed-race mother reveals strangers question whether she's related to her fair-skinned daughter - including a suspicious church-goer who asked the girl: 'Is this your Mummy?' Davina Moon, 32, from Surrey, who has a mixed heritage including Sri Lanka and Ireland, told how society often treats her differently because she doesn't look like her children.",1.0,0.2925929720388659,0.6462964860194329,0.5283953146925773
N30071,news,newspolitics,"Trump juggles statecraft and impeachment on a historic day Projecting unusual calm in the middle of a political firestorm, President Donald Trump pleaded ignorance Wednesday about the first public impeachment hearing, unexpectedly insisting that he really wasn't paying attention to sworn testimony in the House Intelligence Committee that could determine whether he serves out his term in office. The disclaimer might be more credible if ...",1.0,0.2440489072153673,0.6220244536076837,0.4960326048102448
N61145,foodanddrink,tipsandtricks,Stop! Read This Guide Before You Buy an Air Fryer. Shopping for air fryers? Or maybe air fryer toaster ovens? Our air fryer buying guide will help you find the perfect appliance for your needs.,1.0,0.2838045909530226,0.6419022954765112,0.5225363939686817
N37204,health,health-news,"Model, 23, Didn't Know She Was Pregnant Until She Gave Birth to a Full-Term Baby in Her Bathroom An Australian model recently had a life-changing surprise when she gave birth to a baby in her bathroom, despite not knowing that she had been carrying her daughter for nine months.",1.0,0.290088749104927,0.6450443745524634,0.526725832736618
N46751,news,newscrime,"Mom named person of interest in 5-year-old girl's disappearance The search for Taylor Rose Williams, 5, began in Jacksonville on Wednesday.",1.0,0.2907550999140225,0.6453775499570112,0.5271700666093483
N496,music,cma-awards,"Fashion hits and misses from the 2019 Country Music Association Awards From Nicole Kidman to Pink, see the best and worst dressed stars at the 2019 Country Music Association Awards.",1.0,0.2718126269513033,0.6359063134756516,0.5145417513008689
N64685,music,music-celebrity,"Jennifer Lopez shares her #MeToo experience at costume fitting: 'I stood up for myself' Jennifer Lopez recalled an uncomfortable situation earlier in her career when a ""director at a fitting asked me to take my top off.""",1.0,0.2938541851124286,0.6469270925562143,0.5292361234082857
N7041,health,health-news,Dad bans lollipops after 5-year-old son nearly choked to death The boy was sitting near his mother when he began making choking noises.,1.0,0.2925004290115274,0.6462502145057637,0.5283336193410182
N53585,tv,tvnews,"Rip Taylor's Cause of Death Revealed, Memorial Service Scheduled for Later This Month The comedian died at the age of 84 last month.",1.0,0.2978627875061375,0.6489313937530687,0.5319085250040916
N24898,autos,autosbuying,"The lightest sports cars you can buy for under $30,000 Power-to-weight ratios matter, and what these sports cars lack in horsepower they more than make up for in their abilities to attack the roads with venom.",1.0,0.3047958726628833,0.6523979363314416,0.5365305817752555
N47851,travel,traveltripideas,The Top Winter Wonderlands You Should Visit This Holiday Find the best alpine views at these wintry destinations.,1.0,0.2714478668199601,0.63572393340998,0.5142985778799734
N58499,news,newspolitics,"Pompeo's Impeachment Role Draws Outcry From Diplomats, Staffers Secretary of State Mike Pompeo has been credited with improving State Department staffing and morale, but his treatment of U.S. Foreign Service officers caught in the impeachment inquiry has undercut those efforts, according to current and former career professionals upset over his recent actions.",1.0,0.2737399099838551,0.6368699549919276,0.5158266066559034
N39399,music,cma-awards,Gwen Stefani and Blake Shelton Are Couples Goals at the 2019 CMA Awards The cute couple had their second awards show date night of the week in Nashville on Wednesday.,1.0,0.2776646274922274,0.6388323137461137,0.5184430849948183
N57097,news,newsus,Last known Pearl Harbor survivor in Mass. dies at 98 Massachusetts' last known survivor of the Japanese attack on Pearl Harbor that drew the United States into World War II died Tuesday at 98.,1.0,0.2989097035659676,0.6494548517829838,0.5326064690439783
N241,finance,finance-companies,"Are Stores Open on Veterans Day? Target, Aldi, Walmart and More Will shoppers be able to make the most of Veterans Day deals this public holiday?",1.0,0.2103952116389722,0.6051976058194861,0.4735968077593148
N39844,sports,basketball_ncaa,"James Wiseman eligibility: Explaining the NCAA questions on Penny Hardaway, Memphis star Everything you need to know about James Wiseman's eligibility case at Memphis and what it means for him, the Tigers' basketball team and the NCAA going forward.",1.0,0.3081773032896043,0.6540886516448021,0.5387848688597362
N21519,tv,tv-celebrity,RHOP's Monique Samuels Charged With Assault After Incident With Candiace Dillard RHOP's Monique Samuels Charged With Assault After Incident With Candiace Dillard,1.0,0.2891380097790803,0.6445690048895402,0.5260920065193868
N60932,tv,tv-celebrity,Lamar Odom's Son Was ''Hurt'' After Finding Out About His Dad's Engagement on Instagram Lamar Odom's son admits that he was ''hurt and caught off guard'' after finding out about his dad's engagement to Sabrina Parr on Instagram.,1.0,0.3032866147589457,0.6516433073794728,0.535524409839297
N36703,lifestyle,lifestylecelebstyle,Photos of Celebrities at the Airport Are Here to Inspire Your Holiday Travel Style Even the rich and famous aren't spared the most annoying place in the world: the airport.,1.0,0.2755478693536307,0.6377739346768153,0.5170319129024205
N25722,news,newspolitics,"Rex Tillerson denies he tried to undermine Trump, says Nikki Haley was 'rarely present' at meetings The former secretary of state refuted Haley's claims contained in a new book and says he remains proud of his tumultuous time in the Trump administration.",1.0,0.2972589899894463,0.6486294949947231,0.5315059933262976
N29839,lifestyle,lifestylehomeandgarden,"Simple Solutions to Help You Get Rid of Ants for Good Kick pesky ants out of your house and back to their colony with these easy, expert-approved tricks.",1.0,0.3183103213112749,0.6591551606556374,0.5455402142075165
N17896,autos,autossuvs,"Should Chevy Bring This Three-Row Blazer to the U.S.? It's set to go on sale in China soon, but we could see this bigger Blazer doing well in America, too.",1.0,0.2640397143569246,0.6320198571784623,0.509359809571283
N13907,finance,finance-saving-investing,4 reasons you shouldn't max out your 401(k) Making high-dollar contributions to your 401(k) can cost you.,1.0,0.2911492038980837,0.6455746019490418,0.5274328025987225
N57591,lifestyle,lifestyleroyals,Prince Charles Is Getting Into the Fashion Business The Prince's Foundation is partnering with the Yoox Net-a-Porter Group on a sustainable 17-piece collection.,1.0,0.2858706772843578,0.6429353386421789,0.5239137848562385
N64258,news,newspolitics,"Trump impeachment hearing spurs shadow spin war The online spin began even before Wednesday's impeachment hearing got underway. Moments before House Intelligence Committee Chairman Adam Schiff could welcome witnesses to the first public hearing of the impeachment inquiry, President Donald Trump took to Twitter to dismiss the ""New Hoax. Same Swamp."" Former Obama administration aides-turned-podcasters dissected the hearings in real time. They broadcast their running...",1.0,0.2295115664153587,0.6147557832076793,0.4863410442769058
N40065,sports,more_sports,"The Day in Sports: Sunday, November 10, 2019 The Day in Sports: Sunday, November 10, 2019",1.0,0.2638122269812725,0.6319061134906363,0.5092081513208483
N36807,weather,weathertopstories,"Timelapse Shows Snow Dusting Central New Hampshire A ""wintery mix"" of snow, ice, and rain moved across much of New Hampshire on Tuesday, November 12, local meteorologists said. Rain and freezing rain early Tuesday gave way to a period of light snow as colder air rushed in, WMUR said. This timelapse   filmed from 1 pm on Monday to 12 pm on Tuesday   shows snow falling and repeatedly dusting a parking lot in Plymouth, New Hampshire. Gunnar Consol, who filmed the video, said about an inch or two accumulated in Plymouth by Tuesday. Credit: @GunnarConsolWx via Storyful",1.0,0.2960742009804686,0.6480371004902343,0.530716133986979
N58133,news,newspolitics,"George Kent, top State Department Ukraine expert, helps Democrats debunk GOP theories Kent testified that there is no evidence Ukraine interfered in the 2016 election and said Joe Biden's pressure on Ukrainian officials was not the same as President Trump's.",1.0,0.2324511955346568,0.6162255977673284,0.48830079702310447
N60619,news,newspolitics,"Republicans shrug off impeachment hearings as 'boring' Heading into Wednesday's first public impeachment hearing, Republicans had argued the facts weren't there to impeach President Donald Trump. And they complained the proceedings were taking place behind closed doors.",1.0,0.2483862530585912,0.6241931265292956,0.4989241687057274
N13341,news,newsus,"Rising temperatures put U.S. troops at risk during training, report finds By midcentury, troops could face an extra month of heat-index temperatures above 100 F every year, the Union of Concerned Scientists found.",1.0,0.2888429201974292,0.6444214600987146,0.5258952801316195
