ID,category,sub_category,content,collaborative_rec,content_rec,mean,two_one
N24591,lifestyle,lifestylebuzz,"A heartbreaking photo of a dog riding a bus alone went viral, and now people want to adopt her A kennel is seeking the dog's owner. If no one comes forward, she will be put up for adoption.",0.1261151123757809,0.2393674417075839,0.18274127704168242,0.20161666526364955
N63554,travel,traveltripideas,"It took me 96 hours to ride an Amtrak train from coast to coast. I'd do it again in a heartbeat. Four days aboard a cross-country Amtrak train was so much more relaxing than flying. If I had the time, I'd do it on every trip.",0.1265712767138674,0.2862992336362336,0.2064352551750505,0.2330565813287782
N31099,travel,traveltripideas,Harry Potter's Childhood Home in England Is Now on Airbnb I think I can die happy now.,0.1266578617791629,0.2628698073978265,0.19476383458849472,0.21746582552493862
N30974,sports,basketball_ncaa,"Police identify 2 suspects in murder of Andre Emmett last month Two men accused of killing former Texas Tech and NBA player Andre Emmett were identified by Dallas police on Monday, the Dallas Morning News reported.",0.1266578617791629,0.2076397469697293,0.16714880437444612,0.1806457852395405
N36593,foodanddrink,foodnews,"How the Boston cream pie became a beloved dessert A product of the longest continually operating hotel in the United States, the Boston cream pie combines sponge cake, vanilla custard and chocolate icing to form a beloved American dessert.",0.1266578617791629,0.2762450041844647,0.20145143298181378,0.2263826233826974
N58744,lifestyle,voices,"I Gave Up On Love, And It Was One Of The Best Decisions I Ever Made At the end of our date in August 2018, Justin escorted me to my car, where henervously kissed me. When I kissed him back, he cheered, pumping his fists inthe air like he'd won something. I walked from the curb to my car, and when Iturned around, he was watching me, beaming.""I just want to make sure you get to your car safely,"" he said, even though Iwas less than a yard away.I slipped into the driver's seat, thrilled that our second date had gone...",0.1266578617791629,0.2499320782699383,0.1882949700245506,0.20884067277301316
N31802,entertainment,celebrity,Stars turning 50 in 2019 Find out which celebrities are celebrating the big 5-0 in 2019!,0.1266578617791629,0.2389760109272631,0.182816936353213,0.20153662787789636
N50479,health,wellness,"Items you need to stop sharing with others right now Items you should never share for your health and safety include everyday items like toothbrushes, earbuds and lipstick.",0.1266578617791629,0.2610099499343065,0.1938339058567347,0.21622592054925863
N6285,finance,personalfinance,4 habits that could wreck your finances beyond repair Avoid these at all costs.,0.1266578617791629,0.2581795549971074,0.19241870838813513,0.21433899059112588
N8237,foodanddrink,restaurantsandnews,16 Secrets Olive Garden Doesn't Want You to Know Here's everything you've wanted to know about your favorite breadstick-serving restaurant.,0.1266578617791629,0.2695492032215584,0.19810353250036067,0.22191875607409323
N61972,entertainment,entertainment-celebrity,"New details on why Meg Ryan, John Mellencamp split, plus more news Meg Ryan and John Mellencamp's marriage plans may have prompted their split. Plus, more celebrity news for Nov. 4, 2019.",0.1266578617791629,0.2191272372447368,0.17289254951194985,0.18830411208954548
N56853,news,newsworld,"Trump orders withdrawal of U.S. forces from northern Syria, days after Pentagon downplays possibility U.S.-allied Syrian Kurdish fighters announced late Sunday that the Syrian Army would deploy along the Turkish border to ""liberate the areas that the Turkish army has entered with its mercenaries.""",0.1266578617791629,0.2554031081319687,0.1910304849555658,0.21248802601436675
N30103,travel,traveltripideas,"A network of 28 tiny, one-bed hotels in Amsterdam is being called the most beautifully designed hotel of 2019   and it consists of a series of converted bridge houses. Take a look inside. Amsterdam's bridge hotels, located in historic houses on and near bridges, are a tiny house lover's dream ⁠  and they just won a major design award.",0.1266578617791629,0.2687720353811251,0.197714948580144,0.22140064418047103
N29561,lifestyle,lifestylebuzz,"High school cheerleaders go off-script to help man propose to their coach A school's cheer squad coach was surprised when her students went off-script and held up four signs during a routine that read, ""Will you marry me?""",0.1266578617791629,0.233831457509003,0.18024465964408296,0.1981069255990563
N59469,lifestyle,lifestyleroyals,"Every outfit Duchess Kate has worn in 2019 See Kate Middleton's style choices this year from glam gowns and coat dresses to re-wears, tiaras and hats.",0.1266578617791629,0.2568199235305095,0.19173889265483618,0.21343256961339394
N11163,news,newspolitics,"Kobach's campaign paid Kansan known to post racist comments on white nationalist site Kansas Republican Kris Kobach's Senate campaign paid an Olathe man who regularly posted hateful comments about Jews and racial minorities on a white nationalist website. Kobach's campaign paid Joe Suber $500 for field coordinating services in September, according to the Republican's latest campaign finance report. Suber also filed the paperwork with the state of Kansas creating ...",0.1266578617791629,0.2352522748622729,0.1809550683207179,0.1990541371679029
N2018,entertainment,celebrity,"Debunking the week's tabloid stories: Nov. 1, 2019 A round-up of the week's tabloid stories that totally missed the mark.",0.1266578617791629,0.2026400959037754,0.16464897884146917,0.17731268452890456
N30827,foodanddrink,restaurantsandnews,"These are the 11 classic food-court chains with the most locations From Panda Express to Auntie Anne's to Baskin-Robbins, these are the 13 classic food-court chains with the most US locations.",0.1266578617791629,0.2715777976600197,0.1991178297195913,0.22327115236640077
N54449,news,newsus,"Third Indiana Catholic school employee fired in growing scandal over LGBTQ staff Unlike the others fired from Indianapolis-area Catholic schools, Kelley Fisher is straight and only expressed support for her fired colleagues.",0.1266578617791629,0.2355823936156437,0.18112012769740332,0.19927421633681677
N13225,travel,traveltripideas,5 Reasons Destin Is a Great Family Vacation Destination The calm emerald waters and family-friendly attractions of the area make Destin a top spot for a fall or winter getaway.,0.1266578617791629,0.2803989759454069,0.2035284188622849,0.22915193788999225
N40526,music,music-celebrity,Miranda Lambert Shares the Surprising Story of Her and Brendan McLoughlin's Meet-Cute The Pistol Annie's are to thank for introducing the country singer to her husband,0.1266578617791629,0.2303975926434556,0.17852772721130927,0.19581768235535804
N47922,music,music-celebrity,"Allegations against entertainer Todrick Hall are piling up, from stories of nonpayment to accusations of backlash for reporting sexual assault Todrick Hall became prominent in Broadway musicals, for his friendship with Taylor Swift, and more. Now, accusations against him are piling up.",0.1266578617791629,0.1971890449733808,0.16192345337627184,0.17367865057530815
N19874,health,wellness,"How Your Hormones, Weight, or Medication Could Be Killing Your Sex Drive Your libido can suffer for some unexpected reasons. And remember, there is no ""normal"" when it comes to sexual desire.",0.1266578617791629,0.2797959033869539,0.20322688258305843,0.22874988951769024
N22627,news,newsus,Family Members Plead for Help in Search for Missing Atlanta College Student: 'Just Come Home' Family Pleads for Help in Search for Missing College Student,0.1266578617791629,0.2411276143557698,0.18389273806746637,0.2029710301635675
N12785,sports,baseball_mlb,"With Carlos Beltran hire it's clear the Mets learned nothing from the Mickey Callaway mess In hiring Carlos Beltran to guide their fortunes next year, the Mets hierarchy once again out-thought themselves by going ""outside-the-box"" for someone who had never managed anywhere before.",0.1266578617791629,0.2405485979979458,0.18360322988855438,0.2025850192583515
N58091,finance,finance-companies,Ex-Credit Suisse Banker Says Secret Affair Helped Fuel $45 Million Fraud A former Credit Suisse Group AG banker told a federal jury in New York that his decision to take millions of dollars in bribes was fueled in part by his secret love affair with a subordinate.,0.1266578617791629,0.2436335014147553,0.1851456815969591,0.20464162153622448
N21389,news,newsworldpolitics,Rep. Katie Hill's lawyers send cease-and-desist letter to DailyMail.com over nude photos The website is the second to publish alleged lewd photos of the Democratic congresswoman.,0.1266578617791629,0.2185599484172347,0.17260890509819882,0.18792591953787743
N63248,lifestyle,lifestylecelebstyle,"Hailey Baldwin wore three show-stopping dresses during her wedding, and put a unique twist on each one Hailey Baldwin's three custom gowns were designed by Virgil Abloh of Off-White, Vera Wang, and Ralph & Russo.",0.1266578617791629,0.2537014050373624,0.19017963340826266,0.2113535572846292
N16344,entertainment,celebrity,Stars   They're Just Like Us! Stars   They're Just Like Us!,0.1266578617791629,0.2324252504330338,0.17954155610609834,0.19716945421507684
N56290,foodanddrink,tipsandtricks,The Secret Ingredient for Sausage Gravy That's Out of This World Transform your gravy with this $1 ingredient,0.1266578617791629,0.2755568355685149,0.2011073486738389,0.22592384430539755
N22614,sports,football_ncaa,Predicting which of college football's 10 undefeated teams will lose in Week 9 How many teams will still have a perfect record after Week 9?,0.1266578617791629,0.2592339387767824,0.19294590027797265,0.21504191311090923
N53118,health,health-news,Colorado Mom's Touching Facebook Post Beautifully Explains Why We Shouldn't Suffer in Silence One Colorado mom's Facebook post recently went viral for showing how much asking a friend for help can make the difference when you're feeling alone.,0.1266578617791629,0.2269741137460232,0.17681598776259305,0.1935353630904031
N51503,sports,football_ncaa,"Bill Plaschke: Mike Bohn brings USC integrity, which means he can't hire Urban Meyer LOS ANGELES_You ever heard of Mike Bohn? Me neither, and that's a good thing. The University of Southern California is apparently set on naming Bohn as its new athletic director, the smart hiring of a man who embodies the most important attribute for the new leader of the Trojans family. He's a complete stranger. He never played football at USC. He never coached football at USC. He never ...",0.1266578617791629,0.2473618191459357,0.18700984046254931,0.20712716669034476
N12709,lifestyle,lifestylebuzz,"Twitter Had Feelings About Mark Zuckerberg's Micro-Bangs Facebook founder Mark Zuckerberg debuted a new haircut on the House floor on Wednesday, and Twitter quickly took note with an avalanche of memes and quips.",0.1266578617791629,0.2279231754097571,0.17729051859446,0.1941680708662257
N56438,news,newsus,The 'race whisperer' A black activist convinced a neo-Nazi he'd save him from legal ruin. Then the real plan got underway.,0.1266578617791629,0.2386374426256173,0.1826476522023901,0.20131091567679918
N42791,tv,tvnews,"Eva Longoria: 'Latinas Are the Last to Find Their Voices Amplified' Eva Longoria delivered a powerful and moving keynote at TheWrap's Power Women Summit in Los Angeles on Friday, saying that people in Hollywood are ""largely responsible for much of the unconscious bias that is against people of color"" and that ""Latinas are the last to find their voices amplified in this industry."" ""What studies show is that we are being erased,"" Longoria told a room of 2,000 attendees. ""This goes beyond underrepresentation. When...",0.1266578617791629,0.2314951060408918,0.17907648391002734,0.19654935795364883
N2078,tv,tv-celebrity,"Rainbow Baby! Shawn Johnson, Andrew East Welcome 1st Child After Miscarriage Rainbow Baby! Shawn Johnson, Andrew East Welcome 1st Child After Miscarriage",0.1266578617791629,0.2328521105160486,0.17975498614760577,0.19745402760375336
N6576,health,weightloss,16 Women Reveal Exactly How They Got Six-Pack Abs What does it really take to get six-pack abs? These women can tell you exactly what worked for them.,0.1266578617791629,0.2771233290704885,0.20189059542482568,0.2269681733067133
N43374,news,newspolitics,Trump goes on Twitter tear after White House official condemns his Ukraine call President Donald Trump launched a sustained online offensive after details emerged of damaging congressional testimony by a senior White House official.,0.1266578617791629,0.2397897976794593,0.18322382972931112,0.2020791523793605
N51457,foodanddrink,restaurantsandnews,Restaurants Are Dealing With an Avalanche of Special Requests. One Chef Has Had Enough. It's not all about you.,0.1266578617791629,0.2336533487749954,0.18015560527707916,0.19798818644305125
N56444,health,wellness,"Jameela Jamil Called Out a New TV Show Where Judges Decide If Contestants ""Deserve"" Plastic Surgery The Good Place star had a lot to say after learning about ""The Surjury,"" a new British reality series about people competing against one another to win free plastic surgery.",0.1266578617791629,0.2341932364672094,0.18042554912318615,0.1983481115711939
N64554,entertainment,entertainment-celebrity,"Meghan King Edmonds, Jim Edmonds' Nanny Denies Cheating Allegations Meghan King Edmonds, Jim Edmonds' Nanny Denies Cheating Allegations",0.1266578617791629,0.209144878451324,0.16790137011524348,0.1816492062272703
N50258,news,newspolitics,Trump feuds with Susan Rice over Syria President Trump exchanged barbs with the former Obama administration national security adviser Susan Rice over Syria after she criticized his policy.,0.1266578617791629,0.2379545737723023,0.1823062177757326,0.20085566977458916
N2183,tv,humor,"The top female comedians working in film and television today Film and television, specifically in the comedic vein, is currently blessed with a bevy of talented women. The transition from writing standup material to award-winning, mainstream masterpieces has never been so visible, and the impressive canon of female voices peppering the entertainment world is staggering.",0.1266578617791629,0.249901391923932,0.18827962685154745,0.20882021520900895
N59774,foodanddrink,restaurantsandnews,"The Unreasonable Lengths Restaurant Workers Have to Go to Take Time Off From working doubles in advance to finding their own replacements, here's how unsalaried shift workers manage when it comes to vacation.",0.1266578617791629,0.2522601308187251,0.18945899629894403,0.2103927078055377
N23554,sports,football_nfl,Joe Flacco criticizes Broncos coaches as 'afraid to lose' after Colts' comeback Joe Flacco made it clear he thought the Broncos weren't aggressive enough when playing with a lead late in Sunday's loss to the Colts.,0.1273301417413742,0.2337890741473032,0.1805596079443387,0.19830276334532687
N3933,sports,football_nfl,"Bears' Khalil Mack calls out Eagles C Jason Kelce's controversial tactics in offsides penalties The Chicago Bears doomed themselves early in the first half in a 22-14 loss to the Philadelphia Eagles. While the Bears offense had a historically bad first half performance   netting just 9 total yards   the defense had its share of struggles with five pre-snap penalties in the first half against the Eagles. Bears outside linebacker Khalil Mack isn't one to point fingers for the defense's struggles, but when asked about those pre-snap...",0.1273489523831237,0.2219792832692041,0.1746641178261639,0.19043583964051064
N23979,finance,markets,"China already snapping up U.S. farm goods, Trump claims President Donald Trump boasted Sunday without providing evidence that China had ""already begun"" making large purchases of U.S. agricultural products as part of last week's tariff deal with Beijing.",0.1276878948060094,0.2543144479671281,0.19100117138656875,0.21210559691342187
N46795,music,musicnews,Eminem Says He Sides With Chris Brown Over Rihanna Assault on Alleged Leaked Song Leaked audio of Eminem allegedly rapping that he'd side with Chris Brown over Rihanna assault is making rounds on social media and fans are not happy.,0.1280041309857672,0.1990890297659123,0.16354658037583975,0.17539406350586392
N33013,lifestyle,lifestylebuzz,"Couple Cancels Wedding, Keeps $30K as ""Donation"" for Honeymoon Instead In a viral Facebook post, a couple announces they're canceling their wedding, but keeping the $30,000 in gifts for a honeymoon instead.",0.1281340534255191,0.2490979792799511,0.1886160163527351,0.20877667066180708
N53880,finance,markets,"The megaprojects that changed countries forever Megaprojects are complex and expensive ventures that take years to complete. Although the massive scale of these projects makes them fraught with risk, they also have the capacity to bring great economic and social benefits during and after construction. Whether good or bad, these are the megaprojects that have shaped the future of their countries in a big way.",0.1281340534255191,0.2696485585015925,0.19889130596355578,0.222477056809568
N44442,news,newspolitics,"CNN Poll: 50% support impeaching Trump and removing him from office Half of Americans say President Donald Trump should be impeached and removed from office, according to a new CNN poll conducted by SSRS.",0.128230601569513,0.2708595330305174,0.1995450673000152,0.2233165558768493
N55051,lifestyle,voices,I Am Unapologetically Raising My Daughter Without Religion ,0.128230764228541,0.2381153319593213,0.18317304809393115,0.20148714271572787
N23887,news,newsus,"Video allegedly shows police officer roughing up 11-year-old girl There's no excuse for the way this girl was treated, the Farmington police chief said.",0.1286133010485783,0.2100895941906617,0.16935144761962,0.18293082980996722
N59359,news,newscrime,Police Arrest Motorcyclist Who Led High-Speed Chase And Went Home Thinking He Escaped A motorcyclist was arrested after leading California Highway Patrol units on a high-speed chase in Placerville on Saturday.,0.1290879415848503,0.243102651617604,0.18609529660122714,0.20509774827335275
N45535,news,newsus,DOJ sues Walmart for allegedly discriminating against a Navy reserve officer The Department of Justice says that Walmart did not hire a naval reserve officer due to her mandatory two-week training in the summer of 2016.,0.1295482079039125,0.2394695624384569,0.1845088851711847,0.2028291109269421
N57967,sports,basketball_nba,Harden-Westbrook argument goes viral A clip of the Rockets stars appearing to exchange words during Thursday's game against the Bucks quickly started making the rounds online.,0.1297675584254331,0.1954462836508351,0.16260692103813412,0.17355337524236777
N2735,sports,football_nfl,Jimmy Garoppolo addresses Erin Andrews interview by saying he uses 'baby' 500 times a game ,0.1299458146018345,0.2282060567003674,0.17907593565110094,0.19545264266752307
N22929,sports,football_nfl,"Burning questions for Cowboys vs Giants on 'Monday Night Football' Capping off the action in Week 9, the New York Giants are hosting the Dallas Cowboys for the NFC Monday Night Football. There are five burning questions for this NFC matchup.",0.129976511490454,0.2391439980792135,0.18456025478483373,0.2027548358829603
N64395,sports,football_nfl,J.J. Watt has sobering quote after season-ending injury The Houston Texans lost the rock of their team for the season during Sunday's win over the Oakland Raiders. Stud pass rusher and future Hall of Famer J.J.,0.129976511490454,0.2093902510180841,0.16968338125426904,0.18291900450887405
N53209,sports,baseball_mlb,"​Are the Astros stealing signs to gain an edge in ALCS? Hopefully. If your code is easy to crack, the problem is on you, not the codebreaker.",0.129976511490454,0.2680041836445577,0.19899034756750583,0.2219949595931898
N14437,sports,basketball_nba,"Suns' Deandre Ayton suspended 25 games for violating NBA anti-drug policy The league informed the Suns that Ayton, the top pick in the 2018 draft, tested positive for a diuretic. His suspension begins Friday.",0.129976511490454,0.2235807407369437,0.17677862611369885,0.1923793309881138
N32670,news,newspolitics,"McConnell tees up government funding votes amid stalemate Senate Majority Leader Mitch McConnell (R-Ky.) is turning the Senate toward trying to pass a set of long-stalled appropriations bills. ""Congress has fallen badly behind schedule on appropriations. It's been a month since my Democratic colleagues filibustered government funding here on the floor, blocking defense funding and a pay raise for service members. We need to get moving,"" McConnell said from the Senate floor. McConnell said the Senate...",0.129976511490454,0.250348155979002,0.19016233373472802,0.21022427448281933
N1406,sports,football_nfl,"NFL Films signed off on airing of Sam Darnold's 'ghosts' comment A firestorm has erupted in New York over how an unflattering comment from a mic'd up Sam Darnold made the air during ESPN's coverage of the Jets' blowout loss to the Patriots on ""Monday Night Football.""",0.129976511490454,0.2086750632503833,0.16932578737041865,0.1824422126637402
N63306,sports,football_nfl,Jenkins' scorching response to Scandrick ripping Eagles Former Philadelphia Eagles cornerback Orlando Scandrick ripped into Malcolm Jenkins and his former teammates in general.,0.129976511490454,0.2333136238116456,0.18164506765104982,0.19886791970458173
N45824,sports,football_nfl_videos,"Ian Rapoport: MRI results are good news for Patrick Mahomes, Kansas City Chiefs NFL Network Insider Ian Rapoport and James Palmer provide a Patrick Mahomes injury update.",0.129976511490454,0.2288122368244429,0.17939437415744847,0.19586699504644658
N64456,news,newsus,"LA's Getty fire was sparked by downed power lines, Mayor Garcetti says LOS ANGELES - The Getty fire was sparked by a tree branch that fell on power lines, Los Angeles Mayor Eric Garcetti announced at a news conference Tuesday evening. Video footage shows the branch breaking off a eucalyptus tree and sparking the fire in the 1900 block of North Sepulveda Boulevard, Garcetti said. The power lines being examined are operated by the Los Angeles Department of Water ...",0.129976511490454,0.2515722088167915,0.19077436015362276,0.21104030970801232
N5019,sports,football_nfl,"Winners, losers from Cowboys' win over Giants on 'Monday Night Football' In a NFC East tilt, the Cowboys overwhelmed the Giants defense late while Big Blue continues to trip over its own feet.",0.129976511490454,0.2358855979290945,0.18293105470977425,0.20058256911621433
N36068,sports,football_nfl,"AP source: Trent Williams ends holdout, reports to Redskins A person with knowledge of the situation says left tackle Trent Williams has reported to the Washington Redskins, ending his lengthy holdout. The person spoke to The Associated Press on condition of anonymity because the team had not announced Williams' return. He can be kept off the 53-man roster for up to three weeks after reporting. Washington did not deal the 31-year-old before the NFL trade deadline Tuesday, which prompted...",0.129976511490454,0.2355674226201812,0.18277196705531762,0.20037045224360547
N4745,news,newspolitics,"Testimony: White House lawyer told Vindman not to discuss Ukraine call The senior White House lawyer who placed a record of President Donald Trump's July 25 call with Ukraine's president in a top-secret system also instructed at least one official who heard the call not to tell anyone about it, according to testimony heard by House impeachment investigators this week.",0.129976511490454,0.2639040424591947,0.19694027697482436,0.2192615321362811
N26606,autos,autosenthusiasts,2020 Shelby GT500 Aero Performance & Cooling Supercomputers and 3-D Printing are secrets to the all-new Mustang Shelby GT500's high performance.,0.129976511490454,0.2753703307744771,0.20267342113246556,0.22690572434646938
N54807,news,newsworld,"Russia questions language of ""unusual"" Trump letter to Erdogan Russia questions language of ""unusual"" Trump letter to Erdogan",0.129976511490454,0.254413656500715,0.1921950839955845,0.21293460816396134
N32027,sports,football_nfl,Payton declines to name Saints starting QB for Week 8 ,0.129976511490454,0.234875814018398,0.182426162754426,0.19990937984241666
N62055,news,newspolitics,"Trump campaign threatens to sue CNN, citing Project Veritas videos An attorney representing President Trump's reelection campaign sent a letter to CNN on Friday threatening to sue.",0.129976511490454,0.2366254048082943,0.18330095814937414,0.20107577370234753
N35685,autos,autosreview,"First Drive! 2020 Shelby GT500 Is an Apex Predator, Turning Drivers Into Track Stars Driving the 2020 Shelby GT500 on the street, dragstrip, and road course reveals an apex predator that turns any driver into a track star.",0.129976511490454,0.2719904990993026,0.2009835052948783,0.2246525032296864
N52196,news,newspolitics,"Graham claims victory with impeachment vote Sen. Lindsey Graham, who introduced a resolution condemning secretive impeachment proceedings in the House, claimed victory Monday after House Speaker Nancy Pelosi announced she'll hold a formal vote and open up the hearings to the public.",0.129976511490454,0.2672971195417263,0.19863681551609014,0.22152358352463553
N21851,sports,football_nfl,"Next man up: Chiefs prepare for life without Mahomes, with Moore Two weeks ago, Tyreek Hill served as Matt Moore's top target.",0.129976511490454,0.247906640940836,0.188941576215645,0.20859659779070866
N37835,sports,football_nfl,Giants will not go back to Eli Manning after Daniel Jones' struggles Jones has thrown eight interceptions and has lost two fumbles in his past four starts.,0.129976511490454,0.2452615362855918,0.1876190238880229,0.20683319468721253
