ID,category,sub_category,content,collaborative_rec,content_rec,mean,two_one
N16290,news,newsus,"Missouri man missing for a week found alive in car that crashed into ravine Ryan Linneman, of Lee's Summit, was found by a dirt bike rider in wreckage along Interstate 470 in Kansas City, Lee's Summit police said.",0.14701548598585,0.240058492335356,0.193536989160603,0.20904415688552067
N13137,video,popculture,"Singer stands up to heckler who told her to take shirt off After being heckled on stage and told to ""free the nips"" at a concert in Texas, singer Maggie Rogers voiced her anger about the harassment.",0.1472186744168029,0.1930342806016961,0.1701264775092495,0.17776241187339836
N34124,travel,travelnews,"Southwest Airlines evacuates Chicago flight after blown tires: reports Southwest Airlines evacuated a flight Monday morning at Chicago's Midway International Airport, blaming a hydraulic issue with the landing gear.",0.1473577941082678,0.2566576584253215,0.20200772626679464,0.22022437031963693
N8331,entertainment,celebrity,"Melanie Griffith, 62, shows off her insane figure in lingerie selfie, plus more news Melanie Griffith looks more stunning than ever in lingerie selfie, plus more celebrity news for Oct. 30, 2019.",0.1475749783181219,0.2274646386654452,0.18751980849178357,0.20083475188300412
N54522,entertainment,celebrity,"Ben Affleck has a new girlfriend after using the Raya dating app, plus more celeb love life news for late October 2019 Meg Ryan and John Mellencamp call it quits, Halsey and Evan Peters get serious, James McAvoy weds, Meghan King Edmonds accuses hubby of cheating and more.",0.1475842579819582,0.2042084436081023,0.17589635079503024,0.18533371506605428
N22561,sports,football_nfl,NFL Week 8 Power Rankings: Old-school football rules the day NFL Week 8 Power Rankings: Old-school football rules the day,0.1478488741875093,0.2340687121278699,0.1909587931576896,0.2053287661477497
N30867,news,causes-environment,"The size of a bus, rare and endangered whale shark spotted off Florida coast Bigger than Jaws, but not nearly as dangerous, the largest fish in the sea, a whale shark, was spotted off the Florida coast.",0.1480507589196119,0.2503993134621862,0.19922503619089904,0.21628312861466142
N37509,news,newsus,"A man dies in Hawaii after falling into a lava tube in his yard An elderly man died after falling into a lava tube on his property in Hilo, Hawaii, police announced on Wednesday.",0.1484132843857375,0.2399607441538814,0.19418701426980944,0.20944492423116678
N22816,foodanddrink,foodnews,"Snow crab sells for record price in Japan A ""five shining star"" snow crab was auctioned off in Tottori, Japan for a record-breaking 5 million yen ($46,000). wide.",0.1487436972450853,0.2691919034272255,0.2089678003361554,0.22904250136651208
N40944,news,newsus,"Family of toddler who fell from cruise ship 'utterly crushed' after grandfather charged The charge of negligent homicide was ""like pouring salt on an open wound"" for the girl's parents, the family's lawyer told NBC News.",0.1489802983959753,0.2156817548734121,0.1823310266346937,0.19344793604759983
N15122,tv,tv-celebrity,Tamron Hall says she 'never dealt' cocaine after reports say she confessed to doing so Tamron Hall issued a statement in response to the Daily Mail reporting that she confessed to facilitating the sale of cocaine as a teenager.,0.1491331575880316,0.2058734532040478,0.1775033053960397,0.1869600213320424
N56447,tv,tv-celebrity,"'The Office' star Jenna Fischer responds to Chrissy Teigen's theory that Jim and Pam are divorced Jenna, who played Pam opposite John Krasinski's Jim on the hit NBC sitcom, thinks Chrissy got it wrong.",0.149245577685837,0.2461399431468433,0.19769276041634015,0.21384182132650786
N28058,lifestyle,lifestylebuzz,Strange Dog Shows Up On Woman's Lawn   And Seems To Recognize Her Kate Howard was sitting outside her home one afternoon after a memorial service when something amazing happened.,0.1493916447066131,0.2315149138703539,0.1904532792884835,0.20414049081577362
N63276,autos,autosenthusiasts,Gordon Ramsay's Ferrari Monza SP2 Looks Delicious Good thing the roofless ride is inside because it's raining outside.,0.1494870688034019,0.2574788806308347,0.2034829747171183,0.22148161002169042
N1398,news,newsus,"Iowa woman killed by explosion at gender reveal party An Iowa woman was killed by debris from an explosion at a gender reveal party on Saturday, police said.",0.1500046299937965,0.2364285208884896,0.19321657544114304,0.20762055725692521
N39235,news,newscrime,"Florida woman allegedly flees 2 car crashes, kills driver in 3rd crash A Florida woman who killed a 53-year-old man after running a red light and smashing into his Lexus on Saturday morning was in the process of fleeing two earlier car accidents when she caused the fatal collision, police said.",0.1506239514929923,0.2235336219272932,0.18707878671014275,0.19923039844919288
N54842,news,newsus,"Mississippi woman found after being missing for days by writing S.O.S. with rocks S.O.S spelled out with rocks saved a woman missing in a national park for days, according to a release from the National Park Service.",0.15071805182545,0.2259312065745086,0.1883246291999793,0.20086015499148907
N29499,news,newsus,"California governor signs measure banning 'lunch shaming' SACRAMENTO, Calif. (AP)   California's governor has signed into law a bill that guarantees all students a state-funded meal of their choice, even if their parent or guardian has unpaid meal fees.",0.150863754883002,0.270190864494914,0.210527309688958,0.2304151612909433
N35452,weather,weathertopstories,"'Potentially historic wind event' over weekend could inflame California wildfires Northern California could experience a potentially historic wind event this weekend, which could have a dangerous effect on wildfires.",0.150863754883002,0.2656150075820136,0.2082393812325078,0.2273645900156764
N55742,sports,mma,President Donald Trump gets mixed reaction at UFC 244 in historic milestone for MMA ,0.1512581030118281,0.1915946006959683,0.1714263518538982,0.17814910146792157
N14385,news,newsworld,ISIS names successor to slain leader al-Baghdadi The militant group named Abu Ibrahim Hashimi al-Quraishi as the new leader in a message posted by its official media wing.,0.1512816640296316,0.2628300768036581,0.20705587041664486,0.22564727254564929
N56446,movies,movies-celebrity,Ryan Reynolds Shares the First Photo of His and Blake Lively's Newborn Daughter This is the first time the actor has talked about his newborn daughter.,0.1514385254998961,0.2265798130568644,0.18900916927838024,0.2015327172045416
N21623,news,newsus,"A 'one in a million' yellow cardinal, dubbed 'Sunny,' seen in Florida Only three yellow cardinal sightings are reported a year, making the bird's appearance a rare ""one in a million"" finding, an Auburn professor said.",0.151569519285237,0.2686695788496318,0.21011954906743438,0.2296362256615002
N4020,tv,tv-celebrity,"'Tarzan' Actor Ron Ely: Actor's son allegedly killed his mother before deputies shot and killed him, sheriff's office says The son of ""Tarzan"" actor Ron Ely killed his mother before he was shot and killed by deputies on Tuesday, according to the Santa Barbara County Sheriff's Office.",0.1516177674934647,0.2150270597530743,0.1833224136232695,0.19389062899987108
N19347,news,newspolitics,"Former US Senator Kay Hagan dead at 66 Former U.S. Sen. Kay Hagan, a one-time Capitol Hill intern who went on to become North Carolina's first Democratic female senator, died Monday at her Greensboro home. She was 66.",0.1517036071281705,0.2508526097968833,0.2012781084625269,0.2178029422406457
N28711,sports,football_ncaa,The biggest games in the month of November that will decide the College Football Playoff The month of November will decided which teams will be in College Football Playoff contention. A look at the biggest games in a jam-packed schedule.,0.1517045618329047,0.2826513894480441,0.2171779756404744,0.2390024469096643
N8129,news,newsworld,"Elderly Japan woman rescued from Typhoon Hagibis dies after falling from helicopter; storm kills at least 33 An elderly woman was one of the more than 30 who have died in Japan from the devastating Typhoon Hagibis, officials said.",0.1517771865391652,0.2442299584028254,0.19800357247099531,0.21341236778160533
N56537,foodanddrink,restaurantsandnews,"Why Smoked Bologna Is the Secret Star of Oklahoma Barbecue No barbecue plate in the Sooner State is complete without a side of ""Oklahoma tenderloin"".",0.1520064255112201,0.2625318461095624,0.20726913581039125,0.22569003924344827
N36530,tv,tv-celebrity,Property Brothers' J.D. Scott Marries Annalee Belle in Vintage Theatre-Themed Wedding J.D. Scott is Married! Third Property Brother Ties Knot,0.1520436595533819,0.2421034616590667,0.1970735606062243,0.21208352762383845
N14761,weather,weathertopstories,Niagara Falls: Boat stuck on rocks 101 years dislodged High winds and heavy rains dislodged the remains of a barge in the rapids above Niagara Falls that had been there 101 years.,0.1521499185176499,0.2380228352512016,0.19508637688442576,0.209398529673351
N32852,news,newsus,"Nearly $400M worth of cocaine and marijuana intercepted by US Coast Guard The U.S. Coast Guard announced that it seized nearly $367 million of cocaine and about 11,000 pounds of marijuana worth an estimated $10.1 million at a Florida port.",0.1522770678381304,0.2380442690010302,0.1951606684195803,0.20945520194673026
N41797,autos,autosenthusiasts,"Tent Spent: We Try Luxury Camping in a $100,000 Airstream Call us crazy, but we actually enjoy traditional camping activities such as gathering firewood, pitching a tent, and peeing in the woods.",0.1527717523885455,0.2648581855491776,0.20881496896886156,0.22749604116230024
N5978,finance,markets,"Eric Tse, 24, just became a billionaire overnight A 24-year-old business school graduate has just become an overnight billionaire.",0.1532254806379389,0.2413618179347078,0.19729364928632334,0.21198303883578481
N33502,finance,markets,"China's trade with US shrinks in October despite optimism BEIJING (AP)   U.S.-Chinese trade contracted again in October, despite optimism about possible progress in talks aimed at ending a tariff war that threatens global economic growth.",0.1532698154385002,0.2729465206488147,0.21310816804365745,0.23305428557870989
N61388,movies,movies-celebrity,"Judge: Brad Pitt, others can be sued over New Orleans homes The Times-Picayune/ The New Orleans Advocate reports Pitt and other foundation directors asked the court to remove them from the lawsuit, saying they weren't personally responsible for the construction.",0.1532937372246651,0.2202796531992168,0.18678669521194097,0.1979510145410329
N54536,news,newsus,4 High School Students Killed in Texas Car Crash That Also Injured 3: 'We Grieve Together' 4 High School Students Killed in Texas Car Crash,0.1532943948824167,0.2331441675899076,0.19321928123616217,0.20652757668741065
N61342,sports,basketball_nba,"The Warriors' fall from glory, explained Things are getting bad quick for the Warriors.",0.1536083926080002,0.2323772324954434,0.1929928125517218,0.20612095253296234
N62058,sports,football_nfl,"What Tom Brady, Lamar Jackson Told Each Other After Patriots-Ravens Tom Brady offered credit where it was due Sunday night in Baltimore. The Ravens handed Brady and the Patriots their first loss of the season in Week at M amp T Bank Stadium. The primetime",0.1540382395635031,0.2405747637614483,0.1973065016624757,0.21172925569546658
N32109,travel,travelnews,"Cell Phone Forces Flight Diversion to Ireland When no one could identify the owner of the phone, the captain diverted the flight.",0.1541076926058505,0.2411443530560059,0.1976260228309282,0.2121321329059541
N37123,lifestyle,lifestylesmartliving,"17 Things You Should Never Do During a Conversation Want to make sure every conversation you have goes well? Begin with avoiding these 17 things you should never do, according to etiquette experts.",0.1541076926058505,0.2703018988592955,0.212204795732573,0.23157049677481384
N42620,lifestyle,lifestylebuzz,"Heidi Klum's 2019 Halloween Costume Transformation Is Mind-Blowing   But, Like, What Is It? You might say she's scary good at playing dress-up, because Heidi Klum's 2019 Halloween costume is even more impressive than we could have imagined   and that's saying a lot, considering transformative Halloween costumes are kind of her thing. But this year Klum took it up one more notch as she shared her metamorphosis into,",0.1543888871410259,0.2454908863521472,0.19993988674658653,0.2151235532817734
N9803,finance,markets,"Jeff Bezos is set to lose his crown as world's richest person Jeff Bezos is about to relinquish the title of world's richest person to Bill Gates, as Amazon.com Inc. stock tumbled in late trading Thursday.",0.1544981399690497,0.256645003133844,0.20557157155144684,0.22259604874557923
N54435,news,newsus,"'Angel' car saves Arizona family after smashing into suspected drunk driver running red light, video shows An Arizona driver who police praised as an ""angel"" may have saved the lives of a couple pushing a stroller in a crosswalk last week after video showed the car smashing into a suspected drunk driver speeding through a red light -- who came inches away from plowing into the family.",0.1550686436185105,0.2223158648350557,0.1886922542267831,0.19990012442954064
N56514,travel,travelnews,"Road built by biblical villain uncovered in Jerusalem A long-buried street that led pilgrims to the Jewish Temple 2,000 years ago was commissioned by Roman governor Pontius Pilate.",0.1551762630272499,0.2633538775061033,0.2092650702666766,0.22729467267981884
N58715,news,newsus,Officer placed on leave after threatening teen skaters at gunpoint Witnesses said the confrontation began on Saturday night when the plain-clothes officer approached the teenagers and ordered them stop playing loud music.,0.1553957916807481,0.2075118354946981,0.1814538135877231,0.1901398208900481
N55556,finance,personalfinance,Why President Trump's kids are probably celebrating his move to Florida The No. 1 reason billionaires decide to move.,0.1554188560995114,0.244759968555083,0.2000894123272972,0.21497959773655914
N31699,news,newscrime,"Woman stabbed in 2015 home invasion suing 911 dispatch company Breann Lasley has filed a civil lawsuit against Priority Dispatch Corp., alleging ""gross negligence,"" but the company said its system was never used.",0.1555010685190073,0.2277726626486204,0.19163686558381385,0.2036821312720827
N2511,foodanddrink,foodnews,"Krispy Kreme orders Minnesota student who bought, resold doughnuts to 'shut down operations' The people of Minnesota appear to once again be without Krispy Kreme doughnuts.",0.1559654455404885,0.2387982776578557,0.1973818615991721,0.2111873336187333
N59704,news,newscrime,"California sheriff's deputy shot dead, ride-along injured in 'active shooter incident,' officials say A police officer in Northern California was killed and another deputy was injured after an ""active shooter"" incident early Wednesday, according to officials.",0.1561781189910895,0.2552716812486362,0.20572490011986283,0.22224049382945396
N46616,foodanddrink,newstrends,"The best sandwich shop in every US state and DC You don't need to look far to find a great sandwich in the USA. We've rounded up the best sandwich joints in every state, spanning the range from old-school delis still whipping up traditional favorites to quirky, modern joints putting innovative ingredients to work. Pull up a stool and sink your teeth into these mouthwatering offerings.",0.1562966678503851,0.2953590375322206,0.22582785269130284,0.2490049143049421
N35022,lifestyle,lifestylebuzz,"Bed, Bath and Beyond Pulls 'Blackface Pumpkins From the Shelves The pumpkins were removed from stores after an upstate New York community filed complaints.",0.1567156202151296,0.2333780438972954,0.1950468320562125,0.2078239026699068
N39498,video,science,"Why it's so hard for planes to land on water When US Airways Flight 1549 landed in the Hudson river all 150 passengers survived. Landing a plane on the water is called ditching. Ditching is more common in smaller private planes, not large planes from companies like Boeing or Airbus. But the Miracle on the Hudson isn't the only time an aircraft has been ditched. And despite that success, landing a plane on the water can be extremely dangerous.",0.1570775819778551,0.2590234556137358,0.20805051879579545,0.2250414977351089
N21817,news,newspolitics,Two House Democrats break ranks with Pelosi on impeachment rules vote Two House Democrats broke ranks with their party leadership on Thursday's highly-contentious vote.,0.157750916857741,0.2532450244758147,0.20549797066677786,0.22141365526979015
N15034,tv,tv-celebrity,Alec Baldwin's 'heart goes out to' imprisoned Felicity Huffman and husband William H. Macy Alec Baldwin thinks incarceration shouldn't be a consequence for those guilty in the admissions scandal and gave a shout-out to Felicity Huffman.,0.1582506924924718,0.2051602110352871,0.18170545176387945,0.18952370485434866
N55897,tv,tv-celebrity,40 Fun Facts About Jennifer Aniston ,0.1583404109894375,0.2177125257618224,0.18802646837562995,0.19792182083769408
N16617,news,newsus,"Coast Guard searches for man who fell from cruise off Texas The U.S. Coast Guard late Thursday said it was searching for a man who plunged into the Gulf of Mexico while the ship was about 47 miles off the coast of Galveston, Texas.",0.1591826382640258,0.2418615119735016,0.2005220751187637,0.21430188740367634
N33164,sports,football_nfl,100 famous NFL players who played for teams you forgot about Randy Moss with the Titans? Archie Manning with the Vikings? Plenty of NFL players had some forgettable stints with surprising teams.,0.1592668250710681,0.2190936261403502,0.18918022560570913,0.19915135911725615
N34694,tv,tvnews,Rosie O'Donnell: Barbara Walters Isn't 'Up to Speaking to People' Right Now Rosie O'Donnell: Barbara Walters Isn't 'Up to Speaking to People' Right Now,0.1595774537705704,0.2116036635080586,0.1855905586393145,0.19426159359556253
N60340,lifestyle,lifestyleroyals,"Here's Why Harry and Meghan's Latest Interview Could Be the Final Straw for the Royal Family In Prince Harry and Meghan Markle's ITV interview on Oct. 20, they said they're unhappy living in a fishbowl. An insider reveals the palace's response.",0.1597871837946643,0.2155856503333344,0.18768641706399936,0.19698616148711104
N31801,news,newspolitics,Joe Biden reportedly denied Communion at a South Carolina church because of his stance on abortion Joe Biden has a complicated history with the Catholic Church.,0.1598836013047165,0.2446450501329582,0.20226432571883735,0.21639123385687764
N619,news,newsus,"Cornell student, 18, found dead in gorge after frat party, reports say A top Ivy League student was found dead Saturday afternoon in a New York gorge after he left a fraternity party and disappeared Thursday night, according to reports.",0.1606153787503874,0.2232766489552482,0.1919460138528178,0.20238955888696125
N871,tv,tv-celebrity,"Woman, suspect dead at 'Tarzan' actor Ron Ely's California residence Ron Ely, who portrayed Tarzan in the TV series in the 60s, was not harmed and is alive and well, a sheriff's office spokesman said.",0.1607618260697976,0.2371703299700044,0.19896607801990102,0.21170082866993548
N58580,tv,tv-gallery,"17 Hallmark Movies That Are Totally Worth Watching From festive flicks to cheesy romantic comedies, here are all the best Hallmark movies that are worth watching at least once.",0.161292664389122,0.26449708753226,0.21289487596069098,0.230095613151214
N27529,news,newsworld,"A man in Brazil accidentally blew up his yard while trying to kill some cockroaches Cesar Schmitz told FocusOn News, translated by the New York Post, that his wife had complained about roaches invading their garden.",0.1614960652622474,0.2228364875088324,0.1921662763855399,0.20238968009330408
N19001,lifestyle,lifestylepetsanimals,"Cat Sees Rain For The First Time And Loses Her Mind Betty's family adopted her six months ago from a local vet clinic, so she's still learning about her new home. Betty is an indoor cat, but she loves watching the world through her windows, and sometimes her mom will carry her outside and let her play there supervised as a special treat.",0.1614960652622474,0.24873661295281,0.2051163391075287,0.21965643038928914
N15414,sports,baseball_mlb,Why did the Phillies hire new manager Joe Girardi? USA TODAY Sports Bob Nightengale breaks down why the Phillies hired Joe Girardi.,0.1614960652622474,0.259440463791329,0.2104682645267882,0.2267923309483018
N62846,sports,baseball_mlb,"Nationals win first World Series title, storming back on Astros in Game 7, 6-2 After losing all three games in Washington over the weekend, the underdog Nationals became the first team in major league history to win the World Series by claiming four games on the road. Once again, they came from behind to do it.",0.1614960652622474,0.2421838995772107,0.20183998241972906,0.21528795480555626
N32320,news,newsgoodnews,Trooper pulls over to save flag on highway The trooper is being praised for stopping his car and properly handling the fallen flag,0.1614960652622474,0.2441554637190852,0.2028257644906663,0.21660233090013928
N12603,sports,more_sports,"Astros beat Yankees, will face Nationals in World Series SportsPulse: The Houston Astros are returning to the World Series for the second time in three years after defeating the Yankees, but must go through a red-hot Nationals team if they want to hoist the trophy.",0.1614960652622474,0.2405658428169785,0.20103095403961296,0.2142092502987348
N22007,news,newsworld,"Trump appears to confirm U.S. nukes are in Turkey, an admission that would break with longstanding protocol Asked about the U.S.'s reported stockpile in Turkey, Trump said, ""We're confident"" they're safe. The U.S. government has never confirmed that stockpile exists.",0.1614960652622474,0.2721382001534552,0.2168171327078513,0.2352574885230526
N39941,sports,baseball_mlb,"Nationals navigating through the postseason using just six pitchers The Nationals have navigated through the playoffs using mostly just six pitchers, covering nearly 82% of their total pitches.",0.1614960652622474,0.2560089208417712,0.2087524930520093,0.2245046356485966
N10824,news,newsworld,"New details emerge on raid that led to the death of ISIS leader Kurdish allies helped obtain DNA evidence and find the location of Abu Bakr al-Baghdadi, which aided in the capture and death of the terrorist leader.",0.1614960652622474,0.2354120175892251,0.19845404142573625,0.21077336681356587
N22772,entertainment,entertainment-celebrity,Kate Upton Shares Rare Pic of Daughter Cheering Daddy On! The cutest pic on the Internet today.,0.1614960652622474,0.2108907771709195,0.18619342121658344,0.19442587320136215
N58521,news,newsworld,"Islamic State defector inside Baghdadi's hideout critical to success of raid, officials say The informant, whose nationality has not revealed, is expected to receive some or all of the $25 million bounty that had been placed on Baghdadi's head, according to the officials.",0.1614960652622474,0.242328412899079,0.2019122390806632,0.21538429702013515
N19741,foodanddrink,foodnews,"Rachael Ray finally opens restaurant with no physical location Rachael Ray is the anomaly among TV celebrity chefs in that she's never opened a restaurant. Fans have asked for it, but Ray says it's just never been in the cards. Starting today, though, you can eat food designed by Rachael Ray… just not in an actual restaurant.",0.1614960652622474,0.2495870589853347,0.20554156212379104,0.22022339441097227
N21395,news,newsus,"Drone video shows the devastated compound where al-Baghdadi died Drone video showed there was little left standing of the compound at Barisha, Syria, where ISIS leader Abu Bakr al-Baghdadi was killed.",0.1614960652622474,0.2403638010915235,0.20092993317688546,0.21407455581509813
N14343,news,newsworld,Tens of thousands of Hong Kong protesters plead for U.S. help Tens of thousands of mostly young pro-democracy activists rallied in Hong Kong on Monday in the first legal protest since the introduction of colonial-era emergency laws and pleaded for help from the United States,0.1614960652622474,0.240650187135772,0.2010731261990097,0.21426547984459712
N442,sports,baseball_mlb_videos,Angels Hire Joe Maddon As New Manager The Los Angeles Angels Wednesday named the experienced Joe Maddon to be their new manager.,0.1614960652622474,0.2655914425841534,0.2135437539232004,0.23089298347685142
N32607,news,newsus,Murder warrant for Fort Worth officer says woman he killed was holding gun in her home The murder arrest warrant for a white officer who shot and killed a black woman on Saturday says that the victim was holding a gun after she heard noises outside her window.,0.1614960652622474,0.2223695125745352,0.1919327889183913,0.20207836347043925
N11804,news,newsus,"Pregnant Florida woman uses AR-15 to fatally shoot armed intruder Two armed men broke into the house and pistol whipped husband, before wife pulled out their legally possessed weapon and opened fire.",0.1614960652622474,0.2322182787743024,0.1968571720182749,0.2086442076036174
N39074,sports,more_sports,"Eliud Kipchoge runs 1:59 marathon, first to break 2 hours Eliud Kipchoge became the first man to break two hours in a marathon in a non-record-eligible event.",0.1614960652622474,0.2643928200596608,0.2129444426609541,0.23009390179385633
N35820,health,health-news,84-Year-Old Army Veteran Challenges TSA Agent to Push-Up Contest Before Her Flight This veteran's age isn't stopping her from acing a pushup competition!,0.1614960652622474,0.2313199305762863,0.19640799791926686,0.20804530880494002
