ID,category,sub_category,content,collaborative_rec,content_rec,mean,two_one
N58936,news,newsus,Beloved grandfather's body pulled from collapsed Hard Rock hotel A family holding vigil outside the site of the Hard Rock hotel construction collapse received the news they hoped they'd never hear.,0.1098034838657993,0.200611281711546,0.15520738278867263,0.17034201576296376
N21019,autos,autosnews,"Ford Baby Bronco Bare Body Allegedly Leaked In Exclusive Photo Ford had no comment, but it sure looks like the real deal.",0.1105849879226864,0.2335860206783852,0.1720855043005358,0.19258567642648558
N41298,music,music-celebrity,"Katy Perry sued for $150k by photo agency for 3-year-old pic Katy Perry allegedly posted a paparazzi photo without paying the fee, a photo agency claims.",0.1105849879226864,0.2116081531102012,0.1610965705164438,0.17793376471436292
N57239,movies,movies-celebrity,Emma Watson Says She Rejects the Word Single: 'I Call It Being Self-Partnered' Emma Watson Rejects the Word Single: 'I Call It Being Self-Partnered',0.114437260592391,0.2515154814510701,0.18297637102173056,0.20582274116484373
N2805,movies,movienews,"Star Wars: The Rise of Skywalker trailer is out, tickets already on sale The trailer debuted during Monday Night Football halftime, on Carrie Fisher's birthday.",0.114437260592391,0.2325228190548315,0.17348003982361124,0.193160966234018
N55911,lifestyle,lifestylebuzz,Katie Holmes Talks About That Bra and Cardigan Moment Katie Holmes Talks About That Bra and Cardigan Moment,0.1174785348385251,0.2219891638950064,0.16973384936676575,0.18715228754284596
N30698,news,newsus,Cranes remove bus partially swallowed by Pittsburgh sinkhole A bus that was partially swallowed when a sinkhole opened during morning rush hour in downtown Pittsburgh has been removed from the hole. Authorities said earlier Monday that two cranes arrived to remove the city bus.,0.1194833192179604,0.250871046447075,0.1851771828325177,0.20707513737070346
N42526,finance,finance-companies,'Go back to work': Outcry over deaths on Amazon's warehouse floor Billy Foister died last month after a heart attack at work. The incident was just one in a series of recent accidents and fatalities,0.1196780771042161,0.2364586716414206,0.17806837437281836,0.19753180679568574
N25885,entertainment,celebrity,Here's Every Costume the Kardashian-Jenner Family Wore This Halloween Every Kardashian-Jenner Halloween Costume (Even the Kids!) From 2019,0.1200819915088678,0.2409380795660113,0.18051003553743955,0.2006527168802968
N8629,sports,basketball_nba,"Anthony Davis on possibly joining hometown Bulls: 'I mean, I am a free agent next year' ",0.1200819915088678,0.2429753726023615,0.18152868205561465,0.20201091223786358
N62471,sports,football_nfl,"Trent Williams fails physical, experiencing discomfort with helmet Washington Redskins tackle Trent Williams' health situation has managed to get stranger after he reported to the team.",0.1206463113559009,0.2422919101941275,0.1814691107750142,0.20174337724805194
N47485,news,newsus,"Health warning lifted over fire at California oil facility Authorities have lifted shelter-in-place orders for some 12,000 people in Northern California after containment of a fire at a fuel storage facility that sent up a huge cloud of smoke. Emergency sirens blared and thick plumes of black smoke and flames filled the skyline around the NuStar Energy LP facility in Crockett, California, about 30 miles (50 kilometers) northeast of downtown San Francisco.",0.1214813356491892,0.2477025638883704,0.1845919497687798,0.20562882114197667
N719,finance,finance-companies,"Nevada gambling bosses move to bar Wynn from casino industry The complaint filed Monday by the state's Gaming Control Board lists sexual misconduct allegations that have been lodged against the mogul since January 2018. The complaint asks Nevada's Gaming Commission, which acts on the board's recommendations and has final say on licensing, to fine Wynn and revoke his status as being found suitable to be licensed in the industry.",0.1214813356491892,0.2224160163168423,0.17194867598301575,0.18877112276095795
N28074,lifestyle,lifestylefamilyandrelationships,"Woman Texts Dead Father's Phone for 4 Years & Finally Receives an Emotional Reply The pain of losing a parent, especially at a young age, is one that never really goes away.",0.1217862735487997,0.2249588621546816,0.17337256785174066,0.1905679992860543
N16158,lifestyle,lifestylebuzz,"Nationals pitcher criticized for missing playoff game for daughter's birth Daniel Hudson said his family is his ""top priority"" after receiving criticism for missing a playoff game for the birth of his daughter.",0.1223056362115465,0.2111208685425382,0.16671325237704235,0.1815157910988743
N6244,news,newscrime,Suspect Alfredo Vazquez pleads guilty in Clark County judges' shooting case ,0.1228705807906556,0.2103935511230623,0.16663206595685895,0.18121922767892673
N45099,news,newscrime,Suspect in crossbow murder of his father arraigned ,0.1228705807906556,0.1962021242394467,0.15953635251505116,0.17175827642318298
N17686,news,newscrime,"Suspect in Henry County murder, kidnapping arraigned ",0.1228705807906556,0.2195375353295775,0.17120405806011657,0.18731521714993687
N15710,news,newscrime,Arrest made in connection to stabbing in South Louisville ,0.1228705807906556,0.2134702494547704,0.168170415122713,0.18327035990006546
N3142,health,health-news,"Teen wins science competition with liquid bandage invention Kara Fan beat nine other finalists and hundreds of students who submitted ideas in the 3M​ Young Scientist Challenge, winning $25,000.",0.1228705807906556,0.239030068788017,0.18095032478933631,0.2003102394555632
N58224,news,newscrime,"13-year-old charged with two murders escapes custody in North Carolina Officials said they have concerns for public safety due to the teen's ""prior history of assaultive and unpredictable behavior.""",0.1228705807906556,0.2071561970091887,0.16501338889992215,0.17906099160301098
N44462,news,newscrime,"Louisville man who shot at LMPD officer sentenced to 10 more years in prison A Louisville man convicted of shooting at an officer was sentenced Friday. Judge David Hale sentenced Elijah Eubanks, 22, to 119 months in prison for a federal weapons charge. Sign up for our Newsletters In March 2018, Eubanks opened fire on an officer who was attempting to question him while he was in his vehicle with another person. No officers were hit, but Eubanks was shot multiple times when officers returned fire. Eubanks was previously...",0.1228705807906556,0.2364388509775904,0.17965471588412302,0.1985827609152788
N42704,news,newscrime,UPDATE: Coroner reveals identity of victim in Beechmont neighborhood shooting ,0.1228705807906556,0.2240342696229048,0.1734524252067802,0.19031304001215504
N43353,news,newscrime,"Wedding shooter may have been avenging late stepfather's murder, authorities say Brandon Castiglione, the groom's son, was previously charged with second-degree murder in the death of the suspect's stepfather.",0.1228705807906556,0.2116934558393285,0.16728201831499206,0.1820858308231042
N3433,finance,finance-companies,A secretive family landing a $4 billion haul has everyone guessing One of the world's richest and most discreet families must decide what to do with a massive pile of cash.,0.1228705807906556,0.2190345753304829,0.17095257806056924,0.1869799104838738
N6087,news,newsworld,"U.S. bans all flights to Cuba outside Havana in latest crackdown American Airlines and JetBlue, which fly routes to Cuba other than Havana, will have to submit to new regulations from the Transportation Department.",0.1228705807906556,0.262307019417211,0.1925888001039333,0.21582820654169255
N21773,travel,travelnews,Lumber spilled on I-71 following rollover crash; Lanes shut down ,0.1228705807906556,0.2454917799785267,0.18418118038459114,0.204618046915903
N65112,news,newscrime,"Family says 16-year-old was victim hit, killed on I-64 The person struck by 5 vehicles on Interstate 64 Friday night was a 16-year-old girl, according to family members. The girl's father, Ronnie Click, spoke with WHAS11 News Saturday and said his daughter Brea was killed in that incident. Police responded to I-64 near the 22nd Street exit after they received reports that a person had been hit while walking in the slow lane. RELATED: LMPD: Pedestrian struck and killed on I-64 E at 22nd Street Once...",0.1228705807906556,0.2186776421325323,0.17077411146159394,0.18674195501857338
N41011,news,newsworld,"For the first time, a man has been sentenced for sexual slavery by the International Criminal Court. He got 30 years. Bosco Ntaganda is a former Congolese rebel nicknamed the ""Terminator."" The ICC convicted him on 18 counts including murder, sexual slavery and using child soldiers.",0.1228705807906556,0.2280438147260324,0.175457197758344,0.1929860700809068
N22976,news,newsus,"The Sante Fe High School massacre suspect isn't fit to stand trial and will get psychiatric treatment, attorney says Dimitrios Pagourtzis is accused of killing eight students and two teachers at his Texas high school last year.",0.1228705807906556,0.2103192726209058,0.1665949267057807,0.18116970867748905
N63045,news,newscrime,"Coroner IDs man found dead in Klondike neighborhood A man who was found dead in the Klondike neighborhood has been identified. Louisville Metro police responded to the 3200 block of Pomeroy Drive for a call of a person down Friday. Officials said Kevin Hellems, 54, was found dead inside the home from some type of foul play. No other information has been released. The death comes as a surprise to the neighbors in the area, who say they aren't used to seeing police cars and detectives on this...",0.1228705807906556,0.2287443128518459,0.17580744682125077,0.19345306883144914
N59049,news,newsworld,"Three gunmen killed in Brazil airport raid, kidnapping: police Heavily armed gunmen raided an airport in Brazil on Thursday, officials said, stealing money from an armored truck before fleeing and taking a mother and baby hostage. At least one assailant escaped to a nearby residential neighborhood, taking a mother and her baby hostage in their home, the police spokeswoman said.",0.1228705807906556,0.222486873870542,0.1726787273305988,0.18928144284391318
N54889,lifestyle,lifestyle-news-feature,"Chris, the famously woolly sheep, has died Chris made headlines in 2015 after he became the unofficial world record holder for having grown the heaviest fleece.",0.1228705807906556,0.2271544217037172,0.1750125012471864,0.1923931413993633
N34567,news,newscrime,Grandfather charged in death of toddler who fell on cruise ship in Puerto Rico A grandfather who police say dropped his young niece from the 11th floor of a cruise ship docked in Puerto Rico in July has been accused of negligent homicide.,0.1228705807906556,0.2313540744005843,0.17711232759561996,0.1951929098639414
N61101,news,newscrime,"Resident recalls moments leading up to fatal shooting in Russell neighborhood In the Russell neighborhood, crime tape has become a well known sight that's why Lisa Tutt encourages her son and his friends to hang out at her house. READ THE FULL STORY:Resident recalls moments leading up to fatal shooting in Russell neighborhood Sign up for our Newsletters CHECK OUT WLKY:Live. Local. Late-Breaking. Get the top Louisville news, weather and sports from the team at WLKY   online, anytime.",0.1228705807906556,0.1987895888811311,0.16083008483589334,0.1734832528509726
N19709,news,newscrime,Teen given 8 years in prison for gang-related hate crime of student caught on tape A California teenager has been sentenced to eight years in prison for a gang-affiliated hate crime assault on another student.,0.1228705807906556,0.2164031178302801,0.16963684931046785,0.1852256054837386
N29948,lifestyle,lifestyle-news-feature,"A White Woman Searches for Her Black Family DNA testing tells people a lot about their geographic ancestry, prompting difficult questions about racial identity and belonging. ""In my heart, I feel a connection.""",0.1228705807906556,0.2431068763396079,0.18298872856513176,0.20302811115662378
N50528,news,newscrime,Man shot in the chest on Floyd Street ,0.1228705807906556,0.1983014947845914,0.16058603778762348,0.17315785678661277
N1569,news,newsus,"Officer who shot naked man found not guilty of murder DECATUR, Ga. (AP)   A former Georgia police officer who fatally shot an unarmed, naked man was found not guilty of murder Monday but was convicted of aggravated assault and other charges that could send him to prison for more than 30 years. Robert ""Chip"" Olsen's face turned red and he squeezed his eyes shut tightly as the verdict was read. His wife, Kathy Olsen, began sobbing and had to be led from the courtroom. DeKalb County Superior Court...",0.1228705807906556,0.2147398203342796,0.16880520056246762,0.18411674048640492
N35656,travel,travelnews,Motorcyclist killed in crash on New Cut Road identified ,0.1228705807906556,0.2255770281220535,0.17422380445635455,0.19134154567825418
N2663,news,newsworld,16 sentenced to death for burning alive Bangladesh teen Sixteen people were sentenced to death Thursday for burning alive a Bangladeshi teenager who refused to withdraw sexual assault charges against her head teacher.,0.1228705807906556,0.2303732159105145,0.17662189835058506,0.19453900420389486
N23061,news,newscrime,"Police arrest suspect in Bashford Manor double shooting Police have identified the suspect in a double shooting that happened in Bashford Manor. On Thursday, officers arrested Matthew Martin on attempted murder and other drug-related charges. Police said Martin and one of the victims pulled out guns during an argument that happened at Martin's apartment on Goldsmith Lane Wednesday afternoon. Following the argument, both victims were shot in the back as they ran down the hallway and were transported...",0.1228705807906556,0.2082014273852636,0.1655360040879596,0.17975781185372758
N48031,sports,basketball_nba,Ex-Maverick to pay for funeral of woman fatally shot in home by police ,0.1228705807906556,0.1862205283969386,0.1545455545937971,0.16510387919484426
N48390,travel,travelnews,First round of auctions begin for Joe Ley Antiques ,0.1228705807906556,0.2393162662003447,0.18109342349550017,0.20050103773044833
N31741,music,musicnews,"Snoop Dogg bringing 'I Wanna Thank Me' tour to Louisville Palace Multi-platinum rap legend Snoop Dogg is bringing his ""I Wanna Thank Me"" tour to the Louisville Palace in 2020. The venue announced on Twitter that the show is scheduled for Jan. 25. Live Nation presale starts starts Thursday at 10 a.m., and tickets go on sale to the general public Friday at 10 a.m. The Long Beach native released his 17th album, ""I Wanna Thank Me,"" in August. The Doggfather's West Coast G-funk style has sold more than 38 million...",0.1228705807906556,0.2143564973766676,0.1686135390836616,0.18386119184799693
N61355,news,newscrime,"2 Murder suspects escape from Monterey County, California, Jail The suspects are considered dangerous and should not be approached. Anyone who sees them should call 911 immediately.",0.1228705807906556,0.2453779538356523,0.18412426731315396,0.2045421628206534
N63317,news,newscrime,"Police: 4 charged with attempted murder month after shooting in SW Louisville Four people are facing attempted murder charges for a shooting last month in southwest Louisville. According to arrest citations, a group arrived at an apartment in the 9600 block of Lamborne Boulevard on Sept. 27 and attempted to lure a male, unknown age, out of his apartment. When the victim agreed to come outside, police said Byron Kirby, 25, shot at the victim four times. The victim then ran into the woods. It's unclear if he was hit....",0.1228705807906556,0.2142498955369628,0.16856023816380922,0.18379012395486038
N5398,news,newscrime,Suspects identified following hours-long SWAT standoff on South 34th Street ,0.1228705807906556,0.2104571350092672,0.1666638578999614,0.18126161693639664
N10438,lifestyle,lifestylebuzz,"Pope Lick Legend: Loved ones of those who died on trestle push for change Legends of a monster living under a dangerous train trestle have lured people to a quiet Louisville creek for decades. Some swear they have seen proof of a human-goat hybrid terrorizing the area. Others leave with no sightings and no story to tell. Those are the lucky ones. The story of a ""Pope Lick Monster"" or ""Goatman"" haunting the trestle at Pope Lick Creek has been commonplace in Louisville even becoming the focus of a movie in the late...",0.1228705807906556,0.2210644425742193,0.17196751168243746,0.1883331553130314
N8429,weather,weathertopstories,"Group clears plastic drums, tires from Falls of the Ohio State Park LOUISVILLE, Ky. (WHAS11)   The Falls of the Ohio is a little cleaner after volunteers helped return it to its glory. The volunteers picked up trash and debris along with old tires and leftover plastic barrels. It was part of Moran Environmental Recovery's effort to clean up parts of the state park. The group says over the years, the site has experienced waste dumping leaving the grounds full of empty drums, tires and glass. The state park is the...",0.1228705807906556,0.2472966097213434,0.1850835952559995,0.20582126674444745
N51163,lifestyle,lifestylebuzz,"He grew a 910-pound pumpkin and then used it as a boat Instead of making a giant jack o'lantern or a massive pie that could feed the whole town, a farmer in Tennessee took his 910-pound pumpkin out for a spin in his pond.",0.1228705807906556,0.2523302327782331,0.18760040678444434,0.20917701544904058
N62612,news,newscrime,16-year-old injured in shooting near Churchill Downs ,0.1228705807906556,0.1934104664174406,0.15814052360404812,0.16989717120851228
N24611,news,newscrime,"Former Jewish Hospital nurse to be arraigned on sexual abuse of patient charge According to court documents, Dorsey told the woman ""repeatedly"" that, ""I would like to video you.""",0.1228705807906556,0.2082982181202159,0.16558439945543574,0.17982233901036246
N29802,finance,finance-companies,"Barneys Is Sold for Scrap, Ending an Era Authentic Brands Group will take control of the Barneys name   one that has been part of the Manhattan landscape since 1923   and license it to other companies like Saks Fifth Avenue. The firm B. Riley Financial is preparing to liquidate Barneys' high-end wares, at its five stores and two Warehouse locations, starting with private sale events for Barneys' ""most loyal"" shoppers next week.",0.1228705807906556,0.2591264860522012,0.1909985334214284,0.21370785096501932
N7023,lifestyle,lifestyle-news-feature,"After being pushed close to extinction, this humpback whale population is making a comeback A key population of humpback whales is in recovery after it was pushed close to extinction by centuries of exploitation, according to a new study.",0.1228705807906556,0.2540761380195585,0.18847335940510704,0.21034095227659083
N19041,news,newscrime,Kroger shooting: Suspect coming out of store fires at officers before they shoot him dead ,0.1228705807906556,0.2237676738695004,0.17331912733007798,0.19013530950988544
N31739,news,newscrime,"'Habitual stowaway' arrested again at O'Hare, Chicago police say A woman arrested at O'Hare International Airport on Friday night was identified by Chicago police as ""known habitual stowaway"" Marilyn Hartman.",0.1228705807906556,0.231204049299559,0.1770373150451073,0.19509289312992453
N55833,news,newscrime,"Oldham County man charged, injuring victim during shooting practice ",0.1228705807906556,0.2190101469252018,0.1709403638579287,0.18696362488035306
N31402,foodanddrink,restaurantsandnews,"The Best Seafood Restaurant in All 50 States Think there are too many seafood places in Maine to choose among, but none in landlocked Nebraska? This list will point your cravings and more in the right direction. Whether it's shrimp, crab, fish, or sushi that you love, even the most landlocked states have top-notch options for seafood. Find out what's near you.",0.1228705807906556,0.2914462169321543,0.20715839886140494,0.23525433821832137
N6072,news,newsus,"Search resumes for worker missing in New Orleans Hard Rock Hotel building site collapse that killed 2 Rescuers resumed searching Sunday for a worker trapped in rubble after a deadly construction collapse in New Orleans, officials said, but the building's instability is making for a precarious situation.",0.1228705807906556,0.2266618763138448,0.1747662285522502,0.19206477780611506
N10679,news,newspolitics,Justice Dept. appeals order on Mueller grand jury testimony The Justice Department is appealing a judge's order directing the department to produce to the House secret grand jury testimony from special counsel Robert Mueller's Russia investigation.,0.1239221645617218,0.2468241136679235,0.18537313911482264,0.2058567972991896
N55310,news,newscrime,"Joey 'the Clown' Lombardo, infamous Chicago mobster, dead at 90, reports say Chicago mobster Joseph Lombardo   better as ""Joey the Clown""   died in prison Saturday while serving a life sentence for murder, according to federal prosecutors.",0.1247213932757933,0.226552827372767,0.17563711032428014,0.19260901600710909
N64562,tv,tv-celebrity,Rob Kardashian Appears Thinner at Kim Kardashian's Birthday Party in Rare Video Rob Kardashian Appears Thinner at Kim Kardashian's Birthday Party,0.1247213932757933,0.2044242417266438,0.16457281750121855,0.1778566255763603
N8419,news,newscrime,Man charged with 5 counts of first-degree murder in shooting rampage at Chicago condo Chicago police Monday morning announced charges against a man in connection with a shooting rampage that left five people dead Saturday night.,0.1247213932757933,0.2152375436316107,0.16997946845370202,0.18506549351300491
N2606,news,newscrime,"Couple Accused of Injecting Childhood Friend With Meth and Filming Her As She Died After more than two years of investigation, authorities in Oklahoma have filed formal murder charges in the death of a 41-year-old woman whose last moments were captured on videotape.",0.1247213932757933,0.1909833030100833,0.1578523481429383,0.16889599976531997
N32095,news,newsus,"Illegal vapes traced to California woman who was CBD pioneer CARLSBAD, Calif. (AP)   Some of the people rushing to emergency rooms thought the CBD vape they inhaled would help like a gentle medicine. Others puffed it for fun. What the vapors delivered instead was a jolt of synthetic marijuana, and with it an intense high of hallucinations and even seizures.",0.1247213932757933,0.2360468693095583,0.1803841312926758,0.1989383772983033
N20886,news,newsworld,"ISIS Leader Paid Rival for Protection but Was Betrayed by His Own The Islamic State leader Abu Bakr al-Baghdadi was able to hide out in an unlikely part of Syria, the base of a rival group, because he was paying protection money to its members, according to receipts for the payments recovered by researchers.",0.1247213932757933,0.2573739914565186,0.19104769236615596,0.21315645872961017
N157,sports,baseball_mlb,"How did the Nats respond to a controversial call? By leaving absolutely no doubt. A controversial interference call. Dominance from Stephen Strasburg. Booming home runs to turn it around. And now, one game to decide it all.",0.1247213932757933,0.2476498581373538,0.18618562570657354,0.20667370318350028
N20286,movies,movies-celebrity,Scarlett Johansson Says She Was 'Surprised' by Colin Jost's Proposal: 'He Killed It' Scarlett Johansson Was 'Surprised' by Colin Jost's Proposal,0.1247213932757933,0.2318174780606091,0.1782694356682012,0.19611878313233716
N5888,sports,baseball_mlb,Report: Angels could be fined up to $2M for not reporting Skaggs' opioid use The Los Angeles Angels could be fined up to $2 million by the commissioner for not reporting Tyler Skaggs' opioid use. A report published by ESPN on Saturday stated that Angels communications director Eric Kay admitted to federal investigators that he used and supplied Skaggs with drugs since at least 2017.,0.1247213932757933,0.2238759465120564,0.17429866989392484,0.19082442876663536
N1431,news,newscrime,"Four charged with repeatedly escaping prison, returning with booze and phones Acting on ""repeated reports"" that prisoners were regularly escaping and returning, authorities said they caught the men in the act with the contraband.",0.1247213932757933,0.2209030614510785,0.1728122273634359,0.1888425053926501
N15771,autos,autosenthusiasts,"The Holy Grail Of Jeep Grand Cherokees Sits On An Old Wisconsin Dairy Farm, But It May Be Doomed ",0.1247213932757933,0.2329544508283108,0.17883792205205204,0.1968767649774716
N47054,autos,autossema,"Hennessey Maximus Is a 1000-HP Jeep Gladiator from Hell If a 2020 Jeep Gladiator is not aggressive-looking enough, Hennessey has this even more intense version, which it's bringing to the SEMA show.",0.1247213932757933,0.2598640351375877,0.1922927142066905,0.2148164878503229
N18663,news,newsus,"Coast Guard offloads $92 million worth of smuggled cocaine in San Diego The Coast Guard offloaded more than 6,800 pounds of cocaine   worth an estimated $92 million   in San Diego on Wednesday, contraband that the military branch seized in international waters of the eastern Pacific Ocean.",0.1247213932757933,0.2639273340464431,0.1943243636611182,0.2175253537895598
N47482,travel,travelnews,TSA Agents Stop Passenger With Loaded Gun Before Boarding Plane The man was carrying a loaded .22 caliber handgun.,0.1247213932757933,0.2429819401110956,0.18385166669344447,0.2035617578326615
N46868,lifestyle,lifestylepetsanimals,"30 Funny Dog Photos You Need to See We asked readers to send in their favorite animal photos. We were so entertained, we couldn't help but share.",0.1247213932757933,0.2507191176366862,0.18772025545623974,0.20871987618305524
N22130,music,music-celebrity,Rihanna Slays in Sexy Black Bikini in Slow-Motion Video -- Watch! The singer shut down Instagram with her slow-motion clip.,0.1247213932757933,0.2215944721183554,0.17315793269707436,0.18930344583750136
