ID,category,sub_category,content,collaborative_rec,content_rec,mean,two_one
N28660,news,newsworld,"Erdogan vows to 'crush the heads' of Kurds if they don't withdraw; both sides trade blame for violating cease-fire Turkish President Recep Tayyip Erdogan on Saturday promised to ""crush the heads"" of the Kurds in Syria if they don't fall back from the border's safe zone, according to reports.",0.1343624071185721,0.2593973999908766,0.19687990355472434,0.21771906903344176
N62545,finance,finance-companies,"The CEO taking on the gun lobby Ed Stack didn't set out to be an activist. The chief executive of Dick's Sporting Goods, Mr. Stack spent his career selling fishing rods, camping gear and athletic equipment at big-box stores around the country. Dick's was founded by Mr. Stack's father in upstate New York. As a young man, Mr. Stack worked for the family business. But he didn't enjoy the experience. His father was a divisive boss who couldn't manage a supply chain, and was...",0.1343624071185721,0.2198941162673906,0.17712826169298135,0.19138354655111778
N58625,news,newspolitics,"Kamala Harris responds to memo on staff cuts: 'I fully intend to win' The senator's campaign is cutting jobs in its headquarters and shifting workers from New Hampshire, Nevada and California.",0.1343624071185721,0.2688330417899103,0.2015977244542412,0.22400949689946426
N29819,movies,movies-celebrity,"Paparazzi Drove Keira Knightley to a Mental Breakdown: 'I Told Them I Was Going to Kill Somebody' The twice-Oscar-nominated actress spoke frankly with The Telegraph about how the enormous pressure of 2003's ""Pirates of the Caribbean"" and the hits that followed forced her to retreat from the limelight.",0.1343624071185721,0.2039140204810372,0.16913821379980465,0.18073014936021553
N50343,sports,football_ncaa,'We think it's cute.' Clemson reacts as undefeated Tigers keep falling in Top 25 Clemson co-offensive coordinator Jeff Scott was the head coach at Blythewood High School in Richland County in the mid-2000s before beginning his college coaching career at Presbyterian in 2007.,0.1343624071185721,0.2532781532988671,0.1938202802087196,0.21363957123876878
N22032,sports,football_ncaa,Five arguments College Football Playoff committee can ignite with first rankings The first College Football Playoff rankings will be unveiled on Tuesday. Here are the five arguments that could take off as a result.,0.1343624071185721,0.273596281697458,0.20397934440801505,0.2271849901711627
N20933,sports,football_ncaa,"College football Week 7 takeaways: LSU offense shows it's for real LSU appears to finally have the offense to compete with Alabama, and other things Dan Wolken learned from Week 7 of the college football season.",0.1343624071185721,0.2365920310347073,0.18547721907663972,0.20251548972932892
N59496,sports,football_nfl,"Week 7 winners, losers: Aaron Rodgers now in MVP race; Mitchell Trubisky looks lost Aaron Rodgers' big game vaults him into the MVP race. Meanwhile in Chicago, it might be time for the Bears to reconsider Mitchell Trubisky's future.",0.13451055983593,0.238940973240198,0.186725766538064,0.20413083543877533
N24724,news,newsworld,"Humanitarian crisis unfolds as violence escalates in Syria In little more than a week, longstanding alliances have crumbled and old enemies have teamed up after the U.S. began pulling its forces out and Turkey invaded Syria",0.1348002246943635,0.2550488468946534,0.19492453579450847,0.2149659728278901
N38495,health,health-news,"Poultry Recall After 22 Tons of Vietnamese Products Distributed Without Import Inspection In addition to failing to go through the usual food inspection processes, the products came from Vietnam a country that is not eligible to export poultry products to the U.S. or any meat products aside from catfish.",0.1350152249060906,0.2512099635057372,0.19311259420591392,0.2124783839725217
N18086,foodanddrink,restaurantsandnews,"I Would Go Back to This Missouri Theme Park Just for the Snacks The excellent food at Silver Dollar City is one of many reasons that Branson, Missouri is an essential stop on any Midwest road trip.",0.1350152249060906,0.2663554557889632,0.20068534034752689,0.22257537882800568
N34934,sports,golf,"20 years after Payne Stewart's tragic death, son Aaron carries his legacy Aaron Stewart spent his summers on the road as a PGA Tour kid. The behind-the-scenes visits at the Columbus Zoo during the Memorial Tournament stand out among his favorite memories as well as the ""music man"" under the big tree on Hilton Head Island.",0.1350152249060906,0.1987492281627347,0.16688222653441265,0.17750456041052
N41089,lifestyle,lifestylebuzz,"This Man's Rattlesnake Bite Is a Warning to Everyone to Take Animal Bites More Seriously You wouldn't think a baby rattlesnake could do so much damage, but Austin McGee knows better after almost losing his finger to one.",0.1350152249060906,0.2183912256574899,0.17670322528179025,0.19059922540702348
N61186,music,music-celebrity,Infected toe stops R. Kelly from attending court hearing CHICAGO (AP)   R. Kelly's lawyer has told a federal judge that an infected toe prevented the R&B star from attending a hearing in his child pornography case in Chicago. Kelly is detained at a jail two blocks from the courthouse and had been expected to appear at Wednesday's status hearing. But defense lawyer Steve Greenberg said one of Kelly's toenails had to be removed as treatment and Kelly worried someone might trample on his toe as he was...,0.1350152249060906,0.2136522240195035,0.17433372446279705,0.18743989098169922
N60850,foodanddrink,newstrends,"Popeyes is bringing back the chicken sandwich--and also takes a swipe at Chick-fil-A FORT WORTH -- The much-loved Popeyes Louisiana Kitchen fried chicken sandwich returns Sunday, and the company's announcement was a hard kick to the gizzard for competitor Chick-fil-A. After a limited-time summer special turned into a $65 million marketing bonanza, Popeyes will return both the spicy and mild sandwiches -- and on Sunday, when Chick-fil-A is not even open. Popeyes' ...",0.1350152249060906,0.2537932992814644,0.19440426209377748,0.21420060782300646
N63180,music,music-celebrity,"Taylor Swift can't shake 'Shake It Off' copyright suit reinstated by federal court panel A federal appeals court panel Monday reinstated a dismissed copyright lawsuit claiming Taylor Swift's ""Shake It Off"" infringed on an earlier song.",0.1350152249060906,0.2396186565860822,0.1873169407460864,0.204750846026085
N21720,health,health-news,Juul accused of selling 1 million tainted vaping pods Former Juul senior vice president Siddharth Breja claims he was fired in March for raising concerns about contaminated pods,0.1350152249060906,0.2327437620877078,0.1838794934968992,0.20016758302716875
N11727,foodanddrink,restaurantsandnews,"Popeyes quietly launched a new pumpkin pie and it's the best fast-food dessert I've ever tasted Popeyes still doesn't have the chicken sandwich, but it does have a delicious new deep-fried pumpkin and cream cheese pie. Run, don't walk.",0.1350152249060906,0.2538630294632004,0.1944391271846455,0.21424709461083047
N32268,foodanddrink,foodnews,"I ate one of Meghan Markle's favorite foods from Toronto here's what I thought The food at Terroni was good and the prices were surprisingly affordable, but the service was disappointing.",0.1350152249060906,0.2643936710867879,0.19970444799643927,0.2212675223598888
N17681,foodanddrink,foodnews,McDonald's Is Going to Add Chicken to Its Breakfast Menu in 2020 Here's the rumor from McDonald's HQ. The post McDonald's Plans to Add Chicken to Its Breakfast Menu in 2020 appeared first on Taste of Home.,0.1350152249060906,0.2735992689369655,0.20430724692152807,0.22740458759334056
N3577,health,health-news,Tennessee reports 49 cases of lung injury linked to vaping Tennessee health officials say they have received 49 cases of serious lung injury in people who use electronic cigarettes or other vaping devices.,0.1350152249060906,0.2604988685868474,0.197757046746469,0.2186709873599285
N27919,sports,golf,Martin worries about amputation after breaking right leg Casey Martin's worst fear was realized earlier this month when he stepped awkwardly off a curb and fractured his right tibia.,0.1350152249060906,0.2240639777499055,0.17953960132799807,0.19438106013530054
N42570,news,newsus,"Woman dies after being hit by vehicle crossing northwest Fort Worth street, police say A 24-year-old woman died Wednesday after she was struck by a vehicle as she walked across a far northwest Fort Worth street, police said. Kristen Morton was hit at about 6:15 p.m. on Boat Club Road near Reef Point Lane, authorities said. The crash was an accident, a Fort Worth police spokesman said. Police did not describe the vehicle. Morton, who lived in White Settlement, was taken ...",0.1350152249060906,0.2172253513437001,0.17612028812489536,0.18982197586449695
N59254,news,newsus,Judge rules deputies can't put 'no trick-or-treat' signs in sex offenders' yards A federal judge has ruled deputies in a Georgia county cannot put warning signs where registered sex offenders live.,0.1350152249060906,0.2442493904719257,0.18963230768900816,0.20783800194998067
N20109,music,musicnews,Lady Gaga Says 'Fame Is Prison' -- And Has Fans Speculating If New Music Is on the Way The singer's fans are also wondering if she's talking about the pressures of the industry.,0.1350152249060906,0.2100726765445971,0.17254395072534384,0.18505352599842828
N7499,entertainment,celebrity,New Couple Alert? Drake and Kylie Jenner Appear Into Each Other at Party New Couple Alert? Drake and Kylie Jenner Appear Into Each Other at Party,0.1350152249060906,0.2119269877826114,0.173471106344351,0.18628973349043781
N28088,movies,movies-celebrity,Bruce Willis brought Demi Moore to tears after reading her book Demi wasn't sure how her ex would feel about her book until he called her.,0.1350445088064954,0.2256872324744393,0.18036587064046736,0.19547299125179132
N6750,news,newspolitics,"Kamala Harris to slash staff, restructure campaign as she hemorrhages cash Kamala Harris is dramatically restructuring her campaign by redeploying staffers to Iowa and laying off dozens of aides at her Baltimore headquarters, according to campaign sources and a memo obtained by POLITICO Wednesday, as she struggles to resuscitate her beleaguered presidential bid.",0.1351266335881227,0.2491604823245743,0.19214355795634852,0.21114919941242377
N24889,news,newspolitics,"McConnell tees off on Democrats over impeachment Senate Majority Leader Mitch McConnell (R-Ky.) teed off against the House impeachment inquiry on Tuesday, marking his first comments since Congress returned from its two-week break. ""House Democrats are finally indulging in their impeachment obsession. Full steam ahead,"" McConnell said during a speech from the Senate floor, adding that House Speaker Nancy Pelosi (D-Calif.) had ""crumbled"" to the ""left-wing impeachment caucus."" ""I don't...",0.1357579322480029,0.2398666938010425,0.1878123130245227,0.20516377328336263
N35458,finance,markets,"Brazil oil auction a 'total disaster' as bidders stay away Brazil's largest-ever auction of oil deposits flopped, sending the real tumbling, after state-controlled Petroleo Brasileiro SA did most of the bidding while other major oil companies stayed away.",0.1359201878490664,0.2535918644040675,0.19475602612656695,0.21436797221906712
N44383,news,newscrime,"Florida police tell man to quit calling about stolen marijuana A man in Florida repeatedly called 911 over the weekend to report that his roommate had stolen his weed, police said.",0.1371054691039214,0.2357188268121951,0.18641214795805827,0.20284770757610388
N42470,finance,finance-companies,G.M. Workers Approve Contract and End U.A.W. Strike The longest nationwide strike against General Motors in half a century ended on Friday after a solid majority of the company's union members delivered their support for the four-year contract hammered out by their leaders. The United Auto Workers union emerged with substantial wage increases and succeeded in ending a two-tier wage structure that had been a particular irritant in its ranks. It also won commitments to new G.M. investments in...,0.1376223843875939,0.2544873734223443,0.1960548789049691,0.2155323770774275
N31931,news,newscrime,Florida man arrested in beating death of peeping Tom Victor Vickery had been in bed with his girlfriend when they heard a man with a history of peeping at their window.,0.1380308753464903,0.21731941915405,0.17767514725027017,0.1908899045515301
N31825,video,viral,A sneak peek at Hudson Yards' Edge to open March 2020 A new observation deck in NYC is opening up on March 11th 2020. We give you a sneak peek at Hudson Yards' Edge.,0.1384002892180484,0.2688473813177151,0.20362383526788175,0.22536501728449285
N45729,tv,tv-celebrity,"Former Deadliest Catch Star Jerod Sechrist Arrested, Charged with Heroin Possession Deadliest Catch: Jerod Sechrist Charged with Heroin Possession",0.1384002892180484,0.1966698655303985,0.16753507737422346,0.1772466734262818
N51891,sports,football_ncaa,"7 biggest takeaways from the opening College Football Playoff rankings Hey, the Pac-12 is actually being respected.",0.1384002892180484,0.262079728234773,0.20024000872641068,0.22085324856253147
N59026,news,newsus,"Cincinnati school board candidate accused of 'pretending to be black' in his ads A current CPS board member took to Twitter Sunday to say a candidate for the board ""is a white guy pretending to be black to get votes"" in ads.",0.1388399263380742,0.232718965022854,0.18577944568046412,0.2014259521279274
N37159,foodanddrink,restaurantsandnews,"National Sandwich Day: Where to score free subs and meal deals Sunday National Sandwich Day is a day for free food, deals and discounts at Jimmy John's, Jersey Mike's Subs, Subway, Potbelly Sandwich Shop and more.",0.1388832006843073,0.2801306002785273,0.2095069004814173,0.23304813374712066
N8275,news,newsworld,"30 killed in DR Congo bus accident At least 30 died early Sunday when a packed bus came off the road and burst into flames near Kinshasa, the DR Congo capital, a local official said.",0.1389572849580888,0.2314704576834112,0.18521387132075,0.20063273344163707
N9798,news,newsus,"Missing West Point cadet found dead, officials say A U.S. Military Academy cadet who vanished last week has been found dead, officials said Wednesday.",0.1393834910315846,0.2468958685162241,0.19313967977390434,0.2110584093546776
N45794,news,newscrime,"Four flight attendants were arrested in Miami's airport after bringing in thousands in cash, police say Four American Airlines flight attendants were arrested at the Miami International Airport and charged with money laundering after bringing large amounts of cash into the country, police said.",0.1394232798637875,0.2356759919267188,0.18754963589525314,0.20359175457240836
N4607,autos,autosnews,Cause determined in Jessi Combs' fatal speed record crash Occurred at speeds near 550 mph,0.1394697560951677,0.210657131483593,0.17506344378938035,0.18692800635411788
N13008,finance,finance-companies,Harley-Davidson halts production of new electric motorcycles Harley-Davidson has halted production and deliveries of its new LiveWire electric motorcycle after reportedly discovering a problem with its charging mechanism.,0.1400038571288483,0.2648573915934115,0.2024306243611299,0.22323954677189042
N58090,sports,football_nfl,"Frustrated Antonio Brown has active morning on Twitter Receiver Antonio Brown continues to wait for his next opportunity, and he continues to be justifiably frustrated by the fact that the NFL's slow-moving investigation is essentially keeping Brown suspended without pay.",0.1402369943284716,0.2338555181764302,0.1870462562524509,0.20264934356044398
N20121,music,musicnews,"Bob Kingsley, Country Radio Legend, Dead at 80 Country radio legend Bob Kingley, the longtime host of the nationally syndicated program Bob Kingsley's Country Top 40, died early Thursday in Weatherford, Texas, following a lengthy battle with bladder cancer. He was 80 years old. A member of the Country Radio Broadcasters Hall of Fame, inducted in 1998, he later became only the format's fifth representative in the National Radio Hall of Fame in 2016. Kingsley was 18 and serving in the Air...",0.1405878121726315,0.2127165695357699,0.1766521908542007,0.18867365041472375
N5445,weather,weathertopstories,"Wild fall freeze: Utah falls close to minus-35 as West shivers, while bitter cold oozes east Denver could start Halloween morning near 0 degrees.",0.1407528235985834,0.2433277455946028,0.1920402845965931,0.20913610492926302
N7132,lifestyle,lifestylebuzz,"8 Hero Dogs That We Don't Deserve From trained search and rescue dogs, to a cosmonaut, to a boxer with a penchant for recycling, here are 8 dogs who deserve all the belly rubs.",0.1407879329292496,0.2430220786585255,0.19190500579388753,0.2089440300821002
N48742,news,newscrime,"Before his execution, a death row inmate told his victim's family he forgives them Charles Rhines, who was convicted of murder in the brutal stabbing of a 22-year-old man in 1992, was executed in South Dakota Monday, the state's attorney general said, after the Supreme Court denied a last-ditch appeal of his case.",0.1411141238881371,0.2181190313977824,0.17961657764295974,0.1924507288945673
N6154,sports,football_ncaa,"Report: Florida State considering firing Willie Taggart, pursuing Urban Meyer Willie Taggart should definitely look over his shoulder, should this report be true.",0.1416589566275826,0.2542213582841166,0.1979401574558496,0.2167005577319386
N57737,news,newsus,"Missing Minnesota boy, 6, and his dog, found in cornfield by drone with thermal camera A missing 6-year-old boy from Minnesota and his dog were found Wednesday after hundreds of volunteers   including one who used his own drone with a thermal camera   searched for him for hours.",0.1417194080709247,0.2286247532412761,0.1851720806561004,0.19965630485115896
N12349,lifestyle,lifestylebuzz,"Divers Find Giant Mysterious 'Egg' Floating In Ocean A team of divers set off to explore a sunken World War II ship off the Norwegian coast, but what they found was something far more mysterious. While making their way back to shore, Ronald Raasch, Nils Baadness and Brynjar Aarnseth came face-to-face with a giant floating orb. The bubble hovered 17 meters (56 feet) below the surface and appeared to be see-through. The divers turned their flashlights on it and realized that the sphere was filled...",0.1417650282849789,0.2426748371774348,0.19221993273120686,0.20903823421328283
N459,news,newscrime,Serial stowaway arrested at Chicago airport for 2nd time Hartman was taken into custody was charged with one felony count of criminal trespass,0.1418147451343857,0.2282179338921329,0.1850163395132593,0.19941687097288383
N27644,lifestyle,lifestylebuzz,"Dog 'Randomly' Drops By Family Reunion   Then People Check His Collar The other day, Leslie Kowash was at a family reunion in Georgia when a friendly local decided to drop in on the party, seemingly out of nowhere. It was a sweet brown pup   and a rather plump one, at that.",0.1428513822678797,0.222485058931491,0.18266822059968535,0.19594050004362057
N61070,news,newscrime,Man arrested in 1993 cold case rape after he's identified by DNA: Police The suspect was 28 at the time and not known to the victim.,0.1430774873289811,0.217732771327923,0.18040512932845204,0.19284767666160904
N30531,tv,tv-gallery,"16 transgender celebrities who are changing television Shows like ""Euphoria,"" ""Pose,"" ""The Fosters,"" and ""Shameless"" have all introduced trans actors and characters in recent years.",0.1431087292690204,0.2148344497788119,0.17897158952391615,0.19092587627554808
N40640,foodanddrink,foodnews,"Foie Gras Is Banned by New York City Lutèce served it seared, with dark chocolate sauce and bitter orange marmalade. Le Cirque offered it in classic terrine form, but also served it with rabbit and bacon and made it the scene-stealer in a ravioli dish. But Lutèce closed in New York in 2004. Le Cirque shut its last Manhattan location in 2017. And foie gras, the calling card of fine French dining, is about to follow suit. The New York City Council overwhelmingly passed legislation on...",0.1431760546684586,0.2524244843183494,0.197800269493404,0.21600834110171915
N25158,lifestyle,lifestyleroyals,Kate Middleton Takes Prince George and Princess Charlotte Halloween Shopping at Local Supermarket Kate Middleton Takes George and Charlotte Halloween Shopping,0.1435194267916674,0.2351943597245295,0.18935689325809846,0.20463604874690883
N57318,news,newsus,"A 2,000-pound great white shark is swimming off the coast of Florida A great white shark that weighs over 2,000 pounds and measures 15 feet, 5 inches long has been swimming along the US East Coast.",0.1435470011496273,0.2731101292200213,0.2083285651848243,0.22992241986322332
N38562,sports,baseball_mlb,Nationals still uncertain on Scherzer status after injection HOUSTON (AP)   The Washington Nationals remain unsure about the health of pitcher Max Scherzer and catcher Kurt Suzuki heading into Game 6 of the World Series against Houston. Scherzer was scratched from his Game 5 start Sunday night because of nerve irritation near his neck and had a cortisone shot. Scherzer won the opener and hopes to be able to pitch in a Game 7 if the Nationals get that far. Houston won three in a row at Washington to take a...,0.1435967814299366,0.229428731251987,0.18651275634096182,0.20081808131130355
N22570,foodanddrink,foodnews,'Ghost kitchens' are taking over fast-food chains from Chick-fil-A to Wendy's Wendy's became the latest fast-food chain to name-check ghost kitchens on Friday at the company's investor day.,0.1437179999594148,0.2383744011775737,0.19104620056849425,0.2068222674381874
N29197,lifestyle,lifestylebuzz,Bella Hadid Is Named Most Beautiful Woman in the World -- How It Was Decided Beyonce and Amber Heard also made the list!,0.1440006958345884,0.2367394731126332,0.1903700844736108,0.20582654735328493
N5283,foodanddrink,foodnews,"For the first time ever, a US cheese is named best in the world Forget the American love affair with Cheez Whiz, blocks of Velveeta and pasteurized processed cheese food slices. An organic blue cheese from Oregon has been named the world's top cheese.",0.1440081280212598,0.2727065891379852,0.2083573585796225,0.22980710209907673
N30160,foodanddrink,tipsandtricks,How To Open a Can Without a Can Opener All it takes is a metal spoon and some elbow grease.,0.1442381107651076,0.2855877353401393,0.21491292305262344,0.23847119381512874
N56630,finance,markets,China asks WTO for $2.4 billion sanctions against U.S. in latest clash China asks WTO for $2.4 billion sanctions against U.S. in latest clash,0.1446264933860305,0.2605434940279731,0.2025849937070018,0.22190449381399224
N54225,news,newsus,"Multiple Houses on Fire After Plane Crashes in NJ At least two houses are on fire in Colonia, New Jersey, after a plane crash, according to the Colonia Fire Department. A Cessna 414 crashed into a home on Berkley Avenue at 11 a.m. Tuesday, according to the FAA. The FAA will conduct an investigation into the cause of the crash. The number of people aboard and their conditions are unknown. The area is a heavy residential area with tree-lined streets. News 4's Dennis Protsko, who is part of the...",0.1451183092033489,0.2551924828104672,0.20015539600690804,0.21850109160809442
N25785,sports,football_nfl,OJ Simpson suing Vegas hotel for defamation over 2017 TMZ story claiming 'belligerence' ,0.1454622549286873,0.1929071875835595,0.16918472125612338,0.17709221003193543
N18094,movies,movies-celebrity,"Michelle Pfeiffer initially blamed herself after #MeToo moment: 'I should've known' Michelle Pfeiffer is opening up about an uncomfortable and inappropriate moment with a ""high-powered"" industry person.",0.1458649015243753,0.2089308889474033,0.1773978952358893,0.1879088931397273
N2203,sports,baseball_mlb,"Off to the World Series, these Nationals have proved everyone wrong This unexpected joyride of a season could hold more promise yet.",0.1460042513552943,0.2515664455950878,0.19878534847519103,0.21637904751515663
N51180,finance,finance-companies,"Verizon to give its wireless customers a year of Disney+ Verizon announced Tuesday that it is teaming up with Disney to give new and existing 4G LTE and 5G wireless ""unlimited"" customers a free year of the new Disney+ streaming service. The exclusive promotion coincides with the Disney+ launch on Nov. 12. New Verizon FIOS and 5G Home Internet customers will also qualify for a year of Disney+.",0.146224340537267,0.2889401971732601,0.21758226885526355,0.24136824496126238
N64631,news,newsworld,"She fought for human rights on a tiny island that banned guns. Then she was shot dead. Rachelle Bergeron had been the only prosecutor in Yap, a Micronesian island about 550 miles southwest of Guam.",0.1464554007361288,0.2260607611277161,0.18625808093192245,0.199525640997187
N34399,foodanddrink,restaurantsandnews,Burger King's new 'Ghost Whopper' is here to haunt your Halloween order The Ghost Whopper will be available at 10 select restaurants beginning Oct. 24. The only thing scarier than Burger King's new Ghost Whopper is the thought of having no Whoppers at all.,0.1468595096960715,0.2517322619678726,0.19929588583197205,0.21677467787727223
N24294,news,newspolitics,"Giuliani Mixes His Business With Role as Trump's Lawyer It is an extraordinary time in Washington, but it is more or less business as usual for Rudolph W. Giuliani. He is a central figure in the impeachment inquiry. He is under scrutiny by federal prosecutors. But throughout the building controversy, Mr. Giuliani has continued to represent clients, broker deals and take on consulting contracts in Washington and around the world in ways that leave him subject to criticism that he is using...",0.1470006370418053,0.2391243496972577,0.19306249336953152,0.20841644547877355
