ID,category,sub_category,content,collaborative_rec,content_rec,mean,two_one
N42782,sports,baseball_mlb,Three takeaways from Yankees' ALCS Game 5 victory over the Astros The Yankees kept hope alive thanks to some impressive starting pitching and a pair of early home runs.,0.2110765435166021,0.2803833560754755,0.2457299497960388,0.2572810852225177
N55189,tv,tvnews,"'Wheel Of Fortune' Guest Delivers Hilarious, Off The Rails Introduction We'd like to solve the puzzle, Pat: Blair Davis' loveless marriage? On Monday, ""Wheel of Fortune"" welcomed as a new contestant trucking business owner Blair Davis, who offered a biting introduction for himself. When host Pat Sajak asked the man from Cardiff, California, about his family, Davis plunged into one of the darkest personal summaries the show has likely ever heard. ""I've been trapped in a loveless marriage for the last 12 years to an...",0.2278080293961264,0.2361714872762375,0.23198975833618196,0.23338366798286714
N18445,sports,football_ncaa,"Michigan sends breakup tweet to Notre Dame as series goes on hold Parting is such sweet sorrow, say the Wolverines.",0.2288127080208049,0.280696381339674,0.25475454468023945,0.26340182356671765
N63302,lifestyle,lifestylebuzz,"This Wedding Photo of a Canine Best Man Captures Just How Deep a Dog's Love Truly Is When Mark Doublet made his dog, Marley, the best man at his wedding, he took his duties very seriously, and a photo of them together has gone viral.",0.2312988234706195,0.2607506977995898,0.24602476063510464,0.2509334063565997
N34694,tv,tvnews,Rosie O'Donnell: Barbara Walters Isn't 'Up to Speaking to People' Right Now Rosie O'Donnell: Barbara Walters Isn't 'Up to Speaking to People' Right Now,0.2351704576418742,0.2591894638323042,0.2471799607370892,0.2511831284354942
N19347,news,newspolitics,"Former US Senator Kay Hagan dead at 66 Former U.S. Sen. Kay Hagan, a one-time Capitol Hill intern who went on to become North Carolina's first Democratic female senator, died Monday at her Greensboro home. She was 66.",0.2414704898162021,0.2709534680072893,0.2562119789117457,0.26112580861026025
N49749,sports,football_nfl,"'Unbelievable.' Chiefs fans stunned, mad after loss to the Titans What the heck happened? The Chiefs were lining up for a field goal that would have given them and eight-point lead late in Sunday's game against the Tennessee Titans in Nashville. The snap came before holder Dustin Colquitt was ready and he threw the ball away. Colquitt was called for intentional grounding and the Titans took over. They drove down the field for a touchdown, two-point ...",0.2499085877626081,0.2620271332386181,0.2559678605006131,0.2579876180799481
N31801,news,newspolitics,Joe Biden reportedly denied Communion at a South Carolina church because of his stance on abortion Joe Biden has a complicated history with the Catholic Church.,0.2710822523343091,0.2815359294448504,0.2763090908895798,0.2780513704080033
N45794,news,newscrime,"Four flight attendants were arrested in Miami's airport after bringing in thousands in cash, police say Four American Airlines flight attendants were arrested at the Miami International Airport and charged with money laundering after bringing large amounts of cash into the country, police said.",0.2833964103917993,0.3103463171301847,0.296871363760992,0.3013630148840562
N55199,news,newsus,Winter homeless shelter remains unopened after protests ,1.0,0.2799835968302764,0.6399917984151382,0.5199890645535176
N6940,finance,finance-career-education,"Kaiser Permanente CEO And Affordable Health Care Advocate Bernard J. Tyson Dies Health care provider Kaiser Permanente said Sunday its chairman and CEO, Bernard J. Tyson, has died unexpectedly at the age of 60.",1.0,0.2354475360230022,0.6177237680115011,0.4902983573486681
N18340,sports,basketball_nba,"Raptors end Lakers' 7-game winning streak in 113-104 victory LOS ANGELES (AP)   The centerpiece of the Toronto Raptors' championship team works at Staples Center now. Two more key components of last season's sublime roster got injured right before the Raptors arrived in Los Angeles for the reunion. In the opening weeks of life after Kawhi, the defending champs are learning they might be deeper than even they realized. They definitely had enough to hold off Staples' marquee tenants in a remarkable...",1.0,0.2495751104217238,0.6247875552108619,0.4997167402811492
N40147,sports,football_nfl,"Well, they'll take it: Shining light on the highs and lows from the Bears' win over the Lions on the Bear Download podcast Welcome to the Bear Download podcast. Listen below or subscribe and listen on iTunes | Spotify | Stitcher | Google Play Bears win! Well, yes, they did end their four-game losing streak with a 20-13 victory over the shorthanded Lions. But Rich and Dan break it all down and let some air out of the balloon -- not that much was in there to start. On the bright side, quarterback Mitch Trubisky ...",1.0,0.2972175833407712,0.6486087916703855,0.5314783888938475
N41222,news,newsworld,"Evo Morales of Bolivia Accepts Asylum in Mexico Evo Morales, the former president of Bolivia who resigned under pressure from street protests and the military, was granted asylum in Mexico on Monday, departing from the country at a time when it is deeply polarized and leaderless.",1.0,0.2755652195856641,0.6377826097928321,0.5170434797237761
N25142,entertainment,awards,"Robert Downey Jr. reassures fans he didn't die at 2019 E! PCAs Tony Stark has risen from the dead! The ""Iron Man"" star takes the stage to kick off the E! People's Choice Awards with a bang! Watch.",1.0,0.241970195627695,0.6209850978138475,0.49464679708513
N55528,lifestyle,lifestyleroyals,"The Brands Queen Elizabeth, Prince Charles, and Prince Philip Swear By Shop the notebooks, jackets, and more that the royals can't live without.",1.0,0.2694516459816499,0.6347258229908249,0.5129677639877666
N61572,sports,football_nfl,"Believe in 'Minkah Magic' as Fitzpatrick sparks Steelers' turnaround Discarded by the Dolphins after a little more than a season, Minkah Fitzpatrick is making a considerable difference for a surging Steelers team.",1.0,0.2904587480313518,0.6452293740156759,0.5269724986875679
N218,video,news,Bolivia protesters celebrate Morales' resignation Bolivian opposition protesters celebrated joyously in the streets of La Paz on Sunday evening after Bolivian President Evo Morales said he would resign following weeks of protests over a disputed election that has roiled the South American nation.,1.0,0.2791421632384114,0.6395710816192057,0.5194281088256076
N9739,sports,football_nfl_videos,Vikings edge Cowboys on 'SNF' Watch the Minnesota Vikings vs. Dallas Cowboys highlights from Week 10 of the 2019 season.,1.0,0.2930489616086144,0.6465244808043071,0.5286993077390763
N39983,news,newscrime,"NYPD Defends Officers In Arrest Of Illegal Food Vendor Despite criticism from some city officials, the NYPD says its officers acted properly in arresting a woman who was illegally selling churros inside a Brooklyn subway station. CBS2's Lisa Rozner reports",1.0,0.2587600337396093,0.6293800168698047,0.5058400224930728
N43567,news,newspolitics,"High-stakes televised impeachment hearings set for next week William Taylor, the top diplomat in Ukraine, will testify, and Republicans hope to hear from Hunter Biden and the anonymous whistleblower.",1.0,0.2802809228495341,0.640140461424767,0.5201872818996893
N413,news,newsscienceandtechnology,"Google Maps lets you manage your public profile from the Android app Google Maps increasingly thrives on user contributions to fill in details, but you haven't had the option to manage your public profile from the phone app you're probably using to make those contributions. That's a bit backwards, but Google is thankfully setting things right. An updated version of the Android app lets you manage your profile from a new ""your profile"" item in the side menu.",1.0,0.3149264956625275,0.6574632478312638,0.543284330441685
N208,sports,football_nfl,Five winners and five losers as the Dallas Cowboys drop a heartbreaker to the Minnesota Vikings A tough loss to swallow for the Cowboys.,1.0,0.2626751311638317,0.6313375655819158,0.5084500874425544
N27974,weather,weathertopstories,"Colder Temperatures And A Wintery Mix Expected Monday First on Fox, we begin tonight on the winter watch today`s fall feel giving way to winter in a hurry, and that means getting prepared for the quick change in seasons, and that means some snow. Fox 2/News 11`s Blair Ledet begins our coverage.",1.0,0.2994586812290727,0.6497293406145364,0.5329724541527151
N6379,news,newscrime,"California cops respond to 2 homeless men shot with arrows: report Two homeless men living at an encampment near San Francisco were shot with arrows early Sunday in an attack that was not random, a report said.",1.0,0.260168818538093,0.6300844092690465,0.5067792123587287
N5,sports,icehockey_nhl,"Even David Pastrnak's slumps are superstar caliber for Bruins Guess David Pastrnak isn't going to score 82 goals and accumulate 164 points this season. Or at least he's not on pace to do anymore. After scoring 15 goals and adding 15 assists through the Bruins' first 15 games, Pastrnak had gone two games without a point after he was blanked in Boston's 3-2 shootout loss to Philadelphia at TD Garden on Sunday. Oh the humanity! But here's where things stand in the 23-year-old sniper's career. Gone are the...",1.0,0.283883108658239,0.6419415543291195,0.5225887391054926
N20831,sports,soccer_mls,"New buzz on possibility of Major League Soccer in Charlotte Charlotte appears to be in the driver's seat for Major League Soccer's 30th franchise. MLS Commissioner Don Garber mentioned Charlotte as one of three cities in the running at Friday's State of the League press conference. ""It is very likely that we'll announce [the] team 30 in the next number of months,"" Garber said. Garber acknowledged Charlotte, Phoenix and Las Vegas as cities in the mix for expansion. ""It's fair to say that Charlotte has...",1.0,0.2967876402369409,0.6483938201184705,0.5311917601579605
N5497,news,newsus,"Still teaching at 95, Jimmy Carter draws devotees to church PLAINS, Ga. (AP)   The pilgrims arrive early and from all over, gathering hours before daybreak in an old pecan grove that surrounds a country church. They come, they say, for a dose of simple decency and devotion wrapped up in a Bible lesson. The teacher is the 39th president of the United States, Jimmy Carter. Nearly four decades after he left office and despite a body that's failing after 95 years, the nation's oldest-ever ex-president still...",1.0,0.2852950391208572,0.6426475195604286,0.5235300260805714
N13019,video,lifestyle,"Still teaching at 95, Jimmy Carter draws devotees to church Former President Jimmy Carter can still draw a crowd, and he does each time he teaches Sunday school in his hometown of Plains, Georgia. (Nov. 11)",1.0,0.2876166464642359,0.6438083232321179,0.5250777643094906
N31581,news,newsus,"Man killed in single-car crash after having medical emergency behind the wheel A 52-year-old man was killed after he had a medical emergency behind the wheel. The Missouri State Highway Patrol said Jeffery T. Gregory was driving on Missouri Highway 79 near the intersection of East Terra Lane Sunday afternoon at around 12:45 when he had a medical emergency. The crash report said the car drove off the left side of the road, ended up on East Terra Lane and flipped before slamming into a concrete median. He was pronounced dead...",1.0,0.2551554574606421,0.627577728730321,0.5034369716404281
N10311,news,newsworld,"Turkish army takes CNN inside Syria's safe zone A month after Turkey launched its operation into northern Syria, major combat operations around the town of Tal Abyad may have ended, but the battle for this part of Syria is far from over. CNN's Jomana Karadsheh reports.",1.0,0.2964774342679053,0.6482387171339526,0.5309849561786035
N5027,news,newsscienceandtechnology,NEW DETAILS: Wright Brothers airport eyes growth as upgrades continue Dayton-Wright Brothers Airport is in the midst of what is expected be more than $4 million in investments as it broadens its regional reach.,1.0,0.3322383480898117,0.6661191740449058,0.5548255653932077
N64760,news,newsoffbeat,"Supermarket magnate John Catsimatidis offers $1,000 reward in case of possible Queens cat poisonings It might take Cats to catch a heartless feline killer. Supermarket mogul and one-time mayoral hopeful John Catsimatidis is offering a $1,000 reward for information on a suspected cat killer who animal rights activists believe is poisoning feral felines in Queens. Catsimatidis announced the reward on his Cats Roundtable radio show Sunday morning during a segment with Guardian Angels ...",1.0,0.2809647718791241,0.6404823859395621,0.5206431812527494
N43432,news,newsus,"US Forest Service shuts down vandalized Georgia park feature GAINESVILLE, Ga. (AP)   The U.S. Forest Service says vandalism is forcing it to shut down a popular fall leaf viewing destination in Georgia. The agency posted photos to Facebook on Friday showing a wooden platform covered in white spray paint overlooking the mountainous north Georgia landscape at Chattahoochee-Oconee National Forests.",1.0,0.3084110727620091,0.6542055363810045,0.5389407151746727
N17258,news,newsscienceandtechnology,Realme takes chunk of India mobile market as Samsung slides Over 400 percent more phones shipped year-on-year,1.0,0.291667327426342,0.645833663713171,0.527778218284228
N23858,sports,golf,"Young Northeast Florida fans flock to U.S. women's soccer When the U.S. women's national soccer team arrived in Jacksonville for a final exhibition match to conclude their 2019 Victory Tour at TIAA Bank Field against Costa Rica Sunday night, area fans were waiting for them. Although the suspense was low, since the U.S. women's national team has put up an impressive 14-0-0 all-time record against Costa Rica, soccer fans from far and wide showed out to ...",1.0,0.3085815244027824,0.6542907622013912,0.5390543496018549
N16909,weather,weathertopstories,"Adapting, Learning And Soul Searching: Reflecting On Woolsey Fire Woolsey Fire Anniversary: A community is forever changed by the largest blaze in county history, a harbinger of the catastrophic fire era.",1.0,0.2614643615802734,0.6307321807901367,0.5076429077201823
N47585,lifestyle,lifestylefamily,Family says 13-year-old Broadway star died from massive asthma attack ,1.0,0.2394027277597442,0.6197013638798721,0.49293515183982944
N7482,sports,more_sports,"St. Dominic soccer player tries to kick cancer to the curb Sometimes, what happens on the sidelines can be even more important than what happens on the field. That was the case recently for the improving St. Dominic boys soccer team. ""We're led by some great seniors and they're learning a lot,"" said head soccer coach Greg Koeller. Since 2000, the Crusaders have won five state titles. And if that wasn't enough motivation, they have players who provide inspiration. Like No. 2, Clay North. ""Clay is just an...",1.0,0.2984229384076917,0.6492114692038459,0.5322819589384611
N3411,sports,basketball_ncaa,"Aldermen, Parents And Players Hope SLPS Will Reconsider Roosevelt Coach Termination New tonight, the Roosevelt High School football coach was fired for contacting players through social media. But theres a push to have him re-instated. Fox 2/News 11s Jeff Bernthal was live with why several St. Louis aldermen want the district to re-consider the coachs termination.",1.0,0.2769734877729682,0.6384867438864841,0.5179823251819788
N5171,news,elections-2020-us,Still a chance? 2020 longshots insist race is up for grabs Bernie Sanders rallied hundreds of supporters outside the New Hampshire capital when the senator formally filed to compete in the state's first-in-the-nation presidential primary.,1.0,0.30016718694501,0.650083593472505,0.5334447912966733
N241,finance,finance-companies,"Are Stores Open on Veterans Day? Target, Aldi, Walmart and More Will shoppers be able to make the most of Veterans Day deals this public holiday?",1.0,0.3168240844701063,0.6584120422350531,0.5445493896467375
N20332,news,newsworld,"Langfords, 100 members of Mormon families leave Mexico after ambush David Langford and his hero son, Devin, who helped save his siblings, are leaving Northwest Mexico, where Mormons lived for decades before drug cartels encroached.",1.0,0.2566611107507527,0.6283305553753764,0.5044407405005018
N19639,health,weightloss,50 Worst Habits For Belly Fat These seemingly harmless habits are holding you back and keeping you from shedding that unwanted belly fat for good.,1.0,0.3019675109122691,0.6509837554561345,0.5346450072748461
N61837,news,newsworld,"The Cost of Trump's Aid Freeze in the Trenches of Ukraine's War Lt. Ivan Molchanets peeked over a parapet of sand bags at the front line of the war in Ukraine. Next to him was an empty helmet propped up to trick snipers, already perforated with multiple holes.",1.0,0.2670777342204753,0.6335388671102377,0.5113851561469835
N38324,health,medical,"How to Get Rid of Skin Tags, According to a Dermatologist They seem harmless, but there's a very good reason you shouldn't ignore them. The post How to Get Rid of Skin Tags, According to a Dermatologist appeared first on Reader's Digest.",1.0,0.3454041971001682,0.6727020985500841,0.5636027980667788
N2073,sports,football_nfl,Should NFL be able to fine players for criticizing officiating? Several fines came down against NFL players for criticizing officiating this week. It's a very bad look for the league.,1.0,0.2802574522238485,0.6401287261119243,0.520171634815899
N49186,weather,weathertopstories,"It's been Orlando's hottest October ever so far, but cooler temperatures on the way There won't be a chill down to your bones this Halloween in Orlando, unless you count the sweat dripping from your armpits.",1.0,0.2874099786145736,0.6437049893072868,0.524939985743049
N59295,news,newsworld,"Chile: Three die in supermarket fire amid protests Three people have died in a supermarket fire as angry protests in Chile entered their seventh day, the mayor of capital city Santiago said on Sunday.",1.0,0.2763529972915973,0.6381764986457986,0.5175686648610649
N15962,sports,football_nfl,"Ravens Coach Harbaugh: Michael Pierce's X-Rays Negative After Ankle Injury, No Timetable On Return Coach John Harbaugh said the x-rays on his ankle came back negative, but there is no clear timetable on his return.",1.0,0.2868455393122331,0.6434227696561166,0.5245636928748221
N28814,sports,basketball_ncaa,"Christyn Williams delivers all-around performance to fuel stilted UConn offense On a day when UConn's offense often felt stilted and stagnant, the Huskies turned to one player more than any other for scoring, playmaking and a general positive presence. Sophomore Christyn Williams was efficient Sunday, converting 10 of 17 field-goal attempts. She was consistent, with at least one field goal in all four quarters and at least two rebounds in three of the four. And she was ...",1.0,0.2685386586341745,0.6342693293170872,0.5123591057561163
N47850,news,newsus,"Texas teacher free on bond after assaulting a student A Texas teacher is free on bond tonight, after her arrest for assaulting a student. Her violent outburst was captured on cell phone video. Meg Oliver reports.",1.0,0.2908533673595798,0.64542668367979,0.5272355782397198
N52046,sports,racing,NASCAR championship standings 2019: Final 4 drivers set for Cup Series title race at Homestead Three Joe Gibbs Racing drivers will be competing with a Stewart-Haas Racing driver for a championship on Nov. 17.,1.0,0.3299450650005086,0.6649725325002542,0.553296710000339
N4219,sports,icehockey_nhl,"In USA vs. Canada hockey, the winners are women At the end, what didn't matter was the score. What mattered most was the game. Playing ice hockey hard and fast. Some of the highest level hockey in the world, played by women. Even the players in Sunday's second sold-out exhibition game between the national women's teams of the United States and Canada   the best female players in the world and the biggest rivals   had stressed a higher purpose to this past week's joint training camp that put...",1.0,0.2809505404497903,0.6404752702248951,0.5206336936331935
N31089,news,newsus,Thief steals thousands from couple during wedding reception Emma and Chris Cox's picture-perfect wedding day was tarnished when a thief swiped a gift bag filled with thousands in cash. The brazen heist was caught on surveillance cameras.,1.0,0.2519929238466818,0.6259964619233409,0.5013286158977879
N41479,sports,basketball_nba,"Scouting report: Rockets vs. Pelicans When/where: 7 p.m. Monday/Smoothie King Center TV/radio: AT&T SportsNet/790-AM; Spanish: 850 AM/101.7 FM So far: Rockets 6-3, Pelicans 2-7 Lately: The Rockets have a three-game winning streak, their longest of the season, after beating the Bulls in Chicago on Saturday. The Pelicans picked up their second win of the season Saturday in Charlotte. Scouting the Rockets In the past six games against the Pelicans, the Rockets have outscored New...",1.0,0.2835547117825401,0.64177735589127,0.5223698078550267
N54299,sports,baseball_mlb,"Column: Baseball's hot stove league could use an NBA-style spark after the slow pace of the last few offseasons When discussing teams' interest in free agent Bryce Harper last year at the general managers meetings, agent Scott Boras cautioned that many suitors would be playing it cool over the winter. ""It's not a regatta,"" Boras said. ""It's a submarine race."" The submarine race finally ended more than three months later, during spring training, with Harper signing a record 13-year, $330 million deal ...",1.0,0.2628155726383634,0.6314077863191817,0.5085437150922423
N24301,sports,football_nfl,"10 biggest disappointments of NFL Week 10 From quarterback play to special teams disasters, there was plenty of disappointment to go around in Week 10 of the NFL.",1.0,0.2640645802614013,0.6320322901307006,0.5093763868409342
N15236,finance,finance-real-estate,"Only 1 World City Charges More Than NYC Per Foot Of Apt Space The amount New Yorkers pay per square foot of real estate is much higher than almost anywhere else in the world, a recent report shows.",1.0,0.3002305514484923,0.6501152757242461,0.5334870342989948
N3354,sports,more_sports,NCDPS: Juveniles who escaped from N.C. development center may be in Hickory area ,1.0,0.2958413315537899,0.647920665776895,0.5305608877025265
N35584,travel,travelnews,"Veterans gather, share stories at Brick Store Museum exhibit ahead of American Legion Centennial The Brick Store Museum in Kennebunk held an open house for veterans Sunday in celebration of the American Legion's centennial anniversary. At the museum, a new exhibit looks back at 100 years of history between the town of Kennebunk and the Webber-Lefebvre American Legion Post 74. The exhibit displays various artifacts, historical documents, military uniforms and photos on loan from the post. Sign up for our Newsletters The American Legion is...",1.0,0.3002755624739218,0.6501377812369609,0.5335170416492812
N21106,sports,football_nfl,"Patriots: CB Stephon Gilmore's dominance has had much to do with New England being 8-1 The Patriots headed into their bye week after their first loss of 2019. At 8-1, however, there's been much more good than bad this season, so far. When the team returns for Week 11, they'll still be in the driver's seat for the AFC's No. 1 seed. The schedule won't be easy -- Philadelphia, Dallas, Houston and Kansas City -- but we'll see if the Patriots can regain their form from the first ...",1.0,0.2951175717353818,0.6475587858676909,0.5300783811569212
N8371,sports,football_nfl,"Rams' fake punt goes horribly wrong, Steelers get pick Nothing seems to be working for the Rams against the Steelers, and this fake punt attempt was no exception.",1.0,0.2696620038130711,0.6348310019065355,0.5131080025420474
N56061,sports,football_nfl,9 things we learned from Sunday's games of Week 10 of NFL season ,1.0,0.2602472804528852,0.6301236402264426,0.5068315203019235
N14622,news,newscrime,"Family asks for help in solving May cold case Friends and family of a murder victim is asking the community for answers. Corey Johnson, 27, was gunned down on 18th and West Main Streets on May 21. His sister, Monique Johnson, says she has not heard anything from police as far as leads or suspects. Johnson is asking that if someone knows information regarding her brother's murder to come forward. ""I'm just pleading for the public, anyone who knows anything please speak,"" she said. Johnson's...",1.0,0.2648988120242335,0.6324494060121167,0.509932541349489
N13341,news,newsus,"Rising temperatures put U.S. troops at risk during training, report finds By midcentury, troops could face an extra month of heat-index temperatures above 100 F every year, the Union of Concerned Scientists found.",1.0,0.3058061862397375,0.6529030931198687,0.537204124159825
N50451,news,newsus,"Police: Man killed in crash, fire in Pleasant Ridge A man is dead after a car crash turned into a fire in Pleasant Ridge late Sunday night. The crash happened around 10:30 p.m. on Ridge and Montgomery Road. Sign up for our Newsletters Police said emergency crews at the scene found the driver trapped in the car. Officials said the driver crashed into a utility pole causing the car to burst into flames. The driver later died from his injuries. Investigators said they believe the driver was speeding...",1.0,0.2708690392007143,0.6354345196003571,0.5139126928004762
N40065,sports,more_sports,"The Day in Sports: Sunday, November 10, 2019 The Day in Sports: Sunday, November 10, 2019",1.0,0.2801061294596305,0.6400530647298153,0.520070752973087
N17301,sports,football_nfl,Kirk Cousins responds to narrative about not being able to beat winning teams Cousins helped deliver a huge win for the Vikings over the Cowboys Sunday night.,1.0,0.2777503374257893,0.6388751687128946,0.5185002249505262
