ID,category,sub_category,content,collaborative_rec,content_rec,mean,two_one
N34418,sports,soccer_epl,"How the Sounders won MLS Cup Mark, Jeremiah and Casey were so excited they did a postgame podcast.",1.0,0.2801352887892455,0.6400676443946227,0.5200901925261636
N56193,sports,football_nfl,Cowboys have questionable red zone calls in loss to Vikings ,1.0,0.2771793848270778,0.6385896924135389,0.5181195898847185
N33435,lifestyle,lifestylefamily,"Four siblings, all veterans, celebrate Veterans Day in DC Those who pay a visit to the solemn World War II Memorial will come across inscriptions, excerpts of speeches from leaders honoring those who laid down their lives for this country.",1.0,0.288026413663513,0.6440132068317566,0.5253509424423419
N10529,sports,football_nfl,Week 10 Game Balls: Few Bright Spots in Colts Dismal Showing against Dolphins ,1.0,0.2647603052363089,0.6323801526181545,0.5098402034908726
N39850,lifestyle,lifestylebuzz,"Veterans Day event in Jeffersontown brings out the town and the Ladies for Liberty At a Veterans Day observation service in Jeffersontown Veterans Memorial Park Sunday, several hundred people gathered.",1.0,0.2692240361236624,0.6346120180618312,0.5128160240824415
N44276,autos,autossports,Best Sports Car Deals for October ,1.0,0.2970817503330625,0.6485408751665312,0.531387833555375
