ID,category,sub_category,content,collaborative_rec,content_rec,mean,two_one
N47401,foodanddrink,tipsandtricks,"Your turkey timeline: what to do and when for the perfect holiday roast Most people only cook a turkey once or twice a year which inevitably turns the whole thing into a stressful experience, full of paranoia that the bird will turn out dry. But fear not! Our fail-safe turkey timeline will take you all the way from ordering through to what to do with the leftovers.",1.0,0.2861931385922015,0.6430965692961008,0.5241287590614676
N41578,lifestyle,lifestyleroyals,Meghan Markle Chose a Chic Black Ensemble for Remembrance Sunday Services She paired her outfit with a bold hat and a crimson poppy pin.,1.0,0.233811311669101,0.6169056558345505,0.489207541112734
N56051,lifestyle,lifestyleroyals,"Meghan Markle and Prince Harry Reunite with Kate Middleton and Prince William for Remembrance Service Meghan Markle, Harry Reunite Kate and William at Remembrance Day",1.0,0.2276715635477314,0.6138357817738657,0.4851143756984876
N36532,weather,weathertopstories,Winds fan ferocious fires in Australia's most populous state Ferocious wildfires were burning at emergency-level intensity across Australia's most populous state and into Sydney's suburbs on Tuesday as authorities warned most people in their paths that there was no longer time to flee.,1.0,0.2566012558249947,0.6283006279124974,0.5044008372166631
N14592,entertainment,entertainment-celebrity,"Chrissy Teigen's weekend was basically a clapback double-header, plus more news Chrissy Teigen gives us two more lessons in the art of the clapback. Plus, more celebrity news for Nov. 12, 2019.",1.0,0.2306935785096998,0.6153467892548499,0.48712905233979986
N64745,sports,baseball_mlb,"With latest sign-stealing revelations, Houston Astros once again toe baseball's ethical lines Accused of electronically stealing signs in 2017, the Astros organization faces even more questions about its culture.",1.0,0.2463992642142703,0.6231996321071351,0.49759950947618015
N22417,travel,travelarticle,Divers salvage 100-year-old liquor from WWI shipwreck A team of ocean explorers says it has retrieved cognac and liqueur from a ship that was bound for Russia when it was sunk by a German submarine in 1917.,1.0,0.2799771713142955,0.6399885856571478,0.519984780876197
N25406,autos,autossuvs,We Test the 2020 Jeep Wrangler EcoDiesel Jeep's diesel engine turns a great off-roader into something special.,1.0,0.2809961755717556,0.6404980877858778,0.520664117047837
N26706,news,newsus,Missing California hiker found dead at top of glacier just weeks before baby was due A missing hiker from Huntington Beach California was found dead on Thursday at the top of the Darwin glacier in the Inyo National Forest.,1.0,0.241041122043373,0.6205205610216865,0.494027414695582
N47099,foodanddrink,tipsandtricks,"This Korean Ingredient Makes Your Chili Taste Amazing As in, more amazing than it already is.",1.0,0.2864036789583445,0.6432018394791723,0.524269119305563
N12995,news,newsus,"Cows swept out to sea by Hurricane Dorian are found months later   on the Outer Banks CHARLOTTE, N.C. - Cape Lookout National Seashore on the Outer Banks has discovered three cows are roaming the national park, and it is believed they got there by swimming four to five miles across the Core Sound during Hurricane Dorian. All three were living on Cedar Island when the hurricane generated a ""mini tsunami"" on Sept. 6, sweeping much of the wildlife off the island, including 28 wild ...",1.0,0.2666155334101283,0.6333077667050642,0.5110770222734189
N49030,movies,movies-celebrity,"Kevin Hart Steps Out for Date Night With Wife Amid Recovery From Car Accident Kevin Hart is in better spirits following the violent car crash that left him hospitalized in September. Last night, he was spotted out with his wife for date night in Los Angeles.",1.0,0.2521713941680851,0.6260856970840425,0.5014475961120567
N40065,sports,more_sports,"The Day in Sports: Sunday, November 10, 2019 The Day in Sports: Sunday, November 10, 2019",1.0,0.2633861664568671,0.6316930832284335,0.5089241109712447
N29196,health,health-news,"Florida boy's mock CPR drill goes viral: 'How cute is this!' The saying ""the apple doesn't fall far from the tree"" rings very true for a 3-year-old Florida boy who apparently wants to be just like his father, a first responder.",1.0,0.2345689844845381,0.6172844922422691,0.4897126563230254
N42977,news,newsus,"'It's not over': Sarah Palin says she is fighting to repair her marriage Former Alaska Gov. Sarah Palin said she learned her husband, Todd, wanted a divorce in an email from his lawyer and that the two are seeking counseling.",1.0,0.2414285021860656,0.6207142510930328,0.49428566812404373
N37320,news,newspolitics,"Pro-Trump conservatives are getting trolled in real life by a far-right group Groypers, as they call themselves, fuse online political extremism with stunts at conservative events.",1.0,0.2324332851205541,0.6162166425602771,0.48828885674703604
N51808,news,newspolitics,"Democrats' impeachment lawyer cut his teeth prosecuting mobsters, Wall Street cheats Daniel Goldman will lead witness questioning during the hearings that begin Wednesday.",1.0,0.2230645044380838,0.6115322522190418,0.4820430029587225
N26944,news,newsus,"Jeffrey Epstein's Estate May Set Up a Program to Pay Accusers Lawyers for Jeffrey Epstein's estate are considering setting up a program to resolve claims filed by women who say they were abused by the financier, who killed himself in August while facing federal sex trafficking charges. The plan was disclosed in a court filing on Tuesday by a lawyer for one of Mr. Epstein's accusers, who is suing the estate in federal court in Manhattan. The filing said lawyers for Mr. Epstein's estate had informed...",1.0,0.255347789581473,0.6276738947907365,0.5035651930543152
N13341,news,newsus,"Rising temperatures put U.S. troops at risk during training, report finds By midcentury, troops could face an extra month of heat-index temperatures above 100 F every year, the Union of Concerned Scientists found.",1.0,0.2819991286848582,0.6409995643424291,0.5213327524565721
N58241,finance,markets,"The Dow was perfectly unchanged on Tuesday, a rare occasion on Wall Street The 30-stock average closed flat going out at least six decimal places. It was the first unchanged close for the Dow since April 24, 2014.",1.0,0.2711854774657729,0.6355927387328865,0.5141236516438485
N35131,finance,markets,"The world's largest trade deal could be signed in 2020 RCEP involves all 10 ASEAN countries and five of the bloc's major trading partners: Australia, China, Japan, New Zealand and South Korea.",1.0,0.3113371897407245,0.6556685948703622,0.5408914598271497
N46477,movies,movienews,Mark Ruffalo Wants to Set Up Jennifer Aniston on a Date Mark Ruffalo Wants to Set Up Jennifer Aniston on a Date,1.0,0.2371843313881438,0.6185921656940719,0.4914562209254292
N35850,news,newsus,U.S. Judge Blocks 'Suspicionless' Searches of Phones at Borders A federal judge rejected a Trump administration policy allowing agents at U.S. border crossings and airports to arbitrarily search the phones and laptops of international travelers.,1.0,0.258176530532418,0.629088265266209,0.5054510203549454
N47248,finance,markets,"Fed's Powell sees steady growth, signals pause in rate cuts Federal Reserve Chairman Jerome Powell expects the U.S. economy to continue growing at a solid pace, though it still faces risks from slower growth overseas and trade tensions.",1.0,0.2726910869122886,0.6363455434561442,0.5151273912748591
N13907,finance,finance-saving-investing,4 reasons you shouldn't max out your 401(k) Making high-dollar contributions to your 401(k) can cost you.,1.0,0.2958133177778655,0.6479066588889327,0.5305422118519103
N31679,entertainment,celebrity,Biggest celeb weddings of the last decade Take a look back at the most memorable and extravagant celeb weddings that went down in the 2010s.,1.0,0.2585479981427578,0.6292739990713789,0.5056986654285052
N56193,sports,football_nfl,Cowboys have questionable red zone calls in loss to Vikings ,1.0,0.2241589109669003,0.6120794554834501,0.4827726073112668
N61320,lifestyle,lifestyleroyals,Kate Middleton Wore a Simple Black Dress and Embellished Headband to the Festival of Remembrance The Duchess of Cambridge and the rest of the royal family are honoring those who have died in battle this weekend.,1.0,0.2387245739505711,0.6193622869752855,0.49248304930038067
N36436,news,newsphotos,"The 12 Texas cities everyone in the country is moving to Texas' largest cities were at the top of the list, as well as Midland, a major hub of the fracking boom.",1.0,0.273676971079405,0.6368384855397025,0.51578464738627
N51587,travel,traveltripideas,"The 24 Most Beautiful Castles in Europe Eat your heart out, Disney.",1.0,0.2582944482439131,0.6291472241219566,0.5055296321626087
N64560,sports,basketball_nba,"Report: Knicks' brass will stay on if team shows 'progress' this season The New York Knicks' front office appears to be safe for now. Owner James Dolan met with president of basketball operations Steve Mills and others in management on Monday. The Knicks' brass left with the impression that their jobs would be secure as long as the team ""showed progress"" this season, league sources told SNY's Ian Begley. However, it's unclear what Dolan deems as ""progress,"" reports Begley. Mills and general manager Scott Perry are...",1.0,0.2565843702957532,0.6282921851478767,0.5043895801971687
N33677,tv,tv-celebrity,Marie Osmond 'chipped off a piece' of her kneecap when she fell on stage during performance Marie Osmond reveals that she chipped her knee when she fell during her Las Vegas residency performance last week.,1.0,0.2613058556228192,0.6306529278114096,0.5075372370818795
N57327,lifestyle,lifestylebuzz,Please Don't Yell at Your Dog! A new study shows it can cause long-term psychological impacts.,1.0,0.2785172419020437,0.6392586209510218,0.5190114946013624
N49712,news,newsgoodnews,"Wisconsin bus driver saves children wandering in snow, as deadly Arctic air mass grips US As bitter cold took hold across the Midwest earlier this week, a sharp-eyed bus driver in Wisconsin was credited with helping rescue two children who were very underdressed for the weather conditions.",1.0,0.2478052791153813,0.6239026395576907,0.4985368527435875
N19376,sports,basketball_nba,The HoopsHype Daily: Trae Young putting up monstrous numbers ,1.0,0.2581741310674204,0.6290870655337102,0.5054494207116136
N58020,foodanddrink,beverages,Brooklyn Brewery Shows Craft Beer Can Be Nonalcoholic Too Special Effects hits all the notes of a craft brew with none of the alcohol,1.0,0.2586244418795614,0.6293122209397807,0.5057496279197076
N4913,finance,finance-companies,Don't be fooled: Costco says $75 coupon is a scam Wholesale retailer Costco is warning customers about a new scam that is promising shoppers a $75 coupon.,1.0,0.2879456565004186,0.6439728282502093,0.5252971043336123
N43670,sports,basketball_nba,"Draymond criticizes official for ejection: 'Don't tell me not to talk' Golden State Warriors forward Draymond Green made Chase Center history during Monday's loss to the Utah Jazz, becoming the first player ejected from a game in the new venue after arguing with an official. The three-time All-Star was given a second technical foul for continuing to plead his case after disagreeing with a blocking call, but it seems Green's spat with the official went beyond just that foul. ""I disagreed with that call,"" Green told...",1.0,0.2303748560032966,0.6151874280016483,0.4869165706688644
N58553,lifestyle,lifestyleroyals,"Prince Harry and Meghan Markle Will Reportedly Visit Oprah While in California During their six-week break from their royal duties, Prince Harry and Meghan Markle are planning to visit Oprah Winfrey, according to a royal insider.",1.0,0.2380738987349951,0.6190369493674975,0.4920492658233301
N9652,finance,finance-real-estate,"NYC is selling 'air rights' to city housing buildings, first big deal goes to de Blasio donors It may not be a bridge, but the city has something to sell you in Brooklyn   and donors to Mayor de Blasio are first in line to benefit. In what appears to be a textbook ""pay-to-play"" move, the city is selling NYCHA development rights to builders who gave de Blasio's campaigns more than $20,000.",1.0,0.2599885653435164,0.6299942826717582,0.5066590435623443
N38309,tv,tv-celebrity,Joe Giudice Says It Was 'Painful' Watching Real Housewives of New Jersey from Prison Joe Giudice Says It Was 'Painful' Watching RHONJ from Prison,1.0,0.2501854730062269,0.6250927365031135,0.5001236486708179
N15855,lifestyle,lifestyleroyals,"A body-language expert says Meghan Markle is ""politely disconnecting"" from the public, and honestly, we would too Can we blame her? Meghan Markle is supposedly ""politely disconnecting"" from the public as seen in her body language, and girl, you do you.",1.0,0.2227500012979348,0.6113750006489674,0.4818333341986232
N7821,sports,football_nfl,"'Monday Night Football' commentator under fire after belittling criticism of 49ers kicker for missed field goal Joe Tessitore called out 49ers kicker Chase McLaughlin after he shanked a potential game-winning kick in San Francisco, and some fans weren't happy.",1.0,0.2146408399896192,0.6073204199948096,0.47642722665974613
N241,finance,finance-companies,"Are Stores Open on Veterans Day? Target, Aldi, Walmart and More Will shoppers be able to make the most of Veterans Day deals this public holiday?",1.0,0.2739416779854999,0.63697083899275,0.5159611186569999
N48064,news,newsworld,"Why Ukraine and Russia are still at war A long and draining war in eastern Ukraine has become embroiled in President Trump's attempts to undermine his opponents at home. But the war is real and still taking lives, and a way to end it will be very difficult to find.",1.0,0.2494963347998882,0.6247481673999441,0.49966422319992543
N60932,tv,tv-celebrity,Lamar Odom's Son Was ''Hurt'' After Finding Out About His Dad's Engagement on Instagram Lamar Odom's son admits that he was ''hurt and caught off guard'' after finding out about his dad's engagement to Sabrina Parr on Instagram.,1.0,0.2382466252442701,0.619123312622135,0.4921644168295134
N17896,autos,autossuvs,"Should Chevy Bring This Three-Row Blazer to the U.S.? It's set to go on sale in China soon, but we could see this bigger Blazer doing well in America, too.",1.0,0.2719530602308074,0.6359765301154037,0.5146353734872049
N25722,news,newspolitics,"Rex Tillerson denies he tried to undermine Trump, says Nikki Haley was 'rarely present' at meetings The former secretary of state refuted Haley's claims contained in a new book and says he remains proud of his tumultuous time in the Trump administration.",1.0,0.2247115206108416,0.6123557603054208,0.48314101374056106
N44818,sports,football_nfl,Redskins name rookie Dwayne Haskins starter for rest of season ,1.0,0.2501894550305105,0.6250947275152552,0.5001263033536736
N51896,health,fitness,"Watch the 'Footloose' Dance Warmup That Gets These High Schoolers Ready to Race They tear up the course before, well, tearing up the course.",1.0,0.2552885385167575,0.6276442692583788,0.503525692344505
N36252,finance,markets,Oil rises after OPEC's Barkindo says U.S. shale growth may slow in 2020 Oil rises after OPEC's Barkindo says U.S. shale growth may slow in 2020,1.0,0.2762445134701609,0.6381222567350804,0.5174963423134405
N52600,finance,finance-companies,"Saudi Aramco takes another step toward 1st public offering DUBAI, United Arab Emirates (AP)   Saudi Arabia's state-owned oil giant Aramco revealed it will sell up to 0.5% of its shares to individual investors, but in a lengthy document published late Saturday it did not disclose how much of the company will be floated when it goes public on the country's domestic exchange.",1.0,0.2949671248705061,0.6474835624352531,0.529978083247004
N54161,news,newsus,"Berliners tried to send Trump a piece of the Berlin Wall with a message saying 'no wall lasts forever' The 2.7-ton chunk of concrete arrived in Washington, DC, on Saturday, and local media outlets reported that the Secret Service turned it away.",1.0,0.2292142250325207,0.6146071125162603,0.48614281668834713
N60408,weather,weathertopstories,"Over 20 inches of snow for some Michigan communities in 24 hours! Significant amounts of snow fell within a meandering lake-effect snow band overnight into Tuesday morning across parts of the southwestern Lower Peninsula of Michigan, resulting in up to and over 2 feet in some locations... and that's where AccuWeather's Blake Naftel took in some of the snowy spectacles as people begun to dig out.",1.0,0.2837571336641807,0.6418785668320903,0.5225047557761204
N25138,sports,football_ncaa,"College Football Playoff picture: 4 in, 2 out, 5 to watch Sporting News takes a look at the College Football Playoff picture heading into Week 12 of the season.",1.0,0.2695815695283039,0.634790784764152,0.5130543796855359
N63550,lifestyle,lifestyleroyals,Why Kate & Meghan Were on Different Balconies for Remembrance Sunday There's no scandal here. It's all about the order of precedence.,1.0,0.2206987785223392,0.6103493892611696,0.48046585234822614
N36621,news,newspolitics,Mulvaney's move to join impeachment testimony lawsuit rankles Bolton allies Former national security adviser John Bolton views the acting White House chief of staff as a key participant in the administration's effort to pressure Ukraine.,1.0,0.2317167628719413,0.6158583814359706,0.4878111752479608
N15506,news,newsworld,"Trump 'so extreme' on climate he's waking people up, Greta Thunberg tells AFP Swedish teen activist Greta Thunberg said Tuesday that US President Donald Trump's climate change denialism was ""so extreme"" that it had helped galvanize the movement to halt long term planetary warming. The venue was originally in Chile but was shifted because of political unrest, forcing Greta to change her travel plans.",1.0,0.2334274800699546,0.6167137400349773,0.4889516533799697
N54482,lifestyle,lifestylebuzz,"Mixed-race mother reveals strangers question whether she's related to her fair-skinned daughter - including a suspicious church-goer who asked the girl: 'Is this your Mummy?' Davina Moon, 32, from Surrey, who has a mixed heritage including Sri Lanka and Ireland, told how society often treats her differently because she doesn't look like her children.",1.0,0.2481424824399193,0.6240712412199596,0.4987616549599462
N30071,news,newspolitics,"Trump juggles statecraft and impeachment on a historic day Projecting unusual calm in the middle of a political firestorm, President Donald Trump pleaded ignorance Wednesday about the first public impeachment hearing, unexpectedly insisting that he really wasn't paying attention to sworn testimony in the House Intelligence Committee that could determine whether he serves out his term in office. The disclaimer might be more credible if ...",1.0,0.2395783935445373,0.6197891967722686,0.49305226236302485
N61145,foodanddrink,tipsandtricks,Stop! Read This Guide Before You Buy an Air Fryer. Shopping for air fryers? Or maybe air fryer toaster ovens? Our air fryer buying guide will help you find the perfect appliance for your needs.,1.0,0.3009258804505403,0.6504629402252702,0.5339505869670269
N37204,health,health-news,"Model, 23, Didn't Know She Was Pregnant Until She Gave Birth to a Full-Term Baby in Her Bathroom An Australian model recently had a life-changing surprise when she gave birth to a baby in her bathroom, despite not knowing that she had been carrying her daughter for nine months.",1.0,0.2567998069291896,0.6283999034645948,0.5045332046194597
N46751,news,newscrime,"Mom named person of interest in 5-year-old girl's disappearance The search for Taylor Rose Williams, 5, began in Jacksonville on Wednesday.",1.0,0.2340374413507646,0.6170187206753823,0.489358294233843
N496,music,cma-awards,"Fashion hits and misses from the 2019 Country Music Association Awards From Nicole Kidman to Pink, see the best and worst dressed stars at the 2019 Country Music Association Awards.",1.0,0.2652317341788955,0.6326158670894477,0.510154489452597
N64685,music,music-celebrity,"Jennifer Lopez shares her #MeToo experience at costume fitting: 'I stood up for myself' Jennifer Lopez recalled an uncomfortable situation earlier in her career when a ""director at a fitting asked me to take my top off.""",1.0,0.2585657126037145,0.6292828563018573,0.505710475069143
N7041,health,health-news,Dad bans lollipops after 5-year-old son nearly choked to death The boy was sitting near his mother when he began making choking noises.,1.0,0.2395910983700437,0.6197955491850219,0.4930607322466958
N53585,tv,tvnews,"Rip Taylor's Cause of Death Revealed, Memorial Service Scheduled for Later This Month The comedian died at the age of 84 last month.",1.0,0.2297043010121421,0.614852150506071,0.4864695340080947
N24898,autos,autosbuying,"The lightest sports cars you can buy for under $30,000 Power-to-weight ratios matter, and what these sports cars lack in horsepower they more than make up for in their abilities to attack the roads with venom.",1.0,0.3078926222541872,0.6539463111270936,0.5385950815027915
N47851,travel,traveltripideas,The Top Winter Wonderlands You Should Visit This Holiday Find the best alpine views at these wintry destinations.,1.0,0.284692246401883,0.6423461232009415,0.523128164267922
N39389,lifestyle,lifestylebuzz,"Dog Rips The Tail Off Every Single One Of His Toy Pigs Tim Eberts When Diesel's parents first brought him home a cute little stuffed pig toy, they had no idea just how much the husky was going to love it.",1.0,0.2587180682903534,0.6293590341451767,0.5058120455269022
N36703,lifestyle,lifestylecelebstyle,Photos of Celebrities at the Airport Are Here to Inspire Your Holiday Travel Style Even the rich and famous aren't spared the most annoying place in the world: the airport.,1.0,0.2628247941958187,0.6314123970979093,0.5085498627972125
N57097,news,newsus,Last known Pearl Harbor survivor in Mass. dies at 98 Massachusetts' last known survivor of the Japanese attack on Pearl Harbor that drew the United States into World War II died Tuesday at 98.,1.0,0.2622464149226572,0.6311232074613287,0.5081642766151048
N15307,sports,basketball_nba,"10 most stunning early trends around the NBA Youngsters Luka Doncic and Pascal Siakam are taking their games to new heights, while a former No. 1 overall pick is doing his best to shed the ""bust"" label.",1.0,0.2549609957793675,0.6274804978896837,0.5033073305195783
N29839,lifestyle,lifestylehomeandgarden,"Simple Solutions to Help You Get Rid of Ants for Good Kick pesky ants out of your house and back to their colony with these easy, expert-approved tricks.",1.0,0.2969792844281101,0.648489642214055,0.5313195229520734
N48578,news,newsgoodnews,"Deer stranded 5 miles offshore saved by Maine lobstermen A group of Maine lobstermen spotted a deer in an unusual place Monday: open waters. The men quickly took action to save the animal, which had somehow ventured 5 miles away from shore, and hauled their catch of the day to safety.",1.0,0.2687002337251363,0.6343501168625681,0.5124668224834241
N47205,news,newspolitics,"Whistleblower never met or talked with Schiff - source The whistleblower who prompted an impeachment inquiry into U.S. President Donald Trump never met or spoke with congressman Adam Schiff, the Democrat leading impeachment hearings in Congress, a source familiar with the whistleblower's contacts said.",1.0,0.2501955152176651,0.6250977576088326,0.5001303434784434
N57591,lifestyle,lifestyleroyals,Prince Charles Is Getting Into the Fashion Business The Prince's Foundation is partnering with the Yoox Net-a-Porter Group on a sustainable 17-piece collection.,1.0,0.2579556406316744,0.6289778203158372,0.5053037604211162
N64258,news,newspolitics,"Trump impeachment hearing spurs shadow spin war The online spin began even before Wednesday's impeachment hearing got underway. Moments before House Intelligence Committee Chairman Adam Schiff could welcome witnesses to the first public hearing of the impeachment inquiry, President Donald Trump took to Twitter to dismiss the ""New Hoax. Same Swamp."" Former Obama administration aides-turned-podcasters dissected the hearings in real time. They broadcast their running...",1.0,0.2316330516580195,0.6158165258290098,0.487755367772013
N56061,sports,football_nfl,9 things we learned from Sunday's games of Week 10 of NFL season ,1.0,0.2304465065137674,0.6152232532568838,0.4869643376758449
N36807,weather,weathertopstories,"Timelapse Shows Snow Dusting Central New Hampshire A ""wintery mix"" of snow, ice, and rain moved across much of New Hampshire on Tuesday, November 12, local meteorologists said. Rain and freezing rain early Tuesday gave way to a period of light snow as colder air rushed in, WMUR said. This timelapse   filmed from 1 pm on Monday to 12 pm on Tuesday   shows snow falling and repeatedly dusting a parking lot in Plymouth, New Hampshire. Gunnar Consol, who filmed the video, said about an inch or two accumulated in Plymouth by Tuesday. Credit: @GunnarConsolWx via Storyful",1.0,0.2791372922270584,0.6395686461135293,0.5194248614847056
N58133,news,newspolitics,"George Kent, top State Department Ukraine expert, helps Democrats debunk GOP theories Kent testified that there is no evidence Ukraine interfered in the 2016 election and said Joe Biden's pressure on Ukrainian officials was not the same as President Trump's.",1.0,0.2448465615041328,0.6224232807520664,0.4965643743360885
N60619,news,newspolitics,"Republicans shrug off impeachment hearings as 'boring' Heading into Wednesday's first public impeachment hearing, Republicans had argued the facts weren't there to impeach President Donald Trump. And they complained the proceedings were taking place behind closed doors.",1.0,0.2369678643264755,0.6184839321632377,0.4913119095509837
