ID,category,sub_category,content,collaborative_rec,content_rec,mean,two_one
N26040,sports,football_nfl,"32 things we learned from Week 7 of the 2019 NFL season As the NFL approaches its midseason point, several contenders are rounding into top form while others are getting desperate.",0.1538677033934804,0.2395600050763897,0.19671385423493504,0.2109959045154199
N6056,entertainment,celebrity,"See what your favorite stars look like without makeup They get glammed up for red carpet events, but in their downtime, celebrities from Katie Holmes to Emma Stone prefer to let their natural beauty take center stage. Yes, just like you, stars do occasionally allow the world to see their foundation-free skin and mascara-less lashes to celebrate their freckles, little imperfections and inside-out glow, usually by way of the makeup-free selfie. They even sometimes celebrate their bare-facedness with hashtags like #wokeuplikethis and #nofilter. To see these stars without makeup   including Kate Hudson, Kim Kardashian, Gigi Hadid and all the stars you see above   check out the gallery now. For the latest beauty and style trends subscribe to our new podcast 'Get Tressed With Us' below! 34 Of Your Favorite Celebrities With Or Without Makeup!",0.1541040132947585,0.2583915822886901,0.2062477977917243,0.2236290592907129
N47485,news,newsus,"Health warning lifted over fire at California oil facility Authorities have lifted shelter-in-place orders for some 12,000 people in Northern California after containment of a fire at a fuel storage facility that sent up a huge cloud of smoke. Emergency sirens blared and thick plumes of black smoke and flames filled the skyline around the NuStar Energy LP facility in Crockett, California, about 30 miles (50 kilometers) northeast of downtown San Francisco.",0.1544094589986085,0.2566315146774534,0.20552048683803092,0.22255749611783843
N719,finance,finance-companies,"Nevada gambling bosses move to bar Wynn from casino industry The complaint filed Monday by the state's Gaming Control Board lists sexual misconduct allegations that have been lodged against the mogul since January 2018. The complaint asks Nevada's Gaming Commission, which acts on the board's recommendations and has final say on licensing, to fine Wynn and revoke his status as being found suitable to be licensed in the industry.",0.1544094589986085,0.238639930129256,0.19652469456393223,0.21056310641904016
N41797,autos,autosenthusiasts,"Tent Spent: We Try Luxury Camping in a $100,000 Airstream Call us crazy, but we actually enjoy traditional camping activities such as gathering firewood, pitching a tent, and peeing in the woods.",0.1547407400882892,0.2770032812525695,0.21587201067042935,0.23624910086447606
N16292,foodanddrink,foodnews,"What it's like to cook for Kate Middleton and Prince William, according to Giada De Laurentiis One of the professional chef's favorite career moments was the day she cooked for the Duke and Duchess of Cambridge at a polo charity event.",0.1550873540204797,0.2294641913535321,0.1922757726870059,0.20467191224251463
N38939,music,musicnews,"This Guns N' Roses Video Just Became the First From the '80s to Reach 1 Billion YouTube Views Guns 'N Roses' rockin' black-and-white video for ""Sweet Child O' Mine"" has become the first video from the 1980s to hit one billion YouTube views.",0.1550873540204797,0.2830404088996359,0.21906388146005779,0.24038939060658382
N48076,tv,tvnews,"Whoopi Goldberg Asks Meghan McCain to 'Respect' Her 'View' Co-Hosts During Heated Discussion 'I'm not trying to cut you off, I'm trying to get you heard.'",0.1550873540204797,0.2276588464862753,0.1913731002533775,0.20346834899767677
N28088,movies,movies-celebrity,Bruce Willis brought Demi Moore to tears after reading her book Demi wasn't sure how her ex would feel about her book until he called her.,0.155105013117601,0.2480156970035886,0.2015603550605948,0.21704546904159275
N37378,news,newsus,"Wisconsin jury awards $450,000 in Sandy Hook defamation case A jury in Wisconsin has awarded $450,000 to the father of a boy killed in the 2012 Sandy Hook school shooting after he filed a defamation lawsuit against conspiracy theorist writers who claimed the massacre never happened.",0.155108970605289,0.2476748784207199,0.20139192451300444,0.21681957581557626
N25158,lifestyle,lifestyleroyals,Kate Middleton Takes Prince George and Princess Charlotte Halloween Shopping at Local Supermarket Kate Middleton Takes George and Charlotte Halloween Shopping,0.155374334189393,0.2204890935206718,0.1879317138550324,0.19878417374357887
N61388,movies,movies-celebrity,"Judge: Brad Pitt, others can be sued over New Orleans homes The Times-Picayune/ The New Orleans Advocate reports Pitt and other foundation directors asked the court to remove them from the lawsuit, saying they weren't personally responsible for the construction.",0.1554667939279516,0.2255593446411993,0.19051306928457545,0.20219516107011673
N45535,news,newsus,DOJ sues Walmart for allegedly discriminating against a Navy reserve officer The Department of Justice says that Walmart did not hire a naval reserve officer due to her mandatory two-week training in the summer of 2016.,0.1554814742641608,0.2481127595455264,0.2017971169048436,0.21723566445173786
N13912,travel,traveltips,A lawyer reveals a legal nightmare you can face on a cruise ship Cruise ship passengers can be exposed to legal systems that don't provide the same protections they would find in the US.,0.155704409869729,0.2520782454722684,0.2038913276709987,0.21995363360475528
N62285,news,newsus,"Former Florida cop won't serve jail time after accidentally killing woman, 73, in training exercise A former Florida police officer who accidentally shot and killed a 73-year-old woman during a demonstration will not serve any jail time as part of a plea agreement.",0.155704409869729,0.236475911912529,0.19609016089112902,0.20955207789826233
N34399,foodanddrink,restaurantsandnews,Burger King's new 'Ghost Whopper' is here to haunt your Halloween order The Ghost Whopper will be available at 10 select restaurants beginning Oct. 24. The only thing scarier than Burger King's new Ghost Whopper is the thought of having no Whoppers at all.,0.1560264399540962,0.2124250452777232,0.1842257426159097,0.19362551016984753
N57967,sports,basketball_nba,Harden-Westbrook argument goes viral A clip of the Rockets stars appearing to exchange words during Thursday's game against the Bucks quickly started making the rounds online.,0.1561621872227929,0.2370473084008143,0.1966047478118036,0.21008560134147383
N63554,travel,traveltripideas,"It took me 96 hours to ride an Amtrak train from coast to coast. I'd do it again in a heartbeat. Four days aboard a cross-country Amtrak train was so much more relaxing than flying. If I had the time, I'd do it on every trip.",0.1563781555988433,0.3136127354974748,0.23499544554815904,0.26120120886459763
N55742,sports,mma,President Donald Trump gets mixed reaction at UFC 244 in historic milestone for MMA ,0.1566286940997858,0.2184607445343788,0.1875447193170823,0.19785006105618114
N41298,music,music-celebrity,"Katy Perry sued for $150k by photo agency for 3-year-old pic Katy Perry allegedly posted a paparazzi photo without paying the fee, a photo agency claims.",0.1566816539635514,0.2628763848257099,0.20977901939463067,0.2274781412049904
N21019,autos,autosnews,"Ford Baby Bronco Bare Body Allegedly Leaked In Exclusive Photo Ford had no comment, but it sure looks like the real deal.",0.1566816539635514,0.2527105983825363,0.20469612617304384,0.22070095024287464
N42470,finance,finance-companies,G.M. Workers Approve Contract and End U.A.W. Strike The longest nationwide strike against General Motors in half a century ended on Friday after a solid majority of the company's union members delivered their support for the four-year contract hammered out by their leaders. The United Auto Workers union emerged with substantial wage increases and succeeded in ending a two-tier wage structure that had been a particular irritant in its ranks. It also won commitments to new G.M. investments in...,0.156772833530771,0.2682420697803178,0.2125074516555444,0.23108565769713554
N24691,news,newsus,"Bill Macy, Bea Arthur's Husband on 'Maude,' Dies at 97 Norman Lear saw him choking on a chicken bone and brought him to Hollywood. The actor also appeared in 'My Favorite Year' and 'The Late Show.'",0.1573280732308399,0.2341458429534454,0.19573695809214264,0.2085399197125769
N25785,sports,football_nfl,OJ Simpson suing Vegas hotel for defamation over 2017 TMZ story claiming 'belligerence' ,0.1573510004024904,0.2172577357354117,0.18730436806895107,0.19728882395777128
N56446,movies,movies-celebrity,Ryan Reynolds Shares the First Photo of His and Blake Lively's Newborn Daughter This is the first time the actor has talked about his newborn daughter.,0.1573870676656044,0.2495321422820012,0.2034596049738028,0.21881711740986892
N15122,tv,tv-celebrity,Tamron Hall says she 'never dealt' cocaine after reports say she confessed to doing so Tamron Hall issued a statement in response to the Daily Mail reporting that she confessed to facilitating the sale of cocaine as a teenager.,0.1576102310194094,0.2396061952536179,0.19860821313651367,0.2122742071755484
N62612,news,newscrime,16-year-old injured in shooting near Churchill Downs ,0.1578576514656172,0.2376889007723166,0.1977732761189669,0.21107848433675014
N63045,news,newscrime,"Coroner IDs man found dead in Klondike neighborhood A man who was found dead in the Klondike neighborhood has been identified. Louisville Metro police responded to the 3200 block of Pomeroy Drive for a call of a person down Friday. Officials said Kevin Hellems, 54, was found dead inside the home from some type of foul play. No other information has been released. The death comes as a surprise to the neighbors in the area, who say they aren't used to seeing police cars and detectives on this...",0.1578576514656172,0.2349264866450986,0.1963920690553579,0.2092368749186048
N61355,news,newscrime,"2 Murder suspects escape from Monterey County, California, Jail The suspects are considered dangerous and should not be approached. Anyone who sees them should call 911 immediately.",0.1578576514656172,0.2532856269030485,0.20557163918433285,0.22147630175723806
N43353,news,newscrime,"Wedding shooter may have been avenging late stepfather's murder, authorities say Brandon Castiglione, the groom's son, was previously charged with second-degree murder in the death of the suspect's stepfather.",0.1578576514656172,0.2274973388508691,0.19267749515824314,0.20428410972245178
N17686,news,newscrime,"Suspect in Henry County murder, kidnapping arraigned ",0.1578576514656172,0.2404203655028267,0.19913900848422195,0.21289946082375685
N5398,news,newscrime,Suspects identified following hours-long SWAT standoff on South 34th Street ,0.1578576514656172,0.2372959906682969,0.19757682106695706,0.21081654426740368
N65112,news,newscrime,"Family says 16-year-old was victim hit, killed on I-64 The person struck by 5 vehicles on Interstate 64 Friday night was a 16-year-old girl, according to family members. The girl's father, Ronnie Click, spoke with WHAS11 News Saturday and said his daughter Brea was killed in that incident. Police responded to I-64 near the 22nd Street exit after they received reports that a person had been hit while walking in the slow lane. RELATED: LMPD: Pedestrian struck and killed on I-64 E at 22nd Street Once...",0.1578576514656172,0.2436497941919408,0.200753722828779,0.21505241328316627
N6087,news,newsworld,"U.S. bans all flights to Cuba outside Havana in latest crackdown American Airlines and JetBlue, which fly routes to Cuba other than Havana, will have to submit to new regulations from the Transportation Department.",0.1578576514656172,0.2643112234113889,0.21108443743850305,0.228826699429465
N1569,news,newsus,"Officer who shot naked man found not guilty of murder DECATUR, Ga. (AP)   A former Georgia police officer who fatally shot an unarmed, naked man was found not guilty of murder Monday but was convicted of aggravated assault and other charges that could send him to prison for more than 30 years. Robert ""Chip"" Olsen's face turned red and he squeezed his eyes shut tightly as the verdict was read. His wife, Kathy Olsen, began sobbing and had to be led from the courtroom. DeKalb County Superior Court...",0.1578576514656172,0.2453026602356249,0.20158015585062106,0.21615432397895565
N45099,news,newscrime,Suspect in crossbow murder of his father arraigned ,0.1578576514656172,0.2320631212817221,0.19496038637366964,0.2073279646763538
N3433,finance,finance-companies,A secretive family landing a $4 billion haul has everyone guessing One of the world's richest and most discreet families must decide what to do with a massive pile of cash.,0.1578576514656172,0.242471358742271,0.2001645051039441,0.21426678965005305
N54889,lifestyle,lifestyle-news-feature,"Chris, the famously woolly sheep, has died Chris made headlines in 2015 after he became the unofficial world record holder for having grown the heaviest fleece.",0.1578576514656172,0.2469593709086275,0.20240851118712233,0.21725879776095738
N35656,travel,travelnews,Motorcyclist killed in crash on New Cut Road identified ,0.1578576514656172,0.2376801207136438,0.1977688860896305,0.2110726309643016
N48390,travel,travelnews,First round of auctions begin for Joe Ley Antiques ,0.1578576514656172,0.262831067450034,0.2103443594578256,0.2278399287885617
N50528,news,newscrime,Man shot in the chest on Floyd Street ,0.1578576514656172,0.229462213835043,0.1936599326503301,0.20559402637856775
N19041,news,newscrime,Kroger shooting: Suspect coming out of store fires at officers before they shoot him dead ,0.1578576514656172,0.2309346673790896,0.1943961594223534,0.2065756620745988
N63317,news,newscrime,"Police: 4 charged with attempted murder month after shooting in SW Louisville Four people are facing attempted murder charges for a shooting last month in southwest Louisville. According to arrest citations, a group arrived at an apartment in the 9600 block of Lamborne Boulevard on Sept. 27 and attempted to lure a male, unknown age, out of his apartment. When the victim agreed to come outside, police said Byron Kirby, 25, shot at the victim four times. The victim then ran into the woods. It's unclear if he was hit....",0.1578576514656172,0.2439722048785521,0.20091492817208464,0.21526735374090714
N7023,lifestyle,lifestyle-news-feature,"After being pushed close to extinction, this humpback whale population is making a comeback A key population of humpback whales is in recovery after it was pushed close to extinction by centuries of exploitation, according to a new study.",0.1578576514656172,0.2870650841868088,0.222461367826213,0.2439959399464116
N29948,lifestyle,lifestyle-news-feature,"A White Woman Searches for Her Black Family DNA testing tells people a lot about their geographic ancestry, prompting difficult questions about racial identity and belonging. ""In my heart, I feel a connection.""",0.1578576514656172,0.2595066674132089,0.20868215943941304,0.225623662097345
N24611,news,newscrime,"Former Jewish Hospital nurse to be arraigned on sexual abuse of patient charge According to court documents, Dorsey told the woman ""repeatedly"" that, ""I would like to video you.""",0.1578576514656172,0.2444119796360609,0.20113481555083906,0.21556053691257968
N51163,lifestyle,lifestylebuzz,"He grew a 910-pound pumpkin and then used it as a boat Instead of making a giant jack o'lantern or a massive pie that could feed the whole town, a farmer in Tennessee took his 910-pound pumpkin out for a spin in his pond.",0.1578576514656172,0.2608295524045179,0.20934360193506754,0.22650558542488433
N55833,news,newscrime,"Oldham County man charged, injuring victim during shooting practice ",0.1578576514656172,0.2545358349344,0.2061967432000086,0.22230977377813907
N58224,news,newscrime,"13-year-old charged with two murders escapes custody in North Carolina Officials said they have concerns for public safety due to the teen's ""prior history of assaultive and unpredictable behavior.""",0.1578576514656172,0.2326152064576525,0.19523642896163484,0.20769602146030738
N59049,news,newsworld,"Three gunmen killed in Brazil airport raid, kidnapping: police Heavily armed gunmen raided an airport in Brazil on Thursday, officials said, stealing money from an armored truck before fleeing and taking a mother and baby hostage. At least one assailant escaped to a nearby residential neighborhood, taking a mother and her baby hostage in their home, the police spokeswoman said.",0.1578576514656172,0.2618648445820252,0.2098612480238212,0.2271957802098892
N22976,news,newsus,"The Sante Fe High School massacre suspect isn't fit to stand trial and will get psychiatric treatment, attorney says Dimitrios Pagourtzis is accused of killing eight students and two teachers at his Texas high school last year.",0.1578576514656172,0.2434512520510493,0.20065445175833324,0.21492005185590526
N48031,sports,basketball_nba,Ex-Maverick to pay for funeral of woman fatally shot in home by police ,0.1578576514656172,0.2043925737287594,0.1811251125971883,0.18888093297437866
N8429,weather,weathertopstories,"Group clears plastic drums, tires from Falls of the Ohio State Park LOUISVILLE, Ky. (WHAS11)   The Falls of the Ohio is a little cleaner after volunteers helped return it to its glory. The volunteers picked up trash and debris along with old tires and leftover plastic barrels. It was part of Moran Environmental Recovery's effort to clean up parts of the state park. The group says over the years, the site has experienced waste dumping leaving the grounds full of empty drums, tires and glass. The state park is the...",0.1578576514656172,0.2811548617726884,0.2195062566191528,0.24005579167033134
N6244,news,newscrime,Suspect Alfredo Vazquez pleads guilty in Clark County judges' shooting case ,0.1578576514656172,0.2544871420604293,0.20617239676302326,0.22227731186215863
N21773,travel,travelnews,Lumber spilled on I-71 following rollover crash; Lanes shut down ,0.1578576514656172,0.2595601456707256,0.2087088985681714,0.2256593142690228
N31402,foodanddrink,restaurantsandnews,"The Best Seafood Restaurant in All 50 States Think there are too many seafood places in Maine to choose among, but none in landlocked Nebraska? This list will point your cravings and more in the right direction. Whether it's shrimp, crab, fish, or sushi that you love, even the most landlocked states have top-notch options for seafood. Find out what's near you.",0.1578576514656172,0.2749931589176282,0.2164254051916227,0.23594798976695788
N34567,news,newscrime,Grandfather charged in death of toddler who fell on cruise ship in Puerto Rico A grandfather who police say dropped his young niece from the 11th floor of a cruise ship docked in Puerto Rico in July has been accused of negligent homicide.,0.1578576514656172,0.2378021393872018,0.1978298954264095,0.2111539767466736
N3142,health,health-news,"Teen wins science competition with liquid bandage invention Kara Fan beat nine other finalists and hundreds of students who submitted ideas in the 3Mâ€‹ Young Scientist Challenge, winning $25,000.",0.1578576514656172,0.2667070501848141,0.21228235082521565,0.23042391727841513
N29802,finance,finance-companies,"Barneys Is Sold for Scrap, Ending an Era Authentic Brands Group will take control of the Barneys name   one that has been part of the Manhattan landscape since 1923   and license it to other companies like Saks Fifth Avenue. The firm B. Riley Financial is preparing to liquidate Barneys' high-end wares, at its five stores and two Warehouse locations, starting with private sale events for Barneys' ""most loyal"" shoppers next week.",0.1578576514656172,0.2443242274500252,0.2010909394578212,0.21550203545522253
N19709,news,newscrime,Teen given 8 years in prison for gang-related hate crime of student caught on tape A California teenager has been sentenced to eight years in prison for a gang-affiliated hate crime assault on another student.,0.1578576514656172,0.2513886044196387,0.20462312794262794,0.2202116201016315
N15710,news,newscrime,Arrest made in connection to stabbing in South Louisville ,0.1578576514656172,0.2404893330641899,0.19917349226490355,0.212945439197999
N61101,news,newscrime,"Resident recalls moments leading up to fatal shooting in Russell neighborhood In the Russell neighborhood, crime tape has become a well known sight that's why Lisa Tutt encourages her son and his friends to hang out at her house. READ THE FULL STORY:Resident recalls moments leading up to fatal shooting in Russell neighborhood Sign up for our Newsletters CHECK OUT WLKY:Live. Local. Late-Breaking. Get the top Louisville news, weather and sports from the team at WLKY   online, anytime.",0.1578576514656172,0.2186013872312094,0.1882295193484133,0.19835347530934533
N2663,news,newsworld,16 sentenced to death for burning alive Bangladesh teen Sixteen people were sentenced to death Thursday for burning alive a Bangladeshi teenager who refused to withdraw sexual assault charges against her head teacher.,0.1578576514656172,0.252841929460082,0.2053497904628496,0.22118050346192705
N31739,news,newscrime,"'Habitual stowaway' arrested again at O'Hare, Chicago police say A woman arrested at O'Hare International Airport on Friday night was identified by Chicago police as ""known habitual stowaway"" Marilyn Hartman.",0.1578576514656172,0.2532512835332692,0.2055544674994432,0.2214534061773852
N23061,news,newscrime,"Police arrest suspect in Bashford Manor double shooting Police have identified the suspect in a double shooting that happened in Bashford Manor. On Thursday, officers arrested Matthew Martin on attempted murder and other drug-related charges. Police said Martin and one of the victims pulled out guns during an argument that happened at Martin's apartment on Goldsmith Lane Wednesday afternoon. Following the argument, both victims were shot in the back as they ran down the hallway and were transported...",0.1578576514656172,0.2437728065864357,0.20081522902602644,0.21513442154616286
N41011,news,newsworld,"For the first time, a man has been sentenced for sexual slavery by the International Criminal Court. He got 30 years. Bosco Ntaganda is a former Congolese rebel nicknamed the ""Terminator."" The ICC convicted him on 18 counts including murder, sexual slavery and using child soldiers.",0.1578576514656172,0.2731545452518004,0.2155060983587088,0.23472224732307265
N44462,news,newscrime,"Louisville man who shot at LMPD officer sentenced to 10 more years in prison A Louisville man convicted of shooting at an officer was sentenced Friday. Judge David Hale sentenced Elijah Eubanks, 22, to 119 months in prison for a federal weapons charge. Sign up for our Newsletters In March 2018, Eubanks opened fire on an officer who was attempting to question him while he was in his vehicle with another person. No officers were hit, but Eubanks was shot multiple times when officers returned fire. Eubanks was previously...",0.1578576514656172,0.2573875253866494,0.2076225884261333,0.2242109007463053
N6072,news,newsus,"Search resumes for worker missing in New Orleans Hard Rock Hotel building site collapse that killed 2 Rescuers resumed searching Sunday for a worker trapped in rubble after a deadly construction collapse in New Orleans, officials said, but the building's instability is making for a precarious situation.",0.1578576514656172,0.2443154769822731,0.20108656422394516,0.21549620181005447
N42704,news,newscrime,UPDATE: Coroner reveals identity of victim in Beechmont neighborhood shooting ,0.1578576514656172,0.229509171243924,0.1936834113547706,0.20562533131782174
N31741,music,musicnews,"Snoop Dogg bringing 'I Wanna Thank Me' tour to Louisville Palace Multi-platinum rap legend Snoop Dogg is bringing his ""I Wanna Thank Me"" tour to the Louisville Palace in 2020. The venue announced on Twitter that the show is scheduled for Jan. 25. Live Nation presale starts starts Thursday at 10 a.m., and tickets go on sale to the general public Friday at 10 a.m. The Long Beach native released his 17th album, ""I Wanna Thank Me,"" in August. The Doggfather's West Coast G-funk style has sold more than 38 million...",0.1578576514656172,0.2723100926575295,0.21508387206157334,0.23415927892689206
N10438,lifestyle,lifestylebuzz,"Pope Lick Legend: Loved ones of those who died on trestle push for change Legends of a monster living under a dangerous train trestle have lured people to a quiet Louisville creek for decades. Some swear they have seen proof of a human-goat hybrid terrorizing the area. Others leave with no sightings and no story to tell. Those are the lucky ones. The story of a ""Pope Lick Monster"" or ""Goatman"" haunting the trestle at Pope Lick Creek has been commonplace in Louisville even becoming the focus of a movie in the late...",0.1578576514656172,0.2234028344639288,0.190630242964773,0.20155444013115828
N47054,autos,autossema,"Hennessey Maximus Is a 1000-HP Jeep Gladiator from Hell If a 2020 Jeep Gladiator is not aggressive-looking enough, Hennessey has this even more intense version, which it's bringing to the SEMA show.",0.1579488666134338,0.2884395589514136,0.22319421278242368,0.24494266150542035
N24123,sports,baseball_mlb,Why is Giancarlo Stanton on the Yankees' playoff roster? ,0.1579488666134338,0.2614019424021822,0.20967540450780797,0.22691758380593272
N18663,news,newsus,"Coast Guard offloads $92 million worth of smuggled cocaine in San Diego The Coast Guard offloaded more than 6,800 pounds of cocaine   worth an estimated $92 million   in San Diego on Wednesday, contraband that the military branch seized in international waters of the eastern Pacific Ocean.",0.1579488666134338,0.2970697823519113,0.22750932448267253,0.2506961437724188
