ID,category,sub_category,content,collaborative_rec,content_rec,mean,two_one
N27441,lifestyle,lifestylehomeandgarden,These Christmas Window Decorations Are Full of Holiday Cheer Don't overlook this decorating opportunity this year.,1.0,0.2803279492480206,0.6401639746240103,0.5202186328320137
N8400,autos,autosresearchguides,These are the new cars that depreciate least Don't want to lose a ton of money on your next new car? These are the new car models that hold the most value after five years.,1.0,0.3082188018145873,0.6541094009072936,0.5388125345430581
N53431,lifestyle,lifestylehomeandgarden,Designer-Approved Ideas to Transform a Small Bedroom Because a lack of square footage shouldn't cramp your style.,1.0,0.285551190404896,0.642775595202448,0.523700793603264
N61006,entertainment,awards,Jenna Dewan flaunts her baby bump in red gown at People's Choice Awards She looks absolutely stunning.,1.0,0.2642192255127342,0.6321096127563671,0.5094794836751562
N11817,travel,traveltripideas,"Here's the Best Small Town in Every State From Los Alamos, California, to Shelter Island, New York, these are the best small towns INSIDER found in every state.",1.0,0.2751401782969516,0.6375700891484758,0.5167601188646344
N41172,entertainment,celebrity,Welcome to the World! All of the Celebrity Babies Who've Made Their Debuts in 2019 See who's made their debut so far this year,1.0,0.2671311123174531,0.6335655561587266,0.5114207415449687
N14531,news,newsworld,Turkey starts repatriation of captured Islamic State militants: media Turkey starts repatriation of captured Islamic State militants: media,1.0,0.2555461803763967,0.6277730901881984,0.5036974535842644
N40530,news,newspolitics,"What's coming in impeachment: The inquiry goes public For only the fourth time in U.S. history, the House of Representatives has started a presidential impeachment inquiry.",1.0,0.2732631518136417,0.6366315759068208,0.515508767875761
N64606,entertainment,celebrity,"Best celebrity hair moments of 2019 (so far) New year, new 'do! Nothing has the power to transform a look quite like a new hairstyle, which might explain why celebrities are constantly switching things up with fresh cuts, colors and lengths. In 2019, we've already seen stars like Rowan Blanchard and John Travolta go shorter (or, in the Saturday Night Fever star's case, bald!), Lady Gaga and Chris Messina walk the red carpet with striking new shades and Hilary Duff and Sarah Hyland show how subtle color shifts can make a big impact. And, if 2018's tress transformations were any indication, there is going to be so much more where that came from. Keep scrolling to see the best celebrity haircuts, color, extensions and more of 2019 so far!",1.0,0.2625938321808068,0.6312969160904034,0.5083958881205378
N25414,finance,finance-companies,"Alibaba breaks Singles Day record of more than $30 billion in sales and climbing Chinese e-commerce giant Alibaba set a new sales record on Singles Day, the world's largest 24-hour shopping event.",1.0,0.294170272792036,0.647085136396018,0.5294468485280239
N59385,entertainment,celebrity,"Celebrity Engagements of 2019 Love is abloom in 2019! Stars such as Tim Tebow, who is set to wed former Miss Universe Demi-Leigh Nel-Peters, and Hamilton's Anthony Ramos will soon be walking down the aisle after popping the question to their respective loved ones. Scroll through to see who else is put a ring on it this year and get the story behind their sweet proposals.",1.0,0.25298312020669,0.626491560103345,0.5019887468044599
N33120,entertainment,celebrity,Stars who welcomed babies in 2019 See which celebrities expanded their families this year!,1.0,0.2633120557794765,0.6316560278897383,0.5088747038529843
N10960,foodanddrink,recipes,65 Best Fall Soups That Will Warm You and Your Family Up All Season Long These hearty bowls are the perfect companion for a rainy fall night.,1.0,0.2752204554765829,0.6376102277382915,0.5168136369843885
N50023,health,nutrition,"The #1 Worst Menu Option at 76 Popular Restaurants The rule ""everything in moderation"" simply isn't an excuse for these excessive menu choices that will set you back for days.",1.0,0.2497789018600712,0.6248894509300356,0.4998526012400475
N43432,news,newsus,"US Forest Service shuts down vandalized Georgia park feature GAINESVILLE, Ga. (AP)   The U.S. Forest Service says vandalism is forcing it to shut down a popular fall leaf viewing destination in Georgia. The agency posted photos to Facebook on Friday showing a wooden platform covered in white spray paint overlooking the mountainous north Georgia landscape at Chattahoochee-Oconee National Forests.",1.0,0.2529073082346836,0.6264536541173418,0.5019382054897891
N32010,finance,personalfinance,The biggest wastes of money in 2019 Relive 2019 with this look at some of the biggest wastes of money of the year.,1.0,0.2761123540768022,0.6380561770384011,0.5174082360512015
N61822,lifestyle,lifestylehomeandgarden,"200 Shocking Home Photos You Have to See We know a good DIY project when we see it, but these aren't them. Some of these are goofy, some are head scratchers and some are downright dangerous. Check these photos out, you'll definitely learn a thing or two!",1.0,0.2791839584911221,0.6395919792455611,0.5194559723274147
N23254,movies,movies-celebrity,Best nostalgic pics of Leonardo DiCaprio Celebrate Leo's birthday with these throwback photos.,1.0,0.2874087190990588,0.6437043595495294,0.5249391460660392
N5791,lifestyle,lifestylehomeandgarden,"12 Fall Landscaping Mistakes to Know and Avoid Whether you have a green thumb when it comes to your home garden, or you can hardly tell the difference between a rose and a weed, you should know that there are certain landscaping tasks that need to be done right to keep your home exterior looking its best. But to do that, you must avoid the most common fall landscaping blunders.",1.0,0.2951049661423975,0.6475524830711987,0.530069977428265
N30188,lifestyle,lifestylebuzz,Look of the day: Ashley Graham's latest sizzling maternity look & more celeb style Bella Hadid attended the CFDA/Vogue Fashion Fund Awards in an Alexander Wang jumpsuit embellished with nipple and belly-button jewels.,1.0,0.2488244033391771,0.6244122016695886,0.4992162688927847
N4912,movies,movies-gallery,"New Movies and TV Shows You'll Be Able to Cozy Up With on Netflix in November Movie watchers divide themselves into two camps when November rolls around: those who aren't ready to stop watching all the horror flicks that creeped them out around Halloween, and those who can't wait to dive into cheesy holiday movie season.",1.0,0.2510023229434086,0.6255011614717043,0.5006682152956057
N17104,news,newscrime,"Veterans suffered, investors lost millions in nationwide schemes People lost hundreds of millions of dollars. But something is happening that might finally stop it.",1.0,0.2534046057302408,0.6267023028651204,0.5022697371534939
N54988,finance,personalfinance,28 Dumb Ways You Could Lose It All by Trying To Get Rich Don't gamble your money away in foolish ways.,1.0,0.2839653714442914,0.6419826857221457,0.5226435809628609
N22549,entertainment,awards,2019 People's Choice Awards nominees' best recent style moments We're checking out the E! People's Choice Awards nominees' stellar recent style moments.,1.0,0.258588126922022,0.629294063461011,0.5057254179480146
N54300,entertainment,celebrity,"Week in celebrity photos for Nov. 4-8, 2019 Week in celebrity photos for Nov. 4-8, 2019",1.0,0.2358896259514838,0.6179448129757419,0.4905930839676559
N21840,travel,traveltips,"10 Things You Should Never Do in an Airplane Bathroom Germs are potentially harmful in a normal bathroom. But put that bathroom in the sky, shrink it, and pump pressurized air into it and you've got the perfect environment for germs to thrive. The post 10 Things You Should Never Do in an Airplane Bathroom appeared first on Reader's Digest.",1.0,0.3083883579963937,0.6541941789981969,0.5389255719975958
N31978,music,music-awards,"Country music's biggest scandals From Wynonna Judd's husband's arrest to the Dixie Chicks' vent about George W. Bush, relive country's biggest scandals.",1.0,0.2465873235424244,0.6232936617712121,0.49772488236161627
N51241,lifestyle,lifestylefamilyandrelationships,"I Was Adopted Here's What Everyone Gets Wrong About Adoption While adoption is wonderful in many ways, it comes with its own set of unique challenges. Sometimes, those challenges come from other people making incorrect assumptions. The post I Was Adopted Here's What Everyone Gets Wrong About Adoption appeared first on Reader's Digest.",1.0,0.2863663270565998,0.6431831635282999,0.5242442180377331
N22880,lifestyle,voices,"I ordered clothes from those cheap online stores, and I'm not sold As an avid brick-and-mortar shopper, my eyes were opened when I tried an $8 formal dress, a $4 blouse, and other clothes for less than $10.",1.0,0.267160260280712,0.633580130140356,0.5114401735204747
N27143,foodanddrink,beverages,Best Dive Bar in Every State The real challenge in compiling a list of America's best dive bars comes in defining just what a dive bar is and isn't.,1.0,0.2860741263427656,0.6430370631713828,0.5240494175618438
N61623,entertainment,entertainment-celebrity,"Big celebrity money moments of the last decade From bankruptcy filings and huge paydays to reaching billionaire status, read up on the most fascinating money news involving the stars from 2010 to 2019.",1.0,0.2495584322911314,0.6247792161455656,0.49970562152742093
N24686,entertainment,entertainment-celebrity,Stars who've had more than one wedding with the same spouse See which celebs exchanged vows with their significant others more than once.,1.0,0.2543467877330856,0.6271733938665428,0.5028978584887237
N55204,entertainment,entertainment-celebrity,"Stars Who Served in the Military Adam Driver, Jeff Bridges, Ice-T and more stars who served in the military.",1.0,0.248533469193332,0.624266734596666,0.49902231279555465
N62386,news,newspolitics,America's Most and Least Popular Senators Senators represent the interests of the residents of their home state on Capitol Hill by crafting and voting on new laws and by approving or rejecting cabinet and judicial nominations made by the president.,1.0,0.2721641790367739,0.636082089518387,0.5147761193578493
N40356,movies,movies-gallery,"All 112 of Netflix's notable original movies, ranked from worst to best To find out which Netflix original films are worth watching, we turned to Rotten Tomatoes to rank everything from ""Roma"" to ""Bright.""",1.0,0.273320471580733,0.6366602357903666,0.515546981053822
N55353,weather,weathertopstories,Distressing photos show glaciers that are disappearing or on the brink of collapse around the world The future of glaciers around the world is shaky. Here are photos showing some of the glaciers that might not be around for much longer.,1.0,0.2776684873729773,0.6388342436864887,0.5184456582486515
N50575,autos,autossuvs,Should You Get the 2020 Ford Explorer? Pros and Cons on This Family SUV Ford completely reimagined Explorer is a 2020 SUV of the Year contender,1.0,0.2991530964176755,0.6495765482088378,0.532768730945117
N26376,finance,markets,"Stocks close higher on optimism over China trade deal Stocks ended at record highs Thursday after the world's two largest economies reportedly agreed to remove existing trade tariffs, sparking a huge rotation into equities and out of bonds.",1.0,0.2670331595807074,0.6335165797903537,0.5113554397204716
N37870,news,newsworld,Today in History: November 11 ,1.0,0.2573175055072724,0.6286587527536363,0.5048783370048482
N3344,music,cma-awards,"Top 100 country songs of all time Stacker counts down the top 100 country songs of all time. From old-school honky-tonk to modern country pop, this list covers the biggest hits in Billboard history.",1.0,0.2990780566566038,0.6495390283283019,0.5327187044377358
N26262,entertainment,entertainment-celebrity,"Celebrity plastic surgery transformations See how stars like Sharon Osbourne, Cardi B, Pauly D, Kim Zolciak-Biermann, Gisele Bundchen, Kanye West and others have altered their looks.",1.0,0.2526896220010133,0.6263448110005067,0.5017930813340088
N38311,entertainment,celebrity,Celebrity PDA of 2019 See the stars kissing and hugging on the red carpet and out and about!,1.0,0.253076774407336,0.6265383872036681,0.5020511829382239
N27476,sports,basketball_nba,"Harden scores 47 points, Rockets beat Clippers 102-93 HOUSTON (AP)   James Harden scored 47 points and the Houston Rockets outlasted the Clippers 102-93 in a wild game that saw Los Angeles coach Doc Rivers ejected in the fourth quarter Wednesday night. Houston was up by two with about two minutes left when former Rocket Patrick Beverley fouled out. Harden made both free throws before grabbing a rebound on the other end and hitting a 3 to make it 95-88. Beverley was given a technical foul during a...",1.0,0.2812271376483432,0.6406135688241716,0.520818091765562
N57853,news,newscrime,Triple Shooting In Dallas Leaves 2 Dead & Police Investigating Two people are dead after a triple shooting in Dallas late Sunday night.,1.0,0.2525511846076224,0.6262755923038112,0.5017007897384149
N50005,news,newsgoodnews,"A teenager thought his leukemia was a death sentence. A college football player saved his life. William & Mary offensive lineman Mark Williamson on Friday finally met Rusty Plemons, whose life he helped save three years ago.",1.0,0.2192892800395082,0.6096446400197542,0.47952618669300545
N10840,finance,markets,Trade War's Forgotten Farmers Get Crushed in U.S. Cotton Country American cotton farmers are having such a difficult year that even a potential trade deal between the U.S. and China is likely to offer them little comfort.,1.0,0.2578303715000555,0.6289151857500277,0.5052202476667036
N54283,lifestyle,lifestyleroyals,"Prince Harry just hinted that he and Meghan Markle may want another baby Reports also suggest that Meghan Markle may want to have their next child in Los Angeles, where she was born.",1.0,0.2508841027666831,0.6254420513833415,0.5005894018444554
N33261,video,lifestyle,The Queen Had This Hilarious Reaction to (Unnecessary) Mouth-to-Mouth Resuscitation The Queen had a hilarious reaction when someone tried to save her life. Buzz60's Keri Lumm reports.,1.0,0.2631879769225828,0.6315939884612913,0.5087919846150551
N26084,foodanddrink,recipes,These Christmas Dinner Menus Will Create an Unforgettable Meal We've got you covered for any type of crowd.,1.0,0.2635395492245936,0.6317697746122968,0.5090263661497291
N999,news,newsscienceandtechnology,"Motorola's Razr flip phone is back as a folding-screen smartphone, for $1,500 The good news: A phone can fit in your pocket again. The bad news: It's twice the price of an iPhone.",1.0,0.2744738892073197,0.6372369446036599,0.5163159261382131
N18698,entertainment,awards,Khloe Kardashian Apologizes to Fans After Not Realizing She'd Won an Award at the People's Choice Awards Her family also won for Best Reality Show.,1.0,0.2355744203018236,0.6177872101509118,0.4903829468678824
N287,news,newscrime,Three school workers charged in death of special needs student The student was reportedly restrained face-down for nearly an hour before becoming unresponsive,1.0,0.2497576500939569,0.6248788250469784,0.4998384333959712
N39461,foodanddrink,foodnews,"We Tried 5 Brands of Toaster Pastries So You Don't Have To We tasted organic, generic, gourmet, and nostagic options. Here's what we thought.",1.0,0.2510351271369908,0.6255175635684954,0.5006900847579938
N59673,music,music-celebrity,Selena Gomez and Julia Michaels Share a Kiss Before Getting Matching Arrow Tattoos Selena Gomez and Julia Michaels Get Matching Arrow Tattoos,1.0,0.2711206593952878,0.6355603296976439,0.5140804395968586
N26331,news,newsus,"Wild turkeys are terrorizing a town; MLB player calls on the New Jersey governor for help Todd Frazier, MLB all-star, joined town residents sounding off about wild turkey terror. Now, they're asking New Jersey Gov. Phil Murphy for help.",1.0,0.2177903006760363,0.6088951503380181,0.4785268671173575
N64691,news,newsworld,"U.K. Politicians Fight First December Election in Almost a Century Across the length of the U.K., politicians are donning hiking boots and fluorescent jackets and arming themselves with torches as they campaign in the cold and darkness ahead of the country's first December election in almost a century.",1.0,0.2543945477191157,0.6271972738595578,0.5029296984794105
N23805,lifestyle,awardstyle,Carrie Underwood rocks CMAs and several gorgeous outfits as host All of her looks were just stunning.,1.0,0.2685952601882085,0.6342976300941042,0.5123968401254724
N12124,news,newsworld,"US to keep around 600 troops in Syria: Pentagon chief The United States will maintain around 600 troops in Syria, Pentagon chief Mark Esper said Wednesday, despite Donald Trump's desire to end US involvement in what the president calls ""endless wars"". ""We're going to have about 500 to 600-ish troops there, at the end of the day,"" he said.",1.0,0.265837586473028,0.632918793236514,0.5105583909820186
N8555,lifestyle,lifestyleroyals,"Meghan Markle is being criticized for doing the same things that Kate Middleton is praised for, and a royal expert says it wouldn't be happening if she were white Markle received backlash when her bodyguard told fans not to take photos. However, Middleton was recently called ""down to earth"" for the same thing.",1.0,0.217704294696726,0.608852147348363,0.4784695297978173
N6477,finance,finance-companies,"Walmart releases Black Friday ad with $129 Apple Watch, TV deals, electronics doorbusters Walmart's Black Friday 2019 ad includes a 40-inch TV for $98, Apple iPad for $249, Xbox One, Playstation 4, deals on toys, Instant Pot and more.",1.0,0.2794148078061016,0.6397074039030508,0.5196098718707344
N61787,sports,basketball_nba,Russell Westbrook takes shot at Patrick Beverley Wednesday night's Houston Rockets-LA Clippers game was entertaining on many levels. Russell Westbrook's comments about Patrick Beverly's reputation stood out the most.,1.0,0.2277539487866789,0.6138769743933394,0.4851692991911193
N49879,news,newsgoodnews,"Man runs race in full SWAT gear, saves a life, then proposes -- all in a matter of moments The finish line of the Allstate Hot Chocolate 15K Run changed life-as-they-know it for Chicago Police Sgt. Mike Nowacki, his girlfriend, and a complete stranger with ""serendipitous"" timing.",1.0,0.2400144652643489,0.6200072326321744,0.49334297684289924
N63958,foodanddrink,recipes,Copycat Cracker Barrel Chicken and Dumplings Recipe Craving some comfort food from Cracker Barrel? Skip the restaurant and make this copycat chicken and dumplings recipe instead!,1.0,0.260728493048367,0.6303642465241834,0.5071523286989112
N4936,autos,autosenthusiasts,Lance Altimeter Is A Delicious Drop-In Truck Camper Debuting At SEMA The all-in-one Overlanding package sleeps four and is fully equipped for an off-grid weekend.,1.0,0.2846667241970265,0.6423333620985132,0.5231111494646843
N58410,tv,tv-celebrity,Tristan Thompson Gushes Over Ex Khloe Kardashian After Her People's Choice Win Khloe's ex and the father of her child raved about her in an Instagram post.,1.0,0.242747197198798,0.621373598599399,0.495164798132532
N58885,health,fitness,3 Months of Full Body Workouts Helped This Guy Get Shredded at 40 Mat Smith ramped up his workouts and found an online support group to share fitness goals.,1.0,0.2601083472315033,0.6300541736157517,0.5067388981543355
N47624,news,newsworld,"US, South Korea could scale back joint drills: Esper US military exercises with South Korea could be scaled back to aid diplomacy with the nuclear-armed North, Defense Secretary Mark Esper said on his way to Seoul, as Pyongyang said it was running out of patience. Seoul and Tokyo are both major US allies, democracies and market economies faced with an overbearing China and nuclear-armed North Korea.",1.0,0.2588117696857936,0.6294058848428968,0.5058745131238624
N40559,news,newsworld,"2 dead, 3 injured in a school shooting in Russia Russian police say a student has killed a fellow student and wounded three more in a shooting at a college before taking his own life. Russia's state Investigative Committee says the 19-year-old student in Blagoveshchensk near the border with China brought a hunting rifle to class Thursday and opened fire on students, shooting one dead and severely injuring three more.",1.0,0.2604553741885327,0.6302276870942664,0.5069702494590218
N45561,news,newsphotos,"Inside the world's largest plane, which has a wingspan longer than a football field and a mysterious new owner The Stratolaunch is 238 feet long, 50 feet tall, and has a 385-foot wingspan. It made its first flight in April.",1.0,0.2843645347276635,0.6421822673638318,0.5229096898184423
N8957,music,cma-awards,Best country music albums of all time Stacker has compiled a list of the best country albums of all time as per Billboard's Greatest of All Time Country Albums list. These ratings are based on albums' weekly performance on the Top Country Albums chart from January 1996 to June 2016.,1.0,0.3057700239114205,0.6528850119557102,0.537180015940947
N49252,entertainment,entertainment-books,"100 Books Everyone Should Read Before They Die If you want to fill your shelves with classic titles and tomes that will open your mind to many worlds of fancy, facts, and fiction, these 100 books are the place to start.",1.0,0.3088082307199814,0.6544041153599907,0.5392054871466543
N30253,health,nutrition,"29 Foods Diabetics Should Avoid While some foods may seem healthy, they can be low-nutrition sources of hidden sugars. Here are foods to avoid.",1.0,0.3161219276706208,0.6580609638353104,0.5440812851137472
N42266,lifestyle,lifestylehomeandgarden,"Stylish Living Room Ideas, From Floral to Family-Friendly Bookmark this for the next time you need a refresh.",1.0,0.2835703219204559,0.641785160960228,0.5223802146136373
N53696,news,newsworld,"Ugly From the Outset: Hong Kong's Day of Widespread Violence HONG KONG   Hong Kong was a city on edge on Monday following escalating violence, in which one demonstrator was shot point blank by a police officer and one man was doused with a flammable liquid and set on fire after he scolded protesters. At nightfall, both men were fighting for their lives in a city seething with resentments. Protesters have voiced outrage at police officers they see as increasingly resorting to force, and at a government...",1.0,0.2544575596473668,0.6272287798236834,0.5029717064315778
N46029,news,newsworld,"How Russia Meddles Abroad for Profit: Cash, Trolls and a Cult Leader The Russians were hard to miss. They appeared suddenly last year in Madagascar's traffic-snarled capital, carrying backpacks stuffed with cash and campaign swag decorated with the name of Madagascar's president.",1.0,0.2514172236042981,0.6257086118021491,0.5009448157361986
N28204,finance,markets,"A $100 Billion Fund Manager Is Debunking Stock-Bubble Theories Negative interest rates are unnaturally propping up the stock market and at some point the whole edifice will collapse. It's an oft-repeated theory, but history suggests it might be wrong.",1.0,0.2635267817628385,0.6317633908814193,0.509017854508559
N38483,entertainment,celebrity,"Celebs Who Look Even Better With Gray Hair, From Anderson Cooper to Steve Carell Steve Carell, we salute you.",1.0,0.2581425304683299,0.629071265234165,0.5054283536455533
N61214,news,newsscienceandtechnology,SpaceX set to launch another 60 Starlink internet satellites Initial service is expected to begin next year with global connectivity expected in 2021,1.0,0.2994417216149118,0.6497208608074558,0.5329611477432745
N7419,lifestyle,lifestylevideo,"Why This Couple Is Getting a 'Sleep Divorce' A New Jersey couple is getting an unusual ""divorce."" Liz and Rich Alterman have been happily married for almost 20 years. They have three children and are now on the brink of getting ""sleep divorced.""",1.0,0.2518183083283678,0.6259091541641839,0.5012122055522452
N3992,news,newsworld,"Dozens detained in India over holy site social media comments Indian police have arrested dozens of people for social media comments that allegedly threatened ""communal harmony"" after the Supreme Court awarded a holy site once used for a mosque to Hindus, officials said Monday. The site in the northern city of Ayodhya has in the past caused communal riots that have left thousands dead, and security forces have been on alert since the verdict was announced on Saturday.",1.0,0.2707996608844435,0.6353998304422217,0.5138664405896289
N46972,news,newsworld,U.S. calls on Iraq to hold early elections U.S. calls on Iraq to hold early elections,1.0,0.265122673450075,0.6325613367250376,0.51008178230005
N20824,finance,markets,"The economic picture is darkening in states critical to Trump's reelection bid A closer look at key battleground states could spell trouble for the candidate, whose populist economic proposals have been central to his campaign.",1.0,0.228452943718224,0.6142264718591119,0.4856352958121493
N36273,sports,football_nfl,"Best, worst QB performances from NFL Week 10 Lamar Jackson continues to excel. Philip Rivers Continues to... not excel.",1.0,0.2456226691626979,0.622811334581349,0.49708177944179854
N51853,finance,markets,"The problem with diamonds is they keep getting cheaper Americans are buying more diamond jewelry than ever before, but prices for most polished gems are falling.",1.0,0.3098166281575325,0.6549083140787663,0.5398777521050216
N64174,news,newscrime,Georgia executes man convicted of killing convenience store clerk Georgia executes man convicted of killing convenience store clerk,1.0,0.2266291728515233,0.6133145864257616,0.48441944856768215
N17059,finance,finance-companies,"No. 1 milk company declares bankruptcy amid drop in demand Dean Foods blamed a decadeslong drop in milk consumption that has seen people turn to alternatives like soda, juice and almond milk.",1.0,0.2521218075890571,0.6260609037945286,0.5014145383927047
