ID,category,sub_category,content,collaborative_rec,content_rec,mean,two_one
N16158,lifestyle,lifestylebuzz,"Nationals pitcher criticized for missing playoff game for daughter's birth Daniel Hudson said his family is his ""top priority"" after receiving criticism for missing a playoff game for the birth of his daughter.",0.0896203412582498,0.2476762564333547,0.16864829884580224,0.1949909513749864
N45824,sports,football_nfl_videos,"Ian Rapoport: MRI results are good news for Patrick Mahomes, Kansas City Chiefs NFL Network Insider Ian Rapoport and James Palmer provide a Patrick Mahomes injury update.",0.0989782825938465,0.2418308602938625,0.1704045714438545,0.19421333439385716
N32027,sports,football_nfl,Payton declines to name Saints starting QB for Week 8 ,0.0989782825938465,0.2293228917331825,0.1641505871635145,0.18587468868673715
N62396,sports,football_nfl,Colin Kaepernick is the perfect replacement for Patrick Mahomes This is a good idea if Mahomes misses a lot of time.,0.0989782825938465,0.2570194241300826,0.17799885336196455,0.2043390436180039
N17463,news,newspolitics,"Democrats unveil procedures for Trump's impeachment inquiry, rebutting GOP attacks The resolution hands the lead role to the House Intelligence Committee and its chairman, Rep. Adam B. Schiff, who would have broad latitude to organize extended questioning of potential public witnesses.",0.0989782825938465,0.2575542392475679,0.1782662609207072,0.20469558702966076
N27164,sports,football_nfl,"Burning questions for Dolphins vs. Steelers on 'Monday Night Football' The Dolphins (0-6) are visiting the Steelers (2-4) to close out NFL Week 8 on Monday Night Football. Fans should brace for an ugly game, because that's been a weekly occurrence whenever the Dolphins take the field.",0.0989782825938465,0.2477423492885662,0.17336031594120635,0.19815432705699296
N10270,autos,autossports,"What Do Old-School Mustang Guys Think of the Kia Stinger? We wondered, so we put the Original Venice Crew in our long-term Stinger GT.",0.0989782825938465,0.2677185332304579,0.1833484079121522,0.21147178301825412
N52196,news,newspolitics,"Graham claims victory with impeachment vote Sen. Lindsey Graham, who introduced a resolution condemning secretive impeachment proceedings in the House, claimed victory Monday after House Speaker Nancy Pelosi announced she'll hold a formal vote and open up the hearings to the public.",0.0989782825938465,0.256356843334713,0.17766756296427974,0.2038973230877575
N4745,news,newspolitics,"Testimony: White House lawyer told Vindman not to discuss Ukraine call The senior White House lawyer who placed a record of President Donald Trump's July 25 call with Ukraine's president in a top-secret system also instructed at least one official who heard the call not to tell anyone about it, according to testimony heard by House impeachment investigators this week.",0.0989782825938465,0.2505080211610563,0.1747431518774514,0.1999981083053197
N64456,news,newsus,"LA's Getty fire was sparked by downed power lines, Mayor Garcetti says LOS ANGELES - The Getty fire was sparked by a tree branch that fell on power lines, Los Angeles Mayor Eric Garcetti announced at a news conference Tuesday evening. Video footage shows the branch breaking off a eucalyptus tree and sparking the fire in the 1900 block of North Sepulveda Boulevard, Garcetti said. The power lines being examined are operated by the Los Angeles Department of Water ...",0.0989782825938465,0.2538627067515863,0.1764204946727164,0.20223456536567302
N37835,sports,football_nfl,Giants will not go back to Eli Manning after Daniel Jones' struggles Jones has thrown eight interceptions and has lost two fumbles in his past four starts.,0.0989782825938465,0.2507672888312386,0.17487278571254256,0.20017095341877458
N63306,sports,football_nfl,Jenkins' scorching response to Scandrick ripping Eagles Former Philadelphia Eagles cornerback Orlando Scandrick ripped into Malcolm Jenkins and his former teammates in general.,0.0989782825938465,0.2298593291160491,0.16441880585494778,0.18623231360864823
N62055,news,newspolitics,"Trump campaign threatens to sue CNN, citing Project Veritas videos An attorney representing President Trump's reelection campaign sent a letter to CNN on Friday threatening to sue.",0.0989782825938465,0.2290426589456461,0.16401047076974629,0.18568786682837957
N35685,autos,autosreview,"First Drive! 2020 Shelby GT500 Is an Apex Predator, Turning Drivers Into Track Stars Driving the 2020 Shelby GT500 on the street, dragstrip, and road course reveals an apex predator that turns any driver into a track star.",0.0989782825938465,0.2917542859965478,0.19536628429519715,0.22749561819564737
N57364,news,newspolitics,"Facebook's Zuckerberg grilled by AOC on fact-checking policy for political ads Facebook CEO Mark Zuckerberg struggled to explain the social media company's new policy on fact-checking political ads under questioning from Rep. Alexandria Ocasio-Cortez during a Tuesday hearing. The company recently announced that to protect political speech it would no longer fact check ads from politicians, essentially allowing campaigns to pay Facebook to spread disinformation. At the hearing of the House Financial Services committee,...",0.0989782825938465,0.2445281281891822,0.17175320539151434,0.19601151299073696
N36068,sports,football_nfl,"AP source: Trent Williams ends holdout, reports to Redskins A person with knowledge of the situation says left tackle Trent Williams has reported to the Washington Redskins, ending his lengthy holdout. The person spoke to The Associated Press on condition of anonymity because the team had not announced Williams' return. He can be kept off the 53-man roster for up to three weeks after reporting. Washington did not deal the 31-year-old before the NFL trade deadline Tuesday, which prompted...",0.0989782825938465,0.2505964499439218,0.17478736626888414,0.20005706082723002
N26606,autos,autosenthusiasts,2020 Shelby GT500 Aero Performance & Cooling Supercomputers and 3-D Printing are secrets to the all-new Mustang Shelby GT500's high performance.,0.0989782825938465,0.2918933808285407,0.1954358317111936,0.22758834808364264
N4408,sports,football_nfl,"Patrick Mahomes already back at practice for Chiefs Although Reid didn't rule Mahomes out for the team's Week 8 game, it seems like a long-shot for the quarterback to get back onto the field that quickly.",0.0989782825938465,0.2397738184740712,0.16937605053395885,0.19284197318066296
N15087,sports,football_nfl,"Trent Williams to Cleveland rumor emerges Dysfunctional teams do dysfunctional things. But sometimes they do something that makes sense, against their nature. Washington may soon be throwing in the towel on the Trent Williams holdout, trading the disgruntled left tackle in advance of the deadline that arrives in only two weeks. Steve Doerschuk of the Canton Repository shares the news with [more]",0.0989782825938465,0.2399393162688347,0.1694587994313406,0.19295230504383862
N14437,sports,basketball_nba,"Suns' Deandre Ayton suspended 25 games for violating NBA anti-drug policy The league informed the Suns that Ayton, the top pick in the 2018 draft, tested positive for a diuretic. His suspension begins Friday.",0.0989782825938465,0.2871683002979371,0.1930732914458918,0.22443829439657356
N22929,sports,football_nfl,"Burning questions for Cowboys vs Giants on 'Monday Night Football' Capping off the action in Week 9, the New York Giants are hosting the Dallas Cowboys for the NFC Monday Night Football. There are five burning questions for this NFC matchup.",0.0989782825938465,0.2459157608892087,0.1724470217415276,0.19693660145742128
N34380,news,newspolitics,"House rejects GOP measure censuring Schiff Democrats in the House turned aside a GOP-led privileged resolution to censure House Intelligence Committee Chairman Adam Schiff (D-Calif.) on Monday in a 218-185 vote.Republicans and President Trump have increasingly targeted Schiff, a public face of the impeachment effort.They have taken issue with Schiff's exaggerated account of the details of President Trump's July 25 phone call with Ukrainian President Volodymyr Zelensky during a...",0.0989782825938465,0.2498241817882844,0.17440123219106546,0.19954221539013842
N54807,news,newsworld,"Russia questions language of ""unusual"" Trump letter to Erdogan Russia questions language of ""unusual"" Trump letter to Erdogan",0.0989782825938465,0.2537792034253768,0.17637874300961165,0.20217889648153337
N5019,sports,football_nfl,"Winners, losers from Cowboys' win over Giants on 'Monday Night Football' In a NFC East tilt, the Cowboys overwhelmed the Giants defense late while Big Blue continues to trip over its own feet.",0.0989782825938465,0.2370627892854211,0.16802053593963379,0.19103462038822958
N64395,sports,football_nfl,J.J. Watt has sobering quote after season-ending injury The Houston Texans lost the rock of their team for the season during Sunday's win over the Oakland Raiders. Stud pass rusher and future Hall of Famer J.J.,0.0989782825938465,0.2492299064613595,0.174104094527603,0.19914603183885518
N14137,sports,football_nfl,MetLife Stadium searching for the famous black cat from 'Monday Night Football' ,0.0989782825938465,0.2130635151631209,0.1560208988784837,0.17503510430669608
N1406,sports,football_nfl,"NFL Films signed off on airing of Sam Darnold's 'ghosts' comment A firestorm has erupted in New York over how an unflattering comment from a mic'd up Sam Darnold made the air during ESPN's coverage of the Jets' blowout loss to the Patriots on ""Monday Night Football.""",0.0989782825938465,0.1834060660350153,0.1411921743144309,0.15526347155462572
N52865,news,newspolitics,Ohio's Reputation As a Must-Win State May No Longer Be True ,0.0989782825938465,0.2346181262980983,0.1667982044459724,0.1894048450633477
N53209,sports,baseball_mlb,"â€‹Are the Astros stealing signs to gain an edge in ALCS? Hopefully. If your code is easy to crack, the problem is on you, not the codebreaker.",0.0989782825938465,0.2897842201574835,0.194381251375665,0.22618224096960451
N52227,sports,basketball_nba,"Joel Embiid, Karl-Anthony Towns likely facing multi-game bans for roles in brawl Both teams don't play again until Saturday, so the league will have plenty of time to assess whether any players left the bench area, which could lead to additional suspensions.",0.0989782825938465,0.2411759253949329,0.1700771039943897,0.1937767111279041
N37481,sports,football_nfl,Baker Mayfield blasts officials after Browns loss: Refs were 'pretty bad today' ,0.0989782825938465,0.2326896874981232,0.16583398504598484,0.18811921919669763
N49990,sports,football_nfl,Watch: Kevin Harlan's call of streaking cat on 'MNF' is epic This might legitimately be the best thing we've ever heard from Mr. Harlan.,0.0989782825938465,0.2442733746276445,0.1716258286107455,0.19584167728304516
N5211,sports,football_nfl,"Jets trade DL Leonard Williams to Giants The USC product is in the final year of his deal, and the Jets wanted to get something for him while they still could. The third-rounder they'll be getting from the Giants will presumably be an early third-rounder.",0.0989782825938465,0.2621912542694279,0.1805847684316372,0.20778693037756743
N21851,sports,football_nfl,"Next man up: Chiefs prepare for life without Mahomes, with Moore Two weeks ago, Tyreek Hill served as Matt Moore's top target.",0.0989782825938465,0.2344811193894783,0.1667297009916624,0.1893135071242677
N32670,news,newspolitics,"McConnell tees up government funding votes amid stalemate Senate Majority Leader Mitch McConnell (R-Ky.) is turning the Senate toward trying to pass a set of long-stalled appropriations bills. ""Congress has fallen badly behind schedule on appropriations. It's been a month since my Democratic colleagues filibustered government funding here on the floor, blocking defense funding and a pay raise for service members. We need to get moving,"" McConnell said from the Senate floor. McConnell said the Senate...",0.0989782825938465,0.2423215355946816,0.17064990909426403,0.1945404512610699
N62283,news,newsworld,British PM denied new Brexit deal vote Prime Minister Boris Johnson prepared to Monday make a second attempt to ram his EU divorce deal through parliament and avoid the political damage of delaying Brexit next week. But EU officials were still making preparations for Britain to leave in 10 days' time.,0.0989782825938465,0.2750029692307928,0.18699062591231966,0.21632807368514403
N21428,autos,autosnews,Ford's Mach E Electric SUV Spied Looking...Interesting We're not sure how we feel about this new EV's Mustang-inspired styling cues.,0.0989782825938465,0.2521299550269088,0.17555411881037766,0.20107939754922138
N51180,finance,finance-companies,"Verizon to give its wireless customers a year of Disney+ Verizon announced Tuesday that it is teaming up with Disney to give new and existing 4G LTE and 5G wireless ""unlimited"" customers a free year of the new Disney+ streaming service. The exclusive promotion coincides with the Disney+ launch on Nov. 12. New Verizon FIOS and 5G Home Internet customers will also qualify for a year of Disney+.",0.111868971679402,0.2959977562831025,0.20393336398125225,0.23462149474853566
N62471,sports,football_nfl,"Trent Williams fails physical, experiencing discomfort with helmet Washington Redskins tackle Trent Williams' health situation has managed to get stranger after he reported to the team.",0.1169067840982469,0.2504726566678964,0.18368972038307166,0.2059506991446799
N25885,entertainment,celebrity,Here's Every Costume the Kardashian-Jenner Family Wore This Halloween Every Kardashian-Jenner Halloween Costume (Even the Kids!) From 2019,0.1170650516580667,0.2587954257877908,0.18793023872292874,0.21155196774454943
N8629,sports,basketball_nba,"Anthony Davis on possibly joining hometown Bulls: 'I mean, I am a free agent next year' ",0.1170650516580667,0.2762030110632919,0.1966340313606793,0.2231570245948835
N56175,foodanddrink,restaurantsandnews,Pizza Hut is testing a new round pizza box that looks like a spaceship and is meant to keep pizza fresher Pizza Hut has partnered with Zume to test a new round pizza box that is supposed to keep pizza fresher and crispier. It's also compostable.,0.1179346204965032,0.2548270322409773,0.18638082636874026,0.2091962283261526
N42526,finance,finance-companies,'Go back to work': Outcry over deaths on Amazon's warehouse floor Billy Foister died last month after a heart attack at work. The incident was just one in a series of recent accidents and fatalities,0.1191056332680434,0.2301701354151583,0.17463788434160085,0.19314863469945334
N10679,news,newspolitics,Justice Dept. appeals order on Mueller grand jury testimony The Justice Department is appealing a judge's order directing the department to produce to the House secret grand jury testimony from special counsel Robert Mueller's Russia investigation.,0.1208805421332094,0.2683009826864354,0.19459076240982237,0.21916083583536003
N46795,music,musicnews,Eminem Says He Sides With Chris Brown Over Rihanna Assault on Alleged Leaked Song Leaked audio of Eminem allegedly rapping that he'd side with Chris Brown over Rihanna assault is making rounds on social media and fans are not happy.,0.1211989792190423,0.2525597971957845,0.1868793882074134,0.20877285787020375
N23163,news,newspolitics,"'You people with this phony Emoluments Clause': Cabinet meeting devolves into 71 minutes of Trump grievances President Trump, trying to dig out from two new political holes of his own making on top of the expanding House impeachment inquiry, held forth for 71 minutes Monday during what was ostensibly a Cabinet meeting but ended up being a familiar torrent of grievance, defensiveness and bold statements about his expansive view of his own powers.",0.1230996447587603,0.2296112650270806,0.17635545489292045,0.19410739160430718
N57987,autos,autoshybrids,"2020 Jeep Wrangler Plug-In Hybrid Spied Hiding Its Charging Port Classic looks, modern tech.",0.1247596607649574,0.2755435492391417,0.20015160500204954,0.22528225308108027
N60858,autos,autostrucks,Next Ford F-150 Spied By Motor1.com Reader Work continues on America's favorite truck.,0.1247596607649574,0.2639794916414105,0.19436957620318396,0.21757288134925948
N60826,autos,autossports,This might be a next-gen Nissan Z car mule Powertrain for the 370Z successor could be hiding under the hood,0.1247596607649574,0.2726574227572503,0.19870854176110386,0.22335816875981934
N28862,autos,autosenthusiasts,This Is What the 2020 Toyota Supra Should've Looked Like From the Start That wing should be standard on every Supra. The fact that it isn't is a tragedy.,0.1247596607649574,0.2836316603749739,0.20419566056996563,0.23067432717163508
N63276,autos,autosenthusiasts,Gordon Ramsay's Ferrari Monza SP2 Looks Delicious Good thing the roofless ride is inside because it's raining outside.,0.1265411479443025,0.2677302756906368,0.19713571181746964,0.22066723310852537
N3933,sports,football_nfl,"Bears' Khalil Mack calls out Eagles C Jason Kelce's controversial tactics in offsides penalties The Chicago Bears doomed themselves early in the first half in a 22-14 loss to the Philadelphia Eagles. While the Bears offense had a historically bad first half performance   netting just 9 total yards   the defense had its share of struggles with five pre-snap penalties in the first half against the Eagles. Bears outside linebacker Khalil Mack isn't one to point fingers for the defense's struggles, but when asked about those pre-snap...",0.1284635746036402,0.2132549662131151,0.17085927040837764,0.1849911690099568
N41218,news,newspolitics,"Election Day 2019: Most Important Races and What to Watch For In elections that will determine policy, the political makeup of state legislatures and who lives in governors' mansions, voters will head to the polls Tuesday in states across the country.",0.128637040727271,0.2620249174955262,0.1953309791113986,0.2175622919061078
N54305,sports,football_nfl,Urban legend? How the Cowboys' rout of the Eagles helped take Coach Meyer out of the conversation Did the Cowboy's victory Sunday night take care of the Urban Meyer rumors?,0.128717476822976,0.2187520017809431,0.17373473930195954,0.18874049346162072
N19043,foodanddrink,recipes,Our 30 Favorite Recipes for Brussels Sprouts They're not actually baby cabbages. But they are adorable and delicious.,0.1288554670278023,0.2782998013204054,0.20357763417410385,0.228485023222871
N29854,foodanddrink,recipes,81 Bean Recipes You'll Be Making All Year Long What's for dinner tonight? These 55 great recipes for beans.,0.1288554670278023,0.2893034476055119,0.2090794573166571,0.23582078741294202
N21342,autos,autosownership,13 Ways You're Shortening the Life of Your Car Put the brakes on these all-too-common mistakes to help keep your car on the road and out of the shop.,0.1288554670278023,0.292941676126187,0.21089857157699465,0.23824627309339208
N2886,foodanddrink,recipes,40+ Ridiculously Good Gluten-Free Thanksgiving Recipes There's no gluten here. But there are potatoes. And stuffing. And pies.,0.1288554670278023,0.264251028157474,0.19655324759263815,0.21911917444758341
N44442,news,newspolitics,"CNN Poll: 50% support impeaching Trump and removing him from office Half of Americans say President Donald Trump should be impeached and removed from office, according to a new CNN poll conducted by SSRS.",0.1290917127588463,0.2672597421395305,0.1981757274491884,0.2212037323459691
N54435,news,newsus,"'Angel' car saves Arizona family after smashing into suspected drunk driver running red light, video shows An Arizona driver who police praised as an ""angel"" may have saved the lives of a couple pushing a stroller in a crosswalk last week after video showed the car smashing into a suspected drunk driver speeding through a red light -- who came inches away from plowing into the family.",0.1296582388389093,0.2391985604948514,0.18442839966688035,0.2026851199428707
N54225,news,newsus,"Multiple Houses on Fire After Plane Crashes in NJ At least two houses are on fire in Colonia, New Jersey, after a plane crash, according to the Colonia Fire Department. A Cessna 414 crashed into a home on Berkley Avenue at 11 a.m. Tuesday, according to the FAA. The FAA will conduct an investigation into the cause of the crash. The number of people aboard and their conditions are unknown. The area is a heavy residential area with tree-lined streets. News 4's Dennis Protsko, who is part of the...",0.130446148821947,0.2625547331873771,0.19650044100466205,0.2185185383989004
N28074,lifestyle,lifestylefamilyandrelationships,"Woman Texts Dead Father's Phone for 4 Years & Finally Receives an Emotional Reply The pain of losing a parent, especially at a young age, is one that never really goes away.",0.1306202937193895,0.2388887511047727,0.1847545224120811,0.20279926530964495
N22816,foodanddrink,foodnews,"Snow crab sells for record price in Japan A ""five shining star"" snow crab was auctioned off in Tottori, Japan for a record-breaking 5 million yen ($46,000). wide.",0.1308253095820586,0.2802396508297912,0.2055324802059249,0.2304348704138803
N55911,lifestyle,lifestylebuzz,Katie Holmes Talks About That Bra and Cardigan Moment Katie Holmes Talks About That Bra and Cardigan Moment,0.13324222945921,0.2447233981093235,0.18898281378426673,0.20756300855928567
N28058,lifestyle,lifestylebuzz,Strange Dog Shows Up On Woman's Lawn   And Seems To Recognize Her Kate Howard was sitting outside her home one afternoon after a memorial service when something amazing happened.,0.1333529023760246,0.2343362028557545,0.18384455261588956,0.20067510269584451
N56447,tv,tv-celebrity,"'The Office' star Jenna Fischer responds to Chrissy Teigen's theory that Jim and Pam are divorced Jenna, who played Pam opposite John Krasinski's Jim on the hit NBC sitcom, thinks Chrissy got it wrong.",0.1336544192948707,0.2204386552108814,0.17704653725287606,0.19151057657221118
N59026,news,newsus,"Cincinnati school board candidate accused of 'pretending to be black' in his ads A current CPS board member took to Twitter Sunday to say a candidate for the board ""is a white guy pretending to be black to get votes"" in ads.",0.1365679954539043,0.2417910772769695,0.18917953636543688,0.2067167166692811
N58090,sports,football_nfl,"Frustrated Antonio Brown has active morning on Twitter Receiver Antonio Brown continues to wait for his next opportunity, and he continues to be justifiably frustrated by the fact that the NFL's slow-moving investigation is essentially keeping Brown suspended without pay.",0.1366655141230945,0.2602197888837118,0.19844265150340312,0.21903503063017268
N18086,foodanddrink,restaurantsandnews,"I Would Go Back to This Missouri Theme Park Just for the Snacks The excellent food at Silver Dollar City is one of many reasons that Branson, Missouri is an essential stop on any Midwest road trip.",0.1368909583991598,0.2684475213210495,0.20266923986010466,0.2245953336804196
N32268,foodanddrink,foodnews,"I ate one of Meghan Markle's favorite foods from Toronto here's what I thought The food at Terroni was good and the prices were surprisingly affordable, but the service was disappointing.",0.1368909583991598,0.2277714658271715,0.18233121211316566,0.1974779633511676
N21720,health,health-news,Juul accused of selling 1 million tainted vaping pods Former Juul senior vice president Siddharth Breja claims he was fired in March for raising concerns about contaminated pods,0.1368909583991598,0.2457961589199583,0.19134355865955904,0.20949442541302546
N27919,sports,golf,Martin worries about amputation after breaking right leg Casey Martin's worst fear was realized earlier this month when he stepped awkwardly off a curb and fractured his right tibia.,0.1368909583991598,0.2377131129241808,0.1873020356616703,0.20410572808250713
N41089,lifestyle,lifestylebuzz,"This Man's Rattlesnake Bite Is a Warning to Everyone to Take Animal Bites More Seriously You wouldn't think a baby rattlesnake could do so much damage, but Austin McGee knows better after almost losing his finger to one.",0.1368909583991598,0.2390923483135634,0.1879916533563616,0.20502521834209553
N61186,music,music-celebrity,Infected toe stops R. Kelly from attending court hearing CHICAGO (AP)   R. Kelly's lawyer has told a federal judge that an infected toe prevented the R&B star from attending a hearing in his child pornography case in Chicago. Kelly is detained at a jail two blocks from the courthouse and had been expected to appear at Wednesday's status hearing. But defense lawyer Steve Greenberg said one of Kelly's toenails had to be removed as treatment and Kelly worried someone might trample on his toe as he was...,0.1368909583991598,0.256274595822563,0.19658277711086142,0.21648005001476195
N3577,health,health-news,Tennessee reports 49 cases of lung injury linked to vaping Tennessee health officials say they have received 49 cases of serious lung injury in people who use electronic cigarettes or other vaping devices.,0.1368909583991598,0.2809732884391658,0.20893212341916279,0.23294584509249713
N60850,foodanddrink,newstrends,"Popeyes is bringing back the chicken sandwich--and also takes a swipe at Chick-fil-A FORT WORTH -- The much-loved Popeyes Louisiana Kitchen fried chicken sandwich returns Sunday, and the company's announcement was a hard kick to the gizzard for competitor Chick-fil-A. After a limited-time summer special turned into a $65 million marketing bonanza, Popeyes will return both the spicy and mild sandwiches -- and on Sunday, when Chick-fil-A is not even open. Popeyes' ...",0.1368909583991598,0.2219524665449571,0.17942171247205846,0.193598630496358
N20109,music,musicnews,Lady Gaga Says 'Fame Is Prison' -- And Has Fans Speculating If New Music Is on the Way The singer's fans are also wondering if she's talking about the pressures of the industry.,0.1368909583991598,0.2445608768152355,0.19072591760719765,0.20867090400987692
