ID,category,sub_category,content,collaborative_rec,content_rec,mean,two_one
N47401,foodanddrink,tipsandtricks,"Your turkey timeline: what to do and when for the perfect holiday roast Most people only cook a turkey once or twice a year which inevitably turns the whole thing into a stressful experience, full of paranoia that the bird will turn out dry. But fear not! Our fail-safe turkey timeline will take you all the way from ordering through to what to do with the leftovers.",1.0,0.3041701262317828,0.6520850631158914,0.5361134174878552
N23184,entertainment,celebrity,Long-term celebrity couples who won't get married These committed celeb couples have opted not to tie the knot.,1.0,0.2366638668022003,0.6183319334011002,0.4911092445348002
N56051,lifestyle,lifestyleroyals,"Meghan Markle and Prince Harry Reunite with Kate Middleton and Prince William for Remembrance Service Meghan Markle, Harry Reunite Kate and William at Remembrance Day",1.0,0.2427950724415278,0.6213975362207639,0.49519671496101847
N36532,weather,weathertopstories,Winds fan ferocious fires in Australia's most populous state Ferocious wildfires were burning at emergency-level intensity across Australia's most populous state and into Sydney's suburbs on Tuesday as authorities warned most people in their paths that there was no longer time to flee.,1.0,0.2471110793320582,0.6235555396660291,0.49807405288803874
N14592,entertainment,entertainment-celebrity,"Chrissy Teigen's weekend was basically a clapback double-header, plus more news Chrissy Teigen gives us two more lessons in the art of the clapback. Plus, more celebrity news for Nov. 12, 2019.",1.0,0.238249822517269,0.6191249112586346,0.49216654834484597
N64745,sports,baseball_mlb,"With latest sign-stealing revelations, Houston Astros once again toe baseball's ethical lines Accused of electronically stealing signs in 2017, the Astros organization faces even more questions about its culture.",1.0,0.220791844451954,0.6103959222259769,0.48052789630130266
N22417,travel,travelarticle,Divers salvage 100-year-old liquor from WWI shipwreck A team of ocean explorers says it has retrieved cognac and liqueur from a ship that was bound for Russia when it was sunk by a German submarine in 1917.,1.0,0.2550993147830498,0.6275496573915249,0.5033995431886998
N25406,autos,autossuvs,We Test the 2020 Jeep Wrangler EcoDiesel Jeep's diesel engine turns a great off-roader into something special.,1.0,0.2847667015609242,0.6423833507804622,0.5231778010406161
N41578,lifestyle,lifestyleroyals,Meghan Markle Chose a Chic Black Ensemble for Remembrance Sunday Services She paired her outfit with a bold hat and a crimson poppy pin.,1.0,0.2369784290114253,0.6184892145057126,0.4913189526742835
N35131,finance,markets,"The world's largest trade deal could be signed in 2020 RCEP involves all 10 ASEAN countries and five of the bloc's major trading partners: Australia, China, Japan, New Zealand and South Korea.",1.0,0.2967480452206407,0.6483740226103203,0.5311653634804271
N47099,foodanddrink,tipsandtricks,"This Korean Ingredient Makes Your Chili Taste Amazing As in, more amazing than it already is.",1.0,0.3129248441329912,0.6564624220664956,0.5419498960886608
N12995,news,newsus,"Cows swept out to sea by Hurricane Dorian are found months later   on the Outer Banks CHARLOTTE, N.C. - Cape Lookout National Seashore on the Outer Banks has discovered three cows are roaming the national park, and it is believed they got there by swimming four to five miles across the Core Sound during Hurricane Dorian. All three were living on Cedar Island when the hurricane generated a ""mini tsunami"" on Sept. 6, sweeping much of the wildlife off the island, including 28 wild ...",1.0,0.2639327983419759,0.631966399170988,0.5092885322279839
N49030,movies,movies-celebrity,"Kevin Hart Steps Out for Date Night With Wife Amid Recovery From Car Accident Kevin Hart is in better spirits following the violent car crash that left him hospitalized in September. Last night, he was spotted out with his wife for date night in Los Angeles.",1.0,0.2429674111417813,0.6214837055708906,0.4953116074278542
N40065,sports,more_sports,"The Day in Sports: Sunday, November 10, 2019 The Day in Sports: Sunday, November 10, 2019",1.0,0.2546882670609625,0.6273441335304812,0.503125511373975
N29196,health,health-news,"Florida boy's mock CPR drill goes viral: 'How cute is this!' The saying ""the apple doesn't fall far from the tree"" rings very true for a 3-year-old Florida boy who apparently wants to be just like his father, a first responder.",1.0,0.2294857482837448,0.6147428741418723,0.4863238321891632
N42977,news,newsus,"'It's not over': Sarah Palin says she is fighting to repair her marriage Former Alaska Gov. Sarah Palin said she learned her husband, Todd, wanted a divorce in an email from his lawyer and that the two are seeking counseling.",1.0,0.2544065925827572,0.6272032962913786,0.5029377283885048
N37320,news,newspolitics,"Pro-Trump conservatives are getting trolled in real life by a far-right group Groypers, as they call themselves, fuse online political extremism with stunts at conservative events.",1.0,0.2225195740505141,0.6112597870252571,0.48167971603367604
N51808,news,newspolitics,"Democrats' impeachment lawyer cut his teeth prosecuting mobsters, Wall Street cheats Daniel Goldman will lead witness questioning during the hearings that begin Wednesday.",1.0,0.2140977692718868,0.6070488846359434,0.47606517951459115
N26944,news,newsus,"Jeffrey Epstein's Estate May Set Up a Program to Pay Accusers Lawyers for Jeffrey Epstein's estate are considering setting up a program to resolve claims filed by women who say they were abused by the financier, who killed himself in August while facing federal sex trafficking charges. The plan was disclosed in a court filing on Tuesday by a lawyer for one of Mr. Epstein's accusers, who is suing the estate in federal court in Manhattan. The filing said lawyers for Mr. Epstein's estate had informed...",1.0,0.2494381174192429,0.6247190587096214,0.4996254116128286
N58241,finance,markets,"The Dow was perfectly unchanged on Tuesday, a rare occasion on Wall Street The 30-stock average closed flat going out at least six decimal places. It was the first unchanged close for the Dow since April 24, 2014.",1.0,0.27627698075701,0.638138490378505,0.51751798717134
N26706,news,newsus,Missing California hiker found dead at top of glacier just weeks before baby was due A missing hiker from Huntington Beach California was found dead on Thursday at the top of the Darwin glacier in the Inyo National Forest.,1.0,0.2434490749432202,0.62172453747161,0.4956327166288135
N46477,movies,movienews,Mark Ruffalo Wants to Set Up Jennifer Aniston on a Date Mark Ruffalo Wants to Set Up Jennifer Aniston on a Date,1.0,0.2563282601263817,0.6281641300631908,0.5042188400842544
N13341,news,newsus,"Rising temperatures put U.S. troops at risk during training, report finds By midcentury, troops could face an extra month of heat-index temperatures above 100 F every year, the Union of Concerned Scientists found.",1.0,0.270099707783869,0.6350498538919345,0.513399805189246
N47248,finance,markets,"Fed's Powell sees steady growth, signals pause in rate cuts Federal Reserve Chairman Jerome Powell expects the U.S. economy to continue growing at a solid pace, though it still faces risks from slower growth overseas and trade tensions.",1.0,0.2561031747023556,0.6280515873511778,0.5040687831349038
N13907,finance,finance-saving-investing,4 reasons you shouldn't max out your 401(k) Making high-dollar contributions to your 401(k) can cost you.,1.0,0.2799284010015025,0.6399642005007513,0.519952267334335
N31679,entertainment,celebrity,Biggest celeb weddings of the last decade Take a look back at the most memorable and extravagant celeb weddings that went down in the 2010s.,1.0,0.2488957339194061,0.624447866959703,0.49926382261293734
N56193,sports,football_nfl,Cowboys have questionable red zone calls in loss to Vikings ,1.0,0.2301375873737384,0.6150687936868692,0.48675839158249223
N61320,lifestyle,lifestyleroyals,Kate Middleton Wore a Simple Black Dress and Embellished Headband to the Festival of Remembrance The Duchess of Cambridge and the rest of the royal family are honoring those who have died in battle this weekend.,1.0,0.250143861341496,0.625071930670748,0.5000959075609973
N36436,news,newsphotos,"The 12 Texas cities everyone in the country is moving to Texas' largest cities were at the top of the list, as well as Midland, a major hub of the fracking boom.",1.0,0.2442714530352213,0.6221357265176106,0.4961809686901475
N51587,travel,traveltripideas,"The 24 Most Beautiful Castles in Europe Eat your heart out, Disney.",1.0,0.2721687140849965,0.6360843570424982,0.514779142723331
N64560,sports,basketball_nba,"Report: Knicks' brass will stay on if team shows 'progress' this season The New York Knicks' front office appears to be safe for now. Owner James Dolan met with president of basketball operations Steve Mills and others in management on Monday. The Knicks' brass left with the impression that their jobs would be secure as long as the team ""showed progress"" this season, league sources told SNY's Ian Begley. However, it's unclear what Dolan deems as ""progress,"" reports Begley. Mills and general manager Scott Perry are...",1.0,0.2496277081614702,0.6248138540807351,0.4997518054409801
N33677,tv,tv-celebrity,Marie Osmond 'chipped off a piece' of her kneecap when she fell on stage during performance Marie Osmond reveals that she chipped her knee when she fell during her Las Vegas residency performance last week.,1.0,0.2656070905283262,0.6328035452641632,0.5104047270188841
N57327,lifestyle,lifestylebuzz,Please Don't Yell at Your Dog! A new study shows it can cause long-term psychological impacts.,1.0,0.2706202725265804,0.6353101362632902,0.5137468483510536
N49712,news,newsgoodnews,"Wisconsin bus driver saves children wandering in snow, as deadly Arctic air mass grips US As bitter cold took hold across the Midwest earlier this week, a sharp-eyed bus driver in Wisconsin was credited with helping rescue two children who were very underdressed for the weather conditions.",1.0,0.2158688502900329,0.6079344251450165,0.4772459001933552
N19376,sports,basketball_nba,The HoopsHype Daily: Trae Young putting up monstrous numbers ,1.0,0.2557957041307481,0.6278978520653741,0.503863802753832
N58020,foodanddrink,beverages,Brooklyn Brewery Shows Craft Beer Can Be Nonalcoholic Too Special Effects hits all the notes of a craft brew with none of the alcohol,1.0,0.2558831446075056,0.6279415723037528,0.5039220964050037
N4913,finance,finance-companies,Don't be fooled: Costco says $75 coupon is a scam Wholesale retailer Costco is warning customers about a new scam that is promising shoppers a $75 coupon.,1.0,0.2725690326371192,0.6362845163185595,0.5150460217580795
N43670,sports,basketball_nba,"Draymond criticizes official for ejection: 'Don't tell me not to talk' Golden State Warriors forward Draymond Green made Chase Center history during Monday's loss to the Utah Jazz, becoming the first player ejected from a game in the new venue after arguing with an official. The three-time All-Star was given a second technical foul for continuing to plead his case after disagreeing with a blocking call, but it seems Green's spat with the official went beyond just that foul. ""I disagreed with that call,"" Green told...",1.0,0.2253396607677255,0.6126698303838627,0.4835597738451503
N58553,lifestyle,lifestyleroyals,"Prince Harry and Meghan Markle Will Reportedly Visit Oprah While in California During their six-week break from their royal duties, Prince Harry and Meghan Markle are planning to visit Oprah Winfrey, according to a royal insider.",1.0,0.2407306459302031,0.6203653229651016,0.49382043062013536
N9652,finance,finance-real-estate,"NYC is selling 'air rights' to city housing buildings, first big deal goes to de Blasio donors It may not be a bridge, but the city has something to sell you in Brooklyn   and donors to Mayor de Blasio are first in line to benefit. In what appears to be a textbook ""pay-to-play"" move, the city is selling NYCHA development rights to builders who gave de Blasio's campaigns more than $20,000.",1.0,0.2348530716002073,0.6174265358001036,0.4899020477334715
N38309,tv,tv-celebrity,Joe Giudice Says It Was 'Painful' Watching Real Housewives of New Jersey from Prison Joe Giudice Says It Was 'Painful' Watching RHONJ from Prison,1.0,0.2321424179404897,0.6160712089702448,0.4880949452936598
N15855,lifestyle,lifestyleroyals,"A body-language expert says Meghan Markle is ""politely disconnecting"" from the public, and honestly, we would too Can we blame her? Meghan Markle is supposedly ""politely disconnecting"" from the public as seen in her body language, and girl, you do you.",1.0,0.2410139310026607,0.6205069655013303,0.4940092873351071
N7821,sports,football_nfl,"'Monday Night Football' commentator under fire after belittling criticism of 49ers kicker for missed field goal Joe Tessitore called out 49ers kicker Chase McLaughlin after he shanked a potential game-winning kick in San Francisco, and some fans weren't happy.",1.0,0.216047708875667,0.6080238544378335,0.47736513925044466
N241,finance,finance-companies,"Are Stores Open on Veterans Day? Target, Aldi, Walmart and More Will shoppers be able to make the most of Veterans Day deals this public holiday?",1.0,0.2797697919254223,0.6398848959627111,0.5198465279502815
N48064,news,newsworld,"Why Ukraine and Russia are still at war A long and draining war in eastern Ukraine has become embroiled in President Trump's attempts to undermine his opponents at home. But the war is real and still taking lives, and a way to end it will be very difficult to find.",1.0,0.2466213238374012,0.6233106619187005,0.49774754922493414
N35850,news,newsus,U.S. Judge Blocks 'Suspicionless' Searches of Phones at Borders A federal judge rejected a Trump administration policy allowing agents at U.S. border crossings and airports to arbitrarily search the phones and laptops of international travelers.,1.0,0.2022075631698351,0.6011037815849175,0.4681383754465567
N25722,news,newspolitics,"Rex Tillerson denies he tried to undermine Trump, says Nikki Haley was 'rarely present' at meetings The former secretary of state refuted Haley's claims contained in a new book and says he remains proud of his tumultuous time in the Trump administration.",1.0,0.2228674099352209,0.6114337049676104,0.48191160662348054
N36703,lifestyle,lifestylecelebstyle,Photos of Celebrities at the Airport Are Here to Inspire Your Holiday Travel Style Even the rich and famous aren't spared the most annoying place in the world: the airport.,1.0,0.2104360290245471,0.6052180145122735,0.47362401934969806
N44818,sports,football_nfl,Redskins name rookie Dwayne Haskins starter for rest of season ,1.0,0.252757998849905,0.6263789994249525,0.5018386658999366
N51896,health,fitness,"Watch the 'Footloose' Dance Warmup That Gets These High Schoolers Ready to Race They tear up the course before, well, tearing up the course.",1.0,0.2530243346982649,0.6265121673491325,0.5020162231321765
N36252,finance,markets,Oil rises after OPEC's Barkindo says U.S. shale growth may slow in 2020 Oil rises after OPEC's Barkindo says U.S. shale growth may slow in 2020,1.0,0.2677682776283758,0.6338841388141879,0.5118455184189172
N52600,finance,finance-companies,"Saudi Aramco takes another step toward 1st public offering DUBAI, United Arab Emirates (AP)   Saudi Arabia's state-owned oil giant Aramco revealed it will sell up to 0.5% of its shares to individual investors, but in a lengthy document published late Saturday it did not disclose how much of the company will be floated when it goes public on the country's domestic exchange.",1.0,0.2972123062197441,0.648606153109872,0.5314748708131627
N54161,news,newsus,"Berliners tried to send Trump a piece of the Berlin Wall with a message saying 'no wall lasts forever' The 2.7-ton chunk of concrete arrived in Washington, DC, on Saturday, and local media outlets reported that the Secret Service turned it away.",1.0,0.2003142049126148,0.6001571024563074,0.4668761366084099
N60408,weather,weathertopstories,"Over 20 inches of snow for some Michigan communities in 24 hours! Significant amounts of snow fell within a meandering lake-effect snow band overnight into Tuesday morning across parts of the southwestern Lower Peninsula of Michigan, resulting in up to and over 2 feet in some locations... and that's where AccuWeather's Blake Naftel took in some of the snowy spectacles as people begun to dig out.",1.0,0.2580914360690077,0.6290457180345038,0.5053942907126718
N25138,sports,football_ncaa,"College Football Playoff picture: 4 in, 2 out, 5 to watch Sporting News takes a look at the College Football Playoff picture heading into Week 12 of the season.",1.0,0.2342262637825111,0.6171131318912555,0.48948417585500736
N63550,lifestyle,lifestyleroyals,Why Kate & Meghan Were on Different Balconies for Remembrance Sunday There's no scandal here. It's all about the order of precedence.,1.0,0.2169999052089701,0.6084999526044851,0.4779999368059801
N36621,news,newspolitics,Mulvaney's move to join impeachment testimony lawsuit rankles Bolton allies Former national security adviser John Bolton views the acting White House chief of staff as a key participant in the administration's effort to pressure Ukraine.,1.0,0.2150782534746224,0.6075391267373111,0.47671883564974826
N15506,news,newsworld,"Trump 'so extreme' on climate he's waking people up, Greta Thunberg tells AFP Swedish teen activist Greta Thunberg said Tuesday that US President Donald Trump's climate change denialism was ""so extreme"" that it had helped galvanize the movement to halt long term planetary warming. The venue was originally in Chile but was shifted because of political unrest, forcing Greta to change her travel plans.",1.0,0.2176168078901363,0.6088084039450682,0.47841120526009084
N54482,lifestyle,lifestylebuzz,"Mixed-race mother reveals strangers question whether she's related to her fair-skinned daughter - including a suspicious church-goer who asked the girl: 'Is this your Mummy?' Davina Moon, 32, from Surrey, who has a mixed heritage including Sri Lanka and Ireland, told how society often treats her differently because she doesn't look like her children.",1.0,0.2503601158686159,0.625180057934308,0.5002400772457439
N30071,news,newspolitics,"Trump juggles statecraft and impeachment on a historic day Projecting unusual calm in the middle of a political firestorm, President Donald Trump pleaded ignorance Wednesday about the first public impeachment hearing, unexpectedly insisting that he really wasn't paying attention to sworn testimony in the House Intelligence Committee that could determine whether he serves out his term in office. The disclaimer might be more credible if ...",1.0,0.2067943316465651,0.6033971658232825,0.4711962210977101
N61145,foodanddrink,tipsandtricks,Stop! Read This Guide Before You Buy an Air Fryer. Shopping for air fryers? Or maybe air fryer toaster ovens? Our air fryer buying guide will help you find the perfect appliance for your needs.,1.0,0.3165581817329737,0.6582790908664868,0.5443721211553157
N37204,health,health-news,"Model, 23, Didn't Know She Was Pregnant Until She Gave Birth to a Full-Term Baby in Her Bathroom An Australian model recently had a life-changing surprise when she gave birth to a baby in her bathroom, despite not knowing that she had been carrying her daughter for nine months.",1.0,0.2474567659063669,0.6237283829531834,0.4983045106042446
N46751,news,newscrime,"Mom named person of interest in 5-year-old girl's disappearance The search for Taylor Rose Williams, 5, began in Jacksonville on Wednesday.",1.0,0.2367168724840425,0.6183584362420212,0.4911445816560283
N496,music,cma-awards,"Fashion hits and misses from the 2019 Country Music Association Awards From Nicole Kidman to Pink, see the best and worst dressed stars at the 2019 Country Music Association Awards.",1.0,0.2576866650576944,0.6288433325288472,0.5051244433717963
N64685,music,music-celebrity,"Jennifer Lopez shares her #MeToo experience at costume fitting: 'I stood up for myself' Jennifer Lopez recalled an uncomfortable situation earlier in her career when a ""director at a fitting asked me to take my top off.""",1.0,0.2689988036900652,0.6344994018450326,0.5126658691267101
N7041,health,health-news,Dad bans lollipops after 5-year-old son nearly choked to death The boy was sitting near his mother when he began making choking noises.,1.0,0.2356989267620525,0.6178494633810263,0.49046595117470165
N53585,tv,tvnews,"Rip Taylor's Cause of Death Revealed, Memorial Service Scheduled for Later This Month The comedian died at the age of 84 last month.",1.0,0.2486983447756124,0.6243491723878062,0.4991322298504083
N24898,autos,autosbuying,"The lightest sports cars you can buy for under $30,000 Power-to-weight ratios matter, and what these sports cars lack in horsepower they more than make up for in their abilities to attack the roads with venom.",1.0,0.2908206805587556,0.6454103402793778,0.5272137870391704
N47851,travel,traveltripideas,The Top Winter Wonderlands You Should Visit This Holiday Find the best alpine views at these wintry destinations.,1.0,0.2726179649744117,0.6363089824872059,0.5150786433162744
N39389,lifestyle,lifestylebuzz,"Dog Rips The Tail Off Every Single One Of His Toy Pigs Tim Eberts When Diesel's parents first brought him home a cute little stuffed pig toy, they had no idea just how much the husky was going to love it.",1.0,0.2462935557155952,0.6231467778577976,0.4975290371437301
N57097,news,newsus,Last known Pearl Harbor survivor in Mass. dies at 98 Massachusetts' last known survivor of the Japanese attack on Pearl Harbor that drew the United States into World War II died Tuesday at 98.,1.0,0.2525291123899009,0.6262645561949505,0.5016860749266006
N39844,sports,basketball_ncaa,"James Wiseman eligibility: Explaining the NCAA questions on Penny Hardaway, Memphis star Everything you need to know about James Wiseman's eligibility case at Memphis and what it means for him, the Tigers' basketball team and the NCAA going forward.",1.0,0.2623822565158927,0.6311911282579463,0.5082548376772618
N15307,sports,basketball_nba,"10 most stunning early trends around the NBA Youngsters Luka Doncic and Pascal Siakam are taking their games to new heights, while a former No. 1 overall pick is doing his best to shed the ""bust"" label.",1.0,0.2449951349608724,0.6224975674804362,0.4966634233072482
N48578,news,newsgoodnews,"Deer stranded 5 miles offshore saved by Maine lobstermen A group of Maine lobstermen spotted a deer in an unusual place Monday: open waters. The men quickly took action to save the animal, which had somehow ventured 5 miles away from shore, and hauled their catch of the day to safety.",1.0,0.2491029851244507,0.6245514925622253,0.49940199008296715
N29839,lifestyle,lifestylehomeandgarden,"Simple Solutions to Help You Get Rid of Ants for Good Kick pesky ants out of your house and back to their colony with these easy, expert-approved tricks.",1.0,0.2991968827384067,0.6495984413692033,0.5327979218256045
N17896,autos,autossuvs,"Should Chevy Bring This Three-Row Blazer to the U.S.? It's set to go on sale in China soon, but we could see this bigger Blazer doing well in America, too.",1.0,0.2701173597873586,0.6350586798936793,0.5134115731915724
N47205,news,newspolitics,"Whistleblower never met or talked with Schiff - source The whistleblower who prompted an impeachment inquiry into U.S. President Donald Trump never met or spoke with congressman Adam Schiff, the Democrat leading impeachment hearings in Congress, a source familiar with the whistleblower's contacts said.",1.0,0.2220997132554115,0.6110498566277057,0.481399808836941
N57591,lifestyle,lifestyleroyals,Prince Charles Is Getting Into the Fashion Business The Prince's Foundation is partnering with the Yoox Net-a-Porter Group on a sustainable 17-piece collection.,1.0,0.2641485716464288,0.6320742858232145,0.5094323810976191
N64258,news,newspolitics,"Trump impeachment hearing spurs shadow spin war The online spin began even before Wednesday's impeachment hearing got underway. Moments before House Intelligence Committee Chairman Adam Schiff could welcome witnesses to the first public hearing of the impeachment inquiry, President Donald Trump took to Twitter to dismiss the ""New Hoax. Same Swamp."" Former Obama administration aides-turned-podcasters dissected the hearings in real time. They broadcast their running...",1.0,0.2115847746486401,0.6057923873243201,0.47438984976576004
N56061,sports,football_nfl,9 things we learned from Sunday's games of Week 10 of NFL season ,1.0,0.2235745183242121,0.6117872591621061,0.4823830122161414
N36807,weather,weathertopstories,"Timelapse Shows Snow Dusting Central New Hampshire A ""wintery mix"" of snow, ice, and rain moved across much of New Hampshire on Tuesday, November 12, local meteorologists said. Rain and freezing rain early Tuesday gave way to a period of light snow as colder air rushed in, WMUR said. This timelapse   filmed from 1 pm on Monday to 12 pm on Tuesday   shows snow falling and repeatedly dusting a parking lot in Plymouth, New Hampshire. Gunnar Consol, who filmed the video, said about an inch or two accumulated in Plymouth by Tuesday. Credit: @GunnarConsolWx via Storyful",1.0,0.2651066017839222,0.632553300891961,0.5100710678559481
N58133,news,newspolitics,"George Kent, top State Department Ukraine expert, helps Democrats debunk GOP theories Kent testified that there is no evidence Ukraine interfered in the 2016 election and said Joe Biden's pressure on Ukrainian officials was not the same as President Trump's.",1.0,0.2220588015310063,0.6110294007655032,0.4813725343540042
