ID,category,sub_category,content,collaborative_rec,content_rec,mean,two_one
N56175,foodanddrink,restaurantsandnews,Pizza Hut is testing a new round pizza box that looks like a spaceship and is meant to keep pizza fresher Pizza Hut has partnered with Zume to test a new round pizza box that is supposed to keep pizza fresher and crispier. It's also compostable.,0.165632659421662,0.2711655088560661,0.21839908413886405,0.2359878923779314
N55911,lifestyle,lifestylebuzz,Katie Holmes Talks About That Bra and Cardigan Moment Katie Holmes Talks About That Bra and Cardigan Moment,0.1657549700444187,0.2591449073349576,0.21244993868968814,0.2280149282381113
N59254,news,newsus,Judge rules deputies can't put 'no trick-or-treat' signs in sex offenders' yards A federal judge has ruled deputies in a Georgia county cannot put warning signs where registered sex offenders live.,0.1658619736963065,0.2245437796215397,0.1952028766589231,0.20498317764646198
N21720,health,health-news,Juul accused of selling 1 million tainted vaping pods Former Juul senior vice president Siddharth Breja claims he was fired in March for raising concerns about contaminated pods,0.1658619736963065,0.2297405946190502,0.19780128415767834,0.20844772097813563
N17681,foodanddrink,foodnews,McDonald's Is Going to Add Chicken to Its Breakfast Menu in 2020 Here's the rumor from McDonald's HQ. The post McDonald's Plans to Add Chicken to Its Breakfast Menu in 2020 appeared first on Taste of Home.,0.1658619736963065,0.2804586935165255,0.22316033360641602,0.24225978690978586
N61186,music,music-celebrity,Infected toe stops R. Kelly from attending court hearing CHICAGO (AP)   R. Kelly's lawyer has told a federal judge that an infected toe prevented the R&B star from attending a hearing in his child pornography case in Chicago. Kelly is detained at a jail two blocks from the courthouse and had been expected to appear at Wednesday's status hearing. But defense lawyer Steve Greenberg said one of Kelly's toenails had to be removed as treatment and Kelly worried someone might trample on his toe as he was...,0.1658619736963065,0.2224902017998907,0.1941760877480986,0.20361412576536264
N11727,foodanddrink,restaurantsandnews,"Popeyes quietly launched a new pumpkin pie and it's the best fast-food dessert I've ever tasted Popeyes still doesn't have the chicken sandwich, but it does have a delicious new deep-fried pumpkin and cream cheese pie. Run, don't walk.",0.1658619736963065,0.2625966604562192,0.21422931707626286,0.23035176486958164
N27919,sports,golf,Martin worries about amputation after breaking right leg Casey Martin's worst fear was realized earlier this month when he stepped awkwardly off a curb and fractured his right tibia.,0.1658619736963065,0.2250234757006605,0.1954427246984835,0.2053029750325425
N60850,foodanddrink,newstrends,"Popeyes is bringing back the chicken sandwich--and also takes a swipe at Chick-fil-A FORT WORTH -- The much-loved Popeyes Louisiana Kitchen fried chicken sandwich returns Sunday, and the company's announcement was a hard kick to the gizzard for competitor Chick-fil-A. After a limited-time summer special turned into a $65 million marketing bonanza, Popeyes will return both the spicy and mild sandwiches -- and on Sunday, when Chick-fil-A is not even open. Popeyes' ...",0.1658619736963065,0.2587858318104014,0.21232390275335394,0.22781121243903643
N63180,music,music-celebrity,"Taylor Swift can't shake 'Shake It Off' copyright suit reinstated by federal court panel A federal appeals court panel Monday reinstated a dismissed copyright lawsuit claiming Taylor Swift's ""Shake It Off"" infringed on an earlier song.",0.1658619736963065,0.2709462774093618,0.21840412555283414,0.23591817617167668
N7499,entertainment,celebrity,New Couple Alert? Drake and Kylie Jenner Appear Into Each Other at Party New Couple Alert? Drake and Kylie Jenner Appear Into Each Other at Party,0.1658619736963065,0.2483722134902033,0.20711709359325492,0.22086880022557104
N42570,news,newsus,"Woman dies after being hit by vehicle crossing northwest Fort Worth street, police say A 24-year-old woman died Wednesday after she was struck by a vehicle as she walked across a far northwest Fort Worth street, police said. Kristen Morton was hit at about 6:15 p.m. on Boat Club Road near Reef Point Lane, authorities said. The crash was an accident, a Fort Worth police spokesman said. Police did not describe the vehicle. Morton, who lived in White Settlement, was taken ...",0.1658619736963065,0.2449541661773585,0.2054080699368325,0.21859010201700782
N20109,music,musicnews,Lady Gaga Says 'Fame Is Prison' -- And Has Fans Speculating If New Music Is on the Way The singer's fans are also wondering if she's talking about the pressures of the industry.,0.1658619736963065,0.2609448490214628,0.21340341135888466,0.22925055724641072
N34934,sports,golf,"20 years after Payne Stewart's tragic death, son Aaron carries his legacy Aaron Stewart spent his summers on the road as a PGA Tour kid. The behind-the-scenes visits at the Columbus Zoo during the Memorial Tournament stand out among his favorite memories as well as the ""music man"" under the big tree on Hilton Head Island.",0.1658619736963065,0.2126891584261954,0.18927556606125095,0.19708009684956576
N3577,health,health-news,Tennessee reports 49 cases of lung injury linked to vaping Tennessee health officials say they have received 49 cases of serious lung injury in people who use electronic cigarettes or other vaping devices.,0.1658619736963065,0.2756794742928324,0.22077072399456946,0.2390736407606571
N32268,foodanddrink,foodnews,"I ate one of Meghan Markle's favorite foods from Toronto here's what I thought The food at Terroni was good and the prices were surprisingly affordable, but the service was disappointing.",0.1658619736963065,0.270705230445452,0.21828360207087927,0.23575747819573686
N18086,foodanddrink,restaurantsandnews,"I Would Go Back to This Missouri Theme Park Just for the Snacks The excellent food at Silver Dollar City is one of many reasons that Branson, Missouri is an essential stop on any Midwest road trip.",0.1658619736963065,0.2578695470694903,0.2118657603828984,0.2272003559450957
N41089,lifestyle,lifestylebuzz,"This Man's Rattlesnake Bite Is a Warning to Everyone to Take Animal Bites More Seriously You wouldn't think a baby rattlesnake could do so much damage, but Austin McGee knows better after almost losing his finger to one.",0.1658619736963065,0.2509514275474347,0.2084067006218706,0.22258827626372532
N38495,health,health-news,"Poultry Recall After 22 Tons of Vietnamese Products Distributed Without Import Inspection In addition to failing to go through the usual food inspection processes, the products came from Vietnam a country that is not eligible to export poultry products to the U.S. or any meat products aside from catfish.",0.1658619736963065,0.2471456112442186,0.20650379247026257,0.22005106539491456
N31931,news,newscrime,Florida man arrested in beating death of peeping Tom Victor Vickery had been in bed with his girlfriend when they heard a man with a history of peeping at their window.,0.1660170326806964,0.2173758557103995,0.19169644419554793,0.2002562480338318
N40509,news,newscrime,One of FBI's Most Wanted fugitives offers surrender One of the FBI's Most Wanted fugitives says he wants to surrender but claims his offers are being ignored by the United States government.,0.166563197438938,0.2128895447771776,0.1897263711080578,0.19744742899776438
N35022,lifestyle,lifestylebuzz,"Bed, Bath and Beyond Pulls 'Blackface Pumpkins From the Shelves The pumpkins were removed from stores after an upstate New York community filed complaints.",0.1667732930180675,0.2461262709892608,0.20644978200366415,0.21967527833219636
N5445,weather,weathertopstories,"Wild fall freeze: Utah falls close to minus-35 as West shivers, while bitter cold oozes east Denver could start Halloween morning near 0 degrees.",0.1668002864007576,0.2455848106271848,0.2061925485139712,0.21932330255170907
N37159,foodanddrink,restaurantsandnews,"National Sandwich Day: Where to score free subs and meal deals Sunday National Sandwich Day is a day for free food, deals and discounts at Jimmy John's, Jersey Mike's Subs, Subway, Potbelly Sandwich Shop and more.",0.1668770332805989,0.2692081104761319,0.2180425718783654,0.23509775141095424
N30531,tv,tv-gallery,"16 transgender celebrities who are changing television Shows like ""Euphoria,"" ""Pose,"" ""The Fosters,"" and ""Shameless"" have all introduced trans actors and characters in recent years.",0.166924105184155,0.2532096800873442,0.2100668926357496,0.22444782178628112
N23163,news,newspolitics,"'You people with this phony Emoluments Clause': Cabinet meeting devolves into 71 minutes of Trump grievances President Trump, trying to dig out from two new political holes of his own making on top of the expanding House impeachment inquiry, held forth for 71 minutes Monday during what was ostensibly a Cabinet meeting but ended up being a familiar torrent of grievance, defensiveness and bold statements about his expansive view of his own powers.",0.1671092980527567,0.2061247429855326,0.18661702051914464,0.19311959467460732
N13231,news,newsus,"Homeowner says a mystery object damaged his house. It didn't fall from a plane, FAA says Authorities including the Federal Aviation Administration have not been able to identify a canister-type object that damaged a Kentucky man's home.",0.1673761103022286,0.219838837778166,0.1936074740401973,0.20235126195285355
N40944,news,newsus,"Family of toddler who fell from cruise ship 'utterly crushed' after grandfather charged The charge of negligent homicide was ""like pouring salt on an open wound"" for the girl's parents, the family's lawyer told NBC News.",0.1674218955035104,0.2151822483021177,0.19130207190281406,0.19926213070258195
N10417,music,musicnews,Watch Miranda Lambert Invite a Little Girl On Stage Who 'Stole' Her Heart The girl's mother thanked Lambert for raining attention on her daughter Remi during the show on Saturday night.,0.1674342968919064,0.2403758009670524,0.20390504892947942,0.21606196627533705
N54842,news,newsus,"Mississippi woman found after being missing for days by writing S.O.S. with rocks S.O.S spelled out with rocks saved a woman missing in a national park for days, according to a release from the National Park Service.",0.1675665419887999,0.2474180777444936,0.20749230986664674,0.22080089915926235
N30867,news,causes-environment,"The size of a bus, rare and endangered whale shark spotted off Florida coast Bigger than Jaws, but not nearly as dangerous, the largest fish in the sea, a whale shark, was spotted off the Florida coast.",0.1676201459052618,0.2570552531547447,0.21233769953000325,0.2272435507382504
N46082,video,science,"Archaeologists open ancient coffins in Egypt After 30 ancient coffins were unearthed ""completely by accident"" in Egypt this week, archaeologists are now taking a closer look. Two of the coffins have been opened but what will experts find inside? NBC's Molly Hunter reports for Weekend TODAY.",0.167654034091927,0.2497348412074308,0.2086944376496789,0.22237457216892956
N58090,sports,football_nfl,"Frustrated Antonio Brown has active morning on Twitter Receiver Antonio Brown continues to wait for his next opportunity, and he continues to be justifiably frustrated by the fact that the NFL's slow-moving investigation is essentially keeping Brown suspended without pay.",0.1677353571160522,0.2285704998307273,0.19815292847338975,0.2082921189258356
N61388,movies,movies-celebrity,"Judge: Brad Pitt, others can be sued over New Orleans homes The Times-Picayune/ The New Orleans Advocate reports Pitt and other foundation directors asked the court to remove them from the lawsuit, saying they weren't personally responsible for the construction.",0.1677493467216037,0.2355559200416357,0.2016526333816197,0.21295372893495837
N16292,foodanddrink,foodnews,"What it's like to cook for Kate Middleton and Prince William, according to Giada De Laurentiis One of the professional chef's favorite career moments was the day she cooked for the Duke and Duchess of Cambridge at a polo charity event.",0.1679318148668485,0.2811345714800426,0.22453319317344556,0.24340031927564457
N38939,music,musicnews,"This Guns N' Roses Video Just Became the First From the '80s to Reach 1 Billion YouTube Views Guns 'N Roses' rockin' black-and-white video for ""Sweet Child O' Mine"" has become the first video from the 1980s to hit one billion YouTube views.",0.1679318148668485,0.2864738859494161,0.2272028504081323,0.2469598622552269
N48076,tv,tvnews,"Whoopi Goldberg Asks Meghan McCain to 'Respect' Her 'View' Co-Hosts During Heated Discussion 'I'm not trying to cut you off, I'm trying to get you heard.'",0.1679318148668485,0.2460378150372699,0.2069848149520592,0.22000248164712943
N61249,tv,tv-celebrity,"Hulk Hogan's jet grounded after 'melted' brakes, blown tires Hulk was headed to Saudi Arabia, but had a pit stop in Iceland.",0.1679498247580906,0.2109701347168333,0.18945997973746193,0.19663003139725238
N15122,tv,tv-celebrity,Tamron Hall says she 'never dealt' cocaine after reports say she confessed to doing so Tamron Hall issued a statement in response to the Daily Mail reporting that she confessed to facilitating the sale of cocaine as a teenager.,0.1679778179709493,0.2354586636639409,0.2017182408174451,0.2129650484329437
N2805,movies,movienews,"Star Wars: The Rise of Skywalker trailer is out, tickets already on sale The trailer debuted during Monday Night Football halftime, on Carrie Fisher's birthday.",0.1683844176324566,0.2343563865521212,0.2013704020922889,0.21236573024556632
N57239,movies,movies-celebrity,Emma Watson Says She Rejects the Word Single: 'I Call It Being Self-Partnered' Emma Watson Rejects the Word Single: 'I Call It Being Self-Partnered',0.1683844176324566,0.2596992283036519,0.21404182296805424,0.2292609580799201
N34694,tv,tvnews,Rosie O'Donnell: Barbara Walters Isn't 'Up to Speaking to People' Right Now Rosie O'Donnell: Barbara Walters Isn't 'Up to Speaking to People' Right Now,0.1685414225943131,0.243036731495628,0.20578907704497054,0.21820496186185637
N2735,sports,football_nfl,Jimmy Garoppolo addresses Erin Andrews interview by saying he uses 'baby' 500 times a game ,0.1686730612553145,0.2367147575311231,0.2026939093932188,0.21403419210585356
N21817,news,newspolitics,Two House Democrats break ranks with Pelosi on impeachment rules vote Two House Democrats broke ranks with their party leadership on Thursday's highly-contentious vote.,0.1688125986541888,0.2083453847493802,0.1885789917017845,0.1951677893843164
N38155,sports,baseball_mlb,Best Photos of the World Series Best Photos of the World Series,0.1688152509584959,0.2683853598153406,0.21860030538691827,0.23519532352972572
N25258,sports,boxing,Evander Holyfield's son wins pro boxing debut in 16 seconds ,0.1688619315695415,0.2285732717821916,0.19871760167586655,0.20866949171130825
N53901,foodanddrink,foodnews,"Chow Mein vs. Lo Mein: What's the Real Difference Between Them? When it comes to chow mein vs. low mein, the similar-looking dishes are popular in Chinese cuisine, but they are very different. Here's how.",0.1690414908785167,0.3208458474624567,0.2449436691704867,0.27024439526781
N58715,news,newsus,Officer placed on leave after threatening teen skaters at gunpoint Witnesses said the confrontation began on Saturday night when the plain-clothes officer approached the teenagers and ordered them stop playing loud music.,0.1696367552086571,0.2101488378272307,0.18989279651794388,0.19664481028770617
N8629,sports,basketball_nba,"Anthony Davis on possibly joining hometown Bulls: 'I mean, I am a free agent next year' ",0.169689084007392,0.25682308099598,0.21325608250168598,0.22777841533311732
N25885,entertainment,celebrity,Here's Every Costume the Kardashian-Jenner Family Wore This Halloween Every Kardashian-Jenner Halloween Costume (Even the Kids!) From 2019,0.169689084007392,0.2697877757662433,0.21973842988681763,0.23642154517995953
N12194,lifestyle,lifestylebuzz,Can You Find the Ghost Hidden Among the Skeletons in This Tricky Brainteaser? The tiny ghost blends in really well with all of the skeleton skulls. Are your eyes good enough to spot it?,0.16972580525528,0.2841055549953211,0.22691568012530056,0.24597897174864072
N54536,news,newsus,4 High School Students Killed in Texas Car Crash That Also Injured 3: 'We Grieve Together' 4 High School Students Killed in Texas Car Crash,0.1698726036425078,0.2605884126262842,0.21523050813439598,0.23034980963169208
N55051,lifestyle,voices,I Am Unapologetically Raising My Daughter Without Religion ,0.1699325464356933,0.2456739090784049,0.2078032277570491,0.22042678819750103
N13137,video,popculture,"Singer stands up to heckler who told her to take shirt off After being heckled on stage and told to ""free the nips"" at a concert in Texas, singer Maggie Rogers voiced her anger about the harassment.",0.1699366768346416,0.2409128418948943,0.20542475936476795,0.2172541202081434
N21164,news,newsus,"Pirates kidnap nine crew members from cargo ship off coast of Benin Pirates boarded a shipping vessel and kidnapped nine crew members off the coast of Benin in West Africa early Saturday morning, according to J.J. Ugland, the Norwegian shipping company which owns the vessel.",0.1700998259283747,0.2182122206257229,0.19415602327704878,0.20217475572660684
N619,news,newsus,"Cornell student, 18, found dead in gorge after frat party, reports say A top Ivy League student was found dead Saturday afternoon in a New York gorge after he left a fraternity party and disappeared Thursday night, according to reports.",0.1701948500069154,0.2299263827796774,0.2000606163932964,0.2100158718554234
N56514,travel,travelnews,"Road built by biblical villain uncovered in Jerusalem A long-buried street that led pilgrims to the Jewish Temple 2,000 years ago was commissioned by Roman governor Pontius Pilate.",0.1702017051431335,0.2338246900283245,0.202013197585729,0.21261702839992752
N21019,autos,autosnews,"Ford Baby Bronco Bare Body Allegedly Leaked In Exclusive Photo Ford had no comment, but it sure looks like the real deal.",0.1702025505514341,0.2689037282362357,0.21955313939383492,0.2360033356746352
N41298,music,music-celebrity,"Katy Perry sued for $150k by photo agency for 3-year-old pic Katy Perry allegedly posted a paparazzi photo without paying the fee, a photo agency claims.",0.1702025505514341,0.2616035216763069,0.21590303611387052,0.2311365313013493
N26122,weather,weatherfullscreenmaps,"Explosive new wildfire drives thousands from homes near Los Angeles The Maria fire ignited in Ventura County early Thursday night and raced westward, consuming 4,000 acres in just three hours.",0.1702234701355346,0.2733856311278084,0.22180455063167148,0.2389982441303838
N55312,travel,travelnews,"Why are most aircraft painted predominantly white? Aircraft liveries, or the designs painted on the exterior of aircraft from the nose to the tail, are a way to identify to which airline the plane belongs.",0.1702234701355346,0.3111579318284146,0.2406907009819746,0.26417977793078795
N41420,news,newsus,Cracks found on 38 of 810 Boeing 737 NG jets inspected globally Cracks found on 38 of 810 Boeing 737 NG jets inspected globally,0.1702234701355346,0.2525655234337165,0.21139449678462557,0.22511817233432255
N35259,finance,finance-retirement,"'I'm 73 and fed up with California and want a gun-friendly, affordable city with good weather   so where should I retire?' Some hidden gems to consider in Georgia, New Mexico and Arkansas.",0.1702234701355346,0.2597385939013409,0.21498103201843777,0.22990021931273882
N29924,autos,autosenthusiasts,"25 Cars No One Wanted to Buy Along with cars so bad they become icons and the models that should have worked but never caught on come a slew of vehicles that'll have you scratching your head. Remind yourself of the disasters that were the Cadillac Catera, Buick Reatta, Volkswagen Phaeton, Lincoln Blackwood, Chrysler Executive Limousine, and more.",0.1702234701355346,0.2742404639054075,0.22223196702047104,0.2395681326487832
N49179,movies,movienews,Joe Alwyn on Buzz Around Taylor Swift Romance: 'I'll Just Turn it Off' Joe Alwyn on Buzz Around Taylor Swift Romance: 'I'll Just Turn it Off',0.1702234701355346,0.2560893719779263,0.21315642105673044,0.2274674046971291
N37720,health,nutrition,"23 Foods That Help Lower High Blood Pressure Consuming less sodium may be important to help slash blood pressure levels, but eating more of these foods is good for your heart and arteries too. The post 23 Foods That Help Lower High Blood Pressure appeared first on The Healthy.",0.1702234701355346,0.3351275975946174,0.252675533865076,0.28015955510825646
N53436,finance,finance-real-estate,"Inside the Sheikh of Dubai's 800-acre Kentucky horse farm I got a tour of Sheikh Mohammed of Dubai's 800-acre horse farm in Kentucky, where horses live in immaculate barns with skylights and personal fans.",0.1702234701355346,0.2434415451116416,0.2068325076235881,0.21903552011960595
N64049,news,newsworld,"After Soldiers Surrender El Chapo's Son, a Shocked Mexican City Sighs With Relief In the days following the siege of the city of Culiacán by the Sinaloa cartel, residents were overcome with relief: Relief that the terror is over.",0.1702234701355346,0.2128621695028548,0.1915428198191947,0.19864926971374808
N11917,travel,travelnews,JetBlue Plane Makes Emergency Landing at JFK Airport The plane landed safely in NYC Sunday night.,0.1702234701355346,0.2112922217891618,0.19075784596234818,0.1976026379046194
N15919,news,newsus,"Saddleridge fire calms down, heavy rains on East Coast A new storm system is developing in the southern Plains and will move east over the next few days bringing a threat of flooding to the South with rain and gusty winds.",0.1702234701355346,0.2570344931053661,0.21362898162045035,0.2280974854487556
N2153,news,newsworld,"Iran alleges foreign government behind 'treacherous' ship attack Iran said Monday a foreign government was behind what it alleges was a ""treacherous"" attack on a tanker off Saudi Arabia last week, as it released pictures of its damaged hull. But the state-owned NITC denied reports the alleged attack had originated from Saudi soil.",0.1702234701355346,0.2623451054054051,0.21628428777046987,0.23163789364878162
N391,news,newsus,"Illegal drones ground water-dropping helicopters at critical moment in Maria fire battle LOS ANGELES - As flames rapidly spread along a hillside in Santa Paula, firefighters were faced with a perilous dilemma: ground night-flying helicopters working to contain the growing fire or risk an aerial collision with a thrill-seeking drone.",0.1702234701355346,0.2384156244569758,0.2043195472962552,0.21568490634982876
N20091,weather,weathertopstories,"Firefighting Plane Battles Maria Fire Near Santa Paula A tanker dropped fire retardant to combat the Maria Fire near Santa Paula in Ventura County, California on Friday, November 1. By Friday, the fire had reached more than 9,000 acres and was at zero percent containment, according to CAL FIRE. The Maria Fire broke out at around 9 pm on Thursday, and ""exploded"" overnight, prompting mandatory evacuations affecting more than 10,000 residents between Santa Paula and Somis, according to reports. Firefighters are battling several blazes across the state, including the 77,000 acre Kincade Fire in Sonoma County and the 1,800 Easy Fire in Ventura County. Incident reports for the California wildfires can be found here. Credit: @shant_nazaryan via Storyful",0.1702234701355346,0.2769776488922735,0.22360055951390406,0.2413929226400272
N5887,weather,weathertopstories,"Lucky Texas Storm Chaser Sees Hailstones Whizz Past Him During Tornado Storm chaser Marcus Diaz may think twice about how close he gets to the elements after large hailstones whizzed past his head from behind as he was filming an EF2 tornado in Tahoka, Texas, earlier this year. According to Accuweather, the winds in the tornado reached ""between 113 and 157 mph."" Diaz posted footage of the moment he was filming a ""dusty EF-2 tornado at close range"" as the hailstones almost hit ""the camera from behind,"" to Twitter on October 17. The lucky storm chaser told Storyful the footage was recorded on May 5. No injuries were reported as a result of the storm. However, the cyclone ripped through agricultural areas, ""causing structural damage to farms and wrecking equipment, power lines, and irrigation systems,"" according to media reports. Diaz may be better served in the future by heeding the advice of the National Oceanic and Atmospheric Administration (NOAA). According to NOAA, ""if you are unable to make it to a safe shelter, either get down in your car and cover your head, or abandon your car and seek shelter in a low lying area such as a ditch or ravine."" Credit: Marcus Diaz via Storyful",0.1702234701355346,0.247664653693048,0.2089440619142913,0.22185092584054353
N4607,autos,autosnews,Cause determined in Jessi Combs' fatal speed record crash Occurred at speeds near 550 mph,0.1703821734293144,0.2459100155753617,0.20814609450233806,0.22073406819334593
N59704,news,newscrime,"California sheriff's deputy shot dead, ride-along injured in 'active shooter incident,' officials say A police officer in Northern California was killed and another deputy was injured after an ""active shooter"" incident early Wednesday, according to officials.",0.1704350382705447,0.2504862511752216,0.21046064472288317,0.2238025135403293
N32852,news,newsus,"Nearly $400M worth of cocaine and marijuana intercepted by US Coast Guard The U.S. Coast Guard announced that it seized nearly $367 million of cocaine and about 11,000 pounds of marijuana worth an estimated $10.1 million at a Florida port.",0.170830155855367,0.216857302979837,0.193843729417602,0.20151492060501366
