ID,category,sub_category,content,collaborative_rec,content_rec,mean,two_one
N40640,foodanddrink,foodnews,"Foie Gras Is Banned by New York City Lutèce served it seared, with dark chocolate sauce and bitter orange marmalade. Le Cirque offered it in classic terrine form, but also served it with rabbit and bacon and made it the scene-stealer in a ravioli dish. But Lutèce closed in New York in 2004. Le Cirque shut its last Manhattan location in 2017. And foie gras, the calling card of fine French dining, is about to follow suit. The New York City Council overwhelmingly passed legislation on...",0.171724650397702,0.2614066722152925,0.21656566130649724,0.23151266494276232
N43955,entertainment,entertainment-celebrity,"Celebrity kids then and now: See how they've grown See what the children of Bobby Cannavale, Ray Liotta, Jude Law, Jamie Foxx, Sylvester Stallone, James Gandolfini and more stars look like now.",0.1723191100576097,0.2411655423517964,0.20674232620470306,0.2182167315870675
N59426,travel,travelnews,"Four American Airlines flight attendants arrested at Miami airport, accused of money laundering Four American Airlines flight attendants were arrested at Miami International Airport Monday on money laundering charges.",0.1726778827100572,0.1965568668179325,0.18461737476399487,0.18859720544864073
N1398,news,newsus,"Iowa woman killed by explosion at gender reveal party An Iowa woman was killed by debris from an explosion at a gender reveal party on Saturday, police said.",0.1727282225186307,0.2453659728022532,0.20904709766044194,0.22115338937437903
N58936,news,newsus,Beloved grandfather's body pulled from collapsed Hard Rock hotel A family holding vigil outside the site of the Hard Rock hotel construction collapse received the news they hoped they'd never hear.,0.172869020143299,0.2301025337958884,0.2014857769695937,0.21102469591169193
N28074,lifestyle,lifestylefamilyandrelationships,"Woman Texts Dead Father's Phone for 4 Years & Finally Receives an Emotional Reply The pain of losing a parent, especially at a young age, is one that never really goes away.",0.1728749847519277,0.2635060863505478,0.21819053555123774,0.23329571915100777
N51891,sports,football_ncaa,"7 biggest takeaways from the opening College Football Playoff rankings Hey, the Pac-12 is actually being respected.",0.1728937726038797,0.2335009036766704,0.20319733814027505,0.2132985266524068
N31825,video,viral,A sneak peek at Hudson Yards' Edge to open March 2020 A new observation deck in NYC is opening up on March 11th 2020. We give you a sneak peek at Hudson Yards' Edge.,0.1728937726038797,0.287102336030471,0.22999805431717535,0.24903281488827386
N45729,tv,tv-celebrity,"Former Deadliest Catch Star Jerod Sechrist Arrested, Charged with Heroin Possession Deadliest Catch: Jerod Sechrist Charged with Heroin Possession",0.1728937726038797,0.2124585846512183,0.192676178627549,0.1992703139687721
N28711,sports,football_ncaa,The biggest games in the month of November that will decide the College Football Playoff The month of November will decided which teams will be in College Football Playoff contention. A look at the biggest games in a jam-packed schedule.,0.1732688114985329,0.2694633044395784,0.22136605796905565,0.23739847345922988
N871,tv,tv-celebrity,"Woman, suspect dead at 'Tarzan' actor Ron Ely's California residence Ron Ely, who portrayed Tarzan in the TV series in the 60s, was not harmed and is alive and well, a sheriff's office spokesman said.",0.1736404919301011,0.2522324000480257,0.21293644598906342,0.22603509734205085
N22570,foodanddrink,foodnews,'Ghost kitchens' are taking over fast-food chains from Chick-fil-A to Wendy's Wendy's became the latest fast-food chain to name-check ghost kitchens on Friday at the company's investor day.,0.173988383423654,0.2612490456818368,0.2176187145527454,0.23216215826244255
N33503,foodanddrink,restaurantsandnews,These Restaurants Are Rumored To Be Haunted By Spirits Get into the Halloween spirit with a reservation at one of these spooky spots.,0.1740787934347357,0.2564305147774662,0.21525465410610095,0.22897994099655605
N27644,lifestyle,lifestylebuzz,"Dog 'Randomly' Drops By Family Reunion   Then People Check His Collar The other day, Leslie Kowash was at a family reunion in Georgia when a friendly local decided to drop in on the party, seemingly out of nowhere. It was a sweet brown pup   and a rather plump one, at that.",0.1745313962003438,0.2246324985651087,0.19958194738272625,0.20793213111018707
N11005,news,newspolitics,"Nunes Aide Is Leaking the Ukraine Whistleblower's Name, Sources Say A top aide to Rep. Devin Nunes has been providing conservative politicians and journalists with information and misinformation about the anonymous whistleblower who triggered the biggest crisis of Donald Trump's presidency, two knowledgeable sources tell The Daily Beast.",0.1748420949748545,0.2362319605680298,0.20553702777144217,0.21576867203697137
N12215,news,newspolitics,Democrats Who Voted to Impeach Bill Clinton Urge Republicans to Vote on Trump Inquiry with 'An Eye Towards History' Former Democrat representatives Paul McHale and Gene Taylor said Republicans have to set aside partisanship.,0.1749446323712576,0.2164648647445289,0.19570474855789324,0.20262478728677177
N14761,weather,weathertopstories,Niagara Falls: Boat stuck on rocks 101 years dislodged High winds and heavy rains dislodged the remains of a barge in the rapids above Niagara Falls that had been there 101 years.,0.1751065261560505,0.2392093671345431,0.2071579466452968,0.21784175347504559
N38868,finance,markets,"China's economic slowdown deepens, weighing on global growth BEIJING (AP)   China's economic growth sank to a new multi-decade low in the latest quarter as a trade war with Washington deepened a slump that is weighing on the global economy. Growth in the world's second-largest economy slipped to 6% in the three months ending in September, down from the previous quarter's 6.2%, data showed Friday. It was the weakest level since China started reporting data by quarters in 1993. The slowdown and weakening...",0.1751830362622078,0.2715221555449275,0.22335259590356765,0.2394091157840209
N39778,lifestyle,lifestyleroyals,"14 Parenting Rules the Royals Have to Follow Even in our modern times, there are some traditions British royal parents can't escape.",0.1751830362622078,0.2369437057474035,0.20606337100480565,0.21635681591900494
N18064,news,newspolitics,Top moments from Tuesday's Democratic debate Tuesday's debate in the key battleground state of Ohio was the first opportunity for Democratic candidates to gather on stage since the announcement of the impeachment inquiry against President Donald Trump.,0.1751830362622078,0.2222857638840037,0.19873440007310575,0.2065848546767384
N54435,news,newsus,"'Angel' car saves Arizona family after smashing into suspected drunk driver running red light, video shows An Arizona driver who police praised as an ""angel"" may have saved the lives of a couple pushing a stroller in a crosswalk last week after video showed the car smashing into a suspected drunk driver speeding through a red light -- who came inches away from plowing into the family.",0.1758191555990997,0.2279983771838549,0.2019087663914773,0.21060530332226984
N31699,news,newscrime,"Woman stabbed in 2015 home invasion suing 911 dispatch company Breann Lasley has filed a civil lawsuit against Priority Dispatch Corp., alleging ""gross negligence,"" but the company said its system was never used.",0.1759042310523475,0.2374954931076284,0.20669986207998797,0.21696507242253477
N30612,finance,personalfinance,"The first thing 14 lottery winners have bought after finding out they were rich Winning the lottery may be a dream come true, but what that actually looks like is different for everyone.",0.175979539486972,0.2660740690207599,0.22102680425386595,0.23604255917616396
N24422,sports,football_nfl,Lamar Jackson makes NFL history with huge day in win over Bengals ,0.1760918573967793,0.2284140358568923,0.2022529466268358,0.2109733097035213
N59289,lifestyle,lifestylecelebstyle,"Katy Perry's 34 Most Memorable Looks of All Time In honor of her birthday, we're looking back at Katy Perry's most memorable performance looks of all time.",0.1760918573967793,0.2980213172137181,0.2370565873052487,0.25737816394140517
N13057,lifestyle,lifestyleroyals,"Queen Elizabeth and Michelle Obama Shared 'Instant, Mutual Warmth' When They Broke Royal Protocol Queen Elizabeth Welcomed When Michelle Obama Put Arm Around Her",0.1760918573967793,0.2322058762711291,0.2041488668339542,0.2135012033130125
N56638,sports,basketball_nba,"LeBron James evacuates LA home, relocates family to hotel because of wildfires Lakers star LeBron James and his family were forced to evacuate their home in Los Angeles due to wildfires that have engulfed Southern California.",0.1760918573967793,0.2358089066877761,0.2059503820422777,0.21590322359077718
N52631,sports,basketball_nba,"Steve Kerr says Warriors' blowout opening loss is no one-off: 'This is reality' The last five years we've been living in a world that isn't supposed to exist, Kerr said after Golden State fell 141-122 to the Clippers.",0.1760918573967793,0.2560466270117058,0.21606924220424253,0.22939503714006362
N45189,news,newsscienceandtechnology,"Roman chariot and horse fossils are unearthed in Croatia after being buried in a ritual reserved for very wealthy families, archaeologists reveal Archaeologists uncovered the fossils near the city of Vinkovci in eastern Croatia and said this is the first time a burial ritual like this has been discovered in the country.",0.1760918573967793,0.2487625465337702,0.21242720196527476,0.22453898348810658
N48222,sports,basketball_nba,"Bucks have done everything right to keep Giannis for good Though Giannis Antetokounmpo doesn't want to talk about his supermax extension right now, the Bucks have done everything right so far.",0.1760918573967793,0.2632163337277516,0.21965409556226545,0.23417484161742752
N3812,sports,basketball_nba,Parity in the NBA means no favorites to win the title Not since the mid-2000s has the NBA season begun with no prohibitive favorite to win the championship.,0.1760918573967793,0.25315645918968,0.21462415829322964,0.22746825859204645
N33727,news,newspolitics,"Why Pete Buttigieg's moment could last well past the debate The Indiana mayor has the money, the staff, the data, and the endorsements to rapidly expand his reach.",0.1760918573967793,0.2310161028459445,0.2035539801213619,0.2127080210295561
N4885,sports,basketball_nba,Tacko Fall working hard to show he's more than a novelty act The 7-foot-5-inch fan favorite is working diligently with the Celtics coaching staff to sharpen his skills.,0.1760918573967793,0.2521601169662081,0.2141259871814937,0.22680403044306519
N50748,weather,weathertopstories,"A rare October snowstorm blankets the Texas Panhandle Heavy snow fell in parts of the Texas Panhandle on Thursday, causing near whiteout conditions in Amarillo, according to the National Weather Service.",0.1760918573967793,0.248631747833013,0.21236180261489615,0.22445178435426844
N16541,sports,basketball_nba,"Steve Kerr says it's unlikely Klay Thompson returns this season from ACL tear Last month, Golden State general manager Bob Myers announced that Klay Thompson would be out at least until the All-Star break to recover from the ACL tear he suffered in the NBA Finals, which left the door open for a return this season.",0.1760918573967793,0.2792147903289517,0.2276533238628655,0.2448404793515609
N57528,news,newsus,Bahareh Zare Bahari: Beauty queen says she will be killed if she is deported to Iran An Iranian beauty queen who has spent almost two weeks inside Manila's international airport says she will be killed if she is sent back home and is seeking asylum in the Philippines.,0.1760918573967793,0.2276035861740054,0.20184772178539234,0.21043300991493002
N2533,entertainment,entertainment-celebrity,"Khloe Kardashian misses ex, Lamar Odom 'all the time,' plus more news Khloe Kardashian wrestles with whether to meet with her ex, Lamar Odom. Plus, more celebrity news for Oct. 24, 2019.",0.1760918573967793,0.253929262841288,0.21501056011903363,0.22798346102645176
N119,sports,basketball_nba,"Anthony Davis, LeBron James dominate offensively to lead Lakers past Warriors in preseason bout ",0.1760918573967793,0.2626148169691791,0.2193533371829792,0.23377383044504585
N4654,sports,basketball_nba,"Shaq gets emotional welcome back from TNT crew after sister's death Shaq had been away after his sister, Ayesha Harrison-Jex, died from cancer at age 40.",0.1760918573967793,0.2245464465485384,0.20031915197265884,0.20839491683128536
N24578,entertainment,celebrity,"Week in celebrity photos for Oct. 28-Nov. 1, 2019 See what the stars were up to during the last week of October.",0.1760918573967793,0.2414284135681943,0.20876013548248679,0.21964956151105597
N16710,finance,markets,The value of America's natural resources revealed Ever been curious about how much money is hiding in America's untapped natural resources? We reveal what they're really worth…,0.1760918573967793,0.2862459870548355,0.2311689222258074,0.24952794383548343
N49689,news,newspolitics,"Democrats confront the prospect of a long primary Joe Biden and Elizabeth Warren are holding steady, Bernie Sanders is bouncing back from his heart attack and Pete Buttigieg is springing to life in Iowa.",0.1760918573967793,0.224773784465371,0.20043282093107515,0.2085464754425071
N18939,sports,basketball_nba,"Charles Barkley: 'At this point, Kawhi's a better player than LeBron' TNT Analyst Charles Barkley said Kawhi Leonard is a better player than LeBron James.",0.1760918573967793,0.2684662459016412,0.22227905164921025,0.23767478306668724
N13480,video,popculture,"Jennifer Aniston on why she joined Instagram: 'I'm just trying to build content' Jennifer Aniston visited Jimmy Kimmel Live!, Wednesday to promote her new Apple series The Morning Show. And while she was there she also talked about her record breaking new Instagram account. As of last night's broadcast, Aniston's account had garnered over 11 million followers in less than two days. She set a new world record, racking up a her first million followers 29 minutes faster than the previous record holders Prince Harry and Megan Markle. While this is her first official instagram account it wasn't her first time on IG. Aniston admitted that she had a fake account prior to making things official. ""It was a stalker account,"" said Aniston, ""When I was thinking about doing this, I sort of figured it was time to kind of understand the world and dip my toe into the social media pool."" When asked why she joined Insta, Aniston replied, ""I don't know."" She also revealed that she does look at other people's Instagram posts. She said, ""I'm just trying to build content, as they say.""",0.1760918573967793,0.2812014210643452,0.22864663923056225,0.24616489984182324
N53428,news,newspolitics,"Pete Buttigieg Says He Does Not Respect Donald Trump: 'At a Deeper Level I Don't Think He Respects Himself' Democratic candidate Pete Buttigieg went on the offensive against President Donald Trump, saying that Trump has done nothing to command his respect.",0.1760918573967793,0.2118251141870012,0.19395848579189023,0.19991402859026058
N55141,news,newspolitics,"White House to cancel Times, Post subscriptions after Trump's 'Hannity' comments The White House said Tuesday that it will not be renewing subscriptions to the New York Times and The Washington Post.",0.1760918573967793,0.2152648801603084,0.19567836877854383,0.20220720590579871
N22260,sports,football_nfl,Black cat visits field during Cowboys-Giants game on 'Monday Night Football' ,0.1760918573967793,0.2069117115663843,0.19150178448158178,0.19663842684318264
N25287,sports,basketball_nba,"Steve Kerr: Steph Curry is 'at his peak physically, mentally' ",0.1760918573967793,0.2590329185095598,0.21756238795316954,0.23138589813863297
N58997,sports,basketball_nba,"LeBron, D-Wade get hyped watching sons connect for basket LeBron James and Dwyane Wade were having a great time as basketball dads watching their son's play over the weekend for Sierra Canyon.",0.1760918573967793,0.2502003346050722,0.21314609600092574,0.22549750886897457
N8519,lifestyle,lifestylebuzz,"Kristen Stewart Just Made Leather Bras a Thing, and We're All For It Leave it to Kristen Stewart to look like a total badass while promoting her new film Charlie's Angels.",0.1760918573967793,0.266305880866014,0.22119886913139664,0.23623453970960243
N28149,sports,basketball_nba,"After summer moves, Jazz not worried about offensive stumbles to start season We've got to not think the game too much, just go out there and play.  Jeff Green",0.1760918573967793,0.2558912922149021,0.2159915748058407,0.22929148060886118
N41832,sports,basketball_nba,Curry swishes shots in warm-up sequence at Chase Center The Golden State Warriors will begin a new season in their new arena Chase Center on Thursday night.,0.1760918573967793,0.2579245740550104,0.21700821572589485,0.23064700183560005
N13286,entertainment,celebrity,"Will Smith gets friendly with fans, plus more celebs out and about this fall See new photos of your favorite celebrities living life during fall 2019!",0.1760918573967793,0.2410500498454294,0.20857095362110434,0.21939731902921272
N26040,sports,football_nfl,"32 things we learned from Week 7 of the 2019 NFL season As the NFL approaches its midseason point, several contenders are rounding into top form while others are getting desperate.",0.1760918573967793,0.2334964088855744,0.20479413314117684,0.21436155838930937
N63658,lifestyle,lifestylecelebstyle,Presenting: The 41 All-Time Most Stunning Dresses From the People's Choice Awards Red Carpet Top hats? Got 'em. A cane? Mm-hmm. Shoulder pads? You betcha.,0.1760918573967793,0.2485460401562829,0.2123189487765311,0.22439464590311503
N39121,sports,basketball_nba,"Celtics, Zion remain sizzling to start preseason Preseason numbers often mean almost nothing. Rotations are unusual, starters rarely play much, and few if any teams are putting a premium on winning games. As such, it's tough to glean much from exhibition stats. But what the Boston Celtics and New Orleans rookie Zion Williamson   the No. 1 pick in this year's draft   have been doing so far in the preseason certainly stands out. The Celtics are 3-0 after beating Cleveland on Sunday   and have...",0.1760918573967793,0.2574257646111927,0.216758811003986,0.23031446220638824
N7534,sports,basketball_nba,Magic Johnson uses MJ's Steph Curry statement to make tampering joke Los Angeles Lakers legend Magic Johnson is free to tweet from Game 1 until the end of the season and we are here for it.,0.1760918573967793,0.2540618284127711,0.2150768429047752,0.22807183807410716
N4693,lifestyle,lifestylecelebstyle,"8 Times Ciara Was the Sexiest Person on the Red Carpet - or Within 50 Miles - This Year Ciara's red carpet style is automatic, supersonic, hypnotic, funky fresh, and - above all - unbelievably sexy.",0.1760918573967793,0.2661294758590787,0.221110666627929,0.23611693637164557
N8959,news,newspolitics,"Graham now says Trump's Ukraine policy was too 'incoherent' for quid pro quo A day after saying he wouldn't bother reading transcripts released by House Democrats in the impeachment inquiry into President Trump, Sen. Lindsey Graham, R-S.C., now says he did read the testimony, and his conclusion is that the administration's Ukraine policy was too ""incoherent"" for it to have orchestrated the quid pro quo that is at the heart of the probe.",0.1760918573967793,0.2222234819432057,0.1991576696699925,0.20684627376106357
N35488,sports,basketball_nba,Kevin Durant had a simple reason for why Steph Curry is better than Russell Westbrook There you have it.,0.1760918573967793,0.2709464518153786,0.22351915460607893,0.23932825367584548
N51458,sports,basketball_nba,Lonzo Ball says Pelicans have to 'hold the fort down' until Zion Williamson returns Lonzo Ball is confident that the New Orleans Pelicans have the talent to win games without their leading scorer Zion Williamson.,0.1760918573967793,0.2566867542754739,0.2163893058361266,0.22982178864924235
N25604,sports,basketball_nba,Warriors' Russell ejected for going after official D'Angelo Russell is not having the best start to the new phase of his career with the Golden State Warriors.,0.1760918573967793,0.2349326773351715,0.2055122673659754,0.21531907068904077
N41777,sports,baseball_mlb,"Kate Upton was so fired up after the Astros' big defensive play The Houston Astros made a great defensive play to keep Game 2 of the ALCS tied in the sixth inning, and perhaps nobody was more excited about it than Kate Upton.",0.1760918573967793,0.2514307963591269,0.2137613268779531,0.22631781670501105
N14167,music,music-celebrity,Britney Spears Does The Splits Like a Boss in Workout Video She's still got it!,0.1760918573967793,0.2884574554309771,0.2322746564138782,0.2510022560862445
N52145,sports,basketball_nba,"Anthony Davis' performance against Grizzlies places him among Lakers greats George Mikan. Elgin Baylor. Wilt Chamberlain. Kareem Abdul-Jabbar. Shaquille O'Neal. Now, Anthony Davis. Lakers history is filled with big men who dazzled their fans and terrified opponents, and on Tuesday night Davis joined their exclusive club. They are the only Lakers to have scored at least 40 points in a game in which they also grabbed 20 rebounds. Davis scored 40 points with 20 rebounds ...",0.1760918573967793,0.2786824606505935,0.2273871590236864,0.2444855928993221
N5092,sports,basketball_nba,Giannis Antetokounmpo spoils Harden-Westbrook debut with triple-double in Bucks comeback ,0.1760918573967793,0.2471310652374228,0.21161146131710104,0.22345132929054162
N27023,sports,basketball_nba,"Paschall, young Warriors beat Blazers for 1st home win SAN FRANCISCO (AP)   Rookie forward Eric Paschall hit a key 3-pointer with 4:05 remaining and finished with 36 points and 13 rebounds for his best game yet, leading the injury-plagued Golden State Warriors to a 127-118 victory against Damian Lillard and the Portland Trail Blazers on Monday night for their first home win at last. Without all their injured stars, the young Warriors more than hung tough   they shined   against a Western Conference...",0.1760918573967793,0.2636870409196243,0.2198894491582018,0.2344886464120093
N48423,sports,basketball_nba,"Warriors' Steve Kerr clarifies comments about Klay Thompson After he previously implied that Thompson wasn't going to play this coming season, Steve Kerr clarified his comments later on Tuesday.",0.1760918573967793,0.2702191569927686,0.22315550719477395,0.2388433904607722
N63411,lifestyle,lifestyleroyals,Meghan Markle's Leather Pencil Skirt is a Powerful Statement Piece Meghan Markle stepped out for an important guest panel appearance in a maroon long-sleeved top with an eye-catching red leather pencil skirt.,0.1760918573967793,0.2493777956625618,0.21273482652967055,0.22494914957396764
N11405,finance,finance-companies,"Boeing says up to 50 planes grounded globally over cracks Crisis-hit Boeing faced fresh safety concerns Thursday, as the firm admitted cracks were found in up to 50 of its popular 737NG planes following worldwide inspections.",0.1760918573967793,0.2452601504553966,0.21067600392608793,0.22220405276919084
N49526,sports,basketball_nba,"James Harden drops 59 points as Rockets edge Wizards in high-scoring duel James Harden would not let the Rockets lose, not a game like this. And all it took was for the Rockets to score 159 points. With no one stopping anyone, with 3s falling and drives ending at the rim, Harden kept scoring and scoring until the Rockets finally got a stop and just enough scoring to finally score just enough. After Russell Westbrook drove to a three-point play after a Harden slam missed, giving the Rockets a lead with 32.4 seconds...",0.1760918573967793,0.2661745757058147,0.221133216551297,0.23614700293613625
N10888,sports,basketball_nba,Report: Many NBA executives believe Andre Iguodala will be traded to Lakers The notion that Iguodala is likely to land with the Lakers is so strong that there is a belief in league circles that it could dissuade other teams from engaging in trade dialogue with Memphis.,0.1760918573967793,0.2532711780412499,0.2146815177190146,0.22754473782642637
N53494,sports,football_nfl,Top takeaways from Sunday's Week 7 NFL action The Atlanta Falcons' season-long struggles continued while the Houston Texans put up a bummer of a performance against the Indianapolis Colts.,0.1760918573967793,0.2384631626587268,0.20727751002775305,0.21767272757141098
N43608,news,newsus,"Trump, Newsom wildfire clash came days after Newsom lauded president as 'partner' Last week Gov. Newsom thanked the Trump administration for ""moving expeditiously to support our efforts"" fighting fires. That was then, this is now.",0.1760918573967793,0.2309769779001963,0.2035344176484878,0.21268193773239064
N34399,foodanddrink,restaurantsandnews,Burger King's new 'Ghost Whopper' is here to haunt your Halloween order The Ghost Whopper will be available at 10 select restaurants beginning Oct. 24. The only thing scarier than Burger King's new Ghost Whopper is the thought of having no Whoppers at all.,0.1761233252174223,0.2796708738813459,0.2278970995493841,0.24515502432670472
N4020,tv,tv-celebrity,"'Tarzan' Actor Ron Ely: Actor's son allegedly killed his mother before deputies shot and killed him, sheriff's office says The son of ""Tarzan"" actor Ron Ely killed his mother before he was shot and killed by deputies on Tuesday, according to the Santa Barbara County Sheriff's Office.",0.1762044989334165,0.2451072805353538,0.21065588973438515,0.22213968666804135
N38118,tv,tv-celebrity,Uh-Oh! Carrie Ann Inaba Falls on 'Dancing With the Stars' Uh-Oh! Carrie Ann Inaba Falls on 'Dancing With the Stars',0.1763842732993092,0.2564378750749188,0.21641107418711397,0.22975334114971557
