ID,category,sub_category,content,collaborative_rec,content_rec,mean,two_one
N37083,news,newsus,Police warn against THC-laced Halloween candy Police in Pennsylvania are urging parents to be extra cautious with their Halloween candy this year.,0.1261636868654674,0.2346040904377886,0.180383888651628,0.19845728924701486
N24492,news,newsus,"Police: Off-Duty Dallas Officer Mistakenly Shoots, Injures Adult Son Thinking He Was An Intruder An off-duty Dallas officer accidentally shot and injured his adult son in DeSoto Saturday evening, police say.",0.1261636868654674,0.2299453323159785,0.17805450959072294,0.19535145049914146
N27235,news,newspolitics,"Hillary Clinton backs out of DC event also set to include Tulsi Gabbard, Kirstjen Nielsen: report Hillary Clinton has backed out of a Friday appearance at an event also scheduled to include Democratic presidential candidate Tulsi Gabbard, among other guests, according to a report.",0.1261636868654674,0.2120234177422981,0.16909355230388273,0.1834035074500212
N39762,news,newscrime,"Woman stabbed to death by son in Plainville, police say A 21-year-old man is accused of stabbing his mother to death in Plainville. Police were called at 10:14 p.m. Thursday to the home at 37 Landau Road. The victim, 51-year old Carlyn D. Murphy, was found dead with apparent stab wounds. Her son, Sean Murphy, 21, who lived in the home, was taken into custody at Patriots Place in Foxborough. Plainville police said they do not believe that there is any ongoing threat or danger to the public. Sean...",0.1261636868654674,0.2302251049167064,0.17819439589108688,0.1955379655662934
N1258,travel,travelnews,"Tourist in Venice kidnaps local woman in row over exchange rate The 46-year-old Israeli was unhappy about the sum of money he was given, and reacted by locking himself in the currency exhange with the worker",0.1261636868654674,0.2103109655669111,0.16823732621618925,0.18226187266642987
N54305,sports,football_nfl,Urban legend? How the Cowboys' rout of the Eagles helped take Coach Meyer out of the conversation Did the Cowboy's victory Sunday night take care of the Urban Meyer rumors?,0.1265987624781301,0.2271177001720836,0.17685823132510686,0.19361138760743243
N58224,news,newscrime,"13-year-old charged with two murders escapes custody in North Carolina Officials said they have concerns for public safety due to the teen's ""prior history of assaultive and unpredictable behavior.""",0.1267688128500045,0.1976019312001594,0.16218537202508193,0.17399089175010776
N6072,news,newsus,"Search resumes for worker missing in New Orleans Hard Rock Hotel building site collapse that killed 2 Rescuers resumed searching Sunday for a worker trapped in rubble after a deadly construction collapse in New Orleans, officials said, but the building's instability is making for a precarious situation.",0.1267688128500045,0.2421132393195328,0.18444102608476864,0.20366509716302336
N17686,news,newscrime,"Suspect in Henry County murder, kidnapping arraigned ",0.1267688128500045,0.202709961151552,0.16473938700077823,0.17739624505103616
N48031,sports,basketball_nba,Ex-Maverick to pay for funeral of woman fatally shot in home by police ,0.1267688128500045,0.2070376041703908,0.16690320851019763,0.1802813403969287
N21773,travel,travelnews,Lumber spilled on I-71 following rollover crash; Lanes shut down ,0.1267688128500045,0.2411967709734523,0.1839827919117284,0.20305411826563638
N19709,news,newscrime,Teen given 8 years in prison for gang-related hate crime of student caught on tape A California teenager has been sentenced to eight years in prison for a gang-affiliated hate crime assault on another student.,0.1267688128500045,0.2204232208378967,0.1735960168439506,0.18920508484193263
N61101,news,newscrime,"Resident recalls moments leading up to fatal shooting in Russell neighborhood In the Russell neighborhood, crime tape has become a well known sight that's why Lisa Tutt encourages her son and his friends to hang out at her house. READ THE FULL STORY:Resident recalls moments leading up to fatal shooting in Russell neighborhood Sign up for our Newsletters CHECK OUT WLKY:Live. Local. Late-Breaking. Get the top Louisville news, weather and sports from the team at WLKY   online, anytime.",0.1267688128500045,0.2320319276154854,0.17940037023274497,0.19694422269365844
N2663,news,newsworld,16 sentenced to death for burning alive Bangladesh teen Sixteen people were sentenced to death Thursday for burning alive a Bangladeshi teenager who refused to withdraw sexual assault charges against her head teacher.,0.1267688128500045,0.2389532557252256,0.18286103428761505,0.20155844143348525
N3433,finance,finance-companies,A secretive family landing a $4 billion haul has everyone guessing One of the world's richest and most discreet families must decide what to do with a massive pile of cash.,0.1267688128500045,0.2107244187646235,0.16874661580731398,0.18273921679308383
N7023,lifestyle,lifestyle-news-feature,"After being pushed close to extinction, this humpback whale population is making a comeback A key population of humpback whales is in recovery after it was pushed close to extinction by centuries of exploitation, according to a new study.",0.1267688128500045,0.2787871935967263,0.20277800322336542,0.2281144000144857
N44462,news,newscrime,"Louisville man who shot at LMPD officer sentenced to 10 more years in prison A Louisville man convicted of shooting at an officer was sentenced Friday. Judge David Hale sentenced Elijah Eubanks, 22, to 119 months in prison for a federal weapons charge. Sign up for our Newsletters In March 2018, Eubanks opened fire on an officer who was attempting to question him while he was in his vehicle with another person. No officers were hit, but Eubanks was shot multiple times when officers returned fire. Eubanks was previously...",0.1267688128500045,0.2339332785738529,0.1803510457119287,0.19821178999923678
N65112,news,newscrime,"Family says 16-year-old was victim hit, killed on I-64 The person struck by 5 vehicles on Interstate 64 Friday night was a 16-year-old girl, according to family members. The girl's father, Ronnie Click, spoke with WHAS11 News Saturday and said his daughter Brea was killed in that incident. Police responded to I-64 near the 22nd Street exit after they received reports that a person had been hit while walking in the slow lane. RELATED: LMPD: Pedestrian struck and killed on I-64 E at 22nd Street Once...",0.1267688128500045,0.2431721627507299,0.18497048780036718,0.20437104611715476
N59049,news,newsworld,"Three gunmen killed in Brazil airport raid, kidnapping: police Heavily armed gunmen raided an airport in Brazil on Thursday, officials said, stealing money from an armored truck before fleeing and taking a mother and baby hostage. At least one assailant escaped to a nearby residential neighborhood, taking a mother and her baby hostage in their home, the police spokeswoman said.",0.1267688128500045,0.1956497892785178,0.16120930106426115,0.1726894638023467
N22976,news,newsus,"The Sante Fe High School massacre suspect isn't fit to stand trial and will get psychiatric treatment, attorney says Dimitrios Pagourtzis is accused of killing eight students and two teachers at his Texas high school last year.",0.1267688128500045,0.2149558022325348,0.17086230754126963,0.1855601391050247
N48390,travel,travelnews,First round of auctions begin for Joe Ley Antiques ,0.1267688128500045,0.2470430995150214,0.18690595618251293,0.20695167062668243
N63045,news,newscrime,"Coroner IDs man found dead in Klondike neighborhood A man who was found dead in the Klondike neighborhood has been identified. Louisville Metro police responded to the 3200 block of Pomeroy Drive for a call of a person down Friday. Officials said Kevin Hellems, 54, was found dead inside the home from some type of foul play. No other information has been released. The death comes as a surprise to the neighbors in the area, who say they aren't used to seeing police cars and detectives on this...",0.1267688128500045,0.2345447871833722,0.18065680001668835,0.19861946240558298
N23061,news,newscrime,"Police arrest suspect in Bashford Manor double shooting Police have identified the suspect in a double shooting that happened in Bashford Manor. On Thursday, officers arrested Matthew Martin on attempted murder and other drug-related charges. Police said Martin and one of the victims pulled out guns during an argument that happened at Martin's apartment on Goldsmith Lane Wednesday afternoon. Following the argument, both victims were shot in the back as they ran down the hallway and were transported...",0.1267688128500045,0.2226645031033204,0.17471665797666244,0.19069927301888176
N31739,news,newscrime,"'Habitual stowaway' arrested again at O'Hare, Chicago police say A woman arrested at O'Hare International Airport on Friday night was identified by Chicago police as ""known habitual stowaway"" Marilyn Hartman.",0.1267688128500045,0.142254771788997,0.13451179231950075,0.1370927854759995
N15710,news,newscrime,Arrest made in connection to stabbing in South Louisville ,0.1267688128500045,0.201222228820745,0.16399552083537475,0.17640442349716484
N34567,news,newscrime,Grandfather charged in death of toddler who fell on cruise ship in Puerto Rico A grandfather who police say dropped his young niece from the 11th floor of a cruise ship docked in Puerto Rico in July has been accused of negligent homicide.,0.1267688128500045,0.2132090019628189,0.1699889074064117,0.18439560559188076
N8429,weather,weathertopstories,"Group clears plastic drums, tires from Falls of the Ohio State Park LOUISVILLE, Ky. (WHAS11)   The Falls of the Ohio is a little cleaner after volunteers helped return it to its glory. The volunteers picked up trash and debris along with old tires and leftover plastic barrels. It was part of Moran Environmental Recovery's effort to clean up parts of the state park. The group says over the years, the site has experienced waste dumping leaving the grounds full of empty drums, tires and glass. The state park is the...",0.1267688128500045,0.2574372982272708,0.19210305553863766,0.2138811364348487
N1569,news,newsus,"Officer who shot naked man found not guilty of murder DECATUR, Ga. (AP)   A former Georgia police officer who fatally shot an unarmed, naked man was found not guilty of murder Monday but was convicted of aggravated assault and other charges that could send him to prison for more than 30 years. Robert ""Chip"" Olsen's face turned red and he squeezed his eyes shut tightly as the verdict was read. His wife, Kathy Olsen, began sobbing and had to be led from the courtroom. DeKalb County Superior Court...",0.1267688128500045,0.2302837210427473,0.1785262669463759,0.19577875164516637
N54889,lifestyle,lifestyle-news-feature,"Chris, the famously woolly sheep, has died Chris made headlines in 2015 after he became the unofficial world record holder for having grown the heaviest fleece.",0.1267688128500045,0.2398572906639107,0.1833130517569576,0.20216113139260863
N19041,news,newscrime,Kroger shooting: Suspect coming out of store fires at officers before they shoot him dead ,0.1267688128500045,0.2307583221697901,0.1787635675098973,0.19609515239652822
N62612,news,newscrime,16-year-old injured in shooting near Churchill Downs ,0.1267688128500045,0.2087622069152136,0.16776550988260905,0.1814310755601439
N6244,news,newscrime,Suspect Alfredo Vazquez pleads guilty in Clark County judges' shooting case ,0.1267688128500045,0.2300957556399232,0.17843228424496385,0.19565344137661697
N51163,lifestyle,lifestylebuzz,"He grew a 910-pound pumpkin and then used it as a boat Instead of making a giant jack o'lantern or a massive pie that could feed the whole town, a farmer in Tennessee took his 910-pound pumpkin out for a spin in his pond.",0.1267688128500045,0.2551398043711901,0.1909543086105973,0.21234947386412825
N41011,news,newsworld,"For the first time, a man has been sentenced for sexual slavery by the International Criminal Court. He got 30 years. Bosco Ntaganda is a former Congolese rebel nicknamed the ""Terminator."" The ICC convicted him on 18 counts including murder, sexual slavery and using child soldiers.",0.1267688128500045,0.230336554255131,0.17855268355256776,0.1958139737867555
N31402,foodanddrink,restaurantsandnews,"The Best Seafood Restaurant in All 50 States Think there are too many seafood places in Maine to choose among, but none in landlocked Nebraska? This list will point your cravings and more in the right direction. Whether it's shrimp, crab, fish, or sushi that you love, even the most landlocked states have top-notch options for seafood. Find out what's near you.",0.1267688128500045,0.2894910030825913,0.20812990796629788,0.23525027300506238
N55833,news,newscrime,"Oldham County man charged, injuring victim during shooting practice ",0.1267688128500045,0.225930594148478,0.17634970349924123,0.19287666704898684
N45099,news,newscrime,Suspect in crossbow murder of his father arraigned ,0.1267688128500045,0.2069627160243096,0.16686576443715706,0.1802314149662079
N61355,news,newscrime,"2 Murder suspects escape from Monterey County, California, Jail The suspects are considered dangerous and should not be approached. Anyone who sees them should call 911 immediately.",0.1267688128500045,0.2299434728243637,0.1783561428371841,0.19555191949957731
N31741,music,musicnews,"Snoop Dogg bringing 'I Wanna Thank Me' tour to Louisville Palace Multi-platinum rap legend Snoop Dogg is bringing his ""I Wanna Thank Me"" tour to the Louisville Palace in 2020. The venue announced on Twitter that the show is scheduled for Jan. 25. Live Nation presale starts starts Thursday at 10 a.m., and tickets go on sale to the general public Friday at 10 a.m. The Long Beach native released his 17th album, ""I Wanna Thank Me,"" in August. The Doggfather's West Coast G-funk style has sold more than 38 million...",0.1267688128500045,0.2640771668765593,0.19542298986328188,0.21830771553437436
N10438,lifestyle,lifestylebuzz,"Pope Lick Legend: Loved ones of those who died on trestle push for change Legends of a monster living under a dangerous train trestle have lured people to a quiet Louisville creek for decades. Some swear they have seen proof of a human-goat hybrid terrorizing the area. Others leave with no sightings and no story to tell. Those are the lucky ones. The story of a ""Pope Lick Monster"" or ""Goatman"" haunting the trestle at Pope Lick Creek has been commonplace in Louisville even becoming the focus of a movie in the late...",0.1267688128500045,0.2300963632766619,0.1784325880633332,0.19565384646777612
N50528,news,newscrime,Man shot in the chest on Floyd Street ,0.1267688128500045,0.2168262932481076,0.17179755304905603,0.18680713311540656
N3142,health,health-news,"Teen wins science competition with liquid bandage invention Kara Fan beat nine other finalists and hundreds of students who submitted ideas in the 3M​ Young Scientist Challenge, winning $25,000.",0.1267688128500045,0.2590466685938228,0.19290774072191363,0.21495405001255005
N29802,finance,finance-companies,"Barneys Is Sold for Scrap, Ending an Era Authentic Brands Group will take control of the Barneys name   one that has been part of the Manhattan landscape since 1923   and license it to other companies like Saks Fifth Avenue. The firm B. Riley Financial is preparing to liquidate Barneys' high-end wares, at its five stores and two Warehouse locations, starting with private sale events for Barneys' ""most loyal"" shoppers next week.",0.1267688128500045,0.2754949657924636,0.20113188932123405,0.22591958147831057
N42704,news,newscrime,UPDATE: Coroner reveals identity of victim in Beechmont neighborhood shooting ,0.1267688128500045,0.2328532362602933,0.1798110245551489,0.19749176179019703
N24611,news,newscrime,"Former Jewish Hospital nurse to be arraigned on sexual abuse of patient charge According to court documents, Dorsey told the woman ""repeatedly"" that, ""I would like to video you.""",0.1267688128500045,0.2191323167498917,0.17295056479994808,0.18834448211659596
N29948,lifestyle,lifestyle-news-feature,"A White Woman Searches for Her Black Family DNA testing tells people a lot about their geographic ancestry, prompting difficult questions about racial identity and belonging. ""In my heart, I feel a connection.""",0.1267688128500045,0.2580420610168447,0.1924054369334246,0.21428431162789796
N43353,news,newscrime,"Wedding shooter may have been avenging late stepfather's murder, authorities say Brandon Castiglione, the groom's son, was previously charged with second-degree murder in the death of the suspect's stepfather.",0.1267688128500045,0.213001589116102,0.16988520098305326,0.1842573303607362
N5398,news,newscrime,Suspects identified following hours-long SWAT standoff on South 34th Street ,0.1267688128500045,0.208400559484199,0.16758468616710176,0.18118997727280084
N35656,travel,travelnews,Motorcyclist killed in crash on New Cut Road identified ,0.1267688128500045,0.2416572854730148,0.18421304916150966,0.20336112793201136
N63317,news,newscrime,"Police: 4 charged with attempted murder month after shooting in SW Louisville Four people are facing attempted murder charges for a shooting last month in southwest Louisville. According to arrest citations, a group arrived at an apartment in the 9600 block of Lamborne Boulevard on Sept. 27 and attempted to lure a male, unknown age, out of his apartment. When the victim agreed to come outside, police said Byron Kirby, 25, shot at the victim four times. The victim then ran into the woods. It's unclear if he was hit....",0.1267688128500045,0.2208129473178022,0.17379088008390337,0.18946490249520298
N6087,news,newsworld,"U.S. bans all flights to Cuba outside Havana in latest crackdown American Airlines and JetBlue, which fly routes to Cuba other than Havana, will have to submit to new regulations from the Transportation Department.",0.1267688128500045,0.2111833034877908,0.16897605816889766,0.18304513994186203
N59496,sports,football_nfl,"Week 7 winners, losers: Aaron Rodgers now in MVP race; Mitchell Trubisky looks lost Aaron Rodgers' big game vaults him into the MVP race. Meanwhile in Chicago, it might be time for the Bears to reconsider Mitchell Trubisky's future.",0.1268280767527745,0.2110316549832839,0.16892986586802922,0.1829637955731141
N58801,sports,golf,"Greg Norman upset Tiger Woods didn't respond to his handwritten letter: ""Maybe Tiger just dislikes me"" Greg Norman tells Men's Health he hand delivered a letter to Tiger Woods following his Masters win in April, but never got a reply.",0.128489207123933,0.2501636394559852,0.18932642328995908,0.20960549534530112
N65169,news,newsus,"Ohio voters express angst over impeachment Support for impeachment may be on the rise, but the view from central Ohio is strikingly complicated and nuanced.",0.128489207123933,0.2254194037246487,0.17695430542429086,0.19310933819107678
N40442,finance,markets,"25 bathrooms? Former Clinton labor secretary says Bezos' mansion helps make case for soaking the rich Robert Reich served as labor secretary in the Clinton administration, where he was named by Time Magazine as one of the 10 most effective cabinet secretaries of the 20th century. He's a Rhodes scholar, a best-selling author, a documentarian and a professor of public policy at UC Berkeley. What he's not, apparently, is a fan of billionaires clinging to their riches.",0.1303073400429105,0.2204306679171832,0.17536900398004684,0.19038955862575896
N63889,news,newspolitics,Trump Attorneys Assert Immunity From Broad Sweep of Law Legal filings and lawyers' statements show an attempt to put President Trump beyond legal reach while in office.,0.1303073400429105,0.213945924791604,0.17212663241725723,0.1860663965420395
N57967,sports,basketball_nba,Harden-Westbrook argument goes viral A clip of the Rockets stars appearing to exchange words during Thursday's game against the Bucks quickly started making the rounds online.,0.131943018603011,0.2393880260394593,0.18566552232123515,0.20357302356064322
N45535,news,newsus,DOJ sues Walmart for allegedly discriminating against a Navy reserve officer The Department of Justice says that Walmart did not hire a naval reserve officer due to her mandatory two-week training in the summer of 2016.,0.1329738096347755,0.2387721658698308,0.18587298775230315,0.20350604712481238
N37378,news,newsus,"Wisconsin jury awards $450,000 in Sandy Hook defamation case A jury in Wisconsin has awarded $450,000 to the father of a boy killed in the 2012 Sandy Hook school shooting after he filed a defamation lawsuit against conspiracy theorist writers who claimed the massacre never happened.",0.1338536556802203,0.2444900000780029,0.1891718278791116,0.20761121861207535
N64467,news,newsus,"Former Fox News hosts want out of non-disclosure agreements In the wake of the Me Too movement, women are calling them unfair silencers that sweep sexual misconduct claims under the rug",0.1393529800123005,0.2355823958912337,0.1874676879517671,0.20350592393158928
N59359,news,newscrime,Police Arrest Motorcyclist Who Led High-Speed Chase And Went Home Thinking He Escaped A motorcyclist was arrested after leading California Highway Patrol units on a high-speed chase in Placerville on Saturday.,0.1402392528858727,0.2182552508122069,0.17924725184903978,0.19224991817009549
N23614,tv,tv-celebrity,"John Witherspoon Dies: Comedian & 'Friday' Star Was 77 John Witherspoon, an actor-comedian who for decades made audiences laugh in television shows and films, including the hit Friday franchise, died suddenly at his home today. He was 77. ""It is with deepest sorrow that we can confirm our beloved husband and father, John Witherspoon, one of the hardest working men in show business, died",0.141931221735454,0.2523829360167617,0.19715707887610784,0.2155656979229925
N14340,news,newsworld,"Security camera spots SOS from woman lost for three days in Australia There was a bit of euphoria that, wow there's our break, police said of the the SOS message.",0.1431889008196092,0.2401838476002165,0.19168637420991286,0.2078521986733474
N5888,sports,baseball_mlb,Report: Angels could be fined up to $2M for not reporting Skaggs' opioid use The Los Angeles Angels could be fined up to $2 million by the commissioner for not reporting Tyler Skaggs' opioid use. A report published by ESPN on Saturday stated that Angels communications director Eric Kay admitted to federal investigators that he used and supplied Skaggs with drugs since at least 2017.,0.1442255380745549,0.241773352402133,0.19299944523834395,0.2092574142929403
N8419,news,newscrime,Man charged with 5 counts of first-degree murder in shooting rampage at Chicago condo Chicago police Monday morning announced charges against a man in connection with a shooting rampage that left five people dead Saturday night.,0.1442255380745549,0.2063315317213698,0.17527853489796236,0.1856295338390982
N55310,news,newscrime,"Joey 'the Clown' Lombardo, infamous Chicago mobster, dead at 90, reports say Chicago mobster Joseph Lombardo   better as ""Joey the Clown""   died in prison Saturday while serving a life sentence for murder, according to federal prosecutors.",0.1442255380745549,0.2204650970865538,0.18234531758055433,0.19505191074922085
N15771,autos,autosenthusiasts,"The Holy Grail Of Jeep Grand Cherokees Sits On An Old Wisconsin Dairy Farm, But It May Be Doomed ",0.1442255380745549,0.2364551964101964,0.19034036724237566,0.20571197696498258
N24123,sports,baseball_mlb,Why is Giancarlo Stanton on the Yankees' playoff roster? ,0.1442255380745549,0.2347138572452763,0.18946969765991561,0.20455108418836918
N47054,autos,autossema,"Hennessey Maximus Is a 1000-HP Jeep Gladiator from Hell If a 2020 Jeep Gladiator is not aggressive-looking enough, Hennessey has this even more intense version, which it's bringing to the SEMA show.",0.1442255380745549,0.2710816740308298,0.20765360605269234,0.22879629537873816
N46868,lifestyle,lifestylepetsanimals,"30 Funny Dog Photos You Need to See We asked readers to send in their favorite animal photos. We were so entertained, we couldn't help but share.",0.1442255380745549,0.2710501529123629,0.2076378454934589,0.22877528129976024
N60388,news,newscrime,"Man threatened school to distract from robbery, police say As a precaution, schools in one of the districts that were threatened placed all of its schools on a modified lockdown",0.1442255380745549,0.2177838075413813,0.18100467280796811,0.1932643843857725
N64562,tv,tv-celebrity,Rob Kardashian Appears Thinner at Kim Kardashian's Birthday Party in Rare Video Rob Kardashian Appears Thinner at Kim Kardashian's Birthday Party,0.1442255380745549,0.2527440885789662,0.19848481332676055,0.2165712384108291
N1431,news,newscrime,"Four charged with repeatedly escaping prison, returning with booze and phones Acting on ""repeated reports"" that prisoners were regularly escaping and returning, authorities said they caught the men in the act with the contraband.",0.1442255380745549,0.1934244252251205,0.1688249816498377,0.17702479617493197
N20286,movies,movies-celebrity,Scarlett Johansson Says She Was 'Surprised' by Colin Jost's Proposal: 'He Killed It' Scarlett Johansson Was 'Surprised' by Colin Jost's Proposal,0.1442255380745549,0.25571395371471,0.19996974589463246,0.21855114850132498
N2606,news,newscrime,"Couple Accused of Injecting Childhood Friend With Meth and Filming Her As She Died After more than two years of investigation, authorities in Oklahoma have filed formal murder charges in the death of a 41-year-old woman whose last moments were captured on videotape.",0.1442255380745549,0.2305676913658942,0.18739661472022456,0.20178697360211445
N22130,music,music-celebrity,Rihanna Slays in Sexy Black Bikini in Slow-Motion Video -- Watch! The singer shut down Instagram with her slow-motion clip.,0.1442255380745549,0.2762211481747838,0.21022334312466937,0.23222261147470752
