ID,category,sub_category,content,collaborative_rec,content_rec,mean,two_one
N37720,health,nutrition,"23 Foods That Help Lower High Blood Pressure Consuming less sodium may be important to help slash blood pressure levels, but eating more of these foods is good for your heart and arteries too. The post 23 Foods That Help Lower High Blood Pressure appeared first on The Healthy.",0.2627589954833259,0.3472345325676677,0.3049967640254968,0.3190760202062204
N20091,weather,weathertopstories,"Firefighting Plane Battles Maria Fire Near Santa Paula A tanker dropped fire retardant to combat the Maria Fire near Santa Paula in Ventura County, California on Friday, November 1. By Friday, the fire had reached more than 9,000 acres and was at zero percent containment, according to CAL FIRE. The Maria Fire broke out at around 9 pm on Thursday, and ""exploded"" overnight, prompting mandatory evacuations affecting more than 10,000 residents between Santa Paula and Somis, according to reports. Firefighters are battling several blazes across the state, including the 77,000 acre Kincade Fire in Sonoma County and the 1,800 Easy Fire in Ventura County. Incident reports for the California wildfires can be found here. Credit: @shant_nazaryan via Storyful",0.2627589954833259,0.3143649552195448,0.28856197535143535,0.29716296864080516
N49179,movies,movienews,Joe Alwyn on Buzz Around Taylor Swift Romance: 'I'll Just Turn it Off' Joe Alwyn on Buzz Around Taylor Swift Romance: 'I'll Just Turn it Off',0.2627589954833259,0.3109644985728803,0.2868617470281031,0.2948959975430288
N35259,finance,finance-retirement,"'I'm 73 and fed up with California and want a gun-friendly, affordable city with good weather   so where should I retire?' Some hidden gems to consider in Georgia, New Mexico and Arkansas.",0.2627589954833259,0.2932434211722632,0.2780012083277945,0.28308194594261743
N26122,weather,weatherfullscreenmaps,"Explosive new wildfire drives thousands from homes near Los Angeles The Maria fire ignited in Ventura County early Thursday night and raced westward, consuming 4,000 acres in just three hours.",0.2627589954833259,0.3019811766058876,0.2823700860446067,0.28890711623170034
N29924,autos,autosenthusiasts,"25 Cars No One Wanted to Buy Along with cars so bad they become icons and the models that should have worked but never caught on come a slew of vehicles that'll have you scratching your head. Remind yourself of the disasters that were the Cadillac Catera, Buick Reatta, Volkswagen Phaeton, Lincoln Blackwood, Chrysler Executive Limousine, and more.",0.2627589954833259,0.2863343221254695,0.27454665880439766,0.27847587991142164
N2153,news,newsworld,"Iran alleges foreign government behind 'treacherous' ship attack Iran said Monday a foreign government was behind what it alleges was a ""treacherous"" attack on a tanker off Saudi Arabia last week, as it released pictures of its damaged hull. But the state-owned NITC denied reports the alleged attack had originated from Saudi soil.",0.2627589954833259,0.2905951447792606,0.2766770701312932,0.2813164283472823
N391,news,newsus,"Illegal drones ground water-dropping helicopters at critical moment in Maria fire battle LOS ANGELES - As flames rapidly spread along a hillside in Santa Paula, firefighters were faced with a perilous dilemma: ground night-flying helicopters working to contain the growing fire or risk an aerial collision with a thrill-seeking drone.",0.2627589954833259,0.2983196687295407,0.2805393321064333,0.28646611098080244
N11917,travel,travelnews,JetBlue Plane Makes Emergency Landing at JFK Airport The plane landed safely in NYC Sunday night.,0.2627589954833259,0.2839477394836716,0.2733533674834987,0.2768848248168897
N15919,news,newsus,"Saddleridge fire calms down, heavy rains on East Coast A new storm system is developing in the southern Plains and will move east over the next few days bringing a threat of flooding to the South with rain and gusty winds.",0.2627589954833259,0.2744624137253839,0.2686107046043549,0.27056127431136456
N64049,news,newsworld,"After Soldiers Surrender El Chapo's Son, a Shocked Mexican City Sighs With Relief In the days following the siege of the city of Culiacán by the Sinaloa cartel, residents were overcome with relief: Relief that the terror is over.",0.2627589954833259,0.29563930345617,0.27919914946974794,0.2846792007985553
N55312,travel,travelnews,"Why are most aircraft painted predominantly white? Aircraft liveries, or the designs painted on the exterior of aircraft from the nose to the tail, are a way to identify to which airline the plane belongs.",0.2627589954833259,0.3266427086259648,0.29470085205464536,0.3053481375784185
N35458,finance,markets,"Brazil oil auction a 'total disaster' as bidders stay away Brazil's largest-ever auction of oil deposits flopped, sending the real tumbling, after state-controlled Petroleo Brasileiro SA did most of the bidding while other major oil companies stayed away.",0.2627788744585007,0.2833451243991257,0.27306199942881315,0.2764897077522507
N27526,news,newsus,"1 dead, 8 others hospitalized in Salmonella outbreak likely tied to ground beef The CDC said the latest Salmonella outbreak is not tied to one type or brand of ground beef.",0.2630573444287377,0.2917181314913326,0.27738773796003513,0.28216453580380096
N15122,tv,tv-celebrity,Tamron Hall says she 'never dealt' cocaine after reports say she confessed to doing so Tamron Hall issued a statement in response to the Daily Mail reporting that she confessed to facilitating the sale of cocaine as a teenager.,0.2630708866590929,0.3105786004873944,0.2868247435732436,0.29474269587796054
N62703,autos,autosnews,"Does Tire Rotation Include Tightening Lug Nuts? Michigan Court Thinks About It For Awhile, Concludes 'No' In what will surely go down in history as one of the most Galaxy Brain court rulings of all time, a Michigan appeals court determined that a tire rotation does not, in fact, include tightening the lug nuts.",0.2632064775308642,0.3010929389106274,0.2821497082207458,0.2884641184507063
N4607,autos,autosnews,Cause determined in Jessi Combs' fatal speed record crash Occurred at speeds near 550 mph,0.2632789894871681,0.304987744279024,0.28413336688309604,0.291084826015072
N8331,entertainment,celebrity,"Melanie Griffith, 62, shows off her insane figure in lingerie selfie, plus more news Melanie Griffith looks more stunning than ever in lingerie selfie, plus more celebrity news for Oct. 30, 2019.",0.2633447320694261,0.3189985959782624,0.29117166402384426,0.3004473080086503
N42128,movies,movies-celebrity,"Hugh Hefner's son Cooper weds 'Harry Potter' actress Cooper Hefner married Scarlett Byrne in Ventura, Calif., on Monday.",0.2635620657176876,0.3324389398341237,0.2980005027759056,0.30947998179531166
N2142,news,newsgoodnews,Young trick-or-treater refills stranger's empty candy bowl with his own The touching moment was captured on a resident's doorbell cam.,0.2635659567983801,0.2927786675107124,0.27817231215454624,0.2830410972732683
N21317,sports,football_ncaa,New Mexico DE Nahje Flowers dies at 21 ,0.2639139454195483,0.3181914528613975,0.29105269914047294,0.3000989503807811
N33503,foodanddrink,restaurantsandnews,These Restaurants Are Rumored To Be Haunted By Spirits Get into the Halloween spirit with a reservation at one of these spooky spots.,0.2642149636193326,0.2953489907183164,0.27978197716882447,0.2849709816853218
N28074,lifestyle,lifestylefamilyandrelationships,"Woman Texts Dead Father's Phone for 4 Years & Finally Receives an Emotional Reply The pain of losing a parent, especially at a young age, is one that never really goes away.",0.2643236613610063,0.2762603879617532,0.27029202466137975,0.2722814790948376
N47485,news,newsus,"Health warning lifted over fire at California oil facility Authorities have lifted shelter-in-place orders for some 12,000 people in Northern California after containment of a fire at a fuel storage facility that sent up a huge cloud of smoke. Emergency sirens blared and thick plumes of black smoke and flames filled the skyline around the NuStar Energy LP facility in Crockett, California, about 30 miles (50 kilometers) northeast of downtown San Francisco.",0.264379767892921,0.3129139140638537,0.28864684097838733,0.29673586534020946
N719,finance,finance-companies,"Nevada gambling bosses move to bar Wynn from casino industry The complaint filed Monday by the state's Gaming Control Board lists sexual misconduct allegations that have been lodged against the mogul since January 2018. The complaint asks Nevada's Gaming Commission, which acts on the board's recommendations and has final say on licensing, to fine Wynn and revoke his status as being found suitable to be licensed in the industry.",0.264379767892921,0.3151230773299551,0.28975142261143805,0.29820864085094373
N18870,lifestyle,shop-holidays,"Here Are the Biggest Deals We're Anticipating for Black Friday The Black Friday deals for 2019 have already begun leaking out. Get a sneak peek at what to expect from popular retailers like Costco, Walmart, and Best Buy. Browse our guide and use it to plan your attack for the biggest shopping event of the year.",0.2646038006131977,0.3143331365074935,0.2894684685603456,0.2977566912093949
N25258,sports,boxing,Evander Holyfield's son wins pro boxing debut in 16 seconds ,0.2647582326500522,0.2947304813561018,0.279744357003077,0.2847397317874186
N9798,news,newsus,"Missing West Point cadet found dead, officials say A U.S. Military Academy cadet who vanished last week has been found dead, officials said Wednesday.",0.2647693347896493,0.2725727139253302,0.2686710243574898,0.2699715875467699
N20109,music,musicnews,Lady Gaga Says 'Fame Is Prison' -- And Has Fans Speculating If New Music Is on the Way The singer's fans are also wondering if she's talking about the pressures of the industry.,0.2648102347421371,0.3000782797202305,0.2824442572311838,0.2883222647275327
N7499,entertainment,celebrity,New Couple Alert? Drake and Kylie Jenner Appear Into Each Other at Party New Couple Alert? Drake and Kylie Jenner Appear Into Each Other at Party,0.2648102347421371,0.3183520507122227,0.29158114272717994,0.30050477872219417
N59254,news,newsus,Judge rules deputies can't put 'no trick-or-treat' signs in sex offenders' yards A federal judge has ruled deputies in a Georgia county cannot put warning signs where registered sex offenders live.,0.2648102347421371,0.3078160942783692,0.2863131645102531,0.2934808077662918
N63180,music,music-celebrity,"Taylor Swift can't shake 'Shake It Off' copyright suit reinstated by federal court panel A federal appeals court panel Monday reinstated a dismissed copyright lawsuit claiming Taylor Swift's ""Shake It Off"" infringed on an earlier song.",0.2648102347421371,0.312923356568539,0.288866795655338,0.2968856492930717
N34934,sports,golf,"20 years after Payne Stewart's tragic death, son Aaron carries his legacy Aaron Stewart spent his summers on the road as a PGA Tour kid. The behind-the-scenes visits at the Columbus Zoo during the Memorial Tournament stand out among his favorite memories as well as the ""music man"" under the big tree on Hilton Head Island.",0.2648102347421371,0.2969518732329126,0.28088105398752483,0.28623799373598746
N42570,news,newsus,"Woman dies after being hit by vehicle crossing northwest Fort Worth street, police say A 24-year-old woman died Wednesday after she was struck by a vehicle as she walked across a far northwest Fort Worth street, police said. Kristen Morton was hit at about 6:15 p.m. on Boat Club Road near Reef Point Lane, authorities said. The crash was an accident, a Fort Worth police spokesman said. Police did not describe the vehicle. Morton, who lived in White Settlement, was taken ...",0.2648102347421371,0.3030003877370676,0.2839053112396024,0.29027033673875746
N61186,music,music-celebrity,Infected toe stops R. Kelly from attending court hearing CHICAGO (AP)   R. Kelly's lawyer has told a federal judge that an infected toe prevented the R&B star from attending a hearing in his child pornography case in Chicago. Kelly is detained at a jail two blocks from the courthouse and had been expected to appear at Wednesday's status hearing. But defense lawyer Steve Greenberg said one of Kelly's toenails had to be removed as treatment and Kelly worried someone might trample on his toe as he was...,0.2648102347421371,0.3092465058387997,0.2870283702904684,0.2944344154732455
N38495,health,health-news,"Poultry Recall After 22 Tons of Vietnamese Products Distributed Without Import Inspection In addition to failing to go through the usual food inspection processes, the products came from Vietnam a country that is not eligible to export poultry products to the U.S. or any meat products aside from catfish.",0.2648102347421371,0.2910757906487723,0.27794301269545474,0.28232060534656056
N21720,health,health-news,Juul accused of selling 1 million tainted vaping pods Former Juul senior vice president Siddharth Breja claims he was fired in March for raising concerns about contaminated pods,0.2648102347421371,0.275496714770859,0.2701534747564981,0.27193455476128503
N3577,health,health-news,Tennessee reports 49 cases of lung injury linked to vaping Tennessee health officials say they have received 49 cases of serious lung injury in people who use electronic cigarettes or other vaping devices.,0.2648102347421371,0.3008341811330078,0.28282220793757246,0.28882619900271755
N11727,foodanddrink,restaurantsandnews,"Popeyes quietly launched a new pumpkin pie and it's the best fast-food dessert I've ever tasted Popeyes still doesn't have the chicken sandwich, but it does have a delicious new deep-fried pumpkin and cream cheese pie. Run, don't walk.",0.2648102347421371,0.2936850998439767,0.27924766729305694,0.28406014481003017
N17681,foodanddrink,foodnews,McDonald's Is Going to Add Chicken to Its Breakfast Menu in 2020 Here's the rumor from McDonald's HQ. The post McDonald's Plans to Add Chicken to Its Breakfast Menu in 2020 appeared first on Taste of Home.,0.2648102347421371,0.3346582299599454,0.29973423235104124,0.31137556488734264
N41089,lifestyle,lifestylebuzz,"This Man's Rattlesnake Bite Is a Warning to Everyone to Take Animal Bites More Seriously You wouldn't think a baby rattlesnake could do so much damage, but Austin McGee knows better after almost losing his finger to one.",0.2648102347421371,0.3016366027579846,0.28322341875006085,0.2893611467527021
N32268,foodanddrink,foodnews,"I ate one of Meghan Markle's favorite foods from Toronto here's what I thought The food at Terroni was good and the prices were surprisingly affordable, but the service was disappointing.",0.2648102347421371,0.2933069340667447,0.27905858440444087,0.2838080342918755
N18086,foodanddrink,restaurantsandnews,"I Would Go Back to This Missouri Theme Park Just for the Snacks The excellent food at Silver Dollar City is one of many reasons that Branson, Missouri is an essential stop on any Midwest road trip.",0.2648102347421371,0.3106989341390197,0.28775458444057844,0.2954027010067255
N60850,foodanddrink,newstrends,"Popeyes is bringing back the chicken sandwich--and also takes a swipe at Chick-fil-A FORT WORTH -- The much-loved Popeyes Louisiana Kitchen fried chicken sandwich returns Sunday, and the company's announcement was a hard kick to the gizzard for competitor Chick-fil-A. After a limited-time summer special turned into a $65 million marketing bonanza, Popeyes will return both the spicy and mild sandwiches -- and on Sunday, when Chick-fil-A is not even open. Popeyes' ...",0.2648102347421371,0.3235790947451629,0.29419466474364997,0.3039894747441543
N27919,sports,golf,Martin worries about amputation after breaking right leg Casey Martin's worst fear was realized earlier this month when he stepped awkwardly off a curb and fractured his right tibia.,0.2648102347421371,0.2595750039485054,0.26219261934532123,0.261320080879716
N61249,tv,tv-celebrity,"Hulk Hogan's jet grounded after 'melted' brakes, blown tires Hulk was headed to Saudi Arabia, but had a pit stop in Iceland.",0.2648360146087827,0.2933499164374898,0.2790929655231362,0.2838452824945874
N32893,weather,weathertopstories,"A Northeast storm is intensifying into a bomb cyclone, forecasters say A bomb cyclone is taking shape along the Eastern Seaboard and starting to make itself felt in the Northeast.",0.2649920095765486,0.2535107981541035,0.2592514038653261,0.25733786862825186
N45794,news,newscrime,"Four flight attendants were arrested in Miami's airport after bringing in thousands in cash, police say Four American Airlines flight attendants were arrested at the Miami International Airport and charged with money laundering after bringing large amounts of cash into the country, police said.",0.2651010351311718,0.3039590390156591,0.28453003707341545,0.2910063710541633
N5469,sports,icehockey_nhl,Evander Kane sued by hotel for gambling debt built during playoffs The Sharks' forward allegedly owes big on some markers at The Cosmopolitan.,0.2652751020071053,0.2895769256890939,0.2774260138480996,0.2814763177950977
N60340,lifestyle,lifestyleroyals,"Here's Why Harry and Meghan's Latest Interview Could Be the Final Straw for the Royal Family In Prince Harry and Meghan Markle's ITV interview on Oct. 20, they said they're unhappy living in a fishbowl. An insider reveals the palace's response.",0.2654113895912311,0.2762980130310666,0.27085470131114886,0.27266913855112146
N29757,sports,basketball_nba,Clippers set bad precedent resting Kawhi Leonard against Bucks The Los Angeles Clippers are continuing with the theme we saw with the Toronto Raptors last season. They've rested reigning NBA Finals MVP Kawhi Leonard in one game of a back-to-back already this season.,0.2656230575435588,0.2645291035088888,0.2650760805262238,0.2648937548537788
N38562,sports,baseball_mlb,Nationals still uncertain on Scherzer status after injection HOUSTON (AP)   The Washington Nationals remain unsure about the health of pitcher Max Scherzer and catcher Kurt Suzuki heading into Game 6 of the World Series against Houston. Scherzer was scratched from his Game 5 start Sunday night because of nerve irritation near his neck and had a cortisone shot. Scherzer won the opener and hopes to be able to pitch in a Game 7 if the Nationals get that far. Houston won three in a row at Washington to take a...,0.2658594881677939,0.26983931793455,0.267849403051172,0.268512708012298
N31801,news,newspolitics,Joe Biden reportedly denied Communion at a South Carolina church because of his stance on abortion Joe Biden has a complicated history with the Catholic Church.,0.2659111904222625,0.289842530352724,0.27787686038749326,0.2818654170425702
N47438,sports,mma,UFC Tampa results: Jedrzejczyk dominates Waterson Joanna Jedrzejczyk just took a dominant decision over Michelle Waterson in the UFC Tampa co-main event.,0.2659260184566787,0.2817549788002272,0.27384049862845294,0.27647865868571103
N20950,sports,football_ncaa,"Franklin upset players wore Sutherland T-shirts without permission Some Penn State players wore T-shirts in warmups ahead of Saturday's game against Iowa in support of teammate Jonathan Sutherland, who was sent a controversial letter from a ""fan"" earlier this week.",0.2659260184566787,0.2445068851957186,0.2552164518261986,0.25164659628270525
N28058,lifestyle,lifestylebuzz,Strange Dog Shows Up On Woman's Lawn   And Seems To Recognize Her Kate Howard was sitting outside her home one afternoon after a memorial service when something amazing happened.,0.2660891344347137,0.287437533330962,0.27676333388283786,0.2803214003655459
N35022,lifestyle,lifestylebuzz,"Bed, Bath and Beyond Pulls 'Blackface Pumpkins From the Shelves The pumpkins were removed from stores after an upstate New York community filed complaints.",0.2662806506668415,0.285014555195242,0.27564760293104174,0.2787699203524418
N21817,news,newspolitics,Two House Democrats break ranks with Pelosi on impeachment rules vote Two House Democrats broke ranks with their party leadership on Thursday's highly-contentious vote.,0.2663457780685721,0.2716992688916643,0.26902252348011824,0.26991477195063357
N61070,news,newscrime,Man arrested in 1993 cold case rape after he's identified by DNA: Police The suspect was 28 at the time and not known to the victim.,0.2664620566453121,0.2981299552855774,0.28229600596544474,0.2875739890721556
N871,tv,tv-celebrity,"Woman, suspect dead at 'Tarzan' actor Ron Ely's California residence Ron Ely, who portrayed Tarzan in the TV series in the 60s, was not harmed and is alive and well, a sheriff's office spokesman said.",0.2665501648831866,0.3224741423864823,0.29451215363483446,0.3038328165520504
N59359,news,newscrime,Police Arrest Motorcyclist Who Led High-Speed Chase And Went Home Thinking He Escaped A motorcyclist was arrested after leading California Highway Patrol units on a high-speed chase in Placerville on Saturday.,0.2667178957206856,0.2983606151249174,0.2825392554228015,0.28781304199017343
N59026,news,newsus,"Cincinnati school board candidate accused of 'pretending to be black' in his ads A current CPS board member took to Twitter Sunday to say a candidate for the board ""is a white guy pretending to be black to get votes"" in ads.",0.2668328533965942,0.3061353638269652,0.2864841086117797,0.2930345270168415
N5283,foodanddrink,foodnews,"For the first time ever, a US cheese is named best in the world Forget the American love affair with Cheez Whiz, blocks of Velveeta and pasteurized processed cheese food slices. An organic blue cheese from Oregon has been named the world's top cheese.",0.2669397394016654,0.3114770649774113,0.28920840218953836,0.29663128978549597
N37378,news,newsus,"Wisconsin jury awards $450,000 in Sandy Hook defamation case A jury in Wisconsin has awarded $450,000 to the father of a boy killed in the 2012 Sandy Hook school shooting after he filed a defamation lawsuit against conspiracy theorist writers who claimed the massacre never happened.",0.2669435061358909,0.2992075659513019,0.28307553604359637,0.28845287934616487
N6695,news,newscrime,"'He fought them,' father says of son killed on birthday defending his family in home Brenton Estorffe, an Australian living in Texas, was died defending his family.",0.2669440657523129,0.2863378728893062,0.2766409693208095,0.2798732705103084
N45535,news,newsus,DOJ sues Walmart for allegedly discriminating against a Navy reserve officer The Department of Justice says that Walmart did not hire a naval reserve officer due to her mandatory two-week training in the summer of 2016.,0.2670592822562194,0.2975306055318696,0.2822949438940445,0.28737349777331955
N56514,travel,travelnews,"Road built by biblical villain uncovered in Jerusalem A long-buried street that led pilgrims to the Jewish Temple 2,000 years ago was commissioned by Roman governor Pontius Pilate.",0.2674370434504958,0.3008064953745059,0.28412176941250084,0.2896833447331692
N32852,news,newsus,"Nearly $400M worth of cocaine and marijuana intercepted by US Coast Guard The U.S. Coast Guard announced that it seized nearly $367 million of cocaine and about 11,000 pounds of marijuana worth an estimated $10.1 million at a Florida port.",0.2675526100250917,0.3113055147521939,0.2894290623886428,0.2967212131764932
N13138,news,newsworld,"Amelia Bambridge: Body of missing backpacker found in sea The body of a 21-year-old British backpacker who went missing after a beach party on a Cambodian island has been found, according to the charity assisting her family.",0.2676249625384201,0.3200915974279129,0.2938582799831665,0.3026027191314153
N56537,foodanddrink,restaurantsandnews,"Why Smoked Bologna Is the Secret Star of Oklahoma Barbecue No barbecue plate in the Sooner State is complete without a side of ""Oklahoma tenderloin"".",0.267822716897018,0.2827314108327594,0.2752770638648887,0.2777618461875122
N48742,news,newscrime,"Before his execution, a death row inmate told his victim's family he forgives them Charles Rhines, who was convicted of murder in the brutal stabbing of a 22-year-old man in 1992, was executed in South Dakota Monday, the state's attorney general said, after the Supreme Court denied a last-ditch appeal of his case.",0.2678616587890455,0.3017714078898118,0.2848165333394287,0.2904681581895564
N54536,news,newsus,4 High School Students Killed in Texas Car Crash That Also Injured 3: 'We Grieve Together' 4 High School Students Killed in Texas Car Crash,0.2678822162260342,0.3068064186656678,0.287344317445851,0.2938316845191233
N24492,news,newsus,"Police: Off-Duty Dallas Officer Mistakenly Shoots, Injures Adult Son Thinking He Was An Intruder An off-duty Dallas officer accidentally shot and injured his adult son in DeSoto Saturday evening, police say.",0.2678864719692657,0.2920874852917141,0.2799869786304899,0.2840204808508979
N39762,news,newscrime,"Woman stabbed to death by son in Plainville, police say A 21-year-old man is accused of stabbing his mother to death in Plainville. Police were called at 10:14 p.m. Thursday to the home at 37 Landau Road. The victim, 51-year old Carlyn D. Murphy, was found dead with apparent stab wounds. Her son, Sean Murphy, 21, who lived in the home, was taken into custody at Patriots Place in Foxborough. Plainville police said they do not believe that there is any ongoing threat or danger to the public. Sean...",0.2678864719692657,0.2789496194556049,0.27341804571243533,0.2752619036268252
N1258,travel,travelnews,"Tourist in Venice kidnaps local woman in row over exchange rate The 46-year-old Israeli was unhappy about the sum of money he was given, and reacted by locking himself in the currency exhange with the worker",0.2678864719692657,0.3067231213772128,0.28730479667323927,0.29377757157456375
N37083,news,newsus,Police warn against THC-laced Halloween candy Police in Pennsylvania are urging parents to be extra cautious with their Halloween candy this year.,0.2678864719692657,0.2729698801046938,0.2704281760369798,0.27127541072621775
