ID,category,sub_category,content,collaborative_rec,content_rec,mean,two_one
N37123,lifestyle,lifestylesmartliving,"17 Things You Should Never Do During a Conversation Want to make sure every conversation you have goes well? Begin with avoiding these 17 things you should never do, according to etiquette experts.",0.2515396826951929,0.2969108247357569,0.2742252537154749,0.28178711072223556
N32109,travel,travelnews,"Cell Phone Forces Flight Diversion to Ireland When no one could identify the owner of the phone, the captain diverted the flight.",0.2515396826951929,0.267850417382008,0.25969505003860044,0.26241350581973627
N18094,movies,movies-celebrity,"Michelle Pfeiffer initially blamed herself after #MeToo moment: 'I should've known' Michelle Pfeiffer is opening up about an uncomfortable and inappropriate moment with a ""high-powered"" industry person.",0.2516721917121888,0.2924071171920094,0.2720396544520991,0.27882880869873583
N8448,entertainment,entertainment-celebrity,Celebs celebrate Halloween 2019 Here's how the stars dressed up while celebrating Halloween this year!,0.2517197963916741,0.3130588910837902,0.28238934373773217,0.29261252618641814
N57239,movies,movies-celebrity,Emma Watson Says She Rejects the Word Single: 'I Call It Being Self-Partnered' Emma Watson Rejects the Word Single: 'I Call It Being Self-Partnered',0.2518570587352896,0.3155974411386524,0.28372724993697096,0.2943506470041981
N2805,movies,movienews,"Star Wars: The Rise of Skywalker trailer is out, tickets already on sale The trailer debuted during Monday Night Football halftime, on Carrie Fisher's birthday.",0.2518570587352896,0.2744657992102052,0.2631614289727474,0.2669295523852333
N12215,news,newspolitics,Democrats Who Voted to Impeach Bill Clinton Urge Republicans to Vote on Trump Inquiry with 'An Eye Towards History' Former Democrat representatives Paul McHale and Gene Taylor said Republicans have to set aside partisanship.,0.2523168983940105,0.2674567944034974,0.2598868463987539,0.2624101624003351
N30160,foodanddrink,tipsandtricks,How To Open a Can Without a Can Opener All it takes is a metal spoon and some elbow grease.,0.2525944848006211,0.307674894897361,0.28013468984899104,0.2893147581984477
N11855,news,newsus,"New Jersey woman sues waiter for spilling wine on her Hermès handbag The woman is seeking $30,000 for the light-pink luxury handbag, which has been discontinued.",0.2527603842770958,0.3038087410350955,0.27828456265609564,0.28679262211576223
N64467,news,newsus,"Former Fox News hosts want out of non-disclosure agreements In the wake of the Me Too movement, women are calling them unfair silencers that sweep sexual misconduct claims under the rug",0.2530361880533097,0.2770172413304783,0.265026714691894,0.26902355690475543
N62209,foodanddrink,foodnews,"Popeyes mocks Chick-fil-A for National Sandwich Day blunder, reignites sandwich wars Popeyes is mocking Chick-fil-A as the chicken sandwich wars heat up once again before National Sandwich Day.",0.253183479788551,0.2909505179101153,0.27206699884933316,0.2783615052029272
N21899,foodanddrink,tipsandtricks,Here's How to Correctly Store Potatoes to Keep Them Fresh Potatoes are a staple food in most people's diets for good reason.,0.253183479788551,0.2920424373643153,0.27261295857643314,0.27908945150572717
N61813,sports,football_nfl,"Redskins' Williams reveals cancer scare, explains holdout ASHBURN, Va. (AP)   Washington Redskins tackle Trent Williams revealed a cancer diagnosis that played a part in his lengthy holdout and distrust of the team's medical staff and the organization. Williams on Thursday said he told the team of the medical issue six years ago, and the growth on his head grew substantially over time. The 31-year-old said he had a tumor removed from his skull and needs to get checked out every six months to make sure...",0.253183479788551,0.2546695493981901,0.25392651459337057,0.2541741928616437
N28624,foodanddrink,foodnews,"When I moved from China to the US, eating out became so much more expensive I had to break the habit. Here's how I did it. Instead of feeling like I was depriving myself, I set out to manage my restaurant addiction by figuring out how to recreate what I loved about them.",0.253183479788551,0.2967752647081347,0.27497937224834285,0.2822446697349401
N55064,news,newspolitics,"Trump Taxes: Appeals Court Rules President Must Turn Over 8 Years of Tax Returns A federal appeals panel said on Monday that President Trump's accounting firm must turn over eight years of his personal and corporate tax returns to Manhattan prosecutors, a setback for the president's attempt to keep his financial records private.",0.253183479788551,0.2852950038035706,0.2692392417960608,0.27459116246523074
N22545,foodanddrink,foodnews,"The Search for a Gender Neutral Drive Thru Toy When families are asked whether a kid's meal is for a boy or girl, it means kids get toys based on stereotypes not their actual interests. Is it time to rethink drive-thru toys?",0.253183479788551,0.2861883661820025,0.2696859229852767,0.2751867373841853
N32208,foodanddrink,foodnews,"A Seattle man broke into an office building, ate $200 worth of chocolate, and collapsed in a sugar coma When security arrived, they found the man sprawled out on an office coach stripped of his jacket and shoes.",0.253183479788551,0.2741454099107434,0.2636644448496472,0.2671580998700126
N60956,lifestyle,shop-holidays,"What to Buy the Guy Who Is Impossible to Shop For Indulgences, gadgets, and the things he might never splurge for on his own top our list of gifts for the guy who is impossible to shop for. The post What to Buy the Guy Who Is Impossible to Shop For appeared first on Reader's Digest.",0.253183479788551,0.3421439610095748,0.29766372039906286,0.3124904672692335
N4614,foodanddrink,foodnews,"Orange vs. White Cheddar Cheese: What's The Difference, Anyway? Americans love cheese, and we're eating more of it than ever: about 37 pounds per year per capita, in fact, more than double what we ate four decades ago, according to the U.S. Department of Agriculture.",0.253183479788551,0.3136108758870328,0.2833971778377919,0.2934684105208722
N33571,foodanddrink,recipes,"The Braised Onion Pasta I Only Make for People I Love There are, for me, two kinds of recipes, one for each mood: The first kind is quick and easy, like the 30-minute lemon chicken I make when I come home from work hungry and don't want to think too hard about what I'm feeding myself. The second is for when I'm feeding someone else, usually something special I'm excited to share; these take more time, and just a little bit more care. Like this braised onion pasta, which takes at least two hours to...",0.253183479788551,0.325575111790562,0.28937929578955646,0.30144456778989165
N51810,foodanddrink,newstrends,"The Gooey Sticky Buns of Hit Boston Bakery, Flour, Pop Up in NYC Saturday Plus, Peter Luger's zero-star review is now a Broadway punchline   and more intel",0.253183479788551,0.2778189704159584,0.2655012251022547,0.2696071402068226
N54435,news,newsus,"'Angel' car saves Arizona family after smashing into suspected drunk driver running red light, video shows An Arizona driver who police praised as an ""angel"" may have saved the lives of a couple pushing a stroller in a crosswalk last week after video showed the car smashing into a suspected drunk driver speeding through a red light -- who came inches away from plowing into the family.",0.2535683174543198,0.3058724561331374,0.27972038679372857,0.2884377432401982
N27644,lifestyle,lifestylebuzz,"Dog 'Randomly' Drops By Family Reunion   Then People Check His Collar The other day, Leslie Kowash was at a family reunion in Georgia when a friendly local decided to drop in on the party, seemingly out of nowhere. It was a sweet brown pup   and a rather plump one, at that.",0.2537291939293489,0.3077345515985985,0.2807318727639737,0.28973276570884865
N2203,sports,baseball_mlb,"Off to the World Series, these Nationals have proved everyone wrong This unexpected joyride of a season could hold more promise yet.",0.2544121348280898,0.2334609686869533,0.24393655175752155,0.24044469073399877
N57318,news,newsus,"A 2,000-pound great white shark is swimming off the coast of Florida A great white shark that weighs over 2,000 pounds and measures 15 feet, 5 inches long has been swimming along the US East Coast.",0.2546594283978362,0.3277885685955263,0.29122399849668124,0.3034121885296296
N57737,news,newsus,"Missing Minnesota boy, 6, and his dog, found in cornfield by drone with thermal camera A missing 6-year-old boy from Minnesota and his dog were found Wednesday after hundreds of volunteers   including one who used his own drone with a thermal camera   searched for him for hours.",0.2546607743249731,0.3118549132571957,0.28325784379108443,0.2927902002797882
N33164,sports,football_nfl,100 famous NFL players who played for teams you forgot about Randy Moss with the Titans? Archie Manning with the Vikings? Plenty of NFL players had some forgettable stints with surprising teams.,0.2548305453141514,0.2538705682467324,0.2543505567804419,0.2541905606025387
N40442,finance,markets,"25 bathrooms? Former Clinton labor secretary says Bezos' mansion helps make case for soaking the rich Robert Reich served as labor secretary in the Clinton administration, where he was named by Time Magazine as one of the 10 most effective cabinet secretaries of the 20th century. He's a Rhodes scholar, a best-selling author, a documentarian and a professor of public policy at UC Berkeley. What he's not, apparently, is a fan of billionaires clinging to their riches.",0.2549073744309834,0.3059399968224577,0.28042368562672054,0.28892912269196624
N63889,news,newspolitics,Trump Attorneys Assert Immunity From Broad Sweep of Law Legal filings and lawyers' statements show an attempt to put President Trump beyond legal reach while in office.,0.2549073744309834,0.2921076052428001,0.27350748983689177,0.27970752830552786
N55911,lifestyle,lifestylebuzz,Katie Holmes Talks About That Bra and Cardigan Moment Katie Holmes Talks About That Bra and Cardigan Moment,0.255122046143664,0.292541846240575,0.2738319461921195,0.2800685795416047
N12576,news,newsworld,Chinese pilot suspended after woman poses in cockpit with drinks The unidentified woman is seen sitting in the captain's seat with drinks in front of her on an Air Guilin flight in January this year.,0.2553220564846631,0.2940654182536938,0.27469373736917846,0.2811509643306836
N14340,news,newsworld,"Security camera spots SOS from woman lost for three days in Australia There was a bit of euphoria that, wow there's our break, police said of the the SOS message.",0.2557510466250596,0.2736747210736746,0.2647128838493671,0.26770016292413623
N34399,foodanddrink,restaurantsandnews,Burger King's new 'Ghost Whopper' is here to haunt your Halloween order The Ghost Whopper will be available at 10 select restaurants beginning Oct. 24. The only thing scarier than Burger King's new Ghost Whopper is the thought of having no Whoppers at all.,0.2558725799710217,0.3035803253370503,0.279726452654036,0.2876777435483741
N8275,news,newsworld,"30 killed in DR Congo bus accident At least 30 died early Sunday when a packed bus came off the road and burst into flames near Kinshasa, the DR Congo capital, a local official said.",0.2561034883166644,0.3049089321581439,0.2805062102374042,0.2886404508776507
N30612,finance,personalfinance,"The first thing 14 lottery winners have bought after finding out they were rich Winning the lottery may be a dream come true, but what that actually looks like is different for everyone.",0.2562546515217661,0.274569862491147,0.26541225700645654,0.26846479216802005
N62285,news,newsus,"Former Florida cop won't serve jail time after accidentally killing woman, 73, in training exercise A former Florida police officer who accidentally shot and killed a 73-year-old woman during a demonstration will not serve any jail time as part of a plea agreement.",0.2563971006497419,0.3094121122606099,0.2829046064551759,0.2917404417236539
N13912,travel,traveltips,A lawyer reveals a legal nightmare you can face on a cruise ship Cruise ship passengers can be exposed to legal systems that don't provide the same protections they would find in the US.,0.2563971006497419,0.3000060289764399,0.2782015648130909,0.28546971953420724
N43955,entertainment,entertainment-celebrity,"Celebrity kids then and now: See how they've grown See what the children of Bobby Cannavale, Ray Liotta, Jude Law, Jamie Foxx, Sylvester Stallone, James Gandolfini and more stars look like now.",0.2564225430166011,0.3127388856064386,0.2845807143115199,0.2939667714098261
N33013,lifestyle,lifestylebuzz,"Couple Cancels Wedding, Keeps $30K as ""Donation"" for Honeymoon Instead In a viral Facebook post, a couple announces they're canceling their wedding, but keeping the $30,000 in gifts for a honeymoon instead.",0.2564360261616881,0.3234066071191941,0.2899213166404411,0.30108308013335877
N53880,finance,markets,"The megaprojects that changed countries forever Megaprojects are complex and expensive ventures that take years to complete. Although the massive scale of these projects makes them fraught with risk, they also have the capacity to bring great economic and social benefits during and after construction. Whether good or bad, these are the megaprojects that have shaped the future of their countries in a big way.",0.2564360261616881,0.3246289301067901,0.2905324781342391,0.30189796212508946
N24691,news,newsus,"Bill Macy, Bea Arthur's Husband on 'Maude,' Dies at 97 Norman Lear saw him choking on a chicken bone and brought him to Hollywood. The actor also appeared in 'My Favorite Year' and 'The Late Show.'",0.257202860794424,0.3206706510127836,0.2889367559036038,0.2995147209399971
N6154,sports,football_ncaa,"Report: Florida State considering firing Willie Taggart, pursuing Urban Meyer Willie Taggart should definitely look over his shoulder, should this report be true.",0.2574952096933876,0.2742354071880695,0.26586530844072853,0.2686553413565088
N41298,music,music-celebrity,"Katy Perry sued for $150k by photo agency for 3-year-old pic Katy Perry allegedly posted a paparazzi photo without paying the fee, a photo agency claims.",0.2576278595987001,0.3148230472701869,0.2862254534344435,0.2957579847130246
N21019,autos,autosnews,"Ford Baby Bronco Bare Body Allegedly Leaked In Exclusive Photo Ford had no comment, but it sure looks like the real deal.",0.2576278595987001,0.2843537066510428,0.27099078312487146,0.2754450909669286
N64983,news,newsus,"Buffalo Wild Wings fires workers allegedly involved in racist incident Multi-racial group of 18 in Naperville, Illinois eatery was allegedly asked to move tables to get farther from frequent diner who was ""racist""",0.2577948272519068,0.2885593032046548,0.2731770652282808,0.27830447788707213
N22570,foodanddrink,foodnews,'Ghost kitchens' are taking over fast-food chains from Chick-fil-A to Wendy's Wendy's became the latest fast-food chain to name-check ghost kitchens on Friday at the company's investor day.,0.2579345627476522,0.3036269575290606,0.2807807601383564,0.28839615926859113
N55556,finance,personalfinance,Why President Trump's kids are probably celebrating his move to Florida The No. 1 reason billionaires decide to move.,0.2585492809192796,0.3034712408746541,0.28101026089696685,0.2884972542228626
N12194,lifestyle,lifestylebuzz,Can You Find the Ghost Hidden Among the Skeletons in This Tricky Brainteaser? The tiny ghost blends in really well with all of the skeleton skulls. Are your eyes good enough to spot it?,0.258955587931516,0.2945535447006838,0.2767545663160999,0.2826875591109612
N42470,finance,finance-companies,G.M. Workers Approve Contract and End U.A.W. Strike The longest nationwide strike against General Motors in half a century ended on Friday after a solid majority of the company's union members delivered their support for the four-year contract hammered out by their leaders. The United Auto Workers union emerged with substantial wage increases and succeeded in ending a two-tier wage structure that had been a particular irritant in its ranks. It also won commitments to new G.M. investments in...,0.2590973345873354,0.2945515054927382,0.2768244200400368,0.28273344852427057
N42137,entertainment,celebrity,Celeb couples with big age gaps Age is just a number for some stars!,0.2593601582689496,0.3273274839448443,0.29334382110689694,0.3046717087195461
N29197,lifestyle,lifestylebuzz,Bella Hadid Is Named Most Beautiful Woman in the World -- How It Was Decided Beyonce and Amber Heard also made the list!,0.2594444761648368,0.3254886331813695,0.2924665546731031,0.30347391417585856
N6750,news,newspolitics,"Kamala Harris to slash staff, restructure campaign as she hemorrhages cash Kamala Harris is dramatically restructuring her campaign by redeploying staffers to Iowa and laying off dozens of aides at her Baltimore headquarters, according to campaign sources and a memo obtained by POLITICO Wednesday, as she struggles to resuscitate her beleaguered presidential bid.",0.2594619132870282,0.2861722260067756,0.2728170696469019,0.2772687884335265
N28088,movies,movies-celebrity,Bruce Willis brought Demi Moore to tears after reading her book Demi wasn't sure how her ex would feel about her book until he called her.,0.2599717427700981,0.2923099641144878,0.27614085344229294,0.2815305569996912
N58226,sports,racing,NASCAR driver's car got flipped over and then stuck the landing in wild wreck at Talladega Brendan Gaughan had the best reaction to getting flipped.,0.260140966108265,0.2829951983985904,0.27156808225342766,0.2753771209684819
N23979,finance,markets,"China already snapping up U.S. farm goods, Trump claims President Donald Trump boasted Sunday without providing evidence that China had ""already begun"" making large purchases of U.S. agricultural products as part of last week's tariff deal with Beijing.",0.2604291355431061,0.287851270231992,0.27414020288754903,0.27871055866903005
N39235,news,newscrime,"Florida woman allegedly flees 2 car crashes, kills driver in 3rd crash A Florida woman who killed a 53-year-old man after running a red light and smashing into his Lexus on Saturday morning was in the process of fleeing two earlier car accidents when she caused the fatal collision, police said.",0.2605334874154235,0.3100838531462435,0.2853086702808335,0.2935670645693035
N40509,news,newscrime,One of FBI's Most Wanted fugitives offers surrender One of the FBI's Most Wanted fugitives says he wants to surrender but claims his offers are being ignored by the United States government.,0.2605907950588683,0.2707688994884528,0.26567984727366056,0.2673761980119246
N31931,news,newscrime,Florida man arrested in beating death of peeping Tom Victor Vickery had been in bed with his girlfriend when they heard a man with a history of peeping at their window.,0.2607273853214048,0.2753594308279506,0.26804340807467775,0.27048208232576865
N61342,sports,basketball_nba,"The Warriors' fall from glory, explained Things are getting bad quick for the Warriors.",0.260875990238084,0.1925039969315655,0.22668999358482475,0.21529466136707165
N58090,sports,football_nfl,"Frustrated Antonio Brown has active morning on Twitter Receiver Antonio Brown continues to wait for his next opportunity, and he continues to be justifiably frustrated by the fact that the NFL's slow-moving investigation is essentially keeping Brown suspended without pay.",0.2609175065822537,0.2386770589272692,0.24979728275476146,0.24609054147893072
N28257,news,newspolitics,"Meghan McCain confronts Trump Jr.: 'You and your family have hurt a lot of people' Donald Trump Jr., the president's son, defended his family after ""View"" co-host Meghan McCain suggested they were responsible for the lack of ""character"" in American politics.",0.2611192615103799,0.285394199222941,0.2732567303666604,0.277302553318754
N14385,news,newsworld,ISIS names successor to slain leader al-Baghdadi The militant group named Abu Ibrahim Hashimi al-Quraishi as the new leader in a message posted by its official media wing.,0.2613158594985921,0.3264133526555474,0.29386460607706977,0.3047141882698956
N19347,news,newspolitics,"Former US Senator Kay Hagan dead at 66 Former U.S. Sen. Kay Hagan, a one-time Capitol Hill intern who went on to become North Carolina's first Democratic female senator, died Monday at her Greensboro home. She was 66.",0.2614151356266994,0.3179351669881824,0.2896751513074409,0.29909515653435476
N619,news,newsus,"Cornell student, 18, found dead in gorge after frat party, reports say A top Ivy League student was found dead Saturday afternoon in a New York gorge after he left a fraternity party and disappeared Thursday night, according to reports.",0.2619044073249433,0.2914130136369135,0.2766587104809284,0.28157681153292347
N53033,news,newspolitics,"CNN Poll: Biden's lead in Democratic primary hits widest margin since April Former Vice President Joe Biden's lead in the race for the Democratic nomination for president has rebounded, according to a new CNN poll conducted by SSRS.",0.262053571823018,0.2844452291438999,0.2732494004834589,0.2769813433702726
N59426,travel,travelnews,"Four American Airlines flight attendants arrested at Miami airport, accused of money laundering Four American Airlines flight attendants were arrested at Miami International Airport Monday on money laundering charges.",0.2620718224640916,0.3026645139823195,0.28236816822320554,0.2891336168095769
N1398,news,newsus,"Iowa woman killed by explosion at gender reveal party An Iowa woman was killed by debris from an explosion at a gender reveal party on Saturday, police said.",0.2621397163522151,0.294097873849347,0.2781187951007811,0.2834451546836364
N459,news,newscrime,Serial stowaway arrested at Chicago airport for 2nd time Hartman was taken into custody was charged with one felony count of criminal trespass,0.2621418146894607,0.3062225878760291,0.28418220128274485,0.2915289968138396
N34694,tv,tvnews,Rosie O'Donnell: Barbara Walters Isn't 'Up to Speaking to People' Right Now Rosie O'Donnell: Barbara Walters Isn't 'Up to Speaking to People' Right Now,0.262262137972724,0.2919416520267834,0.2771018949997537,0.2820484806754303
N55742,sports,mma,President Donald Trump gets mixed reaction at UFC 244 in historic milestone for MMA ,0.2622715244088319,0.2702616374386614,0.26626658092374667,0.2675982664287182
N48076,tv,tvnews,"Whoopi Goldberg Asks Meghan McCain to 'Respect' Her 'View' Co-Hosts During Heated Discussion 'I'm not trying to cut you off, I'm trying to get you heard.'",0.2623428284252733,0.3044725115385984,0.28340766998193584,0.29042928383415667
N16292,foodanddrink,foodnews,"What it's like to cook for Kate Middleton and Prince William, according to Giada De Laurentiis One of the professional chef's favorite career moments was the day she cooked for the Duke and Duchess of Cambridge at a polo charity event.",0.2623428284252733,0.3042776426765271,0.2833102355509002,0.2902993712594425
N38939,music,musicnews,"This Guns N' Roses Video Just Became the First From the '80s to Reach 1 Billion YouTube Views Guns 'N Roses' rockin' black-and-white video for ""Sweet Child O' Mine"" has become the first video from the 1980s to hit one billion YouTube views.",0.2623428284252733,0.3162028385838512,0.28927283350456223,0.2982495018643252
N46616,foodanddrink,newstrends,"The best sandwich shop in every US state and DC You don't need to look far to find a great sandwich in the USA. We've rounded up the best sandwich joints in every state, spanning the range from old-school delis still whipping up traditional favorites to quirky, modern joints putting innovative ingredients to work. Pull up a stool and sink your teeth into these mouthwatering offerings.",0.2624033614200603,0.3121651242374166,0.28728424282873843,0.2955778699649645
N53436,finance,finance-real-estate,"Inside the Sheikh of Dubai's 800-acre Kentucky horse farm I got a tour of Sheikh Mohammed of Dubai's 800-acre horse farm in Kentucky, where horses live in immaculate barns with skylights and personal fans.",0.2627589954833259,0.3332028193641989,0.2979809074237624,0.30972154473724123
N41420,news,newsus,Cracks found on 38 of 810 Boeing 737 NG jets inspected globally Cracks found on 38 of 810 Boeing 737 NG jets inspected globally,0.2627589954833259,0.3084905036358472,0.2856247495595865,0.2932466675850067
N5887,weather,weathertopstories,"Lucky Texas Storm Chaser Sees Hailstones Whizz Past Him During Tornado Storm chaser Marcus Diaz may think twice about how close he gets to the elements after large hailstones whizzed past his head from behind as he was filming an EF2 tornado in Tahoka, Texas, earlier this year. According to Accuweather, the winds in the tornado reached ""between 113 and 157 mph."" Diaz posted footage of the moment he was filming a ""dusty EF-2 tornado at close range"" as the hailstones almost hit ""the camera from behind,"" to Twitter on October 17. The lucky storm chaser told Storyful the footage was recorded on May 5. No injuries were reported as a result of the storm. However, the cyclone ripped through agricultural areas, ""causing structural damage to farms and wrecking equipment, power lines, and irrigation systems,"" according to media reports. Diaz may be better served in the future by heeding the advice of the National Oceanic and Atmospheric Administration (NOAA). According to NOAA, ""if you are unable to make it to a safe shelter, either get down in your car and cover your head, or abandon your car and seek shelter in a low lying area such as a ditch or ravine."" Credit: Marcus Diaz via Storyful",0.2627589954833259,0.3071309007459996,0.28494494811466275,0.2923402656584417
