ID,category,sub_category,content,collaborative_rec,content_rec,mean,two_one
N45824,sports,football_nfl_videos,"Ian Rapoport: MRI results are good news for Patrick Mahomes, Kansas City Chiefs NFL Network Insider Ian Rapoport and James Palmer provide a Patrick Mahomes injury update.",0.2046256118925897,0.2292426216432095,0.2169341167678996,0.22103695172633622
N53209,sports,baseball_mlb,"​Are the Astros stealing signs to gain an edge in ALCS? Hopefully. If your code is easy to crack, the problem is on you, not the codebreaker.",0.2046256118925897,0.2641922564600968,0.23440893417634326,0.24433670827092777
N52196,news,newspolitics,"Graham claims victory with impeachment vote Sen. Lindsey Graham, who introduced a resolution condemning secretive impeachment proceedings in the House, claimed victory Monday after House Speaker Nancy Pelosi announced she'll hold a formal vote and open up the hearings to the public.",0.2046256118925897,0.2813091883584161,0.2429674001255029,0.25574799620314065
N26606,autos,autosenthusiasts,2020 Shelby GT500 Aero Performance & Cooling Supercomputers and 3-D Printing are secrets to the all-new Mustang Shelby GT500's high performance.,0.2046256118925897,0.3046485045740067,0.2546370582332982,0.2713075403468677
N64395,sports,football_nfl,J.J. Watt has sobering quote after season-ending injury The Houston Texans lost the rock of their team for the season during Sunday's win over the Oakland Raiders. Stud pass rusher and future Hall of Famer J.J.,0.2046256118925897,0.2456051559022459,0.2251153838974178,0.23194530789902718
N37835,sports,football_nfl,Giants will not go back to Eli Manning after Daniel Jones' struggles Jones has thrown eight interceptions and has lost two fumbles in his past four starts.,0.2046256118925897,0.235505547758777,0.22006557982568337,0.22521223580338123
N62055,news,newspolitics,"Trump campaign threatens to sue CNN, citing Project Veritas videos An attorney representing President Trump's reelection campaign sent a letter to CNN on Friday threatening to sue.",0.2046256118925897,0.305416895809066,0.25502125385082786,0.27181980117024057
N37481,sports,football_nfl,Baker Mayfield blasts officials after Browns loss: Refs were 'pretty bad today' ,0.2046256118925897,0.2090390064628843,0.206832309177737,0.20756787493945278
N21428,autos,autosnews,Ford's Mach E Electric SUV Spied Looking...Interesting We're not sure how we feel about this new EV's Mustang-inspired styling cues.,0.2046256118925897,0.2912380898952941,0.2479318508939419,0.26236726389439263
N64456,news,newsus,"LA's Getty fire was sparked by downed power lines, Mayor Garcetti says LOS ANGELES - The Getty fire was sparked by a tree branch that fell on power lines, Los Angeles Mayor Eric Garcetti announced at a news conference Tuesday evening. Video footage shows the branch breaking off a eucalyptus tree and sparking the fire in the 1900 block of North Sepulveda Boulevard, Garcetti said. The power lines being examined are operated by the Los Angeles Department of Water ...",0.2046256118925897,0.3182630054323002,0.26144430866244495,0.2803838742523967
N52865,news,newspolitics,Ohio's Reputation As a Must-Win State May No Longer Be True ,0.2046256118925897,0.2417858558287026,0.22320573386064615,0.2293991078499983
N36068,sports,football_nfl,"AP source: Trent Williams ends holdout, reports to Redskins A person with knowledge of the situation says left tackle Trent Williams has reported to the Washington Redskins, ending his lengthy holdout. The person spoke to The Associated Press on condition of anonymity because the team had not announced Williams' return. He can be kept off the 53-man roster for up to three weeks after reporting. Washington did not deal the 31-year-old before the NFL trade deadline Tuesday, which prompted...",0.2046256118925897,0.2689069353815588,0.23676627363707425,0.24747982755190243
N57364,news,newspolitics,"Facebook's Zuckerberg grilled by AOC on fact-checking policy for political ads Facebook CEO Mark Zuckerberg struggled to explain the social media company's new policy on fact-checking political ads under questioning from Rep. Alexandria Ocasio-Cortez during a Tuesday hearing. The company recently announced that to protect political speech it would no longer fact check ads from politicians, essentially allowing campaigns to pay Facebook to spread disinformation. At the hearing of the House Financial Services committee,...",0.2046256118925897,0.2920885539871168,0.24835708293985326,0.2629342399556078
N4408,sports,football_nfl,"Patrick Mahomes already back at practice for Chiefs Although Reid didn't rule Mahomes out for the team's Week 8 game, it seems like a long-shot for the quarterback to get back onto the field that quickly.",0.2046256118925897,0.2133740137862126,0.20899981283940117,0.21045787982167163
N62396,sports,football_nfl,Colin Kaepernick is the perfect replacement for Patrick Mahomes This is a good idea if Mahomes misses a lot of time.,0.2046256118925897,0.2450999355848813,0.2248627737387355,0.23160849435411743
N32670,news,newspolitics,"McConnell tees up government funding votes amid stalemate Senate Majority Leader Mitch McConnell (R-Ky.) is turning the Senate toward trying to pass a set of long-stalled appropriations bills. ""Congress has fallen badly behind schedule on appropriations. It's been a month since my Democratic colleagues filibustered government funding here on the floor, blocking defense funding and a pay raise for service members. We need to get moving,"" McConnell said from the Senate floor. McConnell said the Senate...",0.2046256118925897,0.294053464531344,0.24933953821196686,0.2642441803184259
N5211,sports,football_nfl,"Jets trade DL Leonard Williams to Giants The USC product is in the final year of his deal, and the Jets wanted to get something for him while they still could. The third-rounder they'll be getting from the Giants will presumably be an early third-rounder.",0.2046256118925897,0.2728897243214562,0.23875766810702295,0.2501350201785007
N54807,news,newsworld,"Russia questions language of ""unusual"" Trump letter to Erdogan Russia questions language of ""unusual"" Trump letter to Erdogan",0.2046256118925897,0.3079230306840423,0.256274321288316,0.27349055775355813
N32027,sports,football_nfl,Payton declines to name Saints starting QB for Week 8 ,0.2046256118925897,0.2185527192430431,0.2115891655678164,0.2139103501262253
N49990,sports,football_nfl,Watch: Kevin Harlan's call of streaking cat on 'MNF' is epic This might legitimately be the best thing we've ever heard from Mr. Harlan.,0.2046256118925897,0.2736731976170107,0.2391494047548002,0.2506573357088704
N21851,sports,football_nfl,"Next man up: Chiefs prepare for life without Mahomes, with Moore Two weeks ago, Tyreek Hill served as Matt Moore's top target.",0.2046256118925897,0.2489364968945627,0.2267810543935762,0.23416620189390505
N34380,news,newspolitics,"House rejects GOP measure censuring Schiff Democrats in the House turned aside a GOP-led privileged resolution to censure House Intelligence Committee Chairman Adam Schiff (D-Calif.) on Monday in a 218-185 vote.Republicans and President Trump have increasingly targeted Schiff, a public face of the impeachment effort.They have taken issue with Schiff's exaggerated account of the details of President Trump's July 25 phone call with Ukrainian President Volodymyr Zelensky during a...",0.2046256118925897,0.2871416809013073,0.2458836463969485,0.25963632456506813
N17463,news,newspolitics,"Democrats unveil procedures for Trump's impeachment inquiry, rebutting GOP attacks The resolution hands the lead role to the House Intelligence Committee and its chairman, Rep. Adam B. Schiff, who would have broad latitude to organize extended questioning of potential public witnesses.",0.2046256118925897,0.2691119303957775,0.23686877114418362,0.2476164908947149
N5019,sports,football_nfl,"Winners, losers from Cowboys' win over Giants on 'Monday Night Football' In a NFC East tilt, the Cowboys overwhelmed the Giants defense late while Big Blue continues to trip over its own feet.",0.2046256118925897,0.2407720152292313,0.2226988135609105,0.22872321411701743
N27164,sports,football_nfl,"Burning questions for Dolphins vs. Steelers on 'Monday Night Football' The Dolphins (0-6) are visiting the Steelers (2-4) to close out NFL Week 8 on Monday Night Football. Fans should brace for an ugly game, because that's been a weekly occurrence whenever the Dolphins take the field.",0.2046256118925897,0.2319747755074199,0.2183001937000048,0.22285838763580984
N22929,sports,football_nfl,"Burning questions for Cowboys vs Giants on 'Monday Night Football' Capping off the action in Week 9, the New York Giants are hosting the Dallas Cowboys for the NFC Monday Night Football. There are five burning questions for this NFC matchup.",0.2046256118925897,0.2443094718626478,0.22446754187761875,0.2310815185392951
N35685,autos,autosreview,"First Drive! 2020 Shelby GT500 Is an Apex Predator, Turning Drivers Into Track Stars Driving the 2020 Shelby GT500 on the street, dragstrip, and road course reveals an apex predator that turns any driver into a track star.",0.2046256118925897,0.2998131107473887,0.25221936131998923,0.2680839444624557
N1406,sports,football_nfl,"NFL Films signed off on airing of Sam Darnold's 'ghosts' comment A firestorm has erupted in New York over how an unflattering comment from a mic'd up Sam Darnold made the air during ESPN's coverage of the Jets' blowout loss to the Patriots on ""Monday Night Football.""",0.2046256118925897,0.230377980095545,0.21750179599406735,0.22179385736122656
N4745,news,newspolitics,"Testimony: White House lawyer told Vindman not to discuss Ukraine call The senior White House lawyer who placed a record of President Donald Trump's July 25 call with Ukraine's president in a top-secret system also instructed at least one official who heard the call not to tell anyone about it, according to testimony heard by House impeachment investigators this week.",0.2046256118925897,0.2910287238399496,0.24782716786626965,0.26222768652416295
N14437,sports,basketball_nba,"Suns' Deandre Ayton suspended 25 games for violating NBA anti-drug policy The league informed the Suns that Ayton, the top pick in the 2018 draft, tested positive for a diuretic. His suspension begins Friday.",0.2046256118925897,0.2876354460222612,0.24613052895742546,0.25996550131237073
N62283,news,newsworld,British PM denied new Brexit deal vote Prime Minister Boris Johnson prepared to Monday make a second attempt to ram his EU divorce deal through parliament and avoid the political damage of delaying Brexit next week. But EU officials were still making preparations for Britain to leave in 10 days' time.,0.2046256118925897,0.2848858817054597,0.2447557467990247,0.25813245843450305
N15087,sports,football_nfl,"Trent Williams to Cleveland rumor emerges Dysfunctional teams do dysfunctional things. But sometimes they do something that makes sense, against their nature. Washington may soon be throwing in the towel on the Trent Williams holdout, trading the disgruntled left tackle in advance of the deadline that arrives in only two weeks. Steve Doerschuk of the Canton Repository shares the news with [more]",0.2046256118925897,0.2560930231034652,0.23035931749802746,0.23893721936650672
N10270,autos,autossports,"What Do Old-School Mustang Guys Think of the Kia Stinger? We wondered, so we put the Original Venice Crew in our long-term Stinger GT.",0.2046256118925897,0.274962811822215,0.23979421185740235,0.2515170785123399
N52227,sports,basketball_nba,"Joel Embiid, Karl-Anthony Towns likely facing multi-game bans for roles in brawl Both teams don't play again until Saturday, so the league will have plenty of time to assess whether any players left the bench area, which could lead to additional suspensions.",0.2046256118925897,0.2519919874004667,0.2283087996465282,0.2362031955645077
N63306,sports,football_nfl,Jenkins' scorching response to Scandrick ripping Eagles Former Philadelphia Eagles cornerback Orlando Scandrick ripped into Malcolm Jenkins and his former teammates in general.,0.2046256118925897,0.2483197158278084,0.22647266386019904,0.23375501451606884
N14137,sports,football_nfl,MetLife Stadium searching for the famous black cat from 'Monday Night Football' ,0.2046256118925897,0.2428133015738138,0.22371945673320176,0.23008407168007244
N49749,sports,football_nfl,"'Unbelievable.' Chiefs fans stunned, mad after loss to the Titans What the heck happened? The Chiefs were lining up for a field goal that would have given them and eight-point lead late in Sunday's game against the Tennessee Titans in Nashville. The snap came before holder Dustin Colquitt was ready and he threw the ball away. Colquitt was called for intentional grounding and the Titans took over. They drove down the field for a touchdown, two-point ...",0.2153017022814802,0.2144754024522879,0.21488855236688406,0.21475083572868534
N56461,finance,finance-taxes,"President Trump's trillion-dollar hit to homeowners People should consider one of the largely unexamined effects of the last tax bill, which Trump promised would help the middle class: Would you believe it has inflicted a trillion dollars of damage on homeowners?",0.2162544285172518,0.2638712600200175,0.24006284426863464,0.24799898285242894
N54305,sports,football_nfl,Urban legend? How the Cowboys' rout of the Eagles helped take Coach Meyer out of the conversation Did the Cowboy's victory Sunday night take care of the Urban Meyer rumors?,0.2164061556287289,0.2510783092830684,0.23374223245589865,0.2395209247316219
N28711,sports,football_ncaa,The biggest games in the month of November that will decide the College Football Playoff The month of November will decided which teams will be in College Football Playoff contention. A look at the biggest games in a jam-packed schedule.,0.2215840033116423,0.2819309535305846,0.25175747842111346,0.26181530345760384
N3933,sports,football_nfl,"Bears' Khalil Mack calls out Eagles C Jason Kelce's controversial tactics in offsides penalties The Chicago Bears doomed themselves early in the first half in a 22-14 loss to the Philadelphia Eagles. While the Bears offense had a historically bad first half performance   netting just 9 total yards   the defense had its share of struggles with five pre-snap penalties in the first half against the Eagles. Bears outside linebacker Khalil Mack isn't one to point fingers for the defense's struggles, but when asked about those pre-snap...",0.2227677863913671,0.2163704563179835,0.2195691213546753,0.21850289967577802
N23163,news,newspolitics,"'You people with this phony Emoluments Clause': Cabinet meeting devolves into 71 minutes of Trump grievances President Trump, trying to dig out from two new political holes of his own making on top of the expanding House impeachment inquiry, held forth for 71 minutes Monday during what was ostensibly a Cabinet meeting but ended up being a familiar torrent of grievance, defensiveness and bold statements about his expansive view of his own powers.",0.225572430756086,0.2664406428020756,0.2460065367790808,0.2528179054534124
N51616,sports,football_ncaa,"Plaschke: USC's debacle against Oregon is final nail in coach Clay Helton's coffin It's over now, finally, mercifully, a USC football era ending Saturday night on a field filled with mistakes surrounded by fans teeming with anger. There's no way Clay Helton comes back from this. There's no way the Trojans football program can continue on like this. There's no way this should ever happen at USC, ever, this embarrassing 56-24 whipping at the hands and arms and feet of the ...",0.2269135781060328,0.2449818179389308,0.2359476980224818,0.2389590713279648
N62545,finance,finance-companies,"The CEO taking on the gun lobby Ed Stack didn't set out to be an activist. The chief executive of Dick's Sporting Goods, Mr. Stack spent his career selling fishing rods, camping gear and athletic equipment at big-box stores around the country. Dick's was founded by Mr. Stack's father in upstate New York. As a young man, Mr. Stack worked for the family business. But he didn't enjoy the experience. His father was a divisive boss who couldn't manage a supply chain, and was...",0.2269135781060328,0.3216372420803628,0.2742754100931978,0.29006268742225283
N14588,sports,football_ncaa,"Jake Fromm proves Georgia is more than just its running game vs. Florida Georgia beat Florida 24-17 in a huge SEC showdown, and the Bulldogs did that with a clutch performance from Jake Fromm.",0.2269135781060328,0.2535207109506258,0.2402171445283293,0.24465166666909477
N36229,news,newsworld,"US jets destroy anti-ISIS coalition base in Syria after withdrawal, official says Two Operation Inherent Resolve (OIR) F-15 jets destroyed a base that was the headquarters of the anti-ISIS coalition in northern Syria on Wednesday after it had been vacated, according to a military official.",0.2269135781060328,0.2953947062124749,0.2611541421592538,0.2725676635103275
N44007,video,news,Where have Cape Town's great whites gone? Shark spotters say Cape Town's world-famous great whites have disappeared. So where have they gone?,0.2269135781060328,0.2816325876904132,0.25427308289822304,0.2633929178289531
N58625,news,newspolitics,"Kamala Harris responds to memo on staff cuts: 'I fully intend to win' The senator's campaign is cutting jobs in its headquarters and shifting workers from New Hampshire, Nevada and California.",0.2269135781060328,0.2944974580777604,0.26070551809189657,0.2719694980871845
N61319,sports,football_ncaa,"After throwing a punch, Dabo Swinney made CB Andrew Booth ride the manager bus back to Clemson ",0.2269135781060328,0.2673357902195247,0.24712468416277875,0.2538617195150274
N52692,news,newsus,"Dow says no injuries from chemical plant blast in Louisiana An explosion at a Dow chemical plant in Louisiana rattled windows in nearby homes but caused no injuries, the company said Sunday.",0.2269135781060328,0.2880119001183117,0.2574627391121722,0.2676457927808854
N10671,news,newsus,"Pentagon releases first images from raid that killed ISIS leader The Pentagon released newly declassified video and images Wednesday of the daring, two hour raid targeting ISIS leader Abu Bakr al-Baghdadi that shows US forces taking small arms fire from multiple locations as their helicopters approached the compound.",0.2269135781060328,0.2765930882609333,0.25175333318348303,0.2600332515426331
N22032,sports,football_ncaa,Five arguments College Football Playoff committee can ignite with first rankings The first College Football Playoff rankings will be unveiled on Tuesday. Here are the five arguments that could take off as a result.,0.2269135781060328,0.2461706981066013,0.23654213810631705,0.2397516581064118
N14972,foodanddrink,foodnews,"Here's Why We Pass Out Candy on Halloween Sure, candy's a big part of lots of our holidays in the United States but why is Halloween the one where we go door-to-door asking for it?",0.2269135781060328,0.2795106201902291,0.2532120991481309,0.26197827282883035
N46354,sports,football_ncaa,Week 8 observations: Wisconsin exposed as fraud in title chase and that could hurt Big Ten Wisconsin showed it was not a real national title contender with a loss to Illinois that changes the landscape of the Big Ten.,0.2269135781060328,0.2401500665543932,0.233531822330213,0.23573790373827308
N14662,foodanddrink,foodnews,"This Controversial Julia Child Recipe Caused Quite a Stir Julia Child has long been one of the most popular cooks in the country, celebrated for strict interpretations of culinary classics. However, her take on a classic Italian dish caused an uproar.",0.2269135781060328,0.302515698059614,0.26471463808282336,0.27731499140842025
N9460,news,newsworld,"Egypt unveils discovery of 30 ancient coffins with mummies inside Egyptian authorities on Saturday revealed the contents of 30 ancient wooden coffins discovered in Luxor and yes, they include mummies.",0.2269135781060328,0.3153728795732783,0.2711432288396556,0.28588644575086314
N33622,finance,finance-companies,"Aluminum is replacing plastic as the greenest bottle The drive to turn products more eco-friendly is sweeping through the U.S. beverage market, with plastic being replaced in everything from red Solo cups to Coca-Cola Co. and PepsiCo Inc. water bottles.",0.2269135781060328,0.3187114520006858,0.2728125150533593,0.28811216070246815
N14238,sports,football_ncaa,College Football Rivalries: The Top Nicknames ,0.2269135781060328,0.2651812123629221,0.24604739523447744,0.2524253342772923
N29819,movies,movies-celebrity,"Paparazzi Drove Keira Knightley to a Mental Breakdown: 'I Told Them I Was Going to Kill Somebody' The twice-Oscar-nominated actress spoke frankly with The Telegraph about how the enormous pressure of 2003's ""Pirates of the Caribbean"" and the hits that followed forced her to retreat from the limelight.",0.2269135781060328,0.2788190294894099,0.25286630379772135,0.2615172123616175
N770,tv,tvnews,"Megyn Kelly Slams NBC News on 'Tucker Carlson Tonight' for Matt Lauer Investigation, Harvey Weinstein Coverage In Megyn Kelly's first televised interview since exiting NBC, the former Fox News and NBC News anchor took to ""Tucker Carlson Tonight"" Wednesday evening to criticize NBC News management for its handling of the outlet's Harvey Weinstein coverage and internal Matt Lauer investigation.",0.2269135781060328,0.2872091557381522,0.25706136692209247,0.26711062986077905
N20933,sports,football_ncaa,"College football Week 7 takeaways: LSU offense shows it's for real LSU appears to finally have the offense to compete with Alabama, and other things Dan Wolken learned from Week 7 of the college football season.",0.2269135781060328,0.2348948105671073,0.23090419433657006,0.23223439974674914
N50049,sports,football_ncaa,"11 bold predictions for rest of college football season Alabama misses the playoff, USC wins Pac-12 and more",0.2269135781060328,0.2716377340155467,0.24927565606078975,0.25672968204570873
N28660,news,newsworld,"Erdogan vows to 'crush the heads' of Kurds if they don't withdraw; both sides trade blame for violating cease-fire Turkish President Recep Tayyip Erdogan on Saturday promised to ""crush the heads"" of the Kurds in Syria if they don't fall back from the border's safe zone, according to reports.",0.2269135781060328,0.3038988955933038,0.2654062368496683,0.2782371230975468
N35554,sports,football_ncaa,"Lane Kiffin interested in Florida State head coach job Look out, folks. Lane Kiffin wants back into the Power Five, expressing his interest in the Florida State job on the heels of Willie Taggart's Sunday firing.",0.2269135781060328,0.2983045683289282,0.2626090732174805,0.2745075715879631
N38821,news,newsphotos,The US Navy is 244 years old today. Here are 42 powerful images from its iconic history. The US Navy has long been the most visible part of America's military might with visits to far flung ports and operations all over the world.,0.2269135781060328,0.2982121052533286,0.2625628416796807,0.2744459295375633
N51147,sports,football_ncaa,10 storylines to follow heading down college football's home stretch Seven weeks down; seven to go. We've hit the halfway mark of the college football regular season. It's been entertaining thus far   not too many surprises   with enough intrigue to keep us going back each week.,0.2269135781060328,0.2437705380326408,0.23534205806933678,0.23815155139043814
N8285,sports,football_ncaa,"Report: Potential new USC AD told he cannot pursue Urban Meyer, could back out USC supposedly has a deal in place with Cincinnati athletic director Mike Bohn to make him their next AD, but many expected an official announcement on Monday.",0.2269135781060328,0.2856024331674609,0.25625800563674683,0.2660394814803182
N17371,news,newsworld,Turkey Takes Fight Against Kurdish Fighters to Iraq As It Struggles in Syria The Turkish Defense Ministry announced that up to seven Kurdish PKK fighters were killed in back-to-back strikes in northern Iraq as deadly clashes continued across the border in Syria.,0.2269135781060328,0.3048703930373524,0.2658919855716926,0.27888478806024586
N6785,news,newsworld,Today in History: November 5 ,0.2269135781060328,0.299704744259433,0.2633091611827329,0.2754410222082996
N27106,sports,football_ncaa,Brett McMurphy's College Football Bowl Projections After Week 8 This week's National Championship projection: LSU vs. Ohio State. The post Brett McMurphy's College Football Bowl Projections After Week 8 appeared first on Stadium.,0.2269135781060328,0.2678472478902737,0.24738041299815325,0.25420269129552675
N53052,movies,movienews,Charlize Theron Says Playing Megyn Kelly Was 'Harder' Than Portraying a Serial Killer Charlize Theron: Playing Megyn Kelly Was 'Harder' Than Playing a Serial Killer,0.2269135781060328,0.2794369924325557,0.2531752852692942,0.2619291876570481
N21628,news,newsus,"Parkland shooter's death penalty trial set to begin in January Parkland school shooter Nikolas Cruz's death penalty trial is set to begin in January 2020, according to a court order issued Thursday by Florida Circuit Judge Elizabeth Scherer.",0.2269135781060328,0.3031988971374081,0.2650562376217205,0.277770457460283
N11673,movies,movies-celebrity,"Blake Lively Hilariously Trolls Ryan Reynolds for Having ""No Chill"" Blake Lively trolled husband Ryan Reynolds and his gin company, Aviation Gin, on Instagram with some hilarious Stories. See what she wrote here.",0.2269135781060328,0.291913938685657,0.2594137583958449,0.2702471518257823
N31820,news,newsworld,"What we know about the military dog injured in the al-Baghdadi raid The Belgian Malinois wounded during the raid targeting ISIS leader Abu Bakr al-Baghdadi hasn't been identified, but President Trump tweeted a declassified photo.",0.2269135781060328,0.3036701939504715,0.26529188602825216,0.2780846553356586
