ID,category,sub_category,content,collaborative_rec,content_rec,mean,two_one
N8519,lifestyle,lifestylebuzz,"Kristen Stewart Just Made Leather Bras a Thing, and We're All For It Leave it to Kristen Stewart to look like a total badass while promoting her new film Charlie's Angels.",0.1663202871595474,0.2484776028138242,0.2073989449866858,0.22109183092906526
N13057,lifestyle,lifestyleroyals,"Queen Elizabeth and Michelle Obama Shared 'Instant, Mutual Warmth' When They Broke Royal Protocol Queen Elizabeth Welcomed When Michelle Obama Put Arm Around Her",0.1663202871595474,0.2707135402866443,0.21851691372309584,0.23591578924427864
N4654,sports,basketball_nba,"Shaq gets emotional welcome back from TNT crew after sister's death Shaq had been away after his sister, Ayesha Harrison-Jex, died from cancer at age 40.",0.1663202871595474,0.212452504345657,0.1893863957526022,0.19707509861695377
N53428,news,newspolitics,"Pete Buttigieg Says He Does Not Respect Donald Trump: 'At a Deeper Level I Don't Think He Respects Himself' Democratic candidate Pete Buttigieg went on the offensive against President Donald Trump, saying that Trump has done nothing to command his respect.",0.1663202871595474,0.246033843232744,0.2061770651961457,0.2194626578750118
N57528,news,newsus,Bahareh Zare Bahari: Beauty queen says she will be killed if she is deported to Iran An Iranian beauty queen who has spent almost two weeks inside Manila's international airport says she will be killed if she is sent back home and is seeking asylum in the Philippines.,0.1663202871595474,0.2574589471285663,0.21188961714405685,0.22707939380556
N48423,sports,basketball_nba,"Warriors' Steve Kerr clarifies comments about Klay Thompson After he previously implied that Thompson wasn't going to play this coming season, Steve Kerr clarified his comments later on Tuesday.",0.1663202871595474,0.2537363603107401,0.21002832373514374,0.22459766926034253
N50748,weather,weathertopstories,"A rare October snowstorm blankets the Texas Panhandle Heavy snow fell in parts of the Texas Panhandle on Thursday, causing near whiteout conditions in Amarillo, according to the National Weather Service.",0.1663202871595474,0.2647708208977939,0.21554555402867065,0.23195397631837839
N5092,sports,basketball_nba,Giannis Antetokounmpo spoils Harden-Westbrook debut with triple-double in Bucks comeback ,0.1663202871595474,0.2657773467110447,0.21604881693529604,0.23262499352721225
N8959,news,newspolitics,"Graham now says Trump's Ukraine policy was too 'incoherent' for quid pro quo A day after saying he wouldn't bother reading transcripts released by House Democrats in the impeachment inquiry into President Trump, Sen. Lindsey Graham, R-S.C., now says he did read the testimony, and his conclusion is that the administration's Ukraine policy was too ""incoherent"" for it to have orchestrated the quid pro quo that is at the heart of the probe.",0.1663202871595474,0.2731510992137416,0.2197356931866445,0.23754082852901018
N4693,lifestyle,lifestylecelebstyle,"8 Times Ciara Was the Sexiest Person on the Red Carpet - or Within 50 Miles - This Year Ciara's red carpet style is automatic, supersonic, hypnotic, funky fresh, and - above all - unbelievably sexy.",0.1663202871595474,0.2873536568249346,0.22683697199224098,0.2470092002698055
N24578,entertainment,celebrity,"Week in celebrity photos for Oct. 28-Nov. 1, 2019 See what the stars were up to during the last week of October.",0.1663202871595474,0.2476722426467357,0.20699626490314155,0.22055492415100625
N24422,sports,football_nfl,Lamar Jackson makes NFL history with huge day in win over Bengals ,0.1663202871595474,0.2292020547734756,0.1977611709665115,0.20824146556883286
N52631,sports,basketball_nba,"Steve Kerr says Warriors' blowout opening loss is no one-off: 'This is reality' The last five years we've been living in a world that isn't supposed to exist, Kerr said after Golden State fell 141-122 to the Clippers.",0.1663202871595474,0.2321807049499705,0.19925049605475895,0.2102272323531628
N49526,sports,basketball_nba,"James Harden drops 59 points as Rockets edge Wizards in high-scoring duel James Harden would not let the Rockets lose, not a game like this. And all it took was for the Rockets to score 159 points. With no one stopping anyone, with 3s falling and drives ending at the rim, Harden kept scoring and scoring until the Rockets finally got a stop and just enough scoring to finally score just enough. After Russell Westbrook drove to a three-point play after a Harden slam missed, giving the Rockets a lead with 32.4 seconds...",0.1663202871595474,0.2872055534738534,0.2267629203167004,0.24691046470241806
N43608,news,newsus,"Trump, Newsom wildfire clash came days after Newsom lauded president as 'partner' Last week Gov. Newsom thanked the Trump administration for ""moving expeditiously to support our efforts"" fighting fires. That was then, this is now.",0.1663202871595474,0.259865172306621,0.21309272973308419,0.2286835439242631
N28149,sports,basketball_nba,"After summer moves, Jazz not worried about offensive stumbles to start season We've got to not think the game too much, just go out there and play.  Jeff Green",0.1663202871595474,0.2765653093217068,0.2214427982406271,0.239816968600987
N27023,sports,basketball_nba,"Paschall, young Warriors beat Blazers for 1st home win SAN FRANCISCO (AP)   Rookie forward Eric Paschall hit a key 3-pointer with 4:05 remaining and finished with 36 points and 13 rebounds for his best game yet, leading the injury-plagued Golden State Warriors to a 127-118 victory against Damian Lillard and the Portland Trail Blazers on Monday night for their first home win at last. Without all their injured stars, the young Warriors more than hung tough   they shined   against a Western Conference...",0.1663202871595474,0.2492136588382941,0.20776697299892075,0.22158253494537852
N41832,sports,basketball_nba,Curry swishes shots in warm-up sequence at Chase Center The Golden State Warriors will begin a new season in their new arena Chase Center on Thursday night.,0.1663202871595474,0.2653896645972937,0.21585497587842054,0.23236653878471158
N26040,sports,football_nfl,"32 things we learned from Week 7 of the 2019 NFL season As the NFL approaches its midseason point, several contenders are rounding into top form while others are getting desperate.",0.1663202871595474,0.2445180676845789,0.20541917742206314,0.2184521408429017
N14167,music,music-celebrity,Britney Spears Does The Splits Like a Boss in Workout Video She's still got it!,0.1663202871595474,0.2610862383653715,0.21370326276245943,0.22949758796343012
N16541,sports,basketball_nba,"Steve Kerr says it's unlikely Klay Thompson returns this season from ACL tear Last month, Golden State general manager Bob Myers announced that Klay Thompson would be out at least until the All-Star break to recover from the ACL tear he suffered in the NBA Finals, which left the door open for a return this season.",0.1663202871595474,0.2463647080706327,0.20634249761509005,0.21968323443360427
N39235,news,newscrime,"Florida woman allegedly flees 2 car crashes, kills driver in 3rd crash A Florida woman who killed a 53-year-old man after running a red light and smashing into his Lexus on Saturday morning was in the process of fleeing two earlier car accidents when she caused the fatal collision, police said.",0.1663966581991299,0.2349500551351855,0.2006733566671577,0.21209892282316695
N4486,news,newsus,"Florida air show crash: Pilot killed when plane crashes An airplane crashed Friday afternoon at an air show in Florida, killing the pilot, Martin County Sheriff William Snyder said.",0.1668993377365883,0.2307887004642512,0.19884401910041977,0.2094922462216969
N59496,sports,football_nfl,"Week 7 winners, losers: Aaron Rodgers now in MVP race; Mitchell Trubisky looks lost Aaron Rodgers' big game vaults him into the MVP race. Meanwhile in Chicago, it might be time for the Bears to reconsider Mitchell Trubisky's future.",0.1669193397668172,0.2559620692042393,0.21144070448552826,0.22628115939176527
N41218,news,newspolitics,"Election Day 2019: Most Important Races and What to Watch For In elections that will determine policy, the political makeup of state legislatures and who lives in governors' mansions, voters will head to the polls Tuesday in states across the country.",0.1669793733088963,0.2776917469841435,0.2223355601465199,0.24078762242572777
N1843,tv,tvnews,Survivor Contestant Rudy Boesch Dies at 91 After Long Battle with Alzheimer's Disease Survivor's Rudy Boesch Dead at 91,0.1677283468373336,0.2004903129184899,0.18410932987791173,0.18956965755810448
N25785,sports,football_nfl,OJ Simpson suing Vegas hotel for defamation over 2017 TMZ story claiming 'belligerence' ,0.1681758796399405,0.2127723891065288,0.19047413437323463,0.19790688595099937
N28074,lifestyle,lifestylefamilyandrelationships,"Woman Texts Dead Father's Phone for 4 Years & Finally Receives an Emotional Reply The pain of losing a parent, especially at a young age, is one that never really goes away.",0.168519693081944,0.2328759046402359,0.20069779886108996,0.21142383412080526
N31931,news,newscrime,Florida man arrested in beating death of peeping Tom Victor Vickery had been in bed with his girlfriend when they heard a man with a history of peeping at their window.,0.16853489142304,0.2089948749063707,0.18876488316470535,0.19550821374526045
N16617,news,newsus,"Coast Guard searches for man who fell from cruise off Texas The U.S. Coast Guard late Thursday said it was searching for a man who plunged into the Gulf of Mexico while the ship was about 47 miles off the coast of Galveston, Texas.",0.1689251979957578,0.2752608426948696,0.2220930203453137,0.2398156277951657
N59426,travel,travelnews,"Four American Airlines flight attendants arrested at Miami airport, accused of money laundering Four American Airlines flight attendants were arrested at Miami International Airport Monday on money laundering charges.",0.1692126883663152,0.2835901139944348,0.226401401180375,0.24546430545172826
N33503,foodanddrink,restaurantsandnews,These Restaurants Are Rumored To Be Haunted By Spirits Get into the Halloween spirit with a reservation at one of these spooky spots.,0.1692630136887771,0.2622970262171913,0.2157800199529842,0.2312856887077199
N2805,movies,movienews,"Star Wars: The Rise of Skywalker trailer is out, tickets already on sale The trailer debuted during Monday Night Football halftime, on Carrie Fisher's birthday.",0.1693213768747959,0.2651591098901998,0.21724024338249787,0.23321319888506517
N57239,movies,movies-celebrity,Emma Watson Says She Rejects the Word Single: 'I Call It Being Self-Partnered' Emma Watson Rejects the Word Single: 'I Call It Being Self-Partnered',0.1693213768747959,0.2828673583117309,0.2260943675932634,0.24501869783275254
N25258,sports,boxing,Evander Holyfield's son wins pro boxing debut in 16 seconds ,0.1693823556604379,0.1923279447967173,0.18085515022857762,0.18467941508462418
N23554,sports,football_nfl,Joe Flacco criticizes Broncos coaches as 'afraid to lose' after Colts' comeback Joe Flacco made it clear he thought the Broncos weren't aggressive enough when playing with a lead late in Sunday's loss to the Colts.,0.1695399075653035,0.23284776136145,0.20119383446337674,0.21174514342940118
N54225,news,newsus,"Multiple Houses on Fire After Plane Crashes in NJ At least two houses are on fire in Colonia, New Jersey, after a plane crash, according to the Colonia Fire Department. A Cessna 414 crashed into a home on Berkley Avenue at 11 a.m. Tuesday, according to the FAA. The FAA will conduct an investigation into the cause of the crash. The number of people aboard and their conditions are unknown. The area is a heavy residential area with tree-lined streets. News 4's Dennis Protsko, who is part of the...",0.1697046943754808,0.25199864287519,0.21085166862533541,0.22456732670862029
N37378,news,newsus,"Wisconsin jury awards $450,000 in Sandy Hook defamation case A jury in Wisconsin has awarded $450,000 to the father of a boy killed in the 2012 Sandy Hook school shooting after he filed a defamation lawsuit against conspiracy theorist writers who claimed the massacre never happened.",0.1697251626814376,0.2364933968512114,0.2031092797663245,0.21423731879462013
N21019,autos,autosnews,"Ford Baby Bronco Bare Body Allegedly Leaked In Exclusive Photo Ford had no comment, but it sure looks like the real deal.",0.1697599965163425,0.2729226686028229,0.2213413325595827,0.23853511124066276
N41298,music,music-celebrity,"Katy Perry sued for $150k by photo agency for 3-year-old pic Katy Perry allegedly posted a paparazzi photo without paying the fee, a photo agency claims.",0.1697599965163425,0.2457252860792174,0.20774264129777995,0.22040352289159243
N55911,lifestyle,lifestylebuzz,Katie Holmes Talks About That Bra and Cardigan Moment Katie Holmes Talks About That Bra and Cardigan Moment,0.1698557931698051,0.2306577699700364,0.20025678156992074,0.2103904443699593
N12576,news,newsworld,Chinese pilot suspended after woman poses in cockpit with drinks The unidentified woman is seen sitting in the captain's seat with drinks in front of her on an Air Guilin flight in January this year.,0.1702222762349474,0.2548862514015414,0.2125542638182444,0.22666492634601007
N2735,sports,football_nfl,Jimmy Garoppolo addresses Erin Andrews interview by saying he uses 'baby' 500 times a game ,0.1702713558590072,0.2461530842916514,0.2082122200753293,0.22085917481410333
N27235,news,newspolitics,"Hillary Clinton backs out of DC event also set to include Tulsi Gabbard, Kirstjen Nielsen: report Hillary Clinton has backed out of a Friday appearance at an event also scheduled to include Democratic presidential candidate Tulsi Gabbard, among other guests, according to a report.",0.1705195122511278,0.2559988893322492,0.21325920079168847,0.22750576363854205
N24492,news,newsus,"Police: Off-Duty Dallas Officer Mistakenly Shoots, Injures Adult Son Thinking He Was An Intruder An off-duty Dallas officer accidentally shot and injured his adult son in DeSoto Saturday evening, police say.",0.1705195122511278,0.2204163584823707,0.19546793536674925,0.20378407640528973
N39762,news,newscrime,"Woman stabbed to death by son in Plainville, police say A 21-year-old man is accused of stabbing his mother to death in Plainville. Police were called at 10:14 p.m. Thursday to the home at 37 Landau Road. The victim, 51-year old Carlyn D. Murphy, was found dead with apparent stab wounds. Her son, Sean Murphy, 21, who lived in the home, was taken into custody at Patriots Place in Foxborough. Plainville police said they do not believe that there is any ongoing threat or danger to the public. Sean...",0.1705195122511278,0.2195620278779284,0.19504077006452808,0.20321452266899487
N1258,travel,travelnews,"Tourist in Venice kidnaps local woman in row over exchange rate The 46-year-old Israeli was unhappy about the sum of money he was given, and reacted by locking himself in the currency exhange with the worker",0.1705195122511278,0.2437565087023738,0.2071380104767508,0.21934417655195848
N37083,news,newsus,Police warn against THC-laced Halloween candy Police in Pennsylvania are urging parents to be extra cautious with their Halloween candy this year.,0.1705195122511278,0.2523908938890902,0.211455203070109,0.22510043334310273
N10679,news,newspolitics,Justice Dept. appeals order on Mueller grand jury testimony The Justice Department is appealing a judge's order directing the department to produce to the House secret grand jury testimony from special counsel Robert Mueller's Russia investigation.,0.1706362151341336,0.2844818824781615,0.22755904880614752,0.24653332669681885
N8448,entertainment,entertainment-celebrity,Celebs celebrate Halloween 2019 Here's how the stars dressed up while celebrating Halloween this year!,0.170847605190421,0.2680340912021511,0.21944084819628606,0.23563859586490774
N35458,finance,markets,"Brazil oil auction a 'total disaster' as bidders stay away Brazil's largest-ever auction of oil deposits flopped, sending the real tumbling, after state-controlled Petroleo Brasileiro SA did most of the bidding while other major oil companies stayed away.",0.1711240568145674,0.2697948152271524,0.22045943602085988,0.23690456242295738
N44442,news,newspolitics,"CNN Poll: 50% support impeaching Trump and removing him from office Half of Americans say President Donald Trump should be impeached and removed from office, according to a new CNN poll conducted by SSRS.",0.1711497177681816,0.2886658402965701,0.22990777903237586,0.24949379945377395
N10417,music,musicnews,Watch Miranda Lambert Invite a Little Girl On Stage Who 'Stole' Her Heart The girl's mother thanked Lambert for raining attention on her daughter Remi during the show on Saturday night.,0.1713338722644425,0.2636407076401461,0.21748728995229427,0.23287176251491154
N19660,news,newsus,"Woman found dead in Ohio home was likely killed by her Great Danes, police say An officer responding to a possible overdose found a woman lying on the floor with ""numerous"" cuts and puncture wounds.",0.1714092892805998,0.2312569253675276,0.2013331073240637,0.21130771333855167
N24591,lifestyle,lifestylebuzz,"A heartbreaking photo of a dog riding a bus alone went viral, and now people want to adopt her A kennel is seeking the dog's owner. If no one comes forward, she will be put up for adoption.",0.1715766188351072,0.2370843904064583,0.20433050462078273,0.21524846654934127
N58226,sports,racing,NASCAR driver's car got flipped over and then stuck the landing in wild wreck at Talladega Brendan Gaughan had the best reaction to getting flipped.,0.1716822750538364,0.2336149914984367,0.20264863327613655,0.21297075268356994
N59359,news,newscrime,Police Arrest Motorcyclist Who Led High-Speed Chase And Went Home Thinking He Escaped A motorcyclist was arrested after leading California Highway Patrol units on a high-speed chase in Placerville on Saturday.,0.1717697970811113,0.2351398284864986,0.20345481278380495,0.2140164846847028
N58936,news,newsus,Beloved grandfather's body pulled from collapsed Hard Rock hotel A family holding vigil outside the site of the Hard Rock hotel construction collapse received the news they hoped they'd never hear.,0.172069878295089,0.2013027181945619,0.18668629824482547,0.19155843822807095
N14349,entertainment,celebrity,Celebrity Headshots from Before They Were Famous Prepare for some straight-up baby faces.,0.1720901214691552,0.2550634983399348,0.213576809904545,0.22740570604967494
N12349,lifestyle,lifestylebuzz,"Divers Find Giant Mysterious 'Egg' Floating In Ocean A team of divers set off to explore a sunken World War II ship off the Norwegian coast, but what they found was something far more mysterious. While making their way back to shore, Ronald Raasch, Nils Baadness and Brynjar Aarnseth came face-to-face with a giant floating orb. The bubble hovered 17 meters (56 feet) below the surface and appeared to be see-through. The divers turned their flashlights on it and realized that the sphere was filled...",0.1721375412917088,0.2627480603977352,0.217442800844722,0.23254455402905974
N52865,news,newspolitics,Ohio's Reputation As a Must-Win State May No Longer Be True ,0.1723416171565199,0.2607004642263063,0.21652104069141312,0.23124751520304418
N32027,sports,football_nfl,Payton declines to name Saints starting QB for Week 8 ,0.1723416171565199,0.2166720620713931,0.1945068396139565,0.2018952470997687
N5211,sports,football_nfl,"Jets trade DL Leonard Williams to Giants The USC product is in the final year of his deal, and the Jets wanted to get something for him while they still could. The third-rounder they'll be getting from the Giants will presumably be an early third-rounder.",0.1723416171565199,0.273597670941464,0.22296964404899194,0.23984565301314928
N53209,sports,baseball_mlb,"​Are the Astros stealing signs to gain an edge in ALCS? Hopefully. If your code is easy to crack, the problem is on you, not the codebreaker.",0.1723416171565199,0.3111412570179607,0.2417414370872403,0.26487471039748045
N54807,news,newsworld,"Russia questions language of ""unusual"" Trump letter to Erdogan Russia questions language of ""unusual"" Trump letter to Erdogan",0.1723416171565199,0.2948672489910315,0.2336044330737757,0.254025371712861
N64395,sports,football_nfl,J.J. Watt has sobering quote after season-ending injury The Houston Texans lost the rock of their team for the season during Sunday's win over the Oakland Raiders. Stud pass rusher and future Hall of Famer J.J.,0.1723416171565199,0.214372711426654,0.19335716429158695,0.20036234666994263
N21851,sports,football_nfl,"Next man up: Chiefs prepare for life without Mahomes, with Moore Two weeks ago, Tyreek Hill served as Matt Moore's top target.",0.1723416171565199,0.2397139317105219,0.2060277744335209,0.21725649352585458
N57364,news,newspolitics,"Facebook's Zuckerberg grilled by AOC on fact-checking policy for political ads Facebook CEO Mark Zuckerberg struggled to explain the social media company's new policy on fact-checking political ads under questioning from Rep. Alexandria Ocasio-Cortez during a Tuesday hearing. The company recently announced that to protect political speech it would no longer fact check ads from politicians, essentially allowing campaigns to pay Facebook to spread disinformation. At the hearing of the House Financial Services committee,...",0.1723416171565199,0.2609512048220217,0.21664641098927082,0.23141467560018777
N63306,sports,football_nfl,Jenkins' scorching response to Scandrick ripping Eagles Former Philadelphia Eagles cornerback Orlando Scandrick ripped into Malcolm Jenkins and his former teammates in general.,0.1723416171565199,0.2736114941757915,0.2229765556661557,0.23985486850270096
N22929,sports,football_nfl,"Burning questions for Cowboys vs Giants on 'Monday Night Football' Capping off the action in Week 9, the New York Giants are hosting the Dallas Cowboys for the NFC Monday Night Football. There are five burning questions for this NFC matchup.",0.1723416171565199,0.2782119423879441,0.225276779772232,0.24292183397746936
N5019,sports,football_nfl,"Winners, losers from Cowboys' win over Giants on 'Monday Night Football' In a NFC East tilt, the Cowboys overwhelmed the Giants defense late while Big Blue continues to trip over its own feet.",0.1723416171565199,0.2555246511365009,0.2139331341465104,0.2277969731431739
N64456,news,newsus,"LA's Getty fire was sparked by downed power lines, Mayor Garcetti says LOS ANGELES - The Getty fire was sparked by a tree branch that fell on power lines, Los Angeles Mayor Eric Garcetti announced at a news conference Tuesday evening. Video footage shows the branch breaking off a eucalyptus tree and sparking the fire in the 1900 block of North Sepulveda Boulevard, Garcetti said. The power lines being examined are operated by the Los Angeles Department of Water ...",0.1723416171565199,0.2727425439575293,0.2225420805570246,0.23927556835719282
N32670,news,newspolitics,"McConnell tees up government funding votes amid stalemate Senate Majority Leader Mitch McConnell (R-Ky.) is turning the Senate toward trying to pass a set of long-stalled appropriations bills. ""Congress has fallen badly behind schedule on appropriations. It's been a month since my Democratic colleagues filibustered government funding here on the floor, blocking defense funding and a pay raise for service members. We need to get moving,"" McConnell said from the Senate floor. McConnell said the Senate...",0.1723416171565199,0.2932080295238947,0.2327748233402073,0.2529192254014364
N4408,sports,football_nfl,"Patrick Mahomes already back at practice for Chiefs Although Reid didn't rule Mahomes out for the team's Week 8 game, it seems like a long-shot for the quarterback to get back onto the field that quickly.",0.1723416171565199,0.2186244549402337,0.1954830360483768,0.20319684234566243
N49990,sports,football_nfl,Watch: Kevin Harlan's call of streaking cat on 'MNF' is epic This might legitimately be the best thing we've ever heard from Mr. Harlan.,0.1723416171565199,0.2628451229432432,0.21759337004988155,0.2326772876810021
N35685,autos,autosreview,"First Drive! 2020 Shelby GT500 Is an Apex Predator, Turning Drivers Into Track Stars Driving the 2020 Shelby GT500 on the street, dragstrip, and road course reveals an apex predator that turns any driver into a track star.",0.1723416171565199,0.2994107416224525,0.2358761793894862,0.257054366800475
N45824,sports,football_nfl_videos,"Ian Rapoport: MRI results are good news for Patrick Mahomes, Kansas City Chiefs NFL Network Insider Ian Rapoport and James Palmer provide a Patrick Mahomes injury update.",0.1723416171565199,0.2167209510566662,0.19453128410659304,0.20192783975661743
N37835,sports,football_nfl,Giants will not go back to Eli Manning after Daniel Jones' struggles Jones has thrown eight interceptions and has lost two fumbles in his past four starts.,0.1723416171565199,0.2547667323306606,0.21355417474359026,0.22729169393928036
N34380,news,newspolitics,"House rejects GOP measure censuring Schiff Democrats in the House turned aside a GOP-led privileged resolution to censure House Intelligence Committee Chairman Adam Schiff (D-Calif.) on Monday in a 218-185 vote.Republicans and President Trump have increasingly targeted Schiff, a public face of the impeachment effort.They have taken issue with Schiff's exaggerated account of the details of President Trump's July 25 phone call with Ukrainian President Volodymyr Zelensky during a...",0.1723416171565199,0.2703772405261229,0.2213594288413214,0.23769869940292188
N27164,sports,football_nfl,"Burning questions for Dolphins vs. Steelers on 'Monday Night Football' The Dolphins (0-6) are visiting the Steelers (2-4) to close out NFL Week 8 on Monday Night Football. Fans should brace for an ugly game, because that's been a weekly occurrence whenever the Dolphins take the field.",0.1723416171565199,0.2558482461755755,0.2140949316660477,0.22801270316922362
