ID,category,sub_category,content,collaborative_rec,content_rec,mean,two_one
N64049,news,newsworld,"After Soldiers Surrender El Chapo's Son, a Shocked Mexican City Sighs With Relief In the days following the siege of the city of Culiacán by the Sinaloa cartel, residents were overcome with relief: Relief that the terror is over.",0.1797194273990531,0.2570687044904534,0.21839406594475325,0.23128561212665327
N11917,travel,travelnews,JetBlue Plane Makes Emergency Landing at JFK Airport The plane landed safely in NYC Sunday night.,0.1797194273990531,0.2557299583478273,0.2177246928734402,0.2303931146982359
N391,news,newsus,"Illegal drones ground water-dropping helicopters at critical moment in Maria fire battle LOS ANGELES - As flames rapidly spread along a hillside in Santa Paula, firefighters were faced with a perilous dilemma: ground night-flying helicopters working to contain the growing fire or risk an aerial collision with a thrill-seeking drone.",0.1797194273990531,0.2597185910553453,0.2197190092271992,0.23305220316991454
N2153,news,newsworld,"Iran alleges foreign government behind 'treacherous' ship attack Iran said Monday a foreign government was behind what it alleges was a ""treacherous"" attack on a tanker off Saudi Arabia last week, as it released pictures of its damaged hull. But the state-owned NITC denied reports the alleged attack had originated from Saudi soil.",0.1797194273990531,0.2763686886175942,0.22804405800832367,0.24415226821141384
N5887,weather,weathertopstories,"Lucky Texas Storm Chaser Sees Hailstones Whizz Past Him During Tornado Storm chaser Marcus Diaz may think twice about how close he gets to the elements after large hailstones whizzed past his head from behind as he was filming an EF2 tornado in Tahoka, Texas, earlier this year. According to Accuweather, the winds in the tornado reached ""between 113 and 157 mph."" Diaz posted footage of the moment he was filming a ""dusty EF-2 tornado at close range"" as the hailstones almost hit ""the camera from behind,"" to Twitter on October 17. The lucky storm chaser told Storyful the footage was recorded on May 5. No injuries were reported as a result of the storm. However, the cyclone ripped through agricultural areas, ""causing structural damage to farms and wrecking equipment, power lines, and irrigation systems,"" according to media reports. Diaz may be better served in the future by heeding the advice of the National Oceanic and Atmospheric Administration (NOAA). According to NOAA, ""if you are unable to make it to a safe shelter, either get down in your car and cover your head, or abandon your car and seek shelter in a low lying area such as a ditch or ravine."" Credit: Marcus Diaz via Storyful",0.1797194273990531,0.2621595370630315,0.22093948223104232,0.23467950050837205
N41420,news,newsus,Cracks found on 38 of 810 Boeing 737 NG jets inspected globally Cracks found on 38 of 810 Boeing 737 NG jets inspected globally,0.1797194273990531,0.2958847995762965,0.2378021134876748,0.2571630088505487
N57737,news,newsus,"Missing Minnesota boy, 6, and his dog, found in cornfield by drone with thermal camera A missing 6-year-old boy from Minnesota and his dog were found Wednesday after hundreds of volunteers   including one who used his own drone with a thermal camera   searched for him for hours.",0.1802030381893723,0.2451123022575926,0.21265767022348245,0.22347588090151915
N14385,news,newsworld,ISIS names successor to slain leader al-Baghdadi The militant group named Abu Ibrahim Hashimi al-Quraishi as the new leader in a message posted by its official media wing.,0.1804345938917759,0.2705743689686228,0.22550448143019935,0.2405277772763405
N14761,weather,weathertopstories,Niagara Falls: Boat stuck on rocks 101 years dislodged High winds and heavy rains dislodged the remains of a barge in the rapids above Niagara Falls that had been there 101 years.,0.1804513340099356,0.259895393702458,0.2201733638561968,0.2334140404716172
N28711,sports,football_ncaa,The biggest games in the month of November that will decide the College Football Playoff The month of November will decided which teams will be in College Football Playoff contention. A look at the biggest games in a jam-packed schedule.,0.1805096727090405,0.2980575734774358,0.23928362309323814,0.2588749398879707
N9798,news,newsus,"Missing West Point cadet found dead, officials say A U.S. Military Academy cadet who vanished last week has been found dead, officials said Wednesday.",0.1807158105105469,0.2217767342612214,0.20124627238588416,0.20808975967766322
N63276,autos,autosenthusiasts,Gordon Ramsay's Ferrari Monza SP2 Looks Delicious Good thing the roofless ride is inside because it's raining outside.,0.1814922053320004,0.2815633446113132,0.2315277749716568,0.2482062981848756
N6154,sports,football_ncaa,"Report: Florida State considering firing Willie Taggart, pursuing Urban Meyer Willie Taggart should definitely look over his shoulder, should this report be true.",0.1816524190691499,0.2547047712114376,0.21817859514029375,0.23035398716400834
N24889,news,newspolitics,"McConnell tees off on Democrats over impeachment Senate Majority Leader Mitch McConnell (R-Ky.) teed off against the House impeachment inquiry on Tuesday, marking his first comments since Congress returned from its two-week break. ""House Democrats are finally indulging in their impeachment obsession. Full steam ahead,"" McConnell said during a speech from the Senate floor, adding that House Speaker Nancy Pelosi (D-Calif.) had ""crumbled"" to the ""left-wing impeachment caucus."" ""I don't...",0.1816930373802024,0.2844814387150959,0.23308723804764914,0.2502186382701314
N33013,lifestyle,lifestylebuzz,"Couple Cancels Wedding, Keeps $30K as ""Donation"" for Honeymoon Instead In a viral Facebook post, a couple announces they're canceling their wedding, but keeping the $30,000 in gifts for a honeymoon instead.",0.1816948890465875,0.273609570822615,0.22765222993460127,0.24297134356393915
N53880,finance,markets,"The megaprojects that changed countries forever Megaprojects are complex and expensive ventures that take years to complete. Although the massive scale of these projects makes them fraught with risk, they also have the capacity to bring great economic and social benefits during and after construction. Whether good or bad, these are the megaprojects that have shaped the future of their countries in a big way.",0.1816948890465875,0.3200825009653466,0.25088869500596706,0.2739532969924269
N8331,entertainment,celebrity,"Melanie Griffith, 62, shows off her insane figure in lingerie selfie, plus more news Melanie Griffith looks more stunning than ever in lingerie selfie, plus more celebrity news for Oct. 30, 2019.",0.1824134166177866,0.2422106023576353,0.21231200948771095,0.22227820711101906
N16290,news,newsus,"Missouri man missing for a week found alive in car that crashed into ravine Ryan Linneman, of Lee's Summit, was found by a dirt bike rider in wreckage along Interstate 470 in Kansas City, Lee's Summit police said.",0.1824276380696759,0.2427994532706635,0.2126135456701697,0.2226755148703343
N41797,autos,autosenthusiasts,"Tent Spent: We Try Luxury Camping in a $100,000 Airstream Call us crazy, but we actually enjoy traditional camping activities such as gathering firewood, pitching a tent, and peeing in the woods.",0.1824795804506097,0.3020625723189104,0.24227107638476006,0.26220157502947683
N57318,news,newsus,"A 2,000-pound great white shark is swimming off the coast of Florida A great white shark that weighs over 2,000 pounds and measures 15 feet, 5 inches long has been swimming along the US East Coast.",0.182609544825351,0.2778357158091031,0.23022263031722706,0.24609365881451906
N1398,news,newsus,"Iowa woman killed by explosion at gender reveal party An Iowa woman was killed by debris from an explosion at a gender reveal party on Saturday, police said.",0.1828173994983287,0.23526899861838,0.20904319905835433,0.21778513224502957
N7132,lifestyle,lifestylebuzz,"8 Hero Dogs That We Don't Deserve From trained search and rescue dogs, to a cosmonaut, to a boxer with a penchant for recycling, here are 8 dogs who deserve all the belly rubs.",0.1828745470642727,0.2469372220973379,0.21490588458080528,0.22558299708631616
N9441,sports,baseball_mlb,How President Trump reacted to getting loudly booed at the World Series Video surfaced of his reaction.,0.1830027342410498,0.2546394704138427,0.21882110232744625,0.2307605583562451
N24724,news,newsworld,"Humanitarian crisis unfolds as violence escalates in Syria In little more than a week, longstanding alliances have crumbled and old enemies have teamed up after the U.S. began pulling its forces out and Turkey invaded Syria",0.1830735519493184,0.2792895392012712,0.2311815455752948,0.24721754345062025
N28257,news,newspolitics,"Meghan McCain confronts Trump Jr.: 'You and your family have hurt a lot of people' Donald Trump Jr., the president's son, defended his family after ""View"" co-host Meghan McCain suggested they were responsible for the lack of ""character"" in American politics.",0.1836329392662624,0.2429412164661635,0.21328707786621295,0.22317179073286314
N38562,sports,baseball_mlb,Nationals still uncertain on Scherzer status after injection HOUSTON (AP)   The Washington Nationals remain unsure about the health of pitcher Max Scherzer and catcher Kurt Suzuki heading into Game 6 of the World Series against Houston. Scherzer was scratched from his Game 5 start Sunday night because of nerve irritation near his neck and had a cortisone shot. Scherzer won the opener and hopes to be able to pitch in a Game 7 if the Nationals get that far. Houston won three in a row at Washington to take a...,0.1836749050070856,0.2642163740612752,0.2239456395341804,0.23736921770987868
N54435,news,newsus,"'Angel' car saves Arizona family after smashing into suspected drunk driver running red light, video shows An Arizona driver who police praised as an ""angel"" may have saved the lives of a couple pushing a stroller in a crosswalk last week after video showed the car smashing into a suspected drunk driver speeding through a red light -- who came inches away from plowing into the family.",0.1837000028169925,0.2412897199423249,0.2124948613796587,0.2220931475672141
N21623,news,newsus,"A 'one in a million' yellow cardinal, dubbed 'Sunny,' seen in Florida Only three yellow cardinal sightings are reported a year, making the bird's appearance a rare ""one in a million"" finding, an Auburn professor said.",0.1837290693563233,0.2732745638859779,0.2285018166211506,0.24342606570942635
N10340,foodanddrink,tipsandtricks,"The French Grandmother's Clever Trick to Keeping Fruit Flies Away When I worked in Paris as an au pair, I marveled at how the French seemed to have it all figured out. The family's grandmother always set the table with the good silver even on a Tuesday. I was instructed to pick up fresh, fluffy chouquettes from the boulangerie for the kids' after-school snack instead of, I don't know, granola bars (which is what I would've gotten). It was almost irritating how everyone around me seemed to have effortlessly...",0.1839076035492164,0.2782737038337839,0.23109065369150017,0.24681833707226142
N871,tv,tv-celebrity,"Woman, suspect dead at 'Tarzan' actor Ron Ely's California residence Ron Ely, who portrayed Tarzan in the TV series in the 60s, was not harmed and is alive and well, a sheriff's office spokesman said.",0.1840683747417657,0.2276387949453568,0.20585358484356125,0.21311532154415977
N42470,finance,finance-companies,G.M. Workers Approve Contract and End U.A.W. Strike The longest nationwide strike against General Motors in half a century ended on Friday after a solid majority of the company's union members delivered their support for the four-year contract hammered out by their leaders. The United Auto Workers union emerged with substantial wage increases and succeeded in ending a two-tier wage structure that had been a particular irritant in its ranks. It also won commitments to new G.M. investments in...,0.1840839459813371,0.2757214691295929,0.229902707555465,0.2451756280801743
N30612,finance,personalfinance,"The first thing 14 lottery winners have bought after finding out they were rich Winning the lottery may be a dream come true, but what that actually looks like is different for everyone.",0.1843832884349036,0.2846035994106619,0.23449344392278273,0.2511968290854091
N5445,weather,weathertopstories,"Wild fall freeze: Utah falls close to minus-35 as West shivers, while bitter cold oozes east Denver could start Halloween morning near 0 degrees.",0.1847340995665898,0.264968927821688,0.22485151369413892,0.2382239850699886
N13008,finance,finance-companies,Harley-Davidson halts production of new electric motorcycles Harley-Davidson has halted production and deliveries of its new LiveWire electric motorcycle after reportedly discovering a problem with its charging mechanism.,0.1852555604736576,0.2900969349737593,0.23767624772370846,0.25514981014039206
N41244,entertainment,entertainment-celebrity,"Keanu Reeves holds hands with Alexandra Grant as the Internet swoons, plus more news The Internet is even more in love with Keanu Reeves after Alexandra Grant PDA. Plus, more celebrity news for Nov. 5, 2019.",0.1853171237176179,0.2489823508742196,0.21714973729591874,0.2277606084886857
N25158,lifestyle,lifestyleroyals,Kate Middleton Takes Prince George and Princess Charlotte Halloween Shopping at Local Supermarket Kate Middleton Takes George and Charlotte Halloween Shopping,0.1856518611463453,0.2621197694604528,0.22388581530339904,0.23663046668908364
N54522,entertainment,celebrity,"Ben Affleck has a new girlfriend after using the Raya dating app, plus more celeb love life news for late October 2019 Meg Ryan and John Mellencamp call it quits, Halsey and Evan Peters get serious, James McAvoy weds, Meghan King Edmonds accuses hubby of cheating and more.",0.1858774264578672,0.2416666389635969,0.21377203271073206,0.22307023479502036
N4020,tv,tv-celebrity,"'Tarzan' Actor Ron Ely: Actor's son allegedly killed his mother before deputies shot and killed him, sheriff's office says The son of ""Tarzan"" actor Ron Ely killed his mother before he was shot and killed by deputies on Tuesday, according to the Santa Barbara County Sheriff's Office.",0.1859196693366961,0.2293320086925611,0.2076258390146286,0.21486122890727274
N40640,foodanddrink,foodnews,"Foie Gras Is Banned by New York City Lutèce served it seared, with dark chocolate sauce and bitter orange marmalade. Le Cirque offered it in classic terrine form, but also served it with rabbit and bacon and made it the scene-stealer in a ravioli dish. But Lutèce closed in New York in 2004. Le Cirque shut its last Manhattan location in 2017. And foie gras, the calling card of fine French dining, is about to follow suit. The New York City Council overwhelmingly passed legislation on...",0.1860792671394281,0.2631559688052558,0.22461761797234198,0.2374637349166466
N33164,sports,football_nfl,100 famous NFL players who played for teams you forgot about Randy Moss with the Titans? Archie Manning with the Vikings? Plenty of NFL players had some forgettable stints with surprising teams.,0.1862315521511094,0.2350270263614585,0.21062928925628394,0.21876186829134214
N54536,news,newsus,4 High School Students Killed in Texas Car Crash That Also Injured 3: 'We Grieve Together' 4 High School Students Killed in Texas Car Crash,0.1863998557176587,0.2433547919247269,0.2148773238211928,0.2243698131890375
N12215,news,newspolitics,Democrats Who Voted to Impeach Bill Clinton Urge Republicans to Vote on Trump Inquiry with 'An Eye Towards History' Former Democrat representatives Paul McHale and Gene Taylor said Republicans have to set aside partisanship.,0.1865907774118843,0.2707056134468578,0.22864819542937104,0.2426673347685333
N28058,lifestyle,lifestylebuzz,Strange Dog Shows Up On Woman's Lawn   And Seems To Recognize Her Kate Howard was sitting outside her home one afternoon after a memorial service when something amazing happened.,0.1867014187799944,0.2295089275088752,0.2081051731444348,0.2152397579325816
N56461,finance,finance-taxes,"President Trump's trillion-dollar hit to homeowners People should consider one of the largely unexamined effects of the last tax bill, which Trump promised would help the middle class: Would you believe it has inflicted a trillion dollars of damage on homeowners?",0.186796920859614,0.273753057277706,0.23027498906866,0.24476767847167533
N11727,foodanddrink,restaurantsandnews,"Popeyes quietly launched a new pumpkin pie and it's the best fast-food dessert I've ever tasted Popeyes still doesn't have the chicken sandwich, but it does have a delicious new deep-fried pumpkin and cream cheese pie. Run, don't walk.",0.1869562045629383,0.2800419574455097,0.233499081004224,0.24901337315131924
N63180,music,music-celebrity,"Taylor Swift can't shake 'Shake It Off' copyright suit reinstated by federal court panel A federal appeals court panel Monday reinstated a dismissed copyright lawsuit claiming Taylor Swift's ""Shake It Off"" infringed on an earlier song.",0.1869562045629383,0.2788461625670191,0.2329011835649787,0.24821617656565884
N38495,health,health-news,"Poultry Recall After 22 Tons of Vietnamese Products Distributed Without Import Inspection In addition to failing to go through the usual food inspection processes, the products came from Vietnam a country that is not eligible to export poultry products to the U.S. or any meat products aside from catfish.",0.1869562045629383,0.2590845963441437,0.223020400453541,0.23504179908374193
N59254,news,newsus,Judge rules deputies can't put 'no trick-or-treat' signs in sex offenders' yards A federal judge has ruled deputies in a Georgia county cannot put warning signs where registered sex offenders live.,0.1869562045629383,0.2670773832319456,0.22701679389744195,0.24037032367560981
N27919,sports,golf,Martin worries about amputation after breaking right leg Casey Martin's worst fear was realized earlier this month when he stepped awkwardly off a curb and fractured his right tibia.,0.1869562045629383,0.1967189676947066,0.19183758612882246,0.1934647133174505
N32268,foodanddrink,foodnews,"I ate one of Meghan Markle's favorite foods from Toronto here's what I thought The food at Terroni was good and the prices were surprisingly affordable, but the service was disappointing.",0.1869562045629383,0.2871339840929972,0.23704509432796772,0.25374139091631087
N17681,foodanddrink,foodnews,McDonald's Is Going to Add Chicken to Its Breakfast Menu in 2020 Here's the rumor from McDonald's HQ. The post McDonald's Plans to Add Chicken to Its Breakfast Menu in 2020 appeared first on Taste of Home.,0.1869562045629383,0.3093496617778132,0.24815293317037573,0.2685518427061882
N20109,music,musicnews,Lady Gaga Says 'Fame Is Prison' -- And Has Fans Speculating If New Music Is on the Way The singer's fans are also wondering if she's talking about the pressures of the industry.,0.1869562045629383,0.270789562174701,0.22887288336881967,0.2428451096374468
N60850,foodanddrink,newstrends,"Popeyes is bringing back the chicken sandwich--and also takes a swipe at Chick-fil-A FORT WORTH -- The much-loved Popeyes Louisiana Kitchen fried chicken sandwich returns Sunday, and the company's announcement was a hard kick to the gizzard for competitor Chick-fil-A. After a limited-time summer special turned into a $65 million marketing bonanza, Popeyes will return both the spicy and mild sandwiches -- and on Sunday, when Chick-fil-A is not even open. Popeyes' ...",0.1869562045629383,0.2742361173529101,0.23059616095792418,0.24514281308958616
N7499,entertainment,celebrity,New Couple Alert? Drake and Kylie Jenner Appear Into Each Other at Party New Couple Alert? Drake and Kylie Jenner Appear Into Each Other at Party,0.1869562045629383,0.2716740514740283,0.2293151280184833,0.24343476917033163
N42570,news,newsus,"Woman dies after being hit by vehicle crossing northwest Fort Worth street, police say A 24-year-old woman died Wednesday after she was struck by a vehicle as she walked across a far northwest Fort Worth street, police said. Kristen Morton was hit at about 6:15 p.m. on Boat Club Road near Reef Point Lane, authorities said. The crash was an accident, a Fort Worth police spokesman said. Police did not describe the vehicle. Morton, who lived in White Settlement, was taken ...",0.1869562045629383,0.2112008074657743,0.19907850601435628,0.20311927316482897
N34934,sports,golf,"20 years after Payne Stewart's tragic death, son Aaron carries his legacy Aaron Stewart spent his summers on the road as a PGA Tour kid. The behind-the-scenes visits at the Columbus Zoo during the Memorial Tournament stand out among his favorite memories as well as the ""music man"" under the big tree on Hilton Head Island.",0.1869562045629383,0.2253257232425231,0.20614096390273068,0.2125358836826615
N18086,foodanddrink,restaurantsandnews,"I Would Go Back to This Missouri Theme Park Just for the Snacks The excellent food at Silver Dollar City is one of many reasons that Branson, Missouri is an essential stop on any Midwest road trip.",0.1869562045629383,0.3065199220118256,0.24673806328738196,0.26666534952886317
N61186,music,music-celebrity,Infected toe stops R. Kelly from attending court hearing CHICAGO (AP)   R. Kelly's lawyer has told a federal judge that an infected toe prevented the R&B star from attending a hearing in his child pornography case in Chicago. Kelly is detained at a jail two blocks from the courthouse and had been expected to appear at Wednesday's status hearing. But defense lawyer Steve Greenberg said one of Kelly's toenails had to be removed as treatment and Kelly worried someone might trample on his toe as he was...,0.1869562045629383,0.2500746702710612,0.21851543741699975,0.22903518170168688
N41089,lifestyle,lifestylebuzz,"This Man's Rattlesnake Bite Is a Warning to Everyone to Take Animal Bites More Seriously You wouldn't think a baby rattlesnake could do so much damage, but Austin McGee knows better after almost losing his finger to one.",0.1869562045629383,0.2387371729120873,0.21284668873751278,0.22147685012903764
N21720,health,health-news,Juul accused of selling 1 million tainted vaping pods Former Juul senior vice president Siddharth Breja claims he was fired in March for raising concerns about contaminated pods,0.1869562045629383,0.2451736617760234,0.21606493316948083,0.22576784270499503
N3577,health,health-news,Tennessee reports 49 cases of lung injury linked to vaping Tennessee health officials say they have received 49 cases of serious lung injury in people who use electronic cigarettes or other vaping devices.,0.1869562045629383,0.2773883022312767,0.2321722533971075,0.2472442696751639
N619,news,newsus,"Cornell student, 18, found dead in gorge after frat party, reports say A top Ivy League student was found dead Saturday afternoon in a New York gorge after he left a fraternity party and disappeared Thursday night, according to reports.",0.1870406428241872,0.2169175943438769,0.20197911858403206,0.20695861050398032
N61342,sports,basketball_nba,"The Warriors' fall from glory, explained Things are getting bad quick for the Warriors.",0.1870441845056155,0.2515836081063654,0.21931389630599044,0.2300704669061154
N29197,lifestyle,lifestylebuzz,Bella Hadid Is Named Most Beautiful Woman in the World -- How It Was Decided Beyonce and Amber Heard also made the list!,0.1872006083171755,0.2662576281535294,0.22672911823535244,0.23990528820807808
N20950,sports,football_ncaa,"Franklin upset players wore Sutherland T-shirts without permission Some Penn State players wore T-shirts in warmups ahead of Saturday's game against Iowa in support of teammate Jonathan Sutherland, who was sent a controversial letter from a ""fan"" earlier this week.",0.1872387497450418,0.2366063375786968,0.2119225436618693,0.22015047496747847
N47438,sports,mma,UFC Tampa results: Jedrzejczyk dominates Waterson Joanna Jedrzejczyk just took a dominant decision over Michelle Waterson in the UFC Tampa co-main event.,0.1872387497450418,0.2389576645902366,0.2130982071676392,0.221718026308505
N306,movies,movies-celebrity,"Kevin Spacey Won't Be Charged in Sexual Assault Case After Accuser Dies The Los Angeles County District Attorney's Office has formally dropped a case against actor Kevin Spacey, after the accuser died.",0.187341021013793,0.2238349167055384,0.20558796885966568,0.21167028480828992
N13231,news,newsus,"Homeowner says a mystery object damaged his house. It didn't fall from a plane, FAA says Authorities including the Federal Aviation Administration have not been able to identify a canister-type object that damaged a Kentucky man's home.",0.1873831566724468,0.2482616274902138,0.2178223920813303,0.22796880388429147
N10414,movies,movienews,"Robert Evans, 'Chinatown' Producer and Paramount Chief, Dies at 89 Robert Evans, the Paramount executive who produced ""Chinatown"" and ""Urban Cowboy"" and whose life became as melodramatic and jaw-dropping as any of his films, died on Saturday night. He was 89. Even though Hollywood history is filled with colorful characters, few can match the tale of Evans, whose life would seem far-fetched if it were",0.1875166460552204,0.2302595618028069,0.20888810392901364,0.21601192322027807
N19347,news,newspolitics,"Former US Senator Kay Hagan dead at 66 Former U.S. Sen. Kay Hagan, a one-time Capitol Hill intern who went on to become North Carolina's first Democratic female senator, died Monday at her Greensboro home. She was 66.",0.1878315231998394,0.243430993391905,0.2156312582958722,0.22489783666121643
N58580,tv,tv-gallery,"17 Hallmark Movies That Are Totally Worth Watching From festive flicks to cheesy romantic comedies, here are all the best Hallmark movies that are worth watching at least once.",0.1882579437327727,0.3102898195370652,0.24927388163491893,0.26961252760230103
