ID,category,sub_category,content,collaborative_rec,content_rec,mean,two_one
N23979,finance,markets,"China already snapping up U.S. farm goods, Trump claims President Donald Trump boasted Sunday without providing evidence that China had ""already begun"" making large purchases of U.S. agricultural products as part of last week's tariff deal with Beijing.",0.1215066645812175,0.2853665499217658,0.20343660725149165,0.23074658814158303
N23887,news,newsus,"Video allegedly shows police officer roughing up 11-year-old girl There's no excuse for the way this girl was treated, the Farmington police chief said.",0.1241579559552488,0.2325833466069677,0.17837065128110824,0.19644154972306138
N37131,sports,baseball_mlb,What recent history tells us to expect from World Series Game 7 Will the Nationals and Astros give us a classic or a clunker?,0.1248860782209859,0.2771961431363839,0.2010411106786849,0.2264261214979179
N24691,news,newsus,"Bill Macy, Bea Arthur's Husband on 'Maude,' Dies at 97 Norman Lear saw him choking on a chicken bone and brought him to Hollywood. The actor also appeared in 'My Favorite Year' and 'The Late Show.'",0.1297832718111289,0.2153788423643894,0.17258105708775914,0.18684698551330256
N23163,news,newspolitics,"'You people with this phony Emoluments Clause': Cabinet meeting devolves into 71 minutes of Trump grievances President Trump, trying to dig out from two new political holes of his own making on top of the expanding House impeachment inquiry, held forth for 71 minutes Monday during what was ostensibly a Cabinet meeting but ended up being a familiar torrent of grievance, defensiveness and bold statements about his expansive view of his own powers.",0.130694324263825,0.2609161423017988,0.1958052332828119,0.2175088696224742
N59026,news,newsus,"Cincinnati school board candidate accused of 'pretending to be black' in his ads A current CPS board member took to Twitter Sunday to say a candidate for the board ""is a white guy pretending to be black to get votes"" in ads.",0.1401200707302867,0.2367681006196799,0.1884440856749833,0.20455209065654884
N55051,lifestyle,voices,I Am Unapologetically Raising My Daughter Without Religion ,0.1434889941240792,0.2819485392679824,0.2127187666960308,0.23579535755334802
N24294,news,newspolitics,"Giuliani Mixes His Business With Role as Trump's Lawyer It is an extraordinary time in Washington, but it is more or less business as usual for Rudolph W. Giuliani. He is a central figure in the impeachment inquiry. He is under scrutiny by federal prosecutors. But throughout the building controversy, Mr. Giuliani has continued to represent clients, broker deals and take on consulting contracts in Washington and around the world in ways that leave him subject to criticism that he is using...",0.1435625894887595,0.2627176541725948,0.20314012183067715,0.22299929927798304
N20121,music,musicnews,"Bob Kingsley, Country Radio Legend, Dead at 80 Country radio legend Bob Kingley, the longtime host of the nationally syndicated program Bob Kingsley's Country Top 40, died early Thursday in Weatherford, Texas, following a lengthy battle with bladder cancer. He was 80 years old. A member of the Country Radio Broadcasters Hall of Fame, inducted in 1998, he later became only the format's fifth representative in the National Radio Hall of Fame in 2016. Kingsley was 18 and serving in the Air...",0.1450650580701279,0.2244724931068019,0.18476877558846488,0.19800334809457723
N23614,tv,tv-celebrity,"John Witherspoon Dies: Comedian & 'Friday' Star Was 77 John Witherspoon, an actor-comedian who for decades made audiences laugh in television shows and films, including the hit Friday franchise, died suddenly at his home today. He was 77. ""It is with deepest sorrow that we can confirm our beloved husband and father, John Witherspoon, one of the hardest working men in show business, died",0.1454106297694775,0.210460037358094,0.17793533356378574,0.18877690149522183
N61005,sports,football_nfl,Randy Moss takes a perfect dig at Joe Buck's infamous 'disgusting act' call ,0.1458426968349765,0.2173572805851986,0.18159998871008753,0.19351908600179124
N8275,news,newsworld,"30 killed in DR Congo bus accident At least 30 died early Sunday when a packed bus came off the road and burst into flames near Kinshasa, the DR Congo capital, a local official said.",0.1470304922562747,0.2270679419342098,0.18704921709524225,0.20038879204156476
N62612,news,newscrime,16-year-old injured in shooting near Churchill Downs ,0.153966297791305,0.1935272103761629,0.17374675408373397,0.1803402395145436
N48031,sports,basketball_nba,Ex-Maverick to pay for funeral of woman fatally shot in home by police ,0.153966297791305,0.2047898983069372,0.17937809804912108,0.18784869813505978
N6072,news,newsus,"Search resumes for worker missing in New Orleans Hard Rock Hotel building site collapse that killed 2 Rescuers resumed searching Sunday for a worker trapped in rubble after a deadly construction collapse in New Orleans, officials said, but the building's instability is making for a precarious situation.",0.153966297791305,0.2180551919241438,0.1860107448577244,0.1966922272131975
N6087,news,newsworld,"U.S. bans all flights to Cuba outside Havana in latest crackdown American Airlines and JetBlue, which fly routes to Cuba other than Havana, will have to submit to new regulations from the Transportation Department.",0.153966297791305,0.3002833273718509,0.22712481258157796,0.2515109841783356
N51163,lifestyle,lifestylebuzz,"He grew a 910-pound pumpkin and then used it as a boat Instead of making a giant jack o'lantern or a massive pie that could feed the whole town, a farmer in Tennessee took his 910-pound pumpkin out for a spin in his pond.",0.153966297791305,0.2705432285489163,0.21225476317011066,0.23168425162971254
N24611,news,newscrime,"Former Jewish Hospital nurse to be arraigned on sexual abuse of patient charge According to court documents, Dorsey told the woman ""repeatedly"" that, ""I would like to video you.""",0.153966297791305,0.2386201918045861,0.19629324479794555,0.21040222713349238
N15710,news,newscrime,Arrest made in connection to stabbing in South Louisville ,0.153966297791305,0.2209348324226726,0.1874505651069888,0.19861198754555004
N29948,lifestyle,lifestyle-news-feature,"A White Woman Searches for Her Black Family DNA testing tells people a lot about their geographic ancestry, prompting difficult questions about racial identity and belonging. ""In my heart, I feel a connection.""",0.153966297791305,0.2728896697804309,0.21342798378586794,0.23324854578405557
N61101,news,newscrime,"Resident recalls moments leading up to fatal shooting in Russell neighborhood In the Russell neighborhood, crime tape has become a well known sight that's why Lisa Tutt encourages her son and his friends to hang out at her house. READ THE FULL STORY:Resident recalls moments leading up to fatal shooting in Russell neighborhood Sign up for our Newsletters CHECK OUT WLKY:Live. Local. Late-Breaking. Get the top Louisville news, weather and sports from the team at WLKY   online, anytime.",0.153966297791305,0.2309740991703825,0.19247019848084373,0.20530483204402333
N42704,news,newscrime,UPDATE: Coroner reveals identity of victim in Beechmont neighborhood shooting ,0.153966297791305,0.2045314822215463,0.17924889000642563,0.18767642074479918
N29802,finance,finance-companies,"Barneys Is Sold for Scrap, Ending an Era Authentic Brands Group will take control of the Barneys name   one that has been part of the Manhattan landscape since 1923   and license it to other companies like Saks Fifth Avenue. The firm B. Riley Financial is preparing to liquidate Barneys' high-end wares, at its five stores and two Warehouse locations, starting with private sale events for Barneys' ""most loyal"" shoppers next week.",0.153966297791305,0.2856080186661943,0.21978715822874964,0.24172744504123117
N8429,weather,weathertopstories,"Group clears plastic drums, tires from Falls of the Ohio State Park LOUISVILLE, Ky. (WHAS11)   The Falls of the Ohio is a little cleaner after volunteers helped return it to its glory. The volunteers picked up trash and debris along with old tires and leftover plastic barrels. It was part of Moran Environmental Recovery's effort to clean up parts of the state park. The group says over the years, the site has experienced waste dumping leaving the grounds full of empty drums, tires and glass. The state park is the...",0.153966297791305,0.2761824222749152,0.2150743600331101,0.2354437141137118
N2663,news,newsworld,16 sentenced to death for burning alive Bangladesh teen Sixteen people were sentenced to death Thursday for burning alive a Bangladeshi teenager who refused to withdraw sexual assault charges against her head teacher.,0.153966297791305,0.2476008990234465,0.20078359840737575,0.21638936527939934
N43353,news,newscrime,"Wedding shooter may have been avenging late stepfather's murder, authorities say Brandon Castiglione, the groom's son, was previously charged with second-degree murder in the death of the suspect's stepfather.",0.153966297791305,0.2114359058457642,0.1827011018185346,0.19227936982761112
N31739,news,newscrime,"'Habitual stowaway' arrested again at O'Hare, Chicago police say A woman arrested at O'Hare International Airport on Friday night was identified by Chicago police as ""known habitual stowaway"" Marilyn Hartman.",0.153966297791305,0.2652805842454894,0.2096234410183972,0.2281758220940946
N23061,news,newscrime,"Police arrest suspect in Bashford Manor double shooting Police have identified the suspect in a double shooting that happened in Bashford Manor. On Thursday, officers arrested Matthew Martin on attempted murder and other drug-related charges. Police said Martin and one of the victims pulled out guns during an argument that happened at Martin's apartment on Goldsmith Lane Wednesday afternoon. Following the argument, both victims were shot in the back as they ran down the hallway and were transported...",0.153966297791305,0.2250823619252673,0.18952432985828616,0.20137700721394652
N3433,finance,finance-companies,A secretive family landing a $4 billion haul has everyone guessing One of the world's richest and most discreet families must decide what to do with a massive pile of cash.,0.153966297791305,0.2614003228417147,0.20768331031650986,0.2255889811582448
N54889,lifestyle,lifestyle-news-feature,"Chris, the famously woolly sheep, has died Chris made headlines in 2015 after he became the unofficial world record holder for having grown the heaviest fleece.",0.153966297791305,0.2407587843300298,0.19736254106066742,0.2118279554837882
N1569,news,newsus,"Officer who shot naked man found not guilty of murder DECATUR, Ga. (AP)   A former Georgia police officer who fatally shot an unarmed, naked man was found not guilty of murder Monday but was convicted of aggravated assault and other charges that could send him to prison for more than 30 years. Robert ""Chip"" Olsen's face turned red and he squeezed his eyes shut tightly as the verdict was read. His wife, Kathy Olsen, began sobbing and had to be led from the courtroom. DeKalb County Superior Court...",0.153966297791305,0.2262072939110806,0.1900867958511928,0.2021269618711554
N3142,health,health-news,"Teen wins science competition with liquid bandage invention Kara Fan beat nine other finalists and hundreds of students who submitted ideas in the 3M​ Young Scientist Challenge, winning $25,000.",0.153966297791305,0.2569036211497436,0.2054349594705243,0.22259118003026404
N19709,news,newscrime,Teen given 8 years in prison for gang-related hate crime of student caught on tape A California teenager has been sentenced to eight years in prison for a gang-affiliated hate crime assault on another student.,0.153966297791305,0.2353369411848817,0.19465161948809334,0.20821339338702277
N10438,lifestyle,lifestylebuzz,"Pope Lick Legend: Loved ones of those who died on trestle push for change Legends of a monster living under a dangerous train trestle have lured people to a quiet Louisville creek for decades. Some swear they have seen proof of a human-goat hybrid terrorizing the area. Others leave with no sightings and no story to tell. Those are the lucky ones. The story of a ""Pope Lick Monster"" or ""Goatman"" haunting the trestle at Pope Lick Creek has been commonplace in Louisville even becoming the focus of a movie in the late...",0.153966297791305,0.2413786143989242,0.19767245609511458,0.21224117552971777
N41011,news,newsworld,"For the first time, a man has been sentenced for sexual slavery by the International Criminal Court. He got 30 years. Bosco Ntaganda is a former Congolese rebel nicknamed the ""Terminator."" The ICC convicted him on 18 counts including murder, sexual slavery and using child soldiers.",0.153966297791305,0.2220249515794987,0.18799562468540185,0.1993387336501008
N21773,travel,travelnews,Lumber spilled on I-71 following rollover crash; Lanes shut down ,0.153966297791305,0.2549499295034368,0.2044581136473709,0.2212887189327262
N31402,foodanddrink,restaurantsandnews,"The Best Seafood Restaurant in All 50 States Think there are too many seafood places in Maine to choose among, but none in landlocked Nebraska? This list will point your cravings and more in the right direction. Whether it's shrimp, crab, fish, or sushi that you love, even the most landlocked states have top-notch options for seafood. Find out what's near you.",0.153966297791305,0.3340505035125211,0.24400840065191304,0.27402243493878237
N19041,news,newscrime,Kroger shooting: Suspect coming out of store fires at officers before they shoot him dead ,0.153966297791305,0.2503620760107861,0.20216418690104554,0.2182301499376257
N65112,news,newscrime,"Family says 16-year-old was victim hit, killed on I-64 The person struck by 5 vehicles on Interstate 64 Friday night was a 16-year-old girl, according to family members. The girl's father, Ronnie Click, spoke with WHAS11 News Saturday and said his daughter Brea was killed in that incident. Police responded to I-64 near the 22nd Street exit after they received reports that a person had been hit while walking in the slow lane. RELATED: LMPD: Pedestrian struck and killed on I-64 E at 22nd Street Once...",0.153966297791305,0.2126482018506841,0.18330724982099456,0.19308756716422437
N22976,news,newsus,"The Sante Fe High School massacre suspect isn't fit to stand trial and will get psychiatric treatment, attorney says Dimitrios Pagourtzis is accused of killing eight students and two teachers at his Texas high school last year.",0.153966297791305,0.2099399535166148,0.18195312565395988,0.19128206827484484
N63045,news,newscrime,"Coroner IDs man found dead in Klondike neighborhood A man who was found dead in the Klondike neighborhood has been identified. Louisville Metro police responded to the 3200 block of Pomeroy Drive for a call of a person down Friday. Officials said Kevin Hellems, 54, was found dead inside the home from some type of foul play. No other information has been released. The death comes as a surprise to the neighbors in the area, who say they aren't used to seeing police cars and detectives on this...",0.153966297791305,0.2103944261328798,0.18218036196209242,0.19158505001902154
N34567,news,newscrime,Grandfather charged in death of toddler who fell on cruise ship in Puerto Rico A grandfather who police say dropped his young niece from the 11th floor of a cruise ship docked in Puerto Rico in July has been accused of negligent homicide.,0.153966297791305,0.2257421550767965,0.18985422643405075,0.201816869314966
N7023,lifestyle,lifestyle-news-feature,"After being pushed close to extinction, this humpback whale population is making a comeback A key population of humpback whales is in recovery after it was pushed close to extinction by centuries of exploitation, according to a new study.",0.153966297791305,0.2802427012620271,0.21710449952666605,0.2381505667717864
N55833,news,newscrime,"Oldham County man charged, injuring victim during shooting practice ",0.153966297791305,0.2294742027524591,0.19172025027188205,0.20430490109874105
N5398,news,newscrime,Suspects identified following hours-long SWAT standoff on South 34th Street ,0.153966297791305,0.2248454643587494,0.1894058810750272,0.20121907550293458
N44462,news,newscrime,"Louisville man who shot at LMPD officer sentenced to 10 more years in prison A Louisville man convicted of shooting at an officer was sentenced Friday. Judge David Hale sentenced Elijah Eubanks, 22, to 119 months in prison for a federal weapons charge. Sign up for our Newsletters In March 2018, Eubanks opened fire on an officer who was attempting to question him while he was in his vehicle with another person. No officers were hit, but Eubanks was shot multiple times when officers returned fire. Eubanks was previously...",0.153966297791305,0.2418872572657248,0.1979267775285149,0.2125802707742515
N58224,news,newscrime,"13-year-old charged with two murders escapes custody in North Carolina Officials said they have concerns for public safety due to the teen's ""prior history of assaultive and unpredictable behavior.""",0.153966297791305,0.221123081883048,0.18754468983717648,0.1987374871858003
N50528,news,newscrime,Man shot in the chest on Floyd Street ,0.153966297791305,0.2093822801482717,0.18167428896978835,0.19091028602928278
N31741,music,musicnews,"Snoop Dogg bringing 'I Wanna Thank Me' tour to Louisville Palace Multi-platinum rap legend Snoop Dogg is bringing his ""I Wanna Thank Me"" tour to the Louisville Palace in 2020. The venue announced on Twitter that the show is scheduled for Jan. 25. Live Nation presale starts starts Thursday at 10 a.m., and tickets go on sale to the general public Friday at 10 a.m. The Long Beach native released his 17th album, ""I Wanna Thank Me,"" in August. The Doggfather's West Coast G-funk style has sold more than 38 million...",0.153966297791305,0.2600761090963112,0.2070212034438081,0.22470617199464243
N35656,travel,travelnews,Motorcyclist killed in crash on New Cut Road identified ,0.153966297791305,0.2051848471602861,0.17957557247579553,0.18811199737062573
N48390,travel,travelnews,First round of auctions begin for Joe Ley Antiques ,0.153966297791305,0.247616521016007,0.200791409403656,0.21639977994110632
N6244,news,newscrime,Suspect Alfredo Vazquez pleads guilty in Clark County judges' shooting case ,0.153966297791305,0.2275122173628122,0.19073925757705862,0.20299691083897647
N59049,news,newsworld,"Three gunmen killed in Brazil airport raid, kidnapping: police Heavily armed gunmen raided an airport in Brazil on Thursday, officials said, stealing money from an armored truck before fleeing and taking a mother and baby hostage. At least one assailant escaped to a nearby residential neighborhood, taking a mother and her baby hostage in their home, the police spokeswoman said.",0.153966297791305,0.2480358047734486,0.2010010512823768,0.2166793024460674
N63317,news,newscrime,"Police: 4 charged with attempted murder month after shooting in SW Louisville Four people are facing attempted murder charges for a shooting last month in southwest Louisville. According to arrest citations, a group arrived at an apartment in the 9600 block of Lamborne Boulevard on Sept. 27 and attempted to lure a male, unknown age, out of his apartment. When the victim agreed to come outside, police said Byron Kirby, 25, shot at the victim four times. The victim then ran into the woods. It's unclear if he was hit....",0.153966297791305,0.2265744897357797,0.19027039376354235,0.20237175908762145
N17686,news,newscrime,"Suspect in Henry County murder, kidnapping arraigned ",0.153966297791305,0.2227807280711904,0.1883735129312477,0.19984258464456192
N45099,news,newscrime,Suspect in crossbow murder of his father arraigned ,0.153966297791305,0.2163449301431421,0.18515561396722355,0.19555205269252973
N61355,news,newscrime,"2 Murder suspects escape from Monterey County, California, Jail The suspects are considered dangerous and should not be approached. Anyone who sees them should call 911 immediately.",0.153966297791305,0.2607377737236038,0.2073520357574544,0.22514728174617085
N57967,sports,basketball_nba,Harden-Westbrook argument goes viral A clip of the Rockets stars appearing to exchange words during Thursday's game against the Bucks quickly started making the rounds online.,0.1566013810651217,0.2566158665209258,0.20660862379302375,0.22327770470232441
N13138,news,newsworld,"Amelia Bambridge: Body of missing backpacker found in sea The body of a 21-year-old British backpacker who went missing after a beach party on a Cambodian island has been found, according to the charity assisting her family.",0.1575803279067499,0.2336448029136798,0.19561256541021485,0.20828997791136986
N42526,finance,finance-companies,'Go back to work': Outcry over deaths on Amazon's warehouse floor Billy Foister died last month after a heart attack at work. The incident was just one in a series of recent accidents and fatalities,0.158013378763873,0.2156968138095254,0.18685509628669922,0.19646900212764126
N22130,music,music-celebrity,Rihanna Slays in Sexy Black Bikini in Slow-Motion Video -- Watch! The singer shut down Instagram with her slow-motion clip.,0.1592688805393676,0.273630671542215,0.2164497760407913,0.23551007454126588
N18663,news,newsus,"Coast Guard offloads $92 million worth of smuggled cocaine in San Diego The Coast Guard offloaded more than 6,800 pounds of cocaine   worth an estimated $92 million   in San Diego on Wednesday, contraband that the military branch seized in international waters of the eastern Pacific Ocean.",0.1592688805393676,0.2821116281370742,0.2206902543382209,0.24116404560450533
N15771,autos,autosenthusiasts,"The Holy Grail Of Jeep Grand Cherokees Sits On An Old Wisconsin Dairy Farm, But It May Be Doomed ",0.1592688805393676,0.2521985018638119,0.20573369120158974,0.22122196142233047
N20886,news,newsworld,"ISIS Leader Paid Rival for Protection but Was Betrayed by His Own The Islamic State leader Abu Bakr al-Baghdadi was able to hide out in an unlikely part of Syria, the base of a rival group, because he was paying protection money to its members, according to receipts for the payments recovered by researchers.",0.1592688805393676,0.2556028693636674,0.2074358749515175,0.22349153975556746
N157,sports,baseball_mlb,"How did the Nats respond to a controversial call? By leaving absolutely no doubt. A controversial interference call. Dominance from Stephen Strasburg. Booming home runs to turn it around. And now, one game to decide it all.",0.1592688805393676,0.2822083599776351,0.22073862025850136,0.2412285334982126
N20286,movies,movies-celebrity,Scarlett Johansson Says She Was 'Surprised' by Colin Jost's Proposal: 'He Killed It' Scarlett Johansson Was 'Surprised' by Colin Jost's Proposal,0.1592688805393676,0.2476972953227926,0.2034830879310801,0.21822115706165096
N47482,travel,travelnews,TSA Agents Stop Passenger With Loaded Gun Before Boarding Plane The man was carrying a loaded .22 caliber handgun.,0.1592688805393676,0.2743301987522797,0.21679953964582366,0.23597642601464236
N24123,sports,baseball_mlb,Why is Giancarlo Stanton on the Yankees' playoff roster? ,0.1592688805393676,0.2730884290828868,0.2161786548111272,0.2351485795683804
N46868,lifestyle,lifestylepetsanimals,"30 Funny Dog Photos You Need to See We asked readers to send in their favorite animal photos. We were so entertained, we couldn't help but share.",0.1592688805393676,0.2714969345138924,0.21538290752663,0.23408758318905082
N2606,news,newscrime,"Couple Accused of Injecting Childhood Friend With Meth and Filming Her As She Died After more than two years of investigation, authorities in Oklahoma have filed formal murder charges in the death of a 41-year-old woman whose last moments were captured on videotape.",0.1592688805393676,0.2267805301343445,0.19302470533685606,0.20427664693601888
N32095,news,newsus,"Illegal vapes traced to California woman who was CBD pioneer CARLSBAD, Calif. (AP)   Some of the people rushing to emergency rooms thought the CBD vape they inhaled would help like a gentle medicine. Others puffed it for fun. What the vapors delivered instead was a jolt of synthetic marijuana, and with it an intense high of hallucinations and even seizures.",0.1592688805393676,0.2545236005063244,0.206896240522846,0.22277202718400546
N55310,news,newscrime,"Joey 'the Clown' Lombardo, infamous Chicago mobster, dead at 90, reports say Chicago mobster Joseph Lombardo   better as ""Joey the Clown""   died in prison Saturday while serving a life sentence for murder, according to federal prosecutors.",0.1592688805393676,0.2165814119058868,0.1879251462226272,0.19747723478371376
N60388,news,newscrime,"Man threatened school to distract from robbery, police say As a precaution, schools in one of the districts that were threatened placed all of its schools on a modified lockdown",0.1592688805393676,0.2594722875017733,0.20937058402057046,0.2260711518476381
N5888,sports,baseball_mlb,Report: Angels could be fined up to $2M for not reporting Skaggs' opioid use The Los Angeles Angels could be fined up to $2 million by the commissioner for not reporting Tyler Skaggs' opioid use. A report published by ESPN on Saturday stated that Angels communications director Eric Kay admitted to federal investigators that he used and supplied Skaggs with drugs since at least 2017.,0.1592688805393676,0.2570406853036867,0.20815478292152714,0.22445008371558034
N1431,news,newscrime,"Four charged with repeatedly escaping prison, returning with booze and phones Acting on ""repeated reports"" that prisoners were regularly escaping and returning, authorities said they caught the men in the act with the contraband.",0.1592688805393676,0.2434339132136632,0.2013513968765154,0.21537890232223134
