ID,category,sub_category,content,collaborative_rec,content_rec,mean,two_one
N29499,news,newsus,"California governor signs measure banning 'lunch shaming' SACRAMENTO, Calif. (AP)   California's governor has signed into law a bill that guarantees all students a state-funded meal of their choice, even if their parent or guardian has unpaid meal fees.",0.1742795492505809,0.2813771146761815,0.2278283319633812,0.24567792620098128
N35452,weather,weathertopstories,"'Potentially historic wind event' over weekend could inflame California wildfires Northern California could experience a potentially historic wind event this weekend, which could have a dangerous effect on wildfires.",0.1742795492505809,0.274961540074549,0.22462054466256492,0.2414008764665596
N47485,news,newsus,"Health warning lifted over fire at California oil facility Authorities have lifted shelter-in-place orders for some 12,000 people in Northern California after containment of a fire at a fuel storage facility that sent up a huge cloud of smoke. Emergency sirens blared and thick plumes of black smoke and flames filled the skyline around the NuStar Energy LP facility in Crockett, California, about 30 miles (50 kilometers) northeast of downtown San Francisco.",0.1743251202554002,0.2783200409208987,0.22632258058814944,0.2436550673657325
N719,finance,finance-companies,"Nevada gambling bosses move to bar Wynn from casino industry The complaint filed Monday by the state's Gaming Control Board lists sexual misconduct allegations that have been lodged against the mogul since January 2018. The complaint asks Nevada's Gaming Commission, which acts on the board's recommendations and has final say on licensing, to fine Wynn and revoke his status as being found suitable to be licensed in the industry.",0.1743251202554002,0.2440299475968173,0.20917753392610874,0.22079500514967826
N34399,foodanddrink,restaurantsandnews,Burger King's new 'Ghost Whopper' is here to haunt your Halloween order The Ghost Whopper will be available at 10 select restaurants beginning Oct. 24. The only thing scarier than Burger King's new Ghost Whopper is the thought of having no Whoppers at all.,0.1749558370234242,0.2496158876724939,0.21228586234795904,0.224729204122804
N64631,news,newsworld,"She fought for human rights on a tiny island that banned guns. Then she was shot dead. Rachelle Bergeron had been the only prosecutor in Yap, a Micronesian island about 550 miles southwest of Guam.",0.1750792015991854,0.2258808729677786,0.20048003728348202,0.20894698251158086
N61972,entertainment,entertainment-celebrity,"New details on why Meg Ryan, John Mellencamp split, plus more news Meg Ryan and John Mellencamp's marriage plans may have prompted their split. Plus, more celebrity news for Nov. 4, 2019.",0.1750996638415601,0.2578993716246635,0.21649951773311177,0.2302994690302957
N19874,health,wellness,"How Your Hormones, Weight, or Medication Could Be Killing Your Sex Drive Your libido can suffer for some unexpected reasons. And remember, there is no ""normal"" when it comes to sexual desire.",0.1750996638415601,0.3003231350200586,0.23771139943080932,0.2585819779605591
N2078,tv,tv-celebrity,"Rainbow Baby! Shawn Johnson, Andrew East Welcome 1st Child After Miscarriage Rainbow Baby! Shawn Johnson, Andrew East Welcome 1st Child After Miscarriage",0.1750996638415601,0.254892058948913,0.21499586139523652,0.2282945939131287
N64554,entertainment,entertainment-celebrity,"Meghan King Edmonds, Jim Edmonds' Nanny Denies Cheating Allegations Meghan King Edmonds, Jim Edmonds' Nanny Denies Cheating Allegations",0.1750996638415601,0.2510329496806397,0.2130663067610999,0.22572185440094653
N8237,foodanddrink,restaurantsandnews,16 Secrets Olive Garden Doesn't Want You to Know Here's everything you've wanted to know about your favorite breadstick-serving restaurant.,0.1750996638415601,0.299291787761497,0.23719572580152853,0.257894413121518
N22627,news,newsus,Family Members Plead for Help in Search for Missing Atlanta College Student: 'Just Come Home' Family Pleads for Help in Search for Missing College Student,0.1750996638415601,0.2517428712343665,0.2134212675379633,0.22619513543676437
N42791,tv,tvnews,"Eva Longoria: 'Latinas Are the Last to Find Their Voices Amplified' Eva Longoria delivered a powerful and moving keynote at TheWrap's Power Women Summit in Los Angeles on Friday, saying that people in Hollywood are ""largely responsible for much of the unconscious bias that is against people of color"" and that ""Latinas are the last to find their voices amplified in this industry."" ""What studies show is that we are being erased,"" Longoria told a room of 2,000 attendees. ""This goes beyond underrepresentation. When...",0.1750996638415601,0.2625949425232968,0.21884730318242845,0.23342984962938457
N21389,news,newsworldpolitics,Rep. Katie Hill's lawyers send cease-and-desist letter to DailyMail.com over nude photos The website is the second to publish alleged lewd photos of the Democratic congresswoman.,0.1750996638415601,0.2425703037883574,0.20883498381495874,0.2200800904727583
N58091,finance,finance-companies,Ex-Credit Suisse Banker Says Secret Affair Helped Fuel $45 Million Fraud A former Credit Suisse Group AG banker told a federal jury in New York that his decision to take millions of dollars in bribes was fueled in part by his secret love affair with a subordinate.,0.1750996638415601,0.2516717407539139,0.213385702297737,0.22614771511646264
N30974,sports,basketball_ncaa,"Police identify 2 suspects in murder of Andre Emmett last month Two men accused of killing former Texas Tech and NBA player Andre Emmett were identified by Dallas police on Monday, the Dallas Morning News reported.",0.1750996638415601,0.2202769680563797,0.1976883159489699,0.20521786665143985
N47922,music,music-celebrity,"Allegations against entertainer Todrick Hall are piling up, from stories of nonpayment to accusations of backlash for reporting sexual assault Todrick Hall became prominent in Broadway musicals, for his friendship with Taylor Swift, and more. Now, accusations against him are piling up.",0.1750996638415601,0.2429294166200818,0.20901454023082094,0.22031949902724124
N22614,sports,football_ncaa,Predicting which of college football's 10 undefeated teams will lose in Week 9 How many teams will still have a perfect record after Week 9?,0.1750996638415601,0.2718984104966286,0.22349903716909436,0.23963216161160578
N56438,news,newsus,The 'race whisperer' A black activist convinced a neo-Nazi he'd save him from legal ruin. Then the real plan got underway.,0.1750996638415601,0.2454109721853188,0.21025531801343944,0.2219738694040659
N56444,health,wellness,"Jameela Jamil Called Out a New TV Show Where Judges Decide If Contestants ""Deserve"" Plastic Surgery The Good Place star had a lot to say after learning about ""The Surjury,"" a new British reality series about people competing against one another to win free plastic surgery.",0.1750996638415601,0.2640078922281902,0.21955377803487514,0.2343718160993135
N30103,travel,traveltripideas,"A network of 28 tiny, one-bed hotels in Amsterdam is being called the most beautifully designed hotel of 2019   and it consists of a series of converted bridge houses. Take a look inside. Amsterdam's bridge hotels, located in historic houses on and near bridges, are a tiny house lover's dream ⁠  and they just won a major design award.",0.1750996638415601,0.3057576502653165,0.2404286570534383,0.26220498812406434
N54449,news,newsus,"Third Indiana Catholic school employee fired in growing scandal over LGBTQ staff Unlike the others fired from Indianapolis-area Catholic schools, Kelley Fisher is straight and only expressed support for her fired colleagues.",0.1750996638415601,0.2421798216654976,0.20863974275352884,0.21981976905751843
N59774,foodanddrink,restaurantsandnews,"The Unreasonable Lengths Restaurant Workers Have to Go to Take Time Off From working doubles in advance to finding their own replacements, here's how unsalaried shift workers manage when it comes to vacation.",0.1750996638415601,0.2608520045265955,0.2179758341840778,0.23226789096491704
N63248,lifestyle,lifestylecelebstyle,"Hailey Baldwin wore three show-stopping dresses during her wedding, and put a unique twist on each one Hailey Baldwin's three custom gowns were designed by Virgil Abloh of Off-White, Vera Wang, and Ralph & Russo.",0.1750996638415601,0.2852101874787891,0.2301549256601746,0.2485066795997128
N13225,travel,traveltripideas,5 Reasons Destin Is a Great Family Vacation Destination The calm emerald waters and family-friendly attractions of the area make Destin a top spot for a fall or winter getaway.,0.1750996638415601,0.3288322678016276,0.25196596582159386,0.2775880664816051
N30827,foodanddrink,restaurantsandnews,"These are the 11 classic food-court chains with the most locations From Panda Express to Auntie Anne's to Baskin-Robbins, these are the 13 classic food-court chains with the most US locations.",0.1750996638415601,0.3019469951812035,0.23852332951138178,0.25966455140132233
N6576,health,weightloss,16 Women Reveal Exactly How They Got Six-Pack Abs What does it really take to get six-pack abs? These women can tell you exactly what worked for them.,0.1750996638415601,0.2993550659743473,0.2372273649079537,0.25793659859675155
N11163,news,newspolitics,"Kobach's campaign paid Kansan known to post racist comments on white nationalist site Kansas Republican Kris Kobach's Senate campaign paid an Olathe man who regularly posted hateful comments about Jews and racial minorities on a white nationalist website. Kobach's campaign paid Joe Suber $500 for field coordinating services in September, according to the Republican's latest campaign finance report. Suber also filed the paperwork with the state of Kansas creating ...",0.1750996638415601,0.2575436245372848,0.21632164418942246,0.23006230430537658
N40526,music,music-celebrity,Miranda Lambert Shares the Surprising Story of Her and Brendan McLoughlin's Meet-Cute The Pistol Annie's are to thank for introducing the country singer to her husband,0.1750996638415601,0.2550281391790456,0.21506390151030286,0.22838531406655044
N16344,entertainment,celebrity,Stars   They're Just Like Us! Stars   They're Just Like Us!,0.1750996638415601,0.2804202510100196,0.22775995742578986,0.24531338862053312
N50479,health,wellness,"Items you need to stop sharing with others right now Items you should never share for your health and safety include everyday items like toothbrushes, earbuds and lipstick.",0.1750996638415601,0.2956015883778357,0.23535062610969787,0.25543428019907716
N12785,sports,baseball_mlb,"With Carlos Beltran hire it's clear the Mets learned nothing from the Mickey Callaway mess In hiring Carlos Beltran to guide their fortunes next year, the Mets hierarchy once again out-thought themselves by going ""outside-the-box"" for someone who had never managed anywhere before.",0.1750996638415601,0.2540937842774843,0.21459672405952218,0.2277624107988429
N58744,lifestyle,voices,"I Gave Up On Love, And It Was One Of The Best Decisions I Ever Made At the end of our date in August 2018, Justin escorted me to my car, where henervously kissed me. When I kissed him back, he cheered, pumping his fists inthe air like he'd won something. I walked from the curb to my car, and when Iturned around, he was watching me, beaming.""I just want to make sure you get to your car safely,"" he said, even though Iwas less than a yard away.I slipped into the driver's seat, thrilled that our second date had gone...",0.1750996638415601,0.2799534577288206,0.22752656078519035,0.24500219309973376
N50258,news,newspolitics,Trump feuds with Susan Rice over Syria President Trump exchanged barbs with the former Obama administration national security adviser Susan Rice over Syria after she criticized his policy.,0.1750996638415601,0.2592882899803916,0.21719397691097586,0.2312254146007811
N51457,foodanddrink,restaurantsandnews,Restaurants Are Dealing With an Avalanche of Special Requests. One Chef Has Had Enough. It's not all about you.,0.1750996638415601,0.2550511960803081,0.2150754299609341,0.22840068533405875
N43374,news,newspolitics,Trump goes on Twitter tear after White House official condemns his Ukraine call President Donald Trump launched a sustained online offensive after details emerged of damaging congressional testimony by a senior White House official.,0.1750996638415601,0.2490902248934151,0.2120949443674876,0.22442670454279676
N29561,lifestyle,lifestylebuzz,"High school cheerleaders go off-script to help man propose to their coach A school's cheer squad coach was surprised when her students went off-script and held up four signs during a routine that read, ""Will you marry me?""",0.1750996638415601,0.2644480186599514,0.21977384125075572,0.23466523372048761
N59469,lifestyle,lifestyleroyals,"Every outfit Duchess Kate has worn in 2019 See Kate Middleton's style choices this year from glam gowns and coat dresses to re-wears, tiaras and hats.",0.1750996638415601,0.2991353615899462,0.23711751271575315,0.2577901290071508
N2018,entertainment,celebrity,"Debunking the week's tabloid stories: Nov. 1, 2019 A round-up of the week's tabloid stories that totally missed the mark.",0.1750996638415601,0.2315359225384006,0.20331779318998033,0.21272383630612043
N6285,finance,personalfinance,4 habits that could wreck your finances beyond repair Avoid these at all costs.,0.1750996638415601,0.2855211755703499,0.230310419705955,0.24871400499408663
N56853,news,newsworld,"Trump orders withdrawal of U.S. forces from northern Syria, days after Pentagon downplays possibility U.S.-allied Syrian Kurdish fighters announced late Sunday that the Syrian Army would deploy along the Turkish border to ""liberate the areas that the Turkish army has entered with its mercenaries.""",0.1750996638415601,0.2674217880838087,0.22126072596268437,0.23664774666972582
N56290,foodanddrink,tipsandtricks,The Secret Ingredient for Sausage Gravy That's Out of This World Transform your gravy with this $1 ingredient,0.1750996638415601,0.3008926976747861,0.23799618075817308,0.2589616863970441
N31099,travel,traveltripideas,Harry Potter's Childhood Home in England Is Now on Airbnb I think I can die happy now.,0.1750996638415601,0.2809527318882795,0.2280261978649198,0.24566837587270637
N36593,foodanddrink,foodnews,"How the Boston cream pie became a beloved dessert A product of the longest continually operating hotel in the United States, the Boston cream pie combines sponge cake, vanilla custard and chocolate icing to form a beloved American dessert.",0.1750996638415601,0.2787797773809913,0.2269397206112757,0.24421973953451423
N53118,health,health-news,Colorado Mom's Touching Facebook Post Beautifully Explains Why We Shouldn't Suffer in Silence One Colorado mom's Facebook post recently went viral for showing how much asking a friend for help can make the difference when you're feeling alone.,0.1750996638415601,0.2584420521110144,0.21677085797628726,0.2306612560211963
N31802,entertainment,celebrity,Stars turning 50 in 2019 Find out which celebrities are celebrating the big 5-0 in 2019!,0.1750996638415601,0.2828895098260602,0.22899458683381013,0.24695956116456017
N51503,sports,football_ncaa,"Bill Plaschke: Mike Bohn brings USC integrity, which means he can't hire Urban Meyer LOS ANGELES_You ever heard of Mike Bohn? Me neither, and that's a good thing. The University of Southern California is apparently set on naming Bohn as its new athletic director, the smart hiring of a man who embodies the most important attribute for the new leader of the Trojans family. He's a complete stranger. He never played football at USC. He never coached football at USC. He never ...",0.1750996638415601,0.2415804582906086,0.20834006106608433,0.2194201934742591
N12709,lifestyle,lifestylebuzz,"Twitter Had Feelings About Mark Zuckerberg's Micro-Bangs Facebook founder Mark Zuckerberg debuted a new haircut on the House floor on Wednesday, and Twitter quickly took note with an avalanche of memes and quips.",0.1750996638415601,0.2583624345426263,0.21673104919209318,0.2306081776422709
N2183,tv,humor,"The top female comedians working in film and television today Film and television, specifically in the comedic vein, is currently blessed with a bevy of talented women. The transition from writing standup material to award-winning, mainstream masterpieces has never been so visible, and the impressive canon of female voices peppering the entertainment world is staggering.",0.1750996638415601,0.2756839877504663,0.2253918257960132,0.24215587978083092
N45794,news,newscrime,"Four flight attendants were arrested in Miami's airport after bringing in thousands in cash, police say Four American Airlines flight attendants were arrested at the Miami International Airport and charged with money laundering after bringing large amounts of cash into the country, police said.",0.1752592329384115,0.2832034367784362,0.22923133485842384,0.24722203549842794
N37509,news,newsus,"A man dies in Hawaii after falling into a lava tube in his yard An elderly man died after falling into a lava tube on his property in Hilo, Hawaii, police announced on Wednesday.",0.1756029754073406,0.2363543753812613,0.20597867539430095,0.21610390872328772
N42137,entertainment,celebrity,Celeb couples with big age gaps Age is just a number for some stars!,0.1756839592891613,0.2625045953301764,0.21909427730966885,0.2335643833165047
N27644,lifestyle,lifestylebuzz,"Dog 'Randomly' Drops By Family Reunion   Then People Check His Collar The other day, Leslie Kowash was at a family reunion in Georgia when a friendly local decided to drop in on the party, seemingly out of nowhere. It was a sweet brown pup   and a rather plump one, at that.",0.1760116634325897,0.2359891112111163,0.206000387321853,0.2159966286182741
N11855,news,newsus,"New Jersey woman sues waiter for spilling wine on her Hermès handbag The woman is seeking $30,000 for the light-pink luxury handbag, which has been discontinued.",0.176197672030032,0.2412524186041766,0.20872504531710429,0.21956750307946174
N53017,lifestyle,lifestylebuzz,Kendall Jenner Wore the Tiniest Dress to Go Jewelry Shopping No fall layers to see here.,0.1763249022055058,0.2932730168568211,0.23479895953116348,0.25429031197304935
N45535,news,newsus,DOJ sues Walmart for allegedly discriminating against a Navy reserve officer The Department of Justice says that Walmart did not hire a naval reserve officer due to her mandatory two-week training in the summer of 2016.,0.1763409303889442,0.2843275510094892,0.2303342406992167,0.24833201080264086
N4607,autos,autosnews,Cause determined in Jessi Combs' fatal speed record crash Occurred at speeds near 550 mph,0.1766282318937823,0.2337125094475651,0.2051703706706737,0.2146844169296375
N30867,news,causes-environment,"The size of a bus, rare and endangered whale shark spotted off Florida coast Bigger than Jaws, but not nearly as dangerous, the largest fish in the sea, a whale shark, was spotted off the Florida coast.",0.1768536847964932,0.2815075845674093,0.22918063468195127,0.24662295131043727
N28088,movies,movies-celebrity,Bruce Willis brought Demi Moore to tears after reading her book Demi wasn't sure how her ex would feel about her book until he called her.,0.1769612852079323,0.2480465418447885,0.2125039135263604,0.22435145629916978
N30160,foodanddrink,tipsandtricks,How To Open a Can Without a Can Opener All it takes is a metal spoon and some elbow grease.,0.1773208464684508,0.3025182258954042,0.23991953618192752,0.26078576608641973
N13137,video,popculture,"Singer stands up to heckler who told her to take shirt off After being heckled on stage and told to ""free the nips"" at a concert in Texas, singer Maggie Rogers voiced her anger about the harassment.",0.1776929859876129,0.2543574627739825,0.21602522438079771,0.228802637178526
N56514,travel,travelnews,"Road built by biblical villain uncovered in Jerusalem A long-buried street that led pilgrims to the Jewish Temple 2,000 years ago was commissioned by Roman governor Pontius Pilate.",0.1779224038167274,0.2762509609866407,0.22708668240168406,0.24347477526333625
N21317,sports,football_ncaa,New Mexico DE Nahje Flowers dies at 21 ,0.1780220173263305,0.2323020429727887,0.20516203014955958,0.21420870109063597
N22570,foodanddrink,foodnews,'Ghost kitchens' are taking over fast-food chains from Chick-fil-A to Wendy's Wendy's became the latest fast-food chain to name-check ghost kitchens on Friday at the company's investor day.,0.178063197127491,0.2598475568257797,0.21895537697663536,0.23258610359301682
N2203,sports,baseball_mlb,"Off to the World Series, these Nationals have proved everyone wrong This unexpected joyride of a season could hold more promise yet.",0.1785710512843041,0.2788724667941917,0.2287217590392479,0.24543866162422914
N61070,news,newscrime,Man arrested in 1993 cold case rape after he's identified by DNA: Police The suspect was 28 at the time and not known to the victim.,0.1786657317537492,0.2236324372173013,0.20114908448552526,0.20864353539611727
N30531,tv,tv-gallery,"16 transgender celebrities who are changing television Shows like ""Euphoria,"" ""Pose,"" ""The Fosters,"" and ""Shameless"" have all introduced trans actors and characters in recent years.",0.1786735140728783,0.2734414871310774,0.22605750060197785,0.24185216277834437
N56541,sports,baseball_mlb,"Soto, Nationals edge Astros in World Series opener Juan Soto homered onto the train tracks high above the left field wall and hit a two-run double as the Nationals tagged Gerrit Cole and the Houston Astros 5-4 Tuesday night in the World Series opener.",0.1789207016818684,0.2682006162047056,0.223560658943287,0.2384406446970932
N59704,news,newscrime,"California sheriff's deputy shot dead, ride-along injured in 'active shooter incident,' officials say A police officer in Northern California was killed and another deputy was injured after an ""active shooter"" incident early Wednesday, according to officials.",0.1794564418062972,0.2391106971474031,0.20928356947685015,0.21922594536703446
N56175,foodanddrink,restaurantsandnews,Pizza Hut is testing a new round pizza box that looks like a spaceship and is meant to keep pizza fresher Pizza Hut has partnered with Zume to test a new round pizza box that is supposed to keep pizza fresher and crispier. It's also compostable.,0.1796489108597291,0.2871721424979806,0.23341052667885487,0.25133106528523014
N35259,finance,finance-retirement,"'I'm 73 and fed up with California and want a gun-friendly, affordable city with good weather   so where should I retire?' Some hidden gems to consider in Georgia, New Mexico and Arkansas.",0.1797194273990531,0.2762269412263438,0.22797318431269845,0.2440577699505802
N20091,weather,weathertopstories,"Firefighting Plane Battles Maria Fire Near Santa Paula A tanker dropped fire retardant to combat the Maria Fire near Santa Paula in Ventura County, California on Friday, November 1. By Friday, the fire had reached more than 9,000 acres and was at zero percent containment, according to CAL FIRE. The Maria Fire broke out at around 9 pm on Thursday, and ""exploded"" overnight, prompting mandatory evacuations affecting more than 10,000 residents between Santa Paula and Somis, according to reports. Firefighters are battling several blazes across the state, including the 77,000 acre Kincade Fire in Sonoma County and the 1,800 Easy Fire in Ventura County. Incident reports for the California wildfires can be found here. Credit: @shant_nazaryan via Storyful",0.1797194273990531,0.2629596121078276,0.22133951975344035,0.2352128838715694
N37720,health,nutrition,"23 Foods That Help Lower High Blood Pressure Consuming less sodium may be important to help slash blood pressure levels, but eating more of these foods is good for your heart and arteries too. The post 23 Foods That Help Lower High Blood Pressure appeared first on The Healthy.",0.1797194273990531,0.3210549181953672,0.2503871727972101,0.27394308792992916
N49179,movies,movienews,Joe Alwyn on Buzz Around Taylor Swift Romance: 'I'll Just Turn it Off' Joe Alwyn on Buzz Around Taylor Swift Romance: 'I'll Just Turn it Off',0.1797194273990531,0.2842769586895191,0.2319981930442861,0.24942444825936375
N29924,autos,autosenthusiasts,"25 Cars No One Wanted to Buy Along with cars so bad they become icons and the models that should have worked but never caught on come a slew of vehicles that'll have you scratching your head. Remind yourself of the disasters that were the Cadillac Catera, Buick Reatta, Volkswagen Phaeton, Lincoln Blackwood, Chrysler Executive Limousine, and more.",0.1797194273990531,0.2811079923784877,0.2304137098887704,0.2473118040520095
N26122,weather,weatherfullscreenmaps,"Explosive new wildfire drives thousands from homes near Los Angeles The Maria fire ignited in Ventura County early Thursday night and raced westward, consuming 4,000 acres in just three hours.",0.1797194273990531,0.2822916945981046,0.23100556099857886,0.24810093886508744
N53436,finance,finance-real-estate,"Inside the Sheikh of Dubai's 800-acre Kentucky horse farm I got a tour of Sheikh Mohammed of Dubai's 800-acre horse farm in Kentucky, where horses live in immaculate barns with skylights and personal fans.",0.1797194273990531,0.2731549683631168,0.22643719788108496,0.24200978804176224
N55312,travel,travelnews,"Why are most aircraft painted predominantly white? Aircraft liveries, or the designs painted on the exterior of aircraft from the nose to the tail, are a way to identify to which airline the plane belongs.",0.1797194273990531,0.3540645815490373,0.2668920044740452,0.29594953016570924
N15919,news,newsus,"Saddleridge fire calms down, heavy rains on East Coast A new storm system is developing in the southern Plains and will move east over the next few days bringing a threat of flooding to the South with rain and gusty winds.",0.1797194273990531,0.2589801197459062,0.21934977357247964,0.2325598889636218
