ID,category,sub_category,content,collaborative_rec,content_rec,mean,two_one
N11817,travel,traveltripideas,"Here's the Best Small Town in Every State From Los Alamos, California, to Shelter Island, New York, these are the best small towns INSIDER found in every state.",1.0,0.2766601773462378,0.6383300886731189,0.5177734515641585
N41172,entertainment,celebrity,Welcome to the World! All of the Celebrity Babies Who've Made Their Debuts in 2019 See who's made their debut so far this year,1.0,0.2660272773378458,0.6330136386689229,0.5106848515585638
N14531,news,newsworld,Turkey starts repatriation of captured Islamic State militants: media Turkey starts repatriation of captured Islamic State militants: media,1.0,0.2739819365305295,0.6369909682652648,0.5159879576870197
N40530,news,newspolitics,"What's coming in impeachment: The inquiry goes public For only the fourth time in U.S. history, the House of Representatives has started a presidential impeachment inquiry.",1.0,0.2745495241168221,0.637274762058411,0.5163663494112147
N64606,entertainment,celebrity,"Best celebrity hair moments of 2019 (so far) New year, new 'do! Nothing has the power to transform a look quite like a new hairstyle, which might explain why celebrities are constantly switching things up with fresh cuts, colors and lengths. In 2019, we've already seen stars like Rowan Blanchard and John Travolta go shorter (or, in the Saturday Night Fever star's case, bald!), Lady Gaga and Chris Messina walk the red carpet with striking new shades and Hilary Duff and Sarah Hyland show how subtle color shifts can make a big impact. And, if 2018's tress transformations were any indication, there is going to be so much more where that came from. Keep scrolling to see the best celebrity haircuts, color, extensions and more of 2019 so far!",1.0,0.2437548960456212,0.6218774480228106,0.4958365973637474
N25414,finance,finance-companies,"Alibaba breaks Singles Day record of more than $30 billion in sales and climbing Chinese e-commerce giant Alibaba set a new sales record on Singles Day, the world's largest 24-hour shopping event.",1.0,0.2878781004895668,0.6439390502447834,0.5252520669930445
N59385,entertainment,celebrity,"Celebrity Engagements of 2019 Love is abloom in 2019! Stars such as Tim Tebow, who is set to wed former Miss Universe Demi-Leigh Nel-Peters, and Hamilton's Anthony Ramos will soon be walking down the aisle after popping the question to their respective loved ones. Scroll through to see who else is put a ring on it this year and get the story behind their sweet proposals.",1.0,0.2706561766730734,0.6353280883365366,0.5137707844487156
N33120,entertainment,celebrity,Stars who welcomed babies in 2019 See which celebrities expanded their families this year!,1.0,0.2759926121094199,0.6379963060547099,0.5173284080729466
N10960,foodanddrink,recipes,65 Best Fall Soups That Will Warm You and Your Family Up All Season Long These hearty bowls are the perfect companion for a rainy fall night.,1.0,0.294266023121741,0.6471330115608704,0.5295106820811606
N50023,health,nutrition,"The #1 Worst Menu Option at 76 Popular Restaurants The rule ""everything in moderation"" simply isn't an excuse for these excessive menu choices that will set you back for days.",1.0,0.2782050238628021,0.6391025119314011,0.518803349241868
N43432,news,newsus,"US Forest Service shuts down vandalized Georgia park feature GAINESVILLE, Ga. (AP)   The U.S. Forest Service says vandalism is forcing it to shut down a popular fall leaf viewing destination in Georgia. The agency posted photos to Facebook on Friday showing a wooden platform covered in white spray paint overlooking the mountainous north Georgia landscape at Chattahoochee-Oconee National Forests.",1.0,0.2663814036663194,0.6331907018331597,0.5109209357775463
N32010,finance,personalfinance,The biggest wastes of money in 2019 Relive 2019 with this look at some of the biggest wastes of money of the year.,1.0,0.2547715951488247,0.6273857975744124,0.5031810634325498
N61822,lifestyle,lifestylehomeandgarden,"200 Shocking Home Photos You Have to See We know a good DIY project when we see it, but these aren't them. Some of these are goofy, some are head scratchers and some are downright dangerous. Check these photos out, you'll definitely learn a thing or two!",1.0,0.2520848618436531,0.6260424309218265,0.5013899078957686
N23254,movies,movies-celebrity,Best nostalgic pics of Leonardo DiCaprio Celebrate Leo's birthday with these throwback photos.,1.0,0.3018805182751561,0.650940259137578,0.5345870121834374
N5791,lifestyle,lifestylehomeandgarden,"12 Fall Landscaping Mistakes to Know and Avoid Whether you have a green thumb when it comes to your home garden, or you can hardly tell the difference between a rose and a weed, you should know that there are certain landscaping tasks that need to be done right to keep your home exterior looking its best. But to do that, you must avoid the most common fall landscaping blunders.",1.0,0.2658057570158824,0.6329028785079411,0.5105371713439215
N30188,lifestyle,lifestylebuzz,Look of the day: Ashley Graham's latest sizzling maternity look & more celeb style Bella Hadid attended the CFDA/Vogue Fashion Fund Awards in an Alexander Wang jumpsuit embellished with nipple and belly-button jewels.,1.0,0.2538151640992342,0.626907582049617,0.5025434427328228
N4912,movies,movies-gallery,"New Movies and TV Shows You'll Be Able to Cozy Up With on Netflix in November Movie watchers divide themselves into two camps when November rolls around: those who aren't ready to stop watching all the horror flicks that creeped them out around Halloween, and those who can't wait to dive into cheesy holiday movie season.",1.0,0.2767293335212406,0.6383646667606203,0.517819555680827
N17104,news,newscrime,"Veterans suffered, investors lost millions in nationwide schemes People lost hundreds of millions of dollars. But something is happening that might finally stop it.",1.0,0.2505980447941456,0.6252990223970728,0.5003986965294304
N54988,finance,personalfinance,28 Dumb Ways You Could Lose It All by Trying To Get Rich Don't gamble your money away in foolish ways.,1.0,0.2662212375236176,0.6331106187618087,0.5108141583490784
N22549,entertainment,awards,2019 People's Choice Awards nominees' best recent style moments We're checking out the E! People's Choice Awards nominees' stellar recent style moments.,1.0,0.2751117457281534,0.6375558728640767,0.5167411638187689
N54300,entertainment,celebrity,"Week in celebrity photos for Nov. 4-8, 2019 Week in celebrity photos for Nov. 4-8, 2019",1.0,0.2796114336486817,0.6398057168243408,0.5197409557657877
N21840,travel,traveltips,"10 Things You Should Never Do in an Airplane Bathroom Germs are potentially harmful in a normal bathroom. But put that bathroom in the sky, shrink it, and pump pressurized air into it and you've got the perfect environment for germs to thrive. The post 10 Things You Should Never Do in an Airplane Bathroom appeared first on Reader's Digest.",1.0,0.2425434255413793,0.6212717127706897,0.49502895036091954
N31978,music,music-awards,"Country music's biggest scandals From Wynonna Judd's husband's arrest to the Dixie Chicks' vent about George W. Bush, relive country's biggest scandals.",1.0,0.2603836013140732,0.6301918006570366,0.5069224008760488
N51241,lifestyle,lifestylefamilyandrelationships,"I Was Adopted Here's What Everyone Gets Wrong About Adoption While adoption is wonderful in many ways, it comes with its own set of unique challenges. Sometimes, those challenges come from other people making incorrect assumptions. The post I Was Adopted Here's What Everyone Gets Wrong About Adoption appeared first on Reader's Digest.",1.0,0.2770780960307198,0.6385390480153599,0.5180520640204799
N22880,lifestyle,voices,"I ordered clothes from those cheap online stores, and I'm not sold As an avid brick-and-mortar shopper, my eyes were opened when I tried an $8 formal dress, a $4 blouse, and other clothes for less than $10.",1.0,0.2871230228934469,0.6435615114467235,0.5247486819289646
N27143,foodanddrink,beverages,Best Dive Bar in Every State The real challenge in compiling a list of America's best dive bars comes in defining just what a dive bar is and isn't.,1.0,0.2690251986914188,0.6345125993457094,0.5126834657942791
N61623,entertainment,entertainment-celebrity,"Big celebrity money moments of the last decade From bankruptcy filings and huge paydays to reaching billionaire status, read up on the most fascinating money news involving the stars from 2010 to 2019.",1.0,0.2539782150280829,0.6269891075140415,0.5026521433520552
N24686,entertainment,entertainment-celebrity,Stars who've had more than one wedding with the same spouse See which celebs exchanged vows with their significant others more than once.,1.0,0.2702909591223349,0.6351454795611675,0.5135273060815566
N55204,entertainment,entertainment-celebrity,"Stars Who Served in the Military Adam Driver, Jeff Bridges, Ice-T and more stars who served in the military.",1.0,0.2709989826470643,0.6354994913235321,0.5139993217647095
N62386,news,newspolitics,America's Most and Least Popular Senators Senators represent the interests of the residents of their home state on Capitol Hill by crafting and voting on new laws and by approving or rejecting cabinet and judicial nominations made by the president.,1.0,0.2971352056920131,0.6485676028460066,0.5314234704613421
N40356,movies,movies-gallery,"All 112 of Netflix's notable original movies, ranked from worst to best To find out which Netflix original films are worth watching, we turned to Rotten Tomatoes to rank everything from ""Roma"" to ""Bright.""",1.0,0.3022920721735592,0.6511460360867796,0.5348613814490395
N55353,weather,weathertopstories,Distressing photos show glaciers that are disappearing or on the brink of collapse around the world The future of glaciers around the world is shaky. Here are photos showing some of the glaciers that might not be around for much longer.,1.0,0.2528063041206997,0.6264031520603499,0.5018708694137998
N50575,autos,autossuvs,Should You Get the 2020 Ford Explorer? Pros and Cons on This Family SUV Ford completely reimagined Explorer is a 2020 SUV of the Year contender,1.0,0.29002762751202,0.64501381375601,0.5266850850080134
N26376,finance,markets,"Stocks close higher on optimism over China trade deal Stocks ended at record highs Thursday after the world's two largest economies reportedly agreed to remove existing trade tariffs, sparking a huge rotation into equities and out of bonds.",1.0,0.2799963439803348,0.6399981719901674,0.5199975626535565
N37870,news,newsworld,Today in History: November 11 ,1.0,0.2595091091774096,0.6297545545887048,0.5063394061182731
N3344,music,cma-awards,"Top 100 country songs of all time Stacker counts down the top 100 country songs of all time. From old-school honky-tonk to modern country pop, this list covers the biggest hits in Billboard history.",1.0,0.2973902338688631,0.6486951169344315,0.5315934892459087
N26262,entertainment,entertainment-celebrity,"Celebrity plastic surgery transformations See how stars like Sharon Osbourne, Cardi B, Pauly D, Kim Zolciak-Biermann, Gisele Bundchen, Kanye West and others have altered their looks.",1.0,0.2435741047992179,0.621787052399609,0.49571606986614525
N38311,entertainment,celebrity,Celebrity PDA of 2019 See the stars kissing and hugging on the red carpet and out and about!,1.0,0.2713918356273351,0.6356959178136675,0.5142612237515567
N27476,sports,basketball_nba,"Harden scores 47 points, Rockets beat Clippers 102-93 HOUSTON (AP)   James Harden scored 47 points and the Houston Rockets outlasted the Clippers 102-93 in a wild game that saw Los Angeles coach Doc Rivers ejected in the fourth quarter Wednesday night. Houston was up by two with about two minutes left when former Rocket Patrick Beverley fouled out. Harden made both free throws before grabbing a rebound on the other end and hitting a 3 to make it 95-88. Beverley was given a technical foul during a...",1.0,0.2694875662782516,0.6347437831391258,0.5129917108521678
N57853,news,newscrime,Triple Shooting In Dallas Leaves 2 Dead & Police Investigating Two people are dead after a triple shooting in Dallas late Sunday night.,1.0,0.2902606308576603,0.6451303154288301,0.5268404205717735
N50005,news,newsgoodnews,"A teenager thought his leukemia was a death sentence. A college football player saved his life. William & Mary offensive lineman Mark Williamson on Friday finally met Rusty Plemons, whose life he helped save three years ago.",1.0,0.2586665620579121,0.629333281028956,0.5057777080386081
N10840,finance,markets,Trade War's Forgotten Farmers Get Crushed in U.S. Cotton Country American cotton farmers are having such a difficult year that even a potential trade deal between the U.S. and China is likely to offer them little comfort.,1.0,0.2760422435240123,0.6380211217620062,0.5173614956826749
N54283,lifestyle,lifestyleroyals,"Prince Harry just hinted that he and Meghan Markle may want another baby Reports also suggest that Meghan Markle may want to have their next child in Los Angeles, where she was born.",1.0,0.2718954990826708,0.6359477495413354,0.5145969993884472
N33261,video,lifestyle,The Queen Had This Hilarious Reaction to (Unnecessary) Mouth-to-Mouth Resuscitation The Queen had a hilarious reaction when someone tried to save her life. Buzz60's Keri Lumm reports.,1.0,0.2394605730710653,0.6197302865355326,0.4929737153807102
N26084,foodanddrink,recipes,These Christmas Dinner Menus Will Create an Unforgettable Meal We've got you covered for any type of crowd.,1.0,0.2959439543458457,0.6479719771729229,0.5306293028972304
N999,news,newsscienceandtechnology,"Motorola's Razr flip phone is back as a folding-screen smartphone, for $1,500 The good news: A phone can fit in your pocket again. The bad news: It's twice the price of an iPhone.",1.0,0.2692870899243667,0.6346435449621833,0.5128580599495778
N18698,entertainment,awards,Khloe Kardashian Apologizes to Fans After Not Realizing She'd Won an Award at the People's Choice Awards Her family also won for Best Reality Show.,1.0,0.2674707927669549,0.6337353963834774,0.51164719517797
N287,news,newscrime,Three school workers charged in death of special needs student The student was reportedly restrained face-down for nearly an hour before becoming unresponsive,1.0,0.2690473304843672,0.6345236652421836,0.5126982203229115
N39461,foodanddrink,foodnews,"We Tried 5 Brands of Toaster Pastries So You Don't Have To We tasted organic, generic, gourmet, and nostagic options. Here's what we thought.",1.0,0.2701691880823846,0.6350845940411923,0.5134461253882564
N59673,music,music-celebrity,Selena Gomez and Julia Michaels Share a Kiss Before Getting Matching Arrow Tattoos Selena Gomez and Julia Michaels Get Matching Arrow Tattoos,1.0,0.2756221847563743,0.6378110923781871,0.5170814565042495
N26331,news,newsus,"Wild turkeys are terrorizing a town; MLB player calls on the New Jersey governor for help Todd Frazier, MLB all-star, joined town residents sounding off about wild turkey terror. Now, they're asking New Jersey Gov. Phil Murphy for help.",1.0,0.2439436422173906,0.6219718211086953,0.4959624281449271
N64691,news,newsworld,"U.K. Politicians Fight First December Election in Almost a Century Across the length of the U.K., politicians are donning hiking boots and fluorescent jackets and arming themselves with torches as they campaign in the cold and darkness ahead of the country's first December election in almost a century.",1.0,0.2644871657771587,0.6322435828885793,0.5096581105181057
N23805,lifestyle,awardstyle,Carrie Underwood rocks CMAs and several gorgeous outfits as host All of her looks were just stunning.,1.0,0.2809756799678983,0.6404878399839491,0.5206504533119322
N12124,news,newsworld,"US to keep around 600 troops in Syria: Pentagon chief The United States will maintain around 600 troops in Syria, Pentagon chief Mark Esper said Wednesday, despite Donald Trump's desire to end US involvement in what the president calls ""endless wars"". ""We're going to have about 500 to 600-ish troops there, at the end of the day,"" he said.",1.0,0.2727907931409906,0.6363953965704953,0.5151938620939938
N8555,lifestyle,lifestyleroyals,"Meghan Markle is being criticized for doing the same things that Kate Middleton is praised for, and a royal expert says it wouldn't be happening if she were white Markle received backlash when her bodyguard told fans not to take photos. However, Middleton was recently called ""down to earth"" for the same thing.",1.0,0.2511384503566836,0.6255692251783418,0.5007589669044556
N6477,finance,finance-companies,"Walmart releases Black Friday ad with $129 Apple Watch, TV deals, electronics doorbusters Walmart's Black Friday 2019 ad includes a 40-inch TV for $98, Apple iPad for $249, Xbox One, Playstation 4, deals on toys, Instant Pot and more.",1.0,0.3022837216277835,0.6511418608138917,0.5348558144185223
N61787,sports,basketball_nba,Russell Westbrook takes shot at Patrick Beverley Wednesday night's Houston Rockets-LA Clippers game was entertaining on many levels. Russell Westbrook's comments about Patrick Beverly's reputation stood out the most.,1.0,0.2610449507304038,0.6305224753652019,0.5073633004869358
N49879,news,newsgoodnews,"Man runs race in full SWAT gear, saves a life, then proposes -- all in a matter of moments The finish line of the Allstate Hot Chocolate 15K Run changed life-as-they-know it for Chicago Police Sgt. Mike Nowacki, his girlfriend, and a complete stranger with ""serendipitous"" timing.",1.0,0.2397281183724016,0.6198640591862008,0.4931520789149344
N63958,foodanddrink,recipes,Copycat Cracker Barrel Chicken and Dumplings Recipe Craving some comfort food from Cracker Barrel? Skip the restaurant and make this copycat chicken and dumplings recipe instead!,1.0,0.3022092839490639,0.6511046419745319,0.5348061892993758
N4936,autos,autosenthusiasts,Lance Altimeter Is A Delicious Drop-In Truck Camper Debuting At SEMA The all-in-one Overlanding package sleeps four and is fully equipped for an off-grid weekend.,1.0,0.2653380328038098,0.6326690164019049,0.5102253552025399
N58410,tv,tv-celebrity,Tristan Thompson Gushes Over Ex Khloe Kardashian After Her People's Choice Win Khloe's ex and the father of her child raved about her in an Instagram post.,1.0,0.2895520395423242,0.6447760197711621,0.5263680263615494
N58885,health,fitness,3 Months of Full Body Workouts Helped This Guy Get Shredded at 40 Mat Smith ramped up his workouts and found an online support group to share fitness goals.,1.0,0.2876146750276086,0.6438073375138043,0.5250764500184057
N47624,news,newsworld,"US, South Korea could scale back joint drills: Esper US military exercises with South Korea could be scaled back to aid diplomacy with the nuclear-armed North, Defense Secretary Mark Esper said on his way to Seoul, as Pyongyang said it was running out of patience. Seoul and Tokyo are both major US allies, democracies and market economies faced with an overbearing China and nuclear-armed North Korea.",1.0,0.2511750450081372,0.6255875225040686,0.5007833633387582
N40559,news,newsworld,"2 dead, 3 injured in a school shooting in Russia Russian police say a student has killed a fellow student and wounded three more in a shooting at a college before taking his own life. Russia's state Investigative Committee says the 19-year-old student in Blagoveshchensk near the border with China brought a hunting rifle to class Thursday and opened fire on students, shooting one dead and severely injuring three more.",1.0,0.2665970271374756,0.6332985135687378,0.511064684758317
N45561,news,newsphotos,"Inside the world's largest plane, which has a wingspan longer than a football field and a mysterious new owner The Stratolaunch is 238 feet long, 50 feet tall, and has a 385-foot wingspan. It made its first flight in April.",1.0,0.20774533064026,0.60387266532013,0.47183022042684
N8957,music,cma-awards,Best country music albums of all time Stacker has compiled a list of the best country albums of all time as per Billboard's Greatest of All Time Country Albums list. These ratings are based on albums' weekly performance on the Top Country Albums chart from January 1996 to June 2016.,1.0,0.3189442773662937,0.6594721386831468,0.5459628515775291
N49252,entertainment,entertainment-books,"100 Books Everyone Should Read Before They Die If you want to fill your shelves with classic titles and tomes that will open your mind to many worlds of fancy, facts, and fiction, these 100 books are the place to start.",1.0,0.305236137117994,0.6526180685589971,0.5368240914119959
N30253,health,nutrition,"29 Foods Diabetics Should Avoid While some foods may seem healthy, they can be low-nutrition sources of hidden sugars. Here are foods to avoid.",1.0,0.2994292330037879,0.6497146165018939,0.5329528220025253
N42266,lifestyle,lifestylehomeandgarden,"Stylish Living Room Ideas, From Floral to Family-Friendly Bookmark this for the next time you need a refresh.",1.0,0.2976293316119548,0.6488146658059775,0.5317528877413031
N53696,news,newsworld,"Ugly From the Outset: Hong Kong's Day of Widespread Violence HONG KONG   Hong Kong was a city on edge on Monday following escalating violence, in which one demonstrator was shot point blank by a police officer and one man was doused with a flammable liquid and set on fire after he scolded protesters. At nightfall, both men were fighting for their lives in a city seething with resentments. Protesters have voiced outrage at police officers they see as increasingly resorting to force, and at a government...",1.0,0.2509300281569924,0.6254650140784962,0.5006200187713282
N46029,news,newsworld,"How Russia Meddles Abroad for Profit: Cash, Trolls and a Cult Leader The Russians were hard to miss. They appeared suddenly last year in Madagascar's traffic-snarled capital, carrying backpacks stuffed with cash and campaign swag decorated with the name of Madagascar's president.",1.0,0.2511356809143518,0.6255678404571758,0.5007571206095678
N28204,finance,markets,"A $100 Billion Fund Manager Is Debunking Stock-Bubble Theories Negative interest rates are unnaturally propping up the stock market and at some point the whole edifice will collapse. It's an oft-repeated theory, but history suggests it might be wrong.",1.0,0.2565868269375667,0.6282934134687833,0.5043912179583778
N38483,entertainment,celebrity,"Celebs Who Look Even Better With Gray Hair, From Anderson Cooper to Steve Carell Steve Carell, we salute you.",1.0,0.2847000648313432,0.6423500324156716,0.5231333765542288
N61214,news,newsscienceandtechnology,SpaceX set to launch another 60 Starlink internet satellites Initial service is expected to begin next year with global connectivity expected in 2021,1.0,0.289719520210011,0.6448597601050055,0.5264796801400073
N7419,lifestyle,lifestylevideo,"Why This Couple Is Getting a 'Sleep Divorce' A New Jersey couple is getting an unusual ""divorce."" Liz and Rich Alterman have been happily married for almost 20 years. They have three children and are now on the brink of getting ""sleep divorced.""",1.0,0.2564539881546656,0.6282269940773328,0.504302658769777
N3992,news,newsworld,"Dozens detained in India over holy site social media comments Indian police have arrested dozens of people for social media comments that allegedly threatened ""communal harmony"" after the Supreme Court awarded a holy site once used for a mosque to Hindus, officials said Monday. The site in the northern city of Ayodhya has in the past caused communal riots that have left thousands dead, and security forces have been on alert since the verdict was announced on Saturday.",1.0,0.2783494532357815,0.6391747266178908,0.518899635490521
N46972,news,newsworld,U.S. calls on Iraq to hold early elections U.S. calls on Iraq to hold early elections,1.0,0.293503822198878,0.646751911099439,0.5290025481325853
N20824,finance,markets,"The economic picture is darkening in states critical to Trump's reelection bid A closer look at key battleground states could spell trouble for the candidate, whose populist economic proposals have been central to his campaign.",1.0,0.2725622675180196,0.6362811337590097,0.5150415116786797
N36273,sports,football_nfl,"Best, worst QB performances from NFL Week 10 Lamar Jackson continues to excel. Philip Rivers Continues to... not excel.",1.0,0.2841490866849079,0.642074543342454,0.5227660577899386
N51853,finance,markets,"The problem with diamonds is they keep getting cheaper Americans are buying more diamond jewelry than ever before, but prices for most polished gems are falling.",1.0,0.2895842493754162,0.6447921246877081,0.5263894995836108
N64174,news,newscrime,Georgia executes man convicted of killing convenience store clerk Georgia executes man convicted of killing convenience store clerk,1.0,0.2908831172330964,0.6454415586165482,0.5272554114887309
N17059,finance,finance-companies,"No. 1 milk company declares bankruptcy amid drop in demand Dean Foods blamed a decadeslong drop in milk consumption that has seen people turn to alternatives like soda, juice and almond milk.",1.0,0.2507384526104373,0.6253692263052186,0.5004923017402916
N36624,finance,markets,"Red and Blue Economies Are Heading in Sharply Different Directions At a quick glance, red and blue metropolitan areas are performing equally well on average in the most watched indicators of labor market health. Employment growth in the year ending in the first quarter of 2019 was 1.4 percent in both Democratic-leaning and Republican-leaning metro areas, and the unemployment rate in both types of places is roughly equivalent. Silicon Valley (blue) is booming. So is Provo, Utah (red). But below the surface, red...",1.0,0.2748207369587899,0.6374103684793949,0.5165471579725266
