ID,category,sub_category,content,collaborative_rec,content_rec,mean,two_one
N32109,travel,travelnews,"Cell Phone Forces Flight Diversion to Ireland When no one could identify the owner of the phone, the captain diverted the flight.",0.1772709860065038,0.2155586673430561,0.19641482667477994,0.20279610689753866
N37123,lifestyle,lifestylesmartliving,"17 Things You Should Never Do During a Conversation Want to make sure every conversation you have goes well? Begin with avoiding these 17 things you should never do, according to etiquette experts.",0.1772709860065038,0.2965919632621991,0.23693147463435144,0.2568183041769673
N12349,lifestyle,lifestylebuzz,"Divers Find Giant Mysterious 'Egg' Floating In Ocean A team of divers set off to explore a sunken World War II ship off the Norwegian coast, but what they found was something far more mysterious. While making their way back to shore, Ronald Raasch, Nils Baadness and Brynjar Aarnseth came face-to-face with a giant floating orb. The bubble hovered 17 meters (56 feet) below the surface and appeared to be see-through. The divers turned their flashlights on it and realized that the sphere was filled...",0.1773083032230992,0.1977559643819051,0.18753213380250217,0.1909400773289698
N58226,sports,racing,NASCAR driver's car got flipped over and then stuck the landing in wild wreck at Talladega Brendan Gaughan had the best reaction to getting flipped.,0.1777778475419739,0.231971004958004,0.20487442624998894,0.21390661915266063
N41218,news,newspolitics,"Election Day 2019: Most Important Races and What to Watch For In elections that will determine policy, the political makeup of state legislatures and who lives in governors' mansions, voters will head to the polls Tuesday in states across the country.",0.177902497968187,0.2872864334332671,0.23259446570072706,0.2508251216115737
N48076,tv,tvnews,"Whoopi Goldberg Asks Meghan McCain to 'Respect' Her 'View' Co-Hosts During Heated Discussion 'I'm not trying to cut you off, I'm trying to get you heard.'",0.1779348136010854,0.2659896439805164,0.2219622287908009,0.2366380338540394
N38939,music,musicnews,"This Guns N' Roses Video Just Became the First From the '80s to Reach 1 Billion YouTube Views Guns 'N Roses' rockin' black-and-white video for ""Sweet Child O' Mine"" has become the first video from the 1980s to hit one billion YouTube views.",0.1779348136010854,0.2876118702849924,0.2327733419430389,0.2510528513903567
N16292,foodanddrink,foodnews,"What it's like to cook for Kate Middleton and Prince William, according to Giada De Laurentiis One of the professional chef's favorite career moments was the day she cooked for the Duke and Duchess of Cambridge at a polo charity event.",0.1779348136010854,0.266164465988091,0.2220496397945882,0.23675458185908915
N59359,news,newscrime,Police Arrest Motorcyclist Who Led High-Speed Chase And Went Home Thinking He Escaped A motorcyclist was arrested after leading California Highway Patrol units on a high-speed chase in Placerville on Saturday.,0.1783985492112084,0.2720572235553707,0.22522788638328956,0.24083766544064994
N42470,finance,finance-companies,G.M. Workers Approve Contract and End U.A.W. Strike The longest nationwide strike against General Motors in half a century ended on Friday after a solid majority of the company's union members delivered their support for the four-year contract hammered out by their leaders. The United Auto Workers union emerged with substantial wage increases and succeeded in ending a two-tier wage structure that had been a particular irritant in its ranks. It also won commitments to new G.M. investments in...,0.1786154363703801,0.2805095975754959,0.229562516972938,0.24654487717379062
N30867,news,causes-environment,"The size of a bus, rare and endangered whale shark spotted off Florida coast Bigger than Jaws, but not nearly as dangerous, the largest fish in the sea, a whale shark, was spotted off the Florida coast.",0.178688884403962,0.2220499817727222,0.2003694330883421,0.20759628264980215
N54305,sports,football_nfl,Urban legend? How the Cowboys' rout of the Eagles helped take Coach Meyer out of the conversation Did the Cowboy's victory Sunday night take care of the Urban Meyer rumors?,0.1788418828341347,0.2553800388179604,0.21711096082604756,0.22986732015668518
N55911,lifestyle,lifestylebuzz,Katie Holmes Talks About That Bra and Cardigan Moment Katie Holmes Talks About That Bra and Cardigan Moment,0.1792530691154771,0.2611619267825639,0.2202074979490205,0.2338589742268683
N8448,entertainment,entertainment-celebrity,Celebs celebrate Halloween 2019 Here's how the stars dressed up while celebrating Halloween this year!,0.1799037185777997,0.2552207788615659,0.2175622487196828,0.2301150921003105
N37083,news,newsus,Police warn against THC-laced Halloween candy Police in Pennsylvania are urging parents to be extra cautious with their Halloween candy this year.,0.1799408161144712,0.2740215757977073,0.22698119595608926,0.24266132256996192
N39762,news,newscrime,"Woman stabbed to death by son in Plainville, police say A 21-year-old man is accused of stabbing his mother to death in Plainville. Police were called at 10:14 p.m. Thursday to the home at 37 Landau Road. The victim, 51-year old Carlyn D. Murphy, was found dead with apparent stab wounds. Her son, Sean Murphy, 21, who lived in the home, was taken into custody at Patriots Place in Foxborough. Plainville police said they do not believe that there is any ongoing threat or danger to the public. Sean...",0.1799408161144712,0.2733825143536457,0.22666166523405845,0.2422352816072542
N24492,news,newsus,"Police: Off-Duty Dallas Officer Mistakenly Shoots, Injures Adult Son Thinking He Was An Intruder An off-duty Dallas officer accidentally shot and injured his adult son in DeSoto Saturday evening, police say.",0.1799408161144712,0.2788622492943247,0.22940153270439795,0.2458884382343735
N1258,travel,travelnews,"Tourist in Venice kidnaps local woman in row over exchange rate The 46-year-old Israeli was unhappy about the sum of money he was given, and reacted by locking himself in the currency exhange with the worker",0.1799408161144712,0.2430606194048629,0.21150071775966706,0.22202068497473232
N27235,news,newspolitics,"Hillary Clinton backs out of DC event also set to include Tulsi Gabbard, Kirstjen Nielsen: report Hillary Clinton has backed out of a Friday appearance at an event also scheduled to include Democratic presidential candidate Tulsi Gabbard, among other guests, according to a report.",0.1799408161144712,0.2513755190382198,0.2156581675763455,0.22756395139697028
N58715,news,newsus,Officer placed on leave after threatening teen skaters at gunpoint Witnesses said the confrontation began on Saturday night when the plain-clothes officer approached the teenagers and ordered them stop playing loud music.,0.1801021670765575,0.2683500749490454,0.22422612101280143,0.2389341056582161
N59496,sports,football_nfl,"Week 7 winners, losers: Aaron Rodgers now in MVP race; Mitchell Trubisky looks lost Aaron Rodgers' big game vaults him into the MVP race. Meanwhile in Chicago, it might be time for the Bears to reconsider Mitchell Trubisky's future.",0.1804701674001825,0.2632472599238754,0.22185871366202894,0.2356548957493111
N57737,news,newsus,"Missing Minnesota boy, 6, and his dog, found in cornfield by drone with thermal camera A missing 6-year-old boy from Minnesota and his dog were found Wednesday after hundreds of volunteers   including one who used his own drone with a thermal camera   searched for him for hours.",0.1812362705561815,0.2574423294483914,0.21933930000228646,0.23204030981765478
N61005,sports,football_nfl,Randy Moss takes a perfect dig at Joe Buck's infamous 'disgusting act' call ,0.1819610936396495,0.2491587304266445,0.215559912033147,0.22675951816431283
N32027,sports,football_nfl,Payton declines to name Saints starting QB for Week 8 ,0.1819950934877158,0.2763349226784687,0.22916500808309226,0.24488831294821775
N64456,news,newsus,"LA's Getty fire was sparked by downed power lines, Mayor Garcetti says LOS ANGELES - The Getty fire was sparked by a tree branch that fell on power lines, Los Angeles Mayor Eric Garcetti announced at a news conference Tuesday evening. Video footage shows the branch breaking off a eucalyptus tree and sparking the fire in the 1900 block of North Sepulveda Boulevard, Garcetti said. The power lines being examined are operated by the Los Angeles Department of Water ...",0.1819950934877158,0.2646516751676357,0.22332338432767576,0.2370994812743291
N36068,sports,football_nfl,"AP source: Trent Williams ends holdout, reports to Redskins A person with knowledge of the situation says left tackle Trent Williams has reported to the Washington Redskins, ending his lengthy holdout. The person spoke to The Associated Press on condition of anonymity because the team had not announced Williams' return. He can be kept off the 53-man roster for up to three weeks after reporting. Washington did not deal the 31-year-old before the NFL trade deadline Tuesday, which prompted...",0.1819950934877158,0.2731569517775774,0.2275760226326466,0.24276966568095684
N4745,news,newspolitics,"Testimony: White House lawyer told Vindman not to discuss Ukraine call The senior White House lawyer who placed a record of President Donald Trump's July 25 call with Ukraine's president in a top-secret system also instructed at least one official who heard the call not to tell anyone about it, according to testimony heard by House impeachment investigators this week.",0.1819950934877158,0.280575942500568,0.2312855179941419,0.24771565949628394
N62055,news,newspolitics,"Trump campaign threatens to sue CNN, citing Project Veritas videos An attorney representing President Trump's reelection campaign sent a letter to CNN on Friday threatening to sue.",0.1819950934877158,0.2939490695871357,0.23797208153742574,0.2566310775539957
N52196,news,newspolitics,"Graham claims victory with impeachment vote Sen. Lindsey Graham, who introduced a resolution condemning secretive impeachment proceedings in the House, claimed victory Monday after House Speaker Nancy Pelosi announced she'll hold a formal vote and open up the hearings to the public.",0.1819950934877158,0.2833374855557941,0.23266628952175494,0.24955668819976798
N35685,autos,autosreview,"First Drive! 2020 Shelby GT500 Is an Apex Predator, Turning Drivers Into Track Stars Driving the 2020 Shelby GT500 on the street, dragstrip, and road course reveals an apex predator that turns any driver into a track star.",0.1819950934877158,0.3056062806861418,0.2438006870869288,0.2644025516199998
N45824,sports,football_nfl_videos,"Ian Rapoport: MRI results are good news for Patrick Mahomes, Kansas City Chiefs NFL Network Insider Ian Rapoport and James Palmer provide a Patrick Mahomes injury update.",0.1819950934877158,0.2834993035000961,0.23274719849390596,0.2496645668293027
N53209,sports,baseball_mlb,"​Are the Astros stealing signs to gain an edge in ALCS? Hopefully. If your code is easy to crack, the problem is on you, not the codebreaker.",0.1819950934877158,0.3037015236297504,0.2428483085587331,0.26313271358240553
N5211,sports,football_nfl,"Jets trade DL Leonard Williams to Giants The USC product is in the final year of his deal, and the Jets wanted to get something for him while they still could. The third-rounder they'll be getting from the Giants will presumably be an early third-rounder.",0.1819950934877158,0.2765949583032913,0.22929502589550355,0.24506167003143278
N49990,sports,football_nfl,Watch: Kevin Harlan's call of streaking cat on 'MNF' is epic This might legitimately be the best thing we've ever heard from Mr. Harlan.,0.1819950934877158,0.2836561584335211,0.23282562596061845,0.24976913678491933
N21851,sports,football_nfl,"Next man up: Chiefs prepare for life without Mahomes, with Moore Two weeks ago, Tyreek Hill served as Matt Moore's top target.",0.1819950934877158,0.2755670531657284,0.2287810733267221,0.24437639993972418
N52865,news,newspolitics,Ohio's Reputation As a Must-Win State May No Longer Be True ,0.1819950934877158,0.2573068428951259,0.21965096819142085,0.2322029264259892
N32670,news,newspolitics,"McConnell tees up government funding votes amid stalemate Senate Majority Leader Mitch McConnell (R-Ky.) is turning the Senate toward trying to pass a set of long-stalled appropriations bills. ""Congress has fallen badly behind schedule on appropriations. It's been a month since my Democratic colleagues filibustered government funding here on the floor, blocking defense funding and a pay raise for service members. We need to get moving,"" McConnell said from the Senate floor. McConnell said the Senate...",0.1819950934877158,0.277943816711882,0.2299694550997989,0.24596090897049327
N5019,sports,football_nfl,"Winners, losers from Cowboys' win over Giants on 'Monday Night Football' In a NFC East tilt, the Cowboys overwhelmed the Giants defense late while Big Blue continues to trip over its own feet.",0.1819950934877158,0.2737258490376527,0.22786047126268424,0.24314893052100706
N37481,sports,football_nfl,Baker Mayfield blasts officials after Browns loss: Refs were 'pretty bad today' ,0.1819950934877158,0.2921040760484776,0.2370495847680967,0.25540108186155697
N34380,news,newspolitics,"House rejects GOP measure censuring Schiff Democrats in the House turned aside a GOP-led privileged resolution to censure House Intelligence Committee Chairman Adam Schiff (D-Calif.) on Monday in a 218-185 vote.Republicans and President Trump have increasingly targeted Schiff, a public face of the impeachment effort.They have taken issue with Schiff's exaggerated account of the details of President Trump's July 25 phone call with Ukrainian President Volodymyr Zelensky during a...",0.1819950934877158,0.2624585779253846,0.2222268357065502,0.23563741644616165
N37835,sports,football_nfl,Giants will not go back to Eli Manning after Daniel Jones' struggles Jones has thrown eight interceptions and has lost two fumbles in his past four starts.,0.1819950934877158,0.2857542106565789,0.23387465207214736,0.2511678382669579
N22929,sports,football_nfl,"Burning questions for Cowboys vs Giants on 'Monday Night Football' Capping off the action in Week 9, the New York Giants are hosting the Dallas Cowboys for the NFC Monday Night Football. There are five burning questions for this NFC matchup.",0.1819950934877158,0.2731115290853582,0.227553311286537,0.24273938388614405
N14437,sports,basketball_nba,"Suns' Deandre Ayton suspended 25 games for violating NBA anti-drug policy The league informed the Suns that Ayton, the top pick in the 2018 draft, tested positive for a diuretic. His suspension begins Friday.",0.1819950934877158,0.2953469611826136,0.2386710273351647,0.2575630052843143
N15087,sports,football_nfl,"Trent Williams to Cleveland rumor emerges Dysfunctional teams do dysfunctional things. But sometimes they do something that makes sense, against their nature. Washington may soon be throwing in the towel on the Trent Williams holdout, trading the disgruntled left tackle in advance of the deadline that arrives in only two weeks. Steve Doerschuk of the Canton Repository shares the news with [more]",0.1819950934877158,0.2412305534277955,0.21161282345775567,0.2214854001144356
N54807,news,newsworld,"Russia questions language of ""unusual"" Trump letter to Erdogan Russia questions language of ""unusual"" Trump letter to Erdogan",0.1819950934877158,0.2572139876506218,0.2196045405691688,0.23214102292965313
N62396,sports,football_nfl,Colin Kaepernick is the perfect replacement for Patrick Mahomes This is a good idea if Mahomes misses a lot of time.,0.1819950934877158,0.2951410816853019,0.23856808758650885,0.25742575228610654
N4408,sports,football_nfl,"Patrick Mahomes already back at practice for Chiefs Although Reid didn't rule Mahomes out for the team's Week 8 game, it seems like a long-shot for the quarterback to get back onto the field that quickly.",0.1819950934877158,0.2832288755319789,0.23261198450984735,0.24948428151722454
N1406,sports,football_nfl,"NFL Films signed off on airing of Sam Darnold's 'ghosts' comment A firestorm has erupted in New York over how an unflattering comment from a mic'd up Sam Darnold made the air during ESPN's coverage of the Jets' blowout loss to the Patriots on ""Monday Night Football.""",0.1819950934877158,0.2590253523440964,0.2205102229159061,0.23334859939196953
N26606,autos,autosenthusiasts,2020 Shelby GT500 Aero Performance & Cooling Supercomputers and 3-D Printing are secrets to the all-new Mustang Shelby GT500's high performance.,0.1819950934877158,0.2819278981261985,0.23196149580695716,0.24861696324670426
N17463,news,newspolitics,"Democrats unveil procedures for Trump's impeachment inquiry, rebutting GOP attacks The resolution hands the lead role to the House Intelligence Committee and its chairman, Rep. Adam B. Schiff, who would have broad latitude to organize extended questioning of potential public witnesses.",0.1819950934877158,0.2778284910030427,0.22991179224537925,0.2458840251646004
N57364,news,newspolitics,"Facebook's Zuckerberg grilled by AOC on fact-checking policy for political ads Facebook CEO Mark Zuckerberg struggled to explain the social media company's new policy on fact-checking political ads under questioning from Rep. Alexandria Ocasio-Cortez during a Tuesday hearing. The company recently announced that to protect political speech it would no longer fact check ads from politicians, essentially allowing campaigns to pay Facebook to spread disinformation. At the hearing of the House Financial Services committee,...",0.1819950934877158,0.2880471839698986,0.2350211387288072,0.25269648714250437
N64395,sports,football_nfl,J.J. Watt has sobering quote after season-ending injury The Houston Texans lost the rock of their team for the season during Sunday's win over the Oakland Raiders. Stud pass rusher and future Hall of Famer J.J.,0.1819950934877158,0.2732570740560797,0.22762608377189775,0.24283641386662505
N27164,sports,football_nfl,"Burning questions for Dolphins vs. Steelers on 'Monday Night Football' The Dolphins (0-6) are visiting the Steelers (2-4) to close out NFL Week 8 on Monday Night Football. Fans should brace for an ugly game, because that's been a weekly occurrence whenever the Dolphins take the field.",0.1819950934877158,0.2713207146780282,0.226657904082872,0.24154550761459073
N10270,autos,autossports,"What Do Old-School Mustang Guys Think of the Kia Stinger? We wondered, so we put the Original Venice Crew in our long-term Stinger GT.",0.1819950934877158,0.2571551385352354,0.2195751160114756,0.23210179018606222
N63306,sports,football_nfl,Jenkins' scorching response to Scandrick ripping Eagles Former Philadelphia Eagles cornerback Orlando Scandrick ripped into Malcolm Jenkins and his former teammates in general.,0.1819950934877158,0.2712137890601519,0.22660444127393387,0.2414742238693399
N14137,sports,football_nfl,MetLife Stadium searching for the famous black cat from 'Monday Night Football' ,0.1819950934877158,0.2452071077048861,0.21360110059630094,0.22413643629916266
N52227,sports,basketball_nba,"Joel Embiid, Karl-Anthony Towns likely facing multi-game bans for roles in brawl Both teams don't play again until Saturday, so the league will have plenty of time to assess whether any players left the bench area, which could lead to additional suspensions.",0.1819950934877158,0.2838532399997624,0.23292416674373911,0.24990052449574687
N21428,autos,autosnews,Ford's Mach E Electric SUV Spied Looking...Interesting We're not sure how we feel about this new EV's Mustang-inspired styling cues.,0.1819950934877158,0.2713228019276835,0.22665894770769965,0.24154689911436092
N62283,news,newsworld,British PM denied new Brexit deal vote Prime Minister Boris Johnson prepared to Monday make a second attempt to ram his EU divorce deal through parliament and avoid the political damage of delaying Brexit next week. But EU officials were still making preparations for Britain to leave in 10 days' time.,0.1819950934877158,0.2681032390353282,0.225049166261522,0.23940052385279073
N60936,news,newsus,Chicago teachers' strike ends after 11 days. CPS will have 5 make-up days of school The Chicago Teachers Union voted to accept a tentative agreement with Mayor Lori Lightfoot. The two sides argued over how many days to make up.,0.1821489334605531,0.2762245619787067,0.2291867477196299,0.24486601913932216
N51464,news,newsus,"Woman wanted for climbing into Bronx Zoo lion exhibit: 'I am the lion now' Myah Autry said her decision to climb a fence and head into the lion's den was a ""spiritual"" experience.",0.1821489334605531,0.2681838784386677,0.2251664059496104,0.23950556344596283
N51616,sports,football_ncaa,"Plaschke: USC's debacle against Oregon is final nail in coach Clay Helton's coffin It's over now, finally, mercifully, a USC football era ending Saturday night on a field filled with mistakes surrounded by fans teeming with anger. There's no way Clay Helton comes back from this. There's no way the Trojans football program can continue on like this. There's no way this should ever happen at USC, ever, this embarrassing 56-24 whipping at the hands and arms and feet of the ...",0.1821489334605531,0.267162178786429,0.22465555612349106,0.23882443034447037
N44007,video,news,Where have Cape Town's great whites gone? Shark spotters say Cape Town's world-famous great whites have disappeared. So where have they gone?,0.1821489334605531,0.2539052592651071,0.2180270963628301,0.22998648399692243
N11673,movies,movies-celebrity,"Blake Lively Hilariously Trolls Ryan Reynolds for Having ""No Chill"" Blake Lively trolled husband Ryan Reynolds and his gin company, Aviation Gin, on Instagram with some hilarious Stories. See what she wrote here.",0.1821489334605531,0.2351071730589294,0.20862805325974126,0.21745442652613728
N53052,movies,movienews,Charlize Theron Says Playing Megyn Kelly Was 'Harder' Than Portraying a Serial Killer Charlize Theron: Playing Megyn Kelly Was 'Harder' Than Playing a Serial Killer,0.1821489334605531,0.2557825469113963,0.2189657401859747,0.23123800909444855
N61319,sports,football_ncaa,"After throwing a punch, Dabo Swinney made CB Andrew Booth ride the manager bus back to Clemson ",0.1821489334605531,0.2688407834423679,0.2254948584514605,0.2399435001150963
N51147,sports,football_ncaa,10 storylines to follow heading down college football's home stretch Seven weeks down; seven to go. We've hit the halfway mark of the college football regular season. It's been entertaining thus far   not too many surprises   with enough intrigue to keep us going back each week.,0.1821489334605531,0.2927300758780133,0.2374395046692832,0.25586969507219326
N45388,sports,football_ncaa,"College football Week 8 bowl projections: Baylor surges into New Year's Day 6 Sporting News' Week 8 bowl projections saw a little movement, and Baylor and North Carolina each have joined the New Year's Day 6 discussion.",0.1821489334605531,0.2835635849818154,0.23285625922118425,0.24975870114139462
N6785,news,newsworld,Today in History: November 5 ,0.1821489334605531,0.2650633731253015,0.2236061532929273,0.23742522657038534
N63642,news,newsus,U.S. Coast Guard responds to oil discharge in Louisiana protected wetlands U.S. Coast Guard responds to oil discharge in Louisiana protected wetlands,0.1821489334605531,0.2263980648957276,0.20427349917814036,0.2116483544173361
N50343,sports,football_ncaa,'We think it's cute.' Clemson reacts as undefeated Tigers keep falling in Top 25 Clemson co-offensive coordinator Jeff Scott was the head coach at Blythewood High School in Richland County in the mid-2000s before beginning his college coaching career at Presbyterian in 2007.,0.1821489334605531,0.2835814205145837,0.2328651769875684,0.2497705914965735
N50015,news,newsworld,North Korea rejects meeting with South over resort North Korea on Tuesday rejected South Korea's request for working-level talks to discuss the possible demolition of South Korean-made hotels and other facilities at the North's Diamond Mountain resort that North Korean leader Kim Jong Un wants removed.,0.1821489334605531,0.2632492279390458,0.22269908069979946,0.2362157964462149
N770,tv,tvnews,"Megyn Kelly Slams NBC News on 'Tucker Carlson Tonight' for Matt Lauer Investigation, Harvey Weinstein Coverage In Megyn Kelly's first televised interview since exiting NBC, the former Fox News and NBC News anchor took to ""Tucker Carlson Tonight"" Wednesday evening to criticize NBC News management for its handling of the outlet's Harvey Weinstein coverage and internal Matt Lauer investigation.",0.1821489334605531,0.2486391250796729,0.215394029270113,0.22647572787329961
N1455,sports,football_ncaa,"LSU up to No. 2 behind Alabama in Amway Coaches poll as Oklahoma, Notre Dame tumble LSU is now No. 2 in the Amway Coaches Poll behind Alabama, while Oklahoma and Notre Dame both tumbled after losses on the road.",0.1821489334605531,0.2762877965500929,0.229218365005323,0.2449081755202463
N20933,sports,football_ncaa,"College football Week 7 takeaways: LSU offense shows it's for real LSU appears to finally have the offense to compete with Alabama, and other things Dan Wolken learned from Week 7 of the college football season.",0.1821489334605531,0.2705017640668665,0.2263253487637098,0.24105082053142868
N28467,news,newsworld,"Four-metre king cobra wrestled from sewer in Thailand A feisty four-metre (13-foot) king cobra was pulled from a sewer in southern Thailand in an hour-long operation, a rescue foundation said Tuesday, describing the reptile as one of the largest they had ever captured. Kritkamon said the snake was more than four metres long, weighed 15 kilos (33 pounds), and was the third-largest they had found.",0.1821489334605531,0.2787435197560209,0.230446226608287,0.2465453243241983
