ID,category,sub_category,content,collaborative_rec,content_rec,mean,two_one
N13231,news,newsus,"Homeowner says a mystery object damaged his house. It didn't fall from a plane, FAA says Authorities including the Federal Aviation Administration have not been able to identify a canister-type object that damaged a Kentucky man's home.",0.1886296687701778,0.2211890073030327,0.20490933803660527,0.21033589445874773
N61070,news,newscrime,Man arrested in 1993 cold case rape after he's identified by DNA: Police The suspect was 28 at the time and not known to the victim.,0.1887872450539413,0.2917334298851399,0.2402603374695406,0.257418034941407
N3933,sports,football_nfl,"Bears' Khalil Mack calls out Eagles C Jason Kelce's controversial tactics in offsides penalties The Chicago Bears doomed themselves early in the first half in a 22-14 loss to the Philadelphia Eagles. While the Bears offense had a historically bad first half performance   netting just 9 total yards   the defense had its share of struggles with five pre-snap penalties in the first half against the Eagles. Bears outside linebacker Khalil Mack isn't one to point fingers for the defense's struggles, but when asked about those pre-snap...",0.1890402797823494,0.2643667755231214,0.22670352765273538,0.23925794360953073
N25062,sports,basketball_nba,"James Harden scores 36 points, Rockets rout Warriors 129-112 HOUSTON (AP)   James Harden had 36 points and 13 assists and the Houston Rockets routed Golden State 129-112 on Wednesday night, sending the short-handed Warriors to their sixth loss in eight games this season. Harden again appeared to be moving past his early shooting woes, going 6 of 16 from 3-point range. Since going 17 of 79 on 3s in his first six games, Harden has made 13 of 32 the last two. Russell Westbrook had 18 points, eight rebounds...",0.1890603102903214,0.2814986660391826,0.235279488164752,0.2506858807895622
N59923,entertainment,celebrity,Third time's (not always) the charm: From silver screen icons to a world heavyweight boxer - celebs who've been married more than three times It's no secret that many celebrities have long and colorful relationship histories. Here are the celebrities who have walked down the aisle more than three times,0.1890603102903214,0.2647984340359123,0.22692937216311684,0.239552392787382
N20680,sports,football_nfl,Saints DBs mocked Bears RB Tarik Cohen for being short during heated argument Things go personal in Chicago.,0.1890603102903214,0.2783510867263885,0.23370569850835493,0.2485874945810328
N11885,sports,football_nfl,"Something fishy happened in that Texans-Chiefs call There was no pool report, no video from Al Riveron. And there likely will be no public admission regarding the conversation(s) that resulted in a key defensive pass interference foul being wiped out in the Texans-Chiefs game. But something fishy happened, as evidenced by the images broadcast by CBS. It occurred with the Chiefs leading [more]",0.1890603102903214,0.250859589082171,0.2199599496862462,0.23025982948488777
N23784,music,music-gallery,"35 musicians you should see live at least once in your life If you have a chance to see these musicians live, you absolutely need to take the chance and grab a ticket.",0.1890603102903214,0.2947113370892041,0.24188582368976275,0.2594943281562432
N4830,movies,movies-celebrity,"Cuba Gooding Jr. pleads not guilty to sex misconduct claims NEW YORK (AP)   Cuba Gooding Jr. has pleaded not guilty to an indictment alleging two instances of sexual misconduct. Gooding appeared Tuesday before a judge in New York City and was released on his own recognizance. The new charge involves an alleged incident in October 2018. The defense paints it as a shakedown attempt. The 51-year-old ""Jerry Maguire"" star was previously accused of groping a woman's breast at a bar on June 9. The woman told...",0.1890603102903214,0.2885395562069641,0.23879993324864274,0.2553798075680832
N48621,finance,personalfinance,"The 25 richest families in America Stacker compiled a list of the 25 richest American families using 2019 data from Forbes. From winemakers to oil tycoons, find out which American families have a combined net worth of more than $721.5 billion.",0.1890603102903214,0.294811902728294,0.2419361065093077,0.25956137191563644
N59139,entertainment,entertainment-books,"Prince's The Beautiful Ones is a breathtaking, occasionally frustrating look at the icon Prince The Beautiful Ones book: EW review",0.1890603102903214,0.2788985921138964,0.2339794512021089,0.2489524981727047
N36387,news,newscrime,Pasadena substitute teacher accused of sexually assaulting student for two years A Pasadena ISD substitute teacher is accused of having an improper relationship with a student at Sam Rayburn High School.,0.1890603102903214,0.2931616462339572,0.24111097826213929,0.25846120091941194
N37586,autos,autosclassics,The 50 most expensive cars ever sold at auction Breaking records and bank accounts,0.1890603102903214,0.2721143639589999,0.23058733712466065,0.24442967940277371
N44416,sports,more_sports,Rockets vs Nets game thread The Houston Rockets will look for their fourth straight win tonight against the Brooklyn Nets.,0.1890603102903214,0.288791694957709,0.2389260026240152,0.2555479000685798
N40785,news,newscrime,"Mother Is Freed After 15 Years in Prison for Father's Abuse A domestic violence survivor in Oklahoma walked free from prison on Friday, according to a corrections spokeswoman, after spending 15 years behind bars for failing to report that her boyfriend was also abusing their children.",0.1890603102903214,0.2849333364041734,0.2369968233472474,0.2529756610328894
N60785,music,music-celebrity,"DMX heading back to rehab, cancels concerts DMX has long struggled with substance abuse.",0.1890603102903214,0.2717248295607513,0.23039256992553633,0.24416998980394133
N37681,sports,basketball_nba,Chris Paul receives standing ovation in return to Houston against Rockets ,0.1890603102903214,0.2738994899517575,0.23147990012103944,0.24561976339794545
N34167,health,fitness,"I Took the 30-Day Squat Challenge and Here's What Happened I completed more than 3,000 squats, which is at least 2,900 more than I would have normally done.",0.1890603102903214,0.29727429183733,0.2431673010638257,0.2612029646549938
N3280,sports,mmaufc,Foul play suspected in case of UFC fighter's missing stepdaughter ,0.1890603102903214,0.2563623201160036,0.22271131520316248,0.2339283168407762
N40373,news,newscrime,Ex-model accuses Jeffrey Epstein's friend of rape Several women have come forward in recent weeks with allegations against a model agent that span three decades,0.1890603102903214,0.2744856460317738,0.23177297816104758,0.24601053411795631
N50372,entertainment,celebrity,Celebrity mug shots Check out the best celebrity mug shots of all time!,0.1890603102903214,0.2767367422456284,0.2328985262679749,0.24751126492719272
N25114,lifestyle,lifestylebuzz,"There's a mouse hiding among mushrooms in this viral brainteaser. Can you spot it? Artist Gergely Dudás expertly hides hard-to-find objects in his vibrant illustrations, creating viral brainteasers that stump the internet.",0.1890603102903214,0.2499001196561373,0.21948021497322934,0.2296201832008653
N46085,movies,movies-celebrity,"Johnny Depp Settles Legal Battle With Former Law Firm Bloom Hergott for 8 Figure Sum Johnny Depp has settled a legal battle with his former lawyer Jake Bloom of Bloom Hergott on Wednesday, according to an attorney from Bloom's firm. An individual familiar with the matter tells TheWrap the settlement was for an amount just over eight figures. Depp sued Bloom in Oct. 2017 and the company costing the actor ""tens of millions of dollars"" through improperly collecting upwards of $30 million in legal fees during the course of their...",0.1890603102903214,0.2687195727672888,0.2288899415288051,0.24216648527496631
N60985,sports,football_nfl,"Ex-NFL player Winslow Jr takes plea deal before rape retrial VISTA, Calif. (AP)   Former NFL player Kellen Winslow Jr. pleaded guilty Monday to raping an unconscious teen in 2003 and to sexual battery involving a 54-year-old hitchhiker in a deal that spared him the possibility of life in prison. Winslow initially hesitated and seemed to agonize over his decision. ""I'm sorry. I'm just not thinking very clearly,"" Winslow told the judge at one point. He asked the judge for more time before he finally entered...",0.1890603102903214,0.2662343697678583,0.22764734002908985,0.240509683275346
N47687,sports,basketball_nba,Video emerges of Rockets fan punching Pelicans assistant coach A television station obtained video showing a fan at Toyota Center punching New Orleans Pelicans assistant coach Joe Boylan.,0.1890603102903214,0.2634759393643887,0.22626812482735503,0.23867072967303293
N36353,weather,weathertopstories,"Halloween storm to dump 1st snow of season in parts of Midwest After a brief clip of wintry weather races through the central Plains and western Great Lakes to start the week, a much larger and more impactful winterlike storm will close out October.",0.1890603102903214,0.2479624008973773,0.21851135559384935,0.22832837069502532
N47175,sports,basketball_nba,Report: Adidas working on buyout of $25 million John Wall deal amid injuries ,0.1890603102903214,0.2747452958571581,0.23190280307373975,0.24618363400154586
N44984,sports,football_nfl,"Who the Houston Roughnecks took in the XFL Draft Twenty-two of the 42 players added to the Houston Roughnecks roster through the inaugural XFL Draft this week have been on active NFL rosters in their careers. Twelve of those players played multiple seasons in the NFL. Among the most well-known players selected by the Roughnecks include quarterback Connor Cook, who started a playoff game for the Raiders, who lost that game to the Texans in January 2017. Receiver Sammie Coates also was taken by...",0.1890603102903214,0.2803527423780848,0.23470652633420308,0.24992193168216364
N65204,movies,movies-celebrity,See Vin Diesel's 21st birthday post to Paul Walker's daughter Meadow The Fast & Furious franchise star has remained close to close to Paul's daughter following his death six years ago this month.,0.1890603102903214,0.2725743605281745,0.23081733540924795,0.24473634378222348
N13137,video,popculture,"Singer stands up to heckler who told her to take shirt off After being heckled on stage and told to ""free the nips"" at a concert in Texas, singer Maggie Rogers voiced her anger about the harassment.",0.1890680286470116,0.2670327630230322,0.2280503958350219,0.24104451823102532
N51180,finance,finance-companies,"Verizon to give its wireless customers a year of Disney+ Verizon announced Tuesday that it is teaming up with Disney to give new and existing 4G LTE and 5G wireless ""unlimited"" customers a free year of the new Disney+ streaming service. The exclusive promotion coincides with the Disney+ launch on Nov. 12. New Verizon FIOS and 5G Home Internet customers will also qualify for a year of Disney+.",0.1891791242244261,0.2967640932933354,0.24297160875888074,0.2609024369370323
N40640,foodanddrink,foodnews,"Foie Gras Is Banned by New York City Lutèce served it seared, with dark chocolate sauce and bitter orange marmalade. Le Cirque offered it in classic terrine form, but also served it with rabbit and bacon and made it the scene-stealer in a ravioli dish. But Lutèce closed in New York in 2004. Le Cirque shut its last Manhattan location in 2017. And foie gras, the calling card of fine French dining, is about to follow suit. The New York City Council overwhelmingly passed legislation on...",0.1892215652175921,0.2588420181803421,0.2240317916989671,0.2356352005260921
N459,news,newscrime,Serial stowaway arrested at Chicago airport for 2nd time Hartman was taken into custody was charged with one felony count of criminal trespass,0.1893049338104271,0.2391817066519301,0.2142433202311786,0.22255611570476241
N16617,news,newsus,"Coast Guard searches for man who fell from cruise off Texas The U.S. Coast Guard late Thursday said it was searching for a man who plunged into the Gulf of Mexico while the ship was about 47 miles off the coast of Galveston, Texas.",0.1893613755987913,0.2462380330892523,0.2177997043440218,0.22727914725909865
N11855,news,newsus,"New Jersey woman sues waiter for spilling wine on her Hermès handbag The woman is seeking $30,000 for the light-pink luxury handbag, which has been discontinued.",0.1895401549123386,0.2503041349527891,0.21992214493256385,0.2300494749393056
N46082,video,science,"Archaeologists open ancient coffins in Egypt After 30 ancient coffins were unearthed ""completely by accident"" in Egypt this week, archaeologists are now taking a closer look. Two of the coffins have been opened but what will experts find inside? NBC's Molly Hunter reports for Weekend TODAY.",0.1898841888115817,0.2709452359918977,0.2304147124017397,0.24392488693179235
N55051,lifestyle,voices,I Am Unapologetically Raising My Daughter Without Religion ,0.1898948524561748,0.2845300529851176,0.23721245272064617,0.25298498614213666
N19347,news,newspolitics,"Former US Senator Kay Hagan dead at 66 Former U.S. Sen. Kay Hagan, a one-time Capitol Hill intern who went on to become North Carolina's first Democratic female senator, died Monday at her Greensboro home. She was 66.",0.1900594877712506,0.2770705779178004,0.23356503284452548,0.24806688120228376
N28088,movies,movies-celebrity,Bruce Willis brought Demi Moore to tears after reading her book Demi wasn't sure how her ex would feel about her book until he called her.,0.1901811205173758,0.2704294255448299,0.23030527303110285,0.24367999053567854
N38118,tv,tv-celebrity,Uh-Oh! Carrie Ann Inaba Falls on 'Dancing With the Stars' Uh-Oh! Carrie Ann Inaba Falls on 'Dancing With the Stars',0.1904435692029417,0.2310693288050223,0.210756449003982,0.2175274089376621
N54522,entertainment,celebrity,"Ben Affleck has a new girlfriend after using the Raya dating app, plus more celeb love life news for late October 2019 Meg Ryan and John Mellencamp call it quits, Halsey and Evan Peters get serious, James McAvoy weds, Meghan King Edmonds accuses hubby of cheating and more.",0.1904742869043525,0.2715830106853182,0.23102864879483537,0.2445467694249963
N22816,foodanddrink,foodnews,"Snow crab sells for record price in Japan A ""five shining star"" snow crab was auctioned off in Tottori, Japan for a record-breaking 5 million yen ($46,000). wide.",0.190807408790474,0.2851694575575458,0.23798843317400992,0.2537154413018552
N2735,sports,football_nfl,Jimmy Garoppolo addresses Erin Andrews interview by saying he uses 'baby' 500 times a game ,0.1908364409693744,0.2837235651859743,0.23728000307767436,0.25276119044710765
N30160,foodanddrink,tipsandtricks,How To Open a Can Without a Can Opener All it takes is a metal spoon and some elbow grease.,0.1910048704884154,0.2837965636295311,0.23740071705897325,0.2528659992491592
N42526,finance,finance-companies,'Go back to work': Outcry over deaths on Amazon's warehouse floor Billy Foister died last month after a heart attack at work. The incident was just one in a series of recent accidents and fatalities,0.191271589259007,0.2727980215786834,0.2320348054188452,0.24562254413879125
N10417,music,musicnews,Watch Miranda Lambert Invite a Little Girl On Stage Who 'Stole' Her Heart The girl's mother thanked Lambert for raining attention on her daughter Remi during the show on Saturday night.,0.1912786404627762,0.2740361995350389,0.23265741999890754,0.24645034651095132
N56447,tv,tv-celebrity,"'The Office' star Jenna Fischer responds to Chrissy Teigen's theory that Jim and Pam are divorced Jenna, who played Pam opposite John Krasinski's Jim on the hit NBC sitcom, thinks Chrissy got it wrong.",0.1912795941504344,0.2726330321664058,0.23195631315842008,0.24551521949441532
N56446,movies,movies-celebrity,Ryan Reynolds Shares the First Photo of His and Blake Lively's Newborn Daughter This is the first time the actor has talked about his newborn daughter.,0.1913565141368531,0.269493954232176,0.23042523418451455,0.24344814086706834
N46616,foodanddrink,newstrends,"The best sandwich shop in every US state and DC You don't need to look far to find a great sandwich in the USA. We've rounded up the best sandwich joints in every state, spanning the range from old-school delis still whipping up traditional favorites to quirky, modern joints putting innovative ingredients to work. Pull up a stool and sink your teeth into these mouthwatering offerings.",0.1914944822666883,0.2924181943730293,0.2419563383198588,0.25877695700424896
N54536,news,newsus,4 High School Students Killed in Texas Car Crash That Also Injured 3: 'We Grieve Together' 4 High School Students Killed in Texas Car Crash,0.1916326593704342,0.2864837215483748,0.23905819045940452,0.2548667008223946
N21817,news,newspolitics,Two House Democrats break ranks with Pelosi on impeachment rules vote Two House Democrats broke ranks with their party leadership on Thursday's highly-contentious vote.,0.1919234337592509,0.2767329513815836,0.23432819257041726,0.24846311217413936
N25258,sports,boxing,Evander Holyfield's son wins pro boxing debut in 16 seconds ,0.1920201630876572,0.2725944176211149,0.23230729035438608,0.24573633277662904
N30612,finance,personalfinance,"The first thing 14 lottery winners have bought after finding out they were rich Winning the lottery may be a dream come true, but what that actually looks like is different for everyone.",0.192229165435102,0.2753283105268849,0.23377873798099344,0.2476285954962906
N35022,lifestyle,lifestylebuzz,"Bed, Bath and Beyond Pulls 'Blackface Pumpkins From the Shelves The pumpkins were removed from stores after an upstate New York community filed complaints.",0.1923207019955115,0.2600102195151637,0.22616546075533758,0.23744704700861294
N33502,finance,markets,"China's trade with US shrinks in October despite optimism BEIJING (AP)   U.S.-Chinese trade contracted again in October, despite optimism about possible progress in talks aimed at ending a tariff war that threatens global economic growth.",0.1923453780536746,0.2884225857611746,0.2403839819074246,0.25639684985867456
N44399,health,medical,Subtle Signs You May Have Clogged Arteries These surprising clues can point to clogged arteries and underlying heart disease.,0.1924739466648583,0.3043246744681865,0.2483993105665224,0.26704109853374375
N56514,travel,travelnews,"Road built by biblical villain uncovered in Jerusalem A long-buried street that led pilgrims to the Jewish Temple 2,000 years ago was commissioned by Roman governor Pontius Pilate.",0.1924897282555738,0.2960282032391621,0.24425896574736797,0.26151537824463267
N7132,lifestyle,lifestylebuzz,"8 Hero Dogs That We Don't Deserve From trained search and rescue dogs, to a cosmonaut, to a boxer with a penchant for recycling, here are 8 dogs who deserve all the belly rubs.",0.1926786789666284,0.2598655094854901,0.22627209422605926,0.2374698993125362
N10732,lifestyle,lifestylebuzz,"Couple Didn't Know Why Car Was Running Strangely   Then They Popped The Hood Earlier this week, Holly Persic was driving to work in Pennsylvania when her car suddenly started acting up. The engine was making a weird sound, and there was a faint smell of burning. Persic pulled over and called her husband, Chris. He suggested she pop the hood. And sure enough, this is what they found: Chris Persic Inside the engine compartment were hundreds of walnuts, along with some dry grass. A squirrel, it seems, had chosen the...",0.1927420790573775,0.2261927077013203,0.2094673933793489,0.21504249815333937
N25885,entertainment,celebrity,Here's Every Costume the Kardashian-Jenner Family Wore This Halloween Every Kardashian-Jenner Halloween Costume (Even the Kids!) From 2019,0.1929908304596133,0.2641028800101253,0.22854685523486928,0.24039886349328793
N8629,sports,basketball_nba,"Anthony Davis on possibly joining hometown Bulls: 'I mean, I am a free agent next year' ",0.1929908304596133,0.2853114860759903,0.23915115826780178,0.2545379342038646
N23614,tv,tv-celebrity,"John Witherspoon Dies: Comedian & 'Friday' Star Was 77 John Witherspoon, an actor-comedian who for decades made audiences laugh in television shows and films, including the hit Friday franchise, died suddenly at his home today. He was 77. ""It is with deepest sorrow that we can confirm our beloved husband and father, John Witherspoon, one of the hardest working men in show business, died",0.1930791401133146,0.2926886997233491,0.24288391991833186,0.25948551318667096
N59026,news,newsus,"Cincinnati school board candidate accused of 'pretending to be black' in his ads A current CPS board member took to Twitter Sunday to say a candidate for the board ""is a white guy pretending to be black to get votes"" in ads.",0.1930838211223277,0.2844273298203054,0.23875557547131654,0.25397949358764615
N5283,foodanddrink,foodnews,"For the first time ever, a US cheese is named best in the world Forget the American love affair with Cheez Whiz, blocks of Velveeta and pasteurized processed cheese food slices. An organic blue cheese from Oregon has been named the world's top cheese.",0.1932677208318438,0.2642658765155097,0.22876679867367675,0.2405998246209544
N55742,sports,mma,President Donald Trump gets mixed reaction at UFC 244 in historic milestone for MMA ,0.19331796211767,0.2535862820810131,0.22345212209934154,0.23349684209323207
N43202,autos,autosnews,Mid-Engine C8 Corvette Production Postponed Until February 2020 The car was supposed to be hitting dealers by the end of 2019. That's no longer happening.,0.1933780726873391,0.2936390132270091,0.24350854295717408,0.26021869971378575
N619,news,newsus,"Cornell student, 18, found dead in gorge after frat party, reports say A top Ivy League student was found dead Saturday afternoon in a New York gorge after he left a fraternity party and disappeared Thursday night, according to reports.",0.1934831047976966,0.2612014991864071,0.22734230199205185,0.23862870105683692
N23979,finance,markets,"China already snapping up U.S. farm goods, Trump claims President Donald Trump boasted Sunday without providing evidence that China had ""already begun"" making large purchases of U.S. agricultural products as part of last week's tariff deal with Beijing.",0.1937052367232763,0.2797415717176575,0.2367234042204669,0.2510627933861971
N44559,health,health-news,Photo of emotional nurse after 'particularly hard day' goes viral Her sister revealed that she had just wrapped up four days worth of work that included assisting in the delivery of a stillborn baby.,0.1945039388734572,0.2602807552950393,0.22739234708424827,0.2383551498211786
N32852,news,newsus,"Nearly $400M worth of cocaine and marijuana intercepted by US Coast Guard The U.S. Coast Guard announced that it seized nearly $367 million of cocaine and about 11,000 pounds of marijuana worth an estimated $10.1 million at a Florida port.",0.1947267751176687,0.2616200905113782,0.22817343281452346,0.23932231871347504
N8331,entertainment,celebrity,"Melanie Griffith, 62, shows off her insane figure in lingerie selfie, plus more news Melanie Griffith looks more stunning than ever in lingerie selfie, plus more celebrity news for Oct. 30, 2019.",0.1949590285455482,0.2758083952680582,0.2353837119068032,0.24885860636055487
N6154,sports,football_ncaa,"Report: Florida State considering firing Willie Taggart, pursuing Urban Meyer Willie Taggart should definitely look over his shoulder, should this report be true.",0.1950119982939513,0.2892414381366306,0.24212671821529097,0.2578316248557375
N47289,finance,finance-homesandpropertysection,"A Los Angeles mansion once listed for $250 million has finally sold for 62% off after 3 years. Take a look inside what was once America's most expensive home. The extravagant Bel Air property has five bars, a bowling alley, a 40-seat movie theater, an 85-foot infinity pool, and a candy wall.",0.1950939134430888,0.2777509572897868,0.2364224353664378,0.2501986093408875
N54225,news,newsus,"Multiple Houses on Fire After Plane Crashes in NJ At least two houses are on fire in Colonia, New Jersey, after a plane crash, according to the Colonia Fire Department. A Cessna 414 crashed into a home on Berkley Avenue at 11 a.m. Tuesday, according to the FAA. The FAA will conduct an investigation into the cause of the crash. The number of people aboard and their conditions are unknown. The area is a heavy residential area with tree-lined streets. News 4's Dennis Protsko, who is part of the...",0.1952914210004617,0.218531579237994,0.20691150011922785,0.21078485982548323
N34694,tv,tvnews,Rosie O'Donnell: Barbara Walters Isn't 'Up to Speaking to People' Right Now Rosie O'Donnell: Barbara Walters Isn't 'Up to Speaking to People' Right Now,0.1953249285033634,0.2557875935222974,0.22555626101283038,0.23563337184931943
N9803,finance,markets,"Jeff Bezos is set to lose his crown as world's richest person Jeff Bezos is about to relinquish the title of world's richest person to Bill Gates, as Amazon.com Inc. stock tumbled in late trading Thursday.",0.1953501225189778,0.2694668660856397,0.23240849430230875,0.24476128489675242
N24691,news,newsus,"Bill Macy, Bea Arthur's Husband on 'Maude,' Dies at 97 Norman Lear saw him choking on a chicken bone and brought him to Hollywood. The actor also appeared in 'My Favorite Year' and 'The Late Show.'",0.1954787367858375,0.2701282870404689,0.23280351191315318,0.24524510362225843
N54842,news,newsus,"Mississippi woman found after being missing for days by writing S.O.S. with rocks S.O.S spelled out with rocks saved a woman missing in a national park for days, according to a release from the National Park Service.",0.1955474906415417,0.2482500381053405,0.22189876437344108,0.2306825222840742
N22570,foodanddrink,foodnews,'Ghost kitchens' are taking over fast-food chains from Chick-fil-A to Wendy's Wendy's became the latest fast-food chain to name-check ghost kitchens on Friday at the company's investor day.,0.1957481206748828,0.2503873922905302,0.2230677564827065,0.23217430175198106
