ID,category,sub_category,content,collaborative_rec,content_rec,mean,two_one
N1431,news,newscrime,"Four charged with repeatedly escaping prison, returning with booze and phones Acting on ""repeated reports"" that prisoners were regularly escaping and returning, authorities said they caught the men in the act with the contraband.",0.196085466076983,0.2687499657171487,0.23241771589706584,0.24452846583709348
N8419,news,newscrime,Man charged with 5 counts of first-degree murder in shooting rampage at Chicago condo Chicago police Monday morning announced charges against a man in connection with a shooting rampage that left five people dead Saturday night.,0.196085466076983,0.282667269972271,0.23937636802462697,0.25380666867384166
N60388,news,newscrime,"Man threatened school to distract from robbery, police say As a precaution, schools in one of the districts that were threatened placed all of its schools on a modified lockdown",0.196085466076983,0.2752220555631849,0.23565376082008394,0.24884319240111763
N46868,lifestyle,lifestylepetsanimals,"30 Funny Dog Photos You Need to See We asked readers to send in their favorite animal photos. We were so entertained, we couldn't help but share.",0.196085466076983,0.2880728006488647,0.24207913336292386,0.2574103557915708
N55310,news,newscrime,"Joey 'the Clown' Lombardo, infamous Chicago mobster, dead at 90, reports say Chicago mobster Joseph Lombardo   better as ""Joey the Clown""   died in prison Saturday while serving a life sentence for murder, according to federal prosecutors.",0.196085466076983,0.2886669328506447,0.24237619946381384,0.2578064439260908
N20286,movies,movies-celebrity,Scarlett Johansson Says She Was 'Surprised' by Colin Jost's Proposal: 'He Killed It' Scarlett Johansson Was 'Surprised' by Colin Jost's Proposal,0.196085466076983,0.2646154593202399,0.23035046269861142,0.24177212823915428
N157,sports,baseball_mlb,"How did the Nats respond to a controversial call? By leaving absolutely no doubt. A controversial interference call. Dominance from Stephen Strasburg. Booming home runs to turn it around. And now, one game to decide it all.",0.196085466076983,0.2723977788996735,0.23424162248832825,0.24696034129210997
N47482,travel,travelnews,TSA Agents Stop Passenger With Loaded Gun Before Boarding Plane The man was carrying a loaded .22 caliber handgun.,0.196085466076983,0.2490057727527354,0.22254561941485917,0.23136567052748458
N5888,sports,baseball_mlb,Report: Angels could be fined up to $2M for not reporting Skaggs' opioid use The Los Angeles Angels could be fined up to $2 million by the commissioner for not reporting Tyler Skaggs' opioid use. A report published by ESPN on Saturday stated that Angels communications director Eric Kay admitted to federal investigators that he used and supplied Skaggs with drugs since at least 2017.,0.196085466076983,0.2884620207848556,0.24227374343091929,0.2576698358822314
N20886,news,newsworld,"ISIS Leader Paid Rival for Protection but Was Betrayed by His Own The Islamic State leader Abu Bakr al-Baghdadi was able to hide out in an unlikely part of Syria, the base of a rival group, because he was paying protection money to its members, according to receipts for the payments recovered by researchers.",0.196085466076983,0.271176844473777,0.23363115527537998,0.24614638500817898
N22130,music,music-celebrity,Rihanna Slays in Sexy Black Bikini in Slow-Motion Video -- Watch! The singer shut down Instagram with her slow-motion clip.,0.196085466076983,0.2557844622005237,0.22593496413875336,0.23588479682601016
N18663,news,newsus,"Coast Guard offloads $92 million worth of smuggled cocaine in San Diego The Coast Guard offloaded more than 6,800 pounds of cocaine   worth an estimated $92 million   in San Diego on Wednesday, contraband that the military branch seized in international waters of the eastern Pacific Ocean.",0.196085466076983,0.2528097889067885,0.22444762749188574,0.23390168129685335
N15771,autos,autosenthusiasts,"The Holy Grail Of Jeep Grand Cherokees Sits On An Old Wisconsin Dairy Farm, But It May Be Doomed ",0.196085466076983,0.2175974391123971,0.20684145259469006,0.21042678143392574
N47054,autos,autossema,"Hennessey Maximus Is a 1000-HP Jeep Gladiator from Hell If a 2020 Jeep Gladiator is not aggressive-looking enough, Hennessey has this even more intense version, which it's bringing to the SEMA show.",0.196085466076983,0.2715048111256954,0.23379513860133921,0.24636502944279126
N64562,tv,tv-celebrity,Rob Kardashian Appears Thinner at Kim Kardashian's Birthday Party in Rare Video Rob Kardashian Appears Thinner at Kim Kardashian's Birthday Party,0.196085466076983,0.2679592555820317,0.23202236082950733,0.2440013257470155
N2606,news,newscrime,"Couple Accused of Injecting Childhood Friend With Meth and Filming Her As She Died After more than two years of investigation, authorities in Oklahoma have filed formal murder charges in the death of a 41-year-old woman whose last moments were captured on videotape.",0.196085466076983,0.2760202624152884,0.2360528642461357,0.2493753303025199
N24123,sports,baseball_mlb,Why is Giancarlo Stanton on the Yankees' playoff roster? ,0.196085466076983,0.2569569584880664,0.2265212122825247,0.23666646101770528
N38562,sports,baseball_mlb,Nationals still uncertain on Scherzer status after injection HOUSTON (AP)   The Washington Nationals remain unsure about the health of pitcher Max Scherzer and catcher Kurt Suzuki heading into Game 6 of the World Series against Houston. Scherzer was scratched from his Game 5 start Sunday night because of nerve irritation near his neck and had a cortisone shot. Scherzer won the opener and hopes to be able to pitch in a Game 7 if the Nationals get that far. Houston won three in a row at Washington to take a...,0.1962243105190598,0.2681137231516332,0.2321690168353465,0.24415058560744207
N23163,news,newspolitics,"'You people with this phony Emoluments Clause': Cabinet meeting devolves into 71 minutes of Trump grievances President Trump, trying to dig out from two new political holes of his own making on top of the expanding House impeachment inquiry, held forth for 71 minutes Monday during what was ostensibly a Cabinet meeting but ended up being a familiar torrent of grievance, defensiveness and bold statements about his expansive view of his own powers.",0.1965058754724598,0.2757070259596254,0.23610645071604258,0.2493066424639035
N43955,entertainment,entertainment-celebrity,"Celebrity kids then and now: See how they've grown See what the children of Bobby Cannavale, Ray Liotta, Jude Law, Jamie Foxx, Sylvester Stallone, James Gandolfini and more stars look like now.",0.1965465941418773,0.2859329467712981,0.2412397704565877,0.2561374958948245
N44383,news,newscrime,"Florida police tell man to quit calling about stolen marijuana A man in Florida repeatedly called 911 over the weekend to report that his roommate had stolen his weed, police said.",0.1970166365404773,0.2976714180305377,0.2473440272855075,0.26411982420051755
N63276,autos,autosenthusiasts,Gordon Ramsay's Ferrari Monza SP2 Looks Delicious Good thing the roofless ride is inside because it's raining outside.,0.1972124221291225,0.2585598751052197,0.2278861486171711,0.2381107241131873
N36530,tv,tv-celebrity,Property Brothers' J.D. Scott Marries Annalee Belle in Vintage Theatre-Themed Wedding J.D. Scott is Married! Third Property Brother Ties Knot,0.197463753656195,0.2811989927872608,0.2393313732217279,0.25328724641023886
N54435,news,newsus,"'Angel' car saves Arizona family after smashing into suspected drunk driver running red light, video shows An Arizona driver who police praised as an ""angel"" may have saved the lives of a couple pushing a stroller in a crosswalk last week after video showed the car smashing into a suspected drunk driver speeding through a red light -- who came inches away from plowing into the family.",0.1977069517470704,0.2483281653951151,0.22301755857109273,0.23145442751243356
N29197,lifestyle,lifestylebuzz,Bella Hadid Is Named Most Beautiful Woman in the World -- How It Was Decided Beyonce and Amber Heard also made the list!,0.1979435517196661,0.2532040354013927,0.2255737935605294,0.23478387417415048
N56630,finance,markets,China asks WTO for $2.4 billion sanctions against U.S. in latest clash China asks WTO for $2.4 billion sanctions against U.S. in latest clash,0.1979623025164349,0.2858543692895214,0.24190833590297817,0.25655701369849254
N39235,news,newscrime,"Florida woman allegedly flees 2 car crashes, kills driver in 3rd crash A Florida woman who killed a 53-year-old man after running a red light and smashing into his Lexus on Saturday morning was in the process of fleeing two earlier car accidents when she caused the fatal collision, police said.",0.1980569697649991,0.259193935113695,0.22862545243934704,0.23881494666412967
N8275,news,newsworld,"30 killed in DR Congo bus accident At least 30 died early Sunday when a packed bus came off the road and burst into flames near Kinshasa, the DR Congo capital, a local official said.",0.1983872017443896,0.2579577282143868,0.2281724649793882,0.23810088605772106
N59704,news,newscrime,"California sheriff's deputy shot dead, ride-along injured in 'active shooter incident,' officials say A police officer in Northern California was killed and another deputy was injured after an ""active shooter"" incident early Wednesday, according to officials.",0.1984187985564914,0.2852281045561694,0.2418234515563304,0.2562916692229434
N40944,news,newsus,"Family of toddler who fell from cruise ship 'utterly crushed' after grandfather charged The charge of negligent homicide was ""like pouring salt on an open wound"" for the girl's parents, the family's lawyer told NBC News.",0.1984321904000096,0.2335606738924311,0.21599643214622033,0.22185117939495724
N33164,sports,football_nfl,100 famous NFL players who played for teams you forgot about Randy Moss with the Titans? Archie Manning with the Vikings? Plenty of NFL players had some forgettable stints with surprising teams.,0.1986297025832702,0.2564533761520419,0.22754153936765603,0.23717881829578463
N28058,lifestyle,lifestylebuzz,Strange Dog Shows Up On Woman's Lawn   And Seems To Recognize Her Kate Howard was sitting outside her home one afternoon after a memorial service when something amazing happened.,0.1987171818377651,0.2422803665605225,0.2204987741991438,0.22775930498627
N1398,news,newsus,"Iowa woman killed by explosion at gender reveal party An Iowa woman was killed by debris from an explosion at a gender reveal party on Saturday, police said.",0.1987491402523911,0.2585909328368208,0.22867003654460594,0.23864366864201086
N56537,foodanddrink,restaurantsandnews,"Why Smoked Bologna Is the Secret Star of Oklahoma Barbecue No barbecue plate in the Sooner State is complete without a side of ""Oklahoma tenderloin"".",0.1988407066951703,0.2884730579848238,0.24365688233999705,0.2585956075549393
N28711,sports,football_ncaa,The biggest games in the month of November that will decide the College Football Playoff The month of November will decided which teams will be in College Football Playoff contention. A look at the biggest games in a jam-packed schedule.,0.1990885680807612,0.3078564328917796,0.2534725004862704,0.2716004779547735
N37159,foodanddrink,restaurantsandnews,"National Sandwich Day: Where to score free subs and meal deals Sunday National Sandwich Day is a day for free food, deals and discounts at Jimmy John's, Jersey Mike's Subs, Subway, Potbelly Sandwich Shop and more.",0.1992696598749311,0.2885094023408376,0.24388953110788436,0.25876282151886876
N48222,sports,basketball_nba,"Bucks have done everything right to keep Giannis for good Though Giannis Antetokounmpo doesn't want to talk about his supermax extension right now, the Bucks have done everything right so far.",0.1995239484781956,0.2765517333620023,0.23803784092009894,0.25087580506740004
N59289,lifestyle,lifestylecelebstyle,"Katy Perry's 34 Most Memorable Looks of All Time In honor of her birthday, we're looking back at Katy Perry's most memorable performance looks of all time.",0.1995239484781956,0.2796337585198457,0.23957885349902064,0.25293048850596234
N13057,lifestyle,lifestyleroyals,"Queen Elizabeth and Michelle Obama Shared 'Instant, Mutual Warmth' When They Broke Royal Protocol Queen Elizabeth Welcomed When Michelle Obama Put Arm Around Her",0.1995239484781956,0.2688450618478792,0.2341845051630374,0.24573802405798467
N57528,news,newsus,Bahareh Zare Bahari: Beauty queen says she will be killed if she is deported to Iran An Iranian beauty queen who has spent almost two weeks inside Manila's international airport says she will be killed if she is sent back home and is seeking asylum in the Philippines.,0.1995239484781956,0.2402742616620813,0.21989910507013843,0.22669082393411938
N3812,sports,basketball_nba,Parity in the NBA means no favorites to win the title Not since the mid-2000s has the NBA season begun with no prohibitive favorite to win the championship.,0.1995239484781956,0.2804761509652934,0.2400000497217445,0.2534920834695941
N8519,lifestyle,lifestylebuzz,"Kristen Stewart Just Made Leather Bras a Thing, and We're All For It Leave it to Kristen Stewart to look like a total badass while promoting her new film Charlie's Angels.",0.1995239484781956,0.260636508079926,0.2300802282790608,0.2402656548793492
N4885,sports,basketball_nba,Tacko Fall working hard to show he's more than a novelty act The 7-foot-5-inch fan favorite is working diligently with the Celtics coaching staff to sharpen his skills.,0.1995239484781956,0.2725281693011747,0.23602605888968514,0.24819342902684832
N50748,weather,weathertopstories,"A rare October snowstorm blankets the Texas Panhandle Heavy snow fell in parts of the Texas Panhandle on Thursday, causing near whiteout conditions in Amarillo, according to the National Weather Service.",0.1995239484781956,0.2714578406035434,0.2354908945408695,0.2474798765617608
N56638,sports,basketball_nba,"LeBron James evacuates LA home, relocates family to hotel because of wildfires Lakers star LeBron James and his family were forced to evacuate their home in Los Angeles due to wildfires that have engulfed Southern California.",0.1995239484781956,0.2538896645520065,0.22670680651510106,0.23576775919406956
N2533,entertainment,entertainment-celebrity,"Khloe Kardashian misses ex, Lamar Odom 'all the time,' plus more news Khloe Kardashian wrestles with whether to meet with her ex, Lamar Odom. Plus, more celebrity news for Oct. 24, 2019.",0.1995239484781956,0.2847034973374963,0.24211372290784594,0.25631031438439605
N58997,sports,basketball_nba,"LeBron, D-Wade get hyped watching sons connect for basket LeBron James and Dwyane Wade were having a great time as basketball dads watching their son's play over the weekend for Sierra Canyon.",0.1995239484781956,0.2763218968731479,0.23792292267567175,0.2507225807414971
N4654,sports,basketball_nba,"Shaq gets emotional welcome back from TNT crew after sister's death Shaq had been away after his sister, Ayesha Harrison-Jex, died from cancer at age 40.",0.1995239484781956,0.2595273314431527,0.22952563996067415,0.23952620378816702
N63411,lifestyle,lifestyleroyals,Meghan Markle's Leather Pencil Skirt is a Powerful Statement Piece Meghan Markle stepped out for an important guest panel appearance in a maroon long-sleeved top with an eye-catching red leather pencil skirt.,0.1995239484781956,0.2595642389060394,0.2295440936921175,0.23955080876342483
N25604,sports,basketball_nba,Warriors' Russell ejected for going after official D'Angelo Russell is not having the best start to the new phase of his career with the Golden State Warriors.,0.1995239484781956,0.2818352941665749,0.24067962132238524,0.25439817893711514
N13286,entertainment,celebrity,"Will Smith gets friendly with fans, plus more celebs out and about this fall See new photos of your favorite celebrities living life during fall 2019!",0.1995239484781956,0.2766314919764637,0.23807772022732965,0.250928977477041
N53428,news,newspolitics,"Pete Buttigieg Says He Does Not Respect Donald Trump: 'At a Deeper Level I Don't Think He Respects Himself' Democratic candidate Pete Buttigieg went on the offensive against President Donald Trump, saying that Trump has done nothing to command his respect.",0.1995239484781956,0.2880398947593415,0.24378192161876855,0.25853457933229285
N51458,sports,basketball_nba,Lonzo Ball says Pelicans have to 'hold the fort down' until Zion Williamson returns Lonzo Ball is confident that the New Orleans Pelicans have the talent to win games without their leading scorer Zion Williamson.,0.1995239484781956,0.2865037880084463,0.24301386824332094,0.2575105081650294
N24422,sports,football_nfl,Lamar Jackson makes NFL history with huge day in win over Bengals ,0.1995239484781956,0.2789527379373852,0.2392383432077904,0.252476474784322
N35488,sports,basketball_nba,Kevin Durant had a simple reason for why Steph Curry is better than Russell Westbrook There you have it.,0.1995239484781956,0.2851486979883743,0.24233632323328494,0.2566071148183147
N8959,news,newspolitics,"Graham now says Trump's Ukraine policy was too 'incoherent' for quid pro quo A day after saying he wouldn't bother reading transcripts released by House Democrats in the impeachment inquiry into President Trump, Sen. Lindsey Graham, R-S.C., now says he did read the testimony, and his conclusion is that the administration's Ukraine policy was too ""incoherent"" for it to have orchestrated the quid pro quo that is at the heart of the probe.",0.1995239484781956,0.2737365379418756,0.2366302432100356,0.2489990081206489
N10888,sports,basketball_nba,Report: Many NBA executives believe Andre Iguodala will be traded to Lakers The notion that Iguodala is likely to land with the Lakers is so strong that there is a belief in league circles that it could dissuade other teams from engaging in trade dialogue with Memphis.,0.1995239484781956,0.2711022448184396,0.2353130966483176,0.2472428127050249
N4693,lifestyle,lifestylecelebstyle,"8 Times Ciara Was the Sexiest Person on the Red Carpet - or Within 50 Miles - This Year Ciara's red carpet style is automatic, supersonic, hypnotic, funky fresh, and - above all - unbelievably sexy.",0.1995239484781956,0.2747146137744339,0.23711928112631475,0.24965105867568782
N25287,sports,basketball_nba,"Steve Kerr: Steph Curry is 'at his peak physically, mentally' ",0.1995239484781956,0.2764636017670997,0.23799377512264766,0.25081705067079835
N28149,sports,basketball_nba,"After summer moves, Jazz not worried about offensive stumbles to start season We've got to not think the game too much, just go out there and play.  Jeff Green",0.1995239484781956,0.2733430656663933,0.23643350707229446,0.24873669327032744
N119,sports,basketball_nba,"Anthony Davis, LeBron James dominate offensively to lead Lakers past Warriors in preseason bout ",0.1995239484781956,0.2688579954553686,0.2341909719667821,0.2457466464629776
N43608,news,newsus,"Trump, Newsom wildfire clash came days after Newsom lauded president as 'partner' Last week Gov. Newsom thanked the Trump administration for ""moving expeditiously to support our efforts"" fighting fires. That was then, this is now.",0.1995239484781956,0.2763597595645847,0.23794185402139015,0.2507478225357883
N53494,sports,football_nfl,Top takeaways from Sunday's Week 7 NFL action The Atlanta Falcons' season-long struggles continued while the Houston Texans put up a bummer of a performance against the Indianapolis Colts.,0.1995239484781956,0.2799833438524093,0.23975364616530245,0.25316354539433805
N41832,sports,basketball_nba,Curry swishes shots in warm-up sequence at Chase Center The Golden State Warriors will begin a new season in their new arena Chase Center on Thursday night.,0.1995239484781956,0.2702109073997584,0.234867427938977,0.24664858775923748
N52145,sports,basketball_nba,"Anthony Davis' performance against Grizzlies places him among Lakers greats George Mikan. Elgin Baylor. Wilt Chamberlain. Kareem Abdul-Jabbar. Shaquille O'Neal. Now, Anthony Davis. Lakers history is filled with big men who dazzled their fans and terrified opponents, and on Tuesday night Davis joined their exclusive club. They are the only Lakers to have scored at least 40 points in a game in which they also grabbed 20 rebounds. Davis scored 40 points with 20 rebounds ...",0.1995239484781956,0.2731356373424702,0.2363297929103329,0.24859840772104536
N52631,sports,basketball_nba,"Steve Kerr says Warriors' blowout opening loss is no one-off: 'This is reality' The last five years we've been living in a world that isn't supposed to exist, Kerr said after Golden State fell 141-122 to the Clippers.",0.1995239484781956,0.248766834487405,0.2241453914828003,0.23235253915100185
N13480,video,popculture,"Jennifer Aniston on why she joined Instagram: 'I'm just trying to build content' Jennifer Aniston visited Jimmy Kimmel Live!, Wednesday to promote her new Apple series The Morning Show. And while she was there she also talked about her record breaking new Instagram account. As of last night's broadcast, Aniston's account had garnered over 11 million followers in less than two days. She set a new world record, racking up a her first million followers 29 minutes faster than the previous record holders Prince Harry and Megan Markle. While this is her first official instagram account it wasn't her first time on IG. Aniston admitted that she had a fake account prior to making things official. ""It was a stalker account,"" said Aniston, ""When I was thinking about doing this, I sort of figured it was time to kind of understand the world and dip my toe into the social media pool."" When asked why she joined Insta, Aniston replied, ""I don't know."" She also revealed that she does look at other people's Instagram posts. She said, ""I'm just trying to build content, as they say.""",0.1995239484781956,0.2819683959499655,0.24074617221408054,0.2544869134593755
N16710,finance,markets,The value of America's natural resources revealed Ever been curious about how much money is hiding in America's untapped natural resources? We reveal what they're really worth…,0.1995239484781956,0.2607643789496126,0.2301441637139041,0.2403509021258069
N49526,sports,basketball_nba,"James Harden drops 59 points as Rockets edge Wizards in high-scoring duel James Harden would not let the Rockets lose, not a game like this. And all it took was for the Rockets to score 159 points. With no one stopping anyone, with 3s falling and drives ending at the rim, Harden kept scoring and scoring until the Rockets finally got a stop and just enough scoring to finally score just enough. After Russell Westbrook drove to a three-point play after a Harden slam missed, giving the Rockets a lead with 32.4 seconds...",0.1995239484781956,0.2612439176052412,0.2303839330417184,0.24067059456289264
N24578,entertainment,celebrity,"Week in celebrity photos for Oct. 28-Nov. 1, 2019 See what the stars were up to during the last week of October.",0.1995239484781956,0.2777578574698037,0.23864090297399965,0.2516798878059343
N45189,news,newsscienceandtechnology,"Roman chariot and horse fossils are unearthed in Croatia after being buried in a ritual reserved for very wealthy families, archaeologists reveal Archaeologists uncovered the fossils near the city of Vinkovci in eastern Croatia and said this is the first time a burial ritual like this has been discovered in the country.",0.1995239484781956,0.2840586875562944,0.241791318017245,0.2558804411969281
N55141,news,newspolitics,"White House to cancel Times, Post subscriptions after Trump's 'Hannity' comments The White House said Tuesday that it will not be renewing subscriptions to the New York Times and The Washington Post.",0.1995239484781956,0.2780086925566931,0.23876632051744434,0.25184711119719394
N26040,sports,football_nfl,"32 things we learned from Week 7 of the 2019 NFL season As the NFL approaches its midseason point, several contenders are rounding into top form while others are getting desperate.",0.1995239484781956,0.2598841971989072,0.2297040728385514,0.23976411429200334
N18939,sports,basketball_nba,"Charles Barkley: 'At this point, Kawhi's a better player than LeBron' TNT Analyst Charles Barkley said Kawhi Leonard is a better player than LeBron James.",0.1995239484781956,0.2803443556390206,0.2399341520586081,0.2534042199187456
N7534,sports,basketball_nba,Magic Johnson uses MJ's Steph Curry statement to make tampering joke Los Angeles Lakers legend Magic Johnson is free to tweet from Game 1 until the end of the season and we are here for it.,0.1995239484781956,0.2843090503656735,0.24191649942193455,0.2560473497365142
N49689,news,newspolitics,"Democrats confront the prospect of a long primary Joe Biden and Elizabeth Warren are holding steady, Bernie Sanders is bouncing back from his heart attack and Pete Buttigieg is springing to life in Iowa.",0.1995239484781956,0.2722562988602193,0.23589012366920745,0.2480121820662114
N33727,news,newspolitics,"Why Pete Buttigieg's moment could last well past the debate The Indiana mayor has the money, the staff, the data, and the endorsements to rapidly expand his reach.",0.1995239484781956,0.2762766509824648,0.2379002997303302,0.25069241681437504
N11405,finance,finance-companies,"Boeing says up to 50 planes grounded globally over cracks Crisis-hit Boeing faced fresh safety concerns Thursday, as the firm admitted cracks were found in up to 50 of its popular 737NG planes following worldwide inspections.",0.1995239484781956,0.198054558891254,0.1987892536847248,0.19854435542023452
