ID,category,sub_category,content,collaborative_rec,content_rec,mean,two_one
N36532,weather,weathertopstories,Winds fan ferocious fires in Australia's most populous state Ferocious wildfires were burning at emergency-level intensity across Australia's most populous state and into Sydney's suburbs on Tuesday as authorities warned most people in their paths that there was no longer time to flee.,1.0,0.2463461183427561,0.623173059171378,0.49756407889517074
N14592,entertainment,entertainment-celebrity,"Chrissy Teigen's weekend was basically a clapback double-header, plus more news Chrissy Teigen gives us two more lessons in the art of the clapback. Plus, more celebrity news for Nov. 12, 2019.",1.0,0.2587933542768001,0.6293966771384001,0.5058622361845334
N26944,news,newsus,"Jeffrey Epstein's Estate May Set Up a Program to Pay Accusers Lawyers for Jeffrey Epstein's estate are considering setting up a program to resolve claims filed by women who say they were abused by the financier, who killed himself in August while facing federal sex trafficking charges. The plan was disclosed in a court filing on Tuesday by a lawyer for one of Mr. Epstein's accusers, who is suing the estate in federal court in Manhattan. The filing said lawyers for Mr. Epstein's estate had informed...",1.0,0.2811979043802224,0.6405989521901112,0.5207986029201482
N64745,sports,baseball_mlb,"With latest sign-stealing revelations, Houston Astros once again toe baseball's ethical lines Accused of electronically stealing signs in 2017, the Astros organization faces even more questions about its culture.",1.0,0.2734521060871513,0.6367260530435757,0.5156347373914342
N58241,finance,markets,"The Dow was perfectly unchanged on Tuesday, a rare occasion on Wall Street The 30-stock average closed flat going out at least six decimal places. It was the first unchanged close for the Dow since April 24, 2014.",1.0,0.2754867615229854,0.6377433807614927,0.5169911743486569
N26706,news,newsus,Missing California hiker found dead at top of glacier just weeks before baby was due A missing hiker from Huntington Beach California was found dead on Thursday at the top of the Darwin glacier in the Inyo National Forest.,1.0,0.2639191548839401,0.6319595774419701,0.5092794365892934
N51808,news,newspolitics,"Democrats' impeachment lawyer cut his teeth prosecuting mobsters, Wall Street cheats Daniel Goldman will lead witness questioning during the hearings that begin Wednesday.",1.0,0.291261679535656,0.645630839767828,0.527507786357104
N37320,news,newspolitics,"Pro-Trump conservatives are getting trolled in real life by a far-right group Groypers, as they call themselves, fuse online political extremism with stunts at conservative events.",1.0,0.2690767608018602,0.6345383804009301,0.5127178405345735
N47099,foodanddrink,tipsandtricks,"This Korean Ingredient Makes Your Chili Taste Amazing As in, more amazing than it already is.",1.0,0.2993947200753017,0.6496973600376509,0.5329298133835345
N12995,news,newsus,"Cows swept out to sea by Hurricane Dorian are found months later   on the Outer Banks CHARLOTTE, N.C. - Cape Lookout National Seashore on the Outer Banks has discovered three cows are roaming the national park, and it is believed they got there by swimming four to five miles across the Core Sound during Hurricane Dorian. All three were living on Cedar Island when the hurricane generated a ""mini tsunami"" on Sept. 6, sweeping much of the wildlife off the island, including 28 wild ...",1.0,0.2340999848851594,0.6170499924425797,0.4893999899234396
N49030,movies,movies-celebrity,"Kevin Hart Steps Out for Date Night With Wife Amid Recovery From Car Accident Kevin Hart is in better spirits following the violent car crash that left him hospitalized in September. Last night, he was spotted out with his wife for date night in Los Angeles.",1.0,0.2663202873338932,0.6331601436669466,0.5108801915559288
N40065,sports,more_sports,"The Day in Sports: Sunday, November 10, 2019 The Day in Sports: Sunday, November 10, 2019",1.0,0.2875541311713272,0.6437770655856636,0.5250360874475515
N29196,health,health-news,"Florida boy's mock CPR drill goes viral: 'How cute is this!' The saying ""the apple doesn't fall far from the tree"" rings very true for a 3-year-old Florida boy who apparently wants to be just like his father, a first responder.",1.0,0.2472596641990111,0.6236298320995055,0.49817310946600735
N22417,travel,travelarticle,Divers salvage 100-year-old liquor from WWI shipwreck A team of ocean explorers says it has retrieved cognac and liqueur from a ship that was bound for Russia when it was sunk by a German submarine in 1917.,1.0,0.2160743455777597,0.6080371727888798,0.4773828970518398
N35131,finance,markets,"The world's largest trade deal could be signed in 2020 RCEP involves all 10 ASEAN countries and five of the bloc's major trading partners: Australia, China, Japan, New Zealand and South Korea.",1.0,0.300464025846983,0.6502320129234915,0.5336426838979886
N48064,news,newsworld,"Why Ukraine and Russia are still at war A long and draining war in eastern Ukraine has become embroiled in President Trump's attempts to undermine his opponents at home. But the war is real and still taking lives, and a way to end it will be very difficult to find.",1.0,0.2449630276899486,0.6224815138449743,0.4966420184599657
N13341,news,newsus,"Rising temperatures put U.S. troops at risk during training, report finds By midcentury, troops could face an extra month of heat-index temperatures above 100 F every year, the Union of Concerned Scientists found.",1.0,0.2640332862034691,0.6320166431017346,0.509355524135646
N47248,finance,markets,"Fed's Powell sees steady growth, signals pause in rate cuts Federal Reserve Chairman Jerome Powell expects the U.S. economy to continue growing at a solid pace, though it still faces risks from slower growth overseas and trade tensions.",1.0,0.2939617109246508,0.6469808554623254,0.5293078072831006
N13907,finance,finance-saving-investing,4 reasons you shouldn't max out your 401(k) Making high-dollar contributions to your 401(k) can cost you.,1.0,0.2895505879118202,0.6447752939559102,0.5263670586078801
N31679,entertainment,celebrity,Biggest celeb weddings of the last decade Take a look back at the most memorable and extravagant celeb weddings that went down in the 2010s.,1.0,0.2601159645354338,0.6300579822677169,0.5067439763569559
N56193,sports,football_nfl,Cowboys have questionable red zone calls in loss to Vikings ,1.0,0.2523477930594304,0.6261738965297152,0.5015651953729536
N61320,lifestyle,lifestyleroyals,Kate Middleton Wore a Simple Black Dress and Embellished Headband to the Festival of Remembrance The Duchess of Cambridge and the rest of the royal family are honoring those who have died in battle this weekend.,1.0,0.260888979664689,0.6304444898323445,0.5072593197764593
N36436,news,newsphotos,"The 12 Texas cities everyone in the country is moving to Texas' largest cities were at the top of the list, as well as Midland, a major hub of the fracking boom.",1.0,0.2655441131192431,0.6327720565596215,0.5103627420794954
N51587,travel,traveltripideas,"The 24 Most Beautiful Castles in Europe Eat your heart out, Disney.",1.0,0.2649259948467126,0.6324629974233563,0.5099506632311417
N64560,sports,basketball_nba,"Report: Knicks' brass will stay on if team shows 'progress' this season The New York Knicks' front office appears to be safe for now. Owner James Dolan met with president of basketball operations Steve Mills and others in management on Monday. The Knicks' brass left with the impression that their jobs would be secure as long as the team ""showed progress"" this season, league sources told SNY's Ian Begley. However, it's unclear what Dolan deems as ""progress,"" reports Begley. Mills and general manager Scott Perry are...",1.0,0.2803933628061423,0.6401966814030712,0.5202622418707615
N33677,tv,tv-celebrity,Marie Osmond 'chipped off a piece' of her kneecap when she fell on stage during performance Marie Osmond reveals that she chipped her knee when she fell during her Las Vegas residency performance last week.,1.0,0.2558977529088682,0.6279488764544341,0.5039318352725788
N57327,lifestyle,lifestylebuzz,Please Don't Yell at Your Dog! A new study shows it can cause long-term psychological impacts.,1.0,0.2900765036130293,0.6450382518065146,0.5267176690753528
N41578,lifestyle,lifestyleroyals,Meghan Markle Chose a Chic Black Ensemble for Remembrance Sunday Services She paired her outfit with a bold hat and a crimson poppy pin.,1.0,0.2775390619126666,0.6387695309563333,0.5183593746084444
N49712,news,newsgoodnews,"Wisconsin bus driver saves children wandering in snow, as deadly Arctic air mass grips US As bitter cold took hold across the Midwest earlier this week, a sharp-eyed bus driver in Wisconsin was credited with helping rescue two children who were very underdressed for the weather conditions.",1.0,0.2238799127928086,0.6119399563964043,0.4825866085285391
N58020,foodanddrink,beverages,Brooklyn Brewery Shows Craft Beer Can Be Nonalcoholic Too Special Effects hits all the notes of a craft brew with none of the alcohol,1.0,0.2632421875469677,0.6316210937734839,0.5088281250313118
N4913,finance,finance-companies,Don't be fooled: Costco says $75 coupon is a scam Wholesale retailer Costco is warning customers about a new scam that is promising shoppers a $75 coupon.,1.0,0.2882915976932181,0.644145798846609,0.5255277317954787
N43670,sports,basketball_nba,"Draymond criticizes official for ejection: 'Don't tell me not to talk' Golden State Warriors forward Draymond Green made Chase Center history during Monday's loss to the Utah Jazz, becoming the first player ejected from a game in the new venue after arguing with an official. The three-time All-Star was given a second technical foul for continuing to plead his case after disagreeing with a blocking call, but it seems Green's spat with the official went beyond just that foul. ""I disagreed with that call,"" Green told...",1.0,0.2659987705105169,0.6329993852552585,0.5106658470070112
N58553,lifestyle,lifestyleroyals,"Prince Harry and Meghan Markle Will Reportedly Visit Oprah While in California During their six-week break from their royal duties, Prince Harry and Meghan Markle are planning to visit Oprah Winfrey, according to a royal insider.",1.0,0.2778360501478435,0.6389180250739217,0.518557366765229
N9652,finance,finance-real-estate,"NYC is selling 'air rights' to city housing buildings, first big deal goes to de Blasio donors It may not be a bridge, but the city has something to sell you in Brooklyn   and donors to Mayor de Blasio are first in line to benefit. In what appears to be a textbook ""pay-to-play"" move, the city is selling NYCHA development rights to builders who gave de Blasio's campaigns more than $20,000.",1.0,0.2498878940942026,0.6249439470471013,0.49992526272946836
N38309,tv,tv-celebrity,Joe Giudice Says It Was 'Painful' Watching Real Housewives of New Jersey from Prison Joe Giudice Says It Was 'Painful' Watching RHONJ from Prison,1.0,0.2782121285109822,0.6391060642554911,0.5188080856739881
N15855,lifestyle,lifestyleroyals,"A body-language expert says Meghan Markle is ""politely disconnecting"" from the public, and honestly, we would too Can we blame her? Meghan Markle is supposedly ""politely disconnecting"" from the public as seen in her body language, and girl, you do you.",1.0,0.2696327038850213,0.6348163519425106,0.5130884692566808
N7821,sports,football_nfl,"'Monday Night Football' commentator under fire after belittling criticism of 49ers kicker for missed field goal Joe Tessitore called out 49ers kicker Chase McLaughlin after he shanked a potential game-winning kick in San Francisco, and some fans weren't happy.",1.0,0.2609598154854814,0.6304799077427408,0.5073065436569876
N241,finance,finance-companies,"Are Stores Open on Veterans Day? Target, Aldi, Walmart and More Will shoppers be able to make the most of Veterans Day deals this public holiday?",1.0,0.2796629653115006,0.6398314826557503,0.519775310207667
N46477,movies,movienews,Mark Ruffalo Wants to Set Up Jennifer Aniston on a Date Mark Ruffalo Wants to Set Up Jennifer Aniston on a Date,1.0,0.2784482325930457,0.6392241162965229,0.5189654883953638
N19376,sports,basketball_nba,The HoopsHype Daily: Trae Young putting up monstrous numbers ,1.0,0.2819456108349359,0.6409728054174679,0.5212970738899573
N35850,news,newsus,U.S. Judge Blocks 'Suspicionless' Searches of Phones at Borders A federal judge rejected a Trump administration policy allowing agents at U.S. border crossings and airports to arbitrarily search the phones and laptops of international travelers.,1.0,0.2595717259738798,0.62978586298694,0.5063811506492532
N25406,autos,autossuvs,We Test the 2020 Jeep Wrangler EcoDiesel Jeep's diesel engine turns a great off-roader into something special.,1.0,0.2580706647207158,0.6290353323603579,0.5053804431471438
N36703,lifestyle,lifestylecelebstyle,Photos of Celebrities at the Airport Are Here to Inspire Your Holiday Travel Style Even the rich and famous aren't spared the most annoying place in the world: the airport.,1.0,0.2287958560003857,0.6143979280001929,0.48586390400025714
N44818,sports,football_nfl,Redskins name rookie Dwayne Haskins starter for rest of season ,1.0,0.2749326036694706,0.6374663018347353,0.516621735779647
N51896,health,fitness,"Watch the 'Footloose' Dance Warmup That Gets These High Schoolers Ready to Race They tear up the course before, well, tearing up the course.",1.0,0.2705959247241559,0.6352979623620779,0.5137306164827706
N36252,finance,markets,Oil rises after OPEC's Barkindo says U.S. shale growth may slow in 2020 Oil rises after OPEC's Barkindo says U.S. shale growth may slow in 2020,1.0,0.2825792461076083,0.6412896230538041,0.5217194974050722
N52600,finance,finance-companies,"Saudi Aramco takes another step toward 1st public offering DUBAI, United Arab Emirates (AP)   Saudi Arabia's state-owned oil giant Aramco revealed it will sell up to 0.5% of its shares to individual investors, but in a lengthy document published late Saturday it did not disclose how much of the company will be floated when it goes public on the country's domestic exchange.",1.0,0.2846753857240156,0.6423376928620078,0.5231169238160104
N54161,news,newsus,"Berliners tried to send Trump a piece of the Berlin Wall with a message saying 'no wall lasts forever' The 2.7-ton chunk of concrete arrived in Washington, DC, on Saturday, and local media outlets reported that the Secret Service turned it away.",1.0,0.2398536736504761,0.6199268368252381,0.49323578243365074
N60408,weather,weathertopstories,"Over 20 inches of snow for some Michigan communities in 24 hours! Significant amounts of snow fell within a meandering lake-effect snow band overnight into Tuesday morning across parts of the southwestern Lower Peninsula of Michigan, resulting in up to and over 2 feet in some locations... and that's where AccuWeather's Blake Naftel took in some of the snowy spectacles as people begun to dig out.",1.0,0.2550714698424898,0.6275357349212449,0.5033809798949932
N25138,sports,football_ncaa,"College Football Playoff picture: 4 in, 2 out, 5 to watch Sporting News takes a look at the College Football Playoff picture heading into Week 12 of the season.",1.0,0.2936849058517616,0.6468424529258808,0.529123270567841
N63550,lifestyle,lifestyleroyals,Why Kate & Meghan Were on Different Balconies for Remembrance Sunday There's no scandal here. It's all about the order of precedence.,1.0,0.2590791976065233,0.6295395988032617,0.5060527984043488
N36621,news,newspolitics,Mulvaney's move to join impeachment testimony lawsuit rankles Bolton allies Former national security adviser John Bolton views the acting White House chief of staff as a key participant in the administration's effort to pressure Ukraine.,1.0,0.2792855947141478,0.639642797357074,0.5195237298094318
N15506,news,newsworld,"Trump 'so extreme' on climate he's waking people up, Greta Thunberg tells AFP Swedish teen activist Greta Thunberg said Tuesday that US President Donald Trump's climate change denialism was ""so extreme"" that it had helped galvanize the movement to halt long term planetary warming. The venue was originally in Chile but was shifted because of political unrest, forcing Greta to change her travel plans.",1.0,0.2408824810127391,0.6204412405063695,0.49392165400849275
N54482,lifestyle,lifestylebuzz,"Mixed-race mother reveals strangers question whether she's related to her fair-skinned daughter - including a suspicious church-goer who asked the girl: 'Is this your Mummy?' Davina Moon, 32, from Surrey, who has a mixed heritage including Sri Lanka and Ireland, told how society often treats her differently because she doesn't look like her children.",1.0,0.2638343189376775,0.6319171594688388,0.509222879291785
N30071,news,newspolitics,"Trump juggles statecraft and impeachment on a historic day Projecting unusual calm in the middle of a political firestorm, President Donald Trump pleaded ignorance Wednesday about the first public impeachment hearing, unexpectedly insisting that he really wasn't paying attention to sworn testimony in the House Intelligence Committee that could determine whether he serves out his term in office. The disclaimer might be more credible if ...",1.0,0.2511794581854466,0.6255897290927233,0.5007863054569643
N61145,foodanddrink,tipsandtricks,Stop! Read This Guide Before You Buy an Air Fryer. Shopping for air fryers? Or maybe air fryer toaster ovens? Our air fryer buying guide will help you find the perfect appliance for your needs.,1.0,0.3030412706187585,0.6515206353093792,0.5353608470791723
N37204,health,health-news,"Model, 23, Didn't Know She Was Pregnant Until She Gave Birth to a Full-Term Baby in Her Bathroom An Australian model recently had a life-changing surprise when she gave birth to a baby in her bathroom, despite not knowing that she had been carrying her daughter for nine months.",1.0,0.2429799810506862,0.621489990525343,0.4953199873671241
N46751,news,newscrime,"Mom named person of interest in 5-year-old girl's disappearance The search for Taylor Rose Williams, 5, began in Jacksonville on Wednesday.",1.0,0.2848398058179083,0.6424199029089541,0.5232265372119389
N496,music,cma-awards,"Fashion hits and misses from the 2019 Country Music Association Awards From Nicole Kidman to Pink, see the best and worst dressed stars at the 2019 Country Music Association Awards.",1.0,0.2815776965046198,0.6407888482523099,0.5210517976697465
N64685,music,music-celebrity,"Jennifer Lopez shares her #MeToo experience at costume fitting: 'I stood up for myself' Jennifer Lopez recalled an uncomfortable situation earlier in her career when a ""director at a fitting asked me to take my top off.""",1.0,0.2609046018577797,0.6304523009288898,0.5072697345718531
N7041,health,health-news,Dad bans lollipops after 5-year-old son nearly choked to death The boy was sitting near his mother when he began making choking noises.,1.0,0.2700251657714089,0.6350125828857045,0.5133501105142726
N53585,tv,tvnews,"Rip Taylor's Cause of Death Revealed, Memorial Service Scheduled for Later This Month The comedian died at the age of 84 last month.",1.0,0.2960290257183325,0.6480145128591662,0.530686017145555
N24898,autos,autosbuying,"The lightest sports cars you can buy for under $30,000 Power-to-weight ratios matter, and what these sports cars lack in horsepower they more than make up for in their abilities to attack the roads with venom.",1.0,0.2934386833969794,0.6467193416984898,0.5289591222646529
N47851,travel,traveltripideas,The Top Winter Wonderlands You Should Visit This Holiday Find the best alpine views at these wintry destinations.,1.0,0.259220269393525,0.6296101346967625,0.50614684626235
N39389,lifestyle,lifestylebuzz,"Dog Rips The Tail Off Every Single One Of His Toy Pigs Tim Eberts When Diesel's parents first brought him home a cute little stuffed pig toy, they had no idea just how much the husky was going to love it.",1.0,0.2647275256580339,0.632363762829017,0.5098183504386893
N57097,news,newsus,Last known Pearl Harbor survivor in Mass. dies at 98 Massachusetts' last known survivor of the Japanese attack on Pearl Harbor that drew the United States into World War II died Tuesday at 98.,1.0,0.2458298287342927,0.6229149143671464,0.4972198858228618
N39844,sports,basketball_ncaa,"James Wiseman eligibility: Explaining the NCAA questions on Penny Hardaway, Memphis star Everything you need to know about James Wiseman's eligibility case at Memphis and what it means for him, the Tigers' basketball team and the NCAA going forward.",1.0,0.2929728596939825,0.6464864298469912,0.5286485731293217
N15307,sports,basketball_nba,"10 most stunning early trends around the NBA Youngsters Luka Doncic and Pascal Siakam are taking their games to new heights, while a former No. 1 overall pick is doing his best to shed the ""bust"" label.",1.0,0.2500608956299104,0.6250304478149552,0.5000405970866069
N48578,news,newsgoodnews,"Deer stranded 5 miles offshore saved by Maine lobstermen A group of Maine lobstermen spotted a deer in an unusual place Monday: open waters. The men quickly took action to save the animal, which had somehow ventured 5 miles away from shore, and hauled their catch of the day to safety.",1.0,0.223797979151613,0.6118989895758065,0.4825319861010753
N29839,lifestyle,lifestylehomeandgarden,"Simple Solutions to Help You Get Rid of Ants for Good Kick pesky ants out of your house and back to their colony with these easy, expert-approved tricks.",1.0,0.3010399955731014,0.6505199977865507,0.534026663715401
N17896,autos,autossuvs,"Should Chevy Bring This Three-Row Blazer to the U.S.? It's set to go on sale in China soon, but we could see this bigger Blazer doing well in America, too.",1.0,0.249129914838853,0.6245649574194265,0.499419943225902
N47205,news,newspolitics,"Whistleblower never met or talked with Schiff - source The whistleblower who prompted an impeachment inquiry into U.S. President Donald Trump never met or spoke with congressman Adam Schiff, the Democrat leading impeachment hearings in Congress, a source familiar with the whistleblower's contacts said.",1.0,0.2740964196788551,0.6370482098394276,0.5160642797859034
N57591,lifestyle,lifestyleroyals,Prince Charles Is Getting Into the Fashion Business The Prince's Foundation is partnering with the Yoox Net-a-Porter Group on a sustainable 17-piece collection.,1.0,0.2672461882396484,0.6336230941198242,0.5114974588264323
N64258,news,newspolitics,"Trump impeachment hearing spurs shadow spin war The online spin began even before Wednesday's impeachment hearing got underway. Moments before House Intelligence Committee Chairman Adam Schiff could welcome witnesses to the first public hearing of the impeachment inquiry, President Donald Trump took to Twitter to dismiss the ""New Hoax. Same Swamp."" Former Obama administration aides-turned-podcasters dissected the hearings in real time. They broadcast their running...",1.0,0.2582857515244769,0.6291428757622385,0.5055238343496513
N56061,sports,football_nfl,9 things we learned from Sunday's games of Week 10 of NFL season ,1.0,0.2628818939503079,0.631440946975154,0.5085879293002052
N36807,weather,weathertopstories,"Timelapse Shows Snow Dusting Central New Hampshire A ""wintery mix"" of snow, ice, and rain moved across much of New Hampshire on Tuesday, November 12, local meteorologists said. Rain and freezing rain early Tuesday gave way to a period of light snow as colder air rushed in, WMUR said. This timelapse   filmed from 1 pm on Monday to 12 pm on Tuesday   shows snow falling and repeatedly dusting a parking lot in Plymouth, New Hampshire. Gunnar Consol, who filmed the video, said about an inch or two accumulated in Plymouth by Tuesday. Credit: @GunnarConsolWx via Storyful",1.0,0.2595266570904544,0.6297633285452272,0.5063511047269695
N58133,news,newspolitics,"George Kent, top State Department Ukraine expert, helps Democrats debunk GOP theories Kent testified that there is no evidence Ukraine interfered in the 2016 election and said Joe Biden's pressure on Ukrainian officials was not the same as President Trump's.",1.0,0.2582986838907777,0.6291493419453889,0.5055324559271851
N60619,news,newspolitics,"Republicans shrug off impeachment hearings as 'boring' Heading into Wednesday's first public impeachment hearing, Republicans had argued the facts weren't there to impeach President Donald Trump. And they complained the proceedings were taking place behind closed doors.",1.0,0.2803276366525348,0.6401638183262675,0.5202184244350232
N60932,tv,tv-celebrity,Lamar Odom's Son Was ''Hurt'' After Finding Out About His Dad's Engagement on Instagram Lamar Odom's son admits that he was ''hurt and caught off guard'' after finding out about his dad's engagement to Sabrina Parr on Instagram.,1.0,0.2955394032725985,0.6477697016362992,0.5303596021817323
N30135,news,newsgoodnews,"Tennessee judge holds lawyer's baby as he swears her into the state bar in viral video Tennessee Court of Appeals Judge Richard Dinkins is going viral after a video showed him swearing in a new lawyer last week while holding her baby.In footage making the rounds online, Dinkins could be seen lightly bouncing the baby on his hip while he administered the oath to Juliana Lamar, the mother of the 1-year-old child who recently graduated from Belmont University College of Law, according to BuzzFeed News.Y'all. Judge Dinkins of the...",1.0,0.2643944325324646,0.6321972162662323,0.5095962883549764
N26025,news,newspolitics,"Bannon calls Pelosi's impeachment strategy ""actually quite brilliant"" Bannon, the former White House chief strategist, called Pelosi a ""master at political warfare""",1.0,0.2796458705618313,0.6398229352809157,0.5197639137078875
