ID,category,sub_category,content,collaborative_rec,content_rec,mean,two_one
N40373,news,newscrime,Ex-model accuses Jeffrey Epstein's friend of rape Several women have come forward in recent weeks with allegations against a model agent that span three decades,0.1624721695840799,0.2571718499863896,0.20982200978523474,0.22560528985228634
N48621,finance,personalfinance,"The 25 richest families in America Stacker compiled a list of the 25 richest American families using 2019 data from Forbes. From winemakers to oil tycoons, find out which American families have a combined net worth of more than $721.5 billion.",0.1624721695840799,0.2499865931444915,0.2062293813642857,0.2208151186243543
N11885,sports,football_nfl,"Something fishy happened in that Texans-Chiefs call There was no pool report, no video from Al Riveron. And there likely will be no public admission regarding the conversation(s) that resulted in a key defensive pass interference foul being wiped out in the Texans-Chiefs game. But something fishy happened, as evidenced by the images broadcast by CBS. It occurred with the Chiefs leading [more]",0.1624721695840799,0.260248332237469,0.21136025091077446,0.22765627801967264
N65204,movies,movies-celebrity,See Vin Diesel's 21st birthday post to Paul Walker's daughter Meadow The Fast & Furious franchise star has remained close to close to Paul's daughter following his death six years ago this month.,0.1624721695840799,0.248628697653701,0.20555043361889044,0.21990985496382728
N47175,sports,basketball_nba,Report: Adidas working on buyout of $25 million John Wall deal amid injuries ,0.1624721695840799,0.2330275211335005,0.1977498453587902,0.20950907061702695
N23784,music,music-gallery,"35 musicians you should see live at least once in your life If you have a chance to see these musicians live, you absolutely need to take the chance and grab a ticket.",0.1624721695840799,0.2785620823470792,0.22051712596557954,0.23986544475941274
N60985,sports,football_nfl,"Ex-NFL player Winslow Jr takes plea deal before rape retrial VISTA, Calif. (AP)   Former NFL player Kellen Winslow Jr. pleaded guilty Monday to raping an unconscious teen in 2003 and to sexual battery involving a 54-year-old hitchhiker in a deal that spared him the possibility of life in prison. Winslow initially hesitated and seemed to agonize over his decision. ""I'm sorry. I'm just not thinking very clearly,"" Winslow told the judge at one point. He asked the judge for more time before he finally entered...",0.1624721695840799,0.2607549143336305,0.2116135419588552,0.22799399941711362
N34167,health,fitness,"I Took the 30-Day Squat Challenge and Here's What Happened I completed more than 3,000 squats, which is at least 2,900 more than I would have normally done.",0.1624721695840799,0.3074960776757005,0.23498412362989018,0.2591547749784936
N50372,entertainment,celebrity,Celebrity mug shots Check out the best celebrity mug shots of all time!,0.1624721695840799,0.2435227847161114,0.20299747715009564,0.21650591300543423
N36387,news,newscrime,Pasadena substitute teacher accused of sexually assaulting student for two years A Pasadena ISD substitute teacher is accused of having an improper relationship with a student at Sam Rayburn High School.,0.1624721695840799,0.2825200986481799,0.2224961341161299,0.2425041222934799
N40785,news,newscrime,"Mother Is Freed After 15 Years in Prison for Father's Abuse A domestic violence survivor in Oklahoma walked free from prison on Friday, according to a corrections spokeswoman, after spending 15 years behind bars for failing to report that her boyfriend was also abusing their children.",0.1624721695840799,0.2538191635999801,0.20814566659203,0.22337016559468
N20680,sports,football_nfl,Saints DBs mocked Bears RB Tarik Cohen for being short during heated argument Things go personal in Chicago.,0.1624721695840799,0.2697403420015044,0.21610625579279213,0.23398428452902953
N25114,lifestyle,lifestylebuzz,"There's a mouse hiding among mushrooms in this viral brainteaser. Can you spot it? Artist Gergely Dudás expertly hides hard-to-find objects in his vibrant illustrations, creating viral brainteasers that stump the internet.",0.1624721695840799,0.2391581052282497,0.2008151374061648,0.2135961266801931
N59496,sports,football_nfl,"Week 7 winners, losers: Aaron Rodgers now in MVP race; Mitchell Trubisky looks lost Aaron Rodgers' big game vaults him into the MVP race. Meanwhile in Chicago, it might be time for the Bears to reconsider Mitchell Trubisky's future.",0.1633216507291379,0.2699213422934426,0.21662149651129026,0.23438811177200772
N4486,news,newsus,"Florida air show crash: Pilot killed when plane crashes An airplane crashed Friday afternoon at an air show in Florida, killing the pilot, Martin County Sheriff William Snyder said.",0.1634051149016935,0.2675422815789026,0.21547369824029805,0.23282989268649956
N5445,weather,weathertopstories,"Wild fall freeze: Utah falls close to minus-35 as West shivers, while bitter cold oozes east Denver could start Halloween morning near 0 degrees.",0.163497658861864,0.2410612927387636,0.2022794758003138,0.21520674811313037
N44559,health,health-news,Photo of emotional nurse after 'particularly hard day' goes viral Her sister revealed that she had just wrapped up four days worth of work that included assisting in the delivery of a stillborn baby.,0.1635802053125588,0.2587094513831489,0.21114482834785384,0.2269997026929522
N39235,news,newscrime,"Florida woman allegedly flees 2 car crashes, kills driver in 3rd crash A Florida woman who killed a 53-year-old man after running a red light and smashing into his Lexus on Saturday morning was in the process of fleeing two earlier car accidents when she caused the fatal collision, police said.",0.1638999728791249,0.2603104200939271,0.21210519648652598,0.22817360435565967
N22545,foodanddrink,foodnews,"The Search for a Gender Neutral Drive Thru Toy When families are asked whether a kid's meal is for a boy or girl, it means kids get toys based on stereotypes not their actual interests. Is it time to rethink drive-thru toys?",0.164331358317782,0.2492818058781096,0.2068065820979458,0.22096499002466707
N28624,foodanddrink,foodnews,"When I moved from China to the US, eating out became so much more expensive I had to break the habit. Here's how I did it. Instead of feeling like I was depriving myself, I set out to manage my restaurant addiction by figuring out how to recreate what I loved about them.",0.164331358317782,0.2370372324149225,0.20068429536635224,0.212801941049209
N62209,foodanddrink,foodnews,"Popeyes mocks Chick-fil-A for National Sandwich Day blunder, reignites sandwich wars Popeyes is mocking Chick-fil-A as the chicken sandwich wars heat up once again before National Sandwich Day.",0.164331358317782,0.2313754355685499,0.19785339694316595,0.20902740981829393
N61813,sports,football_nfl,"Redskins' Williams reveals cancer scare, explains holdout ASHBURN, Va. (AP)   Washington Redskins tackle Trent Williams revealed a cancer diagnosis that played a part in his lengthy holdout and distrust of the team's medical staff and the organization. Williams on Thursday said he told the team of the medical issue six years ago, and the growth on his head grew substantially over time. The 31-year-old said he had a tumor removed from his skull and needs to get checked out every six months to make sure...",0.164331358317782,0.2723908197997466,0.2183610890587643,0.23637099930575842
N33571,foodanddrink,recipes,"The Braised Onion Pasta I Only Make for People I Love There are, for me, two kinds of recipes, one for each mood: The first kind is quick and easy, like the 30-minute lemon chicken I make when I come home from work hungry and don't want to think too hard about what I'm feeding myself. The second is for when I'm feeding someone else, usually something special I'm excited to share; these take more time, and just a little bit more care. Like this braised onion pasta, which takes at least two hours to...",0.164331358317782,0.2742117910262954,0.2192715746720387,0.2375849801234576
N32208,foodanddrink,foodnews,"A Seattle man broke into an office building, ate $200 worth of chocolate, and collapsed in a sugar coma When security arrived, they found the man sprawled out on an office coach stripped of his jacket and shoes.",0.164331358317782,0.2395232584583886,0.2019273083880853,0.21445929174485306
N51810,foodanddrink,newstrends,"The Gooey Sticky Buns of Hit Boston Bakery, Flour, Pop Up in NYC Saturday Plus, Peter Luger's zero-star review is now a Broadway punchline   and more intel",0.164331358317782,0.2211134913146056,0.19272242481619378,0.20218611364899772
N21899,foodanddrink,tipsandtricks,Here's How to Correctly Store Potatoes to Keep Them Fresh Potatoes are a staple food in most people's diets for good reason.,0.164331358317782,0.2745498136184949,0.21944058596813845,0.23781032851825726
N60956,lifestyle,shop-holidays,"What to Buy the Guy Who Is Impossible to Shop For Indulgences, gadgets, and the things he might never splurge for on his own top our list of gifts for the guy who is impossible to shop for. The post What to Buy the Guy Who Is Impossible to Shop For appeared first on Reader's Digest.",0.164331358317782,0.3028180394550065,0.23357469888639426,0.25665581240926505
N4614,foodanddrink,foodnews,"Orange vs. White Cheddar Cheese: What's The Difference, Anyway? Americans love cheese, and we're eating more of it than ever: about 37 pounds per year per capita, in fact, more than double what we ate four decades ago, according to the U.S. Department of Agriculture.",0.164331358317782,0.2659677612398458,0.2151495597788139,0.2320889602658245
N55064,news,newspolitics,"Trump Taxes: Appeals Court Rules President Must Turn Over 8 Years of Tax Returns A federal appeals panel said on Monday that President Trump's accounting firm must turn over eight years of his personal and corporate tax returns to Manhattan prosecutors, a setback for the president's attempt to keep his financial records private.",0.164331358317782,0.287218706501569,0.2257750324096755,0.24625625710697333
N58090,sports,football_nfl,"Frustrated Antonio Brown has active morning on Twitter Receiver Antonio Brown continues to wait for his next opportunity, and he continues to be justifiably frustrated by the fact that the NFL's slow-moving investigation is essentially keeping Brown suspended without pay.",0.1647677739515428,0.2759465602635399,0.22035716710754136,0.23888696482620755
N57737,news,newsus,"Missing Minnesota boy, 6, and his dog, found in cornfield by drone with thermal camera A missing 6-year-old boy from Minnesota and his dog were found Wednesday after hundreds of volunteers   including one who used his own drone with a thermal camera   searched for him for hours.",0.1648083933745928,0.253733791892566,0.2092710926335794,0.22409199238657493
N995,foodanddrink,restaurantsandnews,10 of the best fast-food burger chains across the US Fast-food spots like Shake Shack and In-N-Out sell fresh burgers that keep customers coming back for more.,0.1652957565160775,0.1991325722376629,0.1822141643768702,0.18785363366380112
N58801,sports,golf,"Greg Norman upset Tiger Woods didn't respond to his handwritten letter: ""Maybe Tiger just dislikes me"" Greg Norman tells Men's Health he hand delivered a letter to Tiger Woods following his Masters win in April, but never got a reply.",0.1654422473174036,0.2730288170545789,0.21923553218599123,0.23716662714218711
N65169,news,newsus,"Ohio voters express angst over impeachment Support for impeachment may be on the rise, but the view from central Ohio is strikingly complicated and nuanced.",0.1654422473174036,0.2859593938740357,0.22570082059571964,0.24578701168849165
N28257,news,newspolitics,"Meghan McCain confronts Trump Jr.: 'You and your family have hurt a lot of people' Donald Trump Jr., the president's son, defended his family after ""View"" co-host Meghan McCain suggested they were responsible for the lack of ""character"" in American politics.",0.1657165841771524,0.2481654723200104,0.2069410282485814,0.2206825096057244
N24889,news,newspolitics,"McConnell tees off on Democrats over impeachment Senate Majority Leader Mitch McConnell (R-Ky.) teed off against the House impeachment inquiry on Tuesday, marking his first comments since Congress returned from its two-week break. ""House Democrats are finally indulging in their impeachment obsession. Full steam ahead,"" McConnell said during a speech from the Senate floor, adding that House Speaker Nancy Pelosi (D-Calif.) had ""crumbled"" to the ""left-wing impeachment caucus."" ""I don't...",0.1658250038433485,0.2826387969296862,0.22423190038651736,0.24370086590090698
N22561,sports,football_nfl,NFL Week 8 Power Rankings: Old-school football rules the day NFL Week 8 Power Rankings: Old-school football rules the day,0.1660021815974173,0.2622852712981036,0.21414372644776045,0.2301909080645415
N19660,news,newsus,"Woman found dead in Ohio home was likely killed by her Great Danes, police say An officer responding to a possible overdose found a woman lying on the floor with ""numerous"" cuts and puncture wounds.",0.1662514615361845,0.2597206079479587,0.21298603474207162,0.22856422581070063
N24611,news,newscrime,"Former Jewish Hospital nurse to be arraigned on sexual abuse of patient charge According to court documents, Dorsey told the woman ""repeatedly"" that, ""I would like to video you.""",0.1664633619313263,0.2599333535659953,0.2131983577486608,0.2287766896877723
N31739,news,newscrime,"'Habitual stowaway' arrested again at O'Hare, Chicago police say A woman arrested at O'Hare International Airport on Friday night was identified by Chicago police as ""known habitual stowaway"" Marilyn Hartman.",0.1664633619313263,0.2545506443485921,0.21050700313995918,0.22518821687617016
N23061,news,newscrime,"Police arrest suspect in Bashford Manor double shooting Police have identified the suspect in a double shooting that happened in Bashford Manor. On Thursday, officers arrested Matthew Martin on attempted murder and other drug-related charges. Police said Martin and one of the victims pulled out guns during an argument that happened at Martin's apartment on Goldsmith Lane Wednesday afternoon. Following the argument, both victims were shot in the back as they ran down the hallway and were transported...",0.1664633619313263,0.2748208372842019,0.2206420996077641,0.2387016788332434
N51163,lifestyle,lifestylebuzz,"He grew a 910-pound pumpkin and then used it as a boat Instead of making a giant jack o'lantern or a massive pie that could feed the whole town, a farmer in Tennessee took his 910-pound pumpkin out for a spin in his pond.",0.1664633619313263,0.2690009191698601,0.2177321405505932,0.23482173342368215
N1569,news,newsus,"Officer who shot naked man found not guilty of murder DECATUR, Ga. (AP)   A former Georgia police officer who fatally shot an unarmed, naked man was found not guilty of murder Monday but was convicted of aggravated assault and other charges that could send him to prison for more than 30 years. Robert ""Chip"" Olsen's face turned red and he squeezed his eyes shut tightly as the verdict was read. His wife, Kathy Olsen, began sobbing and had to be led from the courtroom. DeKalb County Superior Court...",0.1664633619313263,0.2711726035347852,0.21881798273305575,0.23626952300029888
N44462,news,newscrime,"Louisville man who shot at LMPD officer sentenced to 10 more years in prison A Louisville man convicted of shooting at an officer was sentenced Friday. Judge David Hale sentenced Elijah Eubanks, 22, to 119 months in prison for a federal weapons charge. Sign up for our Newsletters In March 2018, Eubanks opened fire on an officer who was attempting to question him while he was in his vehicle with another person. No officers were hit, but Eubanks was shot multiple times when officers returned fire. Eubanks was previously...",0.1664633619313263,0.2981446555981488,0.23230400876473756,0.2542508910425413
N3433,finance,finance-companies,A secretive family landing a $4 billion haul has everyone guessing One of the world's richest and most discreet families must decide what to do with a massive pile of cash.,0.1664633619313263,0.2027406947357827,0.1846020283335545,0.19064825046763056
N29948,lifestyle,lifestyle-news-feature,"A White Woman Searches for Her Black Family DNA testing tells people a lot about their geographic ancestry, prompting difficult questions about racial identity and belonging. ""In my heart, I feel a connection.""",0.1664633619313263,0.2432870917739935,0.2048752268526599,0.21767918182643775
N50528,news,newscrime,Man shot in the chest on Floyd Street ,0.1664633619313263,0.2602164828630304,0.21333992239717836,0.22896544255246237
N34567,news,newscrime,Grandfather charged in death of toddler who fell on cruise ship in Puerto Rico A grandfather who police say dropped his young niece from the 11th floor of a cruise ship docked in Puerto Rico in July has been accused of negligent homicide.,0.1664633619313263,0.2696322415663759,0.21804780174885108,0.23524261502135935
N48390,travel,travelnews,First round of auctions begin for Joe Ley Antiques ,0.1664633619313263,0.2514225497622769,0.20894295584680161,0.22310282048529337
N5398,news,newscrime,Suspects identified following hours-long SWAT standoff on South 34th Street ,0.1664633619313263,0.2496265324872122,0.20804494720926925,0.22190547563525023
N48031,sports,basketball_nba,Ex-Maverick to pay for funeral of woman fatally shot in home by police ,0.1664633619313263,0.2185302111609233,0.1924967865461248,0.20117459475105764
N29802,finance,finance-companies,"Barneys Is Sold for Scrap, Ending an Era Authentic Brands Group will take control of the Barneys name   one that has been part of the Manhattan landscape since 1923   and license it to other companies like Saks Fifth Avenue. The firm B. Riley Financial is preparing to liquidate Barneys' high-end wares, at its five stores and two Warehouse locations, starting with private sale events for Barneys' ""most loyal"" shoppers next week.",0.1664633619313263,0.2335718714113784,0.20001761667135234,0.21120236825136102
N62612,news,newscrime,16-year-old injured in shooting near Churchill Downs ,0.1664633619313263,0.2615307969975122,0.21399707946441926,0.22984165197545023
N17686,news,newscrime,"Suspect in Henry County murder, kidnapping arraigned ",0.1664633619313263,0.2606125038329731,0.21353793288214967,0.22922945653242416
N6244,news,newscrime,Suspect Alfredo Vazquez pleads guilty in Clark County judges' shooting case ,0.1664633619313263,0.2649469815324136,0.21570517173186993,0.23211910833205116
N58224,news,newscrime,"13-year-old charged with two murders escapes custody in North Carolina Officials said they have concerns for public safety due to the teen's ""prior history of assaultive and unpredictable behavior.""",0.1664633619313263,0.2614891284971886,0.21397624521425745,0.22981387297523448
N8429,weather,weathertopstories,"Group clears plastic drums, tires from Falls of the Ohio State Park LOUISVILLE, Ky. (WHAS11)   The Falls of the Ohio is a little cleaner after volunteers helped return it to its glory. The volunteers picked up trash and debris along with old tires and leftover plastic barrels. It was part of Moran Environmental Recovery's effort to clean up parts of the state park. The group says over the years, the site has experienced waste dumping leaving the grounds full of empty drums, tires and glass. The state park is the...",0.1664633619313263,0.2707496028155817,0.21860648237345398,0.23598752252082988
N59049,news,newsworld,"Three gunmen killed in Brazil airport raid, kidnapping: police Heavily armed gunmen raided an airport in Brazil on Thursday, officials said, stealing money from an armored truck before fleeing and taking a mother and baby hostage. At least one assailant escaped to a nearby residential neighborhood, taking a mother and her baby hostage in their home, the police spokeswoman said.",0.1664633619313263,0.2753101834055272,0.22088677266842677,0.23902790958079356
N41011,news,newsworld,"For the first time, a man has been sentenced for sexual slavery by the International Criminal Court. He got 30 years. Bosco Ntaganda is a former Congolese rebel nicknamed the ""Terminator."" The ICC convicted him on 18 counts including murder, sexual slavery and using child soldiers.",0.1664633619313263,0.2732016579149561,0.21983250992314118,0.23762222592041282
N21773,travel,travelnews,Lumber spilled on I-71 following rollover crash; Lanes shut down ,0.1664633619313263,0.287156808314369,0.22681008512284767,0.24692565952002143
N55833,news,newscrime,"Oldham County man charged, injuring victim during shooting practice ",0.1664633619313263,0.2861450382160306,0.22630420007367846,0.24625114612112917
N15710,news,newscrime,Arrest made in connection to stabbing in South Louisville ,0.1664633619313263,0.2606678167061588,0.21356558931874253,0.22926633178121464
N7023,lifestyle,lifestyle-news-feature,"After being pushed close to extinction, this humpback whale population is making a comeback A key population of humpback whales is in recovery after it was pushed close to extinction by centuries of exploitation, according to a new study.",0.1664633619313263,0.2847193127239206,0.22559133732762343,0.24530066245972248
N54889,lifestyle,lifestyle-news-feature,"Chris, the famously woolly sheep, has died Chris made headlines in 2015 after he became the unofficial world record holder for having grown the heaviest fleece.",0.1664633619313263,0.2399632836789995,0.2032133228051629,0.21546330976310843
N45099,news,newscrime,Suspect in crossbow murder of his father arraigned ,0.1664633619313263,0.2681160781436659,0.21728972003749608,0.23423183940621936
N63045,news,newscrime,"Coroner IDs man found dead in Klondike neighborhood A man who was found dead in the Klondike neighborhood has been identified. Louisville Metro police responded to the 3200 block of Pomeroy Drive for a call of a person down Friday. Officials said Kevin Hellems, 54, was found dead inside the home from some type of foul play. No other information has been released. The death comes as a surprise to the neighbors in the area, who say they aren't used to seeing police cars and detectives on this...",0.1664633619313263,0.2582078101962078,0.21233558606376707,0.2276263274412473
N22976,news,newsus,"The Sante Fe High School massacre suspect isn't fit to stand trial and will get psychiatric treatment, attorney says Dimitrios Pagourtzis is accused of killing eight students and two teachers at his Texas high school last year.",0.1664633619313263,0.2705710338564887,0.2185171978939075,0.23586847654810122
N65112,news,newscrime,"Family says 16-year-old was victim hit, killed on I-64 The person struck by 5 vehicles on Interstate 64 Friday night was a 16-year-old girl, according to family members. The girl's father, Ronnie Click, spoke with WHAS11 News Saturday and said his daughter Brea was killed in that incident. Police responded to I-64 near the 22nd Street exit after they received reports that a person had been hit while walking in the slow lane. RELATED: LMPD: Pedestrian struck and killed on I-64 E at 22nd Street Once...",0.1664633619313263,0.2748322267091488,0.22064779432023757,0.23870927178320797
N2663,news,newsworld,16 sentenced to death for burning alive Bangladesh teen Sixteen people were sentenced to death Thursday for burning alive a Bangladeshi teenager who refused to withdraw sexual assault charges against her head teacher.,0.1664633619313263,0.2790478413722526,0.22275560165178943,0.24151968155861048
N61101,news,newscrime,"Resident recalls moments leading up to fatal shooting in Russell neighborhood In the Russell neighborhood, crime tape has become a well known sight that's why Lisa Tutt encourages her son and his friends to hang out at her house. READ THE FULL STORY:Resident recalls moments leading up to fatal shooting in Russell neighborhood Sign up for our Newsletters CHECK OUT WLKY:Live. Local. Late-Breaking. Get the top Louisville news, weather and sports from the team at WLKY   online, anytime.",0.1664633619313263,0.2455127454116664,0.20598805367149636,0.2191629509182197
N3142,health,health-news,"Teen wins science competition with liquid bandage invention Kara Fan beat nine other finalists and hundreds of students who submitted ideas in the 3M​ Young Scientist Challenge, winning $25,000.",0.1664633619313263,0.2454860018296082,0.20597468188046725,0.21914512186351423
N19709,news,newscrime,Teen given 8 years in prison for gang-related hate crime of student caught on tape A California teenager has been sentenced to eight years in prison for a gang-affiliated hate crime assault on another student.,0.1664633619313263,0.2838360938165095,0.2251497278739179,0.24471184985478175
N42704,news,newscrime,UPDATE: Coroner reveals identity of victim in Beechmont neighborhood shooting ,0.1664633619313263,0.2472634305563701,0.2068633962438482,0.22033007434802215
N43353,news,newscrime,"Wedding shooter may have been avenging late stepfather's murder, authorities say Brandon Castiglione, the groom's son, was previously charged with second-degree murder in the death of the suspect's stepfather.",0.1664633619313263,0.2569911390018515,0.2117272504665889,0.22681521331167642
N35656,travel,travelnews,Motorcyclist killed in crash on New Cut Road identified ,0.1664633619313263,0.2634175782777449,0.2149404701045356,0.23109950616227204
N19041,news,newscrime,Kroger shooting: Suspect coming out of store fires at officers before they shoot him dead ,0.1664633619313263,0.2584548622300282,0.21245911208067725,0.2277910287971276
N6072,news,newsus,"Search resumes for worker missing in New Orleans Hard Rock Hotel building site collapse that killed 2 Rescuers resumed searching Sunday for a worker trapped in rubble after a deadly construction collapse in New Orleans, officials said, but the building's instability is making for a precarious situation.",0.1664633619313263,0.2640579673458818,0.21526066463860405,0.23152643220769664
