ID,category,sub_category,content,collaborative_rec,content_rec,mean,two_one
N6087,news,newsworld,"U.S. bans all flights to Cuba outside Havana in latest crackdown American Airlines and JetBlue, which fly routes to Cuba other than Havana, will have to submit to new regulations from the Transportation Department.",0.1664633619313263,0.2581274683720057,0.212295415151666,0.22757276622511255
N61355,news,newscrime,"2 Murder suspects escape from Monterey County, California, Jail The suspects are considered dangerous and should not be approached. Anyone who sees them should call 911 immediately.",0.1664633619313263,0.2846225024621893,0.2255429321967578,0.24523612228523495
N31402,foodanddrink,restaurantsandnews,"The Best Seafood Restaurant in All 50 States Think there are too many seafood places in Maine to choose among, but none in landlocked Nebraska? This list will point your cravings and more in the right direction. Whether it's shrimp, crab, fish, or sushi that you love, even the most landlocked states have top-notch options for seafood. Find out what's near you.",0.1664633619313263,0.2481458316456329,0.2073045967884796,0.22091834174086403
N63317,news,newscrime,"Police: 4 charged with attempted murder month after shooting in SW Louisville Four people are facing attempted murder charges for a shooting last month in southwest Louisville. According to arrest citations, a group arrived at an apartment in the 9600 block of Lamborne Boulevard on Sept. 27 and attempted to lure a male, unknown age, out of his apartment. When the victim agreed to come outside, police said Byron Kirby, 25, shot at the victim four times. The victim then ran into the woods. It's unclear if he was hit....",0.1664633619313263,0.2647087577070885,0.21558605981920742,0.2319602924485011
N31741,music,musicnews,"Snoop Dogg bringing 'I Wanna Thank Me' tour to Louisville Palace Multi-platinum rap legend Snoop Dogg is bringing his ""I Wanna Thank Me"" tour to the Louisville Palace in 2020. The venue announced on Twitter that the show is scheduled for Jan. 25. Live Nation presale starts starts Thursday at 10 a.m., and tickets go on sale to the general public Friday at 10 a.m. The Long Beach native released his 17th album, ""I Wanna Thank Me,"" in August. The Doggfather's West Coast G-funk style has sold more than 38 million...",0.1664633619313263,0.2665789579651545,0.2165211599482404,0.23320709262054512
N10438,lifestyle,lifestylebuzz,"Pope Lick Legend: Loved ones of those who died on trestle push for change Legends of a monster living under a dangerous train trestle have lured people to a quiet Louisville creek for decades. Some swear they have seen proof of a human-goat hybrid terrorizing the area. Others leave with no sightings and no story to tell. Those are the lucky ones. The story of a ""Pope Lick Monster"" or ""Goatman"" haunting the trestle at Pope Lick Creek has been commonplace in Louisville even becoming the focus of a movie in the late...",0.1664633619313263,0.2522557234510562,0.20935954269119122,0.2236582696111462
N33503,foodanddrink,restaurantsandnews,These Restaurants Are Rumored To Be Haunted By Spirits Get into the Halloween spirit with a reservation at one of these spooky spots.,0.166801447309103,0.1979385221973801,0.18236998475324157,0.18755949723462106
N24123,sports,baseball_mlb,Why is Giancarlo Stanton on the Yankees' playoff roster? ,0.1669816830232012,0.2507772102021145,0.20887944661265787,0.2228453678091434
N20286,movies,movies-celebrity,Scarlett Johansson Says She Was 'Surprised' by Colin Jost's Proposal: 'He Killed It' Scarlett Johansson Was 'Surprised' by Colin Jost's Proposal,0.1669816830232012,0.2342381449047484,0.20060991396397482,0.211819324277566
N55310,news,newscrime,"Joey 'the Clown' Lombardo, infamous Chicago mobster, dead at 90, reports say Chicago mobster Joseph Lombardo   better as ""Joey the Clown""   died in prison Saturday while serving a life sentence for murder, according to federal prosecutors.",0.1669816830232012,0.2878675227553491,0.22742460288927516,0.24757224284463314
N8419,news,newscrime,Man charged with 5 counts of first-degree murder in shooting rampage at Chicago condo Chicago police Monday morning announced charges against a man in connection with a shooting rampage that left five people dead Saturday night.,0.1669816830232012,0.2621446188920516,0.2145631509576264,0.23042364026910145
N47054,autos,autossema,"Hennessey Maximus Is a 1000-HP Jeep Gladiator from Hell If a 2020 Jeep Gladiator is not aggressive-looking enough, Hennessey has this even more intense version, which it's bringing to the SEMA show.",0.1669816830232012,0.2538689918685494,0.2104253374458753,0.22490655558676664
N64562,tv,tv-celebrity,Rob Kardashian Appears Thinner at Kim Kardashian's Birthday Party in Rare Video Rob Kardashian Appears Thinner at Kim Kardashian's Birthday Party,0.1669816830232012,0.2420223274939416,0.2045020052585714,0.2170087793370281
N47482,travel,travelnews,TSA Agents Stop Passenger With Loaded Gun Before Boarding Plane The man was carrying a loaded .22 caliber handgun.,0.1669816830232012,0.2914983126737852,0.2292399978484932,0.24999276945692384
N22130,music,music-celebrity,Rihanna Slays in Sexy Black Bikini in Slow-Motion Video -- Watch! The singer shut down Instagram with her slow-motion clip.,0.1669816830232012,0.23500765521398,0.2009946691185906,0.21233233115038708
N15771,autos,autosenthusiasts,"The Holy Grail Of Jeep Grand Cherokees Sits On An Old Wisconsin Dairy Farm, But It May Be Doomed ",0.1669816830232012,0.2269982122904754,0.1969899476568383,0.20699270253471733
N18663,news,newsus,"Coast Guard offloads $92 million worth of smuggled cocaine in San Diego The Coast Guard offloaded more than 6,800 pounds of cocaine   worth an estimated $92 million   in San Diego on Wednesday, contraband that the military branch seized in international waters of the eastern Pacific Ocean.",0.1669816830232012,0.2881964927911422,0.2275890879071717,0.24779155620182852
N1431,news,newscrime,"Four charged with repeatedly escaping prison, returning with booze and phones Acting on ""repeated reports"" that prisoners were regularly escaping and returning, authorities said they caught the men in the act with the contraband.",0.1669816830232012,0.2636660796300634,0.2153238813266323,0.231437947427776
N157,sports,baseball_mlb,"How did the Nats respond to a controversial call? By leaving absolutely no doubt. A controversial interference call. Dominance from Stephen Strasburg. Booming home runs to turn it around. And now, one game to decide it all.",0.1669816830232012,0.2666943469984816,0.2168380150108414,0.2334567923400548
N5888,sports,baseball_mlb,Report: Angels could be fined up to $2M for not reporting Skaggs' opioid use The Los Angeles Angels could be fined up to $2 million by the commissioner for not reporting Tyler Skaggs' opioid use. A report published by ESPN on Saturday stated that Angels communications director Eric Kay admitted to federal investigators that he used and supplied Skaggs with drugs since at least 2017.,0.1669816830232012,0.2712691109620352,0.2191253969926182,0.23650663498242386
N46868,lifestyle,lifestylepetsanimals,"30 Funny Dog Photos You Need to See We asked readers to send in their favorite animal photos. We were so entertained, we couldn't help but share.",0.1669816830232012,0.2595251921520921,0.21325343758764664,0.22867735577579512
N20886,news,newsworld,"ISIS Leader Paid Rival for Protection but Was Betrayed by His Own The Islamic State leader Abu Bakr al-Baghdadi was able to hide out in an unlikely part of Syria, the base of a rival group, because he was paying protection money to its members, according to receipts for the payments recovered by researchers.",0.1669816830232012,0.2618151671655647,0.21439842509438295,0.23020400578477684
N32095,news,newsus,"Illegal vapes traced to California woman who was CBD pioneer CARLSBAD, Calif. (AP)   Some of the people rushing to emergency rooms thought the CBD vape they inhaled would help like a gentle medicine. Others puffed it for fun. What the vapors delivered instead was a jolt of synthetic marijuana, and with it an intense high of hallucinations and even seizures.",0.1669816830232012,0.260275047883835,0.2136283654535181,0.22917725959695706
N2606,news,newscrime,"Couple Accused of Injecting Childhood Friend With Meth and Filming Her As She Died After more than two years of investigation, authorities in Oklahoma have filed formal murder charges in the death of a 41-year-old woman whose last moments were captured on videotape.",0.1669816830232012,0.265861943011104,0.2164218130171526,0.23290185634846972
N60388,news,newscrime,"Man threatened school to distract from robbery, police say As a precaution, schools in one of the districts that were threatened placed all of its schools on a modified lockdown",0.1669816830232012,0.2798985612168965,0.22344012212004885,0.24225960181899805
N45535,news,newsus,DOJ sues Walmart for allegedly discriminating against a Navy reserve officer The Department of Justice says that Walmart did not hire a naval reserve officer due to her mandatory two-week training in the summer of 2016.,0.1673484573044441,0.2472002764926686,0.20727436689855633,0.2205830034299271
N45729,tv,tv-celebrity,"Former Deadliest Catch Star Jerod Sechrist Arrested, Charged with Heroin Possession Deadliest Catch: Jerod Sechrist Charged with Heroin Possession",0.1675898360376468,0.2488633162832184,0.2082265761604326,0.22177215620136118
N31825,video,viral,A sneak peek at Hudson Yards' Edge to open March 2020 A new observation deck in NYC is opening up on March 11th 2020. We give you a sneak peek at Hudson Yards' Edge.,0.1675898360376468,0.2503806124099738,0.20898522422381027,0.22278368695253145
N51891,sports,football_ncaa,"7 biggest takeaways from the opening College Football Playoff rankings Hey, the Pac-12 is actually being respected.",0.1675898360376468,0.2563591856863024,0.2119745108619746,0.22676940247008384
N28711,sports,football_ncaa,The biggest games in the month of November that will decide the College Football Playoff The month of November will decided which teams will be in College Football Playoff contention. A look at the biggest games in a jam-packed schedule.,0.1677270297787882,0.2741637864353572,0.2209454081070727,0.23868486754983423
N37378,news,newsus,"Wisconsin jury awards $450,000 in Sandy Hook defamation case A jury in Wisconsin has awarded $450,000 to the father of a boy killed in the 2012 Sandy Hook school shooting after he filed a defamation lawsuit against conspiracy theorist writers who claimed the massacre never happened.",0.1677319132684631,0.253039131142145,0.21038552220530404,0.2246033918509177
N40640,foodanddrink,foodnews,"Foie Gras Is Banned by New York City Lutèce served it seared, with dark chocolate sauce and bitter orange marmalade. Le Cirque offered it in classic terrine form, but also served it with rabbit and bacon and made it the scene-stealer in a ravioli dish. But Lutèce closed in New York in 2004. Le Cirque shut its last Manhattan location in 2017. And foie gras, the calling card of fine French dining, is about to follow suit. The New York City Council overwhelmingly passed legislation on...",0.168076241242809,0.2478582035392347,0.20796722239102186,0.22126421610709282
N9798,news,newsus,"Missing West Point cadet found dead, officials say A U.S. Military Academy cadet who vanished last week has been found dead, officials said Wednesday.",0.1681742208506215,0.2690360668002861,0.2186051438254538,0.23541545148373122
N13893,foodanddrink,restaurantsandnews,"14 Weird Rules Fast-Food Employees Have to Follow Fast food may seem easy, but there are quite a few intricate rules employees have to follow.",0.1682292709416302,0.2372998653917403,0.20276456816668526,0.21427633390837028
N1843,tv,tvnews,Survivor Contestant Rudy Boesch Dies at 91 After Long Battle with Alzheimer's Disease Survivor's Rudy Boesch Dead at 91,0.1685292504816901,0.2703287282477186,0.21942898936470434,0.23639556899237577
N44383,news,newscrime,"Florida police tell man to quit calling about stolen marijuana A man in Florida repeatedly called 911 over the weekend to report that his roommate had stolen his weed, police said.",0.1687970434827262,0.2591632966082144,0.21398017004547032,0.22904121223305168
N31931,news,newscrime,Florida man arrested in beating death of peeping Tom Victor Vickery had been in bed with his girlfriend when they heard a man with a history of peeping at their window.,0.1690562040286637,0.2458550308260261,0.20745561742734492,0.22025542189357197
N43955,entertainment,entertainment-celebrity,"Celebrity kids then and now: See how they've grown See what the children of Bobby Cannavale, Ray Liotta, Jude Law, Jamie Foxx, Sylvester Stallone, James Gandolfini and more stars look like now.",0.1693413827645792,0.2374964206747831,0.20341890171968113,0.21477807470471513
N34124,travel,travelnews,"Southwest Airlines evacuates Chicago flight after blown tires: reports Southwest Airlines evacuated a flight Monday morning at Chicago's Midway International Airport, blaming a hydraulic issue with the landing gear.",0.1694852366259734,0.2717396450894375,0.22061244085770543,0.2376548422682828
N8331,entertainment,celebrity,"Melanie Griffith, 62, shows off her insane figure in lingerie selfie, plus more news Melanie Griffith looks more stunning than ever in lingerie selfie, plus more celebrity news for Oct. 30, 2019.",0.169675169906086,0.2527896305546677,0.21123240023037684,0.2250848103384738
N13008,finance,finance-companies,Harley-Davidson halts production of new electric motorcycles Harley-Davidson has halted production and deliveries of its new LiveWire electric motorcycle after reportedly discovering a problem with its charging mechanism.,0.1697897945327945,0.2795136335412577,0.2246517140370261,0.2429390205384366
N6154,sports,football_ncaa,"Report: Florida State considering firing Willie Taggart, pursuing Urban Meyer Willie Taggart should definitely look over his shoulder, should this report be true.",0.1704104254885878,0.2584030807064507,0.21440675309751925,0.22907219563382972
N1398,news,newsus,"Iowa woman killed by explosion at gender reveal party An Iowa woman was killed by debris from an explosion at a gender reveal party on Saturday, police said.",0.1707240196168208,0.2723733843931856,0.2215487020050032,0.238490262801064
N54842,news,newsus,"Mississippi woman found after being missing for days by writing S.O.S. with rocks S.O.S spelled out with rocks saved a woman missing in a national park for days, according to a release from the National Park Service.",0.1707277078010022,0.2421619913019962,0.2064448495514992,0.21835056346833154
N45794,news,newscrime,"Four flight attendants were arrested in Miami's airport after bringing in thousands in cash, police say Four American Airlines flight attendants were arrested at the Miami International Airport and charged with money laundering after bringing large amounts of cash into the country, police said.",0.1707506627255462,0.2677049823142093,0.21922782251987777,0.23538687578465495
N13231,news,newsus,"Homeowner says a mystery object damaged his house. It didn't fall from a plane, FAA says Authorities including the Federal Aviation Administration have not been able to identify a canister-type object that damaged a Kentucky man's home.",0.171142844210543,0.2444899012408938,0.2078163727257184,0.22004088223077686
N57967,sports,basketball_nba,Harden-Westbrook argument goes viral A clip of the Rockets stars appearing to exchange words during Thursday's game against the Bucks quickly started making the rounds online.,0.1712198387019466,0.2270251534573344,0.1991224960796405,0.20842338187220513
N55742,sports,mma,President Donald Trump gets mixed reaction at UFC 244 in historic milestone for MMA ,0.171237788791375,0.2367887480296976,0.2040132684105363,0.21493842828359008
N9803,finance,markets,"Jeff Bezos is set to lose his crown as world's richest person Jeff Bezos is about to relinquish the title of world's richest person to Bill Gates, as Amazon.com Inc. stock tumbled in late trading Thursday.",0.1713795635356362,0.2469875460208471,0.20918355477824163,0.22178488519244346
N16290,news,newsus,"Missouri man missing for a week found alive in car that crashed into ravine Ryan Linneman, of Lee's Summit, was found by a dirt bike rider in wreckage along Interstate 470 in Kansas City, Lee's Summit police said.",0.1716640187303332,0.28137293316099,0.2265184759456616,0.24480329501743775
N30160,foodanddrink,tipsandtricks,How To Open a Can Without a Can Opener All it takes is a metal spoon and some elbow grease.,0.1718085286213576,0.2856151305132581,0.22871182956730784,0.24767959654929128
N42620,lifestyle,lifestylebuzz,"Heidi Klum's 2019 Halloween Costume Transformation Is Mind-Blowing   But, Like, What Is It? You might say she's scary good at playing dress-up, because Heidi Klum's 2019 Halloween costume is even more impressive than we could have imagined   and that's saying a lot, considering transformative Halloween costumes are kind of her thing. But this year Klum took it up one more notch as she shared her metamorphosis into,",0.1721939864315221,0.2402179736108581,0.2062059800211901,0.2175433112177461
N23614,tv,tv-celebrity,"John Witherspoon Dies: Comedian & 'Friday' Star Was 77 John Witherspoon, an actor-comedian who for decades made audiences laugh in television shows and films, including the hit Friday franchise, died suddenly at his home today. He was 77. ""It is with deepest sorrow that we can confirm our beloved husband and father, John Witherspoon, one of the hardest working men in show business, died",0.173909460893304,0.2687296656611566,0.2213195632772303,0.23712293073853907
N11855,news,newsus,"New Jersey woman sues waiter for spilling wine on her Hermès handbag The woman is seeking $30,000 for the light-pink luxury handbag, which has been discontinued.",0.1739132588335223,0.2283660047454581,0.20113963178949018,0.21021508944147949
N871,tv,tv-celebrity,"Woman, suspect dead at 'Tarzan' actor Ron Ely's California residence Ron Ely, who portrayed Tarzan in the TV series in the 60s, was not harmed and is alive and well, a sheriff's office spokesman said.",0.1742081929542809,0.2627878531097918,0.21849802303203636,0.2332612997246215
N53033,news,newspolitics,"CNN Poll: Biden's lead in Democratic primary hits widest margin since April Former Vice President Joe Biden's lead in the race for the Democratic nomination for president has rebounded, according to a new CNN poll conducted by SSRS.",0.1742855286558404,0.2580997381176021,0.21619263338672126,0.23016166829701487
N41087,tv,tvvideos,'The Masked Singer': Find Out Who the Eagle Was! 'The Masked Singer': Find Out Which Celeb the Eagle Was!,0.1743740599840999,0.2636857482122333,0.21902990409816658,0.23391518546952217
N24233,news,newsphotos,"The world's skinniest skyscraper is almost completed. I toured its first luxury condo   take a look inside the NYC tower that's 24 times taller than it is wide. The 1,428-foot tower on Manhattan's Billionaires' Row is 24 times taller than it is wide and has only one residence per floor.",0.1743740599840999,0.2585177590962901,0.216445909540195,0.2304698593922267
N7563,news,newsus,Iowa family discovers horrifying basement filled with blood It's been two weeks and the blood and fat are still seeping into the basement of Nick Lestina's home.,0.1743740599840999,0.252324097667376,0.21334907882573795,0.22634075177295065
N52500,lifestyle,shop-holidays,Walmart's Pre-Holiday Deals Are Live Right Now Don't get trampled! Shop these online sales from the comfort of your couch.,0.1743740599840999,0.2414520651411544,0.20791306256262715,0.2190927300888029
N26378,autos,autosnews,Man Pulled From Path Of Oncoming BART Train A passenger fell onto the tracks at the Coliseum BART station as the train pulled into the station. A BART worker saved him. (Video),0.1743740599840999,0.2741414398228254,0.22425774990346264,0.24088564654325023
N60384,sports,baseball_mlb,Beer-holding Nationals fan explained why he used his chest to block HR ball He kept the ball in front of him.,0.1743740599840999,0.2826582825986905,0.22851617129139523,0.24656354172716033
N49475,lifestyle,lifestylebuzz,Woman Finds A Giant Wild Snake Just Chilling In Her Bed A 7-foot-long carpet python was slithering over her bed.,0.1743740599840999,0.2509717348182683,0.2126728974011841,0.22543917654021217
N25792,lifestyle,lifestylehomeandgarden,100 Outrageous Things Homeowners Have Done to Their Houses Problems solving skills are on full display with these 100 outrageous things homeowners have done to their houses,0.1743740599840999,0.2595173342976214,0.21694569714086065,0.2311362428597809
N47289,finance,finance-homesandpropertysection,"A Los Angeles mansion once listed for $250 million has finally sold for 62% off after 3 years. Take a look inside what was once America's most expensive home. The extravagant Bel Air property has five bars, a bowling alley, a 40-seat movie theater, an 85-foot infinity pool, and a candy wall.",0.1744230757112089,0.2196699542139902,0.19704651496259956,0.20458766137972975
N619,news,newsus,"Cornell student, 18, found dead in gorge after frat party, reports say A top Ivy League student was found dead Saturday afternoon in a New York gorge after he left a fraternity party and disappeared Thursday night, according to reports.",0.1746752622333864,0.2662902434855698,0.2204827528594781,0.23575191640150867
N55897,tv,tv-celebrity,40 Fun Facts About Jennifer Aniston ,0.1749292371880704,0.2246704764012764,0.1997998567946734,0.20809006333020774
N15034,tv,tv-celebrity,Alec Baldwin's 'heart goes out to' imprisoned Felicity Huffman and husband William H. Macy Alec Baldwin thinks incarceration shouldn't be a consequence for those guilty in the admissions scandal and gave a shout-out to Felicity Huffman.,0.175085934380385,0.2424932189183453,0.20878957664936515,0.22002412407235852
N14385,news,newsworld,ISIS names successor to slain leader al-Baghdadi The militant group named Abu Ibrahim Hashimi al-Quraishi as the new leader in a message posted by its official media wing.,0.1750881280751935,0.2708985895908622,0.22299335883302784,0.2389617690856393
N8129,news,newsworld,"Elderly Japan woman rescued from Typhoon Hagibis dies after falling from helicopter; storm kills at least 33 An elderly woman was one of the more than 30 who have died in Japan from the devastating Typhoon Hagibis, officials said.",0.1753336753429156,0.258220806476978,0.2167772409099468,0.23059176276562388
N41244,entertainment,entertainment-celebrity,"Keanu Reeves holds hands with Alexandra Grant as the Internet swoons, plus more news The Internet is even more in love with Keanu Reeves after Alexandra Grant PDA. Plus, more celebrity news for Nov. 5, 2019.",0.1755318467885072,0.2451299634424418,0.2103309051154745,0.22193059122446362
N4020,tv,tv-celebrity,"'Tarzan' Actor Ron Ely: Actor's son allegedly killed his mother before deputies shot and killed him, sheriff's office says The son of ""Tarzan"" actor Ron Ely killed his mother before he was shot and killed by deputies on Tuesday, according to the Santa Barbara County Sheriff's Office.",0.1756695166348576,0.2635988758005658,0.21963419621771169,0.2342890894119964
N19347,news,newspolitics,"Former US Senator Kay Hagan dead at 66 Former U.S. Sen. Kay Hagan, a one-time Capitol Hill intern who went on to become North Carolina's first Democratic female senator, died Monday at her Greensboro home. She was 66.",0.1759158124368995,0.2758748591448752,0.22589533579088733,0.24255517690888329
N2203,sports,baseball_mlb,"Off to the World Series, these Nationals have proved everyone wrong This unexpected joyride of a season could hold more promise yet.",0.1762528328247419,0.2482282964116017,0.2122405646181718,0.22423647521598178
N39498,video,science,"Why it's so hard for planes to land on water When US Airways Flight 1549 landed in the Hudson river all 150 passengers survived. Landing a plane on the water is called ditching. Ditching is more common in smaller private planes, not large planes from companies like Boeing or Airbus. But the Miracle on the Hudson isn't the only time an aircraft has been ditched. And despite that success, landing a plane on the water can be extremely dangerous.",0.1764579251525284,0.2728341498830018,0.2246460375177651,0.24070874163951067
N48742,news,newscrime,"Before his execution, a death row inmate told his victim's family he forgives them Charles Rhines, who was convicted of murder in the brutal stabbing of a 22-year-old man in 1992, was executed in South Dakota Monday, the state's attorney general said, after the Supreme Court denied a last-ditch appeal of his case.",0.176476885511347,0.2856251123554263,0.23105099893338665,0.24924237007406655
N37131,sports,baseball_mlb,What recent history tells us to expect from World Series Game 7 Will the Nationals and Astros give us a classic or a clunker?,0.1766580288145924,0.2565806172464625,0.21661932303052744,0.2299397544358391
N30867,news,causes-environment,"The size of a bus, rare and endangered whale shark spotted off Florida coast Bigger than Jaws, but not nearly as dangerous, the largest fish in the sea, a whale shark, was spotted off the Florida coast.",0.1769033799844329,0.2441621075476145,0.2105327437660237,0.22174253169322064
N21623,news,newsus,"A 'one in a million' yellow cardinal, dubbed 'Sunny,' seen in Florida Only three yellow cardinal sightings are reported a year, making the bird's appearance a rare ""one in a million"" finding, an Auburn professor said.",0.1770202285477401,0.2762281523123949,0.22662419043006748,0.2431588443908433
N27526,news,newsus,"1 dead, 8 others hospitalized in Salmonella outbreak likely tied to ground beef The CDC said the latest Salmonella outbreak is not tied to one type or brand of ground beef.",0.1770640507557949,0.2588419970674471,0.217953023911621,0.23158268163022971
