ID,category,sub_category,content,collaborative_rec,content_rec,mean,two_one
N11673,movies,movies-celebrity,"Blake Lively Hilariously Trolls Ryan Reynolds for Having ""No Chill"" Blake Lively trolled husband Ryan Reynolds and his gin company, Aviation Gin, on Instagram with some hilarious Stories. See what she wrote here.",0.1527402753698391,0.2266661204337563,0.1897031979017977,0.20202417207911724
N51147,sports,football_ncaa,10 storylines to follow heading down college football's home stretch Seven weeks down; seven to go. We've hit the halfway mark of the college football regular season. It's been entertaining thus far   not too many surprises   with enough intrigue to keep us going back each week.,0.1527402753698391,0.2723188968851593,0.21252958612749923,0.23245935638005258
N8160,sports,football_ncaa,College Football Playoff Chase: Who's Still In The Hunt After Week 9? Which top teams have the best chance of getting into the College Football Playoff after Week 9?,0.1527402753698391,0.2571466338591603,0.2049434546144997,0.2223445143627199
N770,tv,tvnews,"Megyn Kelly Slams NBC News on 'Tucker Carlson Tonight' for Matt Lauer Investigation, Harvey Weinstein Coverage In Megyn Kelly's first televised interview since exiting NBC, the former Fox News and NBC News anchor took to ""Tucker Carlson Tonight"" Wednesday evening to criticize NBC News management for its handling of the outlet's Harvey Weinstein coverage and internal Matt Lauer investigation.",0.1527402753698391,0.2425653853188658,0.19765283034435244,0.21262368200252357
N38821,news,newsphotos,The US Navy is 244 years old today. Here are 42 powerful images from its iconic history. The US Navy has long been the most visible part of America's military might with visits to far flung ports and operations all over the world.,0.1527402753698391,0.2706666411343619,0.21170345825210052,0.23135785254618763
N1455,sports,football_ncaa,"LSU up to No. 2 behind Alabama in Amway Coaches poll as Oklahoma, Notre Dame tumble LSU is now No. 2 in the Amway Coaches Poll behind Alabama, while Oklahoma and Notre Dame both tumbled after losses on the road.",0.1527402753698391,0.259841348710619,0.20629081204022903,0.22414099093035902
N61319,sports,football_ncaa,"After throwing a punch, Dabo Swinney made CB Andrew Booth ride the manager bus back to Clemson ",0.1527402753698391,0.269597514488449,0.21116889492914404,0.23064510144891237
N50049,sports,football_ncaa,"11 bold predictions for rest of college football season Alabama misses the playoff, USC wins Pac-12 and more",0.1527402753698391,0.2493049395368168,0.20102260745332795,0.21711671814782424
N20933,sports,football_ncaa,"College football Week 7 takeaways: LSU offense shows it's for real LSU appears to finally have the offense to compete with Alabama, and other things Dan Wolken learned from Week 7 of the college football season.",0.1527402753698391,0.2591307221413867,0.2059354987556129,0.22366723988420417
N14588,sports,football_ncaa,"Jake Fromm proves Georgia is more than just its running game vs. Florida Georgia beat Florida 24-17 in a huge SEC showdown, and the Bulldogs did that with a clutch performance from Jake Fromm.",0.1527402753698391,0.26559041032783,0.20916534284883453,0.22797369867516637
N62545,finance,finance-companies,"The CEO taking on the gun lobby Ed Stack didn't set out to be an activist. The chief executive of Dick's Sporting Goods, Mr. Stack spent his career selling fishing rods, camping gear and athletic equipment at big-box stores around the country. Dick's was founded by Mr. Stack's father in upstate New York. As a young man, Mr. Stack worked for the family business. But he didn't enjoy the experience. His father was a divisive boss who couldn't manage a supply chain, and was...",0.1527402753698391,0.2668054599156306,0.20977286764273484,0.2287837317337001
N14662,foodanddrink,foodnews,"This Controversial Julia Child Recipe Caused Quite a Stir Julia Child has long been one of the most popular cooks in the country, celebrated for strict interpretations of culinary classics. However, her take on a classic Italian dish caused an uproar.",0.1527402753698391,0.2405159037699521,0.1966280895698956,0.21125736096991443
N45388,sports,football_ncaa,"College football Week 8 bowl projections: Baylor surges into New Year's Day 6 Sporting News' Week 8 bowl projections saw a little movement, and Baylor and North Carolina each have joined the New Year's Day 6 discussion.",0.1527402753698391,0.2492887846482175,0.2010145300090283,0.21710594822209137
N50015,news,newsworld,North Korea rejects meeting with South over resort North Korea on Tuesday rejected South Korea's request for working-level talks to discuss the possible demolition of South Korean-made hotels and other facilities at the North's Diamond Mountain resort that North Korean leader Kim Jong Un wants removed.,0.1527402753698391,0.2673533747418596,0.21004682505584937,0.22914900828451945
N28467,news,newsworld,"Four-metre king cobra wrestled from sewer in Thailand A feisty four-metre (13-foot) king cobra was pulled from a sewer in southern Thailand in an hour-long operation, a rescue foundation said Tuesday, describing the reptile as one of the largest they had ever captured. Kritkamon said the snake was more than four metres long, weighed 15 kilos (33 pounds), and was the third-largest they had found.",0.1527402753698391,0.2858055643367391,0.21927291985328912,0.2414504680144391
N33622,finance,finance-companies,"Aluminum is replacing plastic as the greenest bottle The drive to turn products more eco-friendly is sweeping through the U.S. beverage market, with plastic being replaced in everything from red Solo cups to Coca-Cola Co. and PepsiCo Inc. water bottles.",0.1527402753698391,0.2506256407452395,0.20168295805753933,0.21799718562010606
N40545,finance,finance-savemoney,"12 things that could save us money if we weren't lazy From checking your credit report to comparison shopping, go the extra mile to keep your cash.",0.1527402753698391,0.2588657085511148,0.20580299196047697,0.22349056415735624
N2052,sports,football_ncaa,"Hernandez: USC athletic director Mike Bohn needs to tune out Urban (Meyer) noise He wasn't in the building. Except he was. He was rarely mentioned by name. Except every other question was about him. Urban Meyer was nowhere and everywhere Thursday in the John McKay Center, where Mike Bohn was introduced as USC's athletic director. The reason was obvious: Meyer is whom Trojan Nation wants as its football coach. USC can preach the importance of integrity, but the university ...",0.1527402753698391,0.2543583112753041,0.2035492933225716,0.22048563264014912
N58601,health,health-news,"Zantac Recall Update: Another Company Recalls Ranitidine Heartburn Drug Over Cancer Fears Aurobindo Pharma USA, Inc. is the latest company to issue a voluntary recall of ranitidine products over concerns regarding ""probable"" carcinogen NDMA.",0.1527402753698391,0.2821115456694072,0.21742591051962318,0.23898778890288452
N35554,sports,football_ncaa,"Lane Kiffin interested in Florida State head coach job Look out, folks. Lane Kiffin wants back into the Power Five, expressing his interest in the Florida State job on the heels of Willie Taggart's Sunday firing.",0.1527402753698391,0.2698072621794709,0.21127376877465498,0.23078493324292695
N44007,video,news,Where have Cape Town's great whites gone? Shark spotters say Cape Town's world-famous great whites have disappeared. So where have they gone?,0.1527402753698391,0.2590717427369476,0.20590600905339335,0.22362792028124479
N42583,news,newsworld,"India's capital restricts cars as people choke in dirty air Authorities restricted many private vehicles from taking to the roads of India's capital on Monday amid a public health crisis that has left New Delhi residents gasping and their eyes burning from toxic air pollution. The ""odd-even"" scheme will restrict private vehicles with odd-number license plates to driving on odd dates while even-numbered plates are allowed on even-numbered dates.",0.1527402753698391,0.287784812346726,0.22026254385828253,0.24276996668776368
N52692,news,newsus,"Dow says no injuries from chemical plant blast in Louisiana An explosion at a Dow chemical plant in Louisiana rattled windows in nearby homes but caused no injuries, the company said Sunday.",0.1527402753698391,0.2554087007765675,0.20407448807320333,0.22118589230765806
N14349,entertainment,celebrity,Celebrity Headshots from Before They Were Famous Prepare for some straight-up baby faces.,0.1530620608386406,0.2528500992408947,0.20295608003976764,0.21958741977347665
N10417,music,musicnews,Watch Miranda Lambert Invite a Little Girl On Stage Who 'Stole' Her Heart The girl's mother thanked Lambert for raining attention on her daughter Remi during the show on Saturday night.,0.1535136391489177,0.2464164320669668,0.19996503560794227,0.21544883442761711
N57318,news,newsus,"A 2,000-pound great white shark is swimming off the coast of Florida A great white shark that weighs over 2,000 pounds and measures 15 feet, 5 inches long has been swimming along the US East Coast.",0.1539037700661563,0.2810392868065625,0.2174715284363594,0.2386607812264271
N5283,foodanddrink,foodnews,"For the first time ever, a US cheese is named best in the world Forget the American love affair with Cheez Whiz, blocks of Velveeta and pasteurized processed cheese food slices. An organic blue cheese from Oregon has been named the world's top cheese.",0.1542617968258835,0.2346852564740117,0.1944735266499476,0.20787743659130228
N42128,movies,movies-celebrity,"Hugh Hefner's son Cooper weds 'Harry Potter' actress Cooper Hefner married Scarlett Byrne in Ventura, Calif., on Monday.",0.154431688913615,0.227383438719288,0.19090756381645152,0.20306618878406366
N719,finance,finance-companies,"Nevada gambling bosses move to bar Wynn from casino industry The complaint filed Monday by the state's Gaming Control Board lists sexual misconduct allegations that have been lodged against the mogul since January 2018. The complaint asks Nevada's Gaming Commission, which acts on the board's recommendations and has final say on licensing, to fine Wynn and revoke his status as being found suitable to be licensed in the industry.",0.1545869765417741,0.2610206332927203,0.2078038049172472,0.22554274770907157
N47485,news,newsus,"Health warning lifted over fire at California oil facility Authorities have lifted shelter-in-place orders for some 12,000 people in Northern California after containment of a fire at a fuel storage facility that sent up a huge cloud of smoke. Emergency sirens blared and thick plumes of black smoke and flames filled the skyline around the NuStar Energy LP facility in Crockett, California, about 30 miles (50 kilometers) northeast of downtown San Francisco.",0.1545869765417741,0.2598758108688448,0.20723139370530946,0.22477953275982124
N23163,news,newspolitics,"'You people with this phony Emoluments Clause': Cabinet meeting devolves into 71 minutes of Trump grievances President Trump, trying to dig out from two new political holes of his own making on top of the expanding House impeachment inquiry, held forth for 71 minutes Monday during what was ostensibly a Cabinet meeting but ended up being a familiar torrent of grievance, defensiveness and bold statements about his expansive view of his own powers.",0.1547391713397031,0.2707714085780696,0.21275528995888635,0.23209399616528076
N2735,sports,football_nfl,Jimmy Garoppolo addresses Erin Andrews interview by saying he uses 'baby' 500 times a game ,0.1548364186369922,0.2638831556021356,0.2093597871195639,0.22753424328042113
N35458,finance,markets,"Brazil oil auction a 'total disaster' as bidders stay away Brazil's largest-ever auction of oil deposits flopped, sending the real tumbling, after state-controlled Petroleo Brasileiro SA did most of the bidding while other major oil companies stayed away.",0.1551131603830778,0.266784929526599,0.2109490449548384,0.2295610064787586
N38939,music,musicnews,"This Guns N' Roses Video Just Became the First From the '80s to Reach 1 Billion YouTube Views Guns 'N Roses' rockin' black-and-white video for ""Sweet Child O' Mine"" has become the first video from the 1980s to hit one billion YouTube views.",0.1553369045006084,0.2751233281707559,0.21523011633568218,0.23519452028070675
N16292,foodanddrink,foodnews,"What it's like to cook for Kate Middleton and Prince William, according to Giada De Laurentiis One of the professional chef's favorite career moments was the day she cooked for the Duke and Duchess of Cambridge at a polo charity event.",0.1553369045006084,0.2310904976048217,0.19321370105271507,0.20583929990341726
N48076,tv,tvnews,"Whoopi Goldberg Asks Meghan McCain to 'Respect' Her 'View' Co-Hosts During Heated Discussion 'I'm not trying to cut you off, I'm trying to get you heard.'",0.1553369045006084,0.2532326239043214,0.20428476420246489,0.22060071743641707
N61005,sports,football_nfl,Randy Moss takes a perfect dig at Joe Buck's infamous 'disgusting act' call ,0.1553846787749393,0.2304476079603858,0.19291614336766255,0.20542663156523697
N13137,video,popculture,"Singer stands up to heckler who told her to take shirt off After being heckled on stage and told to ""free the nips"" at a concert in Texas, singer Maggie Rogers voiced her anger about the harassment.",0.1558763958490063,0.2468601776574016,0.20136828675320395,0.2165322503879365
N30698,news,newsus,Cranes remove bus partially swallowed by Pittsburgh sinkhole A bus that was partially swallowed when a sinkhole opened during morning rush hour in downtown Pittsburgh has been removed from the hole. Authorities said earlier Monday that two cranes arrived to remove the city bus.,0.1559509807643065,0.2619023196166037,0.2089266501904551,0.22658520666583798
N28088,movies,movies-celebrity,Bruce Willis brought Demi Moore to tears after reading her book Demi wasn't sure how her ex would feel about her book until he called her.,0.1559971345299355,0.2547526660352686,0.20537490028260202,0.2218341555334909
N54522,entertainment,celebrity,"Ben Affleck has a new girlfriend after using the Raya dating app, plus more celeb love life news for late October 2019 Meg Ryan and John Mellencamp call it quits, Halsey and Evan Peters get serious, James McAvoy weds, Meghan King Edmonds accuses hubby of cheating and more.",0.1560872184899312,0.2027295843913025,0.17940840144061687,0.18718212909084542
N32893,weather,weathertopstories,"A Northeast storm is intensifying into a bomb cyclone, forecasters say A bomb cyclone is taking shape along the Eastern Seaboard and starting to make itself felt in the Northeast.",0.1562664988674594,0.2692284008852527,0.21274744987635605,0.23157443354598828
N42137,entertainment,celebrity,Celeb couples with big age gaps Age is just a number for some stars!,0.1563622811634058,0.2472099898595782,0.201786135511492,0.2169274202941874
N64049,news,newsworld,"After Soldiers Surrender El Chapo's Son, a Shocked Mexican City Sighs With Relief In the days following the siege of the city of Culiacán by the Sinaloa cartel, residents were overcome with relief: Relief that the terror is over.",0.1565526953439202,0.258687085331804,0.2076198903378621,0.22464228866917607
N49179,movies,movienews,Joe Alwyn on Buzz Around Taylor Swift Romance: 'I'll Just Turn it Off' Joe Alwyn on Buzz Around Taylor Swift Romance: 'I'll Just Turn it Off',0.1565526953439202,0.2596961701009764,0.2081244327224483,0.22531501184862435
N35259,finance,finance-retirement,"'I'm 73 and fed up with California and want a gun-friendly, affordable city with good weather   so where should I retire?' Some hidden gems to consider in Georgia, New Mexico and Arkansas.",0.1565526953439202,0.2699262804583819,0.21323948790115105,0.232135085420228
N15919,news,newsus,"Saddleridge fire calms down, heavy rains on East Coast A new storm system is developing in the southern Plains and will move east over the next few days bringing a threat of flooding to the South with rain and gusty winds.",0.1565526953439202,0.2708857135806181,0.21371920446226914,0.2327747075017188
N55312,travel,travelnews,"Why are most aircraft painted predominantly white? Aircraft liveries, or the designs painted on the exterior of aircraft from the nose to the tail, are a way to identify to which airline the plane belongs.",0.1565526953439202,0.3024153621133206,0.2294840287286204,0.2537944731901871
N26122,weather,weatherfullscreenmaps,"Explosive new wildfire drives thousands from homes near Los Angeles The Maria fire ignited in Ventura County early Thursday night and raced westward, consuming 4,000 acres in just three hours.",0.1565526953439202,0.2570051952625749,0.20677894530324756,0.22352102862302337
N41420,news,newsus,Cracks found on 38 of 810 Boeing 737 NG jets inspected globally Cracks found on 38 of 810 Boeing 737 NG jets inspected globally,0.1565526953439202,0.2821336618330478,0.21934317858848398,0.24027333967000525
N29924,autos,autosenthusiasts,"25 Cars No One Wanted to Buy Along with cars so bad they become icons and the models that should have worked but never caught on come a slew of vehicles that'll have you scratching your head. Remind yourself of the disasters that were the Cadillac Catera, Buick Reatta, Volkswagen Phaeton, Lincoln Blackwood, Chrysler Executive Limousine, and more.",0.1565526953439202,0.2492714378291153,0.20291206658651773,0.21836519033405027
N11917,travel,travelnews,JetBlue Plane Makes Emergency Landing at JFK Airport The plane landed safely in NYC Sunday night.,0.1565526953439202,0.2465288479201559,0.20154077163203804,0.21653679706141066
N2153,news,newsworld,"Iran alleges foreign government behind 'treacherous' ship attack Iran said Monday a foreign government was behind what it alleges was a ""treacherous"" attack on a tanker off Saudi Arabia last week, as it released pictures of its damaged hull. But the state-owned NITC denied reports the alleged attack had originated from Saudi soil.",0.1565526953439202,0.287266206107131,0.2219094507255256,0.2436950358527274
N20091,weather,weathertopstories,"Firefighting Plane Battles Maria Fire Near Santa Paula A tanker dropped fire retardant to combat the Maria Fire near Santa Paula in Ventura County, California on Friday, November 1. By Friday, the fire had reached more than 9,000 acres and was at zero percent containment, according to CAL FIRE. The Maria Fire broke out at around 9 pm on Thursday, and ""exploded"" overnight, prompting mandatory evacuations affecting more than 10,000 residents between Santa Paula and Somis, according to reports. Firefighters are battling several blazes across the state, including the 77,000 acre Kincade Fire in Sonoma County and the 1,800 Easy Fire in Ventura County. Incident reports for the California wildfires can be found here. Credit: @shant_nazaryan via Storyful",0.1565526953439202,0.2748588767021387,0.21570578602302945,0.23542348291606588
N53436,finance,finance-real-estate,"Inside the Sheikh of Dubai's 800-acre Kentucky horse farm I got a tour of Sheikh Mohammed of Dubai's 800-acre horse farm in Kentucky, where horses live in immaculate barns with skylights and personal fans.",0.1565526953439202,0.2442482797939209,0.20040048756892054,0.21501641831058735
N37720,health,nutrition,"23 Foods That Help Lower High Blood Pressure Consuming less sodium may be important to help slash blood pressure levels, but eating more of these foods is good for your heart and arteries too. The post 23 Foods That Help Lower High Blood Pressure appeared first on The Healthy.",0.1565526953439202,0.311332804932921,0.23394275013842059,0.2597394350699207
N391,news,newsus,"Illegal drones ground water-dropping helicopters at critical moment in Maria fire battle LOS ANGELES - As flames rapidly spread along a hillside in Santa Paula, firefighters were faced with a perilous dilemma: ground night-flying helicopters working to contain the growing fire or risk an aerial collision with a thrill-seeking drone.",0.1565526953439202,0.2542028279216614,0.20537776163279078,0.22165278372908098
N5887,weather,weathertopstories,"Lucky Texas Storm Chaser Sees Hailstones Whizz Past Him During Tornado Storm chaser Marcus Diaz may think twice about how close he gets to the elements after large hailstones whizzed past his head from behind as he was filming an EF2 tornado in Tahoka, Texas, earlier this year. According to Accuweather, the winds in the tornado reached ""between 113 and 157 mph."" Diaz posted footage of the moment he was filming a ""dusty EF-2 tornado at close range"" as the hailstones almost hit ""the camera from behind,"" to Twitter on October 17. The lucky storm chaser told Storyful the footage was recorded on May 5. No injuries were reported as a result of the storm. However, the cyclone ripped through agricultural areas, ""causing structural damage to farms and wrecking equipment, power lines, and irrigation systems,"" according to media reports. Diaz may be better served in the future by heeding the advice of the National Oceanic and Atmospheric Administration (NOAA). According to NOAA, ""if you are unable to make it to a safe shelter, either get down in your car and cover your head, or abandon your car and seek shelter in a low lying area such as a ditch or ravine."" Credit: Marcus Diaz via Storyful",0.1565526953439202,0.2541294010043413,0.20534104817413074,0.2216038324508676
N42470,finance,finance-companies,G.M. Workers Approve Contract and End U.A.W. Strike The longest nationwide strike against General Motors in half a century ended on Friday after a solid majority of the company's union members delivered their support for the four-year contract hammered out by their leaders. The United Auto Workers union emerged with substantial wage increases and succeeded in ending a two-tier wage structure that had been a particular irritant in its ranks. It also won commitments to new G.M. investments in...,0.1567788207882841,0.2670224542263669,0.2119006375073255,0.2302745764136726
N11405,finance,finance-companies,"Boeing says up to 50 planes grounded globally over cracks Crisis-hit Boeing faced fresh safety concerns Thursday, as the firm admitted cracks were found in up to 50 of its popular 737NG planes following worldwide inspections.",0.1569325619041454,0.2578160211451606,0.207374291524653,0.22418820139815554
N56638,sports,basketball_nba,"LeBron James evacuates LA home, relocates family to hotel because of wildfires Lakers star LeBron James and his family were forced to evacuate their home in Los Angeles due to wildfires that have engulfed Southern California.",0.1569325619041454,0.240943283078189,0.1989379224911672,0.21293970935350778
N5092,sports,basketball_nba,Giannis Antetokounmpo spoils Harden-Westbrook debut with triple-double in Bucks comeback ,0.1569325619041454,0.243703544038255,0.2003180529712002,0.21477988332688513
N58997,sports,basketball_nba,"LeBron, D-Wade get hyped watching sons connect for basket LeBron James and Dwyane Wade were having a great time as basketball dads watching their son's play over the weekend for Sierra Canyon.",0.1569325619041454,0.2619970863699992,0.2094648241370723,0.2269755782147146
N25287,sports,basketball_nba,"Steve Kerr: Steph Curry is 'at his peak physically, mentally' ",0.1569325619041454,0.2608175744206078,0.2088750681623766,0.22618923691512036
N45189,news,newsscienceandtechnology,"Roman chariot and horse fossils are unearthed in Croatia after being buried in a ritual reserved for very wealthy families, archaeologists reveal Archaeologists uncovered the fossils near the city of Vinkovci in eastern Croatia and said this is the first time a burial ritual like this has been discovered in the country.",0.1569325619041454,0.2687544778477109,0.21284351987592814,0.23148050586652238
N50748,weather,weathertopstories,"A rare October snowstorm blankets the Texas Panhandle Heavy snow fell in parts of the Texas Panhandle on Thursday, causing near whiteout conditions in Amarillo, according to the National Weather Service.",0.1569325619041454,0.2561789570777473,0.20655575949094634,0.22309682535321332
N14167,music,music-celebrity,Britney Spears Does The Splits Like a Boss in Workout Video She's still got it!,0.1569325619041454,0.2557784041570959,0.20635548303062065,0.22282979007277906
N13480,video,popculture,"Jennifer Aniston on why she joined Instagram: 'I'm just trying to build content' Jennifer Aniston visited Jimmy Kimmel Live!, Wednesday to promote her new Apple series The Morning Show. And while she was there she also talked about her record breaking new Instagram account. As of last night's broadcast, Aniston's account had garnered over 11 million followers in less than two days. She set a new world record, racking up a her first million followers 29 minutes faster than the previous record holders Prince Harry and Megan Markle. While this is her first official instagram account it wasn't her first time on IG. Aniston admitted that she had a fake account prior to making things official. ""It was a stalker account,"" said Aniston, ""When I was thinking about doing this, I sort of figured it was time to kind of understand the world and dip my toe into the social media pool."" When asked why she joined Insta, Aniston replied, ""I don't know."" She also revealed that she does look at other people's Instagram posts. She said, ""I'm just trying to build content, as they say.""",0.1569325619041454,0.2222226463620367,0.18957760413309105,0.20045928487607292
N63411,lifestyle,lifestyleroyals,Meghan Markle's Leather Pencil Skirt is a Powerful Statement Piece Meghan Markle stepped out for an important guest panel appearance in a maroon long-sleeved top with an eye-catching red leather pencil skirt.,0.1569325619041454,0.2593277551585762,0.2081301585313608,0.22519602407376593
