ID,category,sub_category,content,collaborative_rec,content_rec,mean,two_one
N16158,lifestyle,lifestylebuzz,"Nationals pitcher criticized for missing playoff game for daughter's birth Daniel Hudson said his family is his ""top priority"" after receiving criticism for missing a playoff game for the birth of his daughter.",0.1091242661858017,0.2512173524665355,0.18017080932616858,0.20385299037295757
N62471,sports,football_nfl,"Trent Williams fails physical, experiencing discomfort with helmet Washington Redskins tackle Trent Williams' health situation has managed to get stranger after he reported to the team.",0.1130836673289527,0.2922536775974927,0.2026686724632227,0.2325303408413127
N64456,news,newsus,"LA's Getty fire was sparked by downed power lines, Mayor Garcetti says LOS ANGELES - The Getty fire was sparked by a tree branch that fell on power lines, Los Angeles Mayor Eric Garcetti announced at a news conference Tuesday evening. Video footage shows the branch breaking off a eucalyptus tree and sparking the fire in the 1900 block of North Sepulveda Boulevard, Garcetti said. The power lines being examined are operated by the Los Angeles Department of Water ...",0.1186344546343013,0.2702890768900474,0.19446176576217433,0.21973753613813202
N36068,sports,football_nfl,"AP source: Trent Williams ends holdout, reports to Redskins A person with knowledge of the situation says left tackle Trent Williams has reported to the Washington Redskins, ending his lengthy holdout. The person spoke to The Associated Press on condition of anonymity because the team had not announced Williams' return. He can be kept off the 53-man roster for up to three weeks after reporting. Washington did not deal the 31-year-old before the NFL trade deadline Tuesday, which prompted...",0.1186344546343013,0.2828781725762178,0.20075631360525953,0.22813026659557895
N57364,news,newspolitics,"Facebook's Zuckerberg grilled by AOC on fact-checking policy for political ads Facebook CEO Mark Zuckerberg struggled to explain the social media company's new policy on fact-checking political ads under questioning from Rep. Alexandria Ocasio-Cortez during a Tuesday hearing. The company recently announced that to protect political speech it would no longer fact check ads from politicians, essentially allowing campaigns to pay Facebook to spread disinformation. At the hearing of the House Financial Services committee,...",0.1186344546343013,0.2552531901633236,0.18694382239881246,0.2097136116536495
N62396,sports,football_nfl,Colin Kaepernick is the perfect replacement for Patrick Mahomes This is a good idea if Mahomes misses a lot of time.,0.1186344546343013,0.2913852069601722,0.20500983079723678,0.2338016228515486
N22929,sports,football_nfl,"Burning questions for Cowboys vs Giants on 'Monday Night Football' Capping off the action in Week 9, the New York Giants are hosting the Dallas Cowboys for the NFC Monday Night Football. There are five burning questions for this NFC matchup.",0.1186344546343013,0.2805103241395367,0.199572389386919,0.2265517009711249
N4745,news,newspolitics,"Testimony: White House lawyer told Vindman not to discuss Ukraine call The senior White House lawyer who placed a record of President Donald Trump's July 25 call with Ukraine's president in a top-secret system also instructed at least one official who heard the call not to tell anyone about it, according to testimony heard by House impeachment investigators this week.",0.1186344546343013,0.2862206675064717,0.2024275610703865,0.23035859654908156
N14437,sports,basketball_nba,"Suns' Deandre Ayton suspended 25 games for violating NBA anti-drug policy The league informed the Suns that Ayton, the top pick in the 2018 draft, tested positive for a diuretic. His suspension begins Friday.",0.1186344546343013,0.2895731101538372,0.20410378239406923,0.2325935583139919
N54807,news,newsworld,"Russia questions language of ""unusual"" Trump letter to Erdogan Russia questions language of ""unusual"" Trump letter to Erdogan",0.1186344546343013,0.2753201350069232,0.19697729482061227,0.22309157488271592
N32027,sports,football_nfl,Payton declines to name Saints starting QB for Week 8 ,0.1186344546343013,0.2654671606352469,0.1920508076347741,0.21652292530159836
N15087,sports,football_nfl,"Trent Williams to Cleveland rumor emerges Dysfunctional teams do dysfunctional things. But sometimes they do something that makes sense, against their nature. Washington may soon be throwing in the towel on the Trent Williams holdout, trading the disgruntled left tackle in advance of the deadline that arrives in only two weeks. Steve Doerschuk of the Canton Repository shares the news with [more]",0.1186344546343013,0.2694071271808741,0.19402079090758773,0.21914956966534985
N64395,sports,football_nfl,J.J. Watt has sobering quote after season-ending injury The Houston Texans lost the rock of their team for the season during Sunday's win over the Oakland Raiders. Stud pass rusher and future Hall of Famer J.J.,0.1186344546343013,0.2662593517655298,0.19244690319991553,0.21705105272178696
N5019,sports,football_nfl,"Winners, losers from Cowboys' win over Giants on 'Monday Night Football' In a NFC East tilt, the Cowboys overwhelmed the Giants defense late while Big Blue continues to trip over its own feet.",0.1186344546343013,0.2660756677924192,0.19235506121336027,0.21692859673971324
N52227,sports,basketball_nba,"Joel Embiid, Karl-Anthony Towns likely facing multi-game bans for roles in brawl Both teams don't play again until Saturday, so the league will have plenty of time to assess whether any players left the bench area, which could lead to additional suspensions.",0.1186344546343013,0.2656724315091711,0.1921534430717362,0.21665977255088115
N21851,sports,football_nfl,"Next man up: Chiefs prepare for life without Mahomes, with Moore Two weeks ago, Tyreek Hill served as Matt Moore's top target.",0.1186344546343013,0.2826982864689537,0.2006663705516275,0.22801034252406954
N49990,sports,football_nfl,Watch: Kevin Harlan's call of streaking cat on 'MNF' is epic This might legitimately be the best thing we've ever heard from Mr. Harlan.,0.1186344546343013,0.2420611770635061,0.1803478158489037,0.20091893625377116
N5211,sports,football_nfl,"Jets trade DL Leonard Williams to Giants The USC product is in the final year of his deal, and the Jets wanted to get something for him while they still could. The third-rounder they'll be getting from the Giants will presumably be an early third-rounder.",0.1186344546343013,0.2829663207792817,0.20080038770679148,0.22818903206428823
N37835,sports,football_nfl,Giants will not go back to Eli Manning after Daniel Jones' struggles Jones has thrown eight interceptions and has lost two fumbles in his past four starts.,0.1186344546343013,0.2917257872031416,0.20518012091872145,0.23402867634686148
N37481,sports,football_nfl,Baker Mayfield blasts officials after Browns loss: Refs were 'pretty bad today' ,0.1186344546343013,0.2732487238750586,0.19594158925467997,0.22171063412813952
N27164,sports,football_nfl,"Burning questions for Dolphins vs. Steelers on 'Monday Night Football' The Dolphins (0-6) are visiting the Steelers (2-4) to close out NFL Week 8 on Monday Night Football. Fans should brace for an ugly game, because that's been a weekly occurrence whenever the Dolphins take the field.",0.1186344546343013,0.2868271558205889,0.20273080522744508,0.23076292209182636
N34380,news,newspolitics,"House rejects GOP measure censuring Schiff Democrats in the House turned aside a GOP-led privileged resolution to censure House Intelligence Committee Chairman Adam Schiff (D-Calif.) on Monday in a 218-185 vote.Republicans and President Trump have increasingly targeted Schiff, a public face of the impeachment effort.They have taken issue with Schiff's exaggerated account of the details of President Trump's July 25 phone call with Ukrainian President Volodymyr Zelensky during a...",0.1186344546343013,0.2761149306808123,0.1973746926575568,0.22362143866530862
N21428,autos,autosnews,Ford's Mach E Electric SUV Spied Looking...Interesting We're not sure how we feel about this new EV's Mustang-inspired styling cues.,0.1186344546343013,0.2496951342907428,0.18416479446252204,0.20600824107192897
N17463,news,newspolitics,"Democrats unveil procedures for Trump's impeachment inquiry, rebutting GOP attacks The resolution hands the lead role to the House Intelligence Committee and its chairman, Rep. Adam B. Schiff, who would have broad latitude to organize extended questioning of potential public witnesses.",0.1186344546343013,0.2770834495356791,0.19785895208499021,0.2242671179018865
N1406,sports,football_nfl,"NFL Films signed off on airing of Sam Darnold's 'ghosts' comment A firestorm has erupted in New York over how an unflattering comment from a mic'd up Sam Darnold made the air during ESPN's coverage of the Jets' blowout loss to the Patriots on ""Monday Night Football.""",0.1186344546343013,0.2178902107017304,0.16826233266801585,0.18480495867925403
N62283,news,newsworld,British PM denied new Brexit deal vote Prime Minister Boris Johnson prepared to Monday make a second attempt to ram his EU divorce deal through parliament and avoid the political damage of delaying Brexit next week. But EU officials were still making preparations for Britain to leave in 10 days' time.,0.1186344546343013,0.30008513255255,0.20935979359342566,0.23960157324646708
N63306,sports,football_nfl,Jenkins' scorching response to Scandrick ripping Eagles Former Philadelphia Eagles cornerback Orlando Scandrick ripped into Malcolm Jenkins and his former teammates in general.,0.1186344546343013,0.271492207870175,0.19506333125223813,0.2205396234582171
N62055,news,newspolitics,"Trump campaign threatens to sue CNN, citing Project Veritas videos An attorney representing President Trump's reelection campaign sent a letter to CNN on Friday threatening to sue.",0.1186344546343013,0.2695090116491695,0.19407173314173543,0.21921749264421345
N26606,autos,autosenthusiasts,2020 Shelby GT500 Aero Performance & Cooling Supercomputers and 3-D Printing are secrets to the all-new Mustang Shelby GT500's high performance.,0.1186344546343013,0.2672894587339316,0.19296195668411648,0.21773779070072152
N35685,autos,autosreview,"First Drive! 2020 Shelby GT500 Is an Apex Predator, Turning Drivers Into Track Stars Driving the 2020 Shelby GT500 on the street, dragstrip, and road course reveals an apex predator that turns any driver into a track star.",0.1186344546343013,0.274826326577795,0.19673039060604813,0.2227623692632971
N32670,news,newspolitics,"McConnell tees up government funding votes amid stalemate Senate Majority Leader Mitch McConnell (R-Ky.) is turning the Senate toward trying to pass a set of long-stalled appropriations bills. ""Congress has fallen badly behind schedule on appropriations. It's been a month since my Democratic colleagues filibustered government funding here on the floor, blocking defense funding and a pay raise for service members. We need to get moving,"" McConnell said from the Senate floor. McConnell said the Senate...",0.1186344546343013,0.282699521828748,0.20066698823152468,0.2280111660972658
N45824,sports,football_nfl_videos,"Ian Rapoport: MRI results are good news for Patrick Mahomes, Kansas City Chiefs NFL Network Insider Ian Rapoport and James Palmer provide a Patrick Mahomes injury update.",0.1186344546343013,0.2735658582329775,0.19610015643363943,0.22192205703341877
N10270,autos,autossports,"What Do Old-School Mustang Guys Think of the Kia Stinger? We wondered, so we put the Original Venice Crew in our long-term Stinger GT.",0.1186344546343013,0.2602120316756222,0.18942324315496173,0.21301950599518188
N14137,sports,football_nfl,MetLife Stadium searching for the famous black cat from 'Monday Night Football' ,0.1186344546343013,0.2315710864704369,0.1751027705523691,0.19392554252505836
N4408,sports,football_nfl,"Patrick Mahomes already back at practice for Chiefs Although Reid didn't rule Mahomes out for the team's Week 8 game, it seems like a long-shot for the quarterback to get back onto the field that quickly.",0.1186344546343013,0.2848692234869922,0.20175183906064675,0.22945763386942855
N52196,news,newspolitics,"Graham claims victory with impeachment vote Sen. Lindsey Graham, who introduced a resolution condemning secretive impeachment proceedings in the House, claimed victory Monday after House Speaker Nancy Pelosi announced she'll hold a formal vote and open up the hearings to the public.",0.1186344546343013,0.2956209421661113,0.20712769840020628,0.23662544632217464
N52865,news,newspolitics,Ohio's Reputation As a Must-Win State May No Longer Be True ,0.1186344546343013,0.2397455830074515,0.1791900188208764,0.1993752068830681
N53209,sports,baseball_mlb,"​Are the Astros stealing signs to gain an edge in ALCS? Hopefully. If your code is easy to crack, the problem is on you, not the codebreaker.",0.1186344546343013,0.290578867575329,0.20460666110481518,0.2332640632616531
N64554,entertainment,entertainment-celebrity,"Meghan King Edmonds, Jim Edmonds' Nanny Denies Cheating Allegations Meghan King Edmonds, Jim Edmonds' Nanny Denies Cheating Allegations",0.1265532569206031,0.2414658462699647,0.1840095515952839,0.2031616498201775
N2078,tv,tv-celebrity,"Rainbow Baby! Shawn Johnson, Andrew East Welcome 1st Child After Miscarriage Rainbow Baby! Shawn Johnson, Andrew East Welcome 1st Child After Miscarriage",0.1265532569206031,0.2735688323692341,0.2000610446449186,0.22456364055302377
N8237,foodanddrink,restaurantsandnews,16 Secrets Olive Garden Doesn't Want You to Know Here's everything you've wanted to know about your favorite breadstick-serving restaurant.,0.1265532569206031,0.2370763243445861,0.1818147906325946,0.20023530186992508
N13225,travel,traveltripideas,5 Reasons Destin Is a Great Family Vacation Destination The calm emerald waters and family-friendly attractions of the area make Destin a top spot for a fall or winter getaway.,0.1265532569206031,0.2588151334828499,0.1926841952017265,0.2147278412954343
N30974,sports,basketball_ncaa,"Police identify 2 suspects in murder of Andre Emmett last month Two men accused of killing former Texas Tech and NBA player Andre Emmett were identified by Dallas police on Monday, the Dallas Morning News reported.",0.1265532569206031,0.2782497044719745,0.2024014806962888,0.2276842219548507
N43374,news,newspolitics,Trump goes on Twitter tear after White House official condemns his Ukraine call President Donald Trump launched a sustained online offensive after details emerged of damaging congressional testimony by a senior White House official.,0.1265532569206031,0.2775928314405559,0.2020730441805795,0.22724630660057163
N16344,entertainment,celebrity,Stars   They're Just Like Us! Stars   They're Just Like Us!,0.1265532569206031,0.2405005079388116,0.18352688242970733,0.2025180909327421
N30827,foodanddrink,restaurantsandnews,"These are the 11 classic food-court chains with the most locations From Panda Express to Auntie Anne's to Baskin-Robbins, these are the 13 classic food-court chains with the most US locations.",0.1265532569206031,0.2121312172277624,0.16934223707418275,0.1836052304587093
N56444,health,wellness,"Jameela Jamil Called Out a New TV Show Where Judges Decide If Contestants ""Deserve"" Plastic Surgery The Good Place star had a lot to say after learning about ""The Surjury,"" a new British reality series about people competing against one another to win free plastic surgery.",0.1265532569206031,0.2358969483615688,0.18122510264108593,0.19944905121458023
N50479,health,wellness,"Items you need to stop sharing with others right now Items you should never share for your health and safety include everyday items like toothbrushes, earbuds and lipstick.",0.1265532569206031,0.2735865532075434,0.20006990506407324,0.22457545444522994
N31802,entertainment,celebrity,Stars turning 50 in 2019 Find out which celebrities are celebrating the big 5-0 in 2019!,0.1265532569206031,0.2495879804240668,0.18807061867233493,0.20857640592291224
N42791,tv,tvnews,"Eva Longoria: 'Latinas Are the Last to Find Their Voices Amplified' Eva Longoria delivered a powerful and moving keynote at TheWrap's Power Women Summit in Los Angeles on Friday, saying that people in Hollywood are ""largely responsible for much of the unconscious bias that is against people of color"" and that ""Latinas are the last to find their voices amplified in this industry."" ""What studies show is that we are being erased,"" Longoria told a room of 2,000 attendees. ""This goes beyond underrepresentation. When...",0.1265532569206031,0.2432831424652133,0.18491819969290818,0.2043731806170099
N2018,entertainment,celebrity,"Debunking the week's tabloid stories: Nov. 1, 2019 A round-up of the week's tabloid stories that totally missed the mark.",0.1265532569206031,0.2261883401609437,0.1763707985407734,0.19297664574749682
N58744,lifestyle,voices,"I Gave Up On Love, And It Was One Of The Best Decisions I Ever Made At the end of our date in August 2018, Justin escorted me to my car, where henervously kissed me. When I kissed him back, he cheered, pumping his fists inthe air like he'd won something. I walked from the curb to my car, and when Iturned around, he was watching me, beaming.""I just want to make sure you get to your car safely,"" he said, even though Iwas less than a yard away.I slipped into the driver's seat, thrilled that our second date had gone...",0.1265532569206031,0.2590288759243516,0.19279106642247734,0.21487033625643542
N59469,lifestyle,lifestyleroyals,"Every outfit Duchess Kate has worn in 2019 See Kate Middleton's style choices this year from glam gowns and coat dresses to re-wears, tiaras and hats.",0.1265532569206031,0.2570933433169957,0.1918233001187994,0.21357998118486482
N59774,foodanddrink,restaurantsandnews,"The Unreasonable Lengths Restaurant Workers Have to Go to Take Time Off From working doubles in advance to finding their own replacements, here's how unsalaried shift workers manage when it comes to vacation.",0.1265532569206031,0.2343669058164835,0.1804600813685433,0.19842902285119005
N22614,sports,football_ncaa,Predicting which of college football's 10 undefeated teams will lose in Week 9 How many teams will still have a perfect record after Week 9?,0.1265532569206031,0.2681785628381467,0.19736590987937488,0.2209701275322988
N47922,music,music-celebrity,"Allegations against entertainer Todrick Hall are piling up, from stories of nonpayment to accusations of backlash for reporting sexual assault Todrick Hall became prominent in Broadway musicals, for his friendship with Taylor Swift, and more. Now, accusations against him are piling up.",0.1265532569206031,0.2468441020634004,0.18669867949200175,0.20674715368246796
N51503,sports,football_ncaa,"Bill Plaschke: Mike Bohn brings USC integrity, which means he can't hire Urban Meyer LOS ANGELES_You ever heard of Mike Bohn? Me neither, and that's a good thing. The University of Southern California is apparently set on naming Bohn as its new athletic director, the smart hiring of a man who embodies the most important attribute for the new leader of the Trojans family. He's a complete stranger. He never played football at USC. He never coached football at USC. He never ...",0.1265532569206031,0.2562384242614476,0.19139584059102535,0.21301003514783276
N6576,health,weightloss,16 Women Reveal Exactly How They Got Six-Pack Abs What does it really take to get six-pack abs? These women can tell you exactly what worked for them.,0.1265532569206031,0.2751804493380887,0.2008668531293459,0.22563805186559352
N51457,foodanddrink,restaurantsandnews,Restaurants Are Dealing With an Avalanche of Special Requests. One Chef Has Had Enough. It's not all about you.,0.1265532569206031,0.2126860126610931,0.1696196347908481,0.18397509408092977
N2183,tv,humor,"The top female comedians working in film and television today Film and television, specifically in the comedic vein, is currently blessed with a bevy of talented women. The transition from writing standup material to award-winning, mainstream masterpieces has never been so visible, and the impressive canon of female voices peppering the entertainment world is staggering.",0.1265532569206031,0.245914375943035,0.18623381643181905,0.20612733626889104
N40526,music,music-celebrity,Miranda Lambert Shares the Surprising Story of Her and Brendan McLoughlin's Meet-Cute The Pistol Annie's are to thank for introducing the country singer to her husband,0.1265532569206031,0.2429825844573764,0.18476792068898973,0.2041728086117853
N12709,lifestyle,lifestylebuzz,"Twitter Had Feelings About Mark Zuckerberg's Micro-Bangs Facebook founder Mark Zuckerberg debuted a new haircut on the House floor on Wednesday, and Twitter quickly took note with an avalanche of memes and quips.",0.1265532569206031,0.2358693856537931,0.18121132128719808,0.1994306760760631
N36593,foodanddrink,foodnews,"How the Boston cream pie became a beloved dessert A product of the longest continually operating hotel in the United States, the Boston cream pie combines sponge cake, vanilla custard and chocolate icing to form a beloved American dessert.",0.1265532569206031,0.2495622003314836,0.18805772862604336,0.20855921919452344
N54449,news,newsus,"Third Indiana Catholic school employee fired in growing scandal over LGBTQ staff Unlike the others fired from Indianapolis-area Catholic schools, Kelley Fisher is straight and only expressed support for her fired colleagues.",0.1265532569206031,0.2575472632509259,0.1920502600857645,0.21388259447415164
N50258,news,newspolitics,Trump feuds with Susan Rice over Syria President Trump exchanged barbs with the former Obama administration national security adviser Susan Rice over Syria after she criticized his policy.,0.1265532569206031,0.2772601229355234,0.20190668992806324,0.22702450093054996
N22627,news,newsus,Family Members Plead for Help in Search for Missing Atlanta College Student: 'Just Come Home' Family Pleads for Help in Search for Missing College Student,0.1265532569206031,0.2649478573252256,0.19575055712291434,0.21881632385701807
N56290,foodanddrink,tipsandtricks,The Secret Ingredient for Sausage Gravy That's Out of This World Transform your gravy with this $1 ingredient,0.1265532569206031,0.2500551660338924,0.18830421147724774,0.2088878629961293
N61972,entertainment,entertainment-celebrity,"New details on why Meg Ryan, John Mellencamp split, plus more news Meg Ryan and John Mellencamp's marriage plans may have prompted their split. Plus, more celebrity news for Nov. 4, 2019.",0.1265532569206031,0.241801012589653,0.18417713475512804,0.20338509403330304
N30103,travel,traveltripideas,"A network of 28 tiny, one-bed hotels in Amsterdam is being called the most beautifully designed hotel of 2019   and it consists of a series of converted bridge houses. Take a look inside. Amsterdam's bridge hotels, located in historic houses on and near bridges, are a tiny house lover's dream ⁠  and they just won a major design award.",0.1265532569206031,0.2301127177208218,0.17833298732071245,0.19559289745408223
N12785,sports,baseball_mlb,"With Carlos Beltran hire it's clear the Mets learned nothing from the Mickey Callaway mess In hiring Carlos Beltran to guide their fortunes next year, the Mets hierarchy once again out-thought themselves by going ""outside-the-box"" for someone who had never managed anywhere before.",0.1265532569206031,0.2339973579393909,0.18027530742999698,0.19818265759979495
N56438,news,newsus,The 'race whisperer' A black activist convinced a neo-Nazi he'd save him from legal ruin. Then the real plan got underway.,0.1265532569206031,0.2590416836752667,0.1927974702979349,0.2148788747570455
N56853,news,newsworld,"Trump orders withdrawal of U.S. forces from northern Syria, days after Pentagon downplays possibility U.S.-allied Syrian Kurdish fighters announced late Sunday that the Syrian Army would deploy along the Turkish border to ""liberate the areas that the Turkish army has entered with its mercenaries.""",0.1265532569206031,0.269157605380526,0.19785543115056456,0.2216228225605517
N53118,health,health-news,Colorado Mom's Touching Facebook Post Beautifully Explains Why We Shouldn't Suffer in Silence One Colorado mom's Facebook post recently went viral for showing how much asking a friend for help can make the difference when you're feeling alone.,0.1265532569206031,0.2412764677002807,0.1839148623104419,0.20303539744038815
N63248,lifestyle,lifestylecelebstyle,"Hailey Baldwin wore three show-stopping dresses during her wedding, and put a unique twist on each one Hailey Baldwin's three custom gowns were designed by Virgil Abloh of Off-White, Vera Wang, and Ralph & Russo.",0.1265532569206031,0.243431151155412,0.18499220403800753,0.20447185307714236
N21389,news,newsworldpolitics,Rep. Katie Hill's lawyers send cease-and-desist letter to DailyMail.com over nude photos The website is the second to publish alleged lewd photos of the Democratic congresswoman.,0.1265532569206031,0.2539734818129764,0.19026336936678975,0.21150007351551864
N11163,news,newspolitics,"Kobach's campaign paid Kansan known to post racist comments on white nationalist site Kansas Republican Kris Kobach's Senate campaign paid an Olathe man who regularly posted hateful comments about Jews and racial minorities on a white nationalist website. Kobach's campaign paid Joe Suber $500 for field coordinating services in September, according to the Republican's latest campaign finance report. Suber also filed the paperwork with the state of Kansas creating ...",0.1265532569206031,0.2630930824050753,0.1948231696628392,0.21757980724358456
N31099,travel,traveltripideas,Harry Potter's Childhood Home in England Is Now on Airbnb I think I can die happy now.,0.1265532569206031,0.2437820205554818,0.18516763873804243,0.20470576601052223
