ID,category,sub_category,content,collaborative_rec,content_rec,mean,two_one
N43595,travel,traveltripideas,"Best all-inclusive resorts in the world Certain vacation destinations are known for having a wealth of all-inclusive resorts (the islands of Fiji and Jamaica come to mind). But resorts that wrap fun, food and drinks into a convenient package can be found all over the world. From a Cancun family favourite and an all-inclusive ski resort in the Alps to a far-flung locale that caters to scuba divers, you'll find a bit of everything on this roundup of the best all-inclusive resorts in the world.",0.3078797582375178,0.316321219686156,0.3121004889618369,0.3135073992032766
N46267,sports,basketball_nba,Report: Timberwolves 'fuming' over NBA's ruling in Karl-Anthony Towns-Joel Embiid fight The Timberwolves reportedly wanted Ben Simmons punished. Their grievances apparently didn't end there.,0.3093513193194953,0.2579027823871106,0.283627050853303,0.2750522946979055
N3057,finance,finance-retirement,4 things every retiree should know Your new life may be liberating   and daunting.,0.3150439012918383,0.297031862833689,0.3060378820627636,0.3030358756530721
N33771,sports,football_ncaa,Florida State football looking to replace former Coach Willie Taggart quickly Florida State Director of Athletics David Coburn wants to have a new head coach in place quickly to replace Willie Taggart.,0.4412908821131542,0.2840362338025977,0.36266355795787597,0.3364544499061165
N51188,sports,baseball_mlb_videos,"ALCS Game 6 Highlights: Yankees vs. Astros After Yankees 2B DJ LeMahieu hit a game tying 2-run homer in the top of the 9th inning, Astros' 2B Jose Altuve smashed a walk-off 2-run home run off of Aroldis Chapman to send Houston back to the World Series for the second time in three years.",0.5136583628247251,0.3061516013580945,0.4099049820914098,0.3753205218469714
N56051,lifestyle,lifestyleroyals,"Meghan Markle and Prince Harry Reunite with Kate Middleton and Prince William for Remembrance Service Meghan Markle, Harry Reunite Kate and William at Remembrance Day",1.0,0.279667808815183,0.6398339044075915,0.519778539210122
N36532,weather,weathertopstories,Winds fan ferocious fires in Australia's most populous state Ferocious wildfires were burning at emergency-level intensity across Australia's most populous state and into Sydney's suburbs on Tuesday as authorities warned most people in their paths that there was no longer time to flee.,1.0,0.27944672705959,0.639723363529795,0.51963115137306
N14592,entertainment,entertainment-celebrity,"Chrissy Teigen's weekend was basically a clapback double-header, plus more news Chrissy Teigen gives us two more lessons in the art of the clapback. Plus, more celebrity news for Nov. 12, 2019.",1.0,0.2799605640741891,0.6399802820370946,0.5199737093827927
N37320,news,newspolitics,"Pro-Trump conservatives are getting trolled in real life by a far-right group Groypers, as they call themselves, fuse online political extremism with stunts at conservative events.",1.0,0.2532400217733386,0.6266200108866693,0.502160014515559
N42977,news,newsus,"'It's not over': Sarah Palin says she is fighting to repair her marriage Former Alaska Gov. Sarah Palin said she learned her husband, Todd, wanted a divorce in an email from his lawyer and that the two are seeking counseling.",1.0,0.291436437364987,0.6457182186824935,0.527624291576658
N29196,health,health-news,"Florida boy's mock CPR drill goes viral: 'How cute is this!' The saying ""the apple doesn't fall far from the tree"" rings very true for a 3-year-old Florida boy who apparently wants to be just like his father, a first responder.",1.0,0.2610249660026442,0.6305124830013221,0.5073499773350961
N47099,foodanddrink,tipsandtricks,"This Korean Ingredient Makes Your Chili Taste Amazing As in, more amazing than it already is.",1.0,0.3002892731671879,0.6501446365835939,0.5335261821114585
N12995,news,newsus,"Cows swept out to sea by Hurricane Dorian are found months later   on the Outer Banks CHARLOTTE, N.C. - Cape Lookout National Seashore on the Outer Banks has discovered three cows are roaming the national park, and it is believed they got there by swimming four to five miles across the Core Sound during Hurricane Dorian. All three were living on Cedar Island when the hurricane generated a ""mini tsunami"" on Sept. 6, sweeping much of the wildlife off the island, including 28 wild ...",1.0,0.2642847263860862,0.6321423631930431,0.5095231509240574
N22417,travel,travelarticle,Divers salvage 100-year-old liquor from WWI shipwreck A team of ocean explorers says it has retrieved cognac and liqueur from a ship that was bound for Russia when it was sunk by a German submarine in 1917.,1.0,0.289595385255271,0.6447976926276355,0.526396923503514
N58241,finance,markets,"The Dow was perfectly unchanged on Tuesday, a rare occasion on Wall Street The 30-stock average closed flat going out at least six decimal places. It was the first unchanged close for the Dow since April 24, 2014.",1.0,0.2949893817314931,0.6474946908657465,0.5299929211543287
N40065,sports,more_sports,"The Day in Sports: Sunday, November 10, 2019 The Day in Sports: Sunday, November 10, 2019",1.0,0.2971014620219816,0.6485507310109908,0.5314009746813211
N49030,movies,movies-celebrity,"Kevin Hart Steps Out for Date Night With Wife Amid Recovery From Car Accident Kevin Hart is in better spirits following the violent car crash that left him hospitalized in September. Last night, he was spotted out with his wife for date night in Los Angeles.",1.0,0.2806899640146424,0.6403449820073213,0.5204599760097616
N26706,news,newsus,Missing California hiker found dead at top of glacier just weeks before baby was due A missing hiker from Huntington Beach California was found dead on Thursday at the top of the Darwin glacier in the Inyo National Forest.,1.0,0.2710680681062715,0.6355340340531357,0.5140453787375143
N35131,finance,markets,"The world's largest trade deal could be signed in 2020 RCEP involves all 10 ASEAN countries and five of the bloc's major trading partners: Australia, China, Japan, New Zealand and South Korea.",1.0,0.3189578679601997,0.6594789339800998,0.5459719119734665
N64745,sports,baseball_mlb,"With latest sign-stealing revelations, Houston Astros once again toe baseball's ethical lines Accused of electronically stealing signs in 2017, the Astros organization faces even more questions about its culture.",1.0,0.2697320303367162,0.634866015168358,0.5131546868911441
N62933,news,newspolitics,"Roger Stone's defense: MAGA, God and Donald Trump Given the chance to tell his side of the story, Stone chose not to take the witness stand. Given the opportunity to call witnesses, his attorneys opted instead to simply play portions of the congressional testimony in question.",1.0,0.3139015277127057,0.6569507638563529,0.5426010184751371
N48064,news,newsworld,"Why Ukraine and Russia are still at war A long and draining war in eastern Ukraine has become embroiled in President Trump's attempts to undermine his opponents at home. But the war is real and still taking lives, and a way to end it will be very difficult to find.",1.0,0.2959690026090641,0.647984501304532,0.530646001739376
N47401,foodanddrink,tipsandtricks,"Your turkey timeline: what to do and when for the perfect holiday roast Most people only cook a turkey once or twice a year which inevitably turns the whole thing into a stressful experience, full of paranoia that the bird will turn out dry. But fear not! Our fail-safe turkey timeline will take you all the way from ordering through to what to do with the leftovers.",1.0,0.3083782614098381,0.654189130704919,0.5389188409398921
N13907,finance,finance-saving-investing,4 reasons you shouldn't max out your 401(k) Making high-dollar contributions to your 401(k) can cost you.,1.0,0.3113266759084407,0.6556633379542204,0.5408844506056272
N31679,entertainment,celebrity,Biggest celeb weddings of the last decade Take a look back at the most memorable and extravagant celeb weddings that went down in the 2010s.,1.0,0.2967044332356972,0.6483522166178486,0.531136288823798
N56193,sports,football_nfl,Cowboys have questionable red zone calls in loss to Vikings ,1.0,0.2790130891693098,0.6395065445846548,0.5193420594462065
N61320,lifestyle,lifestyleroyals,Kate Middleton Wore a Simple Black Dress and Embellished Headband to the Festival of Remembrance The Duchess of Cambridge and the rest of the royal family are honoring those who have died in battle this weekend.,1.0,0.2547502966801521,0.627375148340076,0.5031668644534347
N36436,news,newsphotos,"The 12 Texas cities everyone in the country is moving to Texas' largest cities were at the top of the list, as well as Midland, a major hub of the fracking boom.",1.0,0.2892040948794031,0.6446020474397015,0.5261360632529354
N51587,travel,traveltripideas,"The 24 Most Beautiful Castles in Europe Eat your heart out, Disney.",1.0,0.2676202769084121,0.6338101384542061,0.5117468512722747
N64560,sports,basketball_nba,"Report: Knicks' brass will stay on if team shows 'progress' this season The New York Knicks' front office appears to be safe for now. Owner James Dolan met with president of basketball operations Steve Mills and others in management on Monday. The Knicks' brass left with the impression that their jobs would be secure as long as the team ""showed progress"" this season, league sources told SNY's Ian Begley. However, it's unclear what Dolan deems as ""progress,"" reports Begley. Mills and general manager Scott Perry are...",1.0,0.2925698047739038,0.6462849023869519,0.5283798698492692
N33677,tv,tv-celebrity,Marie Osmond 'chipped off a piece' of her kneecap when she fell on stage during performance Marie Osmond reveals that she chipped her knee when she fell during her Las Vegas residency performance last week.,1.0,0.2844377034106641,0.642218851705332,0.5229584689404427
N57327,lifestyle,lifestylebuzz,Please Don't Yell at Your Dog! A new study shows it can cause long-term psychological impacts.,1.0,0.2822929099275661,0.6411464549637831,0.5215286066183774
N49712,news,newsgoodnews,"Wisconsin bus driver saves children wandering in snow, as deadly Arctic air mass grips US As bitter cold took hold across the Midwest earlier this week, a sharp-eyed bus driver in Wisconsin was credited with helping rescue two children who were very underdressed for the weather conditions.",1.0,0.2768877866162043,0.6384438933081021,0.5179251910774695
N19376,sports,basketball_nba,The HoopsHype Daily: Trae Young putting up monstrous numbers ,1.0,0.3113154867451505,0.6556577433725752,0.5408769911634337
N58020,foodanddrink,beverages,Brooklyn Brewery Shows Craft Beer Can Be Nonalcoholic Too Special Effects hits all the notes of a craft brew with none of the alcohol,1.0,0.2561516091947069,0.6280758045973535,0.5041010727964712
N4913,finance,finance-companies,Don't be fooled: Costco says $75 coupon is a scam Wholesale retailer Costco is warning customers about a new scam that is promising shoppers a $75 coupon.,1.0,0.2604437783290849,0.6302218891645425,0.5069625188860566
N43670,sports,basketball_nba,"Draymond criticizes official for ejection: 'Don't tell me not to talk' Golden State Warriors forward Draymond Green made Chase Center history during Monday's loss to the Utah Jazz, becoming the first player ejected from a game in the new venue after arguing with an official. The three-time All-Star was given a second technical foul for continuing to plead his case after disagreeing with a blocking call, but it seems Green's spat with the official went beyond just that foul. ""I disagreed with that call,"" Green told...",1.0,0.2951340981287008,0.6475670490643504,0.5300893987524672
N58553,lifestyle,lifestyleroyals,"Prince Harry and Meghan Markle Will Reportedly Visit Oprah While in California During their six-week break from their royal duties, Prince Harry and Meghan Markle are planning to visit Oprah Winfrey, according to a royal insider.",1.0,0.2826839123392912,0.6413419561696456,0.5217892748928608
N9652,finance,finance-real-estate,"NYC is selling 'air rights' to city housing buildings, first big deal goes to de Blasio donors It may not be a bridge, but the city has something to sell you in Brooklyn   and donors to Mayor de Blasio are first in line to benefit. In what appears to be a textbook ""pay-to-play"" move, the city is selling NYCHA development rights to builders who gave de Blasio's campaigns more than $20,000.",1.0,0.2534394675176962,0.6267197337588482,0.5022929783451308
N38309,tv,tv-celebrity,Joe Giudice Says It Was 'Painful' Watching Real Housewives of New Jersey from Prison Joe Giudice Says It Was 'Painful' Watching RHONJ from Prison,1.0,0.2726127437708017,0.6363063718854008,0.5150751625138678
N15855,lifestyle,lifestyleroyals,"A body-language expert says Meghan Markle is ""politely disconnecting"" from the public, and honestly, we would too Can we blame her? Meghan Markle is supposedly ""politely disconnecting"" from the public as seen in her body language, and girl, you do you.",1.0,0.282703300182847,0.6413516500914235,0.521802200121898
N7821,sports,football_nfl,"'Monday Night Football' commentator under fire after belittling criticism of 49ers kicker for missed field goal Joe Tessitore called out 49ers kicker Chase McLaughlin after he shanked a potential game-winning kick in San Francisco, and some fans weren't happy.",1.0,0.2772784115899687,0.6386392057949843,0.5181856077266458
N241,finance,finance-companies,"Are Stores Open on Veterans Day? Target, Aldi, Walmart and More Will shoppers be able to make the most of Veterans Day deals this public holiday?",1.0,0.2612758117201952,0.6306379058600976,0.5075172078134634
N46477,movies,movienews,Mark Ruffalo Wants to Set Up Jennifer Aniston on a Date Mark Ruffalo Wants to Set Up Jennifer Aniston on a Date,1.0,0.2802059784280934,0.6401029892140467,0.5201373189520623
N51808,news,newspolitics,"Democrats' impeachment lawyer cut his teeth prosecuting mobsters, Wall Street cheats Daniel Goldman will lead witness questioning during the hearings that begin Wednesday.",1.0,0.2852839591318059,0.642641979565903,0.5235226394212039
N41578,lifestyle,lifestyleroyals,Meghan Markle Chose a Chic Black Ensemble for Remembrance Sunday Services She paired her outfit with a bold hat and a crimson poppy pin.,1.0,0.2547427012761032,0.6273713506380516,0.5031618008507355
N23184,entertainment,celebrity,Long-term celebrity couples who won't get married These committed celeb couples have opted not to tie the knot.,1.0,0.276729178426929,0.6383645892134645,0.5178194522846193
N26944,news,newsus,"Jeffrey Epstein's Estate May Set Up a Program to Pay Accusers Lawyers for Jeffrey Epstein's estate are considering setting up a program to resolve claims filed by women who say they were abused by the financier, who killed himself in August while facing federal sex trafficking charges. The plan was disclosed in a court filing on Tuesday by a lawyer for one of Mr. Epstein's accusers, who is suing the estate in federal court in Manhattan. The filing said lawyers for Mr. Epstein's estate had informed...",1.0,0.300083256856274,0.650041628428137,0.5333888379041827
N17896,autos,autossuvs,"Should Chevy Bring This Three-Row Blazer to the U.S.? It's set to go on sale in China soon, but we could see this bigger Blazer doing well in America, too.",1.0,0.2618865783119413,0.6309432891559706,0.5079243855412942
N35850,news,newsus,U.S. Judge Blocks 'Suspicionless' Searches of Phones at Borders A federal judge rejected a Trump administration policy allowing agents at U.S. border crossings and airports to arbitrarily search the phones and laptops of international travelers.,1.0,0.2628708528399199,0.63143542641996,0.5085805685599466
N44818,sports,football_nfl,Redskins name rookie Dwayne Haskins starter for rest of season ,1.0,0.2943311062145545,0.6471655531072773,0.529554070809703
N51896,health,fitness,"Watch the 'Footloose' Dance Warmup That Gets These High Schoolers Ready to Race They tear up the course before, well, tearing up the course.",1.0,0.2733149730466775,0.6366574865233388,0.5155433153644516
N36252,finance,markets,Oil rises after OPEC's Barkindo says U.S. shale growth may slow in 2020 Oil rises after OPEC's Barkindo says U.S. shale growth may slow in 2020,1.0,0.2738276740179456,0.6369138370089729,0.5158851160119637
N52600,finance,finance-companies,"Saudi Aramco takes another step toward 1st public offering DUBAI, United Arab Emirates (AP)   Saudi Arabia's state-owned oil giant Aramco revealed it will sell up to 0.5% of its shares to individual investors, but in a lengthy document published late Saturday it did not disclose how much of the company will be floated when it goes public on the country's domestic exchange.",1.0,0.2928093077770018,0.6464046538885009,0.5285395385180012
N54161,news,newsus,"Berliners tried to send Trump a piece of the Berlin Wall with a message saying 'no wall lasts forever' The 2.7-ton chunk of concrete arrived in Washington, DC, on Saturday, and local media outlets reported that the Secret Service turned it away.",1.0,0.2566492892385432,0.6283246446192716,0.5044328594923622
N60408,weather,weathertopstories,"Over 20 inches of snow for some Michigan communities in 24 hours! Significant amounts of snow fell within a meandering lake-effect snow band overnight into Tuesday morning across parts of the southwestern Lower Peninsula of Michigan, resulting in up to and over 2 feet in some locations... and that's where AccuWeather's Blake Naftel took in some of the snowy spectacles as people begun to dig out.",1.0,0.2733105335774078,0.6366552667887039,0.5155403557182718
N25138,sports,football_ncaa,"College Football Playoff picture: 4 in, 2 out, 5 to watch Sporting News takes a look at the College Football Playoff picture heading into Week 12 of the season.",1.0,0.2962508124764211,0.6481254062382106,0.5308338749842807
N30135,news,newsgoodnews,"Tennessee judge holds lawyer's baby as he swears her into the state bar in viral video Tennessee Court of Appeals Judge Richard Dinkins is going viral after a video showed him swearing in a new lawyer last week while holding her baby.In footage making the rounds online, Dinkins could be seen lightly bouncing the baby on his hip while he administered the oath to Juliana Lamar, the mother of the 1-year-old child who recently graduated from Belmont University College of Law, according to BuzzFeed News.Y'all. Judge Dinkins of the...",1.0,0.2861416429030907,0.6430708214515454,0.5240944286020605
N63550,lifestyle,lifestyleroyals,Why Kate & Meghan Were on Different Balconies for Remembrance Sunday There's no scandal here. It's all about the order of precedence.,1.0,0.2681649998900972,0.6340824999450486,0.5121099999267315
N15506,news,newsworld,"Trump 'so extreme' on climate he's waking people up, Greta Thunberg tells AFP Swedish teen activist Greta Thunberg said Tuesday that US President Donald Trump's climate change denialism was ""so extreme"" that it had helped galvanize the movement to halt long term planetary warming. The venue was originally in Chile but was shifted because of political unrest, forcing Greta to change her travel plans.",1.0,0.2798679964692405,0.6399339982346203,0.5199119976461604
N39389,lifestyle,lifestylebuzz,"Dog Rips The Tail Off Every Single One Of His Toy Pigs Tim Eberts When Diesel's parents first brought him home a cute little stuffed pig toy, they had no idea just how much the husky was going to love it.",1.0,0.2630601019578892,0.6315300509789445,0.5087067346385927
N54482,lifestyle,lifestylebuzz,"Mixed-race mother reveals strangers question whether she's related to her fair-skinned daughter - including a suspicious church-goer who asked the girl: 'Is this your Mummy?' Davina Moon, 32, from Surrey, who has a mixed heritage including Sri Lanka and Ireland, told how society often treats her differently because she doesn't look like her children.",1.0,0.2602498326070198,0.6301249163035099,0.5068332217380132
N61145,foodanddrink,tipsandtricks,Stop! Read This Guide Before You Buy an Air Fryer. Shopping for air fryers? Or maybe air fryer toaster ovens? Our air fryer buying guide will help you find the perfect appliance for your needs.,1.0,0.2973198037787754,0.6486599018893877,0.5315465358525169
N37204,health,health-news,"Model, 23, Didn't Know She Was Pregnant Until She Gave Birth to a Full-Term Baby in Her Bathroom An Australian model recently had a life-changing surprise when she gave birth to a baby in her bathroom, despite not knowing that she had been carrying her daughter for nine months.",1.0,0.2788908644885824,0.6394454322442912,0.5192605763257216
N46751,news,newscrime,"Mom named person of interest in 5-year-old girl's disappearance The search for Taylor Rose Williams, 5, began in Jacksonville on Wednesday.",1.0,0.2590426609544645,0.6295213304772322,0.5060284406363096
N496,music,cma-awards,"Fashion hits and misses from the 2019 Country Music Association Awards From Nicole Kidman to Pink, see the best and worst dressed stars at the 2019 Country Music Association Awards.",1.0,0.2782478783557746,0.6391239391778873,0.5188319189038497
N64685,music,music-celebrity,"Jennifer Lopez shares her #MeToo experience at costume fitting: 'I stood up for myself' Jennifer Lopez recalled an uncomfortable situation earlier in her career when a ""director at a fitting asked me to take my top off.""",1.0,0.2525399381148865,0.6262699690574433,0.501693292076591
N7041,health,health-news,Dad bans lollipops after 5-year-old son nearly choked to death The boy was sitting near his mother when he began making choking noises.,1.0,0.242435185669451,0.6212175928347254,0.49495679044630064
N53585,tv,tvnews,"Rip Taylor's Cause of Death Revealed, Memorial Service Scheduled for Later This Month The comedian died at the age of 84 last month.",1.0,0.2728822917055908,0.6364411458527954,0.5152548611370605
N24898,autos,autosbuying,"The lightest sports cars you can buy for under $30,000 Power-to-weight ratios matter, and what these sports cars lack in horsepower they more than make up for in their abilities to attack the roads with venom.",1.0,0.3288039260554416,0.6644019630277208,0.5525359507036277
N47851,travel,traveltripideas,The Top Winter Wonderlands You Should Visit This Holiday Find the best alpine views at these wintry destinations.,1.0,0.2800000623955496,0.6400000311977748,0.5200000415970331
N58499,news,newspolitics,"Pompeo's Impeachment Role Draws Outcry From Diplomats, Staffers Secretary of State Mike Pompeo has been credited with improving State Department staffing and morale, but his treatment of U.S. Foreign Service officers caught in the impeachment inquiry has undercut those efforts, according to current and former career professionals upset over his recent actions.",1.0,0.2795969592714642,0.6397984796357321,0.5197313061809761
N30071,news,newspolitics,"Trump juggles statecraft and impeachment on a historic day Projecting unusual calm in the middle of a political firestorm, President Donald Trump pleaded ignorance Wednesday about the first public impeachment hearing, unexpectedly insisting that he really wasn't paying attention to sworn testimony in the House Intelligence Committee that could determine whether he serves out his term in office. The disclaimer might be more credible if ...",1.0,0.2977967819261806,0.6488983909630903,0.5318645212841204
N57097,news,newsus,Last known Pearl Harbor survivor in Mass. dies at 98 Massachusetts' last known survivor of the Japanese attack on Pearl Harbor that drew the United States into World War II died Tuesday at 98.,1.0,0.2955314822272977,0.6477657411136488,0.5303543214848652
N39844,sports,basketball_ncaa,"James Wiseman eligibility: Explaining the NCAA questions on Penny Hardaway, Memphis star Everything you need to know about James Wiseman's eligibility case at Memphis and what it means for him, the Tigers' basketball team and the NCAA going forward.",1.0,0.3175294206447575,0.6587647103223787,0.5450196137631717
N15307,sports,basketball_nba,"10 most stunning early trends around the NBA Youngsters Luka Doncic and Pascal Siakam are taking their games to new heights, while a former No. 1 overall pick is doing his best to shed the ""bust"" label.",1.0,0.2948287549921711,0.6474143774960855,0.5298858366614474
N60932,tv,tv-celebrity,Lamar Odom's Son Was ''Hurt'' After Finding Out About His Dad's Engagement on Instagram Lamar Odom's son admits that he was ''hurt and caught off guard'' after finding out about his dad's engagement to Sabrina Parr on Instagram.,1.0,0.2981401492782348,0.6490700746391174,0.5320934328521565
N36703,lifestyle,lifestylecelebstyle,Photos of Celebrities at the Airport Are Here to Inspire Your Holiday Travel Style Even the rich and famous aren't spared the most annoying place in the world: the airport.,1.0,0.2572626112768132,0.6286313056384066,0.5048417408512088
N25722,news,newspolitics,"Rex Tillerson denies he tried to undermine Trump, says Nikki Haley was 'rarely present' at meetings The former secretary of state refuted Haley's claims contained in a new book and says he remains proud of his tumultuous time in the Trump administration.",1.0,0.2943902903589177,0.6471951451794589,0.5295935269059451
N29839,lifestyle,lifestylehomeandgarden,"Simple Solutions to Help You Get Rid of Ants for Good Kick pesky ants out of your house and back to their colony with these easy, expert-approved tricks.",1.0,0.2884745691108559,0.644237284555428,0.5256497127405706
N47248,finance,markets,"Fed's Powell sees steady growth, signals pause in rate cuts Federal Reserve Chairman Jerome Powell expects the U.S. economy to continue growing at a solid pace, though it still faces risks from slower growth overseas and trade tensions.",1.0,0.2959246045441753,0.6479623022720876,0.5306164030294502
