ID,category,sub_category,content,collaborative_rec,content_rec,mean,two_one
N41089,lifestyle,lifestylebuzz,"This Man's Rattlesnake Bite Is a Warning to Everyone to Take Animal Bites More Seriously You wouldn't think a baby rattlesnake could do so much damage, but Austin McGee knows better after almost losing his finger to one.",0.2268535745533765,0.2931908393795034,0.26002220696643996,0.27107841777079444
N3577,health,health-news,Tennessee reports 49 cases of lung injury linked to vaping Tennessee health officials say they have received 49 cases of serious lung injury in people who use electronic cigarettes or other vaping devices.,0.2268535745533765,0.2902849166401635,0.25856924559676997,0.26914113594456784
N21720,health,health-news,Juul accused of selling 1 million tainted vaping pods Former Juul senior vice president Siddharth Breja claims he was fired in March for raising concerns about contaminated pods,0.2268535745533765,0.249457868453748,0.23815572150356226,0.24192310382029086
N59254,news,newsus,Judge rules deputies can't put 'no trick-or-treat' signs in sex offenders' yards A federal judge has ruled deputies in a Georgia county cannot put warning signs where registered sex offenders live.,0.2268535745533765,0.2280198952033477,0.2274367348783621,0.2276311216533573
N34934,sports,golf,"20 years after Payne Stewart's tragic death, son Aaron carries his legacy Aaron Stewart spent his summers on the road as a PGA Tour kid. The behind-the-scenes visits at the Columbus Zoo during the Memorial Tournament stand out among his favorite memories as well as the ""music man"" under the big tree on Hilton Head Island.",0.2268535745533765,0.3012030842424904,0.26402832939793347,0.2764199143461191
N42570,news,newsus,"Woman dies after being hit by vehicle crossing northwest Fort Worth street, police say A 24-year-old woman died Wednesday after she was struck by a vehicle as she walked across a far northwest Fort Worth street, police said. Kristen Morton was hit at about 6:15 p.m. on Boat Club Road near Reef Point Lane, authorities said. The crash was an accident, a Fort Worth police spokesman said. Police did not describe the vehicle. Morton, who lived in White Settlement, was taken ...",0.2268535745533765,0.2973985284229177,0.2621260514881471,0.2738835437997373
N63180,music,music-celebrity,"Taylor Swift can't shake 'Shake It Off' copyright suit reinstated by federal court panel A federal appeals court panel Monday reinstated a dismissed copyright lawsuit claiming Taylor Swift's ""Shake It Off"" infringed on an earlier song.",0.2268535745533765,0.2666934602128096,0.24677351738309306,0.2534134983263319
N27919,sports,golf,Martin worries about amputation after breaking right leg Casey Martin's worst fear was realized earlier this month when he stepped awkwardly off a curb and fractured his right tibia.,0.2268535745533765,0.2694196943649313,0.2481366344591539,0.2552309877610797
N17681,foodanddrink,foodnews,McDonald's Is Going to Add Chicken to Its Breakfast Menu in 2020 Here's the rumor from McDonald's HQ. The post McDonald's Plans to Add Chicken to Its Breakfast Menu in 2020 appeared first on Taste of Home.,0.2268535745533765,0.2957909835980798,0.26132227907572814,0.27281184724984536
N11727,foodanddrink,restaurantsandnews,"Popeyes quietly launched a new pumpkin pie and it's the best fast-food dessert I've ever tasted Popeyes still doesn't have the chicken sandwich, but it does have a delicious new deep-fried pumpkin and cream cheese pie. Run, don't walk.",0.2268535745533765,0.2248039493212944,0.22582876193733548,0.22548715773198846
N32268,foodanddrink,foodnews,"I ate one of Meghan Markle's favorite foods from Toronto here's what I thought The food at Terroni was good and the prices were surprisingly affordable, but the service was disappointing.",0.2268535745533765,0.2682055604274389,0.24752956749040772,0.25442156513608477
N38495,health,health-news,"Poultry Recall After 22 Tons of Vietnamese Products Distributed Without Import Inspection In addition to failing to go through the usual food inspection processes, the products came from Vietnam a country that is not eligible to export poultry products to the U.S. or any meat products aside from catfish.",0.2268535745533765,0.2470925733152478,0.23697307393431216,0.24034624039462404
N18086,foodanddrink,restaurantsandnews,"I Would Go Back to This Missouri Theme Park Just for the Snacks The excellent food at Silver Dollar City is one of many reasons that Branson, Missouri is an essential stop on any Midwest road trip.",0.2268535745533765,0.2889234954091635,0.25788853498127,0.26823352179056786
N61388,movies,movies-celebrity,"Judge: Brad Pitt, others can be sued over New Orleans homes The Times-Picayune/ The New Orleans Advocate reports Pitt and other foundation directors asked the court to remove them from the lawsuit, saying they weren't personally responsible for the construction.",0.2270506777631567,0.2391185839633205,0.2330846308632386,0.23509594856326588
N13008,finance,finance-companies,Harley-Davidson halts production of new electric motorcycles Harley-Davidson has halted production and deliveries of its new LiveWire electric motorcycle after reportedly discovering a problem with its charging mechanism.,0.227068036536298,0.2723923380220067,0.24973018727915236,0.2572842375267705
N43955,entertainment,entertainment-celebrity,"Celebrity kids then and now: See how they've grown See what the children of Bobby Cannavale, Ray Liotta, Jude Law, Jamie Foxx, Sylvester Stallone, James Gandolfini and more stars look like now.",0.2270856162179499,0.2790288957331824,0.25305725597556616,0.26171446922810493
N44559,health,health-news,Photo of emotional nurse after 'particularly hard day' goes viral Her sister revealed that she had just wrapped up four days worth of work that included assisting in the delivery of a stillborn baby.,0.2273143882852925,0.2459958921861448,0.23665514023571865,0.239768724219194
N54536,news,newsus,4 High School Students Killed in Texas Car Crash That Also Injured 3: 'We Grieve Together' 4 High School Students Killed in Texas Car Crash,0.2274084046790806,0.2830312043365216,0.25521980450780113,0.2644902711173746
N34694,tv,tvnews,Rosie O'Donnell: Barbara Walters Isn't 'Up to Speaking to People' Right Now Rosie O'Donnell: Barbara Walters Isn't 'Up to Speaking to People' Right Now,0.2274394636267702,0.2784305764803483,0.2529350200535593,0.26143353886248893
N30160,foodanddrink,tipsandtricks,How To Open a Can Without a Can Opener All it takes is a metal spoon and some elbow grease.,0.2274939718553699,0.2942854843565559,0.2608897281059629,0.27202164685616054
N18870,lifestyle,shop-holidays,"Here Are the Biggest Deals We're Anticipating for Black Friday The Black Friday deals for 2019 have already begun leaking out. Get a sneak peek at what to expect from popular retailers like Costco, Walmart, and Best Buy. Browse our guide and use it to plan your attack for the biggest shopping event of the year.",0.227550757386404,0.2498599667407184,0.2387053620635612,0.2424235636226136
N55051,lifestyle,voices,I Am Unapologetically Raising My Daughter Without Religion ,0.2275723177322387,0.2957593453862914,0.26166583155926504,0.2730303361682738
N22816,foodanddrink,foodnews,"Snow crab sells for record price in Japan A ""five shining star"" snow crab was auctioned off in Tottori, Japan for a record-breaking 5 million yen ($46,000). wide.",0.227596321384536,0.2810809293608842,0.2543386253727101,0.2632527267021014
N56541,sports,baseball_mlb,"Soto, Nationals edge Astros in World Series opener Juan Soto homered onto the train tracks high above the left field wall and hit a two-run double as the Nationals tagged Gerrit Cole and the Houston Astros 5-4 Tuesday night in the World Series opener.",0.2276198078457469,0.3144510227594856,0.27103541530261627,0.28550728445490603
N53436,finance,finance-real-estate,"Inside the Sheikh of Dubai's 800-acre Kentucky horse farm I got a tour of Sheikh Mohammed of Dubai's 800-acre horse farm in Kentucky, where horses live in immaculate barns with skylights and personal fans.",0.227643094276598,0.2758371932135498,0.2517401437450739,0.2597724935678992
N11917,travel,travelnews,JetBlue Plane Makes Emergency Landing at JFK Airport The plane landed safely in NYC Sunday night.,0.227643094276598,0.2595328217434827,0.24358795801004035,0.24890291258785446
N55312,travel,travelnews,"Why are most aircraft painted predominantly white? Aircraft liveries, or the designs painted on the exterior of aircraft from the nose to the tail, are a way to identify to which airline the plane belongs.",0.227643094276598,0.3248159237657829,0.2762295090211905,0.29242498060272126
N15919,news,newsus,"Saddleridge fire calms down, heavy rains on East Coast A new storm system is developing in the southern Plains and will move east over the next few days bringing a threat of flooding to the South with rain and gusty winds.",0.227643094276598,0.2737585445348258,0.25070081940571187,0.2583867277820832
N2153,news,newsworld,"Iran alleges foreign government behind 'treacherous' ship attack Iran said Monday a foreign government was behind what it alleges was a ""treacherous"" attack on a tanker off Saudi Arabia last week, as it released pictures of its damaged hull. But the state-owned NITC denied reports the alleged attack had originated from Saudi soil.",0.227643094276598,0.2846174618716153,0.25613027807410665,0.2656260060066095
N26122,weather,weatherfullscreenmaps,"Explosive new wildfire drives thousands from homes near Los Angeles The Maria fire ignited in Ventura County early Thursday night and raced westward, consuming 4,000 acres in just three hours.",0.227643094276598,0.294328221791249,0.2609856580339235,0.272099845953032
N41420,news,newsus,Cracks found on 38 of 810 Boeing 737 NG jets inspected globally Cracks found on 38 of 810 Boeing 737 NG jets inspected globally,0.227643094276598,0.2921455535432169,0.25989432390990747,0.2706447337876773
N5887,weather,weathertopstories,"Lucky Texas Storm Chaser Sees Hailstones Whizz Past Him During Tornado Storm chaser Marcus Diaz may think twice about how close he gets to the elements after large hailstones whizzed past his head from behind as he was filming an EF2 tornado in Tahoka, Texas, earlier this year. According to Accuweather, the winds in the tornado reached ""between 113 and 157 mph."" Diaz posted footage of the moment he was filming a ""dusty EF-2 tornado at close range"" as the hailstones almost hit ""the camera from behind,"" to Twitter on October 17. The lucky storm chaser told Storyful the footage was recorded on May 5. No injuries were reported as a result of the storm. However, the cyclone ripped through agricultural areas, ""causing structural damage to farms and wrecking equipment, power lines, and irrigation systems,"" according to media reports. Diaz may be better served in the future by heeding the advice of the National Oceanic and Atmospheric Administration (NOAA). According to NOAA, ""if you are unable to make it to a safe shelter, either get down in your car and cover your head, or abandon your car and seek shelter in a low lying area such as a ditch or ravine."" Credit: Marcus Diaz via Storyful",0.227643094276598,0.3257531028493767,0.2766980985629873,0.29304976665845045
N20091,weather,weathertopstories,"Firefighting Plane Battles Maria Fire Near Santa Paula A tanker dropped fire retardant to combat the Maria Fire near Santa Paula in Ventura County, California on Friday, November 1. By Friday, the fire had reached more than 9,000 acres and was at zero percent containment, according to CAL FIRE. The Maria Fire broke out at around 9 pm on Thursday, and ""exploded"" overnight, prompting mandatory evacuations affecting more than 10,000 residents between Santa Paula and Somis, according to reports. Firefighters are battling several blazes across the state, including the 77,000 acre Kincade Fire in Sonoma County and the 1,800 Easy Fire in Ventura County. Incident reports for the California wildfires can be found here. Credit: @shant_nazaryan via Storyful",0.227643094276598,0.2925603444186668,0.2601017193476324,0.2709212610379772
N37720,health,nutrition,"23 Foods That Help Lower High Blood Pressure Consuming less sodium may be important to help slash blood pressure levels, but eating more of these foods is good for your heart and arteries too. The post 23 Foods That Help Lower High Blood Pressure appeared first on The Healthy.",0.227643094276598,0.3210382773002289,0.2743406857884134,0.28990654962568524
N391,news,newsus,"Illegal drones ground water-dropping helicopters at critical moment in Maria fire battle LOS ANGELES - As flames rapidly spread along a hillside in Santa Paula, firefighters were faced with a perilous dilemma: ground night-flying helicopters working to contain the growing fire or risk an aerial collision with a thrill-seeking drone.",0.227643094276598,0.2755079395475854,0.2515755169120917,0.25955299112392294
N35259,finance,finance-retirement,"'I'm 73 and fed up with California and want a gun-friendly, affordable city with good weather   so where should I retire?' Some hidden gems to consider in Georgia, New Mexico and Arkansas.",0.227643094276598,0.2903652199016681,0.25900415708913305,0.2694578446933114
N29924,autos,autosenthusiasts,"25 Cars No One Wanted to Buy Along with cars so bad they become icons and the models that should have worked but never caught on come a slew of vehicles that'll have you scratching your head. Remind yourself of the disasters that were the Cadillac Catera, Buick Reatta, Volkswagen Phaeton, Lincoln Blackwood, Chrysler Executive Limousine, and more.",0.227643094276598,0.263089744245279,0.2453664192609385,0.2512741942557187
N64049,news,newsworld,"After Soldiers Surrender El Chapo's Son, a Shocked Mexican City Sighs With Relief In the days following the siege of the city of Culiacán by the Sinaloa cartel, residents were overcome with relief: Relief that the terror is over.",0.227643094276598,0.285461872602516,0.256552483439557,0.26618894649387664
N49179,movies,movienews,Joe Alwyn on Buzz Around Taylor Swift Romance: 'I'll Just Turn it Off' Joe Alwyn on Buzz Around Taylor Swift Romance: 'I'll Just Turn it Off',0.227643094276598,0.2899400732639072,0.2587915837702526,0.2691744136014708
N15122,tv,tv-celebrity,Tamron Hall says she 'never dealt' cocaine after reports say she confessed to doing so Tamron Hall issued a statement in response to the Daily Mail reporting that she confessed to facilitating the sale of cocaine as a teenager.,0.2276594659884618,0.276266089086325,0.2519627775373934,0.26006388138703723
N34399,foodanddrink,restaurantsandnews,Burger King's new 'Ghost Whopper' is here to haunt your Halloween order The Ghost Whopper will be available at 10 select restaurants beginning Oct. 24. The only thing scarier than Burger King's new Ghost Whopper is the thought of having no Whoppers at all.,0.227818280784338,0.2239525052522571,0.22588539301829755,0.22524109709628404
N63276,autos,autosenthusiasts,Gordon Ramsay's Ferrari Monza SP2 Looks Delicious Good thing the roofless ride is inside because it's raining outside.,0.2278337365896777,0.2887996936454517,0.2583167151175647,0.2684777079601937
N23887,news,newsus,"Video allegedly shows police officer roughing up 11-year-old girl There's no excuse for the way this girl was treated, the Farmington police chief said.",0.2280922719964508,0.2449648498481369,0.23652856092229385,0.2393406572309082
N23163,news,newspolitics,"'You people with this phony Emoluments Clause': Cabinet meeting devolves into 71 minutes of Trump grievances President Trump, trying to dig out from two new political holes of his own making on top of the expanding House impeachment inquiry, held forth for 71 minutes Monday during what was ostensibly a Cabinet meeting but ended up being a familiar torrent of grievance, defensiveness and bold statements about his expansive view of his own powers.",0.2281077278017905,0.2862350682126919,0.2571713980072412,0.2668592880757248
N19347,news,newspolitics,"Former US Senator Kay Hagan dead at 66 Former U.S. Sen. Kay Hagan, a one-time Capitol Hill intern who went on to become North Carolina's first Democratic female senator, died Monday at her Greensboro home. She was 66.",0.2281387790336495,0.2864067227894743,0.25727275091156193,0.26698407487086606
N31931,news,newscrime,Florida man arrested in beating death of peeping Tom Victor Vickery had been in bed with his girlfriend when they heard a man with a history of peeping at their window.,0.2281524555820971,0.243109301867525,0.23563087872481103,0.23812368643904902
N58801,sports,golf,"Greg Norman upset Tiger Woods didn't respond to his handwritten letter: ""Maybe Tiger just dislikes me"" Greg Norman tells Men's Health he hand delivered a letter to Tiger Woods following his Masters win in April, but never got a reply.",0.2282157513853288,0.3011813118827443,0.26469853163403656,0.27685945838360576
N65169,news,newsus,"Ohio voters express angst over impeachment Support for impeachment may be on the rise, but the view from central Ohio is strikingly complicated and nuanced.",0.2282157513853288,0.264198297711071,0.2462070245481999,0.2522041156024903
N60858,autos,autostrucks,Next Ford F-150 Spied By Motor1.com Reader Work continues on America's favorite truck.,0.2283390682156956,0.2751324859655907,0.25173577709064315,0.259534680048959
N57987,autos,autoshybrids,"2020 Jeep Wrangler Plug-In Hybrid Spied Hiding Its Charging Port Classic looks, modern tech.",0.2283390682156956,0.2974251710795135,0.26288211964760455,0.27439647012490753
N60826,autos,autossports,This might be a next-gen Nissan Z car mule Powertrain for the 370Z successor could be hiding under the hood,0.2283390682156956,0.3065587183079002,0.2674488932617979,0.2804855016104987
N28862,autos,autosenthusiasts,This Is What the 2020 Toyota Supra Should've Looked Like From the Start That wing should be standard on every Supra. The fact that it isn't is a tragedy.,0.2283390682156956,0.3058420061402914,0.26709053717799347,0.2800076934987595
N23554,sports,football_nfl,Joe Flacco criticizes Broncos coaches as 'afraid to lose' after Colts' comeback Joe Flacco made it clear he thought the Broncos weren't aggressive enough when playing with a lead late in Sunday's loss to the Colts.,0.2283938438404988,0.2851764427169941,0.25678514327874646,0.26624890975816234
N24889,news,newspolitics,"McConnell tees off on Democrats over impeachment Senate Majority Leader Mitch McConnell (R-Ky.) teed off against the House impeachment inquiry on Tuesday, marking his first comments since Congress returned from its two-week break. ""House Democrats are finally indulging in their impeachment obsession. Full steam ahead,"" McConnell said during a speech from the Senate floor, adding that House Speaker Nancy Pelosi (D-Calif.) had ""crumbled"" to the ""left-wing impeachment caucus."" ""I don't...",0.2284434800931362,0.2952471133125151,0.26184529670282564,0.27297923557272213
N46616,foodanddrink,newstrends,"The best sandwich shop in every US state and DC You don't need to look far to find a great sandwich in the USA. We've rounded up the best sandwich joints in every state, spanning the range from old-school delis still whipping up traditional favorites to quirky, modern joints putting innovative ingredients to work. Pull up a stool and sink your teeth into these mouthwatering offerings.",0.2284853096046873,0.2959074938002819,0.2621964017024846,0.2734334324017504
N56537,foodanddrink,restaurantsandnews,"Why Smoked Bologna Is the Secret Star of Oklahoma Barbecue No barbecue plate in the Sooner State is complete without a side of ""Oklahoma tenderloin"".",0.228789845280638,0.2682939674671388,0.2485419063738884,0.2551259267383052
N54435,news,newsus,"'Angel' car saves Arizona family after smashing into suspected drunk driver running red light, video shows An Arizona driver who police praised as an ""angel"" may have saved the lives of a couple pushing a stroller in a crosswalk last week after video showed the car smashing into a suspected drunk driver speeding through a red light -- who came inches away from plowing into the family.",0.2290761965709436,0.2818479710487331,0.25546208380983837,0.2642573795561366
N23614,tv,tv-celebrity,"John Witherspoon Dies: Comedian & 'Friday' Star Was 77 John Witherspoon, an actor-comedian who for decades made audiences laugh in television shows and films, including the hit Friday franchise, died suddenly at his home today. He was 77. ""It is with deepest sorrow that we can confirm our beloved husband and father, John Witherspoon, one of the hardest working men in show business, died",0.2292352004009276,0.2807108894355301,0.2549730449182288,0.2635523264239959
N31699,news,newscrime,"Woman stabbed in 2015 home invasion suing 911 dispatch company Breann Lasley has filed a civil lawsuit against Priority Dispatch Corp., alleging ""gross negligence,"" but the company said its system was never used.",0.2292883208061456,0.2519749379474214,0.2406316293767835,0.24441273223366278
N25885,entertainment,celebrity,Here's Every Costume the Kardashian-Jenner Family Wore This Halloween Every Kardashian-Jenner Halloween Costume (Even the Kids!) From 2019,0.2295870154224651,0.2454748298170215,0.2375309226197433,0.24017889168550272
N8629,sports,basketball_nba,"Anthony Davis on possibly joining hometown Bulls: 'I mean, I am a free agent next year' ",0.2295870154224651,0.2871180970331713,0.2583525562278182,0.2679410698296026
N48076,tv,tvnews,"Whoopi Goldberg Asks Meghan McCain to 'Respect' Her 'View' Co-Hosts During Heated Discussion 'I'm not trying to cut you off, I'm trying to get you heard.'",0.2296066928321939,0.2854429059050136,0.25752479936860373,0.26683083488074033
N38939,music,musicnews,"This Guns N' Roses Video Just Became the First From the '80s to Reach 1 Billion YouTube Views Guns 'N Roses' rockin' black-and-white video for ""Sweet Child O' Mine"" has become the first video from the 1980s to hit one billion YouTube views.",0.2296066928321939,0.3035227992416734,0.26656474603693364,0.27888409710518025
N16292,foodanddrink,foodnews,"What it's like to cook for Kate Middleton and Prince William, according to Giada De Laurentiis One of the professional chef's favorite career moments was the day she cooked for the Duke and Duchess of Cambridge at a polo charity event.",0.2296066928321939,0.3079601585385048,0.26878342568534935,0.2818423366364011
N1398,news,newsus,"Iowa woman killed by explosion at gender reveal party An Iowa woman was killed by debris from an explosion at a gender reveal party on Saturday, police said.",0.2298941492458605,0.2705263561922891,0.2502102527190748,0.25698228721014627
N38118,tv,tv-celebrity,Uh-Oh! Carrie Ann Inaba Falls on 'Dancing With the Stars' Uh-Oh! Carrie Ann Inaba Falls on 'Dancing With the Stars',0.2299844429977327,0.2549197070792861,0.2424520750385094,0.24660795238543493
N42620,lifestyle,lifestylebuzz,"Heidi Klum's 2019 Halloween Costume Transformation Is Mind-Blowing   But, Like, What Is It? You might say she's scary good at playing dress-up, because Heidi Klum's 2019 Halloween costume is even more impressive than we could have imagined   and that's saying a lot, considering transformative Halloween costumes are kind of her thing. But this year Klum took it up one more notch as she shared her metamorphosis into,",0.230100195769135,0.2605098583710417,0.24530502707008833,0.2503733041704061
N46082,video,science,"Archaeologists open ancient coffins in Egypt After 30 ancient coffins were unearthed ""completely by accident"" in Egypt this week, archaeologists are now taking a closer look. Two of the coffins have been opened but what will experts find inside? NBC's Molly Hunter reports for Weekend TODAY.",0.2301093158068205,0.2804419299785982,0.25527562289270933,0.26366439192133895
N47289,finance,finance-homesandpropertysection,"A Los Angeles mansion once listed for $250 million has finally sold for 62% off after 3 years. Take a look inside what was once America's most expensive home. The extravagant Bel Air property has five bars, a bowling alley, a 40-seat movie theater, an 85-foot infinity pool, and a candy wall.",0.2301521399058709,0.2808517703705065,0.25550195513818874,0.2639518935489613
N12576,news,newsworld,Chinese pilot suspended after woman poses in cockpit with drinks The unidentified woman is seen sitting in the captain's seat with drinks in front of her on an Air Guilin flight in January this year.,0.2305105690869467,0.2730572480713721,0.2517839085791594,0.2588750217432303
N28088,movies,movies-celebrity,Bruce Willis brought Demi Moore to tears after reading her book Demi wasn't sure how her ex would feel about her book until he called her.,0.2305191308535988,0.2753949749263648,0.25295705288998177,0.2604363602354428
N15761,entertainment,humor,Comics - '9 to 5' by Harley Schwadron Daily comics: '9 to 5' by Harley Schwadron,0.230617111178777,0.2694601920944008,0.2500386516365889,0.25651249845585955
N6932,foodanddrink,tipsandtricks,How to Split an Apple in Half With Your Bare Hands Paul Rudd wowed Twitter the other day with a video in which he split an apple in half with his bare hands. Amazing! What human being can do that? Surely nobody but Paul Rudd!,0.230617111178777,0.2986909536625323,0.26465403242065466,0.27599967283461385
