ID,category,sub_category,content,collaborative_rec,content_rec,mean,two_one
N47061,lifestyle,shop-holidays,"105 Black Friday Deals You Can Start Shopping Today Save with early bird deals from stores like Walmart, Target, Amazon, Costco, Sam's Club, Kohl's, Sears, JCPenney, and Macy's, which are offering deep Black Friday discounts on the hottest products on your Christmas list   and your wish list   starting on Thanksgiving, or even sooner.",1.0,0.2538984235804197,0.6269492117902098,0.5025989490536131
N47572,finance,markets,"A Trump Tax Break To Help The Poor Went To a Rich GOP Donor's Superyacht Marina The Trump tax law gave governors the authority to distribute valuable tax breaks, and they have wielded it to benefit the politically connected.",1.0,0.2771121692058242,0.6385560846029121,0.5180747794705495
N6342,health,weightloss,"Jess Lost 75 Pounds Without Counting Calories and Did This 1 Inspiring Thing Before Every Meal Jess Dukes makes a list of her ""whys"" and reads them before every meal and every workout.",1.0,0.2946591792323048,0.6473295896161524,0.5297727861548698
N35106,foodanddrink,foodnews,"50 Ways Thanksgiving Foods Have Changed in the Last 50 Years What's considered traditional Thanksgiving food has changed a lot over the years. From new sides to old recipes, see how Thanksgiving has evolved.",1.0,0.2761609838707489,0.6380804919353744,0.5174406559138326
N33831,entertainment,celebrity,"From Idris Elba to Richard Gere: All the Sexiest Man Alive Covers Some are familiar faces (Ben! Brad!) and some are shockers (here's looking at you, Richard!). Check out who's been named Sexiest through the years",1.0,0.2955809487679549,0.6477904743839774,0.5303872991786366
N31041,foodanddrink,recipes,19 Cornbread Recipes to Replace The Store-Bought Rolls This Thanksgiving ,1.0,0.2390974301741765,0.6195487150870882,0.49273162011611765
N22371,lifestyle,lifestylehomeandgarden,Easy DIY Thanksgiving Centerpieces for a Picture-Perfect Table We'll show you how to set the stage.,1.0,0.2440845793217689,0.6220422896608845,0.4960563862145126
N30475,entertainment,celebrity,The Sexiest Photos Ever of Our 29 Sexiest Men Alive Warning: lots of heat ahead,1.0,0.2878903821726362,0.6439451910863181,0.5252602547817574
N29468,health,ads-lung-health,"​'My Annoying Cough Turned Out To Be Lung Cancer' As soon as I was coming out of anesthesia, he told me it was cancerous.",1.0,0.2798386109273586,0.6399193054636794,0.5198924072849057
N7535,lifestyle,lifestylehomeandgarden,"America's Largest Home Also Has the Most Amazing Christmas Decorations Over 13,000 ornaments are deployed around the Biltmore Estate in NC.",1.0,0.2464584912754707,0.6232292456377353,0.4976389941836471
N26940,health,nutrition,"This is Exactly How Long You Should Keep Thanksgiving Leftovers While keeping leftovers seems like a no-brainer, if not done properly, they can make you sick. Learn the right way to store Thanksgiving leftovers.",1.0,0.2791242400976678,0.639562120048834,0.5194161600651118
N27441,lifestyle,lifestylehomeandgarden,These Christmas Window Decorations Are Full of Holiday Cheer Don't overlook this decorating opportunity this year.,1.0,0.2363860175386688,0.6181930087693344,0.4909240116924458
N8400,autos,autosresearchguides,These are the new cars that depreciate least Don't want to lose a ton of money on your next new car? These are the new car models that hold the most value after five years.,1.0,0.3152850760330085,0.6576425380165043,0.5435233840220056
N53431,lifestyle,lifestylehomeandgarden,Designer-Approved Ideas to Transform a Small Bedroom Because a lack of square footage shouldn't cramp your style.,1.0,0.2478721257967688,0.6239360628983844,0.4985814171978459
N61006,entertainment,awards,Jenna Dewan flaunts her baby bump in red gown at People's Choice Awards She looks absolutely stunning.,1.0,0.278636002757036,0.639318001378518,0.5190906685046907
N11817,travel,traveltripideas,"Here's the Best Small Town in Every State From Los Alamos, California, to Shelter Island, New York, these are the best small towns INSIDER found in every state.",1.0,0.282975689967391,0.6414878449836955,0.521983793311594
N41172,entertainment,celebrity,Welcome to the World! All of the Celebrity Babies Who've Made Their Debuts in 2019 See who's made their debut so far this year,1.0,0.2991597552254647,0.6495798776127324,0.5327731701503098
N14531,news,newsworld,Turkey starts repatriation of captured Islamic State militants: media Turkey starts repatriation of captured Islamic State militants: media,1.0,0.2811075447687079,0.640553772384354,0.5207383631791386
N40530,news,newspolitics,"What's coming in impeachment: The inquiry goes public For only the fourth time in U.S. history, the House of Representatives has started a presidential impeachment inquiry.",1.0,0.2921951066111264,0.6460975533055632,0.5281300710740843
N64606,entertainment,celebrity,"Best celebrity hair moments of 2019 (so far) New year, new 'do! Nothing has the power to transform a look quite like a new hairstyle, which might explain why celebrities are constantly switching things up with fresh cuts, colors and lengths. In 2019, we've already seen stars like Rowan Blanchard and John Travolta go shorter (or, in the Saturday Night Fever star's case, bald!), Lady Gaga and Chris Messina walk the red carpet with striking new shades and Hilary Duff and Sarah Hyland show how subtle color shifts can make a big impact. And, if 2018's tress transformations were any indication, there is going to be so much more where that came from. Keep scrolling to see the best celebrity haircuts, color, extensions and more of 2019 so far!",1.0,0.2822410539848204,0.6411205269924102,0.5214940359898803
N25414,finance,finance-companies,"Alibaba breaks Singles Day record of more than $30 billion in sales and climbing Chinese e-commerce giant Alibaba set a new sales record on Singles Day, the world's largest 24-hour shopping event.",1.0,0.2605002365873651,0.6302501182936826,0.50700015772491
N59385,entertainment,celebrity,"Celebrity Engagements of 2019 Love is abloom in 2019! Stars such as Tim Tebow, who is set to wed former Miss Universe Demi-Leigh Nel-Peters, and Hamilton's Anthony Ramos will soon be walking down the aisle after popping the question to their respective loved ones. Scroll through to see who else is put a ring on it this year and get the story behind their sweet proposals.",1.0,0.2980929159570844,0.6490464579785422,0.5320619439713896
N33120,entertainment,celebrity,Stars who welcomed babies in 2019 See which celebrities expanded their families this year!,1.0,0.2915710161190017,0.6457855080595009,0.5277140107460011
N10960,foodanddrink,recipes,65 Best Fall Soups That Will Warm You and Your Family Up All Season Long These hearty bowls are the perfect companion for a rainy fall night.,1.0,0.2605119249843481,0.6302559624921741,0.5070079499895654
N50023,health,nutrition,"The #1 Worst Menu Option at 76 Popular Restaurants The rule ""everything in moderation"" simply isn't an excuse for these excessive menu choices that will set you back for days.",1.0,0.2762908957700014,0.6381454478850007,0.5175272638466676
N43432,news,newsus,"US Forest Service shuts down vandalized Georgia park feature GAINESVILLE, Ga. (AP)   The U.S. Forest Service says vandalism is forcing it to shut down a popular fall leaf viewing destination in Georgia. The agency posted photos to Facebook on Friday showing a wooden platform covered in white spray paint overlooking the mountainous north Georgia landscape at Chattahoochee-Oconee National Forests.",1.0,0.2346920212310674,0.6173460106155337,0.48979468082071154
N32010,finance,personalfinance,The biggest wastes of money in 2019 Relive 2019 with this look at some of the biggest wastes of money of the year.,1.0,0.2880711984123311,0.6440355992061655,0.525380798941554
N61822,lifestyle,lifestylehomeandgarden,"200 Shocking Home Photos You Have to See We know a good DIY project when we see it, but these aren't them. Some of these are goofy, some are head scratchers and some are downright dangerous. Check these photos out, you'll definitely learn a thing or two!",1.0,0.2681864880740681,0.634093244037034,0.512124325382712
N23254,movies,movies-celebrity,Best nostalgic pics of Leonardo DiCaprio Celebrate Leo's birthday with these throwback photos.,1.0,0.3108066900060864,0.6554033450030432,0.5405377933373909
N5791,lifestyle,lifestylehomeandgarden,"12 Fall Landscaping Mistakes to Know and Avoid Whether you have a green thumb when it comes to your home garden, or you can hardly tell the difference between a rose and a weed, you should know that there are certain landscaping tasks that need to be done right to keep your home exterior looking its best. But to do that, you must avoid the most common fall landscaping blunders.",1.0,0.2917062989503783,0.6458531494751891,0.5278041993002522
N30188,lifestyle,lifestylebuzz,Look of the day: Ashley Graham's latest sizzling maternity look & more celeb style Bella Hadid attended the CFDA/Vogue Fashion Fund Awards in an Alexander Wang jumpsuit embellished with nipple and belly-button jewels.,1.0,0.2491429687844472,0.6245714843922237,0.4994286458562981
N4912,movies,movies-gallery,"New Movies and TV Shows You'll Be Able to Cozy Up With on Netflix in November Movie watchers divide themselves into two camps when November rolls around: those who aren't ready to stop watching all the horror flicks that creeped them out around Halloween, and those who can't wait to dive into cheesy holiday movie season.",1.0,0.2669048473283892,0.6334524236641946,0.5112698982189261
N17104,news,newscrime,"Veterans suffered, investors lost millions in nationwide schemes People lost hundreds of millions of dollars. But something is happening that might finally stop it.",1.0,0.2587674476596243,0.6293837238298121,0.5058449651064162
N54988,finance,personalfinance,28 Dumb Ways You Could Lose It All by Trying To Get Rich Don't gamble your money away in foolish ways.,1.0,0.3061725797960192,0.6530862898980097,0.5374483865306794
N22549,entertainment,awards,2019 People's Choice Awards nominees' best recent style moments We're checking out the E! People's Choice Awards nominees' stellar recent style moments.,1.0,0.2757498655007179,0.637874932750359,0.5171665770004785
N54300,entertainment,celebrity,"Week in celebrity photos for Nov. 4-8, 2019 Week in celebrity photos for Nov. 4-8, 2019",1.0,0.2718572015313441,0.635928600765672,0.5145714676875627
N21840,travel,traveltips,"10 Things You Should Never Do in an Airplane Bathroom Germs are potentially harmful in a normal bathroom. But put that bathroom in the sky, shrink it, and pump pressurized air into it and you've got the perfect environment for germs to thrive. The post 10 Things You Should Never Do in an Airplane Bathroom appeared first on Reader's Digest.",1.0,0.2996692418495227,0.6498346209247614,0.5331128278996817
N31978,music,music-awards,"Country music's biggest scandals From Wynonna Judd's husband's arrest to the Dixie Chicks' vent about George W. Bush, relive country's biggest scandals.",1.0,0.2775263402921505,0.6387631701460752,0.5183508935281003
N51241,lifestyle,lifestylefamilyandrelationships,"I Was Adopted Here's What Everyone Gets Wrong About Adoption While adoption is wonderful in many ways, it comes with its own set of unique challenges. Sometimes, those challenges come from other people making incorrect assumptions. The post I Was Adopted Here's What Everyone Gets Wrong About Adoption appeared first on Reader's Digest.",1.0,0.2926898443383715,0.6463449221691857,0.528459896225581
N22880,lifestyle,voices,"I ordered clothes from those cheap online stores, and I'm not sold As an avid brick-and-mortar shopper, my eyes were opened when I tried an $8 formal dress, a $4 blouse, and other clothes for less than $10.",1.0,0.2400110590948593,0.6200055295474296,0.49334070606323954
N27143,foodanddrink,beverages,Best Dive Bar in Every State The real challenge in compiling a list of America's best dive bars comes in defining just what a dive bar is and isn't.,1.0,0.2748130842894907,0.6374065421447453,0.5165420561929938
N61623,entertainment,entertainment-celebrity,"Big celebrity money moments of the last decade From bankruptcy filings and huge paydays to reaching billionaire status, read up on the most fascinating money news involving the stars from 2010 to 2019.",1.0,0.2973424808944197,0.6486712404472099,0.5315616539296131
N24686,entertainment,entertainment-celebrity,Stars who've had more than one wedding with the same spouse See which celebs exchanged vows with their significant others more than once.,1.0,0.2940961019073874,0.6470480509536937,0.5293974012715916
N55204,entertainment,entertainment-celebrity,"Stars Who Served in the Military Adam Driver, Jeff Bridges, Ice-T and more stars who served in the military.",1.0,0.2813713591417354,0.6406856795708677,0.5209142394278236
N62386,news,newspolitics,America's Most and Least Popular Senators Senators represent the interests of the residents of their home state on Capitol Hill by crafting and voting on new laws and by approving or rejecting cabinet and judicial nominations made by the president.,1.0,0.3075811856827414,0.6537905928413708,0.5383874571218276
N40356,movies,movies-gallery,"All 112 of Netflix's notable original movies, ranked from worst to best To find out which Netflix original films are worth watching, we turned to Rotten Tomatoes to rank everything from ""Roma"" to ""Bright.""",1.0,0.3103060013988866,0.6551530006994433,0.540204000932591
N55353,weather,weathertopstories,Distressing photos show glaciers that are disappearing or on the brink of collapse around the world The future of glaciers around the world is shaky. Here are photos showing some of the glaciers that might not be around for much longer.,1.0,0.2728794117084072,0.6364397058542036,0.5152529411389382
N50575,autos,autossuvs,Should You Get the 2020 Ford Explorer? Pros and Cons on This Family SUV Ford completely reimagined Explorer is a 2020 SUV of the Year contender,1.0,0.3121408733897578,0.6560704366948789,0.5414272489265052
N26376,finance,markets,"Stocks close higher on optimism over China trade deal Stocks ended at record highs Thursday after the world's two largest economies reportedly agreed to remove existing trade tariffs, sparking a huge rotation into equities and out of bonds.",1.0,0.2660237707035628,0.6330118853517814,0.5106825138023752
N37870,news,newsworld,Today in History: November 11 ,1.0,0.2837031695934822,0.6418515847967411,0.5224687797289881
N3344,music,cma-awards,"Top 100 country songs of all time Stacker counts down the top 100 country songs of all time. From old-school honky-tonk to modern country pop, this list covers the biggest hits in Billboard history.",1.0,0.3119645389028196,0.6559822694514098,0.5413096926018797
N26262,entertainment,entertainment-celebrity,"Celebrity plastic surgery transformations See how stars like Sharon Osbourne, Cardi B, Pauly D, Kim Zolciak-Biermann, Gisele Bundchen, Kanye West and others have altered their looks.",1.0,0.2505907864266661,0.625295393213333,0.5003938576177773
N38311,entertainment,celebrity,Celebrity PDA of 2019 See the stars kissing and hugging on the red carpet and out and about!,1.0,0.2729203651552246,0.6364601825776123,0.5152802434368164
N27476,sports,basketball_nba,"Harden scores 47 points, Rockets beat Clippers 102-93 HOUSTON (AP)   James Harden scored 47 points and the Houston Rockets outlasted the Clippers 102-93 in a wild game that saw Los Angeles coach Doc Rivers ejected in the fourth quarter Wednesday night. Houston was up by two with about two minutes left when former Rocket Patrick Beverley fouled out. Harden made both free throws before grabbing a rebound on the other end and hitting a 3 to make it 95-88. Beverley was given a technical foul during a...",1.0,0.3216574485343401,0.66082872426717,0.5477716323562267
N57853,news,newscrime,Triple Shooting In Dallas Leaves 2 Dead & Police Investigating Two people are dead after a triple shooting in Dallas late Sunday night.,1.0,0.2620391292071236,0.6310195646035618,0.5080260861380823
N50005,news,newsgoodnews,"A teenager thought his leukemia was a death sentence. A college football player saved his life. William & Mary offensive lineman Mark Williamson on Friday finally met Rusty Plemons, whose life he helped save three years ago.",1.0,0.2952615595443467,0.6476307797721733,0.5301743730295645
N10840,finance,markets,Trade War's Forgotten Farmers Get Crushed in U.S. Cotton Country American cotton farmers are having such a difficult year that even a potential trade deal between the U.S. and China is likely to offer them little comfort.,1.0,0.2485861713277709,0.6242930856638854,0.4990574475518472
N54283,lifestyle,lifestyleroyals,"Prince Harry just hinted that he and Meghan Markle may want another baby Reports also suggest that Meghan Markle may want to have their next child in Los Angeles, where she was born.",1.0,0.2914711226208007,0.6457355613104003,0.5276474150805338
N33261,video,lifestyle,The Queen Had This Hilarious Reaction to (Unnecessary) Mouth-to-Mouth Resuscitation The Queen had a hilarious reaction when someone tried to save her life. Buzz60's Keri Lumm reports.,1.0,0.280771351829307,0.6403856759146536,0.5205142345528713
N26084,foodanddrink,recipes,These Christmas Dinner Menus Will Create an Unforgettable Meal We've got you covered for any type of crowd.,1.0,0.2746743474455908,0.6373371737227954,0.5164495649637272
N999,news,newsscienceandtechnology,"Motorola's Razr flip phone is back as a folding-screen smartphone, for $1,500 The good news: A phone can fit in your pocket again. The bad news: It's twice the price of an iPhone.",1.0,0.3058794669750155,0.6529397334875078,0.5372529779833437
N18698,entertainment,awards,Khloe Kardashian Apologizes to Fans After Not Realizing She'd Won an Award at the People's Choice Awards Her family also won for Best Reality Show.,1.0,0.2611108439577606,0.6305554219788803,0.5074072293051737
N287,news,newscrime,Three school workers charged in death of special needs student The student was reportedly restrained face-down for nearly an hour before becoming unresponsive,1.0,0.2406249562647313,0.6203124781323657,0.4937499708431542
N39461,foodanddrink,foodnews,"We Tried 5 Brands of Toaster Pastries So You Don't Have To We tasted organic, generic, gourmet, and nostagic options. Here's what we thought.",1.0,0.2591711466958633,0.6295855733479316,0.5061140977972421
N59673,music,music-celebrity,Selena Gomez and Julia Michaels Share a Kiss Before Getting Matching Arrow Tattoos Selena Gomez and Julia Michaels Get Matching Arrow Tattoos,1.0,0.2786464103570619,0.6393232051785309,0.519097606904708
N26331,news,newsus,"Wild turkeys are terrorizing a town; MLB player calls on the New Jersey governor for help Todd Frazier, MLB all-star, joined town residents sounding off about wild turkey terror. Now, they're asking New Jersey Gov. Phil Murphy for help.",1.0,0.2454682022304563,0.6227341011152281,0.4969788014869708
N64691,news,newsworld,"U.K. Politicians Fight First December Election in Almost a Century Across the length of the U.K., politicians are donning hiking boots and fluorescent jackets and arming themselves with torches as they campaign in the cold and darkness ahead of the country's first December election in almost a century.",1.0,0.2761892621855984,0.6380946310927992,0.5174595081237323
N23805,lifestyle,awardstyle,Carrie Underwood rocks CMAs and several gorgeous outfits as host All of her looks were just stunning.,1.0,0.2806172519219611,0.6403086259609805,0.5204115012813073
N12124,news,newsworld,"US to keep around 600 troops in Syria: Pentagon chief The United States will maintain around 600 troops in Syria, Pentagon chief Mark Esper said Wednesday, despite Donald Trump's desire to end US involvement in what the president calls ""endless wars"". ""We're going to have about 500 to 600-ish troops there, at the end of the day,"" he said.",1.0,0.3032108668737671,0.6516054334368835,0.535473911249178
N8555,lifestyle,lifestyleroyals,"Meghan Markle is being criticized for doing the same things that Kate Middleton is praised for, and a royal expert says it wouldn't be happening if she were white Markle received backlash when her bodyguard told fans not to take photos. However, Middleton was recently called ""down to earth"" for the same thing.",1.0,0.2641571451770834,0.6320785725885417,0.5094380967847223
N6477,finance,finance-companies,"Walmart releases Black Friday ad with $129 Apple Watch, TV deals, electronics doorbusters Walmart's Black Friday 2019 ad includes a 40-inch TV for $98, Apple iPad for $249, Xbox One, Playstation 4, deals on toys, Instant Pot and more.",1.0,0.2494267446671847,0.6247133723335924,0.4996178297781231
N61787,sports,basketball_nba,Russell Westbrook takes shot at Patrick Beverley Wednesday night's Houston Rockets-LA Clippers game was entertaining on many levels. Russell Westbrook's comments about Patrick Beverly's reputation stood out the most.,1.0,0.284868071715611,0.6424340358578056,0.5232453811437406
N49879,news,newsgoodnews,"Man runs race in full SWAT gear, saves a life, then proposes -- all in a matter of moments The finish line of the Allstate Hot Chocolate 15K Run changed life-as-they-know it for Chicago Police Sgt. Mike Nowacki, his girlfriend, and a complete stranger with ""serendipitous"" timing.",1.0,0.2772162285204548,0.6386081142602273,0.5181441523469699
N63958,foodanddrink,recipes,Copycat Cracker Barrel Chicken and Dumplings Recipe Craving some comfort food from Cracker Barrel? Skip the restaurant and make this copycat chicken and dumplings recipe instead!,1.0,0.2540920519061497,0.6270460259530748,0.5027280346040998
N4936,autos,autosenthusiasts,Lance Altimeter Is A Delicious Drop-In Truck Camper Debuting At SEMA The all-in-one Overlanding package sleeps four and is fully equipped for an off-grid weekend.,1.0,0.2728608571660578,0.6364304285830289,0.5152405714440385
N58410,tv,tv-celebrity,Tristan Thompson Gushes Over Ex Khloe Kardashian After Her People's Choice Win Khloe's ex and the father of her child raved about her in an Instagram post.,1.0,0.3017237330230746,0.6508618665115373,0.5344824886820497
N58885,health,fitness,3 Months of Full Body Workouts Helped This Guy Get Shredded at 40 Mat Smith ramped up his workouts and found an online support group to share fitness goals.,1.0,0.2901018517614081,0.645050925880704,0.5267345678409387
N47624,news,newsworld,"US, South Korea could scale back joint drills: Esper US military exercises with South Korea could be scaled back to aid diplomacy with the nuclear-armed North, Defense Secretary Mark Esper said on his way to Seoul, as Pyongyang said it was running out of patience. Seoul and Tokyo are both major US allies, democracies and market economies faced with an overbearing China and nuclear-armed North Korea.",1.0,0.3015672452413833,0.6507836226206917,0.5343781634942555
N40559,news,newsworld,"2 dead, 3 injured in a school shooting in Russia Russian police say a student has killed a fellow student and wounded three more in a shooting at a college before taking his own life. Russia's state Investigative Committee says the 19-year-old student in Blagoveshchensk near the border with China brought a hunting rifle to class Thursday and opened fire on students, shooting one dead and severely injuring three more.",1.0,0.2871116491281396,0.6435558245640698,0.5247410994187597
N45561,news,newsphotos,"Inside the world's largest plane, which has a wingspan longer than a football field and a mysterious new owner The Stratolaunch is 238 feet long, 50 feet tall, and has a 385-foot wingspan. It made its first flight in April.",1.0,0.3284771701823091,0.6642385850911545,0.5523181134548727
N8957,music,cma-awards,Best country music albums of all time Stacker has compiled a list of the best country albums of all time as per Billboard's Greatest of All Time Country Albums list. These ratings are based on albums' weekly performance on the Top Country Albums chart from January 1996 to June 2016.,1.0,0.3147289622402057,0.6573644811201028,0.5431526414934704
N49252,entertainment,entertainment-books,"100 Books Everyone Should Read Before They Die If you want to fill your shelves with classic titles and tomes that will open your mind to many worlds of fancy, facts, and fiction, these 100 books are the place to start.",1.0,0.296931501445227,0.6484657507226135,0.5312876676301513
N30253,health,nutrition,"29 Foods Diabetics Should Avoid While some foods may seem healthy, they can be low-nutrition sources of hidden sugars. Here are foods to avoid.",1.0,0.2923462446745085,0.6461731223372542,0.5282308297830056
N42266,lifestyle,lifestylehomeandgarden,"Stylish Living Room Ideas, From Floral to Family-Friendly Bookmark this for the next time you need a refresh.",1.0,0.2737443377360443,0.6368721688680221,0.5158295584906962
N53696,news,newsworld,"Ugly From the Outset: Hong Kong's Day of Widespread Violence HONG KONG   Hong Kong was a city on edge on Monday following escalating violence, in which one demonstrator was shot point blank by a police officer and one man was doused with a flammable liquid and set on fire after he scolded protesters. At nightfall, both men were fighting for their lives in a city seething with resentments. Protesters have voiced outrage at police officers they see as increasingly resorting to force, and at a government...",1.0,0.2644019089090448,0.6322009544545224,0.5096012726060298
N46029,news,newsworld,"How Russia Meddles Abroad for Profit: Cash, Trolls and a Cult Leader The Russians were hard to miss. They appeared suddenly last year in Madagascar's traffic-snarled capital, carrying backpacks stuffed with cash and campaign swag decorated with the name of Madagascar's president.",1.0,0.2866115247577994,0.6433057623788997,0.5244076831718663
