ID,category,sub_category,content,collaborative_rec,content_rec,mean,two_one
N37083,news,newsus,Police warn against THC-laced Halloween candy Police in Pennsylvania are urging parents to be extra cautious with their Halloween candy this year.,0.1813707962149172,0.2161496342892421,0.19876021525207965,0.20455668826446716
N39762,news,newscrime,"Woman stabbed to death by son in Plainville, police say A 21-year-old man is accused of stabbing his mother to death in Plainville. Police were called at 10:14 p.m. Thursday to the home at 37 Landau Road. The victim, 51-year old Carlyn D. Murphy, was found dead with apparent stab wounds. Her son, Sean Murphy, 21, who lived in the home, was taken into custody at Patriots Place in Foxborough. Plainville police said they do not believe that there is any ongoing threat or danger to the public. Sean...",0.1813707962149172,0.2639497721144855,0.22266028416470135,0.2364234468146294
N1258,travel,travelnews,"Tourist in Venice kidnaps local woman in row over exchange rate The 46-year-old Israeli was unhappy about the sum of money he was given, and reacted by locking himself in the currency exhange with the worker",0.1813707962149172,0.2668676292337287,0.22411921272432295,0.23836868489412488
N27235,news,newspolitics,"Hillary Clinton backs out of DC event also set to include Tulsi Gabbard, Kirstjen Nielsen: report Hillary Clinton has backed out of a Friday appearance at an event also scheduled to include Democratic presidential candidate Tulsi Gabbard, among other guests, according to a report.",0.1813707962149172,0.2493359868111569,0.21535339151303706,0.22668092327907702
N24492,news,newsus,"Police: Off-Duty Dallas Officer Mistakenly Shoots, Injures Adult Son Thinking He Was An Intruder An off-duty Dallas officer accidentally shot and injured his adult son in DeSoto Saturday evening, police say.",0.1813707962149172,0.2841357768880558,0.2327532865514865,0.24988078333034294
N24724,news,newsworld,"Humanitarian crisis unfolds as violence escalates in Syria In little more than a week, longstanding alliances have crumbled and old enemies have teamed up after the U.S. began pulling its forces out and Turkey invaded Syria",0.1929151142398742,0.2667496310057931,0.22983237262283363,0.24213812541715346
N58091,finance,finance-companies,Ex-Credit Suisse Banker Says Secret Affair Helped Fuel $45 Million Fraud A former Credit Suisse Group AG banker told a federal jury in New York that his decision to take millions of dollars in bribes was fueled in part by his secret love affair with a subordinate.,0.1937102241296699,0.2948966941176317,0.2443034591236508,0.2611678707883111
N30974,sports,basketball_ncaa,"Police identify 2 suspects in murder of Andre Emmett last month Two men accused of killing former Texas Tech and NBA player Andre Emmett were identified by Dallas police on Monday, the Dallas Morning News reported.",0.1937102241296699,0.2650227699957654,0.22936649706271767,0.24125192137373358
N50479,health,wellness,"Items you need to stop sharing with others right now Items you should never share for your health and safety include everyday items like toothbrushes, earbuds and lipstick.",0.1937102241296699,0.256608885385115,0.22515955475739247,0.23564266496663333
N30103,travel,traveltripideas,"A network of 28 tiny, one-bed hotels in Amsterdam is being called the most beautifully designed hotel of 2019   and it consists of a series of converted bridge houses. Take a look inside. Amsterdam's bridge hotels, located in historic houses on and near bridges, are a tiny house lover's dream ⁠  and they just won a major design award.",0.1937102241296699,0.2864506710737237,0.24008044760169678,0.2555371887590391
N63248,lifestyle,lifestylecelebstyle,"Hailey Baldwin wore three show-stopping dresses during her wedding, and put a unique twist on each one Hailey Baldwin's three custom gowns were designed by Virgil Abloh of Off-White, Vera Wang, and Ralph & Russo.",0.1937102241296699,0.2682161643167114,0.23096319422319067,0.2433808509210309
N12785,sports,baseball_mlb,"With Carlos Beltran hire it's clear the Mets learned nothing from the Mickey Callaway mess In hiring Carlos Beltran to guide their fortunes next year, the Mets hierarchy once again out-thought themselves by going ""outside-the-box"" for someone who had never managed anywhere before.",0.1937102241296699,0.2900698878197097,0.24189005597468982,0.2579499999230298
N56290,foodanddrink,tipsandtricks,The Secret Ingredient for Sausage Gravy That's Out of This World Transform your gravy with this $1 ingredient,0.1937102241296699,0.2807516532107559,0.2372309386702129,0.2517378435170606
N22627,news,newsus,Family Members Plead for Help in Search for Missing Atlanta College Student: 'Just Come Home' Family Pleads for Help in Search for Missing College Student,0.1937102241296699,0.2697361099792132,0.23172316705444157,0.24439414802936543
N47922,music,music-celebrity,"Allegations against entertainer Todrick Hall are piling up, from stories of nonpayment to accusations of backlash for reporting sexual assault Todrick Hall became prominent in Broadway musicals, for his friendship with Taylor Swift, and more. Now, accusations against him are piling up.",0.1937102241296699,0.2448388929187736,0.21927455852422173,0.22779600332240568
N40526,music,music-celebrity,Miranda Lambert Shares the Surprising Story of Her and Brendan McLoughlin's Meet-Cute The Pistol Annie's are to thank for introducing the country singer to her husband,0.1937102241296699,0.2996440260364632,0.24667712508306655,0.26433275873419876
N54449,news,newsus,"Third Indiana Catholic school employee fired in growing scandal over LGBTQ staff Unlike the others fired from Indianapolis-area Catholic schools, Kelley Fisher is straight and only expressed support for her fired colleagues.",0.1937102241296699,0.2614680960748491,0.2275891601022595,0.23888213875978936
N30827,foodanddrink,restaurantsandnews,"These are the 11 classic food-court chains with the most locations From Panda Express to Auntie Anne's to Baskin-Robbins, these are the 13 classic food-court chains with the most US locations.",0.1937102241296699,0.2581700561540263,0.2259401401418481,0.2366834454792408
N19874,health,wellness,"How Your Hormones, Weight, or Medication Could Be Killing Your Sex Drive Your libido can suffer for some unexpected reasons. And remember, there is no ""normal"" when it comes to sexual desire.",0.1937102241296699,0.3172919695479532,0.25550109683881156,0.2760980544085254
N53118,health,health-news,Colorado Mom's Touching Facebook Post Beautifully Explains Why We Shouldn't Suffer in Silence One Colorado mom's Facebook post recently went viral for showing how much asking a friend for help can make the difference when you're feeling alone.,0.1937102241296699,0.2691640883861437,0.23143715625790678,0.24401280030065242
N2078,tv,tv-celebrity,"Rainbow Baby! Shawn Johnson, Andrew East Welcome 1st Child After Miscarriage Rainbow Baby! Shawn Johnson, Andrew East Welcome 1st Child After Miscarriage",0.1937102241296699,0.2897928173872695,0.24175152075846967,0.25776528630140294
N12709,lifestyle,lifestylebuzz,"Twitter Had Feelings About Mark Zuckerberg's Micro-Bangs Facebook founder Mark Zuckerberg debuted a new haircut on the House floor on Wednesday, and Twitter quickly took note with an avalanche of memes and quips.",0.1937102241296699,0.2532683671826512,0.22348929565616055,0.23341565283165744
N8237,foodanddrink,restaurantsandnews,16 Secrets Olive Garden Doesn't Want You to Know Here's everything you've wanted to know about your favorite breadstick-serving restaurant.,0.1937102241296699,0.2734540246622088,0.23358212439593934,0.2468727578180292
N42791,tv,tvnews,"Eva Longoria: 'Latinas Are the Last to Find Their Voices Amplified' Eva Longoria delivered a powerful and moving keynote at TheWrap's Power Women Summit in Los Angeles on Friday, saying that people in Hollywood are ""largely responsible for much of the unconscious bias that is against people of color"" and that ""Latinas are the last to find their voices amplified in this industry."" ""What studies show is that we are being erased,"" Longoria told a room of 2,000 attendees. ""This goes beyond underrepresentation. When...",0.1937102241296699,0.2767969894851716,0.23525360680742075,0.24910140103333772
N50258,news,newspolitics,Trump feuds with Susan Rice over Syria President Trump exchanged barbs with the former Obama administration national security adviser Susan Rice over Syria after she criticized his policy.,0.1937102241296699,0.2676900661851986,0.23070014515743426,0.24303011883335568
N43374,news,newspolitics,Trump goes on Twitter tear after White House official condemns his Ukraine call President Donald Trump launched a sustained online offensive after details emerged of damaging congressional testimony by a senior White House official.,0.1937102241296699,0.2783108393977611,0.2360105317637155,0.25011063430839736
N6285,finance,personalfinance,4 habits that could wreck your finances beyond repair Avoid these at all costs.,0.1937102241296699,0.2948643796210107,0.2442873018753403,0.2611463277905638
N2183,tv,humor,"The top female comedians working in film and television today Film and television, specifically in the comedic vein, is currently blessed with a bevy of talented women. The transition from writing standup material to award-winning, mainstream masterpieces has never been so visible, and the impressive canon of female voices peppering the entertainment world is staggering.",0.1937102241296699,0.2905607127171828,0.24213546842342637,0.25827721652134517
N31099,travel,traveltripideas,Harry Potter's Childhood Home in England Is Now on Airbnb I think I can die happy now.,0.1937102241296699,0.2717634046261046,0.23273681437788724,0.24574567779395973
N6576,health,weightloss,16 Women Reveal Exactly How They Got Six-Pack Abs What does it really take to get six-pack abs? These women can tell you exactly what worked for them.,0.1937102241296699,0.3037169761761299,0.2487136001528999,0.2670480588273099
N59774,foodanddrink,restaurantsandnews,"The Unreasonable Lengths Restaurant Workers Have to Go to Take Time Off From working doubles in advance to finding their own replacements, here's how unsalaried shift workers manage when it comes to vacation.",0.1937102241296699,0.2591047943469583,0.2264075092383141,0.23730660427452888
N56444,health,wellness,"Jameela Jamil Called Out a New TV Show Where Judges Decide If Contestants ""Deserve"" Plastic Surgery The Good Place star had a lot to say after learning about ""The Surjury,"" a new British reality series about people competing against one another to win free plastic surgery.",0.1937102241296699,0.2480394070710413,0.2208748156003556,0.2299296794239175
N61972,entertainment,entertainment-celebrity,"New details on why Meg Ryan, John Mellencamp split, plus more news Meg Ryan and John Mellencamp's marriage plans may have prompted their split. Plus, more celebrity news for Nov. 4, 2019.",0.1937102241296699,0.2915685738078526,0.24263939896876124,0.25894912391512503
N56853,news,newsworld,"Trump orders withdrawal of U.S. forces from northern Syria, days after Pentagon downplays possibility U.S.-allied Syrian Kurdish fighters announced late Sunday that the Syrian Army would deploy along the Turkish border to ""liberate the areas that the Turkish army has entered with its mercenaries.""",0.1937102241296699,0.259637051301306,0.22667363771548793,0.23766144224409397
N51457,foodanddrink,restaurantsandnews,Restaurants Are Dealing With an Avalanche of Special Requests. One Chef Has Had Enough. It's not all about you.,0.1937102241296699,0.2578447633513282,0.22577749374049905,0.23646658361077544
N29561,lifestyle,lifestylebuzz,"High school cheerleaders go off-script to help man propose to their coach A school's cheer squad coach was surprised when her students went off-script and held up four signs during a routine that read, ""Will you marry me?""",0.1937102241296699,0.2750774894832782,0.23439385680647407,0.2479550676987421
N11163,news,newspolitics,"Kobach's campaign paid Kansan known to post racist comments on white nationalist site Kansas Republican Kris Kobach's Senate campaign paid an Olathe man who regularly posted hateful comments about Jews and racial minorities on a white nationalist website. Kobach's campaign paid Joe Suber $500 for field coordinating services in September, according to the Republican's latest campaign finance report. Suber also filed the paperwork with the state of Kansas creating ...",0.1937102241296699,0.2877040207816661,0.240707122455668,0.2563727552310007
N64554,entertainment,entertainment-celebrity,"Meghan King Edmonds, Jim Edmonds' Nanny Denies Cheating Allegations Meghan King Edmonds, Jim Edmonds' Nanny Denies Cheating Allegations",0.1937102241296699,0.270509907486581,0.23211006580812543,0.24491001303427729
N16344,entertainment,celebrity,Stars   They're Just Like Us! Stars   They're Just Like Us!,0.1937102241296699,0.2674735843061795,0.2305919042179247,0.2428857975806763
N56438,news,newsus,The 'race whisperer' A black activist convinced a neo-Nazi he'd save him from legal ruin. Then the real plan got underway.,0.1937102241296699,0.2695586972594306,0.23163446069455024,0.2442758728828437
N31802,entertainment,celebrity,Stars turning 50 in 2019 Find out which celebrities are celebrating the big 5-0 in 2019!,0.1937102241296699,0.2952444362733938,0.24447733020153184,0.26139969889215253
N13225,travel,traveltripideas,5 Reasons Destin Is a Great Family Vacation Destination The calm emerald waters and family-friendly attractions of the area make Destin a top spot for a fall or winter getaway.,0.1937102241296699,0.3003860243258817,0.24704812422777578,0.2648274242604778
N36593,foodanddrink,foodnews,"How the Boston cream pie became a beloved dessert A product of the longest continually operating hotel in the United States, the Boston cream pie combines sponge cake, vanilla custard and chocolate icing to form a beloved American dessert.",0.1937102241296699,0.2551257319625449,0.2244179780461074,0.23465389601825326
N2018,entertainment,celebrity,"Debunking the week's tabloid stories: Nov. 1, 2019 A round-up of the week's tabloid stories that totally missed the mark.",0.1937102241296699,0.2499611702099804,0.22183569716982515,0.2312108548498769
N21389,news,newsworldpolitics,Rep. Katie Hill's lawyers send cease-and-desist letter to DailyMail.com over nude photos The website is the second to publish alleged lewd photos of the Democratic congresswoman.,0.1937102241296699,0.2576508397527398,0.22568053194120485,0.23633730121171648
N59469,lifestyle,lifestyleroyals,"Every outfit Duchess Kate has worn in 2019 See Kate Middleton's style choices this year from glam gowns and coat dresses to re-wears, tiaras and hats.",0.1937102241296699,0.2940013125340486,0.24385576833185924,0.26057094973258904
N58744,lifestyle,voices,"I Gave Up On Love, And It Was One Of The Best Decisions I Ever Made At the end of our date in August 2018, Justin escorted me to my car, where henervously kissed me. When I kissed him back, he cheered, pumping his fists inthe air like he'd won something. I walked from the curb to my car, and when Iturned around, he was watching me, beaming.""I just want to make sure you get to your car safely,"" he said, even though Iwas less than a yard away.I slipped into the driver's seat, thrilled that our second date had gone...",0.1937102241296699,0.3009018888004349,0.24730605646505238,0.2651713339101799
N22614,sports,football_ncaa,Predicting which of college football's 10 undefeated teams will lose in Week 9 How many teams will still have a perfect record after Week 9?,0.1937102241296699,0.3042534609492475,0.2489818425394587,0.2674057153427216
N51503,sports,football_ncaa,"Bill Plaschke: Mike Bohn brings USC integrity, which means he can't hire Urban Meyer LOS ANGELES_You ever heard of Mike Bohn? Me neither, and that's a good thing. The University of Southern California is apparently set on naming Bohn as its new athletic director, the smart hiring of a man who embodies the most important attribute for the new leader of the Trojans family. He's a complete stranger. He never played football at USC. He never coached football at USC. He never ...",0.1937102241296699,0.2864852159692058,0.24009772004943786,0.2555602186893605
N6750,news,newspolitics,"Kamala Harris to slash staff, restructure campaign as she hemorrhages cash Kamala Harris is dramatically restructuring her campaign by redeploying staffers to Iowa and laying off dozens of aides at her Baltimore headquarters, according to campaign sources and a memo obtained by POLITICO Wednesday, as she struggles to resuscitate her beleaguered presidential bid.",0.1960191809882739,0.2778409083421672,0.23693004466522055,0.2505669992242027
N62471,sports,football_nfl,"Trent Williams fails physical, experiencing discomfort with helmet Washington Redskins tackle Trent Williams' health situation has managed to get stranger after he reported to the team.",0.1975758121698396,0.2828908489471582,0.2402333305584989,0.2544525033547187
N63554,travel,traveltripideas,"It took me 96 hours to ride an Amtrak train from coast to coast. I'd do it again in a heartbeat. Four days aboard a cross-country Amtrak train was so much more relaxing than flying. If I had the time, I'd do it on every trip.",0.1981088839223947,0.3215460751773501,0.2598274795498724,0.28040034475903164
N53017,lifestyle,lifestylebuzz,Kendall Jenner Wore the Tiniest Dress to Go Jewelry Shopping No fall layers to see here.,0.1992814156602334,0.2535493404233471,0.22641537804179024,0.23546003216897587
N37378,news,newsus,"Wisconsin jury awards $450,000 in Sandy Hook defamation case A jury in Wisconsin has awarded $450,000 to the father of a boy killed in the 2012 Sandy Hook school shooting after he filed a defamation lawsuit against conspiracy theorist writers who claimed the massacre never happened.",0.2007078005700707,0.2803644598253546,0.24053613019771264,0.25381224007359326
N40171,autos,autosbuying,Why You Shouldn't Ever Go for the Cheapest Brake Pads Brakes are the most important part of your car. Here's why you shouldn't cut costs on them.,0.2025075437151196,0.3027141571004175,0.25261085040776854,0.2693119526386515
N33981,lifestyle,lifestylebuzz,"Dog Throws A Total Tantrum When She Realizes Mom Wants To Take The Stairs Aurora Angel Beste Nala has always been the friendliest dog, and loves going out on adventures and meeting new people.",0.2025075437151196,0.2782063940693787,0.24035696889224914,0.2529734439512923
N24691,news,newsus,"Bill Macy, Bea Arthur's Husband on 'Maude,' Dies at 97 Norman Lear saw him choking on a chicken bone and brought him to Hollywood. The actor also appeared in 'My Favorite Year' and 'The Late Show.'",0.2063224473235212,0.2525160588235566,0.2294192530735389,0.2371181883235448
N64467,news,newsus,"Former Fox News hosts want out of non-disclosure agreements In the wake of the Me Too movement, women are calling them unfair silencers that sweep sexual misconduct claims under the rug",0.2072761228379178,0.2460364318522496,0.2266562773450837,0.23311632884747233
N13912,travel,traveltips,A lawyer reveals a legal nightmare you can face on a cruise ship Cruise ship passengers can be exposed to legal systems that don't provide the same protections they would find in the US.,0.20738216199788,0.2624220693379563,0.23490211566791816,0.24407543355793088
N62285,news,newsus,"Former Florida cop won't serve jail time after accidentally killing woman, 73, in training exercise A former Florida police officer who accidentally shot and killed a 73-year-old woman during a demonstration will not serve any jail time as part of a plea agreement.",0.20738216199788,0.2790684436930222,0.2432253028454511,0.25517301646130813
N41218,news,newspolitics,"Election Day 2019: Most Important Races and What to Watch For In elections that will determine policy, the political makeup of state legislatures and who lives in governors' mansions, voters will head to the polls Tuesday in states across the country.",0.2081981283272353,0.2794714338617012,0.24383478109446827,0.25571366535021256
N21019,autos,autosnews,"Ford Baby Bronco Bare Body Allegedly Leaked In Exclusive Photo Ford had no comment, but it sure looks like the real deal.",0.2097727829483812,0.2444566720104003,0.22711472747939077,0.23289537565639395
N41298,music,music-celebrity,"Katy Perry sued for $150k by photo agency for 3-year-old pic Katy Perry allegedly posted a paparazzi photo without paying the fee, a photo agency claims.",0.2097727829483812,0.2674237621734385,0.23859827256090985,0.24820676909841938
N10340,foodanddrink,tipsandtricks,"The French Grandmother's Clever Trick to Keeping Fruit Flies Away When I worked in Paris as an au pair, I marveled at how the French seemed to have it all figured out. The family's grandmother always set the table with the good silver even on a Tuesday. I was instructed to pick up fresh, fluffy chouquettes from the boulangerie for the kids' after-school snack instead of, I don't know, granola bars (which is what I would've gotten). It was almost irritating how everyone around me seemed to have effortlessly...",0.2102582688691577,0.2806004431504484,0.24542935600980303,0.2571530517233515
N43202,autos,autosnews,Mid-Engine C8 Corvette Production Postponed Until February 2020 The car was supposed to be hitting dealers by the end of 2019. That's no longer happening.,0.2103879358058024,0.2867111850810244,0.2485495604434134,0.26127010198928374
N61070,news,newscrime,Man arrested in 1993 cold case rape after he's identified by DNA: Police The suspect was 28 at the time and not known to the victim.,0.2104717939148236,0.2848094112278991,0.24764060257136133,0.26003020545687394
N14349,entertainment,celebrity,Celebrity Headshots from Before They Were Famous Prepare for some straight-up baby faces.,0.2115764923858483,0.2421584748924417,0.226867483639145,0.23196448072357723
N42470,finance,finance-companies,G.M. Workers Approve Contract and End U.A.W. Strike The longest nationwide strike against General Motors in half a century ended on Friday after a solid majority of the company's union members delivered their support for the four-year contract hammered out by their leaders. The United Auto Workers union emerged with substantial wage increases and succeeded in ending a two-tier wage structure that had been a particular irritant in its ranks. It also won commitments to new G.M. investments in...,0.2122150593119703,0.3025388275926642,0.25737694345231726,0.27243090483243293
N55911,lifestyle,lifestylebuzz,Katie Holmes Talks About That Bra and Cardigan Moment Katie Holmes Talks About That Bra and Cardigan Moment,0.2125485400087985,0.2733763960699183,0.2429624680393584,0.25310044404954507
N29499,news,newsus,"California governor signs measure banning 'lunch shaming' SACRAMENTO, Calif. (AP)   California's governor has signed into law a bill that guarantees all students a state-funded meal of their choice, even if their parent or guardian has unpaid meal fees.",0.2128889660816653,0.2737395623659319,0.2433142642237986,0.25345603027117636
N35452,weather,weathertopstories,"'Potentially historic wind event' over weekend could inflame California wildfires Northern California could experience a potentially historic wind event this weekend, which could have a dangerous effect on wildfires.",0.2128889660816653,0.283571620214032,0.24823029314784864,0.2600107355032431
N28074,lifestyle,lifestylefamilyandrelationships,"Woman Texts Dead Father's Phone for 4 Years & Finally Receives an Emotional Reply The pain of losing a parent, especially at a young age, is one that never really goes away.",0.2130953579275473,0.2917484568546334,0.2524219073910904,0.2655307572122714
N42526,finance,finance-companies,'Go back to work': Outcry over deaths on Amazon's warehouse floor Billy Foister died last month after a heart attack at work. The incident was just one in a series of recent accidents and fatalities,0.2131759228853929,0.2370471221701616,0.22511152252777725,0.22909005574190539
N16158,lifestyle,lifestylebuzz,"Nationals pitcher criticized for missing playoff game for daughter's birth Daniel Hudson said his family is his ""top priority"" after receiving criticism for missing a playoff game for the birth of his daughter.",0.2131913786907326,0.2817011638727213,0.24744627128172697,0.25886456881205844
N58580,tv,tv-gallery,"17 Hallmark Movies That Are Totally Worth Watching From festive flicks to cheesy romantic comedies, here are all the best Hallmark movies that are worth watching at least once.",0.2132856344995612,0.2961486026778522,0.2547171185887067,0.26852761328508856
N44442,news,newspolitics,"CNN Poll: 50% support impeaching Trump and removing him from office Half of Americans say President Donald Trump should be impeached and removed from office, according to a new CNN poll conducted by SSRS.",0.2137244504432877,0.286958739951117,0.25034159519720234,0.2625473101151739
N61249,tv,tv-celebrity,"Hulk Hogan's jet grounded after 'melted' brakes, blown tires Hulk was headed to Saudi Arabia, but had a pit stop in Iceland.",0.2139481596727442,0.2613211254562734,0.23763464256450878,0.24553013686176367
N22545,foodanddrink,foodnews,"The Search for a Gender Neutral Drive Thru Toy When families are asked whether a kid's meal is for a boy or girl, it means kids get toys based on stereotypes not their actual interests. Is it time to rethink drive-thru toys?",0.2140928292955672,0.2545159393003694,0.2343043842979683,0.2410415692987687
N62209,foodanddrink,foodnews,"Popeyes mocks Chick-fil-A for National Sandwich Day blunder, reignites sandwich wars Popeyes is mocking Chick-fil-A as the chicken sandwich wars heat up once again before National Sandwich Day.",0.2140928292955672,0.253992476125821,0.23404265271069408,0.2406925938490697
