ID,category,sub_category,content,collaborative_rec,content_rec,mean,two_one
N50258,news,newspolitics,Trump feuds with Susan Rice over Syria President Trump exchanged barbs with the former Obama administration national security adviser Susan Rice over Syria after she criticized his policy.,0.1334182044863563,0.2462903885806732,0.18985429653351477,0.20866632721590092
N21389,news,newsworldpolitics,Rep. Katie Hill's lawyers send cease-and-desist letter to DailyMail.com over nude photos The website is the second to publish alleged lewd photos of the Democratic congresswoman.,0.1334182044863563,0.2402476397959486,0.18683292214115244,0.20463782802608452
N63248,lifestyle,lifestylecelebstyle,"Hailey Baldwin wore three show-stopping dresses during her wedding, and put a unique twist on each one Hailey Baldwin's three custom gowns were designed by Virgil Abloh of Off-White, Vera Wang, and Ralph & Russo.",0.1334182044863563,0.2467115583800372,0.19006488143319675,0.20894710708214356
N43374,news,newspolitics,Trump goes on Twitter tear after White House official condemns his Ukraine call President Donald Trump launched a sustained online offensive after details emerged of damaging congressional testimony by a senior White House official.,0.1334182044863563,0.2378572646465598,0.18563773456645805,0.20304424459315865
N31802,entertainment,celebrity,Stars turning 50 in 2019 Find out which celebrities are celebrating the big 5-0 in 2019!,0.1334182044863563,0.2548333818337184,0.19412579316003736,0.21436165605126437
N22627,news,newsus,Family Members Plead for Help in Search for Missing Atlanta College Student: 'Just Come Home' Family Pleads for Help in Search for Missing College Student,0.1334182044863563,0.2661896697563931,0.19980393712137468,0.22193251466638084
N36593,foodanddrink,foodnews,"How the Boston cream pie became a beloved dessert A product of the longest continually operating hotel in the United States, the Boston cream pie combines sponge cake, vanilla custard and chocolate icing to form a beloved American dessert.",0.1334182044863563,0.2866233619977155,0.21002078324203588,0.23555497616059576
N56290,foodanddrink,tipsandtricks,The Secret Ingredient for Sausage Gravy That's Out of This World Transform your gravy with this $1 ingredient,0.1334182044863563,0.2965900780910891,0.2150041412887227,0.2421994535561782
N30974,sports,basketball_ncaa,"Police identify 2 suspects in murder of Andre Emmett last month Two men accused of killing former Texas Tech and NBA player Andre Emmett were identified by Dallas police on Monday, the Dallas Morning News reported.",0.1334182044863563,0.2348663125666732,0.18414225852651475,0.2010502765399009
N42791,tv,tvnews,"Eva Longoria: 'Latinas Are the Last to Find Their Voices Amplified' Eva Longoria delivered a powerful and moving keynote at TheWrap's Power Women Summit in Los Angeles on Friday, saying that people in Hollywood are ""largely responsible for much of the unconscious bias that is against people of color"" and that ""Latinas are the last to find their voices amplified in this industry."" ""What studies show is that we are being erased,"" Longoria told a room of 2,000 attendees. ""This goes beyond underrepresentation. When...",0.1334182044863563,0.2262130724568597,0.179815638471608,0.19528144980002524
N44442,news,newspolitics,"CNN Poll: 50% support impeaching Trump and removing him from office Half of Americans say President Donald Trump should be impeached and removed from office, according to a new CNN poll conducted by SSRS.",0.1334825778533092,0.2775779757620116,0.2055302768076604,0.2295461764591108
N23163,news,newspolitics,"'You people with this phony Emoluments Clause': Cabinet meeting devolves into 71 minutes of Trump grievances President Trump, trying to dig out from two new political holes of his own making on top of the expanding House impeachment inquiry, held forth for 71 minutes Monday during what was ostensibly a Cabinet meeting but ended up being a familiar torrent of grievance, defensiveness and bold statements about his expansive view of his own powers.",0.1346886549037823,0.2454510718012849,0.1900698633525336,0.208530266168784
N61005,sports,football_nfl,Randy Moss takes a perfect dig at Joe Buck's infamous 'disgusting act' call ,0.1347704052287051,0.1990761164800143,0.1669232608543597,0.17764087939624457
N51180,finance,finance-companies,"Verizon to give its wireless customers a year of Disney+ Verizon announced Tuesday that it is teaming up with Disney to give new and existing 4G LTE and 5G wireless ""unlimited"" customers a free year of the new Disney+ streaming service. The exclusive promotion coincides with the Disney+ launch on Nov. 12. New Verizon FIOS and 5G Home Internet customers will also qualify for a year of Disney+.",0.1347995863447027,0.2860100325686323,0.2104048094566675,0.2356065504939891
N24724,news,newsworld,"Humanitarian crisis unfolds as violence escalates in Syria In little more than a week, longstanding alliances have crumbled and old enemies have teamed up after the U.S. began pulling its forces out and Turkey invaded Syria",0.1361124082984949,0.2641969434190213,0.2001546758587581,0.22150209837884582
N14349,entertainment,celebrity,Celebrity Headshots from Before They Were Famous Prepare for some straight-up baby faces.,0.1364702084828134,0.232239783213432,0.1843549958481227,0.20031659163655915
N42526,finance,finance-companies,'Go back to work': Outcry over deaths on Amazon's warehouse floor Billy Foister died last month after a heart attack at work. The incident was just one in a series of recent accidents and fatalities,0.1376476371713935,0.2551725841436335,0.1964101106575135,0.21599760181955346
N57239,movies,movies-celebrity,Emma Watson Says She Rejects the Word Single: 'I Call It Being Self-Partnered' Emma Watson Rejects the Word Single: 'I Call It Being Self-Partnered',0.1381911136816012,0.2473257087768758,0.19275841122923848,0.21094751041178428
N2805,movies,movienews,"Star Wars: The Rise of Skywalker trailer is out, tickets already on sale The trailer debuted during Monday Night Football halftime, on Carrie Fisher's birthday.",0.1381911136816012,0.2324895765365634,0.18534034510908232,0.20105675558490935
N53017,lifestyle,lifestylebuzz,Kendall Jenner Wore the Tiniest Dress to Go Jewelry Shopping No fall layers to see here.,0.1395560833189091,0.2370845124316998,0.18832029787530447,0.20457503606076957
N37131,sports,baseball_mlb,What recent history tells us to expect from World Series Game 7 Will the Nationals and Astros give us a classic or a clunker?,0.1411199605537007,0.2199305781132626,0.18052526933348167,0.1936603722600753
N38939,music,musicnews,"This Guns N' Roses Video Just Became the First From the '80s to Reach 1 Billion YouTube Views Guns 'N Roses' rockin' black-and-white video for ""Sweet Child O' Mine"" has become the first video from the 1980s to hit one billion YouTube views.",0.1416347887020154,0.2719678698597061,0.20680132928086076,0.22852350947380923
N16292,foodanddrink,foodnews,"What it's like to cook for Kate Middleton and Prince William, according to Giada De Laurentiis One of the professional chef's favorite career moments was the day she cooked for the Duke and Duchess of Cambridge at a polo charity event.",0.1416347887020154,0.2267094094702427,0.18417209908612905,0.19835120254750027
N48076,tv,tvnews,"Whoopi Goldberg Asks Meghan McCain to 'Respect' Her 'View' Co-Hosts During Heated Discussion 'I'm not trying to cut you off, I'm trying to get you heard.'",0.1416347887020154,0.239138296757276,0.1903865427296457,0.20663712740552248
N14340,news,newsworld,"Security camera spots SOS from woman lost for three days in Australia There was a bit of euphoria that, wow there's our break, police said of the the SOS message.",0.1421146973408148,0.2476493340882568,0.19488201571453578,0.21247112183910946
N58801,sports,golf,"Greg Norman upset Tiger Woods didn't respond to his handwritten letter: ""Maybe Tiger just dislikes me"" Greg Norman tells Men's Health he hand delivered a letter to Tiger Woods following his Masters win in April, but never got a reply.",0.1425050166448317,0.2341305542282613,0.18831778543654648,0.2035887083671181
N65169,news,newsus,"Ohio voters express angst over impeachment Support for impeachment may be on the rise, but the view from central Ohio is strikingly complicated and nuanced.",0.1425050166448317,0.2420246612193528,0.19226483893209223,0.20885144636117908
N42128,movies,movies-celebrity,"Hugh Hefner's son Cooper weds 'Harry Potter' actress Cooper Hefner married Scarlett Byrne in Ventura, Calif., on Monday.",0.1434355527393052,0.2500321589980918,0.1967338558686985,0.21449995691182958
N56541,sports,baseball_mlb,"Soto, Nationals edge Astros in World Series opener Juan Soto homered onto the train tracks high above the left field wall and hit a two-run double as the Nationals tagged Gerrit Cole and the Houston Astros 5-4 Tuesday night in the World Series opener.",0.1436019371959738,0.2246782832242896,0.1841401102101317,0.19765283454818433
N56447,tv,tv-celebrity,"'The Office' star Jenna Fischer responds to Chrissy Teigen's theory that Jim and Pam are divorced Jenna, who played Pam opposite John Krasinski's Jim on the hit NBC sitcom, thinks Chrissy got it wrong.",0.1438181002726721,0.2358807677054113,0.1898494339890417,0.20519321189449824
N63554,travel,traveltripideas,"It took me 96 hours to ride an Amtrak train from coast to coast. I'd do it again in a heartbeat. Four days aboard a cross-country Amtrak train was so much more relaxing than flying. If I had the time, I'd do it on every trip.",0.1438583747038573,0.3006256169089419,0.22224199580639958,0.24836986950724704
N63276,autos,autosenthusiasts,Gordon Ramsay's Ferrari Monza SP2 Looks Delicious Good thing the roofless ride is inside because it's raining outside.,0.1443215802112404,0.2711280710505492,0.20772482563089478,0.2288592407707796
N12576,news,newsworld,Chinese pilot suspended after woman poses in cockpit with drinks The unidentified woman is seen sitting in the captain's seat with drinks in front of her on an Air Guilin flight in January this year.,0.1448197836638335,0.2668795377991608,0.20584966073149713,0.22619295308738505
N59496,sports,football_nfl,"Week 7 winners, losers: Aaron Rodgers now in MVP race; Mitchell Trubisky looks lost Aaron Rodgers' big game vaults him into the MVP race. Meanwhile in Chicago, it might be time for the Bears to reconsider Mitchell Trubisky's future.",0.1450224034520652,0.1906519706037746,0.1678371870279199,0.17544211488653813
N41298,music,music-celebrity,"Katy Perry sued for $150k by photo agency for 3-year-old pic Katy Perry allegedly posted a paparazzi photo without paying the fee, a photo agency claims.",0.1455792799026451,0.2473002095461737,0.1964397447244094,0.21339323299833082
N21019,autos,autosnews,"Ford Baby Bronco Bare Body Allegedly Leaked In Exclusive Photo Ford had no comment, but it sure looks like the real deal.",0.1455792799026451,0.2418922493895744,0.19373576464610975,0.20978792622726464
N57737,news,newsus,"Missing Minnesota boy, 6, and his dog, found in cornfield by drone with thermal camera A missing 6-year-old boy from Minnesota and his dog were found Wednesday after hundreds of volunteers   including one who used his own drone with a thermal camera   searched for him for hours.",0.1457913748881434,0.27310368979197,0.2094475323400567,0.23066625149069445
N64467,news,newsus,"Former Fox News hosts want out of non-disclosure agreements In the wake of the Me Too movement, women are calling them unfair silencers that sweep sexual misconduct claims under the rug",0.1465352642986065,0.2489354434108013,0.1977353538547039,0.21480205037340303
N56446,movies,movies-celebrity,Ryan Reynolds Shares the First Photo of His and Blake Lively's Newborn Daughter This is the first time the actor has talked about his newborn daughter.,0.1468057309021763,0.2299467069215446,0.18837621891186046,0.20223304824842184
N62285,news,newsus,"Former Florida cop won't serve jail time after accidentally killing woman, 73, in training exercise A former Florida police officer who accidentally shot and killed a 73-year-old woman during a demonstration will not serve any jail time as part of a plea agreement.",0.1470416718253238,0.2529620814359127,0.20000187663061825,0.21765527823238306
N13912,travel,traveltips,A lawyer reveals a legal nightmare you can face on a cruise ship Cruise ship passengers can be exposed to legal systems that don't provide the same protections they would find in the US.,0.1470416718253238,0.2786639332017236,0.2128528025135237,0.23478984607625702
N28711,sports,football_ncaa,The biggest games in the month of November that will decide the College Football Playoff The month of November will decided which teams will be in College Football Playoff contention. A look at the biggest games in a jam-packed schedule.,0.1470528669593856,0.2606304584767496,0.20384166271806758,0.22277126130429492
N23614,tv,tv-celebrity,"John Witherspoon Dies: Comedian & 'Friday' Star Was 77 John Witherspoon, an actor-comedian who for decades made audiences laugh in television shows and films, including the hit Friday franchise, died suddenly at his home today. He was 77. ""It is with deepest sorrow that we can confirm our beloved husband and father, John Witherspoon, one of the hardest working men in show business, died",0.1472402441039893,0.2696092433228003,0.2084247437133948,0.22881957691652996
N22570,foodanddrink,foodnews,'Ghost kitchens' are taking over fast-food chains from Chick-fil-A to Wendy's Wendy's became the latest fast-food chain to name-check ghost kitchens on Friday at the company's investor day.,0.1472555952761999,0.2420502235944264,0.19465290943531316,0.21045201415501757
N40442,finance,markets,"25 bathrooms? Former Clinton labor secretary says Bezos' mansion helps make case for soaking the rich Robert Reich served as labor secretary in the Clinton administration, where he was named by Time Magazine as one of the 10 most effective cabinet secretaries of the 20th century. He's a Rhodes scholar, a best-selling author, a documentarian and a professor of public policy at UC Berkeley. What he's not, apparently, is a fan of billionaires clinging to their riches.",0.1498931828658756,0.2287361869635134,0.1893146849146945,0.20245518559763412
N63889,news,newspolitics,Trump Attorneys Assert Immunity From Broad Sweep of Law Legal filings and lawyers' statements show an attempt to put President Trump beyond legal reach while in office.,0.1498931828658756,0.2675217553178318,0.2087074690918537,0.22831223116717972
N22130,music,music-celebrity,Rihanna Slays in Sexy Black Bikini in Slow-Motion Video -- Watch! The singer shut down Instagram with her slow-motion clip.,0.1499189866252842,0.2291359771134683,0.18952748186937624,0.20273031361740695
N46868,lifestyle,lifestylepetsanimals,"30 Funny Dog Photos You Need to See We asked readers to send in their favorite animal photos. We were so entertained, we couldn't help but share.",0.1499189866252842,0.2609209285673403,0.20541995759631224,0.22392028125332158
N18663,news,newsus,"Coast Guard offloads $92 million worth of smuggled cocaine in San Diego The Coast Guard offloaded more than 6,800 pounds of cocaine   worth an estimated $92 million   in San Diego on Wednesday, contraband that the military branch seized in international waters of the eastern Pacific Ocean.",0.1499189866252842,0.3005805170291091,0.22524975182719664,0.2503600068945008
N15771,autos,autosenthusiasts,"The Holy Grail Of Jeep Grand Cherokees Sits On An Old Wisconsin Dairy Farm, But It May Be Doomed ",0.1499189866252842,0.243964182722197,0.1969415846737406,0.21261578402322606
N47482,travel,travelnews,TSA Agents Stop Passenger With Loaded Gun Before Boarding Plane The man was carrying a loaded .22 caliber handgun.,0.1499189866252842,0.2770161195406682,0.21346755308297619,0.23465040856887354
N157,sports,baseball_mlb,"How did the Nats respond to a controversial call? By leaving absolutely no doubt. A controversial interference call. Dominance from Stephen Strasburg. Booming home runs to turn it around. And now, one game to decide it all.",0.1499189866252842,0.2254275726791417,0.18767327965221295,0.20025804399452254
N47054,autos,autossema,"Hennessey Maximus Is a 1000-HP Jeep Gladiator from Hell If a 2020 Jeep Gladiator is not aggressive-looking enough, Hennessey has this even more intense version, which it's bringing to the SEMA show.",0.1499189866252842,0.2663348447133019,0.20812691566929303,0.22752955868396266
N20886,news,newsworld,"ISIS Leader Paid Rival for Protection but Was Betrayed by His Own The Islamic State leader Abu Bakr al-Baghdadi was able to hide out in an unlikely part of Syria, the base of a rival group, because he was paying protection money to its members, according to receipts for the payments recovered by researchers.",0.1499189866252842,0.2685844500541748,0.2092517183397295,0.22902929557787793
N2606,news,newscrime,"Couple Accused of Injecting Childhood Friend With Meth and Filming Her As She Died After more than two years of investigation, authorities in Oklahoma have filed formal murder charges in the death of a 41-year-old woman whose last moments were captured on videotape.",0.1499189866252842,0.2659503344140077,0.20793466051964596,0.22727321848443321
N64562,tv,tv-celebrity,Rob Kardashian Appears Thinner at Kim Kardashian's Birthday Party in Rare Video Rob Kardashian Appears Thinner at Kim Kardashian's Birthday Party,0.1499189866252842,0.2289379255754513,0.18942845610036774,0.20259827925872895
N8419,news,newscrime,Man charged with 5 counts of first-degree murder in shooting rampage at Chicago condo Chicago police Monday morning announced charges against a man in connection with a shooting rampage that left five people dead Saturday night.,0.1499189866252842,0.252420974364254,0.20116998049476909,0.21825364511793072
N5888,sports,baseball_mlb,Report: Angels could be fined up to $2M for not reporting Skaggs' opioid use The Los Angeles Angels could be fined up to $2 million by the commissioner for not reporting Tyler Skaggs' opioid use. A report published by ESPN on Saturday stated that Angels communications director Eric Kay admitted to federal investigators that he used and supplied Skaggs with drugs since at least 2017.,0.1499189866252842,0.2552126518087871,0.20256581921703565,0.22011476341428615
N60388,news,newscrime,"Man threatened school to distract from robbery, police say As a precaution, schools in one of the districts that were threatened placed all of its schools on a modified lockdown",0.1499189866252842,0.2637622762192042,0.20684063142224418,0.22581451302123084
N1431,news,newscrime,"Four charged with repeatedly escaping prison, returning with booze and phones Acting on ""repeated reports"" that prisoners were regularly escaping and returning, authorities said they caught the men in the act with the contraband.",0.1499189866252842,0.2727753645542923,0.21134717558978824,0.23182323857795628
N24123,sports,baseball_mlb,Why is Giancarlo Stanton on the Yankees' playoff roster? ,0.1499189866252842,0.2119987497884843,0.18095886820688423,0.19130549540075092
N20286,movies,movies-celebrity,Scarlett Johansson Says She Was 'Surprised' by Colin Jost's Proposal: 'He Killed It' Scarlett Johansson Was 'Surprised' by Colin Jost's Proposal,0.1499189866252842,0.2320154909357932,0.1909672387805387,0.20464998949895688
N55310,news,newscrime,"Joey 'the Clown' Lombardo, infamous Chicago mobster, dead at 90, reports say Chicago mobster Joseph Lombardo   better as ""Joey the Clown""   died in prison Saturday while serving a life sentence for murder, according to federal prosecutors.",0.1499189866252842,0.2553259988021183,0.20262249271370125,0.22019032807650696
N32095,news,newsus,"Illegal vapes traced to California woman who was CBD pioneer CARLSBAD, Calif. (AP)   Some of the people rushing to emergency rooms thought the CBD vape they inhaled would help like a gentle medicine. Others puffed it for fun. What the vapors delivered instead was a jolt of synthetic marijuana, and with it an intense high of hallucinations and even seizures.",0.1499189866252842,0.2639753412400341,0.20694716393265913,0.2259565563684508
N43955,entertainment,entertainment-celebrity,"Celebrity kids then and now: See how they've grown See what the children of Bobby Cannavale, Ray Liotta, Jude Law, Jamie Foxx, Sylvester Stallone, James Gandolfini and more stars look like now.",0.1506558748376913,0.2312100592800542,0.19093296705887275,0.20435866446593323
N42137,entertainment,celebrity,Celeb couples with big age gaps Age is just a number for some stars!,0.1507528858611588,0.2288746517881957,0.18981376882467724,0.20283406314585004
N33013,lifestyle,lifestylebuzz,"Couple Cancels Wedding, Keeps $30K as ""Donation"" for Honeymoon Instead In a viral Facebook post, a couple announces they're canceling their wedding, but keeping the $30,000 in gifts for a honeymoon instead.",0.1507632042585114,0.2826208283774097,0.21669201631796053,0.2386682870044436
N53880,finance,markets,"The megaprojects that changed countries forever Megaprojects are complex and expensive ventures that take years to complete. Although the massive scale of these projects makes them fraught with risk, they also have the capacity to bring great economic and social benefits during and after construction. Whether good or bad, these are the megaprojects that have shaped the future of their countries in a big way.",0.1507632042585114,0.2887251323007878,0.2197441682796496,0.24273782295336233
N57318,news,newsus,"A 2,000-pound great white shark is swimming off the coast of Florida A great white shark that weighs over 2,000 pounds and measures 15 feet, 5 inches long has been swimming along the US East Coast.",0.1508756438876881,0.282139037844024,0.21650734086585605,0.23838457319191203
N20121,music,musicnews,"Bob Kingsley, Country Radio Legend, Dead at 80 Country radio legend Bob Kingley, the longtime host of the nationally syndicated program Bob Kingsley's Country Top 40, died early Thursday in Weatherford, Texas, following a lengthy battle with bladder cancer. He was 80 years old. A member of the Country Radio Broadcasters Hall of Fame, inducted in 1998, he later became only the format's fifth representative in the National Radio Hall of Fame in 2016. Kingsley was 18 and serving in the Air...",0.1509035884748994,0.2530739602411107,0.20198877435800505,0.21901716965237358
N2203,sports,baseball_mlb,"Off to the World Series, these Nationals have proved everyone wrong This unexpected joyride of a season could hold more promise yet.",0.1513881736405383,0.214231201371071,0.18280968750580465,0.19328352546089345
N28074,lifestyle,lifestylefamilyandrelationships,"Woman Texts Dead Father's Phone for 4 Years & Finally Receives an Emotional Reply The pain of losing a parent, especially at a young age, is one that never really goes away.",0.1518714210926862,0.2526856594734453,0.20227854028306574,0.21908091334652557
N14385,news,newsworld,ISIS names successor to slain leader al-Baghdadi The militant group named Abu Ibrahim Hashimi al-Quraishi as the new leader in a message posted by its official media wing.,0.1526218454395668,0.2623983423434726,0.2075100938915197,0.22580617670883732
N30531,tv,tv-gallery,"16 transgender celebrities who are changing television Shows like ""Euphoria,"" ""Pose,"" ""The Fosters,"" and ""Shameless"" have all introduced trans actors and characters in recent years.",0.1530326888199191,0.2224605007392385,0.1877465947795788,0.19931789676613204
N23887,news,newsus,"Video allegedly shows police officer roughing up 11-year-old girl There's no excuse for the way this girl was treated, the Farmington police chief said.",0.1533148428237944,0.2628367823508898,0.2080758125873421,0.22632946917519134
N38562,sports,baseball_mlb,Nationals still uncertain on Scherzer status after injection HOUSTON (AP)   The Washington Nationals remain unsure about the health of pitcher Max Scherzer and catcher Kurt Suzuki heading into Game 6 of the World Series against Houston. Scherzer was scratched from his Game 5 start Sunday night because of nerve irritation near his neck and had a cortisone shot. Scherzer won the opener and hopes to be able to pitch in a Game 7 if the Nationals get that far. Houston won three in a row at Washington to take a...,0.1534257742647148,0.2263550723215033,0.18989042329310904,0.20204530630257378
N6750,news,newspolitics,"Kamala Harris to slash staff, restructure campaign as she hemorrhages cash Kamala Harris is dramatically restructuring her campaign by redeploying staffers to Iowa and laying off dozens of aides at her Baltimore headquarters, according to campaign sources and a memo obtained by POLITICO Wednesday, as she struggles to resuscitate her beleaguered presidential bid.",0.1536708224179761,0.2432652140852045,0.1984680182515903,0.213400416862795
N61186,music,music-celebrity,Infected toe stops R. Kelly from attending court hearing CHICAGO (AP)   R. Kelly's lawyer has told a federal judge that an infected toe prevented the R&B star from attending a hearing in his child pornography case in Chicago. Kelly is detained at a jail two blocks from the courthouse and had been expected to appear at Wednesday's status hearing. But defense lawyer Steve Greenberg said one of Kelly's toenails had to be removed as treatment and Kelly worried someone might trample on his toe as he was...,0.1537587002832309,0.2549652384456474,0.20436196936443915,0.2212297257248419
N59254,news,newsus,Judge rules deputies can't put 'no trick-or-treat' signs in sex offenders' yards A federal judge has ruled deputies in a Georgia county cannot put warning signs where registered sex offenders live.,0.1537587002832309,0.2871357336156488,0.22044721694943986,0.24267672250484285
