ID,category,sub_category,content,collaborative_rec,content_rec,mean,two_one
N19347,news,newspolitics,"Former US Senator Kay Hagan dead at 66 Former U.S. Sen. Kay Hagan, a one-time Capitol Hill intern who went on to become North Carolina's first Democratic female senator, died Monday at her Greensboro home. She was 66.",0.2632168731269042,0.3029193663502104,0.2830681197385573,0.2896852019424417
N34694,tv,tvnews,Rosie O'Donnell: Barbara Walters Isn't 'Up to Speaking to People' Right Now Rosie O'Donnell: Barbara Walters Isn't 'Up to Speaking to People' Right Now,0.2642813991067927,0.309151122277395,0.2867162606920939,0.29419454788719424
N31801,news,newspolitics,Joe Biden reportedly denied Communion at a South Carolina church because of his stance on abortion Joe Biden has a complicated history with the Catholic Church.,0.267081069512512,0.2837023758023124,0.2753917226574122,0.27816194037237896
N42782,sports,baseball_mlb,Three takeaways from Yankees' ALCS Game 5 victory over the Astros The Yankees kept hope alive thanks to some impressive starting pitching and a pair of early home runs.,0.2723959980461627,0.278429859820807,0.27541292893348485,0.2764185725625922
N49749,sports,football_nfl,"'Unbelievable.' Chiefs fans stunned, mad after loss to the Titans What the heck happened? The Chiefs were lining up for a field goal that would have given them and eight-point lead late in Sunday's game against the Tennessee Titans in Nashville. The snap came before holder Dustin Colquitt was ready and he threw the ball away. Colquitt was called for intentional grounding and the Titans took over. They drove down the field for a touchdown, two-point ...",0.2724264178965685,0.2975306803295773,0.2849785491130729,0.2891625928519077
N18445,sports,football_ncaa,"Michigan sends breakup tweet to Notre Dame as series goes on hold Parting is such sweet sorrow, say the Wolverines.",0.278424478490122,0.3114610524223954,0.2949427654562587,0.3004488611116376
N63302,lifestyle,lifestylebuzz,"This Wedding Photo of a Canine Best Man Captures Just How Deep a Dog's Love Truly Is When Mark Doublet made his dog, Marley, the best man at his wedding, he took his duties very seriously, and a photo of them together has gone viral.",0.2852617129737382,0.2916548383828724,0.2884582756783053,0.28952379657982763
N55189,tv,tvnews,"'Wheel Of Fortune' Guest Delivers Hilarious, Off The Rails Introduction We'd like to solve the puzzle, Pat: Blair Davis' loveless marriage? On Monday, ""Wheel of Fortune"" welcomed as a new contestant trucking business owner Blair Davis, who offered a biting introduction for himself. When host Pat Sajak asked the man from Cardiff, California, about his family, Davis plunged into one of the darkest personal summaries the show has likely ever heard. ""I've been trapped in a loveless marriage for the last 12 years to an...",0.2906404107332245,0.3079697332332911,0.2993050719832578,0.30219329239993553
N10414,movies,movienews,"Robert Evans, 'Chinatown' Producer and Paramount Chief, Dies at 89 Robert Evans, the Paramount executive who produced ""Chinatown"" and ""Urban Cowboy"" and whose life became as melodramatic and jaw-dropping as any of his films, died on Saturday night. He was 89. Even though Hollywood history is filled with colorful characters, few can match the tale of Evans, whose life would seem far-fetched if it were",0.3003194980116888,0.3183686048650896,0.30934405143838917,0.312352235913956
N53526,health,voices,"I Was An NBA Wife. Here's How It Affected My Mental Health. I felt like I was a fraud, and being an NBA wife didn't help that. In fact, it nearly destroyed me.",0.3088480929667722,0.30762866790762,0.3082383804371961,0.3080351429273374
N18340,sports,basketball_nba,"Raptors end Lakers' 7-game winning streak in 113-104 victory LOS ANGELES (AP)   The centerpiece of the Toronto Raptors' championship team works at Staples Center now. Two more key components of last season's sublime roster got injured right before the Raptors arrived in Los Angeles for the reunion. In the opening weeks of life after Kawhi, the defending champs are learning they might be deeper than even they realized. They definitely had enough to hold off Staples' marquee tenants in a remarkable...",1.0,0.2972726887750411,0.6486363443875205,0.5315151258500274
N55199,news,newsus,Winter homeless shelter remains unopened after protests ,1.0,0.27274675432711,0.636373377163555,0.51516450288474
N25142,entertainment,awards,"Robert Downey Jr. reassures fans he didn't die at 2019 E! PCAs Tony Stark has risen from the dead! The ""Iron Man"" star takes the stage to kick off the E! People's Choice Awards with a bang! Watch.",1.0,0.2983646368180125,0.6491823184090062,0.5322430912120083
N40147,sports,football_nfl,"Well, they'll take it: Shining light on the highs and lows from the Bears' win over the Lions on the Bear Download podcast Welcome to the Bear Download podcast. Listen below or subscribe and listen on iTunes | Spotify | Stitcher | Google Play Bears win! Well, yes, they did end their four-game losing streak with a 20-13 victory over the shorthanded Lions. But Rich and Dan break it all down and let some air out of the balloon -- not that much was in there to start. On the bright side, quarterback Mitch Trubisky ...",1.0,0.3166371735487406,0.6583185867743703,0.544424782365827
N41222,news,newsworld,"Evo Morales of Bolivia Accepts Asylum in Mexico Evo Morales, the former president of Bolivia who resigned under pressure from street protests and the military, was granted asylum in Mexico on Monday, departing from the country at a time when it is deeply polarized and leaderless.",1.0,0.2691024051658224,0.6345512025829112,0.5127349367772149
N6940,finance,finance-career-education,"Kaiser Permanente CEO And Affordable Health Care Advocate Bernard J. Tyson Dies Health care provider Kaiser Permanente said Sunday its chairman and CEO, Bernard J. Tyson, has died unexpectedly at the age of 60.",1.0,0.3191906179105856,0.6595953089552928,0.5461270786070571
N55528,lifestyle,lifestyleroyals,"The Brands Queen Elizabeth, Prince Charles, and Prince Philip Swear By Shop the notebooks, jackets, and more that the royals can't live without.",1.0,0.2862562110446024,0.6431281055223013,0.5241708073630682
N61572,sports,football_nfl,"Believe in 'Minkah Magic' as Fitzpatrick sparks Steelers' turnaround Discarded by the Dolphins after a little more than a season, Minkah Fitzpatrick is making a considerable difference for a surging Steelers team.",1.0,0.292000730938761,0.6460003654693804,0.5280004872925073
N218,video,news,Bolivia protesters celebrate Morales' resignation Bolivian opposition protesters celebrated joyously in the streets of La Paz on Sunday evening after Bolivian President Evo Morales said he would resign following weeks of protests over a disputed election that has roiled the South American nation.,1.0,0.2715201580827687,0.6357600790413843,0.5143467720551791
N9739,sports,football_nfl_videos,Vikings edge Cowboys on 'SNF' Watch the Minnesota Vikings vs. Dallas Cowboys highlights from Week 10 of the 2019 season.,1.0,0.3230589013772396,0.6615294506886198,0.548705934251493
N39983,news,newscrime,"NYPD Defends Officers In Arrest Of Illegal Food Vendor Despite criticism from some city officials, the NYPD says its officers acted properly in arresting a woman who was illegally selling churros inside a Brooklyn subway station. CBS2's Lisa Rozner reports",1.0,0.2235391816359789,0.6117695908179894,0.4823594544239859
N43567,news,newspolitics,"High-stakes televised impeachment hearings set for next week William Taylor, the top diplomat in Ukraine, will testify, and Republicans hope to hear from Hunter Biden and the anonymous whistleblower.",1.0,0.2768547137178261,0.638427356858913,0.5179031424785507
N413,news,newsscienceandtechnology,"Google Maps lets you manage your public profile from the Android app Google Maps increasingly thrives on user contributions to fill in details, but you haven't had the option to manage your public profile from the phone app you're probably using to make those contributions. That's a bit backwards, but Google is thankfully setting things right. An updated version of the Android app lets you manage your profile from a new ""your profile"" item in the side menu.",1.0,0.3332937108549473,0.6666468554274736,0.5555291405699648
N208,sports,football_nfl,Five winners and five losers as the Dallas Cowboys drop a heartbreaker to the Minnesota Vikings A tough loss to swallow for the Cowboys.,1.0,0.2837482430661695,0.6418741215330848,0.5224988287107797
N27974,weather,weathertopstories,"Colder Temperatures And A Wintery Mix Expected Monday First on Fox, we begin tonight on the winter watch today`s fall feel giving way to winter in a hurry, and that means getting prepared for the quick change in seasons, and that means some snow. Fox 2/News 11`s Blair Ledet begins our coverage.",1.0,0.2950118545379241,0.6475059272689621,0.5300079030252827
N6379,news,newscrime,"California cops respond to 2 homeless men shot with arrows: report Two homeless men living at an encampment near San Francisco were shot with arrows early Sunday in an attack that was not random, a report said.",1.0,0.2506210317162861,0.625310515858143,0.5004140211441908
N5,sports,icehockey_nhl,"Even David Pastrnak's slumps are superstar caliber for Bruins Guess David Pastrnak isn't going to score 82 goals and accumulate 164 points this season. Or at least he's not on pace to do anymore. After scoring 15 goals and adding 15 assists through the Bruins' first 15 games, Pastrnak had gone two games without a point after he was blanked in Boston's 3-2 shootout loss to Philadelphia at TD Garden on Sunday. Oh the humanity! But here's where things stand in the 23-year-old sniper's career. Gone are the...",1.0,0.3313689731012877,0.6656844865506438,0.5542459820675252
N20831,sports,soccer_mls,"New buzz on possibility of Major League Soccer in Charlotte Charlotte appears to be in the driver's seat for Major League Soccer's 30th franchise. MLS Commissioner Don Garber mentioned Charlotte as one of three cities in the running at Friday's State of the League press conference. ""It is very likely that we'll announce [the] team 30 in the next number of months,"" Garber said. Garber acknowledged Charlotte, Phoenix and Las Vegas as cities in the mix for expansion. ""It's fair to say that Charlotte has...",1.0,0.2883302416919678,0.6441651208459839,0.5255534944613118
N5497,news,newsus,"Still teaching at 95, Jimmy Carter draws devotees to church PLAINS, Ga. (AP)   The pilgrims arrive early and from all over, gathering hours before daybreak in an old pecan grove that surrounds a country church. They come, they say, for a dose of simple decency and devotion wrapped up in a Bible lesson. The teacher is the 39th president of the United States, Jimmy Carter. Nearly four decades after he left office and despite a body that's failing after 95 years, the nation's oldest-ever ex-president still...",1.0,0.290993153227355,0.6454965766136775,0.5273287688182366
N13019,video,lifestyle,"Still teaching at 95, Jimmy Carter draws devotees to church Former President Jimmy Carter can still draw a crowd, and he does each time he teaches Sunday school in his hometown of Plains, Georgia. (Nov. 11)",1.0,0.2906691786667641,0.6453345893333821,0.5271127857778427
N31581,news,newsus,"Man killed in single-car crash after having medical emergency behind the wheel A 52-year-old man was killed after he had a medical emergency behind the wheel. The Missouri State Highway Patrol said Jeffery T. Gregory was driving on Missouri Highway 79 near the intersection of East Terra Lane Sunday afternoon at around 12:45 when he had a medical emergency. The crash report said the car drove off the left side of the road, ended up on East Terra Lane and flipped before slamming into a concrete median. He was pronounced dead...",1.0,0.2846770789069052,0.6423385394534527,0.5231180526046034
N10311,news,newsworld,"Turkish army takes CNN inside Syria's safe zone A month after Turkey launched its operation into northern Syria, major combat operations around the town of Tal Abyad may have ended, but the battle for this part of Syria is far from over. CNN's Jomana Karadsheh reports.",1.0,0.2985884199839158,0.6492942099919579,0.5323922799892772
N5027,news,newsscienceandtechnology,NEW DETAILS: Wright Brothers airport eyes growth as upgrades continue Dayton-Wright Brothers Airport is in the midst of what is expected be more than $4 million in investments as it broadens its regional reach.,1.0,0.2184487648024208,0.6092243824012104,0.47896584320161384
N64760,news,newsoffbeat,"Supermarket magnate John Catsimatidis offers $1,000 reward in case of possible Queens cat poisonings It might take Cats to catch a heartless feline killer. Supermarket mogul and one-time mayoral hopeful John Catsimatidis is offering a $1,000 reward for information on a suspected cat killer who animal rights activists believe is poisoning feral felines in Queens. Catsimatidis announced the reward on his Cats Roundtable radio show Sunday morning during a segment with Guardian Angels ...",1.0,0.2728655043741292,0.6364327521870646,0.5152436695827528
N43432,news,newsus,"US Forest Service shuts down vandalized Georgia park feature GAINESVILLE, Ga. (AP)   The U.S. Forest Service says vandalism is forcing it to shut down a popular fall leaf viewing destination in Georgia. The agency posted photos to Facebook on Friday showing a wooden platform covered in white spray paint overlooking the mountainous north Georgia landscape at Chattahoochee-Oconee National Forests.",1.0,0.2900601704991674,0.6450300852495837,0.5267067803327783
N17258,news,newsscienceandtechnology,Realme takes chunk of India mobile market as Samsung slides Over 400 percent more phones shipped year-on-year,1.0,0.300988261379466,0.6504941306897329,0.5339921742529773
N23858,sports,golf,"Young Northeast Florida fans flock to U.S. women's soccer When the U.S. women's national soccer team arrived in Jacksonville for a final exhibition match to conclude their 2019 Victory Tour at TIAA Bank Field against Costa Rica Sunday night, area fans were waiting for them. Although the suspense was low, since the U.S. women's national team has put up an impressive 14-0-0 all-time record against Costa Rica, soccer fans from far and wide showed out to ...",1.0,0.2474820252069627,0.6237410126034814,0.49832135013797507
N16909,weather,weathertopstories,"Adapting, Learning And Soul Searching: Reflecting On Woolsey Fire Woolsey Fire Anniversary: A community is forever changed by the largest blaze in county history, a harbinger of the catastrophic fire era.",1.0,0.3101486126131347,0.6550743063065674,0.5400990750754231
N47585,lifestyle,lifestylefamily,Family says 13-year-old Broadway star died from massive asthma attack ,1.0,0.2697677531844049,0.6348838765922025,0.5131785021229366
N7482,sports,more_sports,"St. Dominic soccer player tries to kick cancer to the curb Sometimes, what happens on the sidelines can be even more important than what happens on the field. That was the case recently for the improving St. Dominic boys soccer team. ""We're led by some great seniors and they're learning a lot,"" said head soccer coach Greg Koeller. Since 2000, the Crusaders have won five state titles. And if that wasn't enough motivation, they have players who provide inspiration. Like No. 2, Clay North. ""Clay is just an...",1.0,0.3202368874630048,0.6601184437315024,0.5468245916420031
N3411,sports,basketball_ncaa,"Aldermen, Parents And Players Hope SLPS Will Reconsider Roosevelt Coach Termination New tonight, the Roosevelt High School football coach was fired for contacting players through social media. But theres a push to have him re-instated. Fox 2/News 11s Jeff Bernthal was live with why several St. Louis aldermen want the district to re-consider the coachs termination.",1.0,0.3052374144736063,0.6526187072368032,0.5368249429824041
N5171,news,elections-2020-us,Still a chance? 2020 longshots insist race is up for grabs Bernie Sanders rallied hundreds of supporters outside the New Hampshire capital when the senator formally filed to compete in the state's first-in-the-nation presidential primary.,1.0,0.3085929429589346,0.6542964714794672,0.539061961972623
N241,finance,finance-companies,"Are Stores Open on Veterans Day? Target, Aldi, Walmart and More Will shoppers be able to make the most of Veterans Day deals this public holiday?",1.0,0.2991621573894474,0.6495810786947237,0.5327747715929649
N20332,news,newsworld,"Langfords, 100 members of Mormon families leave Mexico after ambush David Langford and his hero son, Devin, who helped save his siblings, are leaving Northwest Mexico, where Mormons lived for decades before drug cartels encroached.",1.0,0.2654749545407069,0.6327374772703535,0.5103166363604712
N19639,health,weightloss,50 Worst Habits For Belly Fat These seemingly harmless habits are holding you back and keeping you from shedding that unwanted belly fat for good.,1.0,0.313241396234962,0.656620698117481,0.542160930823308
N61837,news,newsworld,"The Cost of Trump's Aid Freeze in the Trenches of Ukraine's War Lt. Ivan Molchanets peeked over a parapet of sand bags at the front line of the war in Ukraine. Next to him was an empty helmet propped up to trick snipers, already perforated with multiple holes.",1.0,0.2539730402487844,0.6269865201243923,0.5026486934991896
N38324,health,medical,"How to Get Rid of Skin Tags, According to a Dermatologist They seem harmless, but there's a very good reason you shouldn't ignore them. The post How to Get Rid of Skin Tags, According to a Dermatologist appeared first on Reader's Digest.",1.0,0.3501776809332286,0.6750888404666143,0.5667851206221524
N2073,sports,football_nfl,Should NFL be able to fine players for criticizing officiating? Several fines came down against NFL players for criticizing officiating this week. It's a very bad look for the league.,1.0,0.2836142459254791,0.6418071229627396,0.5224094972836527
N49186,weather,weathertopstories,"It's been Orlando's hottest October ever so far, but cooler temperatures on the way There won't be a chill down to your bones this Halloween in Orlando, unless you count the sweat dripping from your armpits.",1.0,0.2745998922572241,0.6372999461286121,0.5163999281714827
N59295,news,newsworld,"Chile: Three die in supermarket fire amid protests Three people have died in a supermarket fire as angry protests in Chile entered their seventh day, the mayor of capital city Santiago said on Sunday.",1.0,0.2480221797169062,0.6240110898584531,0.4986814531446041
N15962,sports,football_nfl,"Ravens Coach Harbaugh: Michael Pierce's X-Rays Negative After Ankle Injury, No Timetable On Return Coach John Harbaugh said the x-rays on his ankle came back negative, but there is no clear timetable on his return.",1.0,0.3096507988605154,0.6548253994302577,0.5397671992403436
N28814,sports,basketball_ncaa,"Christyn Williams delivers all-around performance to fuel stilted UConn offense On a day when UConn's offense often felt stilted and stagnant, the Huskies turned to one player more than any other for scoring, playmaking and a general positive presence. Sophomore Christyn Williams was efficient Sunday, converting 10 of 17 field-goal attempts. She was consistent, with at least one field goal in all four quarters and at least two rebounds in three of the four. And she was ...",1.0,0.3059258297359113,0.6529629148679557,0.5372838864906075
N47850,news,newsus,"Texas teacher free on bond after assaulting a student A Texas teacher is free on bond tonight, after her arrest for assaulting a student. Her violent outburst was captured on cell phone video. Meg Oliver reports.",1.0,0.2477010487224282,0.6238505243612141,0.4984673658149521
N52046,sports,racing,NASCAR championship standings 2019: Final 4 drivers set for Cup Series title race at Homestead Three Joe Gibbs Racing drivers will be competing with a Stewart-Haas Racing driver for a championship on Nov. 17.,1.0,0.3002903005342164,0.6501451502671082,0.5335268670228109
N4219,sports,icehockey_nhl,"In USA vs. Canada hockey, the winners are women At the end, what didn't matter was the score. What mattered most was the game. Playing ice hockey hard and fast. Some of the highest level hockey in the world, played by women. Even the players in Sunday's second sold-out exhibition game between the national women's teams of the United States and Canada   the best female players in the world and the biggest rivals   had stressed a higher purpose to this past week's joint training camp that put...",1.0,0.2882389116010829,0.6441194558005414,0.5254926077340553
N31089,news,newsus,Thief steals thousands from couple during wedding reception Emma and Chris Cox's picture-perfect wedding day was tarnished when a thief swiped a gift bag filled with thousands in cash. The brazen heist was caught on surveillance cameras.,1.0,0.2226302928177932,0.6113151464088966,0.4817535285451955
N41479,sports,basketball_nba,"Scouting report: Rockets vs. Pelicans When/where: 7 p.m. Monday/Smoothie King Center TV/radio: AT&T SportsNet/790-AM; Spanish: 850 AM/101.7 FM So far: Rockets 6-3, Pelicans 2-7 Lately: The Rockets have a three-game winning streak, their longest of the season, after beating the Bulls in Chicago on Saturday. The Pelicans picked up their second win of the season Saturday in Charlotte. Scouting the Rockets In the past six games against the Pelicans, the Rockets have outscored New...",1.0,0.3169824062892841,0.658491203144642,0.5446549375261893
N54299,sports,baseball_mlb,"Column: Baseball's hot stove league could use an NBA-style spark after the slow pace of the last few offseasons When discussing teams' interest in free agent Bryce Harper last year at the general managers meetings, agent Scott Boras cautioned that many suitors would be playing it cool over the winter. ""It's not a regatta,"" Boras said. ""It's a submarine race."" The submarine race finally ended more than three months later, during spring training, with Harper signing a record 13-year, $330 million deal ...",1.0,0.2839801105256532,0.6419900552628266,0.5226534070171021
N24301,sports,football_nfl,"10 biggest disappointments of NFL Week 10 From quarterback play to special teams disasters, there was plenty of disappointment to go around in Week 10 of the NFL.",1.0,0.3101565782361989,0.6550782891180995,0.5401043854907992
N15236,finance,finance-real-estate,"Only 1 World City Charges More Than NYC Per Foot Of Apt Space The amount New Yorkers pay per square foot of real estate is much higher than almost anywhere else in the world, a recent report shows.",1.0,0.2755561054746728,0.6377780527373365,0.5170374036497818
N3354,sports,more_sports,NCDPS: Juveniles who escaped from N.C. development center may be in Hickory area ,1.0,0.2676816346155029,0.6338408173077514,0.5117877564103352
N35584,travel,travelnews,"Veterans gather, share stories at Brick Store Museum exhibit ahead of American Legion Centennial The Brick Store Museum in Kennebunk held an open house for veterans Sunday in celebration of the American Legion's centennial anniversary. At the museum, a new exhibit looks back at 100 years of history between the town of Kennebunk and the Webber-Lefebvre American Legion Post 74. The exhibit displays various artifacts, historical documents, military uniforms and photos on loan from the post. Sign up for our Newsletters The American Legion is...",1.0,0.291219346950292,0.645609673475146,0.527479564633528
N21106,sports,football_nfl,"Patriots: CB Stephon Gilmore's dominance has had much to do with New England being 8-1 The Patriots headed into their bye week after their first loss of 2019. At 8-1, however, there's been much more good than bad this season, so far. When the team returns for Week 11, they'll still be in the driver's seat for the AFC's No. 1 seed. The schedule won't be easy -- Philadelphia, Dallas, Houston and Kansas City -- but we'll see if the Patriots can regain their form from the first ...",1.0,0.3131013033369482,0.656550651668474,0.5420675355579654
N8371,sports,football_nfl,"Rams' fake punt goes horribly wrong, Steelers get pick Nothing seems to be working for the Rams against the Steelers, and this fake punt attempt was no exception.",1.0,0.3119490635787987,0.6559745317893994,0.5412993757191991
N56061,sports,football_nfl,9 things we learned from Sunday's games of Week 10 of NFL season ,1.0,0.2985017695119341,0.649250884755967,0.532334513007956
N14622,news,newscrime,"Family asks for help in solving May cold case Friends and family of a murder victim is asking the community for answers. Corey Johnson, 27, was gunned down on 18th and West Main Streets on May 21. His sister, Monique Johnson, says she has not heard anything from police as far as leads or suspects. Johnson is asking that if someone knows information regarding her brother's murder to come forward. ""I'm just pleading for the public, anyone who knows anything please speak,"" she said. Johnson's...",1.0,0.2809794417012243,0.6404897208506122,0.5206529611341495
N13341,news,newsus,"Rising temperatures put U.S. troops at risk during training, report finds By midcentury, troops could face an extra month of heat-index temperatures above 100 F every year, the Union of Concerned Scientists found.",1.0,0.2701767667785165,0.6350883833892582,0.5134511778523443
N50451,news,newsus,"Police: Man killed in crash, fire in Pleasant Ridge A man is dead after a car crash turned into a fire in Pleasant Ridge late Sunday night. The crash happened around 10:30 p.m. on Ridge and Montgomery Road. Sign up for our Newsletters Police said emergency crews at the scene found the driver trapped in the car. Officials said the driver crashed into a utility pole causing the car to burst into flames. The driver later died from his injuries. Investigators said they believe the driver was speeding...",1.0,0.2816253316899969,0.6408126658449984,0.5210835544599979
