ID,category,sub_category,content,collaborative_rec,content_rec,mean,two_one
N22976,news,newsus,"The Sante Fe High School massacre suspect isn't fit to stand trial and will get psychiatric treatment, attorney says Dimitrios Pagourtzis is accused of killing eight students and two teachers at his Texas high school last year.",0.1606651391642913,0.2454371037857362,0.20305112147501375,0.21717978224525455
N10438,lifestyle,lifestylebuzz,"Pope Lick Legend: Loved ones of those who died on trestle push for change Legends of a monster living under a dangerous train trestle have lured people to a quiet Louisville creek for decades. Some swear they have seen proof of a human-goat hybrid terrorizing the area. Others leave with no sightings and no story to tell. Those are the lucky ones. The story of a ""Pope Lick Monster"" or ""Goatman"" haunting the trestle at Pope Lick Creek has been commonplace in Louisville even becoming the focus of a movie in the late...",0.1606651391642913,0.2549271352630131,0.2077961372136522,0.2235064698967725
N15710,news,newscrime,Arrest made in connection to stabbing in South Louisville ,0.1606651391642913,0.2288360094833939,0.19475057432384257,0.20611238604369303
N24611,news,newscrime,"Former Jewish Hospital nurse to be arraigned on sexual abuse of patient charge According to court documents, Dorsey told the woman ""repeatedly"" that, ""I would like to video you.""",0.1606651391642913,0.260996713669562,0.21083092641692663,0.22755285550113843
N54889,lifestyle,lifestyle-news-feature,"Chris, the famously woolly sheep, has died Chris made headlines in 2015 after he became the unofficial world record holder for having grown the heaviest fleece.",0.1606651391642913,0.2434739363475726,0.20206953775593195,0.2158710039531455
N51163,lifestyle,lifestylebuzz,"He grew a 910-pound pumpkin and then used it as a boat Instead of making a giant jack o'lantern or a massive pie that could feed the whole town, a farmer in Tennessee took his 910-pound pumpkin out for a spin in his pond.",0.1606651391642913,0.2509175991754174,0.20579136916985435,0.22083344583837536
N31402,foodanddrink,restaurantsandnews,"The Best Seafood Restaurant in All 50 States Think there are too many seafood places in Maine to choose among, but none in landlocked Nebraska? This list will point your cravings and more in the right direction. Whether it's shrimp, crab, fish, or sushi that you love, even the most landlocked states have top-notch options for seafood. Find out what's near you.",0.1606651391642913,0.2977122540385907,0.22918869660144098,0.25202988241382424
N43353,news,newscrime,"Wedding shooter may have been avenging late stepfather's murder, authorities say Brandon Castiglione, the groom's son, was previously charged with second-degree murder in the death of the suspect's stepfather.",0.1606651391642913,0.2391395004736906,0.19990231981899093,0.21298138003722417
N31739,news,newscrime,"'Habitual stowaway' arrested again at O'Hare, Chicago police say A woman arrested at O'Hare International Airport on Friday night was identified by Chicago police as ""known habitual stowaway"" Marilyn Hartman.",0.1606651391642913,0.2670470981082242,0.21385611863625775,0.23158644512691323
N8429,weather,weathertopstories,"Group clears plastic drums, tires from Falls of the Ohio State Park LOUISVILLE, Ky. (WHAS11)   The Falls of the Ohio is a little cleaner after volunteers helped return it to its glory. The volunteers picked up trash and debris along with old tires and leftover plastic barrels. It was part of Moran Environmental Recovery's effort to clean up parts of the state park. The group says over the years, the site has experienced waste dumping leaving the grounds full of empty drums, tires and glass. The state park is the...",0.1606651391642913,0.2715112126345756,0.21608817589943347,0.23456252147781417
N61101,news,newscrime,"Resident recalls moments leading up to fatal shooting in Russell neighborhood In the Russell neighborhood, crime tape has become a well known sight that's why Lisa Tutt encourages her son and his friends to hang out at her house. READ THE FULL STORY:Resident recalls moments leading up to fatal shooting in Russell neighborhood Sign up for our Newsletters CHECK OUT WLKY:Live. Local. Late-Breaking. Get the top Louisville news, weather and sports from the team at WLKY   online, anytime.",0.1606651391642913,0.215853032500657,0.18825908583247414,0.19745706805520177
N6087,news,newsworld,"U.S. bans all flights to Cuba outside Havana in latest crackdown American Airlines and JetBlue, which fly routes to Cuba other than Havana, will have to submit to new regulations from the Transportation Department.",0.1606651391642913,0.2864390947538114,0.22355211695905136,0.24451444289063803
N1569,news,newsus,"Officer who shot naked man found not guilty of murder DECATUR, Ga. (AP)   A former Georgia police officer who fatally shot an unarmed, naked man was found not guilty of murder Monday but was convicted of aggravated assault and other charges that could send him to prison for more than 30 years. Robert ""Chip"" Olsen's face turned red and he squeezed his eyes shut tightly as the verdict was read. His wife, Kathy Olsen, began sobbing and had to be led from the courtroom. DeKalb County Superior Court...",0.1606651391642913,0.2528003582441563,0.2067327487042238,0.22208861855086798
N17686,news,newscrime,"Suspect in Henry County murder, kidnapping arraigned ",0.1606651391642913,0.2576182960566031,0.2091417176104472,0.22530057709249915
N48031,sports,basketball_nba,Ex-Maverick to pay for funeral of woman fatally shot in home by police ,0.1606651391642913,0.2328689289949583,0.19676703407962481,0.20880099905140265
N6244,news,newscrime,Suspect Alfredo Vazquez pleads guilty in Clark County judges' shooting case ,0.1606651391642913,0.2590367220313818,0.20985093059783655,0.2262461944090183
N19709,news,newscrime,Teen given 8 years in prison for gang-related hate crime of student caught on tape A California teenager has been sentenced to eight years in prison for a gang-affiliated hate crime assault on another student.,0.1606651391642913,0.2596763532207392,0.21017074619251525,0.22667261520192322
N45099,news,newscrime,Suspect in crossbow murder of his father arraigned ,0.1606651391642913,0.241839492439744,0.20125231580201763,0.21478137468125977
N6072,news,newsus,"Search resumes for worker missing in New Orleans Hard Rock Hotel building site collapse that killed 2 Rescuers resumed searching Sunday for a worker trapped in rubble after a deadly construction collapse in New Orleans, officials said, but the building's instability is making for a precarious situation.",0.1606651391642913,0.2587384920429603,0.20970181560362577,0.2260473744167373
N58224,news,newscrime,"13-year-old charged with two murders escapes custody in North Carolina Officials said they have concerns for public safety due to the teen's ""prior history of assaultive and unpredictable behavior.""",0.1606651391642913,0.2361940734854799,0.1984296063248856,0.2110177620450837
N48390,travel,travelnews,First round of auctions begin for Joe Ley Antiques ,0.1606651391642913,0.2416872483164537,0.2011761937403725,0.21467987859906623
N19041,news,newscrime,Kroger shooting: Suspect coming out of store fires at officers before they shoot him dead ,0.1606651391642913,0.2379337140456496,0.19929942660497046,0.2121775224185302
N2663,news,newsworld,16 sentenced to death for burning alive Bangladesh teen Sixteen people were sentenced to death Thursday for burning alive a Bangladeshi teenager who refused to withdraw sexual assault charges against her head teacher.,0.1606651391642913,0.2694378011486268,0.21505147015645903,0.2331802471538483
N63317,news,newscrime,"Police: 4 charged with attempted murder month after shooting in SW Louisville Four people are facing attempted murder charges for a shooting last month in southwest Louisville. According to arrest citations, a group arrived at an apartment in the 9600 block of Lamborne Boulevard on Sept. 27 and attempted to lure a male, unknown age, out of his apartment. When the victim agreed to come outside, police said Byron Kirby, 25, shot at the victim four times. The victim then ran into the woods. It's unclear if he was hit....",0.1606651391642913,0.2409202977895962,0.20079271847694374,0.2141685782478279
N34567,news,newscrime,Grandfather charged in death of toddler who fell on cruise ship in Puerto Rico A grandfather who police say dropped his young niece from the 11th floor of a cruise ship docked in Puerto Rico in July has been accused of negligent homicide.,0.1606651391642913,0.2766303199450798,0.21864772955468553,0.23797525968481698
N7023,lifestyle,lifestyle-news-feature,"After being pushed close to extinction, this humpback whale population is making a comeback A key population of humpback whales is in recovery after it was pushed close to extinction by centuries of exploitation, according to a new study.",0.1606651391642913,0.2779507710107457,0.2193079550875185,0.23885556039526093
N29802,finance,finance-companies,"Barneys Is Sold for Scrap, Ending an Era Authentic Brands Group will take control of the Barneys name   one that has been part of the Manhattan landscape since 1923   and license it to other companies like Saks Fifth Avenue. The firm B. Riley Financial is preparing to liquidate Barneys' high-end wares, at its five stores and two Warehouse locations, starting with private sale events for Barneys' ""most loyal"" shoppers next week.",0.1606651391642913,0.2738824964843427,0.21727381782431698,0.23614337737765892
N3142,health,health-news,"Teen wins science competition with liquid bandage invention Kara Fan beat nine other finalists and hundreds of students who submitted ideas in the 3M​ Young Scientist Challenge, winning $25,000.",0.1606651391642913,0.2500232866188534,0.20534421289157234,0.22023723746733273
N41011,news,newsworld,"For the first time, a man has been sentenced for sexual slavery by the International Criminal Court. He got 30 years. Bosco Ntaganda is a former Congolese rebel nicknamed the ""Terminator."" The ICC convicted him on 18 counts including murder, sexual slavery and using child soldiers.",0.1606651391642913,0.2690790811425199,0.21487211015340557,0.23294110048311037
N44462,news,newscrime,"Louisville man who shot at LMPD officer sentenced to 10 more years in prison A Louisville man convicted of shooting at an officer was sentenced Friday. Judge David Hale sentenced Elijah Eubanks, 22, to 119 months in prison for a federal weapons charge. Sign up for our Newsletters In March 2018, Eubanks opened fire on an officer who was attempting to question him while he was in his vehicle with another person. No officers were hit, but Eubanks was shot multiple times when officers returned fire. Eubanks was previously...",0.1606651391642913,0.2560085554616408,0.20833684731296603,0.22422741669585763
N55833,news,newscrime,"Oldham County man charged, injuring victim during shooting practice ",0.1606651391642913,0.2514896074115333,0.2060773732879123,0.22121478466245265
N35656,travel,travelnews,Motorcyclist killed in crash on New Cut Road identified ,0.1606651391642913,0.2610045425823359,0.2108348408733136,0.22755807477632103
N59049,news,newsworld,"Three gunmen killed in Brazil airport raid, kidnapping: police Heavily armed gunmen raided an airport in Brazil on Thursday, officials said, stealing money from an armored truck before fleeing and taking a mother and baby hostage. At least one assailant escaped to a nearby residential neighborhood, taking a mother and her baby hostage in their home, the police spokeswoman said.",0.1606651391642913,0.2617357601702362,0.21120044966726376,0.22804555316825456
N62612,news,newscrime,16-year-old injured in shooting near Churchill Downs ,0.1606651391642913,0.2144923477562466,0.18757874346026893,0.1965499448922615
N3433,finance,finance-companies,A secretive family landing a $4 billion haul has everyone guessing One of the world's richest and most discreet families must decide what to do with a massive pile of cash.,0.1606651391642913,0.2455291068831219,0.20309712302370658,0.2172411176435117
N58936,news,newsus,Beloved grandfather's body pulled from collapsed Hard Rock hotel A family holding vigil outside the site of the Hard Rock hotel construction collapse received the news they hoped they'd never hear.,0.1609253502807521,0.2514799667590948,0.20620265851992345,0.22129509459964722
N25158,lifestyle,lifestyleroyals,Kate Middleton Takes Prince George and Princess Charlotte Halloween Shopping at Local Supermarket Kate Middleton Takes George and Charlotte Halloween Shopping,0.1618581268977297,0.2327841252216891,0.1973211260597094,0.20914212578036928
N28257,news,newspolitics,"Meghan McCain confronts Trump Jr.: 'You and your family have hurt a lot of people' Donald Trump Jr., the president's son, defended his family after ""View"" co-host Meghan McCain suggested they were responsible for the lack of ""character"" in American politics.",0.1621295883592221,0.220940821291083,0.19153520482515254,0.20133707698046271
N34399,foodanddrink,restaurantsandnews,Burger King's new 'Ghost Whopper' is here to haunt your Halloween order The Ghost Whopper will be available at 10 select restaurants beginning Oct. 24. The only thing scarier than Burger King's new Ghost Whopper is the thought of having no Whoppers at all.,0.1629477681312525,0.2693848309501067,0.2161662995406796,0.2339058100104886
N37378,news,newsus,"Wisconsin jury awards $450,000 in Sandy Hook defamation case A jury in Wisconsin has awarded $450,000 to the father of a boy killed in the 2012 Sandy Hook school shooting after he filed a defamation lawsuit against conspiracy theorist writers who claimed the massacre never happened.",0.16334474250507,0.2633293128260997,0.21333702766558488,0.23000112271908982
N35259,finance,finance-retirement,"'I'm 73 and fed up with California and want a gun-friendly, affordable city with good weather   so where should I retire?' Some hidden gems to consider in Georgia, New Mexico and Arkansas.",0.1641103452425703,0.2676409850551859,0.2158756651488781,0.23313077178431402
N29924,autos,autosenthusiasts,"25 Cars No One Wanted to Buy Along with cars so bad they become icons and the models that should have worked but never caught on come a slew of vehicles that'll have you scratching your head. Remind yourself of the disasters that were the Cadillac Catera, Buick Reatta, Volkswagen Phaeton, Lincoln Blackwood, Chrysler Executive Limousine, and more.",0.1641103452425703,0.2687833482271664,0.21644684673486833,0.233892347232301
N37720,health,nutrition,"23 Foods That Help Lower High Blood Pressure Consuming less sodium may be important to help slash blood pressure levels, but eating more of these foods is good for your heart and arteries too. The post 23 Foods That Help Lower High Blood Pressure appeared first on The Healthy.",0.1641103452425703,0.3205895439113057,0.24234994457693798,0.2684298110217272
N64049,news,newsworld,"After Soldiers Surrender El Chapo's Son, a Shocked Mexican City Sighs With Relief In the days following the siege of the city of Culiacán by the Sinaloa cartel, residents were overcome with relief: Relief that the terror is over.",0.1641103452425703,0.2521417110291805,0.20812602813587538,0.22279792243364374
N391,news,newsus,"Illegal drones ground water-dropping helicopters at critical moment in Maria fire battle LOS ANGELES - As flames rapidly spread along a hillside in Santa Paula, firefighters were faced with a perilous dilemma: ground night-flying helicopters working to contain the growing fire or risk an aerial collision with a thrill-seeking drone.",0.1641103452425703,0.2755721517308762,0.21984124848672323,0.23841821623477422
N53436,finance,finance-real-estate,"Inside the Sheikh of Dubai's 800-acre Kentucky horse farm I got a tour of Sheikh Mohammed of Dubai's 800-acre horse farm in Kentucky, where horses live in immaculate barns with skylights and personal fans.",0.1641103452425703,0.2453729400074754,0.20474164262502284,0.21828540841917368
N55312,travel,travelnews,"Why are most aircraft painted predominantly white? Aircraft liveries, or the designs painted on the exterior of aircraft from the nose to the tail, are a way to identify to which airline the plane belongs.",0.1641103452425703,0.3292664209542882,0.24668838309842925,0.2742143957170489
N5887,weather,weathertopstories,"Lucky Texas Storm Chaser Sees Hailstones Whizz Past Him During Tornado Storm chaser Marcus Diaz may think twice about how close he gets to the elements after large hailstones whizzed past his head from behind as he was filming an EF2 tornado in Tahoka, Texas, earlier this year. According to Accuweather, the winds in the tornado reached ""between 113 and 157 mph."" Diaz posted footage of the moment he was filming a ""dusty EF-2 tornado at close range"" as the hailstones almost hit ""the camera from behind,"" to Twitter on October 17. The lucky storm chaser told Storyful the footage was recorded on May 5. No injuries were reported as a result of the storm. However, the cyclone ripped through agricultural areas, ""causing structural damage to farms and wrecking equipment, power lines, and irrigation systems,"" according to media reports. Diaz may be better served in the future by heeding the advice of the National Oceanic and Atmospheric Administration (NOAA). According to NOAA, ""if you are unable to make it to a safe shelter, either get down in your car and cover your head, or abandon your car and seek shelter in a low lying area such as a ditch or ravine."" Credit: Marcus Diaz via Storyful",0.1641103452425703,0.2562804708128776,0.21019540802772393,0.22555709562277515
N11917,travel,travelnews,JetBlue Plane Makes Emergency Landing at JFK Airport The plane landed safely in NYC Sunday night.,0.1641103452425703,0.2622613665041557,0.213185855873363,0.22954435941696055
N15919,news,newsus,"Saddleridge fire calms down, heavy rains on East Coast A new storm system is developing in the southern Plains and will move east over the next few days bringing a threat of flooding to the South with rain and gusty winds.",0.1641103452425703,0.2615955169253714,0.21285293108397085,0.22910045969777104
N41420,news,newsus,Cracks found on 38 of 810 Boeing 737 NG jets inspected globally Cracks found on 38 of 810 Boeing 737 NG jets inspected globally,0.1641103452425703,0.2850392852016591,0.2245748152221147,0.2447296385486295
N49179,movies,movienews,Joe Alwyn on Buzz Around Taylor Swift Romance: 'I'll Just Turn it Off' Joe Alwyn on Buzz Around Taylor Swift Romance: 'I'll Just Turn it Off',0.1641103452425703,0.2446393011396649,0.2043748231911176,0.21779631584063336
N26122,weather,weatherfullscreenmaps,"Explosive new wildfire drives thousands from homes near Los Angeles The Maria fire ignited in Ventura County early Thursday night and raced westward, consuming 4,000 acres in just three hours.",0.1641103452425703,0.2615501705716365,0.2128302579071034,0.22907022879528108
N2153,news,newsworld,"Iran alleges foreign government behind 'treacherous' ship attack Iran said Monday a foreign government was behind what it alleges was a ""treacherous"" attack on a tanker off Saudi Arabia last week, as it released pictures of its damaged hull. But the state-owned NITC denied reports the alleged attack had originated from Saudi soil.",0.1641103452425703,0.283365782345832,0.22373806379420114,0.24361396997807808
N20091,weather,weathertopstories,"Firefighting Plane Battles Maria Fire Near Santa Paula A tanker dropped fire retardant to combat the Maria Fire near Santa Paula in Ventura County, California on Friday, November 1. By Friday, the fire had reached more than 9,000 acres and was at zero percent containment, according to CAL FIRE. The Maria Fire broke out at around 9 pm on Thursday, and ""exploded"" overnight, prompting mandatory evacuations affecting more than 10,000 residents between Santa Paula and Somis, according to reports. Firefighters are battling several blazes across the state, including the 77,000 acre Kincade Fire in Sonoma County and the 1,800 Easy Fire in Ventura County. Incident reports for the California wildfires can be found here. Credit: @shant_nazaryan via Storyful",0.1641103452425703,0.2809430288413307,0.2225266870419505,0.24199880097507723
N33502,finance,markets,"China's trade with US shrinks in October despite optimism BEIJING (AP)   U.S.-Chinese trade contracted again in October, despite optimism about possible progress in talks aimed at ending a tariff war that threatens global economic growth.",0.1642225306002751,0.2559847290834112,0.21010362984184316,0.2253973295890325
N64631,news,newsworld,"She fought for human rights on a tiny island that banned guns. Then she was shot dead. Rachelle Bergeron had been the only prosecutor in Yap, a Micronesian island about 550 miles southwest of Guam.",0.16438771864748,0.2634554630720955,0.21392159085978774,0.23043288159722367
N56537,foodanddrink,restaurantsandnews,"Why Smoked Bologna Is the Secret Star of Oklahoma Barbecue No barbecue plate in the Sooner State is complete without a side of ""Oklahoma tenderloin"".",0.1648676249602259,0.2612567585406993,0.2130621917504626,0.22912704734720815
N41797,autos,autosenthusiasts,"Tent Spent: We Try Luxury Camping in a $100,000 Airstream Call us crazy, but we actually enjoy traditional camping activities such as gathering firewood, pitching a tent, and peeing in the woods.",0.1650465731311939,0.2713433420034766,0.21819495756733526,0.2359110857127157
N45535,news,newsus,DOJ sues Walmart for allegedly discriminating against a Navy reserve officer The Department of Justice says that Walmart did not hire a naval reserve officer due to her mandatory two-week training in the summer of 2016.,0.1652392532439826,0.2675612613214009,0.21640025728269174,0.2334539252955948
N15034,tv,tv-celebrity,Alec Baldwin's 'heart goes out to' imprisoned Felicity Huffman and husband William H. Macy Alec Baldwin thinks incarceration shouldn't be a consequence for those guilty in the admissions scandal and gave a shout-out to Felicity Huffman.,0.1657021206563743,0.2407872183023411,0.2032446694793577,0.21575885242035217
N4486,news,newsus,"Florida air show crash: Pilot killed when plane crashes An airplane crashed Friday afternoon at an air show in Florida, killing the pilot, Martin County Sheriff William Snyder said.",0.1662176856087093,0.2770394317554044,0.22162855868205686,0.24009884970650602
N32893,weather,weathertopstories,"A Northeast storm is intensifying into a bomb cyclone, forecasters say A bomb cyclone is taking shape along the Eastern Seaboard and starting to make itself felt in the Northeast.",0.1663549725395091,0.2605167635668718,0.21343586805319045,0.22912949989108422
N19347,news,newspolitics,"Former US Senator Kay Hagan dead at 66 Former U.S. Sen. Kay Hagan, a one-time Capitol Hill intern who went on to become North Carolina's first Democratic female senator, died Monday at her Greensboro home. She was 66.",0.1666665987142405,0.2571614219213997,0.2119140103178201,0.2269964808523466
N54522,entertainment,celebrity,"Ben Affleck has a new girlfriend after using the Raya dating app, plus more celeb love life news for late October 2019 Meg Ryan and John Mellencamp call it quits, Halsey and Evan Peters get serious, James McAvoy weds, Meghan King Edmonds accuses hubby of cheating and more.",0.1666831869861465,0.2169773086603927,0.1918302478232696,0.20021260143564396
N41244,entertainment,entertainment-celebrity,"Keanu Reeves holds hands with Alexandra Grant as the Internet swoons, plus more news The Internet is even more in love with Keanu Reeves after Alexandra Grant PDA. Plus, more celebrity news for Nov. 5, 2019.",0.16698457358177,0.2440623298291934,0.2055234517054817,0.2183697444133856
N61388,movies,movies-celebrity,"Judge: Brad Pitt, others can be sued over New Orleans homes The Times-Picayune/ The New Orleans Advocate reports Pitt and other foundation directors asked the court to remove them from the lawsuit, saying they weren't personally responsible for the construction.",0.1671920205004423,0.228923153851087,0.19805758717576466,0.2083461094008721
N21317,sports,football_ncaa,New Mexico DE Nahje Flowers dies at 21 ,0.1674737189234295,0.2594871906987301,0.2134804548110798,0.22881603344029655
N30612,finance,personalfinance,"The first thing 14 lottery winners have bought after finding out they were rich Winning the lottery may be a dream come true, but what that actually looks like is different for everyone.",0.1674739842943575,0.2513039031673315,0.2093889437308445,0.22336059687634016
N56630,finance,markets,China asks WTO for $2.4 billion sanctions against U.S. in latest clash China asks WTO for $2.4 billion sanctions against U.S. in latest clash,0.1675535387876408,0.2703588572139008,0.2189561980007708,0.2360904177384808
N9798,news,newsus,"Missing West Point cadet found dead, officials say A U.S. Military Academy cadet who vanished last week has been found dead, officials said Wednesday.",0.1676759777586289,0.2664223719815221,0.2170491748700755,0.2335069072405577
N21087,sports,football_nfl,"Report: Three-time Super Bowl-winning RB LeGarrette Blount works out for Raiders Now 32 years old, Blount has nearly 1,500 carries through nine pro seasons and has 6,306 yards and 56 career TDs.",0.1681670170405823,0.1989696734577305,0.18356834524915638,0.1887021213186811
N24691,news,newsus,"Bill Macy, Bea Arthur's Husband on 'Maude,' Dies at 97 Norman Lear saw him choking on a chicken bone and brought him to Hollywood. The actor also appeared in 'My Favorite Year' and 'The Late Show.'",0.1681815516092799,0.2601246083260754,0.21415307996767766,0.22947692275381024
N59026,news,newsus,"Cincinnati school board candidate accused of 'pretending to be black' in his ads A current CPS board member took to Twitter Sunday to say a candidate for the board ""is a white guy pretending to be black to get votes"" in ads.",0.1682702169224022,0.2371133354540219,0.20269177618821205,0.21416562927681534
