ID,category,sub_category,content,collaborative_rec,content_rec,mean,two_one
N40065,sports,more_sports,"The Day in Sports: Sunday, November 10, 2019 The Day in Sports: Sunday, November 10, 2019",1.0,0.3223766386354416,0.6611883193177208,0.5482510924236277
N17301,sports,football_nfl,Kirk Cousins responds to narrative about not being able to beat winning teams Cousins helped deliver a huge win for the Vikings over the Cowboys Sunday night.,1.0,0.3206402347535951,0.6603201173767975,0.54709348983573
N34418,sports,soccer_epl,"How the Sounders won MLS Cup Mark, Jeremiah and Casey were so excited they did a postgame podcast.",1.0,0.3011922949011969,0.6505961474505985,0.5341281966007979
N56193,sports,football_nfl,Cowboys have questionable red zone calls in loss to Vikings ,1.0,0.2906194240819555,0.6453097120409778,0.5270796160546369
N33435,lifestyle,lifestylefamily,"Four siblings, all veterans, celebrate Veterans Day in DC Those who pay a visit to the solemn World War II Memorial will come across inscriptions, excerpts of speeches from leaders honoring those who laid down their lives for this country.",1.0,0.276826215622259,0.6384131078111295,0.5178841437481727
N10529,sports,football_nfl,Week 10 Game Balls: Few Bright Spots in Colts Dismal Showing against Dolphins ,1.0,0.2908824216039002,0.64544121080195,0.5272549477359334
N39850,lifestyle,lifestylebuzz,"Veterans Day event in Jeffersontown brings out the town and the Ladies for Liberty At a Veterans Day observation service in Jeffersontown Veterans Memorial Park Sunday, several hundred people gathered.",1.0,0.2888844527768209,0.6444422263884104,0.5259229685178806
N44276,autos,autossports,Best Sports Car Deals for October ,1.0,0.3038554428233548,0.6519277214116774,0.5359036285489032
