ID,category,sub_category,content,collaborative_rec,content_rec,mean,two_one
N64395,sports,football_nfl,J.J. Watt has sobering quote after season-ending injury The Houston Texans lost the rock of their team for the season during Sunday's win over the Oakland Raiders. Stud pass rusher and future Hall of Famer J.J.,0.11266661078526,0.1934536321865914,0.15306012148592568,0.16652462505281426
N27164,sports,football_nfl,"Burning questions for Dolphins vs. Steelers on 'Monday Night Football' The Dolphins (0-6) are visiting the Steelers (2-4) to close out NFL Week 8 on Monday Night Football. Fans should brace for an ugly game, because that's been a weekly occurrence whenever the Dolphins take the field.",0.11266661078526,0.2278510514254091,0.17025883110533455,0.18945623787869273
N21851,sports,football_nfl,"Next man up: Chiefs prepare for life without Mahomes, with Moore Two weeks ago, Tyreek Hill served as Matt Moore's top target.",0.11266661078526,0.2323181399615923,0.17249237537342615,0.19243429690281488
N14437,sports,basketball_nba,"Suns' Deandre Ayton suspended 25 games for violating NBA anti-drug policy The league informed the Suns that Ayton, the top pick in the 2018 draft, tested positive for a diuretic. His suspension begins Friday.",0.11266661078526,0.2259137381592976,0.1692901744722788,0.18816469570128508
N62396,sports,football_nfl,Colin Kaepernick is the perfect replacement for Patrick Mahomes This is a good idea if Mahomes misses a lot of time.,0.11266661078526,0.2228640764478596,0.16776534361655981,0.18613158789365974
N53209,sports,baseball_mlb,"​Are the Astros stealing signs to gain an edge in ALCS? Hopefully. If your code is easy to crack, the problem is on you, not the codebreaker.",0.11266661078526,0.2550694189800453,0.18386801488265264,0.20760181624845023
N4745,news,newspolitics,"Testimony: White House lawyer told Vindman not to discuss Ukraine call The senior White House lawyer who placed a record of President Donald Trump's July 25 call with Ukraine's president in a top-secret system also instructed at least one official who heard the call not to tell anyone about it, according to testimony heard by House impeachment investigators this week.",0.11266661078526,0.2639987332767345,0.18833267203099724,0.213554692446243
N49990,sports,football_nfl,Watch: Kevin Harlan's call of streaking cat on 'MNF' is epic This might legitimately be the best thing we've ever heard from Mr. Harlan.,0.11266661078526,0.2067558533551382,0.1597112320701991,0.17539277249851215
N5211,sports,football_nfl,"Jets trade DL Leonard Williams to Giants The USC product is in the final year of his deal, and the Jets wanted to get something for him while they still could. The third-rounder they'll be getting from the Giants will presumably be an early third-rounder.",0.11266661078526,0.2415527218468386,0.1771096663160493,0.1985906848263124
N5019,sports,football_nfl,"Winners, losers from Cowboys' win over Giants on 'Monday Night Football' In a NFC East tilt, the Cowboys overwhelmed the Giants defense late while Big Blue continues to trip over its own feet.",0.11266661078526,0.2265169909000502,0.1695918008426551,0.18856686419512014
N22929,sports,football_nfl,"Burning questions for Cowboys vs Giants on 'Monday Night Football' Capping off the action in Week 9, the New York Giants are hosting the Dallas Cowboys for the NFC Monday Night Football. There are five burning questions for this NFC matchup.",0.11266661078526,0.2452730333303427,0.17896982205780135,0.20107089248198182
N4408,sports,football_nfl,"Patrick Mahomes already back at practice for Chiefs Although Reid didn't rule Mahomes out for the team's Week 8 game, it seems like a long-shot for the quarterback to get back onto the field that quickly.",0.11266661078526,0.2051897988607153,0.15892820482298764,0.17434873616889687
N52865,news,newspolitics,Ohio's Reputation As a Must-Win State May No Longer Be True ,0.11266661078526,0.2097468396825554,0.1612067252339077,0.17738676338345694
N37481,sports,football_nfl,Baker Mayfield blasts officials after Browns loss: Refs were 'pretty bad today' ,0.11266661078526,0.2088520610021874,0.1607593358937237,0.1767902442632116
N32670,news,newspolitics,"McConnell tees up government funding votes amid stalemate Senate Majority Leader Mitch McConnell (R-Ky.) is turning the Senate toward trying to pass a set of long-stalled appropriations bills. ""Congress has fallen badly behind schedule on appropriations. It's been a month since my Democratic colleagues filibustered government funding here on the floor, blocking defense funding and a pay raise for service members. We need to get moving,"" McConnell said from the Senate floor. McConnell said the Senate...",0.11266661078526,0.2613686801794572,0.1870176454823586,0.2118013237147248
N35685,autos,autosreview,"First Drive! 2020 Shelby GT500 Is an Apex Predator, Turning Drivers Into Track Stars Driving the 2020 Shelby GT500 on the street, dragstrip, and road course reveals an apex predator that turns any driver into a track star.",0.11266661078526,0.2652468426436474,0.18895672671445368,0.21438676535751827
N57364,news,newspolitics,"Facebook's Zuckerberg grilled by AOC on fact-checking policy for political ads Facebook CEO Mark Zuckerberg struggled to explain the social media company's new policy on fact-checking political ads under questioning from Rep. Alexandria Ocasio-Cortez during a Tuesday hearing. The company recently announced that to protect political speech it would no longer fact check ads from politicians, essentially allowing campaigns to pay Facebook to spread disinformation. At the hearing of the House Financial Services committee,...",0.11266661078526,0.2537752489234814,0.18322092985437072,0.20673903621074094
N54807,news,newsworld,"Russia questions language of ""unusual"" Trump letter to Erdogan Russia questions language of ""unusual"" Trump letter to Erdogan",0.11266661078526,0.2655633365019486,0.1891149736436043,0.21459776126305238
N34380,news,newspolitics,"House rejects GOP measure censuring Schiff Democrats in the House turned aside a GOP-led privileged resolution to censure House Intelligence Committee Chairman Adam Schiff (D-Calif.) on Monday in a 218-185 vote.Republicans and President Trump have increasingly targeted Schiff, a public face of the impeachment effort.They have taken issue with Schiff's exaggerated account of the details of President Trump's July 25 phone call with Ukrainian President Volodymyr Zelensky during a...",0.11266661078526,0.251495443002412,0.18208102689383598,0.20521916559669467
N32027,sports,football_nfl,Payton declines to name Saints starting QB for Week 8 ,0.11266661078526,0.2002728723622874,0.1564697415737737,0.17107078516994495
N45824,sports,football_nfl_videos,"Ian Rapoport: MRI results are good news for Patrick Mahomes, Kansas City Chiefs NFL Network Insider Ian Rapoport and James Palmer provide a Patrick Mahomes injury update.",0.11266661078526,0.2085547635770077,0.16061068718113386,0.17659204597975847
N15087,sports,football_nfl,"Trent Williams to Cleveland rumor emerges Dysfunctional teams do dysfunctional things. But sometimes they do something that makes sense, against their nature. Washington may soon be throwing in the towel on the Trent Williams holdout, trading the disgruntled left tackle in advance of the deadline that arrives in only two weeks. Steve Doerschuk of the Canton Repository shares the news with [more]",0.11266661078526,0.2086720151776809,0.16066931298147044,0.1766702137135406
N26606,autos,autosenthusiasts,2020 Shelby GT500 Aero Performance & Cooling Supercomputers and 3-D Printing are secrets to the all-new Mustang Shelby GT500's high performance.,0.11266661078526,0.2663806143821589,0.18952361258370942,0.21514261318319258
N52196,news,newspolitics,"Graham claims victory with impeachment vote Sen. Lindsey Graham, who introduced a resolution condemning secretive impeachment proceedings in the House, claimed victory Monday after House Speaker Nancy Pelosi announced she'll hold a formal vote and open up the hearings to the public.",0.11266661078526,0.2511111122055813,0.18188886149542066,0.20496294506547422
N63306,sports,football_nfl,Jenkins' scorching response to Scandrick ripping Eagles Former Philadelphia Eagles cornerback Orlando Scandrick ripped into Malcolm Jenkins and his former teammates in general.,0.11266661078526,0.224418395154666,0.16854250296996298,0.187167800364864
N64456,news,newsus,"LA's Getty fire was sparked by downed power lines, Mayor Garcetti says LOS ANGELES - The Getty fire was sparked by a tree branch that fell on power lines, Los Angeles Mayor Eric Garcetti announced at a news conference Tuesday evening. Video footage shows the branch breaking off a eucalyptus tree and sparking the fire in the 1900 block of North Sepulveda Boulevard, Garcetti said. The power lines being examined are operated by the Los Angeles Department of Water ...",0.11266661078526,0.2514989887621129,0.18208279977368647,0.20522152943649527
N14137,sports,football_nfl,MetLife Stadium searching for the famous black cat from 'Monday Night Football' ,0.11266661078526,0.2219009966235642,0.1672838037044121,0.1854895346774628
N36068,sports,football_nfl,"AP source: Trent Williams ends holdout, reports to Redskins A person with knowledge of the situation says left tackle Trent Williams has reported to the Washington Redskins, ending his lengthy holdout. The person spoke to The Associated Press on condition of anonymity because the team had not announced Williams' return. He can be kept off the 53-man roster for up to three weeks after reporting. Washington did not deal the 31-year-old before the NFL trade deadline Tuesday, which prompted...",0.11266661078526,0.212764907505635,0.1627157591454475,0.17939880859884336
N21428,autos,autosnews,Ford's Mach E Electric SUV Spied Looking...Interesting We're not sure how we feel about this new EV's Mustang-inspired styling cues.,0.11266661078526,0.2640531470436943,0.18835987891447714,0.2135909682908829
N37835,sports,football_nfl,Giants will not go back to Eli Manning after Daniel Jones' struggles Jones has thrown eight interceptions and has lost two fumbles in his past four starts.,0.11266661078526,0.2347686001290245,0.17371760545714227,0.19406793701443634
N62055,news,newspolitics,"Trump campaign threatens to sue CNN, citing Project Veritas videos An attorney representing President Trump's reelection campaign sent a letter to CNN on Friday threatening to sue.",0.11266661078526,0.2594214874049538,0.1860440490951069,0.2105031951983892
N62283,news,newsworld,British PM denied new Brexit deal vote Prime Minister Boris Johnson prepared to Monday make a second attempt to ram his EU divorce deal through parliament and avoid the political damage of delaying Brexit next week. But EU officials were still making preparations for Britain to leave in 10 days' time.,0.11266661078526,0.2812414092008162,0.19695400999303808,0.22504980972896413
N17463,news,newspolitics,"Democrats unveil procedures for Trump's impeachment inquiry, rebutting GOP attacks The resolution hands the lead role to the House Intelligence Committee and its chairman, Rep. Adam B. Schiff, who would have broad latitude to organize extended questioning of potential public witnesses.",0.11266661078526,0.2485433884938058,0.18060499963953291,0.20325112925762387
N10270,autos,autossports,"What Do Old-School Mustang Guys Think of the Kia Stinger? We wondered, so we put the Original Venice Crew in our long-term Stinger GT.",0.11266661078526,0.2527143379014208,0.1826904743433404,0.20603176219603386
N52227,sports,basketball_nba,"Joel Embiid, Karl-Anthony Towns likely facing multi-game bans for roles in brawl Both teams don't play again until Saturday, so the league will have plenty of time to assess whether any players left the bench area, which could lead to additional suspensions.",0.11266661078526,0.1958436441908065,0.15425512748803324,0.16811796638895768
N1406,sports,football_nfl,"NFL Films signed off on airing of Sam Darnold's 'ghosts' comment A firestorm has erupted in New York over how an unflattering comment from a mic'd up Sam Darnold made the air during ESPN's coverage of the Jets' blowout loss to the Patriots on ""Monday Night Football.""",0.11266661078526,0.2034756994277983,0.15807115510652914,0.17320600321361887
N14588,sports,football_ncaa,"Jake Fromm proves Georgia is more than just its running game vs. Florida Georgia beat Florida 24-17 in a huge SEC showdown, and the Bulldogs did that with a clutch performance from Jake Fromm.",0.1186418720442684,0.231083800220935,0.1748628361326017,0.19360315749537946
N63642,news,newsus,U.S. Coast Guard responds to oil discharge in Louisiana protected wetlands U.S. Coast Guard responds to oil discharge in Louisiana protected wetlands,0.1186418720442684,0.2898803343176095,0.20426110318093896,0.23280084689316247
N62545,finance,finance-companies,"The CEO taking on the gun lobby Ed Stack didn't set out to be an activist. The chief executive of Dick's Sporting Goods, Mr. Stack spent his career selling fishing rods, camping gear and athletic equipment at big-box stores around the country. Dick's was founded by Mr. Stack's father in upstate New York. As a young man, Mr. Stack worked for the family business. But he didn't enjoy the experience. His father was a divisive boss who couldn't manage a supply chain, and was...",0.1186418720442684,0.2574364399071045,0.18803915597568646,0.21117158395282581
N9460,news,newsworld,"Egypt unveils discovery of 30 ancient coffins with mummies inside Egyptian authorities on Saturday revealed the contents of 30 ancient wooden coffins discovered in Luxor and yes, they include mummies.",0.1186418720442684,0.2649024124592186,0.1917721422517435,0.2161488989875685
N42583,news,newsworld,"India's capital restricts cars as people choke in dirty air Authorities restricted many private vehicles from taking to the roads of India's capital on Monday amid a public health crisis that has left New Delhi residents gasping and their eyes burning from toxic air pollution. The ""odd-even"" scheme will restrict private vehicles with odd-number license plates to driving on odd dates while even-numbered plates are allowed on even-numbered dates.",0.1186418720442684,0.2812738003714259,0.19995783620784716,0.22706315759570672
N14662,foodanddrink,foodnews,"This Controversial Julia Child Recipe Caused Quite a Stir Julia Child has long been one of the most popular cooks in the country, celebrated for strict interpretations of culinary classics. However, her take on a classic Italian dish caused an uproar.",0.1186418720442684,0.2577294052253718,0.1881856386348201,0.21136689416500398
N31820,news,newsworld,"What we know about the military dog injured in the al-Baghdadi raid The Belgian Malinois wounded during the raid targeting ISIS leader Abu Bakr al-Baghdadi hasn't been identified, but President Trump tweeted a declassified photo.",0.1186418720442684,0.2485316233116153,0.18358674767794186,0.205235039555833
N53052,movies,movienews,Charlize Theron Says Playing Megyn Kelly Was 'Harder' Than Portraying a Serial Killer Charlize Theron: Playing Megyn Kelly Was 'Harder' Than Playing a Serial Killer,0.1186418720442684,0.2301215752760066,0.1743817236601375,0.19296167419876054
N60936,news,newsus,Chicago teachers' strike ends after 11 days. CPS will have 5 make-up days of school The Chicago Teachers Union voted to accept a tentative agreement with Mayor Lori Lightfoot. The two sides argued over how many days to make up.,0.1186418720442684,0.2575431371902197,0.18809250461724406,0.2112427154749026
N21628,news,newsus,"Parkland shooter's death penalty trial set to begin in January Parkland school shooter Nikolas Cruz's death penalty trial is set to begin in January 2020, according to a court order issued Thursday by Florida Circuit Judge Elizabeth Scherer.",0.1186418720442684,0.288513081719005,0.20357747688163672,0.23188934516075949
N28660,news,newsworld,"Erdogan vows to 'crush the heads' of Kurds if they don't withdraw; both sides trade blame for violating cease-fire Turkish President Recep Tayyip Erdogan on Saturday promised to ""crush the heads"" of the Kurds in Syria if they don't fall back from the border's safe zone, according to reports.",0.1186418720442684,0.2617028186246936,0.190172345334481,0.21401583643121852
N51464,news,newsus,"Woman wanted for climbing into Bronx Zoo lion exhibit: 'I am the lion now' Myah Autry said her decision to climb a fence and head into the lion's den was a ""spiritual"" experience.",0.1186418720442684,0.2298586855519501,0.17425027879810925,0.19278641438272287
N46354,sports,football_ncaa,Week 8 observations: Wisconsin exposed as fraud in title chase and that could hurt Big Ten Wisconsin showed it was not a real national title contender with a loss to Illinois that changes the landscape of the Big Ten.,0.1186418720442684,0.2263541898080112,0.1724980309261398,0.1904500838867636
N50343,sports,football_ncaa,'We think it's cute.' Clemson reacts as undefeated Tigers keep falling in Top 25 Clemson co-offensive coordinator Jeff Scott was the head coach at Blythewood High School in Richland County in the mid-2000s before beginning his college coaching career at Presbyterian in 2007.,0.1186418720442684,0.2318499101509515,0.17524589109760996,0.1941138974487238
N50049,sports,football_ncaa,"11 bold predictions for rest of college football season Alabama misses the playoff, USC wins Pac-12 and more",0.1186418720442684,0.2108314351887094,0.1647366536164889,0.18010158080722904
N29819,movies,movies-celebrity,"Paparazzi Drove Keira Knightley to a Mental Breakdown: 'I Told Them I Was Going to Kill Somebody' The twice-Oscar-nominated actress spoke frankly with The Telegraph about how the enormous pressure of 2003's ""Pirates of the Caribbean"" and the hits that followed forced her to retreat from the limelight.",0.1186418720442684,0.2194806437306641,0.16906125788746623,0.18586771983519884
N44007,video,news,Where have Cape Town's great whites gone? Shark spotters say Cape Town's world-famous great whites have disappeared. So where have they gone?,0.1186418720442684,0.2707867028062501,0.19471428742525926,0.22007175921892286
N38821,news,newsphotos,The US Navy is 244 years old today. Here are 42 powerful images from its iconic history. The US Navy has long been the most visible part of America's military might with visits to far flung ports and operations all over the world.,0.1186418720442684,0.2748361261538318,0.1967389990990501,0.22277137478397732
N14972,foodanddrink,foodnews,"Here's Why We Pass Out Candy on Halloween Sure, candy's a big part of lots of our holidays in the United States but why is Halloween the one where we go door-to-door asking for it?",0.1186418720442684,0.2759554685508423,0.19729867029755535,0.22351760304865098
N36229,news,newsworld,"US jets destroy anti-ISIS coalition base in Syria after withdrawal, official says Two Operation Inherent Resolve (OIR) F-15 jets destroyed a base that was the headquarters of the anti-ISIS coalition in northern Syria on Wednesday after it had been vacated, according to a military official.",0.1186418720442684,0.2698659680027812,0.1942539200235248,0.21945793601661023
N52692,news,newsus,"Dow says no injuries from chemical plant blast in Louisiana An explosion at a Dow chemical plant in Louisiana rattled windows in nearby homes but caused no injuries, the company said Sunday.",0.1186418720442684,0.2543070258460138,0.1864744489451411,0.20908530791209864
N11673,movies,movies-celebrity,"Blake Lively Hilariously Trolls Ryan Reynolds for Having ""No Chill"" Blake Lively trolled husband Ryan Reynolds and his gin company, Aviation Gin, on Instagram with some hilarious Stories. See what she wrote here.",0.1186418720442684,0.2214771277948561,0.17005949991956226,0.18719870921132686
N17371,news,newsworld,Turkey Takes Fight Against Kurdish Fighters to Iraq As It Struggles in Syria The Turkish Defense Ministry announced that up to seven Kurdish PKK fighters were killed in back-to-back strikes in northern Iraq as deadly clashes continued across the border in Syria.,0.1186418720442684,0.2709618214908702,0.19480184676756931,0.2201885050086696
N1455,sports,football_ncaa,"LSU up to No. 2 behind Alabama in Amway Coaches poll as Oklahoma, Notre Dame tumble LSU is now No. 2 in the Amway Coaches Poll behind Alabama, while Oklahoma and Notre Dame both tumbled after losses on the road.",0.1186418720442684,0.2178650769962059,0.16825347452023715,0.18479067534556004
N40545,finance,finance-savemoney,"12 things that could save us money if we weren't lazy From checking your credit report to comparison shopping, go the extra mile to keep your cash.",0.1186418720442684,0.2789561039386825,0.19879898799147544,0.22551802664054443
N770,tv,tvnews,"Megyn Kelly Slams NBC News on 'Tucker Carlson Tonight' for Matt Lauer Investigation, Harvey Weinstein Coverage In Megyn Kelly's first televised interview since exiting NBC, the former Fox News and NBC News anchor took to ""Tucker Carlson Tonight"" Wednesday evening to criticize NBC News management for its handling of the outlet's Harvey Weinstein coverage and internal Matt Lauer investigation.",0.1186418720442684,0.2228679098843933,0.17075489096433086,0.18812589727101833
N51616,sports,football_ncaa,"Plaschke: USC's debacle against Oregon is final nail in coach Clay Helton's coffin It's over now, finally, mercifully, a USC football era ending Saturday night on a field filled with mistakes surrounded by fans teeming with anger. There's no way Clay Helton comes back from this. There's no way the Trojans football program can continue on like this. There's no way this should ever happen at USC, ever, this embarrassing 56-24 whipping at the hands and arms and feet of the ...",0.1186418720442684,0.2330596769776417,0.17585077451095504,0.19492040866651728
N61319,sports,football_ncaa,"After throwing a punch, Dabo Swinney made CB Andrew Booth ride the manager bus back to Clemson ",0.1186418720442684,0.2282232519222994,0.17343256198328388,0.19169612529628904
N10671,news,newsus,"Pentagon releases first images from raid that killed ISIS leader The Pentagon released newly declassified video and images Wednesday of the daring, two hour raid targeting ISIS leader Abu Bakr al-Baghdadi that shows US forces taking small arms fire from multiple locations as their helicopters approached the compound.",0.1186418720442684,0.2391359414665745,0.17888890675542146,0.19897125165913912
N8160,sports,football_ncaa,College Football Playoff Chase: Who's Still In The Hunt After Week 9? Which top teams have the best chance of getting into the College Football Playoff after Week 9?,0.1186418720442684,0.2404808895482983,0.17956138079628337,0.19986788371362166
N14238,sports,football_ncaa,College Football Rivalries: The Top Nicknames ,0.1186418720442684,0.2284052943124772,0.1735235831783728,0.19181748688974093
N20933,sports,football_ncaa,"College football Week 7 takeaways: LSU offense shows it's for real LSU appears to finally have the offense to compete with Alabama, and other things Dan Wolken learned from Week 7 of the college football season.",0.1186418720442684,0.1941968480603403,0.15641936005230433,0.16901185605498298
N35554,sports,football_ncaa,"Lane Kiffin interested in Florida State head coach job Look out, folks. Lane Kiffin wants back into the Power Five, expressing his interest in the Florida State job on the heels of Willie Taggart's Sunday firing.",0.1186418720442684,0.2474067481806754,0.1830243101124719,0.20448512280187306
N28467,news,newsworld,"Four-metre king cobra wrestled from sewer in Thailand A feisty four-metre (13-foot) king cobra was pulled from a sewer in southern Thailand in an hour-long operation, a rescue foundation said Tuesday, describing the reptile as one of the largest they had ever captured. Kritkamon said the snake was more than four metres long, weighed 15 kilos (33 pounds), and was the third-largest they had found.",0.1186418720442684,0.28346603277088,0.2010539524075742,0.22852464586200946
N51147,sports,football_ncaa,10 storylines to follow heading down college football's home stretch Seven weeks down; seven to go. We've hit the halfway mark of the college football regular season. It's been entertaining thus far   not too many surprises   with enough intrigue to keep us going back each week.,0.1186418720442684,0.2258837003183275,0.17226278618129795,0.19013642422697447
N27106,sports,football_ncaa,Brett McMurphy's College Football Bowl Projections After Week 8 This week's National Championship projection: LSU vs. Ohio State. The post Brett McMurphy's College Football Bowl Projections After Week 8 appeared first on Stadium.,0.1186418720442684,0.2235043750106451,0.17107312352745674,0.18855020735518618
N45388,sports,football_ncaa,"College football Week 8 bowl projections: Baylor surges into New Year's Day 6 Sporting News' Week 8 bowl projections saw a little movement, and Baylor and North Carolina each have joined the New Year's Day 6 discussion.",0.1186418720442684,0.2253045408731483,0.17197320645870834,0.18975031793018832
N6785,news,newsworld,Today in History: November 5 ,0.1186418720442684,0.2580233703018447,0.18833262117305655,0.21156287088265258
N4524,sports,football_ncaa,Brett McMurphy's College Football Bowl Projections After Week 9 Is Oklahoma still projected to earn a College Football Playoff bid? The post Brett McMurphy's College Football Bowl Projections After Week 9 appeared first on Stadium.,0.1186418720442684,0.2356714134984979,0.17715664277138315,0.19666156634708806
N58625,news,newspolitics,"Kamala Harris responds to memo on staff cuts: 'I fully intend to win' The senator's campaign is cutting jobs in its headquarters and shifting workers from New Hampshire, Nevada and California.",0.1186418720442684,0.250390415131174,0.1845161435877212,0.20647423410220545
