ID,category,sub_category,content,collaborative_rec,content_rec,mean,two_one
N61070,news,newscrime,Man arrested in 1993 cold case rape after he's identified by DNA: Police The suspect was 28 at the time and not known to the victim.,0.1745594734940636,0.2534938089769769,0.21402664123552023,0.22718236381600576
N35458,finance,markets,"Brazil oil auction a 'total disaster' as bidders stay away Brazil's largest-ever auction of oil deposits flopped, sending the real tumbling, after state-controlled Petroleo Brasileiro SA did most of the bidding while other major oil companies stayed away.",0.1778137020639103,0.2433826389069263,0.2105981704854183,0.22152632662592098
N6087,news,newsworld,"U.S. bans all flights to Cuba outside Havana in latest crackdown American Airlines and JetBlue, which fly routes to Cuba other than Havana, will have to submit to new regulations from the Transportation Department.",0.1791620395523925,0.2646500180161339,0.2219060287842632,0.23615402519488676
N61355,news,newscrime,"2 Murder suspects escape from Monterey County, California, Jail The suspects are considered dangerous and should not be approached. Anyone who sees them should call 911 immediately.",0.1791620395523925,0.2574574313653455,0.218309735458869,0.2313589674276945
N55833,news,newscrime,"Oldham County man charged, injuring victim during shooting practice ",0.1791620395523925,0.2796307111244024,0.22939637533839746,0.24614115393373243
N7023,lifestyle,lifestyle-news-feature,"After being pushed close to extinction, this humpback whale population is making a comeback A key population of humpback whales is in recovery after it was pushed close to extinction by centuries of exploitation, according to a new study.",0.1791620395523925,0.2499549783320401,0.21455850894221629,0.22635733207215755
N45099,news,newscrime,Suspect in crossbow murder of his father arraigned ,0.1791620395523925,0.2467568396890871,0.2129594396207398,0.22422523964352223
N29948,lifestyle,lifestyle-news-feature,"A White Woman Searches for Her Black Family DNA testing tells people a lot about their geographic ancestry, prompting difficult questions about racial identity and belonging. ""In my heart, I feel a connection.""",0.1791620395523925,0.2419894205001629,0.2105757300262777,0.22104696018423942
N3142,health,health-news,"Teen wins science competition with liquid bandage invention Kara Fan beat nine other finalists and hundreds of students who submitted ideas in the 3M​ Young Scientist Challenge, winning $25,000.",0.1791620395523925,0.2471426672946496,0.21315235342352104,0.22448245804723055
N43353,news,newscrime,"Wedding shooter may have been avenging late stepfather's murder, authorities say Brandon Castiglione, the groom's son, was previously charged with second-degree murder in the death of the suspect's stepfather.",0.1791620395523925,0.2572598840959168,0.21821096182415467,0.23122726924807538
N35656,travel,travelnews,Motorcyclist killed in crash on New Cut Road identified ,0.1791620395523925,0.2667968750882356,0.22297945732031405,0.23758526324295454
N63317,news,newscrime,"Police: 4 charged with attempted murder month after shooting in SW Louisville Four people are facing attempted murder charges for a shooting last month in southwest Louisville. According to arrest citations, a group arrived at an apartment in the 9600 block of Lamborne Boulevard on Sept. 27 and attempted to lure a male, unknown age, out of his apartment. When the victim agreed to come outside, police said Byron Kirby, 25, shot at the victim four times. The victim then ran into the woods. It's unclear if he was hit....",0.1791620395523925,0.2545128672332949,0.21683745339284372,0.2293959246729941
N34567,news,newscrime,Grandfather charged in death of toddler who fell on cruise ship in Puerto Rico A grandfather who police say dropped his young niece from the 11th floor of a cruise ship docked in Puerto Rico in July has been accused of negligent homicide.,0.1791620395523925,0.2208550378148273,0.2000085386836099,0.20695737172734902
N50528,news,newscrime,Man shot in the chest on Floyd Street ,0.1791620395523925,0.2495839857732656,0.21437301266282904,0.2261100036996412
N19709,news,newscrime,Teen given 8 years in prison for gang-related hate crime of student caught on tape A California teenager has been sentenced to eight years in prison for a gang-affiliated hate crime assault on another student.,0.1791620395523925,0.2796494348739472,0.22940573721316987,0.24615363643342897
N61101,news,newscrime,"Resident recalls moments leading up to fatal shooting in Russell neighborhood In the Russell neighborhood, crime tape has become a well known sight that's why Lisa Tutt encourages her son and his friends to hang out at her house. READ THE FULL STORY:Resident recalls moments leading up to fatal shooting in Russell neighborhood Sign up for our Newsletters CHECK OUT WLKY:Live. Local. Late-Breaking. Get the top Louisville news, weather and sports from the team at WLKY   online, anytime.",0.1791620395523925,0.268118654501849,0.22364034702712077,0.23846644951869683
N2663,news,newsworld,16 sentenced to death for burning alive Bangladesh teen Sixteen people were sentenced to death Thursday for burning alive a Bangladeshi teenager who refused to withdraw sexual assault charges against her head teacher.,0.1791620395523925,0.2563667043686917,0.2177643719605421,0.23063181609659195
N48390,travel,travelnews,First round of auctions begin for Joe Ley Antiques ,0.1791620395523925,0.2321728370831056,0.20566743831774903,0.21450257123953456
N65112,news,newscrime,"Family says 16-year-old was victim hit, killed on I-64 The person struck by 5 vehicles on Interstate 64 Friday night was a 16-year-old girl, according to family members. The girl's father, Ronnie Click, spoke with WHAS11 News Saturday and said his daughter Brea was killed in that incident. Police responded to I-64 near the 22nd Street exit after they received reports that a person had been hit while walking in the slow lane. RELATED: LMPD: Pedestrian struck and killed on I-64 E at 22nd Street Once...",0.1791620395523925,0.2789922612344909,0.22907715039344168,0.2457155206737914
N22976,news,newsus,"The Sante Fe High School massacre suspect isn't fit to stand trial and will get psychiatric treatment, attorney says Dimitrios Pagourtzis is accused of killing eight students and two teachers at his Texas high school last year.",0.1791620395523925,0.2676066596139077,0.22338434958315012,0.23812511959340263
N63045,news,newscrime,"Coroner IDs man found dead in Klondike neighborhood A man who was found dead in the Klondike neighborhood has been identified. Louisville Metro police responded to the 3200 block of Pomeroy Drive for a call of a person down Friday. Officials said Kevin Hellems, 54, was found dead inside the home from some type of foul play. No other information has been released. The death comes as a surprise to the neighbors in the area, who say they aren't used to seeing police cars and detectives on this...",0.1791620395523925,0.2245294450673832,0.20184574230988783,0.2094069765623863
N59049,news,newsworld,"Three gunmen killed in Brazil airport raid, kidnapping: police Heavily armed gunmen raided an airport in Brazil on Thursday, officials said, stealing money from an armored truck before fleeing and taking a mother and baby hostage. At least one assailant escaped to a nearby residential neighborhood, taking a mother and her baby hostage in their home, the police spokeswoman said.",0.1791620395523925,0.2225134788170099,0.2008377591847012,0.2080629990621374
N54889,lifestyle,lifestyle-news-feature,"Chris, the famously woolly sheep, has died Chris made headlines in 2015 after he became the unofficial world record holder for having grown the heaviest fleece.",0.1791620395523925,0.2709897948344394,0.22507591719341596,0.24038054307375709
N6072,news,newsus,"Search resumes for worker missing in New Orleans Hard Rock Hotel building site collapse that killed 2 Rescuers resumed searching Sunday for a worker trapped in rubble after a deadly construction collapse in New Orleans, officials said, but the building's instability is making for a precarious situation.",0.1791620395523925,0.2218171655012304,0.20048960252681144,0.2075987901849511
N6244,news,newscrime,Suspect Alfredo Vazquez pleads guilty in Clark County judges' shooting case ,0.1791620395523925,0.2755053675146832,0.22733370353353782,0.24339092486058628
N58224,news,newscrime,"13-year-old charged with two murders escapes custody in North Carolina Officials said they have concerns for public safety due to the teen's ""prior history of assaultive and unpredictable behavior.""",0.1791620395523925,0.2430161967256018,0.21108911813899714,0.22173147766786536
N44462,news,newscrime,"Louisville man who shot at LMPD officer sentenced to 10 more years in prison A Louisville man convicted of shooting at an officer was sentenced Friday. Judge David Hale sentenced Elijah Eubanks, 22, to 119 months in prison for a federal weapons charge. Sign up for our Newsletters In March 2018, Eubanks opened fire on an officer who was attempting to question him while he was in his vehicle with another person. No officers were hit, but Eubanks was shot multiple times when officers returned fire. Eubanks was previously...",0.1791620395523925,0.2783858927919506,0.22877396617217155,0.2453112750454312
N15710,news,newscrime,Arrest made in connection to stabbing in South Louisville ,0.1791620395523925,0.2462188573396632,0.21269044844602786,0.22386658474390628
N31741,music,musicnews,"Snoop Dogg bringing 'I Wanna Thank Me' tour to Louisville Palace Multi-platinum rap legend Snoop Dogg is bringing his ""I Wanna Thank Me"" tour to the Louisville Palace in 2020. The venue announced on Twitter that the show is scheduled for Jan. 25. Live Nation presale starts starts Thursday at 10 a.m., and tickets go on sale to the general public Friday at 10 a.m. The Long Beach native released his 17th album, ""I Wanna Thank Me,"" in August. The Doggfather's West Coast G-funk style has sold more than 38 million...",0.1791620395523925,0.3033101655013953,0.24123610252689387,0.2619274568517277
N10438,lifestyle,lifestylebuzz,"Pope Lick Legend: Loved ones of those who died on trestle push for change Legends of a monster living under a dangerous train trestle have lured people to a quiet Louisville creek for decades. Some swear they have seen proof of a human-goat hybrid terrorizing the area. Others leave with no sightings and no story to tell. Those are the lucky ones. The story of a ""Pope Lick Monster"" or ""Goatman"" haunting the trestle at Pope Lick Creek has been commonplace in Louisville even becoming the focus of a movie in the late...",0.1791620395523925,0.2310549704247851,0.2051085049885888,0.2137573268006542
N42704,news,newscrime,UPDATE: Coroner reveals identity of victim in Beechmont neighborhood shooting ,0.1791620395523925,0.2507755282885916,0.21496878392049207,0.22690436537652522
N19041,news,newscrime,Kroger shooting: Suspect coming out of store fires at officers before they shoot him dead ,0.1791620395523925,0.2243499368093283,0.20175598818086038,0.20928730439034968
N8429,weather,weathertopstories,"Group clears plastic drums, tires from Falls of the Ohio State Park LOUISVILLE, Ky. (WHAS11)   The Falls of the Ohio is a little cleaner after volunteers helped return it to its glory. The volunteers picked up trash and debris along with old tires and leftover plastic barrels. It was part of Moran Environmental Recovery's effort to clean up parts of the state park. The group says over the years, the site has experienced waste dumping leaving the grounds full of empty drums, tires and glass. The state park is the...",0.1791620395523925,0.2402225258806084,0.20969228271650045,0.21986903043786976
N31739,news,newscrime,"'Habitual stowaway' arrested again at O'Hare, Chicago police say A woman arrested at O'Hare International Airport on Friday night was identified by Chicago police as ""known habitual stowaway"" Marilyn Hartman.",0.1791620395523925,0.2585217693215602,0.21884190443697632,0.23206852606517095
N23061,news,newscrime,"Police arrest suspect in Bashford Manor double shooting Police have identified the suspect in a double shooting that happened in Bashford Manor. On Thursday, officers arrested Matthew Martin on attempted murder and other drug-related charges. Police said Martin and one of the victims pulled out guns during an argument that happened at Martin's apartment on Goldsmith Lane Wednesday afternoon. Following the argument, both victims were shot in the back as they ran down the hallway and were transported...",0.1791620395523925,0.2558361932461357,0.21749911639926411,0.23027814201488797
N3433,finance,finance-companies,A secretive family landing a $4 billion haul has everyone guessing One of the world's richest and most discreet families must decide what to do with a massive pile of cash.,0.1791620395523925,0.2107250188101158,0.19494352918125413,0.200204025724208
N31402,foodanddrink,restaurantsandnews,"The Best Seafood Restaurant in All 50 States Think there are too many seafood places in Maine to choose among, but none in landlocked Nebraska? This list will point your cravings and more in the right direction. Whether it's shrimp, crab, fish, or sushi that you love, even the most landlocked states have top-notch options for seafood. Find out what's near you.",0.1791620395523925,0.2844321591975943,0.23179709937499338,0.24934211931586034
N48031,sports,basketball_nba,Ex-Maverick to pay for funeral of woman fatally shot in home by police ,0.1791620395523925,0.2391213866738381,0.2091417131131153,0.2191349376333562
N17686,news,newscrime,"Suspect in Henry County murder, kidnapping arraigned ",0.1791620395523925,0.2497128751769181,0.2144374573646553,0.22619592996874288
N1569,news,newsus,"Officer who shot naked man found not guilty of murder DECATUR, Ga. (AP)   A former Georgia police officer who fatally shot an unarmed, naked man was found not guilty of murder Monday but was convicted of aggravated assault and other charges that could send him to prison for more than 30 years. Robert ""Chip"" Olsen's face turned red and he squeezed his eyes shut tightly as the verdict was read. His wife, Kathy Olsen, began sobbing and had to be led from the courtroom. DeKalb County Superior Court...",0.1791620395523925,0.2609241183179396,0.22004307893516606,0.2336700920627572
N41011,news,newsworld,"For the first time, a man has been sentenced for sexual slavery by the International Criminal Court. He got 30 years. Bosco Ntaganda is a former Congolese rebel nicknamed the ""Terminator."" The ICC convicted him on 18 counts including murder, sexual slavery and using child soldiers.",0.1791620395523925,0.2532178664237785,0.21618995298808552,0.22853259079998317
N62612,news,newscrime,16-year-old injured in shooting near Churchill Downs ,0.1791620395523925,0.2588304981418885,0.21899626884714052,0.23227434527872318
N29802,finance,finance-companies,"Barneys Is Sold for Scrap, Ending an Era Authentic Brands Group will take control of the Barneys name   one that has been part of the Manhattan landscape since 1923   and license it to other companies like Saks Fifth Avenue. The firm B. Riley Financial is preparing to liquidate Barneys' high-end wares, at its five stores and two Warehouse locations, starting with private sale events for Barneys' ""most loyal"" shoppers next week.",0.1791620395523925,0.2505228495662318,0.21484244455931212,0.226735912894952
N21773,travel,travelnews,Lumber spilled on I-71 following rollover crash; Lanes shut down ,0.1791620395523925,0.2544788081223349,0.21682042383736372,0.22937321859902077
N5398,news,newscrime,Suspects identified following hours-long SWAT standoff on South 34th Street ,0.1791620395523925,0.2408873197350358,0.21002467964371413,0.22031222634082134
N24611,news,newscrime,"Former Jewish Hospital nurse to be arraigned on sexual abuse of patient charge According to court documents, Dorsey told the woman ""repeatedly"" that, ""I would like to video you.""",0.1791620395523925,0.2686196877408197,0.2238908636466061,0.2388004716780106
N51163,lifestyle,lifestylebuzz,"He grew a 910-pound pumpkin and then used it as a boat Instead of making a giant jack o'lantern or a massive pie that could feed the whole town, a farmer in Tennessee took his 910-pound pumpkin out for a spin in his pond.",0.1791620395523925,0.2520157398976634,0.21558888972502793,0.22773117311590643
N24724,news,newsworld,"Humanitarian crisis unfolds as violence escalates in Syria In little more than a week, longstanding alliances have crumbled and old enemies have teamed up after the U.S. began pulling its forces out and Turkey invaded Syria",0.1821161434703059,0.236859278786858,0.20948771112858194,0.21861156701467396
N13912,travel,traveltips,A lawyer reveals a legal nightmare you can face on a cruise ship Cruise ship passengers can be exposed to legal systems that don't provide the same protections they would find in the US.,0.1821246365504852,0.2219077979717683,0.20201621726112673,0.20864674416467394
N62285,news,newsus,"Former Florida cop won't serve jail time after accidentally killing woman, 73, in training exercise A former Florida police officer who accidentally shot and killed a 73-year-old woman during a demonstration will not serve any jail time as part of a plea agreement.",0.1821246365504852,0.2412152508309754,0.21166994369073028,0.22151837940414532
N61972,entertainment,entertainment-celebrity,"New details on why Meg Ryan, John Mellencamp split, plus more news Meg Ryan and John Mellencamp's marriage plans may have prompted their split. Plus, more celebrity news for Nov. 4, 2019.",0.185087233548578,0.2820785757007458,0.2335829046246619,0.24974812831668985
N47922,music,music-celebrity,"Allegations against entertainer Todrick Hall are piling up, from stories of nonpayment to accusations of backlash for reporting sexual assault Todrick Hall became prominent in Broadway musicals, for his friendship with Taylor Swift, and more. Now, accusations against him are piling up.",0.185087233548578,0.2780303391809655,0.23155878636477173,0.24704930397016966
N40526,music,music-celebrity,Miranda Lambert Shares the Surprising Story of Her and Brendan McLoughlin's Meet-Cute The Pistol Annie's are to thank for introducing the country singer to her husband,0.185087233548578,0.2914854594251782,0.23828634648687808,0.2560193841329781
N56853,news,newsworld,"Trump orders withdrawal of U.S. forces from northern Syria, days after Pentagon downplays possibility U.S.-allied Syrian Kurdish fighters announced late Sunday that the Syrian Army would deploy along the Turkish border to ""liberate the areas that the Turkish army has entered with its mercenaries.""",0.185087233548578,0.2608648136283878,0.2229760235884829,0.23560562026845122
N29561,lifestyle,lifestylebuzz,"High school cheerleaders go off-script to help man propose to their coach A school's cheer squad coach was surprised when her students went off-script and held up four signs during a routine that read, ""Will you marry me?""",0.185087233548578,0.2506106478737752,0.2178489407111766,0.22876950976537613
N36593,foodanddrink,foodnews,"How the Boston cream pie became a beloved dessert A product of the longest continually operating hotel in the United States, the Boston cream pie combines sponge cake, vanilla custard and chocolate icing to form a beloved American dessert.",0.185087233548578,0.2791146465204157,0.23210094003449683,0.24777217552980313
N31099,travel,traveltripideas,Harry Potter's Childhood Home in England Is Now on Airbnb I think I can die happy now.,0.185087233548578,0.2708761928843413,0.22798171321645966,0.24227987310575352
N6285,finance,personalfinance,4 habits that could wreck your finances beyond repair Avoid these at all costs.,0.185087233548578,0.2606206309104006,0.2228539322294893,0.23544283178979308
N8237,foodanddrink,restaurantsandnews,16 Secrets Olive Garden Doesn't Want You to Know Here's everything you've wanted to know about your favorite breadstick-serving restaurant.,0.185087233548578,0.2666300661014705,0.22585864982502424,0.239449121917173
N42791,tv,tvnews,"Eva Longoria: 'Latinas Are the Last to Find Their Voices Amplified' Eva Longoria delivered a powerful and moving keynote at TheWrap's Power Women Summit in Los Angeles on Friday, saying that people in Hollywood are ""largely responsible for much of the unconscious bias that is against people of color"" and that ""Latinas are the last to find their voices amplified in this industry."" ""What studies show is that we are being erased,"" Longoria told a room of 2,000 attendees. ""This goes beyond underrepresentation. When...",0.185087233548578,0.2777042974973235,0.23139576552295077,0.24683194284774168
N58091,finance,finance-companies,Ex-Credit Suisse Banker Says Secret Affair Helped Fuel $45 Million Fraud A former Credit Suisse Group AG banker told a federal jury in New York that his decision to take millions of dollars in bribes was fueled in part by his secret love affair with a subordinate.,0.185087233548578,0.2670027252966223,0.22604497942260016,0.23969756138060752
N58744,lifestyle,voices,"I Gave Up On Love, And It Was One Of The Best Decisions I Ever Made At the end of our date in August 2018, Justin escorted me to my car, where henervously kissed me. When I kissed him back, he cheered, pumping his fists inthe air like he'd won something. I walked from the curb to my car, and when Iturned around, he was watching me, beaming.""I just want to make sure you get to your car safely,"" he said, even though Iwas less than a yard away.I slipped into the driver's seat, thrilled that our second date had gone...",0.185087233548578,0.3021448272274867,0.24361603038803237,0.2631256293345171
N50258,news,newspolitics,Trump feuds with Susan Rice over Syria President Trump exchanged barbs with the former Obama administration national security adviser Susan Rice over Syria after she criticized his policy.,0.185087233548578,0.2808186944755223,0.23295296401205018,0.24890820749987422
N51503,sports,football_ncaa,"Bill Plaschke: Mike Bohn brings USC integrity, which means he can't hire Urban Meyer LOS ANGELES_You ever heard of Mike Bohn? Me neither, and that's a good thing. The University of Southern California is apparently set on naming Bohn as its new athletic director, the smart hiring of a man who embodies the most important attribute for the new leader of the Trojans family. He's a complete stranger. He never played football at USC. He never coached football at USC. He never ...",0.185087233548578,0.2808732553518422,0.2329802444502101,0.24894458141742082
N2018,entertainment,celebrity,"Debunking the week's tabloid stories: Nov. 1, 2019 A round-up of the week's tabloid stories that totally missed the mark.",0.185087233548578,0.2245131677581184,0.2048002006533482,0.2113711896882716
N11163,news,newspolitics,"Kobach's campaign paid Kansan known to post racist comments on white nationalist site Kansas Republican Kris Kobach's Senate campaign paid an Olathe man who regularly posted hateful comments about Jews and racial minorities on a white nationalist website. Kobach's campaign paid Joe Suber $500 for field coordinating services in September, according to the Republican's latest campaign finance report. Suber also filed the paperwork with the state of Kansas creating ...",0.185087233548578,0.2763331860738379,0.23071020981120793,0.24591786856541792
N19874,health,wellness,"How Your Hormones, Weight, or Medication Could Be Killing Your Sex Drive Your libido can suffer for some unexpected reasons. And remember, there is no ""normal"" when it comes to sexual desire.",0.185087233548578,0.3130182160695326,0.24905272480905533,0.2703745552292144
N2078,tv,tv-celebrity,"Rainbow Baby! Shawn Johnson, Andrew East Welcome 1st Child After Miscarriage Rainbow Baby! Shawn Johnson, Andrew East Welcome 1st Child After Miscarriage",0.185087233548578,0.285570954054043,0.2353290938013105,0.2520763805522213
N30827,foodanddrink,restaurantsandnews,"These are the 11 classic food-court chains with the most locations From Panda Express to Auntie Anne's to Baskin-Robbins, these are the 13 classic food-court chains with the most US locations.",0.185087233548578,0.261527987027162,0.22330761028787,0.236047735867634
N56290,foodanddrink,tipsandtricks,The Secret Ingredient for Sausage Gravy That's Out of This World Transform your gravy with this $1 ingredient,0.185087233548578,0.2697792721801387,0.22743325286435834,0.24154859263628514
N30974,sports,basketball_ncaa,"Police identify 2 suspects in murder of Andre Emmett last month Two men accused of killing former Texas Tech and NBA player Andre Emmett were identified by Dallas police on Monday, the Dallas Morning News reported.",0.185087233548578,0.2542999961324446,0.2196936148405113,0.23122907527115572
N22614,sports,football_ncaa,Predicting which of college football's 10 undefeated teams will lose in Week 9 How many teams will still have a perfect record after Week 9?,0.185087233548578,0.2728406471362467,0.22896394034241235,0.24358950927369044
N12709,lifestyle,lifestylebuzz,"Twitter Had Feelings About Mark Zuckerberg's Micro-Bangs Facebook founder Mark Zuckerberg debuted a new haircut on the House floor on Wednesday, and Twitter quickly took note with an avalanche of memes and quips.",0.185087233548578,0.283060147633221,0.2340736905908995,0.25040250960500665
N51457,foodanddrink,restaurantsandnews,Restaurants Are Dealing With an Avalanche of Special Requests. One Chef Has Had Enough. It's not all about you.,0.185087233548578,0.2712167500810859,0.22815199181483198,0.24250691123691662
N53118,health,health-news,Colorado Mom's Touching Facebook Post Beautifully Explains Why We Shouldn't Suffer in Silence One Colorado mom's Facebook post recently went viral for showing how much asking a friend for help can make the difference when you're feeling alone.,0.185087233548578,0.2888381227015064,0.23696267812504218,0.2542544929838636
