ID,category,sub_category,content,collaborative_rec,content_rec,mean,two_one
N26940,health,nutrition,"This is Exactly How Long You Should Keep Thanksgiving Leftovers While keeping leftovers seems like a no-brainer, if not done properly, they can make you sick. Learn the right way to store Thanksgiving leftovers.",1.0,0.2701703356344362,0.6350851678172181,0.5134468904229574
N27441,lifestyle,lifestylehomeandgarden,These Christmas Window Decorations Are Full of Holiday Cheer Don't overlook this decorating opportunity this year.,1.0,0.2774412066761946,0.6387206033380973,0.5182941377841297
N8400,autos,autosresearchguides,These are the new cars that depreciate least Don't want to lose a ton of money on your next new car? These are the new car models that hold the most value after five years.,1.0,0.3008026738580333,0.6504013369290167,0.5338684492386888
N53431,lifestyle,lifestylehomeandgarden,Designer-Approved Ideas to Transform a Small Bedroom Because a lack of square footage shouldn't cramp your style.,1.0,0.290944511091333,0.6454722555456665,0.5272963407275553
N61006,entertainment,awards,Jenna Dewan flaunts her baby bump in red gown at People's Choice Awards She looks absolutely stunning.,1.0,0.3117578681145561,0.655878934057278,0.5411719120763707
N11817,travel,traveltripideas,"Here's the Best Small Town in Every State From Los Alamos, California, to Shelter Island, New York, these are the best small towns INSIDER found in every state.",1.0,0.2741753352352922,0.6370876676176461,0.5161168901568615
N41172,entertainment,celebrity,Welcome to the World! All of the Celebrity Babies Who've Made Their Debuts in 2019 See who's made their debut so far this year,1.0,0.2781559359225257,0.6390779679612628,0.5187706239483505
N14531,news,newsworld,Turkey starts repatriation of captured Islamic State militants: media Turkey starts repatriation of captured Islamic State militants: media,1.0,0.2497223838528883,0.6248611919264442,0.49981492256859217
N40530,news,newspolitics,"What's coming in impeachment: The inquiry goes public For only the fourth time in U.S. history, the House of Representatives has started a presidential impeachment inquiry.",1.0,0.2574453476622269,0.6287226738311135,0.5049635651081512
N64606,entertainment,celebrity,"Best celebrity hair moments of 2019 (so far) New year, new 'do! Nothing has the power to transform a look quite like a new hairstyle, which might explain why celebrities are constantly switching things up with fresh cuts, colors and lengths. In 2019, we've already seen stars like Rowan Blanchard and John Travolta go shorter (or, in the Saturday Night Fever star's case, bald!), Lady Gaga and Chris Messina walk the red carpet with striking new shades and Hilary Duff and Sarah Hyland show how subtle color shifts can make a big impact. And, if 2018's tress transformations were any indication, there is going to be so much more where that came from. Keep scrolling to see the best celebrity haircuts, color, extensions and more of 2019 so far!",1.0,0.2908295316566655,0.6454147658283327,0.5272196877711103
N25414,finance,finance-companies,"Alibaba breaks Singles Day record of more than $30 billion in sales and climbing Chinese e-commerce giant Alibaba set a new sales record on Singles Day, the world's largest 24-hour shopping event.",1.0,0.2580834706794777,0.6290417353397388,0.5053889804529851
N59385,entertainment,celebrity,"Celebrity Engagements of 2019 Love is abloom in 2019! Stars such as Tim Tebow, who is set to wed former Miss Universe Demi-Leigh Nel-Peters, and Hamilton's Anthony Ramos will soon be walking down the aisle after popping the question to their respective loved ones. Scroll through to see who else is put a ring on it this year and get the story behind their sweet proposals.",1.0,0.2857384637482068,0.6428692318741034,0.5238256424988045
N33120,entertainment,celebrity,Stars who welcomed babies in 2019 See which celebrities expanded their families this year!,1.0,0.2897058997836517,0.6448529498918258,0.5264705998557677
N10960,foodanddrink,recipes,65 Best Fall Soups That Will Warm You and Your Family Up All Season Long These hearty bowls are the perfect companion for a rainy fall night.,1.0,0.2857611594602272,0.6428805797301136,0.5238407729734847
N50023,health,nutrition,"The #1 Worst Menu Option at 76 Popular Restaurants The rule ""everything in moderation"" simply isn't an excuse for these excessive menu choices that will set you back for days.",1.0,0.2725783004172026,0.6362891502086013,0.515052200278135
N43432,news,newsus,"US Forest Service shuts down vandalized Georgia park feature GAINESVILLE, Ga. (AP)   The U.S. Forest Service says vandalism is forcing it to shut down a popular fall leaf viewing destination in Georgia. The agency posted photos to Facebook on Friday showing a wooden platform covered in white spray paint overlooking the mountainous north Georgia landscape at Chattahoochee-Oconee National Forests.",1.0,0.2708684376885683,0.6354342188442841,0.5139122917923789
N32010,finance,personalfinance,The biggest wastes of money in 2019 Relive 2019 with this look at some of the biggest wastes of money of the year.,1.0,0.2661968450644891,0.6330984225322446,0.5107978967096594
N61822,lifestyle,lifestylehomeandgarden,"200 Shocking Home Photos You Have to See We know a good DIY project when we see it, but these aren't them. Some of these are goofy, some are head scratchers and some are downright dangerous. Check these photos out, you'll definitely learn a thing or two!",1.0,0.2460695504436464,0.6230347752218232,0.4973797002957643
N23254,movies,movies-celebrity,Best nostalgic pics of Leonardo DiCaprio Celebrate Leo's birthday with these throwback photos.,1.0,0.3086815582619617,0.6543407791309809,0.5391210388413078
N5791,lifestyle,lifestylehomeandgarden,"12 Fall Landscaping Mistakes to Know and Avoid Whether you have a green thumb when it comes to your home garden, or you can hardly tell the difference between a rose and a weed, you should know that there are certain landscaping tasks that need to be done right to keep your home exterior looking its best. But to do that, you must avoid the most common fall landscaping blunders.",1.0,0.2944100819384315,0.6472050409692157,0.5296067212922877
N30188,lifestyle,lifestylebuzz,Look of the day: Ashley Graham's latest sizzling maternity look & more celeb style Bella Hadid attended the CFDA/Vogue Fashion Fund Awards in an Alexander Wang jumpsuit embellished with nipple and belly-button jewels.,1.0,0.2710273039619334,0.6355136519809668,0.514018202641289
N4912,movies,movies-gallery,"New Movies and TV Shows You'll Be Able to Cozy Up With on Netflix in November Movie watchers divide themselves into two camps when November rolls around: those who aren't ready to stop watching all the horror flicks that creeped them out around Halloween, and those who can't wait to dive into cheesy holiday movie season.",1.0,0.2626138290558958,0.631306914527948,0.5084092193705971
N17104,news,newscrime,"Veterans suffered, investors lost millions in nationwide schemes People lost hundreds of millions of dollars. But something is happening that might finally stop it.",1.0,0.247976387693686,0.623988193846843,0.498650925129124
N54988,finance,personalfinance,28 Dumb Ways You Could Lose It All by Trying To Get Rich Don't gamble your money away in foolish ways.,1.0,0.2731118897210767,0.6365559448605383,0.5154079264807178
N22549,entertainment,awards,2019 People's Choice Awards nominees' best recent style moments We're checking out the E! People's Choice Awards nominees' stellar recent style moments.,1.0,0.276643658194334,0.6383218290971671,0.5177624387962226
N54300,entertainment,celebrity,"Week in celebrity photos for Nov. 4-8, 2019 Week in celebrity photos for Nov. 4-8, 2019",1.0,0.2701176529169135,0.6350588264584567,0.5134117686112756
N21840,travel,traveltips,"10 Things You Should Never Do in an Airplane Bathroom Germs are potentially harmful in a normal bathroom. But put that bathroom in the sky, shrink it, and pump pressurized air into it and you've got the perfect environment for germs to thrive. The post 10 Things You Should Never Do in an Airplane Bathroom appeared first on Reader's Digest.",1.0,0.2824924614896683,0.6412462307448341,0.5216616409931122
N31978,music,music-awards,"Country music's biggest scandals From Wynonna Judd's husband's arrest to the Dixie Chicks' vent about George W. Bush, relive country's biggest scandals.",1.0,0.2632911189979124,0.6316455594989562,0.5088607459986083
N51241,lifestyle,lifestylefamilyandrelationships,"I Was Adopted Here's What Everyone Gets Wrong About Adoption While adoption is wonderful in many ways, it comes with its own set of unique challenges. Sometimes, those challenges come from other people making incorrect assumptions. The post I Was Adopted Here's What Everyone Gets Wrong About Adoption appeared first on Reader's Digest.",1.0,0.2840846446346607,0.6420423223173304,0.5227230964231071
N22880,lifestyle,voices,"I ordered clothes from those cheap online stores, and I'm not sold As an avid brick-and-mortar shopper, my eyes were opened when I tried an $8 formal dress, a $4 blouse, and other clothes for less than $10.",1.0,0.2426692904216043,0.6213346452108022,0.4951128602810695
N27143,foodanddrink,beverages,Best Dive Bar in Every State The real challenge in compiling a list of America's best dive bars comes in defining just what a dive bar is and isn't.,1.0,0.2674060782271513,0.6337030391135756,0.5116040521514342
N61623,entertainment,entertainment-celebrity,"Big celebrity money moments of the last decade From bankruptcy filings and huge paydays to reaching billionaire status, read up on the most fascinating money news involving the stars from 2010 to 2019.",1.0,0.2646721506461043,0.6323360753230521,0.5097814337640695
N24686,entertainment,entertainment-celebrity,Stars who've had more than one wedding with the same spouse See which celebs exchanged vows with their significant others more than once.,1.0,0.2798597038414296,0.6399298519207148,0.5199064692276197
N55204,entertainment,entertainment-celebrity,"Stars Who Served in the Military Adam Driver, Jeff Bridges, Ice-T and more stars who served in the military.",1.0,0.2872495412690509,0.6436247706345255,0.5248330275127006
N62386,news,newspolitics,America's Most and Least Popular Senators Senators represent the interests of the residents of their home state on Capitol Hill by crafting and voting on new laws and by approving or rejecting cabinet and judicial nominations made by the president.,1.0,0.2985097650059577,0.6492548825029789,0.5323398433373051
N40356,movies,movies-gallery,"All 112 of Netflix's notable original movies, ranked from worst to best To find out which Netflix original films are worth watching, we turned to Rotten Tomatoes to rank everything from ""Roma"" to ""Bright.""",1.0,0.2893156381002211,0.6446578190501105,0.5262104254001474
N55353,weather,weathertopstories,Distressing photos show glaciers that are disappearing or on the brink of collapse around the world The future of glaciers around the world is shaky. Here are photos showing some of the glaciers that might not be around for much longer.,1.0,0.2629941859627996,0.6314970929813998,0.5086627906418664
N50575,autos,autossuvs,Should You Get the 2020 Ford Explorer? Pros and Cons on This Family SUV Ford completely reimagined Explorer is a 2020 SUV of the Year contender,1.0,0.2798813997624004,0.6399406998812002,0.5199209331749336
N26376,finance,markets,"Stocks close higher on optimism over China trade deal Stocks ended at record highs Thursday after the world's two largest economies reportedly agreed to remove existing trade tariffs, sparking a huge rotation into equities and out of bonds.",1.0,0.2733139384242372,0.6366569692121186,0.5155426256161582
N37870,news,newsworld,Today in History: November 11 ,1.0,0.2489509292631068,0.6244754646315533,0.49930061950873783
N3344,music,cma-awards,"Top 100 country songs of all time Stacker counts down the top 100 country songs of all time. From old-school honky-tonk to modern country pop, this list covers the biggest hits in Billboard history.",1.0,0.2903416343296608,0.6451708171648304,0.5268944228864405
N26262,entertainment,entertainment-celebrity,"Celebrity plastic surgery transformations See how stars like Sharon Osbourne, Cardi B, Pauly D, Kim Zolciak-Biermann, Gisele Bundchen, Kanye West and others have altered their looks.",1.0,0.2786345839349812,0.6393172919674905,0.5190897226233208
N39461,foodanddrink,foodnews,"We Tried 5 Brands of Toaster Pastries So You Don't Have To We tasted organic, generic, gourmet, and nostagic options. Here's what we thought.",1.0,0.2549198226562068,0.6274599113281034,0.5032798817708045
N27476,sports,basketball_nba,"Harden scores 47 points, Rockets beat Clippers 102-93 HOUSTON (AP)   James Harden scored 47 points and the Houston Rockets outlasted the Clippers 102-93 in a wild game that saw Los Angeles coach Doc Rivers ejected in the fourth quarter Wednesday night. Houston was up by two with about two minutes left when former Rocket Patrick Beverley fouled out. Harden made both free throws before grabbing a rebound on the other end and hitting a 3 to make it 95-88. Beverley was given a technical foul during a...",1.0,0.3159973570291446,0.6579986785145723,0.5439982380194297
N57853,news,newscrime,Triple Shooting In Dallas Leaves 2 Dead & Police Investigating Two people are dead after a triple shooting in Dallas late Sunday night.,1.0,0.243701076917214,0.621850538458607,0.4958007179448093
N50005,news,newsgoodnews,"A teenager thought his leukemia was a death sentence. A college football player saved his life. William & Mary offensive lineman Mark Williamson on Friday finally met Rusty Plemons, whose life he helped save three years ago.",1.0,0.2614040253968203,0.6307020126984102,0.5076026835978802
N10840,finance,markets,Trade War's Forgotten Farmers Get Crushed in U.S. Cotton Country American cotton farmers are having such a difficult year that even a potential trade deal between the U.S. and China is likely to offer them little comfort.,1.0,0.2505860501730016,0.6252930250865008,0.5003907001153344
N54283,lifestyle,lifestyleroyals,"Prince Harry just hinted that he and Meghan Markle may want another baby Reports also suggest that Meghan Markle may want to have their next child in Los Angeles, where she was born.",1.0,0.2818928809447769,0.6409464404723885,0.5212619206298512
N33261,video,lifestyle,The Queen Had This Hilarious Reaction to (Unnecessary) Mouth-to-Mouth Resuscitation The Queen had a hilarious reaction when someone tried to save her life. Buzz60's Keri Lumm reports.,1.0,0.2558748894649703,0.6279374447324851,0.5039165929766468
N26084,foodanddrink,recipes,These Christmas Dinner Menus Will Create an Unforgettable Meal We've got you covered for any type of crowd.,1.0,0.2803627395676641,0.6401813697838321,0.5202418263784427
N999,news,newsscienceandtechnology,"Motorola's Razr flip phone is back as a folding-screen smartphone, for $1,500 The good news: A phone can fit in your pocket again. The bad news: It's twice the price of an iPhone.",1.0,0.2783198248085304,0.6391599124042652,0.5188798832056869
N18698,entertainment,awards,Khloe Kardashian Apologizes to Fans After Not Realizing She'd Won an Award at the People's Choice Awards Her family also won for Best Reality Show.,1.0,0.2801270494679007,0.6400635247339503,0.520084699645267
N47624,news,newsworld,"US, South Korea could scale back joint drills: Esper US military exercises with South Korea could be scaled back to aid diplomacy with the nuclear-armed North, Defense Secretary Mark Esper said on his way to Seoul, as Pyongyang said it was running out of patience. Seoul and Tokyo are both major US allies, democracies and market economies faced with an overbearing China and nuclear-armed North Korea.",1.0,0.2742423609524074,0.6371211804762037,0.5161615739682716
N287,news,newscrime,Three school workers charged in death of special needs student The student was reportedly restrained face-down for nearly an hour before becoming unresponsive,1.0,0.2430098338306311,0.6215049169153155,0.4953398892204207
N58410,tv,tv-celebrity,Tristan Thompson Gushes Over Ex Khloe Kardashian After Her People's Choice Win Khloe's ex and the father of her child raved about her in an Instagram post.,1.0,0.3054457801186268,0.6527228900593134,0.5369638534124178
N26331,news,newsus,"Wild turkeys are terrorizing a town; MLB player calls on the New Jersey governor for help Todd Frazier, MLB all-star, joined town residents sounding off about wild turkey terror. Now, they're asking New Jersey Gov. Phil Murphy for help.",1.0,0.2666003428974914,0.6333001714487457,0.5110668952649943
N64691,news,newsworld,"U.K. Politicians Fight First December Election in Almost a Century Across the length of the U.K., politicians are donning hiking boots and fluorescent jackets and arming themselves with torches as they campaign in the cold and darkness ahead of the country's first December election in almost a century.",1.0,0.2554416213386405,0.6277208106693203,0.5036277475590937
N23805,lifestyle,awardstyle,Carrie Underwood rocks CMAs and several gorgeous outfits as host All of her looks were just stunning.,1.0,0.2967263744026913,0.6483631872013457,0.5311509162684609
N12124,news,newsworld,"US to keep around 600 troops in Syria: Pentagon chief The United States will maintain around 600 troops in Syria, Pentagon chief Mark Esper said Wednesday, despite Donald Trump's desire to end US involvement in what the president calls ""endless wars"". ""We're going to have about 500 to 600-ish troops there, at the end of the day,"" he said.",1.0,0.2742103622635407,0.6371051811317703,0.516140241509027
N8555,lifestyle,lifestyleroyals,"Meghan Markle is being criticized for doing the same things that Kate Middleton is praised for, and a royal expert says it wouldn't be happening if she were white Markle received backlash when her bodyguard told fans not to take photos. However, Middleton was recently called ""down to earth"" for the same thing.",1.0,0.2757173128040741,0.637858656402037,0.517144875202716
N6477,finance,finance-companies,"Walmart releases Black Friday ad with $129 Apple Watch, TV deals, electronics doorbusters Walmart's Black Friday 2019 ad includes a 40-inch TV for $98, Apple iPad for $249, Xbox One, Playstation 4, deals on toys, Instant Pot and more.",1.0,0.2599088022397822,0.6299544011198911,0.5066058681598548
N61787,sports,basketball_nba,Russell Westbrook takes shot at Patrick Beverley Wednesday night's Houston Rockets-LA Clippers game was entertaining on many levels. Russell Westbrook's comments about Patrick Beverly's reputation stood out the most.,1.0,0.2966313971746055,0.6483156985873028,0.5310875981164036
N49879,news,newsgoodnews,"Man runs race in full SWAT gear, saves a life, then proposes -- all in a matter of moments The finish line of the Allstate Hot Chocolate 15K Run changed life-as-they-know it for Chicago Police Sgt. Mike Nowacki, his girlfriend, and a complete stranger with ""serendipitous"" timing.",1.0,0.2556493564003074,0.6278246782001538,0.5037662376002049
N63958,foodanddrink,recipes,Copycat Cracker Barrel Chicken and Dumplings Recipe Craving some comfort food from Cracker Barrel? Skip the restaurant and make this copycat chicken and dumplings recipe instead!,1.0,0.2925943176079203,0.6462971588039601,0.5283962117386135
N59673,music,music-celebrity,Selena Gomez and Julia Michaels Share a Kiss Before Getting Matching Arrow Tattoos Selena Gomez and Julia Michaels Get Matching Arrow Tattoos,1.0,0.2859537531166283,0.6429768765583141,0.5239691687444188
N7419,lifestyle,lifestylevideo,"Why This Couple Is Getting a 'Sleep Divorce' A New Jersey couple is getting an unusual ""divorce."" Liz and Rich Alterman have been happily married for almost 20 years. They have three children and are now on the brink of getting ""sleep divorced.""",1.0,0.2770311274417305,0.6385155637208653,0.5180207516278204
N27473,news,newspolitics,President Trump Speaks At Opening Ceremony Of 100th Annual Veterans Day Parade In NYC New York City is marking 100 years of commemorating the veterans who served our country.,1.0,0.2748098936775733,0.6374049468387867,0.5165399291183822
N38311,entertainment,celebrity,Celebrity PDA of 2019 See the stars kissing and hugging on the red carpet and out and about!,1.0,0.2781917967918947,0.6390958983959474,0.5187945311945965
N45561,news,newsphotos,"Inside the world's largest plane, which has a wingspan longer than a football field and a mysterious new owner The Stratolaunch is 238 feet long, 50 feet tall, and has a 385-foot wingspan. It made its first flight in April.",1.0,0.2758652423484217,0.6379326211742109,0.5172434948989477
N8957,music,cma-awards,Best country music albums of all time Stacker has compiled a list of the best country albums of all time as per Billboard's Greatest of All Time Country Albums list. These ratings are based on albums' weekly performance on the Top Country Albums chart from January 1996 to June 2016.,1.0,0.288519974097477,0.6442599870487384,0.5256799827316513
N49252,entertainment,entertainment-books,"100 Books Everyone Should Read Before They Die If you want to fill your shelves with classic titles and tomes that will open your mind to many worlds of fancy, facts, and fiction, these 100 books are the place to start.",1.0,0.2669442929069109,0.6334721464534554,0.5112961952712739
N30253,health,nutrition,"29 Foods Diabetics Should Avoid While some foods may seem healthy, they can be low-nutrition sources of hidden sugars. Here are foods to avoid.",1.0,0.3002451585599029,0.6501225792799514,0.5334967723732686
N42266,lifestyle,lifestylehomeandgarden,"Stylish Living Room Ideas, From Floral to Family-Friendly Bookmark this for the next time you need a refresh.",1.0,0.2924945805551324,0.6462472902775662,0.5283297203700883
N53696,news,newsworld,"Ugly From the Outset: Hong Kong's Day of Widespread Violence HONG KONG   Hong Kong was a city on edge on Monday following escalating violence, in which one demonstrator was shot point blank by a police officer and one man was doused with a flammable liquid and set on fire after he scolded protesters. At nightfall, both men were fighting for their lives in a city seething with resentments. Protesters have voiced outrage at police officers they see as increasingly resorting to force, and at a government...",1.0,0.2609610729965529,0.6304805364982764,0.5073073819977019
N46029,news,newsworld,"How Russia Meddles Abroad for Profit: Cash, Trolls and a Cult Leader The Russians were hard to miss. They appeared suddenly last year in Madagascar's traffic-snarled capital, carrying backpacks stuffed with cash and campaign swag decorated with the name of Madagascar's president.",1.0,0.2413695732638725,0.6206847866319363,0.494246382175915
N28204,finance,markets,"A $100 Billion Fund Manager Is Debunking Stock-Bubble Theories Negative interest rates are unnaturally propping up the stock market and at some point the whole edifice will collapse. It's an oft-repeated theory, but history suggests it might be wrong.",1.0,0.2659551033446203,0.6329775516723102,0.5106367355630802
N38483,entertainment,celebrity,"Celebs Who Look Even Better With Gray Hair, From Anderson Cooper to Steve Carell Steve Carell, we salute you.",1.0,0.2849974611700124,0.6424987305850062,0.5233316407800083
N40559,news,newsworld,"2 dead, 3 injured in a school shooting in Russia Russian police say a student has killed a fellow student and wounded three more in a shooting at a college before taking his own life. Russia's state Investigative Committee says the 19-year-old student in Blagoveshchensk near the border with China brought a hunting rifle to class Thursday and opened fire on students, shooting one dead and severely injuring three more.",1.0,0.2499689443310337,0.6249844721655169,0.49997929622068915
N61214,news,newsscienceandtechnology,SpaceX set to launch another 60 Starlink internet satellites Initial service is expected to begin next year with global connectivity expected in 2021,1.0,0.2895345445628988,0.6447672722814494,0.5263563630419326
N42803,lifestyle,awardstyle,Dolly Parton Is Rocking a Thigh-High Slit at the CMA Awards and She Looks Incredible This is why we love her.,1.0,0.2929783228373546,0.6464891614186773,0.528652215224903
N46972,news,newsworld,U.S. calls on Iraq to hold early elections U.S. calls on Iraq to hold early elections,1.0,0.2675838592216915,0.6337919296108457,0.511722572814461
N20824,finance,markets,"The economic picture is darkening in states critical to Trump's reelection bid A closer look at key battleground states could spell trouble for the candidate, whose populist economic proposals have been central to his campaign.",1.0,0.2738956184109512,0.6369478092054757,0.5159304122739674
N36273,sports,football_nfl,"Best, worst QB performances from NFL Week 10 Lamar Jackson continues to excel. Philip Rivers Continues to... not excel.",1.0,0.3062795361641267,0.6531397680820633,0.5375196907760844
N51853,finance,markets,"The problem with diamonds is they keep getting cheaper Americans are buying more diamond jewelry than ever before, but prices for most polished gems are falling.",1.0,0.2748176668781962,0.6374088334390982,0.5165451112521308
N64174,news,newscrime,Georgia executes man convicted of killing convenience store clerk Georgia executes man convicted of killing convenience store clerk,1.0,0.240648033715943,0.6203240168579716,0.49376535581062864
N17059,finance,finance-companies,"No. 1 milk company declares bankruptcy amid drop in demand Dean Foods blamed a decadeslong drop in milk consumption that has seen people turn to alternatives like soda, juice and almond milk.",1.0,0.253968510056166,0.626984255028083,0.5026456733707774
