ID,category,sub_category,content,collaborative_rec,content_rec,mean,two_one
N60850,foodanddrink,newstrends,"Popeyes is bringing back the chicken sandwich--and also takes a swipe at Chick-fil-A FORT WORTH -- The much-loved Popeyes Louisiana Kitchen fried chicken sandwich returns Sunday, and the company's announcement was a hard kick to the gizzard for competitor Chick-fil-A. After a limited-time summer special turned into a $65 million marketing bonanza, Popeyes will return both the spicy and mild sandwiches -- and on Sunday, when Chick-fil-A is not even open. Popeyes' ...",0.2072862653995141,0.2686795021452843,0.2379828837723992,0.24821508989669422
N7499,entertainment,celebrity,New Couple Alert? Drake and Kylie Jenner Appear Into Each Other at Party New Couple Alert? Drake and Kylie Jenner Appear Into Each Other at Party,0.2072862653995141,0.2617729065320043,0.2345295859657592,0.24361069282117426
N3577,health,health-news,Tennessee reports 49 cases of lung injury linked to vaping Tennessee health officials say they have received 49 cases of serious lung injury in people who use electronic cigarettes or other vaping devices.,0.2072862653995141,0.2874869269262693,0.24738659616289171,0.2607533730840176
N38495,health,health-news,"Poultry Recall After 22 Tons of Vietnamese Products Distributed Without Import Inspection In addition to failing to go through the usual food inspection processes, the products came from Vietnam a country that is not eligible to export poultry products to the U.S. or any meat products aside from catfish.",0.2072862653995141,0.2453633047263339,0.226324785062924,0.23267095828406065
N17681,foodanddrink,foodnews,McDonald's Is Going to Add Chicken to Its Breakfast Menu in 2020 Here's the rumor from McDonald's HQ. The post McDonald's Plans to Add Chicken to Its Breakfast Menu in 2020 appeared first on Taste of Home.,0.2072862653995141,0.2858415443177773,0.2465639048586457,0.2596564513450229
N34934,sports,golf,"20 years after Payne Stewart's tragic death, son Aaron carries his legacy Aaron Stewart spent his summers on the road as a PGA Tour kid. The behind-the-scenes visits at the Columbus Zoo during the Memorial Tournament stand out among his favorite memories as well as the ""music man"" under the big tree on Hilton Head Island.",0.2072862653995141,0.2598954342497301,0.2335908498246221,0.24235904463299146
N27919,sports,golf,Martin worries about amputation after breaking right leg Casey Martin's worst fear was realized earlier this month when he stepped awkwardly off a curb and fractured his right tibia.,0.2072862653995141,0.2540951876038008,0.23069072650165745,0.2384922135357052
N28058,lifestyle,lifestylebuzz,Strange Dog Shows Up On Woman's Lawn   And Seems To Recognize Her Kate Howard was sitting outside her home one afternoon after a memorial service when something amazing happened.,0.2072943081295648,0.2463911098814345,0.22684270900549966,0.23335884263081125
N12349,lifestyle,lifestylebuzz,"Divers Find Giant Mysterious 'Egg' Floating In Ocean A team of divers set off to explore a sunken World War II ship off the Norwegian coast, but what they found was something far more mysterious. While making their way back to shore, Ronald Raasch, Nils Baadness and Brynjar Aarnseth came face-to-face with a giant floating orb. The bubble hovered 17 meters (56 feet) below the surface and appeared to be see-through. The divers turned their flashlights on it and realized that the sphere was filled...",0.2074989583418486,0.1826027175868869,0.19505083796436773,0.19090146450520745
N20121,music,musicnews,"Bob Kingsley, Country Radio Legend, Dead at 80 Country radio legend Bob Kingley, the longtime host of the nationally syndicated program Bob Kingsley's Country Top 40, died early Thursday in Weatherford, Texas, following a lengthy battle with bladder cancer. He was 80 years old. A member of the Country Radio Broadcasters Hall of Fame, inducted in 1998, he later became only the format's fifth representative in the National Radio Hall of Fame in 2016. Kingsley was 18 and serving in the Air...",0.2075453609388009,0.2765413091224064,0.24204333503060366,0.2535426597278712
N57318,news,newsus,"A 2,000-pound great white shark is swimming off the coast of Florida A great white shark that weighs over 2,000 pounds and measures 15 feet, 5 inches long has been swimming along the US East Coast.",0.2076024145670694,0.2634769401519432,0.2355396773595063,0.2448520982903186
N56446,movies,movies-celebrity,Ryan Reynolds Shares the First Photo of His and Blake Lively's Newborn Daughter This is the first time the actor has talked about his newborn daughter.,0.2076330861219755,0.3014155897493435,0.25452433793565954,0.27015475520688753
N59496,sports,football_nfl,"Week 7 winners, losers: Aaron Rodgers now in MVP race; Mitchell Trubisky looks lost Aaron Rodgers' big game vaults him into the MVP race. Meanwhile in Chicago, it might be time for the Bears to reconsider Mitchell Trubisky's future.",0.2077111985381655,0.292482926647735,0.2500970625929503,0.26422568394454515
N64983,news,newsus,"Buffalo Wild Wings fires workers allegedly involved in racist incident Multi-racial group of 18 in Naperville, Illinois eatery was allegedly asked to move tables to get farther from frequent diner who was ""racist""",0.2077925506294351,0.2576873659346009,0.232739958282018,0.24105576083287897
N56630,finance,markets,China asks WTO for $2.4 billion sanctions against U.S. in latest clash China asks WTO for $2.4 billion sanctions against U.S. in latest clash,0.2078239010872481,0.2642284826378906,0.23602619186256935,0.24542695545434312
N33503,foodanddrink,restaurantsandnews,These Restaurants Are Rumored To Be Haunted By Spirits Get into the Halloween spirit with a reservation at one of these spooky spots.,0.2079071585849431,0.2374490714373267,0.22267811501113488,0.22760176715319885
N23163,news,newspolitics,"'You people with this phony Emoluments Clause': Cabinet meeting devolves into 71 minutes of Trump grievances President Trump, trying to dig out from two new political holes of his own making on top of the expanding House impeachment inquiry, held forth for 71 minutes Monday during what was ostensibly a Cabinet meeting but ended up being a familiar torrent of grievance, defensiveness and bold statements about his expansive view of his own powers.",0.2080945898370882,0.2676233900158795,0.23785898992648385,0.24778045662294906
N31699,news,newscrime,"Woman stabbed in 2015 home invasion suing 911 dispatch company Breann Lasley has filed a civil lawsuit against Priority Dispatch Corp., alleging ""gross negligence,"" but the company said its system was never used.",0.208098823317845,0.2610029600770577,0.23455089169745136,0.2433682478239868
N619,news,newsus,"Cornell student, 18, found dead in gorge after frat party, reports say A top Ivy League student was found dead Saturday afternoon in a New York gorge after he left a fraternity party and disappeared Thursday night, according to reports.",0.2082336219933169,0.2351306138692515,0.2216821179312842,0.22616494991060665
N28257,news,newspolitics,"Meghan McCain confronts Trump Jr.: 'You and your family have hurt a lot of people' Donald Trump Jr., the president's son, defended his family after ""View"" co-host Meghan McCain suggested they were responsible for the lack of ""character"" in American politics.",0.2086851051617455,0.2800538914336932,0.24436949829771934,0.2562642960097106
N22570,foodanddrink,foodnews,'Ghost kitchens' are taking over fast-food chains from Chick-fil-A to Wendy's Wendy's became the latest fast-food chain to name-check ghost kitchens on Friday at the company's investor day.,0.2086945790873636,0.232762973240808,0.22072877616408582,0.22474017518965989
N54435,news,newsus,"'Angel' car saves Arizona family after smashing into suspected drunk driver running red light, video shows An Arizona driver who police praised as an ""angel"" may have saved the lives of a couple pushing a stroller in a crosswalk last week after video showed the car smashing into a suspected drunk driver speeding through a red light -- who came inches away from plowing into the family.",0.2088099462694092,0.264114360827649,0.23646215354852912,0.24567955597490237
N24294,news,newspolitics,"Giuliani Mixes His Business With Role as Trump's Lawyer It is an extraordinary time in Washington, but it is more or less business as usual for Rudolph W. Giuliani. He is a central figure in the impeachment inquiry. He is under scrutiny by federal prosecutors. But throughout the building controversy, Mr. Giuliani has continued to represent clients, broker deals and take on consulting contracts in Washington and around the world in ways that leave him subject to criticism that he is using...",0.2088929352533594,0.2977573704316312,0.2533251528424953,0.26813589203887395
N10679,news,newspolitics,Justice Dept. appeals order on Mueller grand jury testimony The Justice Department is appealing a judge's order directing the department to produce to the House secret grand jury testimony from special counsel Robert Mueller's Russia investigation.,0.2090709953602803,0.2835144003249654,0.24629269784262284,0.2586999320034037
N1398,news,newsus,"Iowa woman killed by explosion at gender reveal party An Iowa woman was killed by debris from an explosion at a gender reveal party on Saturday, police said.",0.2091229049560762,0.2446862341397747,0.22690456954792543,0.23283179107854185
N25785,sports,football_nfl,OJ Simpson suing Vegas hotel for defamation over 2017 TMZ story claiming 'belligerence' ,0.2091856625604674,0.2798157259509028,0.2445006942556851,0.2562723714874243
N16158,lifestyle,lifestylebuzz,"Nationals pitcher criticized for missing playoff game for daughter's birth Daniel Hudson said his family is his ""top priority"" after receiving criticism for missing a playoff game for the birth of his daughter.",0.2092973138041683,0.29580331487484,0.25255031433950414,0.2669679811846161
N10732,lifestyle,lifestylebuzz,"Couple Didn't Know Why Car Was Running Strangely   Then They Popped The Hood Earlier this week, Holly Persic was driving to work in Pennsylvania when her car suddenly started acting up. The engine was making a weird sound, and there was a faint smell of burning. Persic pulled over and called her husband, Chris. He suggested she pop the hood. And sure enough, this is what they found: Chris Persic Inside the engine compartment were hundreds of walnuts, along with some dry grass. A squirrel, it seems, had chosen the...",0.2093866043555043,0.2395311360348088,0.22445887019515653,0.229482958808374
N33502,finance,markets,"China's trade with US shrinks in October despite optimism BEIJING (AP)   U.S.-Chinese trade contracted again in October, despite optimism about possible progress in talks aimed at ending a tariff war that threatens global economic growth.",0.209739141538589,0.2690124721179618,0.23937580682827542,0.24925469525817084
N39498,video,science,"Why it's so hard for planes to land on water When US Airways Flight 1549 landed in the Hudson river all 150 passengers survived. Landing a plane on the water is called ditching. Ditching is more common in smaller private planes, not large planes from companies like Boeing or Airbus. But the Miracle on the Hudson isn't the only time an aircraft has been ditched. And despite that success, landing a plane on the water can be extremely dangerous.",0.2097704626815041,0.2570392726573397,0.23340486766942192,0.24128300266539449
N30612,finance,personalfinance,"The first thing 14 lottery winners have bought after finding out they were rich Winning the lottery may be a dream come true, but what that actually looks like is different for everyone.",0.2098704478176336,0.2588904585406851,0.23438045317915934,0.2425504549663346
N28711,sports,football_ncaa,The biggest games in the month of November that will decide the College Football Playoff The month of November will decided which teams will be in College Football Playoff contention. A look at the biggest games in a jam-packed schedule.,0.2102352881103741,0.2841902889614699,0.247212788535922,0.2595386220111046
N21087,sports,football_nfl,"Report: Three-time Super Bowl-winning RB LeGarrette Blount works out for Raiders Now 32 years old, Blount has nearly 1,500 carries through nine pro seasons and has 6,306 yards and 56 career TDs.",0.2103454726429613,0.2959914143338693,0.2531684434884153,0.2674427671035666
N1843,tv,tvnews,Survivor Contestant Rudy Boesch Dies at 91 After Long Battle with Alzheimer's Disease Survivor's Rudy Boesch Dead at 91,0.2105797742291379,0.2659041763312407,0.2382419752801893,0.2474627089638731
N28088,movies,movies-celebrity,Bruce Willis brought Demi Moore to tears after reading her book Demi wasn't sure how her ex would feel about her book until he called her.,0.2106043686673455,0.2955353441263421,0.25306985639684376,0.2672250189733432
N3933,sports,football_nfl,"Bears' Khalil Mack calls out Eagles C Jason Kelce's controversial tactics in offsides penalties The Chicago Bears doomed themselves early in the first half in a 22-14 loss to the Philadelphia Eagles. While the Bears offense had a historically bad first half performance   netting just 9 total yards   the defense had its share of struggles with five pre-snap penalties in the first half against the Eagles. Bears outside linebacker Khalil Mack isn't one to point fingers for the defense's struggles, but when asked about those pre-snap...",0.2106779269683015,0.2745423689103484,0.24261014793932495,0.25325422159633276
N12608,foodanddrink,restaurantsandnews,"55 Restaurants That Serve an Amazing Thanksgiving Dinner If you love Thanksgiving and the food but don't love the cooking or cleanup, get an easy gourmet celebration at one of these restaurants nationwide. Many feasts feature local twists on old favorites, such as Turducken gumbo and Cajun fried turkey in New Orleans and even vegan-friendly offerings in Seattle.",0.2108004756086312,0.2638400915250685,0.23732028356684984,0.24616021955292272
N14761,weather,weathertopstories,Niagara Falls: Boat stuck on rocks 101 years dislodged High winds and heavy rains dislodged the remains of a barge in the rapids above Niagara Falls that had been there 101 years.,0.2108027061369513,0.2255856427577723,0.21819417444736178,0.22065799721749862
N29499,news,newsus,"California governor signs measure banning 'lunch shaming' SACRAMENTO, Calif. (AP)   California's governor has signed into law a bill that guarantees all students a state-funded meal of their choice, even if their parent or guardian has unpaid meal fees.",0.2109709598709425,0.2985863915070467,0.2547786756889946,0.2693812476283453
N35452,weather,weathertopstories,"'Potentially historic wind event' over weekend could inflame California wildfires Northern California could experience a potentially historic wind event this weekend, which could have a dangerous effect on wildfires.",0.2109709598709425,0.2618634061961735,0.236417183033558,0.24489925742109647
N4020,tv,tv-celebrity,"'Tarzan' Actor Ron Ely: Actor's son allegedly killed his mother before deputies shot and killed him, sheriff's office says The son of ""Tarzan"" actor Ron Ely killed his mother before he was shot and killed by deputies on Tuesday, according to the Santa Barbara County Sheriff's Office.",0.2110007184573838,0.260113570707151,0.2355571445822674,0.24374261995722862
N15122,tv,tv-celebrity,Tamron Hall says she 'never dealt' cocaine after reports say she confessed to doing so Tamron Hall issued a statement in response to the Daily Mail reporting that she confessed to facilitating the sale of cocaine as a teenager.,0.2110766067174022,0.2641230685136539,0.23759983761552805,0.24644091458157
N61342,sports,basketball_nba,"The Warriors' fall from glory, explained Things are getting bad quick for the Warriors.",0.2112202408309126,0.274358385145583,0.2427893129882478,0.25331233704069284
N30531,tv,tv-gallery,"16 transgender celebrities who are changing television Shows like ""Euphoria,"" ""Pose,"" ""The Fosters,"" and ""Shameless"" have all introduced trans actors and characters in recent years.",0.2114762723845727,0.2810776169775391,0.24627694468105588,0.2578771687798836
N55742,sports,mma,President Donald Trump gets mixed reaction at UFC 244 in historic milestone for MMA ,0.211739512257658,0.2786033526102753,0.24517143243396666,0.25631540582606954
N45794,news,newscrime,"Four flight attendants were arrested in Miami's airport after bringing in thousands in cash, police say Four American Airlines flight attendants were arrested at the Miami International Airport and charged with money laundering after bringing large amounts of cash into the country, police said.",0.2117505471159359,0.2346473926995128,0.22319896990772436,0.2270151108383205
N33164,sports,football_nfl,100 famous NFL players who played for teams you forgot about Randy Moss with the Titans? Archie Manning with the Vikings? Plenty of NFL players had some forgettable stints with surprising teams.,0.2118989236773724,0.2590258916072772,0.2354624076423248,0.2433169022973089
N29757,sports,basketball_nba,Clippers set bad precedent resting Kawhi Leonard against Bucks The Los Angeles Clippers are continuing with the theme we saw with the Toronto Raptors last season. They've rested reigning NBA Finals MVP Kawhi Leonard in one game of a back-to-back already this season.,0.212115923949057,0.3078776033737816,0.25999676366141933,0.27595704356554007
N47175,sports,basketball_nba,Report: Adidas working on buyout of $25 million John Wall deal amid injuries ,0.2122445115746583,0.2867661684349845,0.24950534000482139,0.2619256161482091
N46085,movies,movies-celebrity,"Johnny Depp Settles Legal Battle With Former Law Firm Bloom Hergott for 8 Figure Sum Johnny Depp has settled a legal battle with his former lawyer Jake Bloom of Bloom Hergott on Wednesday, according to an attorney from Bloom's firm. An individual familiar with the matter tells TheWrap the settlement was for an amount just over eight figures. Depp sued Bloom in Oct. 2017 and the company costing the actor ""tens of millions of dollars"" through improperly collecting upwards of $30 million in legal fees during the course of their...",0.2122445115746583,0.288694105437588,0.25046930850612315,0.2632109074832781
N37586,autos,autosclassics,The 50 most expensive cars ever sold at auction Breaking records and bank accounts,0.2122445115746583,0.2555534132962921,0.2338989624354752,0.24111711272241415
N23784,music,music-gallery,"35 musicians you should see live at least once in your life If you have a chance to see these musicians live, you absolutely need to take the chance and grab a ticket.",0.2122445115746583,0.2785423434724249,0.2453934275235416,0.25644306617316937
N65204,movies,movies-celebrity,See Vin Diesel's 21st birthday post to Paul Walker's daughter Meadow The Fast & Furious franchise star has remained close to close to Paul's daughter following his death six years ago this month.,0.2122445115746583,0.3070611572567915,0.2596528344157249,0.27545560869608043
N44984,sports,football_nfl,"Who the Houston Roughnecks took in the XFL Draft Twenty-two of the 42 players added to the Houston Roughnecks roster through the inaugural XFL Draft this week have been on active NFL rosters in their careers. Twelve of those players played multiple seasons in the NFL. Among the most well-known players selected by the Roughnecks include quarterback Connor Cook, who started a playoff game for the Raiders, who lost that game to the Texans in January 2017. Receiver Sammie Coates also was taken by...",0.2122445115746583,0.2807971916700748,0.24652085162236653,0.25794629830493593
N59923,entertainment,celebrity,Third time's (not always) the charm: From silver screen icons to a world heavyweight boxer - celebs who've been married more than three times It's no secret that many celebrities have long and colorful relationship histories. Here are the celebrities who have walked down the aisle more than three times,0.2122445115746583,0.2714829291729909,0.2418637203738246,0.2517367899735467
N34167,health,fitness,"I Took the 30-Day Squat Challenge and Here's What Happened I completed more than 3,000 squats, which is at least 2,900 more than I would have normally done.",0.2122445115746583,0.2971590833153978,0.2547017974450281,0.26885422606848464
N20680,sports,football_nfl,Saints DBs mocked Bears RB Tarik Cohen for being short during heated argument Things go personal in Chicago.,0.2122445115746583,0.2900147729264229,0.2511296422505406,0.2640913524758347
N40785,news,newscrime,"Mother Is Freed After 15 Years in Prison for Father's Abuse A domestic violence survivor in Oklahoma walked free from prison on Friday, according to a corrections spokeswoman, after spending 15 years behind bars for failing to report that her boyfriend was also abusing their children.",0.2122445115746583,0.2668834802542364,0.23956399591444735,0.24867049069437702
N4830,movies,movies-celebrity,"Cuba Gooding Jr. pleads not guilty to sex misconduct claims NEW YORK (AP)   Cuba Gooding Jr. has pleaded not guilty to an indictment alleging two instances of sexual misconduct. Gooding appeared Tuesday before a judge in New York City and was released on his own recognizance. The new charge involves an alleged incident in October 2018. The defense paints it as a shakedown attempt. The 51-year-old ""Jerry Maguire"" star was previously accused of groping a woman's breast at a bar on June 9. The woman told...",0.2122445115746583,0.2680228264175545,0.2401336689961064,0.24943005480325575
N44416,sports,more_sports,Rockets vs Nets game thread The Houston Rockets will look for their fourth straight win tonight against the Brooklyn Nets.,0.2122445115746583,0.29447772964784,0.25336112061124916,0.26706665695677945
N25062,sports,basketball_nba,"James Harden scores 36 points, Rockets rout Warriors 129-112 HOUSTON (AP)   James Harden had 36 points and 13 assists and the Houston Rockets routed Golden State 129-112 on Wednesday night, sending the short-handed Warriors to their sixth loss in eight games this season. Harden again appeared to be moving past his early shooting woes, going 6 of 16 from 3-point range. Since going 17 of 79 on 3s in his first six games, Harden has made 13 of 32 the last two. Russell Westbrook had 18 points, eight rebounds...",0.2122445115746583,0.3174104992608352,0.26482750541774674,0.2823551700321096
N60785,music,music-celebrity,"DMX heading back to rehab, cancels concerts DMX has long struggled with substance abuse.",0.2122445115746583,0.2944607089927212,0.2533526102836897,0.2670553098533669
N48621,finance,personalfinance,"The 25 richest families in America Stacker compiled a list of the 25 richest American families using 2019 data from Forbes. From winemakers to oil tycoons, find out which American families have a combined net worth of more than $721.5 billion.",0.2122445115746583,0.2775579112634391,0.2449012114190487,0.2557867780338455
N59139,entertainment,entertainment-books,"Prince's The Beautiful Ones is a breathtaking, occasionally frustrating look at the icon Prince The Beautiful Ones book: EW review",0.2122445115746583,0.2889269321600455,0.2505857218673519,0.26336612529824976
N3280,sports,mmaufc,Foul play suspected in case of UFC fighter's missing stepdaughter ,0.2122445115746583,0.2271063085169057,0.219675410045782,0.22215237620282324
N11885,sports,football_nfl,"Something fishy happened in that Texans-Chiefs call There was no pool report, no video from Al Riveron. And there likely will be no public admission regarding the conversation(s) that resulted in a key defensive pass interference foul being wiped out in the Texans-Chiefs game. But something fishy happened, as evidenced by the images broadcast by CBS. It occurred with the Chiefs leading [more]",0.2122445115746583,0.2381643265619591,0.22520441906830868,0.2295243882328588
N50372,entertainment,celebrity,Celebrity mug shots Check out the best celebrity mug shots of all time!,0.2122445115746583,0.261622769159414,0.23693364036703615,0.24516334996449546
N36353,weather,weathertopstories,"Halloween storm to dump 1st snow of season in parts of Midwest After a brief clip of wintry weather races through the central Plains and western Great Lakes to start the week, a much larger and more impactful winterlike storm will close out October.",0.2122445115746583,0.2626890738058549,0.23746679269025658,0.24587421972878937
N36387,news,newscrime,Pasadena substitute teacher accused of sexually assaulting student for two years A Pasadena ISD substitute teacher is accused of having an improper relationship with a student at Sam Rayburn High School.,0.2122445115746583,0.2736320764066341,0.2429382939906462,0.2531695547959755
N47687,sports,basketball_nba,Video emerges of Rockets fan punching Pelicans assistant coach A television station obtained video showing a fan at Toyota Center punching New Orleans Pelicans assistant coach Joe Boylan.,0.2122445115746583,0.2703429851107392,0.24129374834269873,0.2509768272653789
N37681,sports,basketball_nba,Chris Paul receives standing ovation in return to Houston against Rockets ,0.2122445115746583,0.2973753885042649,0.2548099500394616,0.2689984295277294
N60985,sports,football_nfl,"Ex-NFL player Winslow Jr takes plea deal before rape retrial VISTA, Calif. (AP)   Former NFL player Kellen Winslow Jr. pleaded guilty Monday to raping an unconscious teen in 2003 and to sexual battery involving a 54-year-old hitchhiker in a deal that spared him the possibility of life in prison. Winslow initially hesitated and seemed to agonize over his decision. ""I'm sorry. I'm just not thinking very clearly,"" Winslow told the judge at one point. He asked the judge for more time before he finally entered...",0.2122445115746583,0.2856503990246484,0.24894745529965334,0.2611817698746517
N40373,news,newscrime,Ex-model accuses Jeffrey Epstein's friend of rape Several women have come forward in recent weeks with allegations against a model agent that span three decades,0.2122445115746583,0.2636059856293639,0.23792524860201109,0.24648549427779537
