ID,category,sub_category,content,collaborative_rec,content_rec,mean,two_one
N64745,sports,baseball_mlb,"With latest sign-stealing revelations, Houston Astros once again toe baseball's ethical lines Accused of electronically stealing signs in 2017, the Astros organization faces even more questions about its culture.",1.0,0.2382801726514304,0.6191400863257152,0.4921867817676202
N36532,weather,weathertopstories,Winds fan ferocious fires in Australia's most populous state Ferocious wildfires were burning at emergency-level intensity across Australia's most populous state and into Sydney's suburbs on Tuesday as authorities warned most people in their paths that there was no longer time to flee.,1.0,0.2624178806379602,0.6312089403189801,0.5082785870919735
N14592,entertainment,entertainment-celebrity,"Chrissy Teigen's weekend was basically a clapback double-header, plus more news Chrissy Teigen gives us two more lessons in the art of the clapback. Plus, more celebrity news for Nov. 12, 2019.",1.0,0.276314119968536,0.638157059984268,0.5175427466456907
N47401,foodanddrink,tipsandtricks,"Your turkey timeline: what to do and when for the perfect holiday roast Most people only cook a turkey once or twice a year which inevitably turns the whole thing into a stressful experience, full of paranoia that the bird will turn out dry. But fear not! Our fail-safe turkey timeline will take you all the way from ordering through to what to do with the leftovers.",1.0,0.2852213220049471,0.6426106610024735,0.5234808813366314
N23184,entertainment,celebrity,Long-term celebrity couples who won't get married These committed celeb couples have opted not to tie the knot.,1.0,0.2797649066837895,0.6398824533418948,0.5198432711225263
N29069,foodanddrink,foodnews,Mezcal vs. Tequila What Are the Differences? We spoke with a tequila afficionado to take a deeper dive into the mezcal vs. tequila debate. Find out the key differences here.,1.0,0.284938718198137,0.6424693590990684,0.523292478798758
N58241,finance,markets,"The Dow was perfectly unchanged on Tuesday, a rare occasion on Wall Street The 30-stock average closed flat going out at least six decimal places. It was the first unchanged close for the Dow since April 24, 2014.",1.0,0.2835724405982166,0.6417862202991083,0.5223816270654777
N35131,finance,markets,"The world's largest trade deal could be signed in 2020 RCEP involves all 10 ASEAN countries and five of the bloc's major trading partners: Australia, China, Japan, New Zealand and South Korea.",1.0,0.2965786327536923,0.6482893163768462,0.5310524218357948
N47099,foodanddrink,tipsandtricks,"This Korean Ingredient Makes Your Chili Taste Amazing As in, more amazing than it already is.",1.0,0.2913205416741926,0.6456602708370963,0.527547027782795
N40065,sports,more_sports,"The Day in Sports: Sunday, November 10, 2019 The Day in Sports: Sunday, November 10, 2019",1.0,0.2866298515748199,0.64331492578741,0.5244199010498799
N12995,news,newsus,"Cows swept out to sea by Hurricane Dorian are found months later   on the Outer Banks CHARLOTTE, N.C. - Cape Lookout National Seashore on the Outer Banks has discovered three cows are roaming the national park, and it is believed they got there by swimming four to five miles across the Core Sound during Hurricane Dorian. All three were living on Cedar Island when the hurricane generated a ""mini tsunami"" on Sept. 6, sweeping much of the wildlife off the island, including 28 wild ...",1.0,0.2226711031182946,0.6113355515591473,0.48178073541219635
N49030,movies,movies-celebrity,"Kevin Hart Steps Out for Date Night With Wife Amid Recovery From Car Accident Kevin Hart is in better spirits following the violent car crash that left him hospitalized in September. Last night, he was spotted out with his wife for date night in Los Angeles.",1.0,0.27759499582182,0.63879749791091,0.5183966638812133
N29196,health,health-news,"Florida boy's mock CPR drill goes viral: 'How cute is this!' The saying ""the apple doesn't fall far from the tree"" rings very true for a 3-year-old Florida boy who apparently wants to be just like his father, a first responder.",1.0,0.2451151549402805,0.6225575774701403,0.4967434366268536
N42977,news,newsus,"'It's not over': Sarah Palin says she is fighting to repair her marriage Former Alaska Gov. Sarah Palin said she learned her husband, Todd, wanted a divorce in an email from his lawyer and that the two are seeking counseling.",1.0,0.2960364151183877,0.6480182075591938,0.5306909434122584
N37320,news,newspolitics,"Pro-Trump conservatives are getting trolled in real life by a far-right group Groypers, as they call themselves, fuse online political extremism with stunts at conservative events.",1.0,0.2735133105690287,0.6367566552845143,0.5156755403793525
N51808,news,newspolitics,"Democrats' impeachment lawyer cut his teeth prosecuting mobsters, Wall Street cheats Daniel Goldman will lead witness questioning during the hearings that begin Wednesday.",1.0,0.2690749151307773,0.6345374575653886,0.5127166100871848
N22417,travel,travelarticle,Divers salvage 100-year-old liquor from WWI shipwreck A team of ocean explorers says it has retrieved cognac and liqueur from a ship that was bound for Russia when it was sunk by a German submarine in 1917.,1.0,0.1773080870651484,0.5886540435325742,0.4515387247100989
N26706,news,newsus,Missing California hiker found dead at top of glacier just weeks before baby was due A missing hiker from Huntington Beach California was found dead on Thursday at the top of the Darwin glacier in the Inyo National Forest.,1.0,0.2545263127833568,0.6272631563916784,0.5030175418555711
N48064,news,newsworld,"Why Ukraine and Russia are still at war A long and draining war in eastern Ukraine has become embroiled in President Trump's attempts to undermine his opponents at home. But the war is real and still taking lives, and a way to end it will be very difficult to find.",1.0,0.257265727859196,0.6286328639295979,0.5048438185727973
N26944,news,newsus,"Jeffrey Epstein's Estate May Set Up a Program to Pay Accusers Lawyers for Jeffrey Epstein's estate are considering setting up a program to resolve claims filed by women who say they were abused by the financier, who killed himself in August while facing federal sex trafficking charges. The plan was disclosed in a court filing on Tuesday by a lawyer for one of Mr. Epstein's accusers, who is suing the estate in federal court in Manhattan. The filing said lawyers for Mr. Epstein's estate had informed...",1.0,0.2685253820824033,0.6342626910412017,0.5123502547216021
N47248,finance,markets,"Fed's Powell sees steady growth, signals pause in rate cuts Federal Reserve Chairman Jerome Powell expects the U.S. economy to continue growing at a solid pace, though it still faces risks from slower growth overseas and trade tensions.",1.0,0.2925481230410647,0.6462740615205324,0.5283654153607098
N13907,finance,finance-saving-investing,4 reasons you shouldn't max out your 401(k) Making high-dollar contributions to your 401(k) can cost you.,1.0,0.3028283213753575,0.6514141606876788,0.535218880916905
N31679,entertainment,celebrity,Biggest celeb weddings of the last decade Take a look back at the most memorable and extravagant celeb weddings that went down in the 2010s.,1.0,0.2755185307782549,0.6377592653891274,0.5170123538521699
N56193,sports,football_nfl,Cowboys have questionable red zone calls in loss to Vikings ,1.0,0.261583445328577,0.6307917226642885,0.507722296885718
N61320,lifestyle,lifestyleroyals,Kate Middleton Wore a Simple Black Dress and Embellished Headband to the Festival of Remembrance The Duchess of Cambridge and the rest of the royal family are honoring those who have died in battle this weekend.,1.0,0.2498738545467371,0.6249369272733686,0.49991590303115807
N36436,news,newsphotos,"The 12 Texas cities everyone in the country is moving to Texas' largest cities were at the top of the list, as well as Midland, a major hub of the fracking boom.",1.0,0.2801910684388576,0.6400955342194288,0.5201273789592384
N51587,travel,traveltripideas,"The 24 Most Beautiful Castles in Europe Eat your heart out, Disney.",1.0,0.2536069514383686,0.6268034757191843,0.5024046342922457
N64560,sports,basketball_nba,"Report: Knicks' brass will stay on if team shows 'progress' this season The New York Knicks' front office appears to be safe for now. Owner James Dolan met with president of basketball operations Steve Mills and others in management on Monday. The Knicks' brass left with the impression that their jobs would be secure as long as the team ""showed progress"" this season, league sources told SNY's Ian Begley. However, it's unclear what Dolan deems as ""progress,"" reports Begley. Mills and general manager Scott Perry are...",1.0,0.3014549265868685,0.6507274632934342,0.5343032843912456
N33677,tv,tv-celebrity,Marie Osmond 'chipped off a piece' of her kneecap when she fell on stage during performance Marie Osmond reveals that she chipped her knee when she fell during her Las Vegas residency performance last week.,1.0,0.2676135330124172,0.6338067665062086,0.5117423553416114
N57327,lifestyle,lifestylebuzz,Please Don't Yell at Your Dog! A new study shows it can cause long-term psychological impacts.,1.0,0.2906717995097592,0.6453358997548796,0.5271145330065061
N41578,lifestyle,lifestyleroyals,Meghan Markle Chose a Chic Black Ensemble for Remembrance Sunday Services She paired her outfit with a bold hat and a crimson poppy pin.,1.0,0.2766413074752755,0.6383206537376378,0.5177608716501836
N49712,news,newsgoodnews,"Wisconsin bus driver saves children wandering in snow, as deadly Arctic air mass grips US As bitter cold took hold across the Midwest earlier this week, a sharp-eyed bus driver in Wisconsin was credited with helping rescue two children who were very underdressed for the weather conditions.",1.0,0.248136244059956,0.624068122029978,0.49875749603997066
N58020,foodanddrink,beverages,Brooklyn Brewery Shows Craft Beer Can Be Nonalcoholic Too Special Effects hits all the notes of a craft brew with none of the alcohol,1.0,0.2584942900928731,0.6292471450464365,0.5056628600619154
N4913,finance,finance-companies,Don't be fooled: Costco says $75 coupon is a scam Wholesale retailer Costco is warning customers about a new scam that is promising shoppers a $75 coupon.,1.0,0.2605974256989917,0.6302987128494959,0.5070649504659944
N43670,sports,basketball_nba,"Draymond criticizes official for ejection: 'Don't tell me not to talk' Golden State Warriors forward Draymond Green made Chase Center history during Monday's loss to the Utah Jazz, becoming the first player ejected from a game in the new venue after arguing with an official. The three-time All-Star was given a second technical foul for continuing to plead his case after disagreeing with a blocking call, but it seems Green's spat with the official went beyond just that foul. ""I disagreed with that call,"" Green told...",1.0,0.2831273681067474,0.6415636840533737,0.5220849120711649
N58553,lifestyle,lifestyleroyals,"Prince Harry and Meghan Markle Will Reportedly Visit Oprah While in California During their six-week break from their royal duties, Prince Harry and Meghan Markle are planning to visit Oprah Winfrey, according to a royal insider.",1.0,0.26362841422089,0.631814207110445,0.5090856094805933
N9652,finance,finance-real-estate,"NYC is selling 'air rights' to city housing buildings, first big deal goes to de Blasio donors It may not be a bridge, but the city has something to sell you in Brooklyn   and donors to Mayor de Blasio are first in line to benefit. In what appears to be a textbook ""pay-to-play"" move, the city is selling NYCHA development rights to builders who gave de Blasio's campaigns more than $20,000.",1.0,0.3031793157340282,0.6515896578670141,0.5354528771560187
N38309,tv,tv-celebrity,Joe Giudice Says It Was 'Painful' Watching Real Housewives of New Jersey from Prison Joe Giudice Says It Was 'Painful' Watching RHONJ from Prison,1.0,0.2976087725428815,0.6488043862714408,0.5317391816952544
N241,finance,finance-companies,"Are Stores Open on Veterans Day? Target, Aldi, Walmart and More Will shoppers be able to make the most of Veterans Day deals this public holiday?",1.0,0.2453540315071933,0.6226770157535967,0.4969026876714622
N15855,lifestyle,lifestyleroyals,"A body-language expert says Meghan Markle is ""politely disconnecting"" from the public, and honestly, we would too Can we blame her? Meghan Markle is supposedly ""politely disconnecting"" from the public as seen in her body language, and girl, you do you.",1.0,0.2809359054655078,0.6404679527327539,0.5206239369770052
N7821,sports,football_nfl,"'Monday Night Football' commentator under fire after belittling criticism of 49ers kicker for missed field goal Joe Tessitore called out 49ers kicker Chase McLaughlin after he shanked a potential game-winning kick in San Francisco, and some fans weren't happy.",1.0,0.2815660018921108,0.6407830009460553,0.5210440012614072
N46477,movies,movienews,Mark Ruffalo Wants to Set Up Jennifer Aniston on a Date Mark Ruffalo Wants to Set Up Jennifer Aniston on a Date,1.0,0.2970193719106225,0.6485096859553112,0.531346247940415
N19376,sports,basketball_nba,The HoopsHype Daily: Trae Young putting up monstrous numbers ,1.0,0.299910071334493,0.6499550356672466,0.5332733808896619
N13341,news,newsus,"Rising temperatures put U.S. troops at risk during training, report finds By midcentury, troops could face an extra month of heat-index temperatures above 100 F every year, the Union of Concerned Scientists found.",1.0,0.2784500443684353,0.6392250221842176,0.5189666962456235
N29839,lifestyle,lifestylehomeandgarden,"Simple Solutions to Help You Get Rid of Ants for Good Kick pesky ants out of your house and back to their colony with these easy, expert-approved tricks.",1.0,0.2671754296551252,0.6335877148275626,0.5114502864367501
N60932,tv,tv-celebrity,Lamar Odom's Son Was ''Hurt'' After Finding Out About His Dad's Engagement on Instagram Lamar Odom's son admits that he was ''hurt and caught off guard'' after finding out about his dad's engagement to Sabrina Parr on Instagram.,1.0,0.2830881363996567,0.6415440681998283,0.522058757599771
N44818,sports,football_nfl,Redskins name rookie Dwayne Haskins starter for rest of season ,1.0,0.2999191809146984,0.6499595904573492,0.5332794539431323
N51896,health,fitness,"Watch the 'Footloose' Dance Warmup That Gets These High Schoolers Ready to Race They tear up the course before, well, tearing up the course.",1.0,0.262884400179348,0.631442200089674,0.5085896001195653
N36252,finance,markets,Oil rises after OPEC's Barkindo says U.S. shale growth may slow in 2020 Oil rises after OPEC's Barkindo says U.S. shale growth may slow in 2020,1.0,0.2618965208906226,0.6309482604453113,0.5079310139270817
N52600,finance,finance-companies,"Saudi Aramco takes another step toward 1st public offering DUBAI, United Arab Emirates (AP)   Saudi Arabia's state-owned oil giant Aramco revealed it will sell up to 0.5% of its shares to individual investors, but in a lengthy document published late Saturday it did not disclose how much of the company will be floated when it goes public on the country's domestic exchange.",1.0,0.2547895489253812,0.6273947744626907,0.5031930326169207
N54161,news,newsus,"Berliners tried to send Trump a piece of the Berlin Wall with a message saying 'no wall lasts forever' The 2.7-ton chunk of concrete arrived in Washington, DC, on Saturday, and local media outlets reported that the Secret Service turned it away.",1.0,0.2668747726506629,0.6334373863253314,0.5112498484337753
N30135,news,newsgoodnews,"Tennessee judge holds lawyer's baby as he swears her into the state bar in viral video Tennessee Court of Appeals Judge Richard Dinkins is going viral after a video showed him swearing in a new lawyer last week while holding her baby.In footage making the rounds online, Dinkins could be seen lightly bouncing the baby on his hip while he administered the oath to Juliana Lamar, the mother of the 1-year-old child who recently graduated from Belmont University College of Law, according to BuzzFeed News.Y'all. Judge Dinkins of the...",1.0,0.2731382949768964,0.6365691474884482,0.5154255299845976
N63550,lifestyle,lifestyleroyals,Why Kate & Meghan Were on Different Balconies for Remembrance Sunday There's no scandal here. It's all about the order of precedence.,1.0,0.2644981448810543,0.6322490724405272,0.5096654299207029
N60408,weather,weathertopstories,"Over 20 inches of snow for some Michigan communities in 24 hours! Significant amounts of snow fell within a meandering lake-effect snow band overnight into Tuesday morning across parts of the southwestern Lower Peninsula of Michigan, resulting in up to and over 2 feet in some locations... and that's where AccuWeather's Blake Naftel took in some of the snowy spectacles as people begun to dig out.",1.0,0.2707875700261355,0.6353937850130678,0.5138583800174237
N25138,sports,football_ncaa,"College Football Playoff picture: 4 in, 2 out, 5 to watch Sporting News takes a look at the College Football Playoff picture heading into Week 12 of the season.",1.0,0.2665544054709463,0.6332772027354732,0.5110362703139641
N15506,news,newsworld,"Trump 'so extreme' on climate he's waking people up, Greta Thunberg tells AFP Swedish teen activist Greta Thunberg said Tuesday that US President Donald Trump's climate change denialism was ""so extreme"" that it had helped galvanize the movement to halt long term planetary warming. The venue was originally in Chile but was shifted because of political unrest, forcing Greta to change her travel plans.",1.0,0.2848162097378564,0.6424081048689282,0.5232108064919042
N54482,lifestyle,lifestylebuzz,"Mixed-race mother reveals strangers question whether she's related to her fair-skinned daughter - including a suspicious church-goer who asked the girl: 'Is this your Mummy?' Davina Moon, 32, from Surrey, who has a mixed heritage including Sri Lanka and Ireland, told how society often treats her differently because she doesn't look like her children.",1.0,0.2538519954438762,0.6269259977219381,0.5025679969625841
N30071,news,newspolitics,"Trump juggles statecraft and impeachment on a historic day Projecting unusual calm in the middle of a political firestorm, President Donald Trump pleaded ignorance Wednesday about the first public impeachment hearing, unexpectedly insisting that he really wasn't paying attention to sworn testimony in the House Intelligence Committee that could determine whether he serves out his term in office. The disclaimer might be more credible if ...",1.0,0.2723230788471719,0.636161539423586,0.5148820525647813
N61145,foodanddrink,tipsandtricks,Stop! Read This Guide Before You Buy an Air Fryer. Shopping for air fryers? Or maybe air fryer toaster ovens? Our air fryer buying guide will help you find the perfect appliance for your needs.,1.0,0.295101781468968,0.647550890734484,0.5300678543126454
N37204,health,health-news,"Model, 23, Didn't Know She Was Pregnant Until She Gave Birth to a Full-Term Baby in Her Bathroom An Australian model recently had a life-changing surprise when she gave birth to a baby in her bathroom, despite not knowing that she had been carrying her daughter for nine months.",1.0,0.2423286612126267,0.6211643306063134,0.4948857741417511
N46751,news,newscrime,"Mom named person of interest in 5-year-old girl's disappearance The search for Taylor Rose Williams, 5, began in Jacksonville on Wednesday.",1.0,0.2442486212286891,0.6221243106143446,0.4961657474857927
N496,music,cma-awards,"Fashion hits and misses from the 2019 Country Music Association Awards From Nicole Kidman to Pink, see the best and worst dressed stars at the 2019 Country Music Association Awards.",1.0,0.2788285014549603,0.6394142507274801,0.5192190009699735
N64685,music,music-celebrity,"Jennifer Lopez shares her #MeToo experience at costume fitting: 'I stood up for myself' Jennifer Lopez recalled an uncomfortable situation earlier in her career when a ""director at a fitting asked me to take my top off.""",1.0,0.2900159696394399,0.6450079848197199,0.5266773130929598
N7041,health,health-news,Dad bans lollipops after 5-year-old son nearly choked to death The boy was sitting near his mother when he began making choking noises.,1.0,0.256975095284023,0.6284875476420115,0.504650063522682
N53585,tv,tvnews,"Rip Taylor's Cause of Death Revealed, Memorial Service Scheduled for Later This Month The comedian died at the age of 84 last month.",1.0,0.2503579608055346,0.6251789804027673,0.500238640537023
N24898,autos,autosbuying,"The lightest sports cars you can buy for under $30,000 Power-to-weight ratios matter, and what these sports cars lack in horsepower they more than make up for in their abilities to attack the roads with venom.",1.0,0.3143961289414242,0.657198064470712,0.5429307526276161
N47851,travel,traveltripideas,The Top Winter Wonderlands You Should Visit This Holiday Find the best alpine views at these wintry destinations.,1.0,0.2750169854273772,0.6375084927136886,0.5166779902849181
N39389,lifestyle,lifestylebuzz,"Dog Rips The Tail Off Every Single One Of His Toy Pigs Tim Eberts When Diesel's parents first brought him home a cute little stuffed pig toy, they had no idea just how much the husky was going to love it.",1.0,0.2601737882240473,0.6300868941120237,0.5067825254826982
N57097,news,newsus,Last known Pearl Harbor survivor in Mass. dies at 98 Massachusetts' last known survivor of the Japanese attack on Pearl Harbor that drew the United States into World War II died Tuesday at 98.,1.0,0.244269036441063,0.6221345182205315,0.4961793576273753
N39844,sports,basketball_ncaa,"James Wiseman eligibility: Explaining the NCAA questions on Penny Hardaway, Memphis star Everything you need to know about James Wiseman's eligibility case at Memphis and what it means for him, the Tigers' basketball team and the NCAA going forward.",1.0,0.3012082642809053,0.6506041321404527,0.5341388428539369
N15307,sports,basketball_nba,"10 most stunning early trends around the NBA Youngsters Luka Doncic and Pascal Siakam are taking their games to new heights, while a former No. 1 overall pick is doing his best to shed the ""bust"" label.",1.0,0.281427392705682,0.640713696352841,0.5209515951371213
N36703,lifestyle,lifestylecelebstyle,Photos of Celebrities at the Airport Are Here to Inspire Your Holiday Travel Style Even the rich and famous aren't spared the most annoying place in the world: the airport.,1.0,0.2722647710222545,0.6361323855111273,0.514843180681503
N25722,news,newspolitics,"Rex Tillerson denies he tried to undermine Trump, says Nikki Haley was 'rarely present' at meetings The former secretary of state refuted Haley's claims contained in a new book and says he remains proud of his tumultuous time in the Trump administration.",1.0,0.285816189679151,0.6429080948395756,0.5238774597861007
N48578,news,newsgoodnews,"Deer stranded 5 miles offshore saved by Maine lobstermen A group of Maine lobstermen spotted a deer in an unusual place Monday: open waters. The men quickly took action to save the animal, which had somehow ventured 5 miles away from shore, and hauled their catch of the day to safety.",1.0,0.2381790865496595,0.6190895432748298,0.4921193910331063
N17896,autos,autossuvs,"Should Chevy Bring This Three-Row Blazer to the U.S.? It's set to go on sale in China soon, but we could see this bigger Blazer doing well in America, too.",1.0,0.2808472393359885,0.6404236196679942,0.5205648262239924
N47205,news,newspolitics,"Whistleblower never met or talked with Schiff - source The whistleblower who prompted an impeachment inquiry into U.S. President Donald Trump never met or spoke with congressman Adam Schiff, the Democrat leading impeachment hearings in Congress, a source familiar with the whistleblower's contacts said.",1.0,0.2762621652227617,0.6381310826113809,0.5175081101485077
N57591,lifestyle,lifestyleroyals,Prince Charles Is Getting Into the Fashion Business The Prince's Foundation is partnering with the Yoox Net-a-Porter Group on a sustainable 17-piece collection.,1.0,0.2668532298330021,0.6334266149165011,0.5112354865553347
N64258,news,newspolitics,"Trump impeachment hearing spurs shadow spin war The online spin began even before Wednesday's impeachment hearing got underway. Moments before House Intelligence Committee Chairman Adam Schiff could welcome witnesses to the first public hearing of the impeachment inquiry, President Donald Trump took to Twitter to dismiss the ""New Hoax. Same Swamp."" Former Obama administration aides-turned-podcasters dissected the hearings in real time. They broadcast their running...",1.0,0.261478454813679,0.6307392274068395,0.5076523032091194
N56061,sports,football_nfl,9 things we learned from Sunday's games of Week 10 of NFL season ,1.0,0.2526953004064634,0.6263476502032317,0.5017968669376422
N36807,weather,weathertopstories,"Timelapse Shows Snow Dusting Central New Hampshire A ""wintery mix"" of snow, ice, and rain moved across much of New Hampshire on Tuesday, November 12, local meteorologists said. Rain and freezing rain early Tuesday gave way to a period of light snow as colder air rushed in, WMUR said. This timelapse   filmed from 1 pm on Monday to 12 pm on Tuesday   shows snow falling and repeatedly dusting a parking lot in Plymouth, New Hampshire. Gunnar Consol, who filmed the video, said about an inch or two accumulated in Plymouth by Tuesday. Credit: @GunnarConsolWx via Storyful",1.0,0.2832658670761581,0.641632933538079,0.5221772447174386
N58133,news,newspolitics,"George Kent, top State Department Ukraine expert, helps Democrats debunk GOP theories Kent testified that there is no evidence Ukraine interfered in the 2016 election and said Joe Biden's pressure on Ukrainian officials was not the same as President Trump's.",1.0,0.2663175881981057,0.6331587940990528,0.5108783921320704
